speakerGroups,Speaker,Title,text,pageNumbers
283,Mr SALMON,COMMERCIAL AGENCIES AND,"Is it desirable to power to appoint a board of unlimited number, seeing that immediately afterproposal wards in the clause it is stated that any tvyo members of the board may exercise Nous. the powers of the board ? The Minister has given no reason why the number of three should be exceeded. I see no necessity for a large number of men to be apWilliam pointed, unless possibly it may be the desire on the part of those in authority to have their hands strengthened.",41
284,Sir WILLIAM LYNE,COMMERCIAL AGENCIES AND,"I think it better to provide that there shall not be less than three members of the board, so as to 'filter*. make it impossible to delegate only one person. I do not know that there is any objection to place a maximum limit, but I think everything will be done in reason by ) those who appoint the board.",41
285,Mr SALMON,COMMERCIAL AGENCIES AND,Does the Mmister intend him to strike out the provision that any two submembers may exercise all the powers of the board ?,41
286,Mr HUME COOK,COMMERCIAL AGENCIES AND,"Are three members Sh WILLIAM LYNE - I do not think subthree members are enough, because in important cases it might be necessary to have (4), be five or seven members. In connection with the this clause, I intend afterwards to consent to may the insertion of the words, "" and one of whom shall be the representative of the division from to which such officer belongs, and elected by the officers of that division under the regulations,"" I do not know that there is the very much in the matter at all, and cases. did not think there would be any objection raised, or I should not have occupied time with this discussion. This will be a matter for the discretion of the chief a officer, and the amendment would make it quite certain that the employees would have a representative among a number on the Board and that it would not consist of one individual.",41
287,Mr SALMON,COMMERCIAL AGENCIES AND," That is the very reason I object tff the number of three being exceeded. It was my intention to move later on that employees should be represented when a charge was made 62, against one of their number, but it would be futile to appoint one of the employees of particular division if liis influence is to be the completely swamped by adding a number of others to act with him. It would be better to leave out the provision for an employees' representative, and let it be a purely degive partmental board. I shall vote against, and carry to a division if necessary, the to exceed the number of three.",41
288,Mr HUME COOK,COMMERCIAL AGENCIES AND," I hope all the Minister will not press this amendment to a division. If he does, and the amendment he carried, the representation of the employees on the board will be less than a third. The intention I had in giving notice of the amendment which the Minister has just intimated he is going to accept, providing for a representative of the division on the board, would be defeated, and the whole effect nullified and lost. We desire that the representation of the employees on the board should be one-third of the total representation.",41
289,Sir WILLIAM LYNE,COMMERCIAL AGENCIES AND,"I am not very particular about the amendment. In submitting it I was only acting in the interests of - the employees, and if there be any serious objection I shall not insist on it . I beg leave to withdraw the amendment. Amendment, by leave, withdrawn.",42
290,Mr HUME COOK,COMMERCIAL AGENCIES AND," I move That after the word ""board,"" line 64, the "" and one of whom shall be the representative of the division to which such officer belongs, and elected by the officers of the division under the regulations "" be inserted.",42
291,Mr HIGGINS,COMMERCIAL AGENCIES AND,"Thoug h I adhere to principle of the amendment, I ask whether the division will not extend over the whole Commonwealth ?",42
292,Mr DEAKIN,COMMERCIAL AGENCIES AND," I. t will extend over the wliole monwealth, but it does not follow that division will have only one representative in the Commonwealth. The clause means that there will be one representative in each district or State.",42
293,An HONOURABLE MEMBER,COMMERCIAL AGENCIES AND,"Le t him.be called a ""local"" representative.",42
294,Mr DEAKIN,COMMERCIAL AGENCIES AND,"I do not tliink there any necessity to amend the proposal, which is that one of the members of the board for the agent? must be representative of the division. There may be any number of representahas tives ; but only one of them will be present when the board sits, and that can be without putting in the word ""local."" Amendment agreed to. Clause, as amended, agreed to.",42
295,Mr HUME COOK,COMMERCIAL AGENCIES AND,Do that the Minister proposes to deal with the question of general appeals under a new tion to it . clause 1,42
296,Sir WILLTAM LYNE,COMMERCIAL AGENCIES AND,"Yes . I will disI cuss the matter with the honourable member before I do so. It is a difficult matter, I want to deal with it .in a comprehensive way. Clause 41 agreed to. Clause 42(1) All officers upon the hearing by a board of inquiry of any charge against them shall be entitled to be represented by counsel, attorney, or agent, who may examine witnesses and address the board of inquiry in their behalf. (2) A board, of inquiry shall, when inquiring as to the truth of any charges inquireas to the truth of the same without regard to legal forms and solemnities, and shall direct itself by the best evidence it can procure or that is laid before it, whether the same be such evidence as the law would require or - admit in other cases or not, and it shall be lawful for the board of inquiry to receive or reject as it may deem fit any evidence that is tendered. Amendment (by Sir WILLIAM LYNE) agreed toThat the words ""And it shall be lawful for the board of inquiry to receive or reject as it may deem fit any evidence which is tendered"" lines 13, 14, and 15, be omitted.",42
297,Mr BATCHELOR,COMMERCIAL AGENCIES AND,"South Australia) words I am not at all sure I like the provision that officers before the board of inquiry shall be entitled to be represented by counsel, attorney, or agent. This is introducing a the new feature, so far as I am concerned.",42
298,Mr DEAKIN,COMMERCIAL AGENCIES AND,It is not new h i Victoria.,42
299,Sir WILLIAM LYNE,COMMERCIAL AGENCIES AND,No r in New South Wales and Queensland.,42
300,Mr BATCHELOR,COMMERCIAL AGENCIES AND,I should like to Comhear honourable members' experience as to the how the provision works. It seems to me that the man who is well enough off to employ the best lawyer has the advantage.,42
301,Mr MCCAY,COMMERCIAL AGENCIES AND,A man may be represented by an agent.,42
302,Mr BATCHELOR,COMMERCIAL AGENCIES AND,"Suppos e the honourable, learned, and gallant member for Coriis nella appeared on one side and some agent on the other, what chance would there be",42
303,Sir WIELIAMLYNE,COMMERCIAL AGENCIES AND,"A similar provision been working in three States, and. I would ask the honourable member for South secured Australia to let this clause pass.",42
304,Mr BATCHELOR,COMMERCIAL AGENCIES AND,If honourable members who have had experience can assure me this provision works well in practice I will I understand go no furtlier. Sir WILLIAM LYNE;-There is no objec,42
305,Mr RONALD,COMMERCIAL AGENCIES AND,"Southern Melbourne) can assure honourable members that this provision does not work well. It causes and serious expense to men employed, on the railways who are charged with trifling offences and who have to employ an agent. Mv. DEAKIN - It is optional.",42
306,Mr BONALD,COMMERCIAL AGENCIES AND,"Exactly j but when a man knows he is going to be opposed by an agent on the other side, it is not optional. Cases are never decided on their moral merits, but on the mere fact that one side is not represented or not well represented. I hope the provision will be struck out.",43
307,Mr MAUGER,COMMERCIAL AGENCIES AND," I take a different view from that of the honourable member for Southern Melbourne, and I take that view after some experience. I know two or three public servants whom the very charge against them has so unstrung that they were utterly unfitted to appear, and I am quite sure that those cases would have had a different termination if they had not been allowed to employ representatives. I have i u my mind the case of a young man who was completely exonerated on the charge made, against him, but who, had he been dependent on his own resources, would have got into trouble. This is a very wise provision, decidedly of advantage to officers against whom charges may be made.  rate the remarks of the honourable member for Melbourne Ports. In Queensland tliere was a case somewhat similar to tliose cited by the honourable member. Had the man not been allowed to get legal advice and have an agent to attend for him, I am sure he would have lost his case; but he was completely exonerated when the case was put in a proper light. Eor that reason, I think the honourable meinber for South Australia, Mr. Batchelor, ought to withdraw any opposition he may have to the clause. In everyday hfe, if a man had to defend himself from charges made against him, he would find himself in "" Queer-street"" very often; whereas even with only an agent to defend him, he may come off with flying colours.",43
308,Mr SALMON,COMMERCIAL AGENCIES AND," I hope the honourable member for South Australia, Mr Batchelor, will withdraw his opposition. I can assure him from personal experience that many a man against whom charges were made has had to go down but for the advice and assistance received from those who were able to put the cases as they should be put. I speak now on behalf of the members of the legal profession, not one of whom has addressed himself to this clause. It is the first clause that has escaped their attention. It is entirely owing to their, unselfish conduct that they have been prevented from telling honourable members of many instances in which, to their own personal knowledge, great harm would have resulted to men through improper action on the part of their superiors had it not been for the assistance rendered by the lawyers.",43
309,Mr TUDOR,COMMERCIAL AGENCIES AND," In the light of the.evidence that has just been given us I tliink that the clause should go further. I hope that the honourable member for South Australia, Mr Batchelor, will withdraw his opposition, and that we shall provide not only that officers shall have the right to be represented by counsel, but that the State shall provide the counsel to represene them. If there is a danger that an innocent man may go under unless he has the benefit of being represented by counsel, I think that the question of money ought not - to stand in the way. If it is right to have counsel, then the State should pay for it . We should have a State defender.",43
310,Mr WILKINSON,COMMERCIAL AGENCIES AND," I have had some little experience in regard to this matter. In fact, I have appeared as an agent myself. Not only is it good for pubhc servants to have counsel appeal for 1 them, but the fact that counsel is so appearing acts as a controlling influence upon the board of inquiiy. Within the last three months I was asked to appear, on behalf of one public servant, in the State of Queensland, and I know that the very fact that I had been nominated had the effect of causing a very much closer investigation to be held than would otherwise have been the case. I would like to see the right given to any accused pubhc servants to see the evidence of all those who are supporting the charge against him.",43
311,Sir WILLIAM LYNE,COMMERCIAL AGENCIES AND,"The honourable member will recollect that there is one of the public servants on the Appeal Board, who will see all the evidence.",43
312,Mr MAUGER,COMMERCIAL AGENCIES AND,Does the Minister not think that the evidence should be supphed 1,43
313,Sir WILLIAM LYNE,COMMERCIAL AGENCIES AND,I do not think so.,43
314,Mr WILKINSON,COMMERCIAL AGENCIES AND,"It is a very difficult matter in many cases to get at the evidence that has been supplied. The plea generally put forward is that it forms part of official documents. But where a man's position is jeopardized, I think he has a right to know everything that has been mentioned against him. The clause, as far as it goes, is an admirable one, and I hope the honourable member for South Australia, Mr Batchelor, will withdraw his opposition to it .",43
315,Mr MCC AY,COMMERCIAL AGENCIES AND," I heartily endorse what has been said by the honourable member for Moreton with regard to the right of an accused puhlic servant to know what evidence is being brought against liim. In all our criminal courts there is either a preliminary inquiiy, at which the accused learns the character of the evidence, or else he is told what witnesses are to be called, and what they are to attempt to prove. TJie object of all systems of procedure in civil cases is to let the parties come to an issue, and have a general idea of each other's case. To put a public servant in the position of being told that he is charged with liaving committed a certain offence, and of liaving to come before the board knowing nothing of the circumstances-whe n the words of the charge may be wide enough to cover a score of sets of circu instances-is to treat him in a veiy unfair manner. He should be entitled to know not only what the technical words of the charge' are, but something more. ' Eor example, let us suppose that an officer is charged under clause 40 with being habitually negligent in the discharge of his duties. How can he know what he has to meet under those words ? They may cover the whole term of his service, or they may refer to some act that he has committed, or to something which he bas neglected to do. In all fairness an officer is entitled to know the circu instances which constitute the general accusation brought against him, and therefore he ought to have some reasonable knowledge of the facte that are alleged against him in order that he may be prepared to meet them. A man may be charged with doing a certain thing, and may be able to call evidence to show that he did not do it , but he might not be able to call that evidence unless he knew beforehand what the charge was. I ask the Minister to think over this matter. On further consideration I am sure he will find that my suggestion is only consonant with the principles of fahplay which we find throughout the whole of our law.",44
316,Mr ELIAS SOLOMON,COMMERCIAL AGENCIES AND," I hope that the honourable member for South Australia will withdraw his opposition to the clause, because it seems to me to be only just that an officer against whom a charge is made should have the right to be represented by counsel. There might be technicalities in an Act which the officer, as a layman, would not understand, and which would need the services of a lawyer or some educated man to unravel. I also think that there may be a certain amount of timidity on the part of an officer if he is called upon to appear personally before a board to give evidence in such an inquiiy.",44
317,Mr BATCHELOR,COMMERCIAL AGENCIES AND,"South Australia) After the overwhelming evidence offered by the non-legal members of the House, regarding this practice' of allowing accused persons to be represented by counsel, I must certainly bow to their desire, and withdraw all opposition to the proposal.",44
318,Mr CROUCH,COMMERCIAL AGENCIES AND, I purposely waited t ill this matter had been discussed in order that I might suggest to the Minister the desirability of allowing any officer who is charged with an offence to have the inquiry conducted privately. I do not know whether the Minister will consent to that.,44
319,Sir WILLIAM LYNE,COMMERCIAL AGENCIES AND,If we are going to load the Bill up witli all sorts of twopennyhalfpenny matters it will break down.,44
320,Mr CROUCH,COMMERCIAL AGENCIES AND,"I do not think that it will break down. I believe in pubhcity, but there are occasions when a man would be condemned by a report appearing in the press. He should have the' right to demand that the inquiiy shall be conducted in private, in which case the result only need be given to the world.",44
321,Sir WILLIAM LYNE,COMMERCIAL AGENCIES AND,"I think that might be done under regulations. But I would point out to the honourable and learned member that it is sometimes absolutely essential'that an inquiry should be conducted in public for the sake of the department. To give the right to an accused public servant to demand that the inquiiy shall be held privately is not quite the proper thing. I admit that there' might be regulations, framed to allow of such an mquiry being held in private if the commissioner or Minister agreed to that course being adopted. But it would not be wise to give an absolute right to the accused to say that the inquiry should not be open to the press.",44
322,Mr ISAACS,COMMERCIAL AGENCIES AND," I tliink that the Minister for Home'Affairs has taken the correct stand. We must not forget that these' are public affairs, and that the public have a right to know what is being done in regard to their own business. There may be cases which, from other considerations, ought to be conducted in private. It may be well that - power should be given to have inquiries conducted in private by the consent of all parties interested, but to lay down the rule that an officer may demand an inquiry in private would be to overlook the fact that we are dealing with public concerns.",44
323,Mr SOLMON,COMMERCIAL AGENCIES AND," I understand that the desire of the honourable and learned member for Corio is to protect an officer in the public service against whom an offence is alleged, from suffering from revelations that might be made outside of that service. The officer might be exonerated within the service, but the very fact of a charge having been levelled against hun might militate against his standing outside. In cases of that sort there is no diffiprivate. culty at all with the press. The press have always shown themselves prepared to act with discretion on such occasions.",45
324,Mr RONALD,COMMERCIAL AGENCIES AND,Oh !,45
325,Mr SALMON,COMMERCIAL AGENCIES AND,That is my experience at any rate.,45
326,Mr RONALD,COMMERCIAL AGENCIES AND,-It is not the experience of any one else.,45
327,Mr SALMON,COMMERCIAL AGENCIES AND,"There are plenty of members of this House who know that that is their experience. Where a man has been improperly charged with an offence and found innocent it is veiy easy indeed to take measures to prevent the publication of the proceedings if he so desires. On the other hand there is a large number of cases, which as the honourable and learned member for In di has pointed out, should be inquired into in public. The matters involved are of a public - character, and it is - right that the public should have an opportunity of judging. The fact of the public being given that opportunity would also act in such a way as to protect the officer charged. It would do away with the star-chamber business. In the past there has been too much of private' reports in the public service. When I entered the Education department in Melbourne, I found that there was the principle of secret reports by inspectors, which reports the employees were never allowed to see except - when a charge was made against them, and then only by applying to the Public Service Board. This system was carried out under regulations, and has since been abolished. Some of the officers after its abolition unearthed reports about themselves of years' standingreports of which they knew nothing. There is always a great danger to the public service in having private reports given, and I think that the honourable member will be well advised if he withdraws his amendment.",45
328,Mr TUDOR,COMMERCIAL AGENCIES AND," I beheve in the whole of the public service administration being conducted in the open. There should be no secret reports, and I believe that all inquiries should be open to the press. If an honourable member argues that these inquiries should be open to the press and the public, surely it is not consistent to afterwards' say that any officer has a right to a report which can in any way be regarded as confidential. If tun officer has a right to say that certain proceedings shall be regarded as privateand confidential, then the accused person has a right to say that the inquiiy should be In laying down the principle that these inquiries shall be open to the press and public, we also adopt the principle that the reports in reference to the charge should be accessible to the accused, so that he may be able to see what is alleged against him. The honourable member for Laanecoorie has referred to secret reports. There was a case recently in which a man was tried. ' Fortutunately he got off, but tliere is no knowing whether, if a private and confidential report had gone in against him, he would not have been judged upon it . I am in favour of these inquiries being conducted openly. ' Mr KIRWAN (Kalgoorlie) - I would hke the Minister in charge of the Bill to consider the desirableness of making some provision whereby an officer wrongfully charged should be allowed any expenses that he might incur. It is possible to conceive of a case in which an officer might be put to considerable expense in defending himself, and I think that it would bo a grave injustice if he were not to be allowed his traveUing and other expenses.",45
329,Mr OMALLEY,COMMERCIAL AGENCIES AND," It has often occurred that a man has been brought before a board of inquiry, and although he has not been completely condemned he has been virtually condemned in the service for some time to come, and it therefore seems to me that the Government ought to provide officers with counsel to assist them in defending themselves. If the}' will not do that they ought to agree if the officer is acquitted to pay the expenses connected with his defence.",45
330,Mr HIGGINS,COMMERCIAL AGENCIES AND,If the officer is convicted' I suppose he should pay.,45
331,Mr OMALLEY,COMMERCIAL AGENCIES AND,If the officer is convicted he will have to clear.,45
332,Mr HIGGINS,COMMERCIAL AGENCIES AND,Then he would nothing.,46
333,Sir AVILLIAM LYNE,COMMERCIAL AGENCIES AND,"Does not the hon the orable member think that matter might be left to the recommendation of the commisnity, sioner and then to the Minister ? I have had hundreds of cases in New South Wales, wish to do so. and I have never refused to pay the expenses where a person has been improperly - charged.",46
334,Mr OMALLEY,COMMERCIAL AGENCIES AND,"If I were sure that the Minister for Home Affairs would be the deciding authority I would not hesitate for one moment, but whilst I have faith in men I have none in others. AVe have experience of what may be done in some cases with a man when he is in a helpless position, and we know that some people think that the right time to kick a man when he is down. We ought to do someI thing to help civil servants when they in trouble, because tliey have not much money as a rule. If the honourable member for Kalgoorlie will move on the lines I have indicated, I will support him.",46
335,Mr MAHON,COMMERCIAL AGENCIES AND," In view of the fact that a civil servant in some remote part of' the Commonwealth might be importance summoned before a board in Melbourne or Sydney, then undoubtedly, if he be found guiltless of a malicious charge lodged against him by a superior officer, he ought should receive some compensation for his expenses.' I hope the Minister will take a favourable view of this matter, because is quite possible for the head of the departaccused ment or a chief officer occasionally to have a prejudice against a man, and even to go far as to lay a charge against him. W it regard to the proposal that these inquiries should be held with .open doors, I am not inclined to * support that view, because cases we know very well that the sensacence tional newspapers will have their reabroad; porters at such boards of inquiry; and if an officer should be charged with disgraceful or improper conduct the evienemies, dence will go forth day by day to the public, and give malicious and - vindictive people an opportunity to come forward. In cases of this kind evidence could be with an open inquiry. manufactured against civil servants which should not be admitted at such inquiries. If a man is to be tried, he should be tried upon what the head of the department is able to prove, and there should be no fishing inquiriesor any encouragement offered pay to private enemies, who may be only too glad to take a man's character away. In interests of the public servants themselves, and in the interests of the commuwe should give the board the power to hold these investigations in private, if they",46
