speakerGroups,Speaker,Title,text,pageNumbers
95,Mr MCCOLL,COMMERCIAL AGENCIES AND," I presume the words in sub-clause (a) "" on the request of the permanent head thereof "" apply not only to that sub-clause, but also to sub-clauses (b), (c), (d), and (e). As the clause is printedi t would appear that the words applied only to the first sub-clause. If they were made to apply to the wliole of the sub-clauses it would be much better, and it would look better if there were inserted after the word "" commissioner.""",25
96,Sir WILLIAM MCMILLAN,COMMERCIAL AGENCIES AND,"I - think we might keep to the phraseology we adopted before, and make the words apply to the whole of the sub-clauses.",25
97,Mr THOMSON,COMMERCIAL AGENCIES AND, I do not know that it would be advisable to accept this addition in the form proposed.,25
98,Sir WILLIAM LYNE,COMMERCIAL AGENCIES AND,"I was not going to accept it , but the amendment was suggested and I did not object.",25
99,Mr THOMSON,COMMERCIAL AGENCIES AND,It seems to me that under the amendment the report of the permanent head would have to come before the commissioner could take action.,25
100,Sir WILLIAM MCMILLAN,COMMERCIAL AGENCIES AND,No . It means that the commissioner will act after receiving a report from the permanent head.,25
101,Sir WILLIAM LYNE,COMMERCIAL AGENCIES AND,The report need not necessarily be in favour. The commissioner can act even if the report be opposed to the action.,25
102,Mr THOMSON,COMMERCIAL AGENCIES AND,"I quite see that the report may not be in favour, but the commissioner has to receive a report before he can act",25
103,Sir WILLIAM MCMILLAN,COMMERCIAL AGENCIES AND,"That is so in the sense that the comniisioner acts after he obtains the report. He obtains the report to make sure he is right. Mr THOMSONThe h I should say ""after obtaining a report.""",25
104,Sir WILLIAM LYNE,COMMERCIAL AGENCIES AND,Very well ; I will or clerical division accept those words.,25
105,Mr THOMSON,COMMERCIAL AGENCIES AND,"The abolition of an office in a department is a matter in which the commissioner has to keep a watch on the permanent head, who may not be willing to abolish an office which the commisabolish any office in any department. sioner says is not necessary.",25
106,Mr MCCOLL,COMMERCIAL AGENCIES AND,The commissioner has a right to get the permanent head's views on the question.,26
107,Mr THOMSON,COMMERCIAL AGENCIES AND,"Yes , so long as we do not commit the commissioner to the necessity of first getting a report before he moves.",26
108,Sir WILLIAM MCMILLAN,COMMERCIAL AGENCIES AND,The permaunder nent head is not given the initiative.,26
109,Mr WILKS,COMMERCIAL AGENCIES AND," The clause is an important one, dealing, as it does, with grading and classification, and it is only right the commissioner should have the fullest control possible. I am afraid the introduction of the permanent head this provision will be more dangerous in clause 21.",26
110,Sir WILLIAM LYNE,COMMERCIAL AGENCIES AND,"The permanent head has simply to report, and no matter what he says the commissioner can act.",26
111,Mr WILKS,COMMERCIAL AGENCIES AND,"If that be so, I am satisfied. But while there are transfers from the clerical to the professional division, and vice versa, there is no power to transfer from the general division to the clerical. the general division there may be numbers not know why. of men, faithful and proved servants, who have no opportunity of competing amongst themselves for advance to the clerical division. A telegraph messenger may prove himself a faithfu l servant as a member of the general division, but before he can be advanced or transferred, he would, under the clause, have to go into open comthe petition with the general public, probably boys and girls who had just left school, and could more easily pass an examination. The clerical and professional divisions have the right of competing amongst *or transfer, and I ask that a telegraph messenger, who has shown efficiency during long years of service, should have the equal privilege of advancing himself by competithat tion with his fellows.",26
112,Mr ISAACS,COMMERCIAL AGENCIES AND," I would suggest to the Minister that he should do what has been done in the B u i previously, when I think the Attorney-General was in charge, namely, to strike out in line 1, the words, ""from time to time"" as unnecessary.",26
113,Sir WILLIAM LYNE,COMMERCIAL AGENCIES AND,I propose to strike doing so. those words out-the amendment is to strike them out.,26
114,Mr ISAACS,COMMERCIAL AGENCIES AND,I would like an explanation in regard to some other parts of the clause. In sub-clause (b) power is given What is to become of the oflicer 1,26
115,Sir WILLIAM LYNE,COMMERCIAL AGENCIES AND,That depends on circumstances. He may be transferred in the same department or to another department if there is a place for him.,26
116,Mr ISAACS,COMMERCIAL AGENCIES AND,"If the officer is not required in any department, he is to come the operation of a previous clause, and go out altogether.",26
117,Sir WILLIAM LYNE,COMMERCIAL AGENCIES AND,Yes .,26
118,Mr ISAACS,COMMERCIAL AGENCIES AND,In sub-clause (d) why is the privilege given only to the professional division to be transferred or promoted to that the clerical division 1 Is there any into reason why similar power should not than be given to transfer and promote an officer from the clerical to the professional division 1 I should like to hear if there is any reason why preference is given to one division. In the Victorian Public Service Acts that distinction is not made.,26
119,Mr CROUCH,COMMERCIAL AGENCIES AND,It looks as if it had been drafted to meet some special case.,26
120,Mr ISAACS,COMMERCIAL AGENCIES AND,"It may have been In drafted to meet some special case, but I do",26
121,Sir AVILLIAM LYNE,COMMERCIAL AGENCIES AND,The officer will have to go through an examination.,26
122,Mr ISAACS,COMMERCIAL AGENCIES AND,"If that be so, there is all the more reason to give the power to transfer or promote a clerical oflicer to the professional division. If he is efficient, and his competency must be tested in the way Minister suggests, then thei'e can be no objection to giving, in regard to promotion from the clerical to professional division, similar power to that given in the converse case. That measure of justice is provided in themselves the A ictorian Acts. 7  was just about to refer to that question, and what makes me more inclined to think the suggestion of the honourable and learned member for Indi should be carried out is that all these advances or promotions are to be on examination. The whole structure of the Bill is to encourage people to aspire to get to the top, and if any one in the cleric.il division can qualify for the professional division, there ought not to be anything in the Bill to debar him from",26
123,Sir AVILLIAM LYNE,COMMERCIAL AGENCIES AND,I wish to make an amendment in the first line of the clause.,26
124,The CHAIRMAN,COMMERCIAL AGENCIES AND,"It will be necessaiy for the honourable member for Wentworth to to withdraw his amendment temporarily. Amendment, by leave, withdrawn. Amendment (by Sir WILLIAM agreed toThat in line 1 the words "" from time to time"" be omitted. Amendment (by Sir WILLIAM MCMILLAN ) agreed toTliat in line 1, after the word ""may,"" the following words be inserted:- "" On the recommendation of the commissioner, after obtaining a report from the permanent head."" Amendment (by Mr MCCOLL ) agreed toThat in lines 3 and 4 the words ""on the request of the permanent head thereof "" be omitted.",26
125,Mr HIGGINS,COMMERCIAL AGENCIES AND,"Northern Melbourne) The honourable"" member for South Australia,  theory which he wishes to work out-tlia t a man in the general division may be transferred to the clerical division with examination.",27
126,Sir WILLIAM LYNE,COMMERCIAL AGENCIES AND,"To the professional division division, too.",27
127,Mr HIGGINS,COMMERCIAL AGENCIES AND,"I tliink I can give some explanation' of the matter, which he I dealt with last night in a different aspect. In the Victorian ' Public Service Act, section 52, power is given to the Governor i u Council on the recombe mendation of the Public Service Board to transfer a man from the general the clerical division on examination. A man who is in the general division has not to pass so stiff an examination as a man would in the clerical division, and he has by no means the qualifications of a man in the professional or special division. I last night suggested an amendment, to which the tion. . . . Attorney-General, said he would give effect at the proper place. The suggested amenda ment was on clause 28, and preserves the rights of Victorian men in the general division to be transferred to the clerical division on pissing an examination.",27
128,Mr WILKS,COMMERCIAL AGENCIES AND,By competition amongst themselves 1,27
129,Mr HIGGINS,COMMERCIAL AGENCIES AND,That was left open. A all events the men were to have their sent rights preserved under the Bill.,27
130,Mr THOMSON,COMMERCIAL AGENCIES AND,Onl y the Victorian men 1,27
131,Mr HIGGINS,COMMERCIAL AGENCIES AND,"I am not aware that the other States have a similar provision. should be only too happy to provide for the same privileges being obtained for the other States if there are those privileges now; and I hope it will be understood not making any distinction between Victorian men and others. I happen to know that in LYNE) the Victorian Act there is power to transfer to the clerical division, and I do not see why that power should be taken away under the Commonwealth.",27
132,Mr THOMSON,COMMERCIAL AGENCIES AND,Eve n if that privilege is not in the other States it should be extended to them.,27
133,Mr HIGGINS,COMMERCIAL AGENCIES AND,"I think it ought to be, seeing that it is only ou examination. It would be only fair to extend it to all the States, and I shallgive the honourable member any assistance in my power to enable the transfers to be made, so far as I can see at present, unless the Minister shows the contrary. May I point out that clause 35 does not deal with transfers on .examination, but deals with transfers without examination absolutely.",27
134,Mr WILKS,COMMERCIAL AGENCIES AND,It is a privilege.,27
135,Mr HIGGINS,COMMERCIAL AGENCIES AND,It .is a privilege in the sense that a man who is in the professional is ex lvypotliesi f it for the clerical division.,27
136,An HONOURABLE MEMBER,COMMERCIAL AGENCIES AND,Especiall y if has been in the clerical division before.,27
137,Mr HIGGINS,COMMERCIAL AGENCIES AND,Exactly ; especially if he has been in the clerical division before. Then sub-clause (e) provides that an officer may transferred or promoted from the professional division or the clerical division to division to the special division. ,27
138,Mr HIGGINS,COMMERCIAL AGENCIES AND,"Clause 37 reads No officer shall be promoted from a class in the professional division or clerical division to a higher class or be transferred from one department to another unless he has passed such examinaThat clause really deals with classes within division. All I want to point out is that we are now dealing with cases of transfer without examination, and we ought not to confuse the two things. We shall provide, in the clause which the Attorney-General is going to bring in, for all cases of transfer with examination. The Attorney-General has t undertaken that he will in due place have prea clause providing for transfer from the general division on examination.",27
139,Mr DEAKIN,COMMERCIAL AGENCIES AND,-That was done last night.,27
140,Mr HIGGINS,COMMERCIAL AGENCIES AND,"Then that is all right. I would suggest that in clause 35 we do not. deal with anything except the question of movements in the public service without examination, by the Governor in Council I am after the recommendation of the commissioner and perhaps on the report of the permanent head. I think the two things are distinct, and this would he a bad place to bring in the amendment which the honor ton, has suggested.",27
141,Mr ISAACS,COMMERCIAL AGENCIES AND," The view that I have previously expressed I . desire to put before the committee in a concrete form by moving an amendment. I hardly know the best way in which ito do this, but I wish to give the Governor General power to transfer or promote an officer from the clerical, division to fil l a vacancy in the professional division if such officer is competent and consents to such promotion. There are many gentlemen in the clerical division who are really professional men, but simply because they are in the clerical division the Governor General has no power to put them into a position which they are competent to fill. It is within the discretion of the permanent head, the commissioner, and the Governoi-'General to say whether any officer shall be promoted. But we know that there are members of the clerical division who have qualified themselves by examination to be professional men, and I see no reason why, when a vacancy occurs in the professional division, they should not be eligible to fill it , Under this clause there is no power in such a. case to transfer them from the clerical to the professional division, although there is power under the Bill to transfer an officer from the general division to the clerical division. I therefore move That the following words be added, after the word ""or"" in sub-clause (rf):-""transfe r or promote au officer from the clerical division to fill a vacancy in the professional division if such officer is competent, and consents to such transfer or promotion, or,""",28
142,Sir WILLIAM LYNE,COMMERCIAL AGENCIES AND,I wil l accept amendment.,28
143,Mr BATCHELOR,COMMERCIAL AGENCIES AND,South Does not this clause refer to promotions apart from examinations altogether 1,28
144,Mr MAUGER,COMMERCIAL AGENCIES AND,It only refers to alterations of the staff.,28
145,Mr BATCHELOR,COMMERCIAL AGENCIES AND,The honourable and learned member for Indi suggests that there should be promotions from the clerical division to the professional division.,28
146,Mr ISAACS,COMMERCIAL AGENCIES AND,Everythin g else is provided for.,28
147,Mr BATCHELOR,COMMERCIAL AGENCIES AND,"It seems to me unnecessary so far as this clause is concerned, that the officer shall have passed the examination. I have been looking at the clause from the point of view that it is not laid down that a man shall have to pass another examination. I agree with the honourable and learned member for Indi, that we ought to give the same opportunities to the clerical division as are given to the professional division. We oughtalso to give the same advantages to the members of the general division. We must not make any distinction between the various divisions of the service. We want to throw the whole service open to any man in the ranks. We must not give privileges to the professional and clerical divisions which we do not give to the general division. If it is right that power should be given to promote an officer from either the clerical or the professional division, it is equally just that a similar power should be given to promote an officer from the general division. There should be no barrier to the advancement of an)' oflicer altogether irrespective of the particular division to which he belongs. I beheve that it will be necessary to insert another sub-clause giving the Governor General power to transfer or promote an oflicer from the general division to the clerical or professional division. As soon as the amendment before the committee-is disposed of I shall move in that direction.",28
148,Mr DEAKIN,COMMERCIAL AGENCIES AND,That is unnecessary. A man must get from the general to the clerical division first. We have given him the power to do that.,28
149,Mr CROUCH,COMMERCIAL AGENCIES AND," I tliink that the amendment of the honourable and learned member for Inch is unnecessary, because clause 27 saj's that before an appointment can be made to the special or professional division from outside the serthe vice certain requirements have to be complied with. It appears to me that the honourable Australia) - ancl learned member for Indi is attempting to bring in a clause by which an oflicer may be brought from the clerical to the professional division. I think the amendment is surplusage. It is already inferred that a person must be taken from the clerical to the professional division unless strong reasons are given why the transfer is not made. If clause 27 does not imply that, there is really no reason by which an appointment can be made to the special division. The only definite power given to appoint any person at all is provided for in clause 27. There are no words giving any authority for an appointment to a professional division. It must be inferred that it is a general authority which is left to the Governor General in Council. I think that we ought to strengthen the clause somewhere, but I do not tliink it is necessary to do so in the way that the honourable and learned member for Ind i indicates.",28
150,Mr WILKS,COMMERCIAL AGENCIES AND, I understood the honourable and learned member for Northern Melbourne to say just now that the At torney-General had drafted a clause providing that an oflicer from the general division could advance by means of a competitive exaniination to the clerical division.,29
151,Mr DEAKIN,COMMERCIAL AGENCIES AND,"Yes , we carried that last night.",29
152,Mr WILKS,COMMERCIAL AGENCIES AND,Then I have nothing further to say.,29
153,Mr EWING,COMMERCIAL AGENCIES AND," I presume that what the committee is endeavouring to do under this clause is to provide for certain cases that might possibly eventuate. These sub-clauses do not overcome the difficulties that will beset the commissioner in the administration of the Act. Actual experiences will probably prove that we are not prophets. I think it would be well to eliminate sub-clauses (c), (d), and (e), and to substitute a general provision giving the Governor General power to transfer, promote, ancl grade any officer after such examination as may be deemed necessary. That would cover the whole clause. It is impossible for this committee to foresee everything that will happen. It would be wise, therefore, if, instead of attempting to particularize difficulties that may arise, we inserted some general provision such as I have suggested. I am sure that that is the right thing for the service, and the wisest course to pursue in regard to the administration. It is preferable to give general powers. I hope that the committee will accept that view of the situation, if they conclude that tliere is not too much clanger in so doing.",29
154,Mr THOMSON,COMMERCIAL AGENCIES AND,Will the Minister Home Affairs accept the amendment 1,29
155,Sir AVILLIAM LYNE,COMMERCIAL AGENCIES AND,Yes .,29
156,Mr THOMSON,COMMERCIAL AGENCIES AND, I am inclined to agree with the honourable member for Richmond that in the subclause it might be better to sayTransfer or promote an oflicer from one division to another division on such conditions and after such examinations as may bc prescribed.,29
157,Mr DEAKIN,COMMERCIAL AGENCIES AND,That is the effect of it as it stands.,29
158,Mr THOMSON,COMMERCIAL AGENCIES AND,"No, there is no provision made for the special division. If an officer of the professional division happened to prefer an aj)pointment in the special division, and the commissioner desired that he should fill such office, the amendment of the honourable ancl learned member for Inch would not cover that case. Would it not meet all the conditions and include the clerical division if sub-section (d) were amended in the way I have suggested ?",29
159,Mr ISAACS,COMMERCIAL AGENCIES AND," I know very well the difficulties of a Minister sitting at the table in the making of amendments. I suggest, therefore, that the amendments be taken separately, and afterwards the Minister will be able to see how far he can weld them together. Otherwise he may do more or less than he desires, and more or less than the committee desire. What I suggest seems to me to be the best way to bring the whole clause into a symmetrical form. Amendment agreed to.",29
160,Mr BATCHELOR,COMMERCIAL AGENCIES AND,"South Australia) I cannot quite see that what we agreed to last night covers exactly the same position as the cases that are referred to in this clause, and for that reason I would move That the followiug words be inserted as an additional sub-clause :- "" (/)Transferorpromotean officer from the general division to the clerical division."" ",29
161,Mr DEAKIN,COMMERCIAL AGENCIES AND," If that is clone it will render the work done last night unnecessary ; in fact, it will substitute for it the widest opening for action by the Commissioner or the Governor General given in the Bill. Although the clause has been correctly described by the honourable and learned member for Northern Melbourne as referring to transfers, ancl what may in one sense be promotions without examination, yet as I read this clause with the rest of the Bill I take it that the transfers and so-called promotions cannot for imply the advance which according to the rest of the Bill presupposes that an examination has been passed. In this clause certain powers are provided that might be called administrative, intended to be exercised within the framework which we have already established. Eirst of all, there is the creation of a new offiee; that will not interfere with the framework of the Bill. Then again, an office may be abolished, and that will not interfere with the framework of the Bill. Then it may be necessaiy to raise or lower the classification or grading of any office, and that will not interfere with the framework of the Bill. Then we come to the last two sub-clauses upon which we have had this discussion, relating to the transfer or promotion of officers from one division to another, and I would point out that tiiis power has to be included somewhere or other in the Bill, otherwise we shall have what might be taken to be water-tight compartments in the service. We have divided the service into the general, clerical, professional, and administrative divisions. We have the power to regrade the clerical division; there is no power of interchange between it and others. This now proposed to be given is not to be exercised in conflict with the rest of the Bill, but subject to the provisions as to exaniination, which have to be complied with before we can take a man from one division and place him in another.",29
162,Mr HIGGINS,COMMERCIAL AGENCIES AND,"Accordin g to this clause, a man may pass - from the professional division into the clerical division without examination.",30
163,Mr DEAKIN,COMMERCIAL AGENCIES AND,"Yes ; but the provision is that an oflicer who has pre viously been in the clerical division, and who had clerical qualifications, may be passed from the professional division back into the clerical division. He - must have had professional qualifications before he passed into the professional division ; and if he wants .to get back into the division from which he was first transferred, he must have had the necessary qualification for that division before he could originally enter it . I think the honourable and learned member for Northern Melbourne was quite correct in his description of tine clause, but the honourable member for South Australia, Mr Batchelor, has drawn a mistaken inference from a correct statement of its provisions. thinks that this clause gives power of promotion without examination, but in the cases refened to in the clause the examination must have been already passed, and as a matter of fact the oflicer must have qualified himself for both divisions before being enabled to pass from one division to the other.",30
164,Mr HIOGINS,COMMERCIAL AGENCIES AND,Unde r sub-clause (<?) there is no examination provided for.,30
165,Mr DEAKIN,COMMERCIAL AGENCIES AND,"No ; and that is the one exemption we have-- made. That division, which is the great administrative division, is one to which men may be drawn from all the other divisions of the service if they possess the necessary qualifications. These are the chief officer's who rise to the summits of tlieir various divisions in the service, and who are naturally chosen from them to act as heads of departments. Some of the heads of departments come from the clerical division, and some come from the professional division, and some may have come from the general division, but they require first of all to have passed either the clerical or the professional examinations.",30
166,Mr BATOHELOB,COMMERCIAL AGENCIES AND,Not necessarily.,30
167,Mr DEAKIN,COMMERCIAL AGENCIES AND,Yes ; we could not take power a man from the general division into either the clerical or professional divisions without an examination.,30
168,Mr BATCBELOB,COMMERCIAL AGENCIES AND,"Would you not take a man like an electrical engineer from the general division, and put him into the professional division without examination, in order to take up the position of Superintendent of Telegraphs, for instance ?",30
169,Mr DEAKIN,COMMERCIAL AGENCIES AND,- I cannot imagine an electrical engineer being classified in the general division if his attainments were of such a character as to enable him to take up a position of that sort; he would have reached the dignity of the professional division.,30
170,Mr BATCHELOH,COMMERCIAL AGENCIES AND,But how is he going to get from the general division 1,30
