speakerGroups,Speaker,Title,text,pageNumbers
0,NA,Unknown,"House of Respresentatives. Thursday, 87 June, 1901. Mr SPEAKER took the chair at 2.30 p.m., and read prayers. PETITION. *  the Baptist Union of Tasmania against the use of the post-office for the facilitation of gambling. UNOPPOSED MOTIONS.",14
1,Mr MCCAY,Unknown,"- I desire to give notice of the following motion :That there be laid before this House a detailed return giving all available information relating to the votes recorded at the recent elections for the Commonwealth Parliament in the State of Tasmania, including the position at each count of the candidates for the Senate and the House of Representatives respectively. I wish to ask the Prime Minister to allow this notice of motion to go on to the unopposed list. I desire to get such particulars as are available, so as to have an example before the House when we come to discuss the Bill?",14
2,Mr MCCOLL,Unknown,Would it not be as well if we had a return of Blue-books showing the voting over all the States ? While the return is being compiled that ma)' as well be done.,15
3,Mr BARTON,Unknown,That is being obtained. THE TARIFF.,15
4,Mr OMALLEY,Unknown,"Referring to the remarks of the honourable member for Wentworth. about the Tariff being brought in by the 1st August, is the Prime Minister aware that immense consignments are coming to the merchants of Sydney which will get. in a little before the 1st August, and can he say how that will affect the merchants in the rest of Australia ?",15
5,Mr BARTON,Unknown,"If what the honourable member has suggested points to the undesirability, at the present. time, of naming - the 1st August or any other date for the introduction of the Budget, I am quite in agreement with the spirit in which he has asked the question. PERSONAL EXPLANATION .",15
6,Sir WILLIAM MCMILLAN,Unknown," As regards the Bill to which I referred yesterday, it is probable, sir, as I found out afterwards, that it was delivered. I make this explanation so as to prevent any officer from being blamed. QUARANTINE. Sir LANGDON BONYTHON asked the Minister of Trade and Customs, ttjjonnoiiceWhether, in view of the urgency of the matter the Government propose to take steps towards federal action in regard to quarantine arrangements V",15
7,Mr KINGSTON,Unknown,"Yes , as soon as the necessaiy federal legislation can be passed. It is not, however, considered that this can be dealt with during the present session. NA  v/poti notice-1. Whether - the Government has considered the question of establishing Commonwealth commercial agencies and depots in London and other centres for the proper storing and distribution of Australian exports, such as dairy and agricultural produce, meat, &c? 2. If not, in view of the great importance of the export trade to the Commonwealth, will the matter be considered without delay ? - Mr BARTON - This matter will receive early consideration, and is to some extent involved in a motion on the paper for a future day. PUBLIC SERVICE BILL . In Committee (consideration resumed from' 26th June, vide page 1669), Clause 31 agreed to. Clause 32. (Arrangemeufc for perfor mance of duties by officer.)",15
8,Mr THOMSON,COMMERCIAL AGENCIES AND," This provision refers to a case where an officer of the Commonwealth performs some duties for the Government of a State, and provides that the Governor General may make arrangements as to the remuneration to be paid; but what about the other case where an officer of a State preforms duties for the Government of the Commonwealth 1",15
9,Sir AVILLIAM LYNE,COMMERCIAL AGENCIES AND," I intend to propose a new clause to deal with that afterwarcls. Clause agreed to. Clause 33 agreed to. Clause 34(1) Whenever in the opinion of the Minister the prompt despatch of the business of a department renders temporary assistance necessary, and the commissioner is unable to provide such assistance from other departments in the State in which such assistance is.required, the permanent headorthechief officer shall, select from the persons whose names are upon the prescribedregister in the State, in which such assistance is required, such person or persons who are available as appear to be best qualified for such work. (2) Such person or persons may be employed to perform such - work for any period not exceeding six months. (3) No person who has been temporarily employed in any department for six months continuously, or for nine months continuously where extended as hereinafter provided, or for six months in the whole in any twelve months, or for nine months continuously where extended as hereinafter provided, shall during the six months m following such temporary employment be eligible for further temporary employment in the public service (4) I i it appears in the public interest to be desirable so to do the commissioner may order that any person who has been temporarily emDEPOTS. ployed in any department for six months continuously may be temporarily employed for not more than three additional, months, but in such event a statement of such extension of employment and the reasons there for shall as soon as practicable after the making of such order be laid before Parliament. (5) The services o£ uny person temporarily employed may dispensed with at any time by the Minister or by the permanent head or chief officer. (6) Kdfcwifchstandi ng the provisions hereinbefore contained, the Governor General, if. it appears in the public interest to be. desirable so to do, may in the case of temporary work in the carrying out of any public work or scheme order thafcfchetemporary employment of all or any persons employed upon such work or scheme may be continued until the completion offchesame ; and unless otherwise ordered by the commissioner or the permanent head any person may be temporarily employed by fclic chief officer in the Government Printing-office, or in the preparation offchecensus for such time as may be necessaiy. Amendment (by Sir WILLIAM LYNE ) proposed that the words "" of a department"" be inserted after the word "" Minister,"" line 1.",15
10,Mr TUDOR,COMMERCIAL AGENCIES AND," There are certain things in regard to temporary employment which are not very satisfactory to the men. I think it should be specified in the clause that temporary employees should receive at least the same minimum as is paid to permanent officers, and a half-holiday per week where it . is given as well as the gazetted holidays. In some cases the temporary employees get the gazetted holidays, r but they do not get paid for them. They are compelled to take the holidays and do not receive any pay. I think the temporary hands in the general division should receive the same consideration as the lowest paid officer therein. Amendment agreed to.  would like the Minister for Home Affairs to explain the reason for sub-clause (3). In South Australia there has been a considerable amount of friction about men who have heen on the temporary list; and after considerable trouble there certain privileges were obtained for such men after they are employed twelve months continuously. Whether it is true or otherwise it has been frequently reported that in a great number of instances care is taken that the men shall not be twelve months employed, so as to prevent them from being entitled to certain privileges which are allowed after they are employed for that period. Without having. any reason assigned for it , it seems a singular proceeding that a man who has been nine months in temporary employment-that is allowing an extreme case, where provision is made for an extension of three months-is to be put off and barred from getting temporary employment for a' considerable time afterwards. I would ask the Minister to explain the reason for this provision in the clause.",16
11,Sir WILLIAM LYNE,COMMERCIAL AGENCIES AND,"The principal, reason is that in some of the States a system has grown up under which temporary employment has amounted almost to permanent employment. In New South Wales we have had men temporarily employed for between 20 and 30 years. That is a most unsatisfactory state of things, and one object of this provision is to prevent such a state of things occurring under the Bill. Another reason for the provision is that ""one person shall not be continuously appointed temporarily. If the work is required to be done; let that man or another man be appointed permanently. ' The temporary employment is to be availed of only in the case of a rush of work which will be of a temporary character, and not to get on a number of men as temporary hands for an indefinite term. Besides that, it gives an opportunity to bring into the service persons who do not pass through the ordinary classification and examination, and who may take the place of the permanent hands who should be employed. I think the honourable member will see that we have had an experience in this matter which is not satisfactory and which should be stopped.",16
12,Mr MAUGER,COMMERCIAL AGENCIES AND," I would like to emphasize what the honourable member for Yarra has pointed out, and to get an assurance from the Minister as to what he proposes to do in regard to the appointment of temporary hands. What the honourable member for Yarra said is notorious, but it is also notorious that tliose persons - who are permanently temporary hands, if I may so put it, are paid considerably less than the officers who are working in a regular way. Surely that is not fair either to the men or to the public. I would urge that the Minister should give an assurance that the Government intend to protect tenrporary employees by seeing that when they are doing like work with permanent employees they shall be paid the same rate of remuneration - I quite agree with the honourable gentleman as to the need for the clause, and .shall support it, but I think the committee should receive an assurance as to how temporary employees are to be treated.",16
13,Mr MCCAY,COMMERCIAL AGENCIES AND," I would suggest to the Minister what might possibly be a flaw in the working of the clause. It says-The permanent head or the chief officer shall' select from the persons whose names are upon the prescribed register in the State in which such assistance is required such person or persons who are available as appear to be best qualified for such work. Would it not be wise to insert words allowr ing the making of regulations to control this selection a little more ? In Victoria we have had a great deal of trouble in regard to temporary lists, and it would be as well to select from the persons whose names are on the prescribed register in such a manner as may be prescribed, so as to prevent men from being taken from the bottom of the list to the exclusion of those who have been much longer registered, and who are much higher on the list. In Victoria we have followed the practice of taking the first suitable man on the list, in order to give everybody a turn. Having had his turn that man goes down, and he has to re-register, so that those low on the list get their turn if suitable for the work. It would do no harm to allow this matter to be settled by regulation to a certain extent, because as the clause stands there is absolutely no check to the selection by the permanent head.",16
14,Sir WILLIAM MCMILLAN,COMMERCIAL AGENCIES AND,How can we avoid that?,17
15,Mr MCCAY,COMMERCIAL AGENCIES AND,"I would suggest that the word ""select,"" in line 7, the words "" in such manner as may be prescribed"" be inserted. I see the permanent is here again, and I do not know whether any objection is raised to that by the honourable member for Wentworth, in so pursuance of his crusade in favour of commissioner. I have been recently getting the impression that that honourable member is not following his maxim so much as he following the maxim of the county fairwherever you see a permanent head, h him. In this case, however, it is difficult to make the commissioner select men for temporary work, and though I am not quite sure this is the proper place, I move That after the word ""select,"" in line 7, the words "" in such manner as may be prescribed bc inserted.",17
16,Mr BATCHELOR,COMMERCIAL AGENCIES AND,"South Australia) It seems to me there vvould be difficulty, some of the States at any rate, where men have been temporarily employed for a siderable number of years. have served six months, the)' will certainly have to ""get"" from the Commonwealth service as the result of this clause.",17
17,Sir WILLIAM MCMILLAN,COMMERCIAL AGENCIES AND,This clause refers to the Commonwealth only.,17
18,Mr BATCHELOR,COMMERCIAL AGENCIES AND,"Of course; but I am talking about men who have been previously in the service of the States, but now ' are temporarily employed in the service of the Commonwealth. If these men are not taken over as permanent hands, they will all be dismissed after they have had six months' service, and that means a serious tiling in some of the States. So far as South Australia is concerned, there will not be any trouble, because the practice is that when a man has been' twelve months temporarily employed, he is regarded as a permanent hand, and has all the rights and privileges of a permanent hand. I under-' stand that in Victoria, however, there are a considerable number of men temporarily employed, and these will necessarily have to be dismissed. I understand from an honourable member that that is the practice in New South Wales to a still greatei extent 1 than in Victoria, and I should hke to hear what the Minister's ideas are as to the wholesale sacking of tliose men.  thoroughly agree ""with the Minister that it is a laudable object to prevent temporary employment, under the conditions to which after he refers,' but I am afraid this clause does not prevent it . The clause merely provides that a certain class of men shall head be employed at the most for nine months, but that another set of men can then be taken on. There is no provision in the Bill at all, far as I understand, that where tliere are the reasonable grounds men ought to be permanently employed. There ought to be a sub-clause making it clear that when temis porary employment becomes abnormal there should be a drafting from the temporary it class into the permanent class so as to prevent the possibility of men being employed temporarily for five or ten years. Under the clause it is quite clear no man can be employed continuously for more than nine months, and then there must be a six "" months' break in his employment ; but in that six months a number' of other men can be temporarily employed, and the first set in of men become again eligible, and so on.",17
19,Mr BATCHELOR,COMMERCIAL AGENCIES AND,"For years.  After the men be very defective from the point of view of the Minister, who wishes to prevent the continuation of temporary employment. Will the Minister consider the desirableness of attaching a sub-clause, making it possible to draft from the temporary list into the permanent list, as an instruction to officers to prevent temporary emploj'ment, - whether by one or two sets of men? The effect is the same whether we have temporary men for 20 years or for one year, if we have two sets of men to work on.",17
20,Mr A MCLEAN,COMMERCIAL AGENCIES AND," There is a difficulty in doing what the honourable  suggests. Every one sees the desirability of carrying out his object as far as practicable, but there is the difficulty that there are certain kinds of work which are continuously expanding aud contracting. There may be a rush of traffic in the grain season causing a great deal of extra work, or there may be extensive railway' construction going on. Different branches of the Railway department are continuously expanding ancl contracting according to the amount of the particular kind of work i h hand, and therefore we cannot very well have a permanent staff. This is the kind of work generally kept for temporary hands, and it is intended as far as possible for those out of employment - That intention may be abused to a considerable extent, but that is the object. The honourable member for South Australia,  the work permanent for the reason that we do not know the number of hands required, three or four times as many men being necessary at one time than at another.  repairers in the Telegraph department, who are kept on for years.",18
21,Sir WILLIAM MCMILLAN,COMMERCIAL AGENCIES AND," It would be better if my facetious friend opposite, the honourable and learned member for Corinella, would point out where, in going through the Bill, we have acted in the silly fashion of hitting the permanent head on the head when it was unnecessary. I do not think any alteration has been made that is not absolutely in consonance with the. arrangements up to the present time.",18
22,Mr MCCAY,COMMERCIAL AGENCIES AND,"I was purely facetious. Sir WILLIAM"" MCMILLAN - I quite agree that in this clause it is very questionable whether we ought not to retain the permanent head as the person connected with temporary employment, seeing that further on the commissioner comes in so that there can be no damage done to the public service. But as regards the proposal of the honourable and learned member for Corinella, it would be very dangerous to introduce it here. The arguments we apphed last night in another case hold good here. It is impossible in the wide area of this Commonwealth, and with the diversity of officers and work, to pin any permanent head down to the selection of men. The man next on the list might be a person utterly unfit for the service required.",18
23,Mr MCCAY,COMMERCIAL AGENCIES AND,I do not suggest that.,18
24,Sir WILLIAM MCMILLAN,COMMERCIAL AGENCIES AND,"If I understand thehonorableand learned member aright, he wants to take the register or whatever it may be, and give the next man temporary employment.",18
25,Mr MCC AY,COMMERCIAL AGENCIES AND," I do not say that; I say the clause as it stands permits the permanent head to select a suitable man from anywhere on the list, whereas in such registers ordinarily, it is considered a reasonable thing to take suitable men in tlieir order as they appear on the list, if they are available in the locality. I do not even determine the form of the regulation, but simply say there ought to be power given to make regulations in order that suitable men may get a fair chance in turn.",18
26,Sir WILLIAM MCMILLAN,COMMERCIAL AGENCIES AND,"I think the amendment is practically surplusage, because we must take the officers who will act under this clause to be persons of common sense.",18
27,Mr FOWLER,COMMERCIAL AGENCIES AND," I must also take exception to the clause as it stands at present. It seems to me the clause will militate very seriously against the effihne ciency of the service, if the principle be admitted of dismissing temporary hands after they have been a certain time at work. If work requires to be continued it is reasonable to assume that the man who has been employed on it is the best man to be continued on it. To change him for a fresh man would, to my mind, from a business point of view, be detrimental to the interests bf the service.",18
28,Mr THOMSON,COMMERCIAL AGENCIES AND,There is provision in the next clause for that.,18
29,Mr MCCOLL,COMMERCIAL AGENCIES AND," I hope the clause will remain as it is. If any alteration is to be made, the period during which a temporary hand should remain out of employment ought to be extended. If the views of the honourable member for South  would simply bring about the old state of affairs we have had in Victoria. In Victoria a large number of men have, got into the service not through the door, but over the wall. We had at one time an enormous service, and had to take very drastic means fco reduce it. We must be very careful with regard to temporary employment, which ought to be very sparingly used, and only when absolutely required, because once a man gets into a department it is very hard to get him oufc. Men have their friends in departmental officials, who so contrive to use every loophole in the Act that these temporal*}' men become permanent before we know where we are. I would, however, ask the Minister to look at the three last lines of the clause on page 13, which I suggest are unnecessary. Those lines provide that, where a man has been employed for six months, and has that period extended another three months, the statement of such extension, and the reasons there for, shall, as soon as practicable, be laid before Parliament. Is it necessary that such a small matter should occupy the time of clerks in making out a precise statement as to why the extension is made'?",18
30,Mr BATCHELOR,COMMERCIAL AGENCIES AND,"South Australia) I quite agree with the honourable member for Echuca that a great deal of danger is likely to arise if we are not very careful in this matter of temporary employment. We do not want the converting of temporary hands into permanent hands to be made a means of persons getting into the service in any other way than by the ordinary examination. If that be allowed, more harm than good will be clone. At the same time, there is a great deal in the contention of the honourable  that temporary employment may be extended a great deal longer than the time named, on the score of economy. Ifc is much cheaper, at times, to employ temporary hands than permanent hands, the latter of whom receive certain holidays and other privileges. The practice of employing temporary hands is constantly adopted in the States, and is veiy likely to be adopted in' the Commonwealth service. Temporary employment should be confined as nearly as possible to works of a temporary character. There is a lot of work in connection withfcheCommonwealth service which will be going on year after year, and which should properly be done by permanent employees'. Under this clause there will be an opportunity to take men on for six months, and in special circumstances for an additional three months, at the end of which time they may be dismissed, and another set of men taken on in thenplace. This operation may be repeated indefinitely, thus defeating the object of the Bill, which is that the conditions under which all persons employed on permanent works for the Commonwealth should be laid down. I know that in connection with the railway service of South Australia men are taken on for twelve months all but a day or two, and then are dismissed in order that they may not get the holidays to which permanent employees are entitled. That is a dodge to escape the necessity for having proper conditions in the public service. I tliink it would be well if we could define "" temporary employment "" in some way. At present I confess that I do not like the clause. Mr THOMSON"" (North Sydney) W it h reference to the remarks of the last speaker, I would point out that these provisions tend to effect what he desires.",19
31,Sir WILLIAM LYNE,COMMERCIAL AGENCIES AND,They are more stringent than those in any of the State Acts.,19
32,Mr THOMSON,COMMERCIAL AGENCIES AND,Excep t the New South Wales Act.,19
33,Sir WILLIAM LYNE,COMMERCIAL AGENCIES AND,They are more stringent than the New South Wales Act.,19
34,Mr THOMSON,COMMERCIAL AGENCIES AND,"I am not familiar with the language of the New South Wales Act. But it seems to me that if the heads of departments can keep on temporary men as long as they choose, then they are very unlikely to make them permanent men. But if, on the other hand, they could keep temporary men for a period of only^ six months, or under special conditions for nine months, and if the work is of sucli a constant character that they really require permanent men, it will be far more to their advantage to get permanent men than to be constantly changing temporary hands. Under these conditions I think that the clause will work favourably to the views of the honourable member for South Australia, Mr Batchelor. From the experience of one of the States there is no doubt that this temporary employment, if it is not made actually temporary by some provision- ",19
35,Mr BATCHELOK,COMMERCIAL AGENCIES AND,"I "" do not object to fchafc at all.",19
36,Mr THOMSON,COMMERCIAL AGENCIES AND,"I am quite aware of that. I was about to say that if this temporary employment is not made actually temporary by some provision we shall get into the public service a lot of unnecessary men who will be kept there by influence, because the permanent head of a department has the appointment of the temporary hands and is subject to his Minister. In another State that system has resulted in a number of men being kept employed who were not really required, and the service has therefore been swelled unduly. The fact that meu cannot be kept permanently employed on what are really temporary works will induce the permanent heads to make permanent appointments where there is need for tliem rather than lose at the end of six or nine months the men who have been accustomed to the work. I would draw the attention of the Minister for Home Affairs to the need for a verbal alteration in sub-clause (3). It seems to me that the words "" for nine months continuously where extended as hereinafter provided "" in the secpnd place'in which they are used are unnecessary and should be omitted.",19
