speakerGroups,Speaker,Title,text,pageNumbers
0,NA,Unknown,"?£ousc of fteprrsnitatibes. Wednesday, n October, 1.905. Mr SPEAKER took the chair at 2.30 p.m., and read prayers. PETITIONS. Mr LIDDELL presented a petition from the Women's Christian Temperance Union of New South Wales, praying for the enactment of legislation to prohibit the sale and consumption of alcoholic liquors in the military camps, canteens, and army transports of the Commonwealth. Petition received. Motion (by Mr LIDDELL ) putThat the petition be read. The House divided. Ayes ... ... ... 40 Noes ... .... .... 8 Majority 3 2 Ares. Bamford,. F. W. Knox, W. Bonython, Sir J. L . Lee, H. W. Brown, T. Liddell, F. Carpenter, W. H. Lonsdale, E. Chanter, J. M. Lyne, Sir W. J. Chapman, A. Mauger; S. Cook, J. Poynton, A. Crouch, R. A. Kpnald, ] . B. Culpin, M. Salmon, G. C. Deakin, A. Smith, S, Edwards, G. B. Storrer, D. Edwards, R. Watkins, D. Ewing, T. T. Watson, J. C. Forrest, Sir J. Webster, W. Fuller, G. W. Wilkinson, J. Fysh, Sir P. O. Wilks, W. H . Glynn, P. MCM. Wilson, j . G. Groom, L. E. Hughes, W. M. 'Hutchison, T, Tellers: Kelly, W. H . Cook, Hume. Tudor, F. G. Nozs. Fisher, A. Thomson, D. A. O'Malley, K. Page. J- Tellers: Smith, B. Frazer, C. E. Thomas, J. MCDonald, C. Question so resolved in the affirmative. Petition read. Mr R EDWARDS presented a similar petition from the Women's Christian Temperance Union of Queensland. Petition received. Mr LIDDELL presented a petition from the Women's Christian Temperance Union of New South Wales, praying for the enactment of legislation to prohibit the importation of opium, except for medicinal purposes, into the Commonwealth. Petition received.  That the petition be read. The House divided. Ayes ... ... ... 35 Noes ... ... ... Majority Brown, T. Lyne, Sir W. J. Chanter, J. M . Mauger, S. Chapman, A. MCDonald, C Cook, J. Page, J. Culpin, M . Ronald, J. B. Deakin, A. Salmon, C. C. Edwards, G. B. Smith, S. Edwards, R. Thomas, J. Ewing, T. T. Tudor, F. G. Fisher, A- Watkins, D . Forrest, Sir J. Webster, W. Fuller, G. W. Wilkinson, J. Groom, L . E. Wilks, W. H . Hughes, W. M . Wilson, J. G. Kelly, W. H . Knox, W. Lee, H . W. Liddell, F. Carpenter, W. H . Lonsdale, E. Cook, Hume Bonython, Sir J. L. Storrer, D . Frazer, C. E. Thomson, D . A. Fysh, Sir P. O. Watson, J. C. G'lynn, P. MCM. Hutchison, J. Tellers: O'M-allev, K . Crouch, R. A. Smith, B. Poynton, A. Question so resolved in the affirmative. Petition read. POSTAL ADMINISTRATION, WESTERN AUSTRALIA.",12
1,Mr FRAZER,Unknown,I would like to ask the Postmaster-General whether he has received the report of the board appointed to inquire into the alleged incompetency or neglect of some of the heads of the Post Office Department in Western Australia?,13
2,Mr CHAPMAN,Unknown,"I have received a fragment of the report-that portion of it which deals with the delays between Western Australia and Adelaide. That is now being dealt with, and I expect to haye the complete report in my hands within the next fortnight. Immediately it is received, action will be taken, and honourable members will be advised accordingly. PARTIALLY-PAID FORCES: SUNDAY WORK.",13
3,Mr WATKINS,Unknown,I would like to ask the Minister whether he has any information with respect to the payment of members of the partially-paid forces for Sunday work ?,13
4,Mr EWING,Unknown,"I am now informed that12 Under the regulations, Militia can only earn a maximum of sixteen days' pay in a year, made up of camps, drills, and parades. In all the States, 23 except New South Wales, the Easter Sunday in AYES. camp was paid for as one of the sixteen, days, but in New South Wales, no pay was given for the Sunday in camp, although the actual days paid for full attendance at the camp were the same as in other States. This has been the custom in New South Wales since before Federation. Instructions have now been given that the Sunday is to be reckoned as one of the days to be paid for in camp, the same as in other States. Men who put in full time will still, however, receive no more than the sixteen days' pay in the year. It may have happened that men who have not earned the full sixteen days, but who were in camp on the Sunday, have received a day's pay less than they might otherwise have received, except that, if it had been decided beforehand to pay for Sunday, the duration of the camp would Tellers : have been shortened by a day. CLOSE OF THE SESSION. NOES.",13
5,Mr CARPENTER,Unknown,"In view of the fact that some honourable members representing distant States have been away from their homes since early in the current year, and in view also of the excellent progress that has been made with the business before us, could the Prime Minister say when the session is likely to close?",13
6,Mr DEAKIN,Unknown,As soon as possible. REPORT ON NEW GUINEA.  the Prime Minister can inform the House when we are likely to have placed before us the report of the Secretary for External Affairs with regard to his visit to New Guinea ?,13
7,Mr DEAKIN,Unknown,I have already had handed to me a portion of the report relating to matters with which we are dealing administratively. The complete document should be ready within a few days. TARIFF COMMISSION.,13
8,Mr JOSEPH COOK,Unknown,"I desire to ask the Prime Minister a question, based upon some correspondence which has been published in the newspapers, as to his action in relation to the Tariff Commission? I find that the Prime Minister forwarded to the Chairman of the Tariff Commission a letter covering a resolution of the Chamber of Manufactures, as follows:That in view of the fact that our artisans are still leaving the Commonwealth, this Chamber respectfully urges the Federal Government to immediately obtain a definite report from the Tariff Commission as to the effect of the Tariff upon industries which have so far been investigated by them. The Prime Minister added certain comments of his own, to the effect that the Government had giventhe resolution their best consideration, and accorded it their heartiest support. He expressed the hope that flhe Cjommission would be able to comply with the suggestion, and mentioned certain reasons in support of it. I should like to know whether he considers he has any powers which would enable him to immediately obtain, a definite report from the Tariff Commission-whether , in fact, he has any control whatever over a Royal Commission appointed by the Governor General, and possessing certain well-defined powers? I desire to know, further, whether he can quote any precedent for the Government directly interfering in what I conceive to be an unwarrantable way with the exercise of the powers of the Royal Commission, and also more than incidentally with the prerogative of the Governor-Ceneral, and whether he has received the resignations of any members of the Commission as a protest against his action?",14
9,Mr DEAKIN,Unknown,"I am not prepared, .without notice, to discuss all the powers which are possessed by the Administration of the day over Royal Commissions. I may point out to the honourable member that my request did not in any way interfere with or impair any of the powers or prerogatives of the Commission itself, or of any commissioner. A resolution passed by a public body and sent to the Government was properly forwarded to a Royal Commission. In this case all that was asked was expedition on the part of the Commission. No attempt was made to define what constitutes expedition, that being left to th-2 good judgment of the Commission themselves. Whatever be the powers of the Governor General, .or of a Royal Commission - and both arc greatthere is not in the slightest' degree a trespass on the one side, or any excuse for feeling an affront on the other in connection with a request that at the earliest: possible date the Commission will make a report on the subjects they have investigated.",14
10,Mr JOSEPH COOK,Unknown,But the Minister expressed a definite opinion that they should report without delay.,14
11,Mr DEAKIN,Unknown,"I urged that the Commission should at once make a report upon the subjects which they had investigated if they were able to do so. Any weight which such"" a request by the Government might have would be derived from the fact that it represents a large body of public opinion, the Commission being left perfectly freeto say ""Yea"" or ""Nay."" As a matter of fact, the Commission have replied in a manner that indicates that they have received the request in a proper spirit. TheChairman, after consulting with the members of the Commission, not only takes nooffence, but expresses his appreciation of the arguments which have been urged in. support of the resolution - Therefore, the honourable member's anticipation of any difficulty between the Government and theCommission on this account has no foundation.",14
12,Mr JOSEPH COOK,Unknown,"As the Prime Minister has expressed his opinion upon the question, I venture to say that the members of the Commission should have resigned. The Prime Minister left one of myquestions unanswered. I should like himto say whether he recollects, in all his political experience, a case in which the Premier of a Government has in any way sought to bring pressure to bear upon a Royall Commission.",14
13,Mr DEAKIN,Unknown,"In the sense of endeavouring to expedite the report of a Commission, I can remember two or three instances which have occurred in Victoria.. I could not from memory say what was theparticular character of the communicationsent to the Commissions; but it has beencustomary in the various States when a public body, however great and important, appears to be in danger of occupying moretime than is necessary, to ask it to expedite matters. Certainly no offence has-, been taken in such cases. At a later stage,",14
14,Mr DEAKIN,Unknown,"I now recollect distinctly a number of occasions in . which Royal Commissions in Victoria have been urged to expedite their reports. Attention having been called to the matter in the House, State Governments have communicated with their Commissions, expressing the wish of Parliament that they would expedite their reports.",15
15,Mr JOSEPH COOK,Unknown,That is quite another matter. In this particular case the Prime Miinister was acting at the dictation of an outside body.,15
16,Mr DEAKIN,Unknown,There was no dictation to or by the Government. OLD-AGE PENSIONS COMMISSION.,15
17,Mr MCDONALD,Unknown,Coul d the Postmaster-General give the House any idea when the report of the Old-age Pensions Commission will be presented?,15
18,Mr AUSTIN CHAPMAN,Unknown,"The Commission have practically concluded the taking of evidence in Victoria, but still have to examine two or three witnesses in New South Wales, and probably one or two in Tasmania. The work is being expedited, in the hope that the report may be presented before the close of the session. ORIENT MAIL CONTRACT. Debate resumed from 5th October (vide page 3266), on motion by Mr AUSTIN CHAPMANThat this House accepts the agreement, made and entered into on the 35th day of April, 1905, between the Postmaster-General, in and for the Commonwealth, of the first part; the Orient Steam Navigation Company Limited, of the second part; and the Law Guarantee and Trust Society, of the third part, for the carriage of mails between Naples and Adelaide, and other portsUpon which Mr R EDWARDS had moved by way of amendment That all the words after the word "" That,"" up to and inclusive of the word "" Adelaide,"" be omitted with a view to the insertion of the following words in place thereof :"" in the opinion of this House the contract entered into with the Orient Company for a Mail Service between Australia and Great Britain should be referred back to the Government for further consideration, with the object of including Brisbane as a port of call.""",15
19,Mr FRAZER,Unknown," I hesitated to speak on this matter before, because I desired to obtain certain information from the members of the late Government, who were responsible for the completion of the contract that we are now being asked to ratify. The members of the late Administration apparently desired that this debate should close without any expressionof opinion from them.",15
20,Mr SYDNEY SMITH,Unknown,That is scarcely a fair remark to make.,15
21,Mr FRAZER,Unknown,"It is true that the late Postmaster-General did address himself to the question under consideration at a late hour last Thursday night, but his remarks were the first expression of opinion that has been heard upon this all-important question from any member of the late Administration.",15
22,Mr WILKS,Unknown,He made only a partial explanation.,15
23,Mr FRAZER,Unknown,"I admit that the inter- jection of the honourable member for Dalley is to a large extent warranted. The reasons advanced by the late Postmaster General for incurring the extraordinary expenditure involved in the present contract were only in the nature of a partial explanation. It is true that he spoke for a couple of hours, but had he continued in the same strain for a week we should still have occupied very much the same position that we do today. He'gave us. an historical review of the contracts which have been entered into for the conveyance of mails between England and Australia'during the past twenty or thirty vears. That information disclosed the fact that, although the trade between these States and the old country has been a continuously increasing quantity, the subsidy paid to' the Orient Steam Navigation Company has also been an increasing one. To my mind, we had reason to expect from the late Postmaster General some strong justification for the decision of the Cabinet, of which he was a member in regard ' to the existing contract. We. all know that other offers were made to the late. Government, and under these circumstances we naturallv though! that the honourable member would have advanced substantial reasons why this Parliament should be called upon to sanction an increased subsidy - In looking through the correspondence which ""led up to this contract, I find that some time prior to its acceptance the members of the ReidMCLean Ministry were telling the people of Australia that no tender could be seriously considered which did nof 'approach closely-to the £100,000 limit. The late Postmaster-General, himself, was of that opinion.' I note, however, that at a particular stage in the negotiations the correspondence suddenly assumes a most extraordinary change. ' U p to the J 5th February it had been addressed to the Postmaster-General, who, in reply, had for\var3ed his communications to the "" General manager of the Orient Steam Navigation Company."" Upon a certain date, after one tender had been refused by the Cabinet, and' its decision had been minuted, I find that the Postmaster-General forwarded a communication to the general manager of the Orient Steam Navigation Company in these wordsI understand company desire to make further offer. If so, shall gladly consider, but it must be firm, direct to me, and immediately. A little later, however, the ex-Postmaster General appears to have dropped out of the negotiations, almost the next communication from Mr. Kenneth S. Anderson is addressed "" Dear Mr Reid."" At this particular period there appeared to be every prospect of a settlement being arrived at, and the familiar terms employed in the correspondence lead me to believe that both parties to it thoroughly understood each other. parently the Postmaster-Genera! tirely overlooked in these later negotiations. At any rate, I feel that he did not receive the consideration to which he was entitled, and that to some extent he was slighted by the Prime Minister of the day. In dealing with the contract which we are asked to ratify,v circumstances which we must The most important of these is that the Government which were responsible for entering into the existing arrangement have paid the extreme penalty for having committed such a colossal blunder. They have been relegated to a position in which their responsibility is much less than it was previously-a position which I believe they will continue to occupy for some considerable time. Viewing their position from that stand-point, I derive amount of pleasure. Further, ceptance of the present contract, subject to' its ratification by this Parlia-' ment, is an effective reply to those persons who are always contending 'that it is impossible for white men to work in the stokeholds of our mail steamers. It has oeen conclusively proved that, if the ventilation of these vessels is attended to, and if an Mr Frazer improvement be effected in the general coi'H ditions that obtain there, no difficulty need be experienced in securing reliable white men to perform this class of work. I am delighted to know that Australia is paying this subsidy . for distribution among our own countrymen instead of to lascars. It may reasonably be urged that those who oppose the ratification of the present contract should be prepared with an alternative scheme for the carriage of our mails. Personally, I am of opinion that the subsidy now being paid to the Orient Steam Navigation Company is considerably in excess of the benefits conferred by that service. It has been claimed-and the Postmaster-General has not denied it that if we adopted the poundage system we could effect a saving of £ 8 0 , 0 0 0 per annum. completely Sir JOHN FORREST - But we should sebecause cure no regularity.",15
24,Mr FRAZER,Unknown,"The Treasurer interjects that we could not secure any regularity in the service under those conditions. I hold that to obtain a sufficient share of the passenger and cargo trade between Australia and other countries to insure success to the venture, it is necessary Ap- that any line of steam-ships should was en- duly advertise the time of the departure of its vessels from particular ports, and also the time at which they may be expected to reach their destination. If the Orient Steam Navigation Company took up the attitude of saying, "" We will not take the public into our confidence as to there are certain the date of the departure of our vessels,"" recollect. I maintain that if they had persisted in their attitude they would very soon have had to relinquish their service. They would have to make room for other companies, which would have considered the public convenience. Let us suppose that the mail steamers did not leave Adelaide at 2 p.m. on Thursday, as they do at the present time, and let us further assume that they left a few hours later. Their owners would still have to give the no small public reasonable notice of the time the 'ac- of the departure. Under the existing law, which compels them to carry mail matter, I understand that they are required to give twenty-four hours' notice of the intended departure of their vessels. But. even assuming that we had to submit to a - little inconvenience by reason of receiving only that brief .notice- a contingency which I do not anticipate would arise- I still maintain that the saving of the increased subsidy payable under the current contract would justify us in submitting to that inconvenience. The late Government professed to Be actuated by a most extraordinary desire to assist the residents of the interior of Australia, but it appears to me-in view of the fact that we are now asked to expend £ 8 0 , 0 0 0 per annum more than is necessary to get our mails carried to the other side of the world - that their professions in this 1 respect are scarcely as sincere as they would have us believe. In my judgment, instead of paying this £ 8 0 , 0 0 0 to placate., our banking and commercial institutions, and to enable the businesses conducted in Flinders-lane and George-street, Sydney, to be carried on at a greater profit, we could expend it much more profitably in extending postal and telegraphic facilities to the residents of the interior. Assuming that, the Orient Steam Navigation Company made the position of the Government as awkward as possible, owing to its refusal to accede to their demands, I say that we could then transmit our mails to the outer world by two other lines of * steamers which run regularly between Australia and Europe - I refer to the Norddeutscher Lloyd and the Messageries Maritimes Companies' vessels. I also expected in connection with the present contract that an effort would have been made to secure more up-to-date ships and a quicker service. I find that the British Government, in its contract with the Peninsular and Oriental Steam Navigation Company, are 'receiving a quicker service for a less subsidy than was previously paid. On the other hand, although the subsidy payable by the Commonwealth has been enormously increased, we have not secured a quicker service than that which obtained seven years ago. Only the other night reference - was made to the fact that the old Cuzco had been taken off the Australian service only within the past two or three years. I repeat that for entering into this contract the late Government deserved to pay the extreme penalty which has been exacted from them. The representatives of Queensland in this House have earnestly advocated the adoption of a certain course in regard to this contract. I for one consider it desirable that the Post and Telegraph Department, in entering into contracts of this kind, should have regard, not only to the expeditious transmission of letters to all parts of the world, but to the interests of producers and all who may be assisted by - means of an adequate and effective oversea service. I do not think it necessary for the Department to study simply the establishment of effective postal communication, and therefore am not opposed to the conditions in the contract relating to the provision of cold storage on board the vessels of the company. It seems to me, however, that since the late Government insisted upon the insertion of a condition in the contract providing that the mail steamers should call not only at Adelaide, but at Melbourne and Sydney, they might well have considered the capital of another State. I doubt the wisdom of requiring the service to be extended beyond the point at which the oversea mails are discharged, but having provided that it shall go on 10 Melbourne and Sydney, we ought certainly to give some consideration to the demands of Queensland. No one can say that, simply because the city has a smaller population than has either Sydney or Melbourne, we should disregard the desire of that State that Brisbane shall be made a port of call. The proposal made by the honourable member for Oxley is a hazy and indefinite one, but if a proposition be submitted by the representatives of Queensland that the vessels of the service shall be sent on to Brisbane on payment of the mileage rate of 3s. 8d. I shall be prepared to give it my support.",16
25,Mr R EDWARDS,Unknown,"That would be better than nothing. - Air. FRAZER - It would relieve Queensland to the extent of something like £ 6 , 0 0 0 per annum. Although I am opposed to the ratification of this contract, I believe that the motion will be carried, and that being so, we should take care to mete out equal treatment to all the States. An important proposition for the establishing of al Commonwealth fleet of mail steamers has been made by the honourable member for Barrier, and the able speech which he recently delivered on the subject is worthy of the serious consideration of the House. I certainly nope that the Government will carefully consider his proposal. In submitting this motion the Postmaster General spoke in a half-hearted way, that was not calculated to arouse any enthusiasm in the proposal to pay a subsidy of £ 1 2 0 , 0 0 0 to this company. The honourable gentleman said that he was not pleased with the terms of thp contract, 'that the subsidy was too large, that better conditions as to time occupied on the voyage should have been exacted, and that the Governcally ment would terminate the agreement as the Government proposal. soon as possible. That does not say much for the perspicacity of the late Governsay ment in entering into such a contract; it indicates an intention on the part Ministry to take a step in the right tion. The time is fast approaching, if is not already at hand, when the Govern-' ment should shake itself free from bonds of the oversea shipping combine. system. The honourable member for Barrier has pointed out that the subsidy now paid the carriage of our oversea mails would be sufficient to provide a sinking fund and meet interest charges on the capital cost of a fleet that than sufficient to carry, not only our oversea mails, but our various exports to markets of the old world. I hope that the Government will give his suggestion their serious attention. My desire is when this contract expires, the CommonMelbourne wealth Government shall be in a position refuse for all time to listen to the. tures of a company which, at present, pears to hold us fast within its grip.",17
