speakerGroups,Speaker,Title,text,pageNumbers
200,Mr DUGALD THOMSON,Unknown,I do not say that they would. But I do say that the Imperial Government would have been in a much stronger position-dealin g as they would have been with a weekly service - tha n Australia was in negotiating for a fortnightly service.,44
201,Mr WATSON,Unknown,"I do not think that there is anything in that contention, because the Orient Steam Navigation Company has nc other contracts.",44
202,Mr DUGALD THOMSON,Unknown,"I would point out that in the papers relating to the English mail service, which have been laid before Parliament, the following passageoccurs :In reply a cable was received from the Office, dated 21st January, rgo3, stating that, with the exception of the Commonwealth the Postal Administrations interested' generally in favour of the extension of thecontracts, if increased speed could be secured, and the Imperial Postmaster-General thought this could be obtained for the present subsidy. With regard to the exclusive employment of white labour, His Majesty's Government could not agree to introduce into a mail contract to which they were a party, stipulations intended to exclude tain classes of British subjects from employment in the contract vessels, and unless that condition could be modified, the idea of a joint arrangement would have to be abandoned, and other plans made for an Australian service. It will thus be seen that the representatives of the Imperial Government expressed the opinion that if they had had to deal with (the two services they qojuild have secured a renewal of the contract at a higher rate of speed for the same subsidy. They would not then have been entirely de- pendent upon the Orient Steam Navigation Company. It must be recollected that they can exercise a strong influence with the Peninsular and Oriental Steam Navigation Company. But for the existence of the white labour condition the Imperial Government could have called for tenders for the whole service, and the Peninsular and Oriental Steam Navigation Company would not have been excluded from tendering.",44
203,Mr WATSON,Unknown,I do not believe it probable that that company would have put on another line of vessels.,45
204,Mr DUGALDTHOMSO N,Unknown,"That may be the. honourable member's belief, but. the British authorities who are in closer - contact with the head offices of the company have expressed the opinion that they would have been able to secure the extension of the service at the same rate.",45
205,Mr WATSON,Unknown,That was evidently with the same company.,45
206,Mr DUGALD THOMSON,Unknown,Perhaps so; but at all events we lost the opportunity of obtaining tenders from other companies employing black labour. The honourable member for Grey declared that the increased subsidy was demanded because the Orient Steam Navigation Company's operations were not paying. The increased subsidy was agreed to for no such reason.  fered by the company for demanding an increased subsidy.,45
207,Mr DUGALDTHOMSO N,Unknown,"Certainly ; but it was not the reason for acceding to the demand. I took no part in the direct negotiations, because the matter was left in the hands of the late Postmaster General, who handled it with very great ability; but I had a conversation with Mr. Anderson, and told him that such a plea - could not be considered by any Government. The reason why we agreed to the contract was that every effort had been made by previous Governments, as well as by the Government of the day-durin g the cershort time at its disposal-t d obtain a service for a lower subsidy, but without success.",45
208,Sir JOHN FORREST,Unknown,Surel v the fact that the service is not paying is an excellent reason for an increased subsidy?,45
209,Mr DUGALD THOMSON,Unknown,"It is not. For many years the company supplied this service for a subsidy of £ 8 5 , 0 0 0 per annum, and during that time they obtained a return-althoug h only a small one-fro m their capital. The service ceased to pay, not because of anything relating to the mails, but owing to the competition for cargo which had set in . Tramp vessels were put on to run directly between Australia and England, while a line of steamers which commenced running to the East reduced the freights on tea between Ceylon andi Australia to 14s.. to 15s. per ton, as against £ 3 10s. per ton previously obtained.",45
210,Sir JOHN FORREST,Unknown,How could the Orient Steam Navigation Company continue the service if it did not pay them?,45
211,Mr DUGALD THOMSON,Unknown,"The Peninsular and Oriental ""Steam Navigation Company are continuing the service, and we must presume that it pays them to do so.",45
212,Mr WATSON,Unknown,"They are receiving a larger subsidy, or, at all events, one that averages a higher rate per mile.",45
213,Mr DUGALD THOMSON,Unknown,"But it is not the business of a Government in dealing with a demand for an increased subsidy for the continuation of a mail service that has been supplied for years to consider the losses incurred by the contracting company in connection with the cargo trade. Where one company cannot carry on successfully another may be able to do so, and a Government has no right to be guided by such considerations. In speaking in favour of the poundage system the honourable member for Grey inquired how many people benefited by the subsidization of the mail service, and replied to his own query by saying that perhaps not one in a thousand did so. That, to my mind, is a very narrow view to take of the effects of a speedy and convenient service between Australia and Great Britain. Such a service must benefit Australia in a trading sense. It reduces, to some extent, the disadvantage under which Australia labours, owin'g to its distance from the trading centres of the world; it brings to our shores many persons who, in a variety of ways, assist Australian enterprises; and it also provides for the wants of our shippers.  been made during the last ten years?",45
214,Mr DUGALD THOMSON,Unknown,"They are covering the distance at least one knot per hour quicker than they used to do ten years ago, and that is a considerable advance. At all events, it cannot be denied that the subsidized mail service provides a ready and regular means of shipping our produce to the markets of the old world. The value that our producers place upon it may be gauged by the fact that they have always been ready to pay a slightly increased rate for the carriage of their produce by these steamers, as compared with the freights charged by other lines running between England and Australia.  other line is taking produce at a much lower rate?",46
215,Mr DUGALD THOMSON,Unknown,I do not know that there is a material difference between the rates. The Orient Steam Navigation Company and the ' Peninsular and Oriental Steam Navigation Company have considerably reduced their rates.,46
216,Mr WATSON,Unknown,They didi so as the result of the competition of cargo vessels.,46
217,Mr DUGALD THOMSON,Unknown,"I would point out what, in my opinion, is the great objection to the acceptance of the amendment. Having regard to our new Federal conditions, I do not agree with the view that we should obtain tenders for a mail service alone. If it be advantageous to Australia, as a whole, to require that refrigerating space shall be provided on board our mails steamers, it may be, if necessary, desirable to impose such a condition. The mere fact that the postal service has been separated from the States should not induce us, in dealing with the oversea mail contract, to pay no regard to the interests) of the States in other matters.",46
218,Mr BROWN,Unknown,"If that be so, why should we not consider* the interests of Queensland?",46
219,Mr DUGALD THOMSON,Unknown,"I am speaking of the interests of Australia, as a whole. If it is to the advantage of all the States to require that refrigerating space shall be provided in our mail steamers, it is - well to make that stipulation, unless too great a price is asked for compliance with it.",46
220,Mr THOMAS,Unknown,But should the Postal Department pay for that service?,46
221,Mr DUGALD THOMSON,Unknown,"I do not think that we should endeavour to entirely separate the postal service from other interests. We have to consider what is a reasonable price to pay for the provision of these conveniences, and if the demand be not unreasonable, it is well if it be necessary to require them to be made under contract. In my opinion, however, we ought in future to require the mails to be carried simply to the first rail port of call in Australia, leaving the com-' pany free to send their steamers beyond that point if they think it desirable. If a State is particularly anxious for them to go to a port beyond that point, when the company do not see their way clear to send them on, that State should bear the cost of the extension. I should like to remind the House that the late Government did not insist that the steamers of the company should go on to Melbourne or Sydney. Alternative tenders were called-on e for a service to Adelaide only, and the other for a service that would go on to Melbourne, Sydney, and Brisbane. The company sent in a tender for delivery of the mails at Adelaide, and for the steamers to proceed to Melbourne and Sydney. That was their own offer, and they asked for no increased subsidy, because of the sending of their vessels to those two ports. No pressure was brought to bear by the Government to induce them to make Melbourne and Sydney ports of call, but we certainly endeavoured to induce them to extend the service to Brisbane.",46
222,Mr WILKS,Unknown,Would not the bulk of the mail matter be landed in any case at Adelaide ?,46
223,Mr DUGALD THOMSON,Unknown,Certainly . But it is now proposed that provision shall be made for the carriage of mails or cargo beyond the ports to which the company may choose to go. It is suggested that the mail steamers should call at a port in each State of the Commonwealth.,46
224,Mr FISHER,Unknown,"If the honourable member turns to clause 4 of the contract, he will see that the company was compelled to send its vessels on to Melbourne and Sydney. Mr.""DUGALD THOMSON - That was their own offer; no influence was brought to bear by the Government to compel them to send them on to those ports. have said, I believe that in we should simply provide for the conveyance of the mails to the nearest rail port.",46
225,Mr FISHER,Unknown,"Why the first rail port, the mails could be delivered more exsupport peditiously at another port? Supposing were quicker to deliver them at Melmake bourne ?",47
226,Mr DUGALD THOMSON,Unknown,"If the and mails could be delivered more expeditiously there, that would be the nearest rail port.",47
227,Mr THOMAS,Unknown,"They say that the mails could be - delivered more expeditiously i the steamers, instead of calling at Adelaide, came straight! on.",47
228,Mr DUGALD THOMSON,Unknown,"I very much doubt it . At all events, I think that in future contracts we should simply vide for the delivery of the mails at the first rail port, leaving the company liberty to send their steamers beyond that State itself? point If any subsidy had to be given for the extension of the service beyond first rail port, it should be paid by the State or States desiring it. The proposal now made is that the mails shall be carried at the expense of the Commonwealth Gowith the cost? vernment to each State in the Commonwealth. That will not apply the English mails by the Red Sea route. - It must apply to mails by Vancouver, as well as from the East. Are we going to agree, for example, that mails from the East shall be carried on to Western Australia at the expense of the Commonwealth ?",47
229,Mr AUSTIN CHAPMAN,Unknown,"If the comto pany made a contract to send the vessels on to Western Australia to deliver parcels there, surely we ought, in justice, to pay them for the carriage of those parcels.",47
230,Mr DUGALD THOMSON,Unknown,"If they every rendered any service over that stretch water, we ought certainly to do so. But if in a contract made with Commonwealth Government for the deing livery of oversea mails in one State, it is to be provided that the allowthroughout ance per mile which we pay the company shall be given to them to go on to the other States, we shall place ourselves in a difficult and false position. I should like to be able to support the amendment, but having regard to all these facts, I not do so. The Minister took up the ner attitude in his first' declaration, is now departing from it, and has announced As I his intention of voting in opposition to his future contracts own arguments. Mr AUSTIN .CHAPMAN - That is not so.",47
231,Mr DUGALD THOMSON,Unknown,"That is if my conclusion. I cannot see my way to the amendment, but I ask the Mini t ister and those who are supporting him to it clear that it shall have effect only during the currency of the present contract with the Orient Steam Navigation Company, shall not be regarded as a precedent in connection with the framing of future contracts for the carriage of mails. Is the Peninsular and' Oriental Steam Navigation f Company to be dealt with in the same way ?",47
232,Mr AUSTIN CHAPMAN,Unknown,We have nothing to do with that company. °,47
233,Mr DUGALD THOMSON,Unknown,"Then I ask if it is intended that the cost of conproveying mails from Queensland homewards shall be made a general charge on the Comat monwealth, instead of being paid by the",47
234,Mr FISHER,Unknown,The country in which mails the are posted always pays for their delivery.,47
235,Mr DUGALD THOMSON,Unknown,Yes ; but do the Government propose that in this instance the Commonwealth shall be charged,47
236,Mr AUSTIN CHAPMAN,Unknown,We are not dealmerely to ing with that matter now.,47
237,Mr DUGALD THOMSON,Unknown,"I am not surprised that the Minister is unable to answer the question. He has accepted the amendment without knowing all that its acceptance involves; but I hope that, if it be carried, it will be made clear that it is apply only to'the present contract. That will remove many of my objections to it , though I shall still be unable to vote for it . If it is to be a permanent condition in all mail contracts that every vessel subsidized to bring mails to Australia shall proceed to State the position will be a very diffiof cult one. I hope that in framing 'future contracts we shall adopt a principle which the will get rid of these difficulties by stipulatonly for the delivery of mails at the first convenient port for their distribution Australia, leaving it to be arranged between the shipping companies and the Governments of the States interested for the steamers to call at any other port at which it may be considered desirable that they should call to which they would not go of cantheir own accord. I am in no way hostile to proQueensland, and wish to be fair to every but he State, but I feel that the amendment will establish a precedent which may be very awkward, unless it is made clear that it of applies only to the present contract.",47
238,Mr WATSON,Unknown," Any one who has followed the negotiations for this service must admit that the successive vernments which have dealt with the matadvocate ter have had a very difficult task. It have been wiser »had the first Federal vernment earlier taken steps to ascertain under what conditions the contract existence could be renewed. When 1 went into office the negotiations for a renewal fallen through, and we called for tenders for alternative services under which the mails would be delivered at Adelaide, with or without the steamers being required to go on to either Melgoods bourne, Sydney, or Brisbane. Before those farming communities. tenders were received we went out of office again, and the Reid Government then the matter up. I am willing to admit that the late Postmaster-General did nearly well as he might have been expected to under the circumstances. It is the Orient Steam Navigation Company secured a substantial increase of subsidy without giving a faster service, and I am inclined to think that it might possible to persuade them to accept a slightly lower amount, though I do not suppose that any substantial saving could been made.",48
239,Mr HUTCHISON,Unknown,A quicker service might have been obtained.,48
240,Mr DUGALD THOMSON,Unknown,No - The comgoing pany cannot increase the speed of the vice with its present boats.,48
241,Mr SYDNEY SMITH,Unknown,"£ 2 0 , 0 0 0 was for an accelerated service.",48
242,Mr WATSON,Unknown,"I do not think that speed could have been increased; but the company might have been induced to acthey cept a iower subsidy. The position, howAustralia ever, was a difficult one, and that emphathem sizes the need for taking time by the lock in regard to the renewal of the present Far East. contract. Steps should be taken very early for the making of arrangements for the future. I am hopeful that the Select Committee which is now sitting will be able to give the House valuable informadon. tion in regard to the subject generally fore it will be necessary to call for tenders for a new contract.",48
243,Mr WILKS,Unknown,"Does the honourable memposition ber expect the honourable member for Barrier to get us out of the difficulty ? . Mr WATSON - The honourable memassumed ber for Barrier has taken a great deal interest in this matter, and it will certainly pay us to give consideration to it . I am not yet convinced mail that it would be profitable to run a ComGomonwealth, line of steamers, but I should the running of such a line if the would enterprise would pay. I am surprised that Go the late Postmaster-General did not give more consideration to the tender of Messrs. then in Scott Fell and Co. That firm, by greatly reducing freights between Austrahad lia and the East, has cut into the operations of a ring which previously controlled that trade, and has caused an enormous reduction in the charges for the conveyance, not only of tea and similar goods, but of the jute which are so much used by our The firm tendered for the conveyance of mails from Adelaide took to Colombo or Bombay-pre'ferabl y the former-for a subsidy of £ 7 5 , 0 0 0 . Under as that arrangement they would have been do transhipped at the port agreed upon into true that one of the many steamers which trade behave tween England and the East. Mr SYDNEY SMITI? - The firm asked £ 1 1 0 , 0 0 0 for the conveyance of mails to a have been Mediterranean port.",48
244,Mr WATSON,Unknown,"I understand that for have that sum they were prepared to land our mails at a Mediterranean port, and to send their steamers on to London. Their steamers would certainly not turn round in the Mediterranean, and come back without ' on to London, because of the transershipment of cargo which that would make necessary. In view of their record, as their asked tender was that of an Australian firm, who were prepared with a tangible proposal, it the should have received consideration.",48
245,Mr SYDNEY SMITH,Unknown,"For ,£110,000 were prepared to carry our mails from to Colombo, and there tranship into swift passenger steamers calling foreat that port on their wav Home or to the",48
246,Mr WATSON,Unknown,"I think that they amended that tender, and offered to land the mails at a Mediterranean port, their steamers proceeding right through to LonHowever, everything points to the benecessity of early action being taken for the determination of this question in order that we shall not be forced into such a as we occupied recently, to some extent owing to our own delay, and also to some extent as the result of the attitude by the Orient Steam Navigation Company. With regard to the extension of the service to Brisbane, it seems to me that the view put forward by the honourable member for North Sydney is the correct one, namely, that we should conclude a mail tract, pure and simple, for the landing of the mails at the nearest rail port. There was a time in Australia when the facilities for the shipment of perishable produce were so inadequate that it was probably necesfrom sary-withou t debating the question whether the Post-office vote or our general expeninto diture should be debited with the costto give some encouragement to steam-ship owners to increase their cool storage accomment modation. We have, however, passed that period. We find that the cargo vessels empty. which are not in receipt of any subsidy giving practically as good a service, so as the carriage of perishables is concerned, as are the mail steamers. Nearly every steamier provides cool storage space, and arrangements have been' made by a combinawith tion of lines for regular sailings, which being availed of by butter shippers ference to the somewhat faster mail steamtablish a precedent. ers. Therefore, the question of assisting exportation of perishable products is not nearly so important as it was a short time ago, and we are free at this stage to centrate our attention upon the question of the carriage of mails alone. So far that is concerned, I think that our purpose would be well served by arranging for the landing of our mails at Adelaide, and mitting the steam-ship companies to send their vessels on to whatever ports they please.",48
247,Mr AUSTIN CHAPMAN,Unknown,That would be mail contract pure and simple.,49
248,Mr WATSON,Unknown,"Yes . The fact that the present contract-n o matter upon what terms it may have been arrived at-include a condition that the mail steamers must ,on to Melbourne and Sydney after they have delivered their mails at Adelaide, fords reasonable ground for the claim made by the representatives of Queensland that consideration should be shown to that State. I admit that special difficulties that exist no other part of the Commonwealth have be overcome in regard to the exportation perishable.products from Queensland. DurI ing my recent visit to that State I found that notwithstanding the great efforts that had been made by the State Government inducefheowners of the Aberdeen line to some of their vessels to Queensland ports, the shippers were at that moment under heel of an absolutely despotic shipping ring, which prevented the vessels' attracted to the port of Brisbane from carrying away a large proportion of the produce intended for exconport. That was a condition of affairs that no community should suffer in silence, and I am inclined, therefore, to extend the most generous treatment to the people of Queensland. All the Brisbane cargo brought out England by the Aberdeen steamers had to be unloaded at Sydney and transhipped other vessels, in""order to be conveyed to Brisbane. According to the conditions laid down by the shipping ring, this transhipwas necessary, even though the oversea steamers had to proceed to Brisbane Further than that, these vessels are were prohibited from shipping at Brisbane far any perishable product other than butter. They were not allowed to load frozen meat, ' fruit, or other produce. That is a condition of affairs upon which Parliament should look a desire to bring about a are change. I am not so much concerned in preas to whether or not Ave should esI am afraid the that the operations of commerce, which are usually extolled as being of the freest possible character, are so hampered by shipconping rings and combinations that it is pf no use to rely on precedent for the solution as of the difficulties presented to us, and for that reason I do not .attach the same importance to precedent as does the honourable permember for North Sydney. There is only one other point to which I desire to referthat is the statement of the honourable member for North Sydney as to the influence a that the insistence upon white labour conditions in connection with the mail steamers had upon the Orient Steam Navigation Company's contract. The honourable member said that, in his opinion, the prohibis tion of the employment of coloured labour come had caused a demand for an increased subsidy. He quoted, in support of that view, afthe opinion expressed by the British Postmaster-General, that if he were free to arrange the whole contract-that is, for the carriage of mails both to and from Australia in - h e would probably be able to secure an to accelerated service at the same outlay that of was being incurred under the old contract. would .direct attention to the fact that that expression of opinion was given some time prior to the expiration of the last conto tract, and before the Orient Steam Navisend gation Company had indicated its position in reference to the renewal of' the contract. the As indicating that it was most unlikely that the British Postmaster-General would 'have been able to secure a renewal of contract on the favourable terms he indiforgot cated, I would point to the statement, which, no doubt, honourable members have seen, as to the position of affairs of the Orient Steam Navigation Company, which shows that they have been earning low rate of profit for some considerable time past.",49
249,Mr DUGALD THOMSON,Unknown,They been making a loss lately.,50
