speakerGroups,Speaker,Title,text,pageNumbers
265,Mr BROWN,Unknown,"I presume that the honourable member, in bringing the matter under the notice of the Convention, was influenced by a desire to induce the States to agree to the adoption of his proposal. If that were not so, why did he bring it forward? On the qth February last the present leader of the Opposition, whilst on a visit to Tasmania, received a deputation from a number of ladies with regard to the contract labour provisions of the Immigration Restriction Act and the white ocean policy. According to the Sydney Morning Herald the deputation was introduced by Senator Dobson and Senator Mulcahy, and the reply of the right honourable member is reported in that journal in these termsHe was one with the deputation in the desire to see ""white ocean"" and the ""contract labour"" clauses repealed, but could not see his way to initiate legislation on the subject, because to do so would lead to the break up of the Coalition Ministry. Apparently the very estimable members of the deputation were somewhat disappointed inat the reasons given, one good ladv hintdarkly that she would lead an insurrection. The Daily Telegraph, in criticising the action of the Government in this matter, said, ten days later As Mr Reid is not at present finding fault with the "" white ocean"" policy, which he denounced at the elections, or proposing to amend it, but doing his best to give effect to it, and let the country take the injurious consequences, he cannot, perhaps, be expected to admit that the increased subsidy asked for is simply the logical result of the demand for a more expensive service. During the conference of Premiers at Hobart, both the right honourable member for East Sydney and the right honourable member for Balaclava informed the assembly that the condition requiring the employment of white seamen on the'mail boats had not materially affected the negotiations between the Postal Department and the Orient Steam Navigation Company in connection with the mail contract. this connection I should like to refer to a paragraph which was published in the Melbourne Argtns on the morning following the arrival at Largs Bay of the first steamer to come here under the new contract. l t was as follows :RMS. ORMUZ AT LARGS BAY. THE WHITE STOKERS. ADELAIDE, Monday - The Orient Pacific liner arrived from London today, and, in accordance with the new mail contract, she has no lascars employed on board. It is three years since the company first shipped black stokers and firemen. The reason for the change was the unreliability of white stokers, and their alleged over-fondness for intoxicating liquor. The chief engineer (Mr. Mclnnes) today expressed his deep regret that the political action of the Commonwealth should have forced the company to revert to the employment of white stokers and firemen. Their stoking of the ship, he stated, is not so satisfactory as the lascars'. That statement was only in accord with the contentions of those who said that the difficulty in the way of securing a satisfactory mail contract was the condition in the Postal Act requiring the employment of white seamen j but a few davs later the following letter appeared in the same newspaper :THE ORMUZ STOKERS. To the Editor of the Argus. Sir - With reference to your telegram from Adelaide to The Argus of the 16th inst., in which you make the statement to the effect that I had expressed deep regret that the Orient Company had been compelled to revert to the employment of white firemen and stokers, and that the stoking of the ship was not as good as when lascars were employed, I deny that I made any comparison between white and black stokers, as far as Mr Brown. their ability went. With regard to white firemen' on board the present voyage, I never sailed with a steadier or more obedient lot of men, as I hope to be able to say the same at the conclusion of the voyage. In justice to the men and myself, I beg you to give publicity to this letter, both in Melbourne and Adelaide, where the above erroneous statements have been made. Yours, & c , KENNETH MCINNES, Chief Engineer. S.S. Ormuz, May 18. As no 'other complaints have been made, it must be assumed that the experience of the other engineers in the Orient Steam Navigation Company's fleet has been the same as that of the chief engineer of the Ormuz, and no trouble has arisen from the employment of white stokers. In view of that fact, the use made of the provision' in the Postal Act to denounce Federal In legislation is not at all creditable to those responsible for it. The Orient Steam Navigation Company, as the result of its long connection with Australia, has secured a very firm grip upon our commerce and trade, and when it came to negotiate with the Postal Department for the mail contract was in a very secure position, because of the way in which it has been nursed and favoured by the community. It could thus demand much more advantageous terms than it would otherwise have secured. It is true that Mr Anderson has since declared that the white labour condition affected the negotiations indirectly, though not directly, but he has riot indicated how it did so. He has suggested, however, that, if there had been no such condition, the British Government might have come to the assistance of the Australian people by contributing part of the increased subsidy for which his company felt compelled for other reasons to ask.. I should like to know from those who are so anxious that the British taxpayer shall not be saddled with expense for the benefit of the Commonwealth, and have proposed that our subsidy to the Navy shall be increased by ioo per cent., what they think of that suggestion ? Would they allow the British taxpayer to bear a portion of the expense of providing us. with a mail service? If they would not, of what advantage would it have been to allow the employment of black labour on these mail ships? The question of employing black labour, upon mail steamers is quite distinct from that of a White Australia. If honourable members will refer back to the debates which took place upon the provision in the Post and Telegraph Act for the employment of white crews upon mail steamers, they will see that its advocates did not propose it as a mere supplement to the White Australia policy, but with the object of encouraging the employment of British sailors in the mercantile marine. The honourable and learned member for West Sydney, in speaking upon the matter in 1901, quoted some statements made by Lord Brassey to the effect that the proportion of sailors in the British mercantile marine had, during the preceding twenty-five years, decreased to the extent of 50 per cent. Whereas twenty-five years previously 200,000 British seamen had found employment upon British merchant vessels, the number had dwindled down to 100,000, and was still rapidly decreasing. Lord Brassey pointed to the difficulty that would be experienced in obtaining a sufficient number of recruits for the Royal Navy, and also in maintaining an efficient naval reserve, adequate to meet the stress of war. It was pointed out that the mercantile marine was being manned by foreign sailors to a larger extent every year, and that a still worse condition of things was rapidly being brought about by the substitution of Asiatics for European seamen. The most recent statistics show that the decrease in the number of British seamen is proceeding at an alarming rate, and that the conditions are such as to cause the greatest concern to statesmen, who have any conception of the probable needs of the Empire in the event of Great Britain becoming involved in war. The object of - initiating a white ocean policy was to insure that British seamen should be employed upon the mail steamers subsidized by the Commonwealth, and I feel sure that 'our action in that regard will meet with the approval of all well-wishers of the Empire. At the time that the controversy with regard to the white ocean policy was at its height, I , in company with a friend from the country, visited Circular Quay, in Sydney, and inspected a number of large steamers which were berthed there. We went on board the German steamer Friedrich der Grosse, a steamer larger than any belonging to the Orient Steam Navigation Company or Peninsular and Oriental Steam Navigation Company. We found no black labour upon that steamer, but the whole of the sailors were Germans. Alongside her was a sailing vessel, which, at that time, was the greatest attraction of Sydney Harbor. It was equipped by the German Government 2 for the special purpose of training youths for a seafaring life, in order that they might afterwards enter the mercantile marine, and eventually be drafted into the German Navy. It is scarcely necessary to say that there was no black labour to be found on that ship. On the other hand, we saw a number of sturdy fine-looking young men of ages ranging from sixteen to twenty-four, whose training was provided for as a part of the system by which Germany is building up her naval power. We next proceeded to the other side of the Quay, where we boarded one of the Peninsular and Oriental Steam Navigation Com pany's steamers. We found there a few British officers and a crew composed mainly of Cingalese. We have built up a navy which is the pride of the British people and the admiration of foreign nations, and we are blindly endangering our prospects of being able tomaintain it by substituting for British seamen foreigners and Asiatics. I believe that the desire for gain which isresponsible for the change now being brought about in our mercantile marine will eventually prove the greatest weakness in the British Empire. Our desire that the money which we pay in the form of subsidies to mail companies shall be spent in the employment of white labour is a commendable one. We do not wish merely to paint the ocean white, but, as far as lies in our power, .to render secure the naval strength of the Empire. As indicating that the employment of British sailors is decreasing, I would point to the returns showing the number of youths indentured as apprentices on sea-going vessels. In 1870 they numbered 18.000; in 1880, 14,000; in 1890, 8,000; in 1900, 5,000; and in 1903, 5,339. Thisgreat reduction shows that the British tar is gradually disappearing from our mercantile marine. I would commend these factsto the serious consideration of honourable members who have expressed their disapproval of our white ocean policy. All the great nations are devoting their attention to the strengthening of their navies. Germany, England's great commercial rival, is. paying more attention to her navy than to her army, and she is acting wisely in building up her naval strength by making every provision for the training of efficient seamen to man her fleets. There is another phase of this question to which I desire to refer, and that is the monopoly which has hitherto been enjoyed by the Peninsular and Oriental Steam Navigation Company and Orient Steam Navigation Company in connection with our produce export trade. These companies have received considerable encouragement at our hands, and, as their position has become strengthened, they have shown a disposition to exact from us all the harder terms. I desire to direct attention to the evidence given before the Butter Commission with regard to the commissions paid to brokers by the Peninsular and Oriental Steam Navigation Companv and the Orient Steam Navigation Company. The following statement occurs in the report :1. That payments were made by the Peninsular and Oriental and Orient Companies from 12th May, 1894, to 30th April, 1903, amounting to £13,130 ios., to Messrs. J. Bartram and Son and Messrs. MCMeekin Broi., and that the following shippers and others participated in the amount paid to Messrs. J. Bartram and Son, namely :Messrs. C. W. Gray and Company, Wm. Telford Webb, Daniel Manson Taylor, Chas. Fredk. Taylor, and the Melbourne Chilled Butter Company. 2. (a) That the payments were in the form of a rebate on freight, and not for services legitimately rendered as brokers.",53
266,Mr SPEAKER,Unknown,"I must ask the honourable member to refrain from any further reference to that matter, unless he can connect his remarks with the motion before the Chair.",56
267,Mr BROWN,Unknown,"The report discloses a monopoly, in which the Orient Steam Navigation Company is concerned, and that improper means have been adopted to secure trade preferences. I advance this as one of the reasons why we should seriously consider the relations in which we stand towards the Orient Steam Navigation Company before the expiration of the current contract.",56
268,Mr SPEAKER,Unknown,"I should hesitate to rule the honourable member entirely out of order, but I would point out that his remarks, whilst they may be made incidentally, must not be made the basis of a long argument.",56
269,Mr BROWN,Unknown,"I merely wish to quote one short paragraph from the report, which reads as follows :From the evidence elicited before this Commission, it is apparent that the shipping companies seek to limit the competition for the carriage of Australian butter. It is also evident that the shipping .interest is sufficiently and influential to demand its own terms from the producers. The evils proceeding from this state of affairs appear to menace the Australian export trade in butter, and call for the united efforts of the States to at once place the trade outside an influence which has the power of increasing the burdens of the primary producers. This House is now engaged in considering a Commerce Bill, which I hope will speedily become law, and put a stop to such malpractices, i am quite in accord with the suggestion of the honourable member for North Sydney that we should enter into a contract solely for the carriage of mails. Our payments in this respect ought not to be regarded as payments for trade purposes. Whilst I consider that trade should be encouraged in every legitimate way, I am of opinion that that encouragement should be given in the form of special subsidies. It is undeniable that other lines of steamers are now entering into competition' with the mail companies, as, for example, the White Star and the Lund and Aberdeen lines. I believe that the public attention which was directed to this matter by the recent negotiations with the Orient Steam Navigation Company has resulted in much good. Before they were threatened with opposition in the Australian trade, the mail steamers were receiving f d . per lb. for the carriage of butter to the old country. The new shipping companies are now carrying it from Melbourne for f d . per lb., a reduction of 50 per cent., and are guaranteeing a temperature of 20 degrees throughout the voyage. As a result of this competition, the Orient Steam Navigation Company and the Peninsular and Oriental Steam Navigation Companyhave made a big reduction in their charge. They have offered to reduce it to 7-i6ths of a penny per lb., and to maintain a temperature of 30 degrees throughout. Thus, I contend that the publicity which has been' given to this matter, instead of exercising an injurious effect on the Commonwealth, has actually been productive of substantial benefit. Recently I saw, in one of the English magazines, an article which was written by a member of the Natal Legislature, setting out the great disadvantages under which that State suffered by reason of the excessive freight charges that are levied by some of the English companies trading there. It is evident, therefore, that other countries are suffering from the evils to which I have referred. I am very loth to support this motion. I do not consider that it is a fair one. To me it is strong apparent that the Orient Steam Navigation Company, finding that they practically controlled the situation, drove as hard a bargain with the Commonwealth as they could. I only support the motion on the understanding that the present contract will be terminated as speedily as possible, and that in the interim the Government will endeavour to secure more reasonable terms than they have obtained hitherto. I trust that the investigation which a Select Committee is at present conducting into the wisdom or otherwise of establishing a State owned line of steamers between Australia and the old country will elicit information which will be of benefit to this Parliament when it is again called upon to deal with this matter ",56
270,Mr CULPIN,Unknown," I am very pleased that the Postmaster-General has agreed to accept practically the amendment of the honourable member for Kennedy. There is just one matter to which I should like to direct attention. The honourable member for North Sydney has stated that, in accepting the proposal of the honourable member for Kennedy, we shall be creating a precedent. In my opinion, all the legislation which has been enacted by this Parliament is in the nature of a precedent. So long as any proposal submitted for our consideration is a fair one, I do not think that we should fear to create precedents. The amendment outlined by the Postmaster-General will, in my opinion, do justice to all the States, and 1"" hope we shall come to a vote upon it as soon as possible.",57
271,Mr MCDONALD,Unknown," I desire to withdraw my amendment. I understand that"" the Government are prepared to meet the views embodied in that amendment by submitting a proposal which will put the matter in a more constitutional form. think that the amendment which will be proposed by the Minister of Home Affairs will accomplish everything that is desired by the House. Amendment, by leave, withdrawn. Amendment (by Mr GROOM) proposed - That the following words be added to the motion:-""bu t is of the opinion that without varying the original contract with the Commonwealth Government, arrangements should be made by which, during the continuance of its sent contract with the Queensland Government, the Company, in consideration of the payment of a sum of 3s. 8d. per mile by the Commonwealth, shall agree to carry postal matter between the ports of Sydney and Brisbane, and shall reduce the payment to be made by the Queensland Government by a corresponding amount, and also that arrangements should be made for making similar provision in the case of Tasmania."" 2",57
272,Mr SYDNEY SMITH,Unknown,Macquarie) The honourable member for Bland and the honourable member for Canobolas have blamed the late Government because they did not accept the offer of Messrs. Scott Fell and Company.,57
273,Mr BROWN,Unknown,"I said that if the Government had not had the offer of that company in reserve, they would have been in a much worse position.",57
274,Mr SYDNEY SMITH,Unknown,"I pointed out by interjection that Messrs. Scott Fell and Company merely undertook to provide us with a service, either to Colombo or to Bombay, and to tranship our mails thence to some port in the Mediterranean. For this service they asked £106,000. I cannot understand why honourable members, who insisted upon a white ocean policy, should favour the Government entering into a contract which provided for the maintenance of a white ocean policy only as far as Bombay or Colombo, and which contemplated the transhipment of our mails at one of these ports to steamers manned by black labour.",57
275,Mr WATSON,Unknown,I have said that I was not in favour of the transhipment proposal at all.,57
276,Mr SYDNEY SMITH,Unknown,"I have'already shown the honourable member the correspondence relating to the matter, and he must be perfectly satisfied that the offer of Messrs. Scott Fell and Company provided for the transhipment of our mails.",57
277,Mr BROWN,Unknown,"Does the honourable member imagine that the Orient Steam Navigation Company would have reduced its tender to £120,000, if it had not been for the offer of Messrs. Scott Fell and ComI pany ?",57
278,Mr SYDNEY SMITH,Unknown,"My .honourable friend knows very well that I used Messrs. Scott Fell and Company's offer for all it was worth. I was engaged in a business deal with a keen, shrewd body of men, and was determined to use all the ammunition at my disposal to secure the best possible bargain. In order that Messrs. Scott Fell and Company's offer should not be made public, I took care that it was not even preplaced on the official records for a time.",57
279,Mr FISHER,Unknown,The honourable member was playing a game of bluff with the joker against him.,57
280,Mr SYDNEY SMITH,Unknown,"At all events, it would have been unwise to disclose the"" exact terms of the offer. I have been blamed for failing to inform the public at the outset that it was an unsatisfactory one; but, in the circumstances, think that I should have been justified in doing so. As to the complaint which has been made with reference to the conditions of the contract now before us, I wish to explain that I said Postmaster-General. nothing to the company as to the terms that we desired to impose until knew that I was on solid ground. My first desire was to ascertain the bedrock price at which they would be prepared supply this service, and when I had suca ceeded in inducing them to reduce their demand to a subsidy of £120,000 per num, I said, "" If we give such a subsidy it must be subject to certain conditions."" The conditions are concessions. that obtained, in addition to the reduction £[30,000 per annum, on the original debut mand.",57
281,Mr THOMAS,Unknown,What were those concesnet to accept. sions ?,58
282,Mr SYDNEY SMITH,Unknown,"I have aling ready dealt with them. I think the PostMacquarie master-General will agree with me that the conditions sought to be imposed by the Orient Steam Navigation Company had for been accepted, the Government might have been called upon to pay an additional £120,000 per annum.",58
283,Mr WATKINS,Unknown,Does the honourable member say that the offer of Messrs. Scott Fell and Company would not have been accepted under any conditions?,58
284,Mr SYDNEY SMITH,Unknown,"It was not undesirable acceptable, firstly, because of the subsidy demanded, and, secondly, because it was for a transhipment service. I thought we ought to have a through service - inadvisable",58
285,Mr FISHER,Unknown,What was the objection as to the transhipment?,58
286,Mr SYDNEY SMITH,Unknown,"The general entirely opinion is that we ought to have a through service for mail and other purposes, and that our mail steamers should be fitted refrigerating machinery. A transhipment service would be unsatisfactory from every point of view. In the first place with such a service we should be unable to assist producers to convey their perishable prowealth duce to the markets of the old world, secondly, there would be uncertainty as to the prompt delivery of mails.",58
287,Mr THOMAS,Unknown,Ha d the matter been left in the honourable member's hands by his leader something better might have sulted.,58
288,Mr SYDNEY SMITH,Unknown,It was not I do not taken out of my hands.,58
289,Mr THOMAS,Unknown,"In the correspondence we find letters addressed "" Dear Reid,"" although up to a certain point the letters from the company were addressed to the",58
290,Mr SYDNEY SMITH,Unknown,"The honourable I member need not trouble, himself about my position in the matter.' In view of the speech made by the honourable member for to Bland, which indicated that he was under misapprehension as to the exact position of affairs respecting Messrs. Scott Fell and anCompany's offer, I felt it necessary to make an explanation. I should have been glad if a satisfactory offer could have been were submitted by that company, because it of would have been an Australian service; I found that the offer was one that I could not reasonably recommend the Cabi",58
291,Mr FISHER,Unknown," The closremarks of. the honourable member for clearly bear out the statement if which I made at an earlier stage in the debate that this contract was largely one the carriage of perishable produce. When I asked the honourable member why, as Postmaster-General, he did not see his way to accept Messrs. Scott Fell and Company's offer, he replied that it would have involved the transhipment of perishable produce. .",58
292,Mr SYDNEY SMITH,Unknown,And of mails.,58
