speakerGroups,Speaker,Title,text,pageNumbers
98,Mr KNOX,Unknown,"Howeve r that may be, I would urge that it is incumbent upon us to pass the motion, in order to endorse the action taken by the late Postmaster-General in the midst of very serious difficulties. some persons may consider that the subsidy to be paid to the Orient Steam Navigation Company is excessive, I venture to say, with a full .knowledge of all the circumstances, that no better arrangement could have been made. I do not think that the Postmaster-General should - have agreed to submit the contract for ratification by the House. I should not have pursued such a course. However, in view of the fact that the Government have acted out of generous consideration for the House, I trust that the motion will be passed. I hope that the Postmaster General will regard it as his duty to place the whole business upon such a footing that he will be able to tell us at an early date what our relations are likely to be with the great mail companies, which have done so much, good, not only in connection with the carriage of the mails, but also the carriage per of our perishable products to the world's markets. I hope that the amendment relating to Brisbane will be so shaped that I shall be able to support it.",28
99,Mr HUTCHISON,Unknown, I should not vote for the ratification of the contract entered into with the Orient Steam Navigation Company but for the fact that I recognise that at present we have practically no alternative. I do not agree with the honourable member for Kooyong when he says that we are at the mercy of the greatest shipping combine in the world.,28
100,Mr KNOX,Unknown,I did not say that.,28
101,Mr HUTCHISON,Unknown,"The honourable member said the London Shipping Conference was the biggest shipping combine in the world, and that it was not possible for to fight against it . If that be the case, it is high time that we made a trial in that direction. The Orient Steam Navigation Company recognised that they were in a position to squeeze an unfair subsidy our of the late Government, and they took full advantage of the circumstances. The honourable member for Kooyong said that the Government were placed in a difficult position in taking a stand against the demand of the Orient Steam Navigation Company, because they were conscious of the fact that thousands of pounds were being lost by the mercantile community owing to the disruption of the mail service. I should like the honourable member to tell us by whom these losses were incurred. As a matter of fact, the chief disadvantage arising from the disorganization of the mail service was experienced by a few traders, and I do not see why the general public should be taxed in order to make up for any losses that might be incurred by them. If a few individuals benefit to the extent of many thousands of pounds by the maintenance of an efficient mail service, they should be made to contribute proportionately towards the subsidy.",28
102,Mr BRUCE SMITH,Unknown,Every child sends a postcard benefits by the mail service.,29
103,Mr HUTCHISON,Unknown,"I have a fairly vice was not disorganized very long. large circle of acquaintances, and during the whole of the time that uncertainty prevailed with regard to the mail service I did not hear a single complaint of inconvenience having been caused. I admit that some traders who desired to obtain an advantage over their rivals might possibly have sustained losses; but if they make so much money out of the mail service, they ought to be called upon to contribute more largely towards the subsidy. I am sorry that the late Government did not take up a firmer stand against the Orient Steam Navigation Company. If a proposal had been made to expend on the education of the people any such increased amount as is represented by the larger subsidy, or to pay bonuses for the encouragement of our manufactures, it would have been met with no stronger opponent than the honourable member for Kooyong. The honourable member says that we have been squeezed by the Orient Steam Navigation Company upon this occasion, and that we cannot help being squeezed again. We are told that this benevolent company has come here to lose money, and yet it has built ship after ship in order to maintain the service between London and Australia. This course would not be adopted if great loss had been incurred. In my view, the big shipping companies are doing very well. They would have abandoned the trade long ago, especially in the face of tha competition of highly-subsidized foreign steamers, unless they had been making a fair profit. If they had been making a loss, they would Have been driven out of the trade altogether. It-has been represented that there was a great outcry on the part of the general public in favour of the present contract being entered into with the Orient Navigation Company, but t h j agitation in that direction was confined to a few individuals whose interests were being endangered. Why should the general community be called upon to pay a heavier mail subsidy for the advantage of a few traders ?",29
104,Mr BRUCE SMITH,Unknown,"Every man who has a cow, and sends butter to the English market, derives a benefit from the service maintained by the mail steamers.",29
105,Mr HUTCHISON,Unknown,"I admit that he does to some extent; but I maintain that we have heard too much about the losses inwho curred by traders and others owing to the disorganization of the mail service. I would point out that that serI am tired of hearing general statements as to the losses that were incurred by the commercial classes, and should like more definite information upon that point. If a member of the Labour Party dared to utter the statements which have been made here by representatives of the trading community they would be accused of making the most extravagant assertions. All these statements have been made with a political object. The desire has been to decry the party which has the interests of the whole community at heart",29
106,Mr BRUCE SMITH,Unknown,How about the matter of preference?,29
107,Mr HUTCHISON,Unknown,"It seems to me' that under this contract the trading community obtain all the preference. The ordinary citizen does not care whether or not his letters from England are a day or two longer in transit. I claim that if we had adhered to the poundage system the inconveniences arising under that system would have righted themselves within a fortnight. I do not think that the Postmaster-General should have consented to making Sydney the final port of call. We all know that as soon as the mails reach Adelaide they are placed on the train and brought on to the eastern States. If , under the contract, Sydney and Melbourne are to be included as ports of call, every State should be larly treated. Under existing conditions, I say that Queensland and Tasmania should be given the benefit of the mileage rates to which reference has been made. I shall be quite willing to do what is only an act of bare justice to those States. I blame the late Government, after having agreed to pay an increased subsidy-in the interests of the trading community, to whom we are told the saving of a couple of days in the transit of their mails represents an advantage of hundreds of thousands of poundsfor not insisting upon a faster service. For my own part, I hope that the inquiry which is now being made into the advisability of establishing a State-owned line of steamers will result in some proposal being adopted which will have the effect of preventing any company from unduly squeezing the people of the Commonwealth. In my opinion, the Orient Steam Navigation Company is being paid an exorbitant sum for the service which it renders. I trust that Tasmania and Queensland will be reimbursed by the payment of mileage rates between Sydney and Brisbane and Melbourne and Hobart respectively. I am willing to support the ratification of the contract, but I hope that it will be terminated at the earliest possible moment.",29
108,Mr BRUCE SMITH,Unknown," - It Sutherland, must be quite evident to those who have listened to the honourable member for Hinding marsh that, in introducing him into the twentieth century, the Creator made a take. He ought to have lived in the of Dr Johnson, when there were no railThomas ways, no telegraphs, and no steam-engines, because, it appears to me, that he moves amongst a circle of people who do not care whether their letters to England occupy month or two months in transit. The state of things which he would enjoy is well de^ picted in one of Richardson's novels, i which the writer describes how a letter which comes from abroad is handed round the village, to be read by every one of inhabitants. But it must be recollected that we are now living in the twentieth century, and the honourable member's indifference the rapidity with which mails are carried to and from England has no application the conditions under which we are deliberatperform ing here. This is not an occasion for a speech, nor is it appropriate that any honourable member should take, upon himself the vindication either of the position of the Postmaster-General or of the Orient simi- Steam Navigation Company. I am not here as an advocate of the Orient Steam Navigation Company, or of any other company j neither am I anxious to vindicate the action of the Minister. I am here as a man of some business knowledge to treat this question in a business way. In the first place, we have to recollect that there is a very great distinction between a proposal to make a contract and a proposal to ratify one which has been already entered into, which has been fully discussed, and finally agreed to by the head of that branch of the Administration with which it is concerned. If every contract made by a Minister had to come before Parliament for ratification, and if its ratification involved a long debate, during the course of which the whole of the details regarding the profits made by the contractor were gone into, we should have very little time for anything else. In the speech which was delivered by the honourable member for Barrier, we were treated to a long dissertation upon shipowning. That honourable member has made a discovery. He has shown that he has mistaken his avocation, and that he ought to have been a ship-owner. Nothing less than the managing directorship of the Orient Steam Navigation Company or of the Peninsular and Oriental Steam Navigation Company, as a colleague of Sir Thomas would fit him, because he has - succeeded in about three months in compassthe whole science of inter-oceanic shipowning. Within that period he has accumismulated a mass of information which men days of more modest temperament, like Sir Sutherland, require a life-time to acquire. I have a little knowledge of shipowning, an3 that knowledge has made me very modest in forming opinions as to the a cost of running these large steamers from one part of the world to another. But the honourable member for Barrier has it all at n his fingers' ends. I am only surprised that one of these large companies has not endeavoured to secure, his services at a high its salary, just as New South Wales secured those of the late Mr Eddy to take chargj of its railway administration. It was once to said of a member of the House of Commons that he was prepared at any time to to take charge of the Channel Fleet, or to an operation for stone whenever long it should be required of him. It seems to me that there are some honourable memthroughout bers in this House who are prepared at any time to throw a flood of light upon any subject under heaven, and to take part in the settlement of any question upon quite as insufficient knowledge, perhaps to the great injury of the State. honourable member for Bass spoke in a very cocksure manner of the unreasonableness of the subsidy which is being paid under the present mail contract. I confess at once-as an illustration of the modesty which some years of shipping experience may produce in a man-that I do not myself feel capable of determining prepared whether or not that subsidy will comnotice pensate any company for carrying mails, in addition to cargo, from Australia to the old country. No member of this House can say whether £120,000 will show a profit to any company until he knows how much cargo its ships carry in the same year, what freights they receive, what cidents befall them, what is the amount of for the work. their insurance, what is the number of passengers they carry, and the expenditure that is incurred in their repair. It is culous for an honourable member to speak tenders. with the definiteness that characterized the statements of the honourable member for Bass. Another honourable member declared that the contract price was a monstrous The question which we have to consider not whether we should enter into this tract if we were asked to do so today. is like a case in which the temporary of the firm, in the absence of his principal, has entered into a contract. He has said, effect, "" I will make a contract with until the head of the firm returns, and, course, it will be subject to his approval."" In the same way, the Minister who this contract was wise enough to limit a term of three years, of which it has two and a half years to run, so that it terminate contemporaneously with the tract entered into with the Peninsular Oriental Steam Navigation Company by the British Government. It will then open to us to say whether we shall have fleet of our own as suggested, or be tent to call for fresh tenders. I think will be admitted that it is quite sible for any Government to enter into detail concerning the reasonableness the payment in every contract it In order to avoid special work having be undertaken by persons whose regular business demands their full attention, system of tender has become current the world. A man who is very much occupied in a particular business may discover that he requires a commodity which it will not pay him to obtain at first hand. We know very well that such a man calls for tenders; he puts all who make it their The business to produce that particular commodity into competition in order that he mav secure the lowest price from them. That is a system which applies not only to Governments but to all forms of business enterprise. If we take, for instance, the Trades Hall-and I go straight into the camp of those honourable members who are to settle all creation at a moment's",30
109,Mr MAHON,Unknown,Com e and stay with us.,31
110,Mr BRUCE SMITH,Unknown,If I did I might upset the serenity of the institution. Can it be said that if the Trades Hall tomorrow desired to refloor the whole of its rooms it would buy timber and nails and do acthe work itself? It would call for tenders,31
111,Mr THOMAS,Unknown,"At Broken Hill, we built ridia hall, costing £6,000, without calling for",31
112,Mr BRUCE SMITH,Unknown,"I can quite understand that the people of Broken Hill might resort to such methods when the one. people of Melbourne would not do so. It is is well known, however-and the House only conneeds the hint to recognise the fact-that This all business men-and certainly every Gohead vernment-mus t trust to competition to supply those requirements which they in cannot regularly undertake for themyou selves. Every public Department calls of for tenders for whatever it requires. Whether it be railway iron, bridge made work, or telegraphic apparatus that is it to needed, tenders' are called in different only parts of the world, and the Government will has to be content to accept the lowest that conit can obtain. That was done in connection and with the. mail service. There are at present something like fifteen large companies be - man y of them possessing steamers compea tent to carry out this service-engage d in the conAustralian trade; and the Ministry had on it two or three different occasions invited tenimposders in order to obtain something which every was considered necessary for the Common-of wealth. We know from experience that makes. had they been inviting tenders for to the supply of railway iron, locomotives, cement, or some other commodity the which every Government requires in large quantities, Ministers would have accepted the lowest tender, unless they felt that there was some improper influence operating which made the tender a grossly unreasonable one. That is the business aspect of this question. The Deakin Administration, in which the honourable member for Denison was Postmaster-General, called two or three times for tenders for this service, and, notwithstanding the keen competition between the many companies possessing steamers capable of engaging in it , they found it impossible to obtain an offer that was satisfactory to them. If we are to frequently adopt the course now being followed, we shall never have done criticising the reasonableness of the charges made for Commonwealth supplies. Some honourable members have been condemning the combination of ship-owners. "" It is an outrageous combination,"" was one expression that I heard.",31
113,Mr MCDONALD,Unknown,"Hear , 'hear.",32
114,Mr BRUCE SMITH,Unknown,"What has become of the consistency of those who would stand here until the judgment day in defence of trades unionism? Trades unionism is a combination of men who wish to maintain an increased price for their labour. That is an allowable aim. I have always justified trades unionism, just as I have justified an association of bankers or a merchants' r in g ; but if we justify unionism in one form, we have no right to cry out against a number of ship-owners because they put their heads together and say, "" We wil form a ring, and maintain the freight rates between this place .and that."" If we denounce one form of combination, let us denounce all forms. Do not let us denounoe the banker or the shipowner, or the merchant, unless we are prepared also to denounce the journeyman who enters into a combination-with his fellows to give an artificial value to his particular commodity. The fact rem'adns, however, that there is no effectual shipping combination. That has been proved by the effect of the Sea Carriage of Goods Act. I - anticipated, some months ago, in this House, that the combination of ship-owners trading to Australia was so perfect that when that measure, which abolishes the conditions on the back of bills of lading, came into operation, the combination would raise the freights. That has not been the effect of the Bill . When I made further inquiries, I found that the ring was not a complete one-that there were two or three recalcitrant companies that were so formidable as to make it impossible to seGure that complete combination which would enable them, as I had anticipated, to raise the freights.",32
115,Mr MAHON,Unknown,"The honourable and learned member was, for once, mistaken.",32
116,Mr BRUCE SMITH,Unknown,"The results show that I was mistaken. After the Bill became law, I discussed it with shipping people, because my own prediction had been falsified, and I wished to learn how it was that the shipping companies had not succeeded in coming together as I had anticipated. We are told also-and I think that this is a confusion of ideas of which we ought to rid ourselves-that in calling for tenders for a mail service Ave ought in all cases to stipulate for conditions such as are contained in the present contract, in relation to the carriage of produce. I cannot see why, because Parliament wishes to have mails carried for the postal sen'ice of Australia, we should have regard to such commercial considerations. There is no more reason for stipulating that the mail steamers shall make proA'ision for carrying butter, sheep, rabbits, or any other commodity, than there is, for arranging with the proprietors of coaches carrying mails in country districts to carry parcels, luggage, or passengers. If Ave stipulate for the carriage of butter and other produce on our mail steamers, why should we not insist upon provision being made for the carriage of first, second, and third class passengers? I haA'e always felt that this question of commerce should be left to shape itself among the commercial community. I go further, and say that there is no need to enter into a contract for mail steamers to go beyond Adelaide, the first port of call, from which Ave can carry our mails by rail faster than by the steamers themselves. What interest haA'e Ave in entering into a contract for the extension of the sen'ice beyond Adelaide? What concern is it to the people of Australia generally-som e of-whom live far away in the interior-whethe r the steamers which carry our marls to Adelaide go on to Melbourne, Sydney, or Brisbane for cargo and passengers ? If there AA'ere a railway connecting Fremantle with Adelaide, there Would be no obligation on the postal authorities to arrange a contract for the steamers to go beyond that port. The moment the mails were landed there, the purposes of the Department Would be sen'ed, and the rest of the vrork carried out by these companies Would be subject to the laAVS which regulate supply and demand, subject to the competition of other companies engaged in the Australian trade. I should like to refer to the honourable member for Barrier, who has introduced into this debate-in which it is somewhat out of place-anothe r instalment of his Commonwealth ship-owning scheme. He is so thoroughly good-natured, and so ready to listen to the views of those who disagree with him that I could not say anything cruel with regard to His scheme; but to my mind, his theories are of the crudest character. The honourable member has not learned the alphabet of the subject which he has attempted to master, and with respect to which he is seeking to assume the role of teacher to the House. In discussing his scheme a few days ago, he made a most elaborate calculation upon the basis of 3 per cent, for interest, but he entirely omitted a 5 per cent, allowance for depreciation. That had not occurred to him.",32
117,Mr THOMAS,Unknown,That is not fair.,33
118,Mr BRUCE SMITH,Unknown,"The honourable member admitted that fact, but he said, with becoming unsophistication, "" We will add another 5 per cent."" In working out his little sum, he appeared to have altogether failed to allow for rates of marine insurance, which are a most important factor in calculating the gross or net profits of a shipping undertaking. I do not wish to spend much time in discussing this phase of the question, but it seems to me that the honourable member is very much in the position of a man who is anxious to read Homer in the original, but has not yet learned the Greek alphabet. The more he studies the questions of ship-owning, shipbuilding, and ship-running, the more modest will he become in explaining or even in forming views on these matters. I offer this observation not in a patronizing spirit, but as the result of a fair amount of shipping experience. There is one other question with which I desire to deal. The contract has been closed, and is submitted for our ratification upon the basis that the mail steamers shall call at Fremantle, Adelaide, Melbourne, and Svdney. I agree with the sentiment that has been expressed, that if we are going to engage the vessels of the company to do something more than bring the mails to the first port of call, from which they may be sent on more rapidly by rail than by steamer, no one State should be deprived of the privileges which are obtained for the Commonwealth generally. The Government proposal is only a repetition of that which was made in regard to the High Court. Some honourable members contend that Melbourne should be the headquarters of the High Court, as of every other Commonwealth service, and that litigants from all parts of Australia should attend the sittings of the High Court in this city. There are other honourable members who contend that the High Court should sit only in Sydney. I am opposed to both contentions. Every man, woman. and child in the Commonwealth contributes directly or indirectly to the maintenance of the High Court, and also to the cost of the oversea mail service, and if the people of Queensland contribute to the cost of a mail contract which covers a service that is not necessary for the purposes of the mails, the people of that State have an equal right to participate in it. But whether the making of Brisbane a port of call can be incorporated in the present contract is a question which only the Minister can answer. His particular knowledge of this contract should enable him to settle all doubts in that regard. I believe that it can be done. If the Orient Steam Navigation Company are prepared to allow their vessels to go on to Brisbane for an additional sum of £ 2 6 . 0 0 0 per 'annum, the Postmaster-General should have no difficulty in inducing the company to agree to the insertion of a new clause which will embody the payment of that increased sum, and so make the contract one of wider scope. It follows, I think, as a corollary to that proposition, that, on the grounds of equity, the people of Queensland should have allowed to them in some way-there are plenty of cross-accounts in which to make the allowance-the difference between the £ 2 6 , 0 0 0 which they are ready to pay to induce the Orient Steam Navigation Company's steamers to call at Brisbane, and the sum which would represent the - per capita contribution of the State to the total cost of the service.",33
119,Mr AUSTIN CHAPMAN,Unknown,What about Tasmania ?,33
120,Mr BRUCE SMITH,Unknown,I do not think that Tasmania asks for any similar arrangement.,33
121,Mr AUSTIN CHAPMAN,Unknown,The representatives of Tasmania have done so.,33
122,Mr STORRER,Unknown,Yes .,33
