speakerGroups,Speaker,Title,text,pageNumbers
73,Mr AUSTIN CHAPMAN,MINISTERIAL TRAVELLING,"That will a suit 'me. Mr W. ELLIOT. JOHNSON - Will it.suit the country? "" Mr AUSTIN ""CHAPMAN suit the country, too. ' But who'is to .'decide whether the .railway is to go to beyan,. aridto'Rungendore, .too? Mr 'SCULLIN - Could , a .""Committee, decide'the matter? .. Mr...AUSTIN 'CHAPMAN - A Comtor.y,-and.the mittee, iwith .time .totgoi into the matter,-, advised by surveyors-and engineers, - would House. be..in. a - betterposition .to judge. The people in,the Territory, .who .have iseJditheir land, ..think ..that .the .Government are'-going io-treat .them, badly, though. they.will be treated well - j- Mr - W.. ELLIOT - JOHNSON afford any serious-mistake atftheffeegirming. r Mr - EENTONf-A5We, cannot lafford.to much money there at all. . Mr AUSTIN CHAPMAN;-In that interjection..may ;be the (kernel - of -.wbati.has been.; called "" political rgerrytmanderiing "" ; a .lange -.section .of\honourable .'members may - nbt- - be in favour of-j-spending any .money there. .An, unfortunate feature is.that-'the - residents in: the Territory/ who are deeply 1 interested, have no representation here; they have.to pay taxation,-.and yet haveuio - voice in the.expenditure-.of the-money. Mr ^.KING O'MALLEY. There 'are -400,000.people at Washington* who-have no : representation. - Mr AJUSTIN CHAPMAN -^Does the Minister, say that - the people-jin' the Terri; tory - should' have norepresentation ? "" Mr KING 0*MALLEY -^We could not have 2',ooo"".peoplei - representedson the-'-'floor as: against - 30,000' people,-'unless-- at it . in the the'Bar 1 of the House. .alterai-' Mr - AUSTIN CHAPMAN - If is - an anoniiily that there - should be taxation-witharid I am-surprised .at J most of<the people in''the Capital area would be supporters-of the present'Government. ' The Federal' Capital is - going' to 1 cost a - few'millions,- - arid --we - ought to 'start I am properly, - and 'have some continuity .of policy. The' officials in the Territory - at the.jQueanpresent do .not know'""how long they may : remain there ;- and so the thing-goes on. I ; give/the'Minister .t>f 'Home Affairs credit away for 'doing' splendid' work, - and'the* founda: tions, ,so far,'are-reaHy good; but'trouble is. ahead-unless something further - be '- done: I suggested'the-other.'day that the Secretary 6f )the Home-Affairs' Department 'would 'be '-very - goodman''toplace in charge on' the 1 spot. Mr KING O'M'ALLEY -^-I am sending him up there. 1 to-.take /diatge'-iater on;-' he - It will will be administrator. Quean- ! Mr - AUSTIN ''(SHATMAN- --That .is all I ;am>.asking cfor. /The 'people"" in""'the Territory - are - entitledto-- somesystem »of local - government. ,My' suggestion^ is- - that we-hrmp Maw Guinea, ithe'-Northern TerriFederal Capital ;ateaitogether, ; and and ^give them -.a . (representative - lin '-ttfae Mr KING O'MALLEY - The 'whole,i*>i members: of''this-. Parliament: xepresent' 'the I hope that people of these Territories. - Mr AUSTIN iGHAPMAN- -^That - » -^We :carmot all-«Mery .well.",24
74,Mr FISHER,MINISTERIAL TRAVELLING,What - does' Ihe 'hbnoraWe spend member -.suggest? <A .'-member 'in (this House ? Mrv AUSTIN - CHAPMAN - Yes y for tSe'.Territories - I have-mentioned-:,24
75,Sir JOHN FORREST,MINISTERIAL TRAVELLING,"How many electors - would there be? M!r.i KING . O'MALLEY - About ; 2,000/ the..;Federal Territory..",25
76,Mr AUSTINCHAP MAN,MINISTERIAL TRAVELLING,"There - are 1,700 or'i,8oo-in the-'Federal area.already, Orbost? and, according to ""the Minister, there .will presently be 17,000-or 18,000. However; itv is not a question of numbers ; if we have a Territory, anomaly that taxpayers there should Western. Australia.:to the.Capital. have no say in regard to the. public - expenditure. Why should these peoplebe taxed? The Minister of Home Affairs his told us' that he is making tife-Territory,-- and 'that - the resumption o* land will pay. I believe-the Minister'will make moneyout of theTerritory, but''the men out-of whom-he is making it'ought-to have some say in this House with regard to taxation. If we' are not to have a Commatter, in a systematic, way. mittee - or - Commission to decide - on* route of the railway from theCapital to the coast, the Minister should have the je* ment. ports on the-different routes laidon the table of the House, so that honourable mempost-offices... bers can seefor themselves - which is-the best. We cannot decide on a railway without the fullest information. - Three different routes 'have been proposed' from the Capital'to-Jervis'-Bay. MV - KING-0!M-ArEEY.r-We'-hav decided to run the railway from Quean? beyan up to the Capital. Mr AUSTIN ' ' CHAPM""ANY- I . think the Minister has done well in . that ; , but who are "" we "" ? ' Mr KING O^MA'LLEY - The Govern-: ment.. Mr AUSTIN CHAPMAN . - It is-not the .function of the Government to decide on railway routes .without - giving the.House an opportunity of >discussing, them. Mr FISHER. - Fro m .Queanbeyan? .",25
77,Mr AUSTIN CHAPMAN,MINISTERIAL TRAVELLING,"I did; not say from Queanbeyan. Mr FISHER,-That- , is alL th&'Minister of Home Affairs spoke of... Mr AUSTIN.. CHAPMAN?.*-There is only one - possible; route -, for - that - rail a sbeerline; frOKL-Queatibeyan, torthe-Capital) Mr KING : O/MAfetEY-.i-We : will start the..railway,-from. Jervdsi.Bay tor.the Capital iat- .psesentii, Mr AUSTIN . CHAPMAM-Ito,shoul d besstarted .as.sooB as possible.;- The: trouble is, that., the. Minister:.!is i a .regulaerautorsat in i the.? Federal; Territorv;; He decides;.what - ; cmd<B%Mm^-BMiZ. 21-43 isstoi b&'done and\'what is in of to be> danei I . object:-'toi the> system, which' is, backSomething has been said- - about the-gauge of> oun railways: Has.the Minister no in-intention-, of connecting the-Federal Capital : up with Melbourne,.Adekii.de,-and the W est ?. Is-, thereto be no connection with Yass or It would--notj take-much to con-: nect the .'railway' up. from Oirbost to .Bombala -- The-:different-lines should be cow nected-up in. such a;way as-.to give-a direct it "" is . an run 1 through fnonr South. Australia', and Big questions like this require handlingv'ini.a proper business-like. way -. Mr KING O'MALLEY;-Shoul d :we have 1 money out of a uniform gauge? Mr AUSTIN . . CHAPMAN - I anr - nat keen on'-ther gauge, though, personally,"".I like-the .'gauge of'm,y<>own State. However;. we!-ought* to :do .something definite,' and the only thing to do'is to tackle-the 11 wish to irtf the dorse/: what: then honourable member : for Grey .has. said .about, the' Postal Depart* j Some consideration ought to 'be given to those - in. charge of .small allowance - They - are . badly p a i d ; and there are thousands of them, in Australia. It r is all very-welhto talk, about spending a - lot of -.money,, but where are.we to get the money from..? If we go. on in the way 1 vve-are going af present,, we.shall soon.be e filially in the Bankruptcy Court.  orable' member provide..the expenditure-for a - railway from. Jervis Bay to the Capital.?",25
78,Mr AUSTIN CHAPMAN,MINISTERIAL TRAVELLING,"Does the honourable member, think that the money for all these-works is to come out of re? venue? I am not. keen on public borrow-. ing,.but it is an:absolute impossibility for the Government to . meet their present en? gagements in the way of defence and other work? without borrowing 'moneyI t is of-.noi use. to createa 'great, national .debt tobuyships, that will be obsoletein ten year* j. and,, in. my opinion, the people of this country, are-nearly up* to the limit, as regards. - taxation.. Everything is: on the rise,;: and . thei time, willcomer when - the 1 wa-ynpeople will begin to think that:.the policy of - the. icountry - is - - spoliation - It is - time not we-.called.a halt: andrasked ourselves where wer are> goinga We .eertairdy cannot go - on with: this expenditure* out: of'revenue only: Let-sthe Government, formulatersome idefinire scheme * fori the ; Federal Capital;: and-./let usi-have ^somebody - inrcontrot-.there; Give theresidents a system of locai governmenti I do not say this unkindly towards those who are in charge there now, because they have done very well. - Mr KING OMALLEY - If we had acted any differently, we should have spent too much money in administration. That is to the danger in Australia-that too much money is spent at the top.",25
79,Mr AUSTIN CHAPMAN,MINISTERIAL TRAVELLING,"The MinSouth ister cannot be charged with spending much money there. There is an impresLoans sion abroad that, owing to the agitation Victoria, the Minister is slowing down in clared outside the State. this regard.",26
80,Mr KING OMALLEY,MINISTERIAL TRAVELLING,No ; it has no effect on me whatever.,26
81,Mr AUSTIN CHAPMAN,MINISTERIAL TRAVELLING,"I did not believe it , because we have the Minister's public promises; but the impression is gaining ground throughout the Commonwealth. People do not seem to realise the importance of the Federal Territory yet. We have there nearly 100,000 acres of good land, yet the Minister goes down to Liverpool to buy land for a depot for horses. Mr KING O'MALLEY - Because near Sydney, where the men are. That is the big city.",26
82,Mr AUSTIN CHAPMAN,MINISTERIAL TRAVELLING,"The money ought to have been spent in the Federal Capital. The curse of this country is the going near the big cities. The Federal Capital is too important a matter to monkey with, or to handle without some continuity of policy, and some definite system of control. Washington is run by a Commission. Mr KING O'MALLEY - They with one man, and it was only in i860 that the commission system was adopted.",26
83,Mr AUSTIN CHAPMAN,MINISTERIAL TRAVELLING,"Then let us start with a one-man system at the Federal Capital. Queanbeyan is on the watershed of the Capital, and the water supply for the Capital will be polluted. Are the Commonwealth Government going to find the money to do all the sewerage works necessary there to prevent this?",26
84,Mr KING OMALLEY,MINISTERIAL TRAVELLING,The New South Wales Government have to do it j I think that is in the contract.,26
85,Mr AUSTIN CHAPMAN,MINISTERIAL TRAVELLING,"They say they have not. It would be unfair to ask the Queanbeyan taxpayers to do it ; the New South Wales Government ought to do it, because they would not let Queanbeyan be included in the Federal Territory, and they would insist on the Capital being where it is - law Mr KING O'MALLEY - If they would give us the catchment area at Queanbeyan we would do it .",26
86,Mr AUSTIN CHAPMAN,MINISTERIAL TRAVELLING,"That is another of the big questions that will, have be tackled; but the biggest is the ques-' tion of the representation of the 2,000 people in the Territory. Under the New Wales law, the State Savings Bank too cannot lend money outside the State. have been made to residents inside in the Federal Territory, which has been deThe bank has notified the people there that they cannot renew the loans, and cannot give them fresh, ones.",26
87,Mr KING OMALLEY,MINISTERIAL TRAVELLING,A r e the privatebanking corporations of Australia treating the people there in that way ?,26
88,Mr AUSTIN CHAPMAN,MINISTERIAL TRAVELLING,There is such uncertainty that they will not touch them.,26
89,Mr KING OMALLEY,MINISTERIAL TRAVELLING,"How can there be any uncertainty when , they are the same people, under the same flag, and living in the same country ? it is",26
90,Mr AUSTIN CHAPMAN,MINISTERIAL TRAVELLING,"It is the duty of the Government to see that these people are not penalized. I believe the Prime Minister will look into the matter, as he has promised to do. The Commonwealth Savings Bank should give the same privileges inside the Territory as the State Savings Banks have given in the past",26
91,Mr FISHER,MINISTERIAL TRAVELLING,They will certainly get them.,26
92,Mr AUSTIN CHAPMAN,MINISTERIAL TRAVELLING,"The Prime Minister says that in all good f a it h ; but what about the man with a loan of ^2,000 started on his property maturing next month, and unable to get it renewed because the Territory has been declared outside New South Wales borders ? His home will be sold up.",26
93,Mr FISHER,MINISTERIAL TRAVELLING,"The credit of the Commonwealth is good enough for him, I think.",26
94,Mr AUSTIN CHAPMAN,MINISTERIAL TRAVELLING,"But he owes the money to the New South Wales Savings Bank, which says it cannot renew the loan.",26
95,Mr FISHER,MINISTERIAL TRAVELLING,I think we shall be able to accommodate him.,26
96,Mr AUSTIN CHAPMAN,MINISTERIAL TRAVELLING,"The people in the Territory will be delighted to learn that the Prime Minister will come to their rescue. There should not be any favour about this matter, nor should they be dependent on the whim or will of any Minister. We might have another Treasurer who would not look at the matter in a reasonable light. It should be a matter of that the people in the Territory should have the same rights and privileges as those in other parts of the Commonwealth.",26
97,Mr CANN,MINISTERIAL TRAVELLING,Why not have a branch of the Commonwealth Bank there?,27
98,Mr AUSTIN CHAPMAN,MINISTERIAL TRAVELLING,"Perhaps the Prime Minister has that in his mind now. He says very fairly that he will meet any genuine cases that arise. It is a great anomaly that 2,000 people living in the Federal Territory should be Ishmaelites, as it were. They have to apply to the Minister of Home Affairs to know what they are to pay for water or lighting, and they have nothing settled. A man inside the Federal Territory does not know what he is to get for his land, who is to fix the values, whether he will have to go to the High Court to fight the matter if he does not like the values, or when he will be and at the same time he cannot go anywhere else. This matter must affect us as Australians, because it involves a great principle. I urge the Government to do something to give these men, not only representation, but some consideration in the shape of a definite policy, .so that be handicapped in any way, or have withheld from them the privileges which other citizens enjoy.",27
99,Mr ARCHIBALD,MINISTERIAL TRAVELLING,"Hindmarsh) [3.55]. - The interest displayed in the welfare of the Northern Territory by honourable members opposite, and more particularly by the honourable member for Darling Downs and the honourable member for Parkes, must be refreshing to the House and gratifying to the residents of the Northern Territory, as well as to all who are anxious for its advancement. Standing by itself, it would appear to be very good, but we have had the further information given to us that an agreement has been made by the Governments of New South Wales and Queensland, under which it' is intended to construct in New South Wales a 4-ft. 8£-in. line, to connect with the Queensland system, so that ample opportunity will be afforded for the trade of the Northern Territory to ""flow to its nearest port,"" and so forth. This information is deeply interesting, and I hope that it will be very carefully considered by the Government when they are determining their policy iii regard to the Northern Territory. As to what that policy is to be, we have only the very slight indication furnished by the appearance on these Estimates of an item of ,£5,00.0 to provide for a survey for a proposed extension' of the Pine Creek railway to the Katherine River - I do not [79] say that the Government have made up their minds in. this respect, but straws in the air sometimes indicate which way the wind is blowing. What I do hope is that there will be no"" scheming on the part of any of the States to obtain an advantage in respect of the trade of the Territory before the Territory itself is opened up. In the interests, not only of the Northern Territory, but of Australia as a whole, it is essential that the Territory should first of all be opened up and developed. I do not think it is going to be a sink for Commonwealth moneys, as the honourable member for Echuca has suggested; but it certainly will be if the State Rights' brigade ""gerrymander '' a policy for the purpose of diverting a trade that - is not yet created, but paid, which, after millions have been wasted, would probably be enjoyed by certain States against the interests of the rest of the Commonwealth. That sort of game is very amusing.",27
100,Mr JOSEPH COOK,MINISTERIAL TRAVELLING,What does the hon.they will not orable member mean?,27
101,Mr ARCHIBALD,MINISTERIAL TRAVELLING,"There seems to be much anxiety on the part of some members of the Opposition that, having regard to the arrangements that are being made between New South Wales and Queensland, the Territory railway line shall start from the north, and not in the south, where we have the highlands.",27
102,Mr JOSEPH COOK,MINISTERIAL TRAVELLING,"I know of no arrangement between New South Wales and Queensland. . . . Mr ARCHIBALD - The honourable member is one of the most innocent men in Australia; but I am very glad that the honourable member for Darling Downs and the honourable member for Parkes, in their thirst for knowledge, have given us the valuable information to which I have alluded. I sound a note of warning to the people of Australia, and earnestly appeal to the House to get above State Rights scheming, and to determine that the Territory shall be opened up in the interests of Australia as a whole.",27
103,Mr JOSEPH COOK,MINISTERIAL TRAVELLING,"Parramatta) [4.0] - I have no doubt that my honourable friend is very earnest, and very honest, straightforward, and outspoken. In short, I have no* doubt that he is the one man in the House who takes a ""broad national view "" of all these questions. Every one knows, however, that he has an eye on his own State all the time. Indeed, it may oe set down as a rule in this House that an honourable member who protests most vigoron ously, and, apparently, whole-heartedly, that some one else is taking a "" parishadding pump "" view, is, in reality, speaking his own mouth full of "" parish-pump"" water. Here we have another instance the kind. The honourable member has been attributing motives to the people of tain States and asserting that they want to ""gerrymander"" a railway, and that they desire to divert the trade of the Norththe present Administration. ern Territory from its natural courses. have heard of no such scheming and no such scheme. There is a natural anxiety on the part of the taxpayers that we shall begin our process of Northern Territory velopment on proper lines; that the work development shall start from some - centre which will give the Territory the greatest and freest access to the markets tralia, and so provoke reciprocal trade, which will help us. to look forward to time when it will be self-supporting, and a party. buttress to, rather than a burden upon, the rest of Australia. The honourable member should cease these ridiculous innuendoes his, unless he is prepared to furnish some substratum of solid information as to the existence of such schemes. I know of no such scheme as he suggests to the House, more by insinuation than by straight-out frank statements. What I do know is that we have a proposal by this Government to construct a section of the Northern Terriing tory railway from the north downwards. If that is to be the extent of the survey, appears to me that it will be a very ridicuhad lous one. Before entering upon a survey of the kind, the Government should have definite plans as to the route to be taken, and as to where they are going to look a way out. What is the good of carrying the Pine Creek railway to the Katherine River, unless we proceed further and know in what direction it is proposed to go? What is the use of merely carrying the way to the Katherine River, and so adding enormously to the already large debts have taken over in connection with the ritory? If all the produce developed by such a railway is to go up north, where will it go when it reaches there? are questions that we need to put to selves. If the honourable member would ask them, he would do very much better than he does by throwing out insinuations regarding representatives of other States, Territory. who may be just as patriotic as he - is to Australia as a whole. What motive can,we have but to develop the Northern Mr Josefh Cook. lines that will make it a paying proposition, and enable it to go on its own way to the material prosperity, with security, and safety of Australia? But to throw a proposal like this before of the House, as the Government have done, and to leave it without a word of excerplanation, is to be guilty of one of ' those mysterious actions which I do not pretend to understand in connection with Instead of I criticising his own Government, which he follows so slavishly and blindly-instea d of criticising the Government which are doing this apparently wooden-headed.thing de- - the honourable member tries to divert of attention to some one else. His own Government are responsible for what is being done, and that is the first fact to which of Aushe should direct his attention.",27
104,Mr ARCHIBALD,MINISTERIAL TRAVELLING,We should get a the worse policy from the honourable member's,28
105,Mr JOSEPH COOK,MINISTERIAL TRAVELLING,"There speaks of this great nationalist! There speaks the Caucus party devotee, who is covering up his own tracks as a blind, sordid supporter of this Government in anything and everything they do, whether it be against his State or not! There speaks the man who is trying to throw dust in the eyes of his own electors by referring in this insinuatway to membeis of others States, and accusing them of all the political crimes it in the calendar. The honourable member better look to himself. If any one is to blame for this patchwork businessif patchwork it be-hi s own Government most assuredly is. They are spending for money on a partial survey, and will not even give the House any explanation. They will not say what is in their minds. I suggest that the honourable member for Hindmarsh is grossly unfair in belabourrailing honourable members as he has been doing, while all the time his trouble U we nearer home in connection with his own TerCaucus and his own Government. This House ought to have a full explanation of the purpose of the Government with regard These to surveys of developmental lines. I am ournot so sure that I do not agree with my honourable friend, that we ought to begin at another spot rather than where we propose in our process of developing the",28
106,Mr ROBERTS,MINISTERIAL TRAVELLING,Does the honourable member think that we ought to start from Territory the south and go north ?,28
107,Mr JOSEPH COOK,MINISTERIAL TRAVELLING,"I did not say where we should start. The very first step we ought to take is to set the experts at work, and not to dictate to them as to where they shall commence their operations. I should select the best men I could get-me n in whose judgment I had the most implicit reliance-of the best calibre that could be obtained in the Commonwealth, and I would say to them, "" Find us the best route for developmental railways. Give us the benefit of your judgment as to where the survey should begin."" Instead of doing what the present Government are doing, I would ask them to direct me as being better informed-as knowing more about this business than I could possibly do owing to my want of training. In other words I would get about me the best ability I could command in the continent for the purpose of making proper surveys, and investigating the country through which those surveys passed. My honourable friend may well leave the Opposition alone in this matter. He will find that they are as patriotic as he is. He will find that they are just as ready as he is to observe the broad lines of the bargain that has been made with his own State-and made, as I think, much to the advantage of South Australia. He certainly will not promote his cause by making insinuations and attributing unworthy motives to men who are as anxious as he is that the Territory shall be developed on right lines, and quite as anxious as he is to do the best for the Commonwealth which we are all here to serve.",29
