speakerGroups,Speaker,Title,text,pageNumbers
350,Mr FISHER,MINISTERIAL TRAVELLING,"I should not be sorry if there was, but I do not think there is. no prejudices on my part, or on the part of the Government, will withhold from any part of Australia the necessary money to make its defence effective. Anis other item referred to was that of ,£45,000 towards the cost of establishing a Military beCollege for Australia. Last year, there honwas a vote of .£40,000, and' we spent ,£68,454. Was not that a laudable action two on the part of the Government, who disthat the revenue was available, and were able by means of the Treasurer's advance to provide an additional amount for New constructing the Military College?",54
351,Mr JOSEPH COOK,MINISTERIAL TRAVELLING,"HO W much is the with ""completed building estimated to cost?",54
352,Mr FISHER,MINISTERIAL TRAVELLING,"I think the total amount is provided for this year, or nearly so. We provided last year as much as we is thought we could economically spend. I am advised by the officers that the increased cost of material and work was the cause of this the chief part of the increase. Honourable been members are aware that during last year cost of material increased greatly,- and Honwould stand representative no sensible of the people by and say that, because the of labour and material increased, we should not go as far as we could if money the could be provided. Practically the same amount of work has been done by the extra amount of money that was provided. Surely that is a fair policy to carry.out?",54
353,Mr BRUCE SMITH,MINISTERIAL TRAVELLING,Can the Prime say whether plans of that expenditure have ever been put upon the table?,54
354,Mr FISHER,MINISTERIAL TRAVELLING,"I do not think they Ophave, but they can be if honourable memyears than have bers so desire.",54
355,Mr BRUCE SMITH,MINISTERIAL TRAVELLING,I should like to see them.,54
356,Mr FISHER,MINISTERIAL TRAVELLING,"I say on behalf of the Government that those, and all other plans that are desire3 by honourable members, can be seen, and copies laid on the table, if required. I think they have always been published, and issued to members.",54
357,Mr FENTON,MINISTERIAL TRAVELLING,Coul d not any member see them at the Defence Department if he so desired?,55
358,Mr FISHER,MINISTERIAL TRAVELLING,"Yes . It is obvious that honourable members can obtain access to them, but care will be taken that they are put on the table. If I remember rightly, they have been issued in the Gazette. Another item which has been much discussed is, "" Acquisition of sites for, and erection of mobilization store buildings and drill halls, towards cost, £80,000."" This arises out of an effective defence poiicy. It does not deal specially with cadets.",55
359,Mr BRUCE SMITH,MINISTERIAL TRAVELLING,Can we be formed where these halls are to be erected ?,55
360,Mr SPEAKER,MINISTERIAL TRAVELLING,The right honourable member will not be in order in dealing in detail with that matter.,55
361,Mr FISHER,MINISTERIAL TRAVELLING,I can make only a casual reference to the statement made by the Leader of the Opposition.,55
362,Mr JOSEPH COOK,MINISTERIAL TRAVELLING,"I rise to a point of order. I submit, sir, that on this report we may discuss any item that has been the subject of a resolution in Committee. May lays that down ""very clearly, and so long as the debate is relevant to a resolution in Committee of Supply, I submit that it is entirely in order. At page 627 of May's Parliamentary Practice we have the statement thatAccording lo existing practice, procedure upon a report of the grants made by the Committees of Supply and Ways and Means consists of debate strictly relevant to each resolution, is separately submitted to the House, raised either on the grant itself or on an amendment proposing a reduction thereof. The question is that the report of the Committee on a series of resolutions be now adopted, and I submit that we may refer to any resolution covered by the report, so long as the debate is relevant.",55
363,Mr SPEAKER,MINISTERIAL TRAVELLING,"The proper stage at which to discuss items in detail is in Committee. The honourable member must know that, while great latitude may be allowed in respect of a general discussion, an honourable member is not entitled, at the report Stage, to discuss actual details, which should have been dealt with in Committee. As to the question of relevancy, I have allowed ample latitude to every honourable member who has kept fairly within the - limits - but if I were to allow a detailed r discussion of items, there would be practically no limitation to the debate, and it is the* duty of the Speaker, whoever he may be, to control, in some way, the debates in the House.",55
364,Mr JOSEPH COOK,MINISTERIAL TRAVELLING,He is not entitled to shorten a debate.,55
365,Mr SPEAKER,MINISTERIAL TRAVELLING,"There has been no attempt on my part to shorten the debate, and I do not think that any action I might take to prevent an honourable member from discussing details at this stage would shorten the debate. If I were to permit a departure to be made from the practice which I have stated, however, 1 should open up a course the following of which would make it almost impossible to control the debates.",55
366,Mr FISHER,MINISTERIAL TRAVELLING,"I shall not depart, sir, in- from your direction. It will be suffirient for me to say that the amount to which reference has been made has been placed on the 'Estimates for purposes of utility, and to promote the efficiency of the Citizen Defence Forces. Military areas have been prescribed all over Australia, and halls and other necessary equipment will be required for the increased Citizen Forces. This item, as I have said, does not particularly affect the Cadet Forces; but it must not be forgotten that our Citizen Forces have practically been doubled. We had formerly about 20,000 men in our Citizen Forces, whereas we have now about 40,000, and this vote of .£80,000 will provide hall accommodation and. equipment necessary for mobilization throughout Australia. I regret that, owing to our anxiety to push on with the work of making efficient the Citizen Forces of Austraas it lia, we are not yet able to give as full details as I should like to be able to give in regard to this item; but it is well to remember that military areas have been prescribed all over Australia, and that I pledge the Government to expend this money in the particular centres where the greatest efficiency will be secured from its outlay.",55
367,Mr JOSEPH COOK,MINISTERIAL TRAVELLING,"All that we have asked for in regard to this item is that we shall be told what proportion is required for mobilization stores, and how much is required for drill halis - We have not asked for details.",55
368,Mr FISHER,MINISTERIAL TRAVELLING,"I cannot even give that information in detail to the honourable member. I take the full responsibility for the item in question. The Minister of Defence, after discussion with his officers, saw that the efficiency of the Forces would be greatly promoted by an expenditure of about ^80,000 during the current year on mobilization stores and drill halls.",55
369,Sir JOHN FORREST,MINISTERIAL TRAVELLING,"DO they not know now where these places are to be erected? Mr FISHER:-There is not sufficient to provide for their erection all over Australia. We are spending this year something like five and a half millions of money on our defence system, and we must trust the Department to expend a few thousand pounds where it is thought that the greatest efficiency will be secured in respect of the amount that is available for the purpose - w e ought to have an inquiry, and present",56
370,Sir JOHN FORREST,MINISTERIAL TRAVELLING,Then they do not know now where these places are to be erected ?,56
371,Mr FISHER,MINISTERIAL TRAVELLING,No .,56
372,Sir JOHN FORREST,MINISTERIAL TRAVELLING,"That being so, they need not have this money.",56
373,Mr FISHER,MINISTERIAL TRAVELLING,That is only the right honourable member's opinion.,56
374,Sir JOHN FORREST,MINISTERIAL TRAVELLING,I am simply stating the plan usually adopted in framing the Estimates.,56
375,Mr FISHER,MINISTERIAL TRAVELLING,"I take the responsibility for the course we are now pursuing. We mean to make the defence system efficient, and to secure that efficiency it be necessary to have drill halls in some parts of Australia and not in other parts. It would be paltry in the extreme for the representatives of one State to say that they objected to the vote because they thought that the greater proportion might be expended in another State.",56
376,Sir JOHN FORREST,MINISTERIAL TRAVELLING,The Treasurer does not know what he wants for the next eight months ?,56
377,Mr FISHER,MINISTERIAL TRAVELLING,The right honourable member does not do himself justice in speaking in that way.,56
378,Mr JOSEPH COOK,MINISTERIAL TRAVELLING,"And the Prime Minister - is not doing himself justice by calling names, instead of giving information.",56
379,Mr FISHER,MINISTERIAL TRAVELLING,"I do not understand the honourable member, but I am not blind to what I see. I am not blind to the tactics that are being pursued, but I am neither embarrassed nor intimidated. We intend to carry out our programme, and at the same time we shall give to the country all the information that we can. Treasury is open to any and every member. No one knows that better than does the right honourable member for Swan, and when the details at.the Treasury can be shown-as they have been shown by us in a way unknown in any other Parliament-to members of the Opposition^ the interests of the country cannot go very far astray. In the opening part of his speech, the Leader of the Opposition sought to .make much of a little incident in regard to the alleged inefficiency of workmen employed by the Government, and the demand that as soon as a suggestion of inefficiency or loafing ori the part of Government employees is made-as scon as it is suggested that men are not giving the Government an equivalent in labour for the pay they receive all the reports to Parliament. Parliament would cease to be a deliberative and representative body if that course were followed. The Postmaster-General being, sick and unable, unfortunately, to attend to his departmental duties, I brought down a categorical denial of the statements inquestion, together with a covering letter by Mr Bright, the Deputy Postmaster-General.. These are either official or they are not. Mr Bright as Deputy Postmaster-General' is as much responsible for the working of his Department as is the Minister, and in my opinion that which I produced was anmay. effective answer to the question raised. The Leader of the Opposition has had a long parliamentary experience, mostly as a Minister, but I venture to say that he was never a member of a Government to which the whole press of Australia displayed its teeth as it has done in our case. We have no chance of defending ourselves.",56
380,Mr JOSEPH COOK,MINISTERIAL TRAVELLING,Nonsense .,56
381,Mr FISHER,MINISTERIAL TRAVELLING,We have no chance whatever. The smallest point is seized-' upon and built up.,56
382,Mr SPEAKER,MINISTERIAL TRAVELLING,The right honourable gentleman is now going beyond the question before the Chair.,56
383,Mr FISHER,MINISTERIAL TRAVELLING,"I am certainly following the bad example of a leading parliamentarian, but I have no desire to come into conflict with the Chair. AH that I shall say is that in the history of this Parliament no Works and Buildings Estimates have been treated as those now under consideration have been. Never before have we had weeks of criticism such The as that to which we have' been listening lately. I am not complaining; I am simply making a statement of fact. If the Opposition think it wise to pursue this, course I shall not complain.",56
384,Mr SPEAKER,MINISTERIAL TRAVELLING,Order 1 . v ,56
385,Mr FISHER,MINISTERIAL TRAVELLING,"We hope to get these Estimates through as soon as possible, because ashas been stated many times already, we desire to send them to another place in order that they may become law, and that the works for which they provide may be proceeded with. The delay which is taking place can be avoided by the Opposition, and I say with the greatest courtesy that we shall be happy if the Bill passes through as quickly as possible, so that we may proceed with works necessary, for the defence and the development of this great country which we have the .honour to govern. - Mr KELLY (Wentworth) [9.22] - I had no intention of interposing in this debate, and I rise now only to pour a little oil on the troubled waters. astounded at the speech to which we have just listened. One might have thought thnt the Prime Minister was suffering under a sense of personal injustice, but all that the Opposition have wanted, and all that they desire is the information that on all prev'ous occasions has been readily afforded by Ministers when asking for Supply in respect of matters of this kind. We have asked for no more, ancl we are - entitled to no less. The Treasurer appeared to think that because it became - necessary for us to ask how certain amounts fitted in with general schemes concerning Australian defence, we were in some vague and indefinite way insulting him, so far as his capacity to reply is conr-e'-ned. I would no more dream of indicting the right honourable member's power? of exposition than I should dream of affronting that delectable sense of humour with which he so often delights the House. I wish to say to him, however, that we have never yet had from this Government any general statement as to how far they are committing themselves in matters of naval defence to which some of these items relate. Take, for instance, the vote for naval works. The Prime Minister thinks-h e is not quite sure, and does not think it quite fair to ask him to be quite sure-that the vote has something to do with the construction of new naval bases about the coastline of Australia. This system of navaJ bases is a new proposition, which was made in Admiral Henderson's report. We do not yet know whether the Government has endorsed that report. If it has endorsed it in to to we shall know in what direction we are tending. If it has not endorsed it beyond this particular section then we desire to know on what authority the Prime Minister is proceeding in this direction. For my own part 1I have some doubt that perhaps we may be following too blindly the example of the Mother Country in endeavouring to separate our naval bases from our ordinary mercantile ports. In the Mother Country it is essential to have mercantile ports and naval bases separate, because the constant movements of ships of war would interfere materially with the mercantile shipping. But oui vessels of war are not so numerous or ubiquitous that we need fear that their passing in and out of ports will seriously interfere with the ordinary shipping. I suggest this as a consideration worthy of passing notice, because every penny spent on naval bases I was which may he unnecessary could be better spent on the construction and arming of ships. Therefore we should be told what is the policy of the Government in this regard. But when we ask for information, our questions are regarded as insults, and our protests as a nefarious attempt to retard the passing of the Estimates. The Prime Minister referred to the vote for the Military College. I should be the last to wish to retard the passing of an item of that kind, because the establishment of the Military College was first suggested in this Parliament by me, and agreed to at my instigation. But I should like to know whether the money asked for is for new works, or to repair the blunders of the past year 9r two? It may be necessary for the rebuilding of the stables, which, apparently, were designed by an architect accustomed to the accommodation provided for horses on shipboard, since so little room was given that the horses could not flick their tails without upsetting the domestic economy of the edifice. These things have constantly to be done because of the departmental bungling under the auspices of this Cabinet of business men. There is another item of £ 8 0 , 0 0 0",57
386,Mr SPEAKER,MINISTERIAL TRAVELLING,The honourable member may not deal with separate items.,57
387,Mr KELLY,MINISTERIAL TRAVELLING,"I am doing so only by way of illustration. The Prime Minister told us that £ 8 0 . 0 0 0 is asked for to provide drill halls and mobilization stores. There are 200 military areas, and if each area is to get a hall, which is what I understood from his lucid explanation, there will be something like £ 4 9 0 for the site and building in each case. But, in addition, out of this amount, we are to have mobilization stores.",57
388,Mr ROBERTS,MINISTERIAL TRAVELLING,The honourable member has not read the Estimates.,58
389,Mr JOSEPH COOK,MINISTERIAL TRAVELLING,The Honorary Minister refers to the footnote.,58
390,Mr KELLY,MINISTERIAL TRAVELLING,"I am not dealing with the footnote, which, I take, it, is like the Honorary Minister himself, more or less under the influence of the Prime Minister, who has just stated that all the drill halls, with, I presume, their sites, and the mobilization stores, were to be provided out of this item. The Prime Minister, who, at this last hour, was going to afford us every information, though in a spirit that, to me, seemed hardly gracious,. has misled us, and we have to trust to the cryptic utterances the Honorary Minister for the correction of the wrong impression made upon our minds by his chief.",58
391,Mr ROBERTS,MINISTERIAL TRAVELLING,I am correcting the honourable member's ignorance. He has not read the Estimates that he is presuming to criticise.,58
392,Mr KELLY,MINISTERIAL TRAVELLING,"I am grateful to the honourable member; but there is no reason for his bitterness - The footnote says that the total estimated cost is £300,000.",58
393,Mr JOSEPH COOK,MINISTERIAL TRAVELLING,"How much of the money is to be spent on drill halls, and how much on mobilization .stores ?",58
394,Mr KELLY,MINISTERIAL TRAVELLING,"That is the question.. We still do not know how many areas are to'have drill halls, and how many mobilization stores are to be provided? The sum provided for training the levies under our new system is, according to the Minister's interjection, only about one-fourth of what will be necessary eventually. If we have to wait four years, what evidence is there of this determined haste to proceed with our military organization of which we heard a few minutes ago from the Prime Minister? I am the last person to desire to hold up the Estimates, but I want something in the nature of a reasoned explanation of them. Perhaps it is hopeless to expect - that from Ministers, though I should like a broad, comprehensive statement of policy in regard to the large question of Australian defence. Indeed, I despair of getting it from Ministers. The Prime Minister, in his hotheaded attack on the Opposition for having the temerity to ask questions, did not do himself or us justice. We are here to ask questions, to try to find out what is being done with the public's money. When we asked what Ministers are spending on themselves, there was an uproar; and now that we wish to know how they propose to spend money on big. public enterprises, we are threatened with a bludgeon.",58
395,Mr JOSEPH COOK,MINISTERIAL TRAVELLING,"This is only a trifle of £4,000,000.",58
396,Mr KELLY,MINISTERIAL TRAVELLING,"The spending of other people's money is always a trifling matter to a Labour Government. But we are the trustees of the public, to whom an expenditure of nearly £ 1 per head is a matter of importance. The people desire that their money shall be spent wisely; and it is the duty of the Opposition, a duty which will be determinedly faced, despite the bluster and bluff of honourable members opposite, to criticise lax methods of adof ministration, and to protest against the non-explanations which have disfigured this debate, and the discussion of the Estimates in Committee.",58
397,Mr FOWLER,MINISTERIAL TRAVELLING,"Perth) [9.36] - Whil e the Leader of the Opposition was speaking, Ministers were very loud and persistent in their assertions that all the information asked for by the Opposition had been given. I wish,' therefore, to draw attention to a specific instance to the contrary . I noticed with surprise that ,£5,000 is set down for the construction of a new General Post Office at Perth. On the. face of it, that is an absurd proposal. I wished to know what the plans of the Government are; what was its object in placing this item on the Estimates; whether there was any further development to announce; and when the building was likely to be taken in hand ? On these points, I have not yet received a word of explanation. The people of Perth and of Western Australia have been clamouring for this post-office for several years. Since it was promised, they have been awaiting impatiently the erection of the building. The site has been acquired, I believe, the Minister of Home Affairs having busied himself about the matter when in Perth recently. I understand that a plan was drawn- I saw a reproduction of it in a newspaper some time ago-in which the post-office was relegated to a sort of backyard, and was surrounded with shops and warehouses. That plan has been discarded, as it deserved to be; but we are yet in the dark as to what is to take its place. This matter is important enough to require more explanation than has been given. If an explanation is not forthcoming, I must take it that the Ministry are in the dark as to whatthey are going to do in the matter. The Prime Minister has indicated that, in the item for Naval Works, money is to be found for the creation of a naval base at Cockburn Sound, which, in the opinion of Admiral Henderson, is one of the most necessary and immediate requirements of the Comprepare monwealth. When constructed, the most important naval dep6t of the Commonwealth, and will greatly affect interests of the Empire. Yet. at this last stage of the consideration of the Estimates",58
398,Mr HIGGS,MINISTERIAL TRAVELLING,"Wit h some reluctance, I ask whether the honourable member is in order in discussing these details ? Informabe tion regarding the Perth Post Office, and the Cockburn Sound naval base, was given last night.",59
399,Mr SPEAKER,MINISTERIAL TRAVELLING,The honourable memthat ber is keeping in a general way to the tion.,59
400,Mr FOWLER,MINISTERIAL TRAVELLING,"At the eleventh hour, this important public work is referred to by the Prime Minister in the most casual way. He says that he thinks that a certain item includes money which is to be spent at considerable. Cockburn Sound. The Minister is evidently not quite sure.",59
401,Mr ROBERTS,MINISTERIAL TRAVELLING,The information was given to the honourable member for Darling Downs when we arrived at the item.,59
402,Mr FOWLER,MINISTERIAL TRAVELLING,"The Minister is very much befogged, because he is evidently sure what is to be done.",59
403,Mr ROBERTS,MINISTERIAL TRAVELLING,"It is not our fault if the honourable member was not here when the explanation was given. Hr. FOWLER - I am referring to the statement made by the Prime Minister togiven night, and I take it he has the most up-toinstead date information. I may have missed particular item, but I was very much surHome prised to hear the casual reference made it by the Prime Minister. If he is not sure what is going to be done Sound, do his officers know precisely what they are going to do? In the absence definite information, are we to assume the officers have asked for £200,000 placed at their disposal for naval works, with no definite plan or scheme to enable the country to get full value? If that-is not an unsatisfactory state of affairs, not know what is; and the Opposition are fully justified in asking for information. If the Government do not give the inforthey immediately' concern. mation, the country .will demand to know the reason why before long. [80] Question resolved in the affirmative. Resolution adopted. Resolution of Ways and Means, covering resolution of Supply, adopted. Ordered That Mr King O'Malley and Mr Hughes do and bring in a Bill to carry out the it will be foregoing resolution. Bill presented by Mr KING O'MALLEY, the and read a first and second time. In Committee: - Clauses 1 and 2 agreed to. Clause 3 (Appropriation of Supply).",59
404,Mr KELLY,MINISTERIAL TRAVELLING,"Wentworth) [9.45] There are grave reasons why money should voted with all speed for new works and buildings; and my only regret is that we have not a system whereby these accounts are presented much earlier in the year, so the Department may have the necesquessary money placed at its disposal at the earliest possible moment. Under the present system, the Minister of Home Affairs is placed in a very difficult position, and we can see that year after year amounts voted are not expended, those last year being very Mr KING O'MALLEY - There was not time to spend the money.",59
