speakerGroups,Speaker,Title,text,pageNumbers
201,Mr RYRIE,MINISTERIAL TRAVELLING,"It will have to be ""over the Katherine,"" because I saw none from lation by this route. Darwin to the Katherine, and I saw none at the Katherine. Is the railway ultilinked mately going from the Katherine down to Oodnadatta, in South Australia, or is it be situated. to be connected with the Queensland railtroops ways? In my opinion, the latter course should be followed. Although I know is an understanding or contract between Federal and South Australian Governments that the line shall be continued from nadatta to Pine Creek, no time is set down for carrying it out, even if there be a nite contract. To solve the problem of settlesending ment in the Northern Territory, we should without delay connect it with the greatest centre of population in Australia, and is Sydney. This can be done more expeNew ditiously than to make a connection with vented. Oodnadatta. The honourable member for Hindmarsh made rather a heated attack those members who dared to say that the railway should go anywhere else than through South Australia, but I hold that if we wish to encourage settlement in Territory we should give settlers there opportunity of reaching the best and biggest market in Australia. Sydney, as the most populous centre, would offer that market. We should construct the railway to connect with the Queensland system. I understand that there is some arrangement between New South Wales Minister of Works the Queensland Government to link up the New South Wales and Queensland railway systems. That connection would go out from Bourke by Hungerford and mory. The Queensland Parliament have already voted £fi,000,000 to extend their western railway system out to Camooweal. When that line was completed, and the connection with Bourke made, the Commonwealth Government would have only 640 miles of railway to construct from Pine Creek to Camooweal, instead of over 1,000 miles from Pine Creek to Oodnadatta.. If the line went from Sydney via Bourke, it would go practically through good country all the way, whereas from Oodnadatta a great part of the way would lie through a desert, where the rainfall is only 4J inches in the year. The best part of the country in the Northern Territory is the Barklay tablelands, which are adjacent to the western border of Queensland. I am told that the railway would pass through a magnificent stretch of country there, and I strongly advocate that no time should be lost in endeavouring to link up the Northern Territory with our greatest centre of popuFrom a defence point of view also, the Territory should be up with the most populous centre, because that is where the ""most troops will The greatest number of would be available in Sydney, and for that reason alone the route I advocate there should be adopted. Had the Nor'.hern the Territory been connected with the Queens-' land railway system during the last Ooddrought, it would have been of enormous benefit to the people of New South Wales, defiwho could have saved millions of stcck by them up into this country for agistment. If Queensland and the north had been linked up, > the present meat famine in that parts of the Commonwealth, particularly m South Wales, would have been preFrom Sydney, vid Bourke, to Darwin, by the route I have indicated, on the distance would be 2,173 miles, as against 2,966 miles if the route viaAdelaide were adopted. That would mean a saving of close on 800 miles for the people the of Sydney, and, surely, they are worthy of an some consideration. The distance from Brisbane to Darwin by rail would be 2,000 miles, as against 3,691 miles via Adelaide. Passengers by train from Rockhampton could reach Darwin by travelling 1,900 miles, as against 4,000 miles if they had the to go round by Adelaide. Passengers and from Melbourne to Darwin would have to travel 2,463 miles, as against 2,379 miles vid Adelaide, so that there would be very little difference for them. From Ad'elnide Toberby rail to Darwin, through Sydney, the distance would be 2,947 - miles, instead of 1,896 miles via Oodnadatta. The greatest number of people will be served by taking the railway to Sydney instead of to Adelaide. The census returns show the population of New South Wales and Queensland to be 2,252,000, as against a population of 1,724,000 for Victoria and South Ausr tralia, and it is this smaller number who would have a shorter distance to travel if the route were vid Adelaide. From - the point of view, therefore, of the greatest good to the greatest number, there can be no doubt that the line from Sydney to Bourke vid Camooweal to Darwin should receive the earnest consideration of the Government. There is, of course, the problem of the gauges, but that is for the Government to solve. If they are not able to solve it, they will have to make room for some one who can. We have a 3-ft. 6-in. gauge in Queensland. I asked the Railways Commissioner in Brisbane, some time ago, when Queensland was going to fall into line with the rest of the Commonwealth by altering its gauge from 3 f t . 6 in. to 4 f t . 8J in. He laughed, and said he had. not the slightest intention of altering it, adding, "" It will cost us £27,000,000 to alter the whole of our gauge.""",39
202,Mr FISHER,MINISTERIAL TRAVELLING,Was it Mr Evans who said that?  the Commissioners for Railways.,40
203,Mr FISHER,MINISTERIAL TRAVELLING,I suggest that the honourable member should verify that before he ,40
204,Mr DEAKIN,MINISTERIAL TRAVELLING,Probably he included the cost of the consequential alterations.,40
205,Mr RYRIE,MINISTERIAL TRAVELLING,He told me himself that it would cost that amount to alter the mileage of gauge in Queensland. I understood that that means every expense in connection with the alteration of the gauge.,40
206,Mr FISHER,MINISTERIAL TRAVELLING,I know the gentleman to whom the honourable member has referred. He is a very able engineer; but that is a ridiculous estimate.,40
207,Mr RYRIE,MINISTERIAL TRAVELLING,"-It is what he told me. He said, as we know, that it would cost far more to convert a 3-ft. 6-in. line to a 4-ft. 81-in. gauge, than it would to alter a wide to a narrow gauge. He pointed out that a great many of the curves would have to be altered if the Queensland railway gauge were raised to 4 f t . 8J in that tunnels, platforms, and rolling-stock would also have to be altered-and he SP<1 : distinctly that the cost would be that which I have stated. The problem is very difficult of solution; and I wish to ascertain whether the Government are doing anything to solve it? Are they communicating with Queensland? The difficulty must be accentuated as time goes on, for new lines are being constructed in New South Wales and Queensland every year.",40
208,Mr FISHER,MINISTERIAL TRAVELLING,The question hardly affects Queensland.,40
209,Mr RYRIE,MINISTERIAL TRAVELLING,"I understood the honourable member to say that it was proposed to build this railway on a 4-ft. 8j-in. gauge, and that we must eventually have that"" as the standard gauge of Australia.",40
210,Mr FISHER,MINISTERIAL TRAVELLING,"If the honourable member looks at the map, he will see that the Queensland railways run inland from the sea-board, and are in sections.",40
211,Mr RYRIE,MINISTERIAL TRAVELLING,"But if the North-western line in New South Wales is eventually connected with the western railways of Queensland, we shall immediately have a break of gauge. We should have another break of gauge if the Pine Creek line were linked up with the Queensland system at Camooweal; so that between Sydney and Port Darwin there, would be two breaks of gauge. The Government ought to endeavour to grapple with the question of uniformity of gauge. If Queensland is going every year to construct mile after mile of railway on a 3-ft. 6-in. gauge, we shall never be able to look forward to a solution of the question. I understand that conferences .have taken place, but that nothing definite has-been arrived at. Surely some'steps should be taken to bring about conferences of the States in order that finality may be reached. I have no desire to labour the question; but to survey a line from Pine Creek to the Katherine River is to start in the wrong direction. A complete and comprehensive scheme of railway construction in the Northern Territory should be mapped out for us. We should then be able to determine where a start should lie made, or we could leave it to experts to guide us in the matter. It seems to mc that this bit of a railway line is to be planked down, so to. speak, in the dark. The Government have no idea whether it is going to be carried on. or what is to be done in regard to the question of break of gauge. In short, these Estimates have been submitted to us on such vague information that it is difficult to know where we stand.",40
212,Mr GLYNN,MINISTERIAL TRAVELLING,"Angas) [5.59] - I hope that the Ministry, before coming to a decision with regard to the question of gauge, will get from experts a report as to what ought to be the standard gauge for Australia. They ought not to assume that the decision to construct the transcontinental railway on a 4-ft. 8J-in. gauge was a direction from Parliament that the Commonwealth Government, in agreement with the States, should make the standard gauge for Australia 4 f t . 8J in. I have no desire to repeat what I said when this question was discussed last year; but, having heard the honourable member for Parkes say that the 4-ft. 8j-in. gauge, in opinion as well as in fact, I suppose, is the gauge of the world, I feel it necessary to call attention to the last report on the subject of gauges. I refer to the report of the Irish Railway Commission, which sat in 1909. That very important Commission was appointed to consider the monopoly of private companies of transit, and to what extent it interfered with legitimate development. The English engineers who gave evidence then, as well as the Irish engineers, concurred in the statement that 5 f t . 3 in. was the best of all gauges. It was said that if the gauge of the railways in England could be changed from 4 f t . 8J in. to s f t . 3 in., the alteration would be made; but that they were faced with the fact that a tremendous bill would be consequential upon it. In America, where there are nearly 300,000 miles of railway lines, there is a very large mileage on a 4-ft. 8i-in. gauge running through forty-six or fortyseven States, and passing through some territories which practically rendered it impossible to act on the opinion of modern engineers that the wider gauge is the better from the stand-point of economy, as well as in other respects. I hope that we shall obtain some expert advice upon this matter, and not rest content with the advice of one or two engineers. I should be sorry in any way to impugn either the ability or the bona fides of any of the experts that have reported in connection with the Western Australian transcontir - tal railway ; but it would be a very grea. help to Mr. Deane himself to have the deliberate opinion of a conference, on which the Commonwealth as well as the States could be represented, called for the .«»ecial purpose of considering what should 1 'ihe standard gauge for Australia. The meeting of engineers, to which reference was made when this question was discussed If ' vear, was not called to give an opinio' in respect of the gauge to be adopte'. ferred incidentally in their report to the advisableness of adopting a 4-ft. 8 - in. L gauge; but I have reason to think some of. them would not endorse that view if they were called upon now to express a deliberate opinion. It is a mistake, without having the guidance of experts, to introduce another gauge in connection with the Northern Territory. There is already a 3-ft. 6-in. gauge line there, and some say that it should be continued on the same gauge with a view to linking it up with the railway system of Queensland. If the Government do decide to adopt the 4-ft. 8|-in. gauge, I hope they will follow the suggestion made by Mr Eddy, when Commissioner of New South Wales, that all rolling stock ordered should be capable, if necessary, of accommodation to the wider gauge. He recommended many years ago that a conference should be held to determine the standard gauge for Australia.",40
213,Mr BRUCE SMITH,MINISTERIAL TRAVELLING,Does the honourable member mean adjustable rolling-stock capable of being placed on either width of rail.,41
214,Mr GLYNN,MINISTERIAL TRAVELLING,"No . There have been various suggestions as to the use of a third rail, and so forth, but all have been passed by.",41
215,Mr BRUCE SMITH,MINISTERIAL TRAVELLING,The most important: part of Mr Eddy's report was that theconversion should be made a Federal expenditure.,41
216,Mr GLYNN,MINISTERIAL TRAVELLING,"A very good idea. I went specially from South Australia - in 1888 to see Mr Eddy. The South Australian House of Assembly, of which I was a member, had carried a motion submitted by me that a meeting of the Railwavs Commissioners of the States should be held to decide what ought to be the standard gauge for Australia, and I went to Victoria and New South Wales to ascertain what chance there was of that motion being acted upon. It was owing to the opposition of Victoria that action was not then taken. Mr Mathieson was then, I think, Commissioner for this State. At all events, Victoria did not acquiesce in the suggestion, and the result was that Mr Eddy's anticipation of a uniform gauge being adopted in about ten years' time was not realized. r There was no concert as to what should be the standard. Mr Eddy pointed out that if a standard gauge were decided upon, allfuture rolling-stock could be so made that it could be used on the wider gauge lines. I ask the Government to see that the They re- rolling-stock which they order for use on the Northern Territory railwavs is also capable of being used on a 5-ft. 3-in. gauge. There is no reason for the Government to believe that, because the House decided that the transcontinental railway should be built on a 4-ft. 8j-in. gauge, line across the continent to Port Darwin should not be built on a 5-ft. 3-in. gauge. The South Australian Government would probably be inclined to continue its 5-ft. 3-in. line to Port Augusta, and if the Commonwealth Government widened the 3-ft. 6-in. line to Oodnadatta, and eventually constructed-as they must, according to the moral, and what seems to be the legal, obligation-the line to Port Darwin on the same gauge, we should have one grand trunk line on a uniform gauge running from Albury right up to that port. There is nothing to prevent lines from Queensland and New South Wales being connected with that line either on their present gauge, as feeders, or upon what ultimately may be the standard gauge of Australia. I am asking, not that we should decide to adopt the 5-ft. 3-in. gauge, but that the Government should have a special inquiry on the subject. that they should not act upon a merely incidental reference to the question of gauge on the part of a Committee that was not appointed to deal specially with that question. A deliberate decision should be given in the light of expert advice.",41
217,Mr BRUCE SMITH,MINISTERIAL TRAVELLING,Does not the honourable member think that the question is settled so far as this. House is concerned ? The whole matter was discussed.,42
218,Mr GLYNN,MINISTERIAL TRAVELLING,No ; only in connection with the Kalgoorlie to Port Augusta railway. I have already said that we should not regard the decision then arrived at as a direction as to what should be the standard gauge for Australia. . Mr Bruce SMITH - A Commission of engineers has reported.,42
219,Mr GLYNN,MINISTERIAL TRAVELLING,"During the discussion, it was doubtless pointed out several times that if we adopted a 4-ft. 8£-in. gauge now, others later on, acting against their better judgment, might be forced to adopt 4 f t . 8J in. as an established Federal gauge. It was never said that because the Government were adopting the 4-ft. 8^-in. gauge for the Western Australian railway, therefore that gauge, without the guidance of a special conference, should be accepted as the standard for all Australia. In the light of modern evidence",42
220,Mr BRUCE SMITH,MINISTERIAL TRAVELLING,There was modern Commission.,42
221,Mr GLYNN,MINISTERIAL TRAVELLING,"A Conference of engineers, which met in 1903, incidentally expressed an opinion in favour of the 4-ft. the 8J-in. gauge. That opinion, however, was not based on a comparison of the merits of that gauge with other gauges.",42
222,Mr BRUCE SMITH,MINISTERIAL TRAVELLING,"If my recollection is not wrong, a Conference of State Railways Engineers-in-Chief met prior to the decision in this House, and reported in favour of a 4-ft. 8j-in. gauge.",42
223,Mr GLYNN,MINISTERIAL TRAVELLING,I did not know that.,42
224,Mr MATHEWS,MINISTERIAL TRAVELLING,There was a conference with some military gentlemen.,42
225,Mr GLYNN,MINISTERIAL TRAVELLING,I am not dealing with that inquiry.,42
226,Mr FISHER,MINISTERIAL TRAVELLING,There was another. The Railways Commissioners met in 1903.,42
227,Mr GLYNN,MINISTERIAL TRAVELLING,"There was no meeting at which any evidence was taken, or any deliberate and final expression of opinion given, in favour of a 4-ft. 8J-in. gauge. I know from experts in South' Australia, whose names I shall not mention, that if I urge some of them were asked for their deliberate opinion, they would recommend a 5-ft. 3-in., and not a 4-ft. 8J-in., gauge. Since 1903, the opinion of experts has been in favour of the 5-ft. 3-in. gauge. Mr W. ELLIOT JOHNSON - The 4-ft. 8iV-in. gauge was recommended for the railway to Western Australia.",42
228,Mr GLYNN,MINISTERIAL TRAVELLING,"There has been no recommendation following upon a proper investigation by experts. However, I shall not discuss the matter now, because finality cannot be reached at this stage; but I ask the Minister to follow the suggestion of the late Mr Eddy, one.of the most competent railway men, from what I have heard and read, whom we have had in Australia, and have the rolling-stock of the Northern Territory constructed so that it may be accommodated, if necessary, to another gauge, or have an inquiry in advance made as to the gauge which should be adopted for all Commonwealth railways. That should not take more than a month or two. It is not to be expected that the transcontinental line through South Australia should be delayed to enable a connection with Camooweal to be made. The transcontinental line was recommended for defence purposes by Major-General Edwards many years ago, and Lord Kitchener recommended it for the same reason, and also, I think, to promote development.",42
229,Mr ATKINSON,MINISTERIAL TRAVELLING,"Wilmot) [6.13] - The a question of gauge is of great importance to the Commonwealth, because in the near future *ve shall be constructing more than one long length of line; and if there is be the conference suggested by the honorto able member for Angas, it should be held very soon for its recommendations to be any practical value. If the Kalgoorlie to havefi""H Port Augusta line is constructed on the 4-ft. 8i-in. gauge, all the other Commonlay wealth lines will have to be on the same gauge I do not offer an opinion as to - whether the 4-ft. 8j-in. or the 5-ft. 3-in. gauge is the better; I agree with the honourable member for Angas that we should endeavour to choose the best gauge, because, in years to come, that will mean economy in working expenses. I wish to know something about the proposal to struct a line to the Katherine River For proposals the development of the Territory, the first thing to be done is the construction of transcontinental line through South Austrapart lia. I was opposed to the agreement which was made with South Australia, because the condition regarding railway construcnot tion, which, I thought, bound the Commonceive wealth too strictly; but, having made agreement, we must keep our bargain. Railway connection with the Queensland system may be a good thing; but we have agreed to construct the line from Oodnaare datta to Pine Creek. South Australia had the best of the deal, and has made agreement whose terms are not fair the Federal stand-point, as the rights the other States are not considered. favoured the transfer of the Northern ritory to the Commonwealth, though jected to the terms of the agreement; that agreement must be kept. We were told that there are about 80,000,000 acres of good wheat land just beyond the Macprosperity, donnell Ranges. If that is so, we should push the line north from Oodnadatta. is useless for people to try to grow without means of transport to market; if there is this area of suitable wheat we should provide a means of communication by extending the Oodnadatta line, which, at present, does not pay, district.",42
230,Mr SAMPSON,MINISTERIAL TRAVELLING,What is the rainfall there ?,43
231,Mr ATKINSON,MINISTERIAL TRAVELLING,"Te n inches, or a little more, which, we have been told those who ought to know, is enough wheat. It will be a long time before will be a large white population in the cal portion of the Northern Territory; by tapping this wheat land we might duce settlement in the southern Territory. The tropical districts north pf to the Barklay tableland have not been shown be suitable for agriculture and close settlement, and pastoral - occupation will not of greatly increase population. Already we to find interest ; t * t on ca, national n m m debt, national rieht. and, in addition, make a heavy annual outfor developmental purposes. Instead of sending officials to the Territory, it would be better to allow a railway to be built there on the land-grant system.",43
232,Mr WATKINS,MINISTERIAL TRAVELLING,"Why is the honourable member "" stone-walling "" the Works Estimates? . There are men waiting for work.",43
233,Mr ATKINSON,MINISTERIAL TRAVELLING,"I have waited for consome days for Ministers to explain these for the expenditure of ,£4,000,000, but have heard nothing from a them. Is the Katherine River line to form of the connection between Pine Creek and Oodnadatta; and on what gauge is it of to be constructed ? We, on this side, canlearn anything from Ministers, and rebut scant courtesy from them. If the that Prime Minister thinks that he can quieten the Opposition with threats, he is mistaken. I protest against the way in which the people living in the Federal Capital area being treated in regard to land matters. has About nine months ago I attended a depuan tation which waited on the Minister, but I from have to learn that those who put their of grievance before him have yet been properly I settled with. They have another grievance. TerThe Savings Bank of New South Wales, I obunder the Act, is not permitted to lend but money out of the State; and the settlers will be placed in an_ awkward position if they cannot renew their loans. In our great for which our friends opposite take all the credit, the price of money is It rising fast, and mortgagors are in for a wheat bad time in the near future. When in but Collins-street the other day I saw that a land, building society was offering 5 per cent, on deposits for two years, and I wondered to that what interest the borrowers from the society would be called upon to pay. Settlers in the Federal area will not be able to renew their loans on anything like the original favourable terms; and, therefore, the Commonwealth Government should come by to their assistance, and see that they are for not penalized. Their present position is there not due to any fault of their own. They tropihave not been paid for their land, although but the Prime Minister last year borrowed in- £2,000,000, of which .£600,000 was to be part of the used for that purpose.",43
234,Mr SCULLIN,MINISTERIAL TRAVELLING,"Does the honourable ber say the Prime Minister borrowed £2,000,000 ?",44
235,Mr ATKINSON,MINISTERIAL TRAVELLING,"The Prime Minister admitted it was a lo'an. The only way differed from the ordinary foreign loan was that we borrowed the money from ourcertain selves, and it is the first loan raised by Commonwealth.",44
236,Mr SPEAKER,MINISTERIAL TRAVELLING,"The honourable memfor ber, must confine himself to the question.",44
237,Unknown,MINISTERIAL TRAVELLING,Sitting suspended from 6.30 to 7.45 p.m.,44
