speakerGroups,Speaker,Title,text,pageNumbers
217,Mr JOSEPH COOK,Unknown,"May I remark that sufficient suggestions have already been thrown out to sink a ship? Mr KING O'MALLEY - Neve r mind, we shall finance this quietly after a time. I shall show the Prime Minister how to We had a lawyer in America called Hol man. He represented Wabash, in Indiana. He was in the United States Congress for forty odd years, and at the end of that time, when a young man defeated him, he said to the ""people, "" Had I served my wife and family half as faithfull y as I served my country, I should not be turned out now to starve."" Whenever there was a proposal for an appropriation to build a railway, or do anything to assist a railway company, Holman used to object, and he was called the watchdog of the United States Treasury; but when he was defeated, at the age of seventy, the people forgot all about the millions that he had saved them.",36
218,Mr THOMAS,Unknown,"Barrier) [3.1] serve that the salary of the Clerk of the House of Representatives has been raised from £900 to £1,000. I have no objection to this, because I think we have in him very able and capable man; but I notice that the secretaries of three very partments-Defence , Home Affairs, and wattle tree. External Affairs-ar e receiving only £900 sign. a year each. I think they occupy positions of equal responsibility, calling for equal ability, and perhaps the Prime Minister tion. could give me some reason why they are receiving less than the Clerk does.",36
219,Mr BAMFORD,Unknown,"Herbert) [3.2] Whilst a number of increases have been given in various"" directions, the Head Gardener of Parliament House grounds, who occupies what might almost be termed a professional position, is left year after year at the miserable salary of £ 1 6 8 While we are looking after officers superior positions, we ought, also, to after those in less elevated places.",36
220,Mr JOSEPH COOK,Unknown,"ParramattaPrime Minister and Minister of Home Affairs) [ 3 . 3 ] - I hope honourable members will understand that if I do not refer to all these matters I am making a note of them, and will go over them carefully afterwards. The heads of Departments mentioned by the honourable member for Barrier have all had very large increases since the Clerk had any at all, and the question of their increase, in any case, seems to have little or no relation to the increase in the Clerk's salary. It is hopeless to try to even up all these officers.",36
221,Mr THOMAS,Unknown,"I do not say that because one man gets £1,000 another ought to get the same, but these are three big Departments. do it . Mr. JOSEPH COOK - Then , frankly, there is no reason that I can allege why these men should be getting £ 9 0 0 while the Clerk gets £1,000, except the fact that the Clerk has been on his £ 9 00 mark for a much longer time than any of these have been on their £900 marks. I have no doubt that all these anomalies will be rectified in time.",36
222,Mr BOY D,Unknown,"Henty) [ 3 . 4 ] - I wish to ask the Prime Minister if the various officers whose salaries appear in the items under discussion are classified under the Public Service Commissioner's classification, and if there is a minimum and maximum salary to which they rise in ordinary grades?",36
223,Mr JOSEPH COOK,Unknown,No ; Parliament - I obcontrols its own officers.,36
224,Mr FENTON,Unknown,"Maribyrnong) [3.5] I do not want to be always quarrelling with the artist who. designed our coat-of a arms, but I remember remarking, when it was first brought out, that the kangaroo big Deand emu appeared to me to be up the It is a very inartistic deI t contains a bad kangaroo and miserable emu, and I ""do not know that even the wattle is a very true representaI t could easily be made a much more appropriate coat-of-arms. I notice that there is a tendency to use imported paper in preference to giving orders to our local paper manufacturers. In two of the States at least there are paper factories doing very important work, and I think the Prime Minister himself performed the opening ceremony of a large . manufacturing establishment a few Saturin days ago. I do not say that they go in look for manufacturing the class of paper I have in my hand; perhaps it is the rougher class of paper that they turn out, but there are paper manufactories in the Commonwealth which can turn out rjaper sufficiently good for any man in this House to write upon, and I trust that they will not be overlooked. Ever since I have been in the House, I have had a suspicion that a considerable quantity of the paper which we, who are supposed to encourage local industry, use here, is imported paper. Without making a charge against any particular official, I can say that there are officials who seem to have a considerable liking for the imported article in preference to the local article, and some members of the House have had to make very strenuous efforts to thwart their desires. We must give our own manufacturers a show, and I trust that those who seem to hanker after the imported article will be brought into conformity with Australian ideas.",36
225,Mr JOSEPH COOK,Unknown,"ParramattaPrime Minister and Minister of Home A f fairs) [3.7] --On last year's Estimates I made a criticism of the note-paper. find that each Department orders its own note-paper just as it pleases, with the result that the price of these papers ranges, so I am told, from about 9s. to over 40s. per l b . There seems to be plenty of room for standardization in that matter. already have a report in my office on the question, and hope to look, not only into the aspect presented by the honourable member for Maribyrnong, but also into the question of whether we cannot save a substantial amount on the item of notepaper alone. Division 3 (Parliamentary Reporting Staff), £8,042 .",37
226,Mr BOYD,Unknown,"Hetnty) [3.8] - I shall be glad of some explanation of why the travelling expenses of the parliamentary staff were £ 6 0 last year as against an mate of £ 2 5 , and why as much as £100 is appropriated for the same purpose this year? Mr JOSE PH COOK (ParramattaPrime Minister and Minister of Home A f fairs) [3.9] - The expense arises in connection with Commissions travelling on public business, while a large part of the extra amount is also due to the travelling expenses of an additional member of the staff who was brought from Western Australia. Although £ 2 5 was voted last year, £ 6 0 was spent, and I am afraid that even more will have to be spent this year.",37
227,Mr BENNETT,Unknown,"Gippsland) [3.10] I should have no objection to the expenditure of this money on the Parliamentary Reporting Staff if I thought that the circulation of Hansard reached to the extent that I desire it to reach. Will the Prime Minister take into consideration some method of altering the parliamentary system of reporting, so as to adopt a similar practice to that followed in South Australia, where the parliamentary debates are published by arrangement with the daily press? This would greatly enhance the value of the reports, and lead to a wider knowledge of political affairs in the Commonwealth, with corresponding benefits to the people and to members. Mr KING O'MALLEY (Darwin) [3.11] - The suggestion of the honourable member for Gippsland would be all righ t if we had a reporting staff in each State, but, unfortunately, the Melbourne papers would have the whole contract, and they do not circulate all over Australia.",37
228,Mr BENNETT,Unknown,"We can get over that difficulty. 1 Mr KING OMALLEY - The miners on the west coast of Tasmania read the little local sheet, and do not get the Melbourne papers. . I must protest against using their money to run a one-State show. I Mr TUDOR (Yarra) [3.12] - I trust that no such steps will ever be taken by this Parliament as practically to hand over the business of reporting our debates to any press organ by a subsidy arrangement. A far better way would be to popularize Hansard. We could have a daily Hansard in connection with the Government Gazette, and prin t our own advertisements in that publication. We spend a good deal in advertising in the daily and weekly papers now. I protest against the handing over of the estitask of reporting our debates to the press. I do not say that they would print what they like, because I presume they would have to publish full reports, but I prefer to have our own Hansard, under the direct control of Parliament.",37
229,Mr FENTON,Unknown,"Maribyrnong) [3.13] I do not think a sufficient number of copies of Hansard get into circulation. It is becoming a very expensive item to some honourable members to supply copies of Hansard to their constituents, and I really think a greater number of copies should be given to each member. It would not be very costly, and it would be giving extra information to the public which they are desirous of getting. A f t e r all, the people of this country are entitled to know exactly what the honourable members of the House are doing, and they cannot get that information from the newspapers of the day. Proposed vote agreed to. Division 4 (The Library), £7,425.",37
230,Mr TUDOR,Unknown,"Yarra) [3.14] - Wit h regard to the collection of Australian historical records, a type-written notice appears in the corridors today. and I presume in the rooms of all parties, that the volume is now available for honourable members on application to the Librarian. This notice ought to be sent to honourable members individually, as some of them otherwise may not see it, although., of course, it is no trouble to those who do see it to apply to the Librarian for a copy of this very valuable historical document.",38
231,Mr JOSEPH COOK,Unknown,"ParamattaPrime Minister and Minister of Home Affairs) [3.15] - I strongly advise every honourable member to make application for this volume. It is one of the most interesting publications that I have perused. Proposed vote agreed to. Division 5 (Refreshment Rooms), £1,192; division 6 (Water Power for Parliament House),- £200; division 7 (Electric Lighting Repairs, dec), £1,491; division 8 (Queen's Hall), £493; division 9 (Parliament Gardens), £524:, agreed to. Division 10 (Miscellaneous), £1,504.",38
232,Mr FENTOJST,Unknown,Maribyrnong) [3.16]. - Unde r this division I - wish to draw attention once more to the bad ventilation of this chamber.,38
233,Mr JOSEPH COOK,Unknown,I do not think it is half as bad as is made out.,38
234,Mr EESTTON,Unknown,"I do. The atmosphere may not hurt the Prime Minister, but it affects those who stick closely to their work in the chamber. The conditions are particularly bad when the galleries are crowded. My voice is not the same as it formerly was, and my constitution is not what, it was. The building must be nearly fifty years old, and though, no doubt, from an architectural point of view it is all right, from a ventilation point of view it is all wrong. The bad atmosphere in the chamber is largely responsible for the way in which business is sometimes conducted. I trust some notice will be taken of my protest, and that there will be an improvement.",38
235,Mr HANS IRVINE,Unknown,"I think this is of the best-ventilated chambers in the world. Mr KING O'MALLEY (Darwin) [3.19] - I would like to ask the Prime Minister whether it is not possible to increase the salary paid to the lift attendant. He draws £110 per annum, and that is not very much in these high-cost times.",38
236,Mr JOSEPH COOK,Unknown,I shall look into it.,38
237,Mr STUMM,Unknown,"Lilley) [3.20] - I would like the Prime Minister to consider the advisability of having a short recess in the middle of next session. Members representing Queensland, Western Australia, and, in*some instances, New South Wales constituencies, under present circumstances, are cut adrift from their homes, their constituencies, and their businesses for over five months, and. it would be a concession to them to get away for two or three weeks. Ministers might also be glad to avail themselves of the break in order to overtake the work in their Departments. Proposed vote agreed to. PBIME MINISTER'S DEPARTMENT. Division 11 (Prime Minister), £42,003.",38
238,Mr THOMAS,Unknown,"Barrier) [3.21] - A few days ago the honourable member for Grey asked the Assistant Minister of Home Affairs whether a caretaker in his Department had had his salary lowered by 7d. a day; and, though the Minister at first said that this was not the case, on a subsequent day he admitted having unr intentionally made a mistake, and said that he found the reduction had been made because the Public Service Corninissioner claimed that under the Public Service Act no temporary hand could receive more in salary than a permanent officer doing the same work. I am not anxious to raise the question of the reduction of this individual salary. I wish to raise a matter of principle. We are entitled to know the intentions of the Government in regard to the payment of temporary hands. The late Government framed a regulation that temporary or casual hands employed by Government Departments must receive the union rate of wages, or wages fixed by an arbitration award, and I am sure that the Prime Minister, unless he has very considerably altered his views, will be prepared to adone mit that any one employed by a Department casually should receive the wages fixed by an arbitration award, or the union rate of wages. However, the Public Service Commissioner pointed out that there was a provision in the Public Service Act providing that a temporaryhand must not receive more than a permanent hand doing the same work. We claimed that the concessions granted to the permanent hands should also he taken into consideration, just as a Judge in an Arbitration Court, when dealing with wages, always takes into consideration the fact whether a man is likely to get permanent work or merely casual work. For instance, when wharf labourers appear before an Arbitration Court they make a strong point of the fact that they should receive a higher rate per hour because they cannot secure continuous employment. If a wharf labourer were paid the same wage per hour as an ordinary labourer gets, he would have very little at the end of a week; in fact, although wharf labourers are paid per hour considerably more than a number of labourers in other industries are paid per hour, the weekly average earned by wharf labourers is not more than £2 per week. In the same way we pointed out to the Public Service Commissioner that it was a fair and legitimate thing that, in fixing the wages for casual and temporary hands, the concessions granted to permanent hands should be taken into consideration, and we laid it down that if any person employed by the Government enjoyed all the concessions, in the shape of leave granted to the permanent hands, he had no right to ask anything more for similar work than the permanent hand received, but that if he did not get these concessions it was not a fair thing that he should get exactly the same pay. I am anxious to learn what is the policy of the present Government in the matter.",38
239,Mr JOSEPH COOK,Unknown,"Our policy is merely to carry out the Act at present, seeing that we cannot alter it.",39
240,Mr THOMAS,Unknown,"If the Ministry take that stand, they will not be able to employ trade unionists. It will practically mean, not only that they are going to say that they will not give preference to unionists, but also that they are going to givfl absolute preference to non-unionists.",39
241,Mr JOSEPH COOK,Unknown,We do not desire tr. do that.,39
242,Mr THOMAS,Unknown,"Le t me explain the position. In connection with Government work a number of carpenters are employed temporarily. There are also permanent carpenters employed in some of the Departments, who are not necessarily paid the union rate of wage. Having entered the service a number of years ago they will remain in Government employ until they are sixty-five years of age. Each year they will enjoy three weeks* holiday, and they will be allowed six months' holiday after twenty years' service. The Public Service Commissioner takes these things into consideration in fixing their salaries. The carpenters outside the Public Service appeal to the Arbitration Court, and get their salaries fixed, not on the basis of permanent work, and not with consideration to the three weeks' annual holiday or the six months' long-service leave. In these circumstances, it is more than probable that their wages will be 6d., 9d., or Is. per day more than those received by carpenters permanently employed in the Department. That is why I say that if it is the intention of the Government to carry out the idea of the Public Service Commissioner, they will not be able to employ trade union carpenters, unless they pay them union or current rates of wages, or the wages fixed under an arbitratio» award.",39
243,Mr JOSEPH COOK,Unknown,We must carry out the law.,39
244,Mr THOMAS,Unknown,"For three years the Fisher Administration did what I think this Government should do, notwithstanding the Public Service Act.",39
245,Mr JOSEPH COOK,Unknown,The reply given to the question referred to related to a particular case. Are there any more in the same category?,39
246,Mr THOMAS,Unknown,"The question related to a particular individual, the reply being that, under the Public Service Act, a temporary employee could not receive more than a permanent employee.",39
247,Mr JOSEPH COOK,Unknown,Is this man still in the Service?,39
248,Mr THOMAS,Unknown,Probably .,39
249,Mr JOSEPH COOK,Unknown,"If he has been there long, why is he a temporary employee ?",39
250,Mr THOMAS,Unknown,"Temporar y and casual employees are on a different footing from permanent employees. However long they may have been in the Service, they may be dismissed at a moment's notice, while permanent men can only be suspended, and may appeal to a Board. I do not wish to raise the case of a particular indidivisions^-professional vidual; it is the principle with which am concerned. A carpenter who is not being paid the union rate of wage cannot remain a member of his union. The last Government got over the difficulty, with in the general division. the consent of the Public Service Commisthis sioner, by not giving to casual and porary men the holidays and other conhave cessions enjoyed by the permanent men, and allowing them extra pay, which made up the Wages Board award. If this Gohim vernment cannot do that, they are carryto ing non-preference to unionists to logical conclusion-that is, preference non-unionists. They may reduce the wages of office cleaners by 7d. a day, they cannot act in the same way towards carpenters, because the latter belong to strong unioD.",39
251,Mr JOSEPH COOK,Unknown,"I can only prothat, mise that I shall look into this matter.",40
252,Mr THOMAS,Unknown,"Every person, whether a unionist or a non-unionist, should have an equal chance of getting employment the Public Service.",40
253,Mr JOSEPH COOK,Unknown,"In the light of what the hehorable member has said, I reduced by 7d. per day. shall have the whole matter reviewed.",40
254,Mr THOMAS,Unknown,"I do not think that I am unreasonable in asking for an water runs and grass grows. answer on Monday or Tuesday, or, at rate, before the Estimates have beeu passed.",40
255,Mr JOSEPH COOK,Unknown,"I do not know about that. Surely the honourable memvice, ber will take the Word of a Minister. II am going away to-night in order to vote at Parramatta tomorrow.",40
256,Mr THOMAS,Unknown,"The Prime Minister must admit the importance of this matter to us. It may be that in the individual case that has been referred to the last us some explanation of this matter. Minister of Home Affairs paid the man 9s. a day on his own authority. The Opget behind the award. position does not ask that the temporary and casual employees of the Government closely into the matter. shall be paid at the whim of a Minister, but we say that such men should be paid the rates awarded by the Wages Boards applying to their trade or union rates. such rates are not recognised there is preference to non-unionists. Mr KING O'MALLEY [3.38] - I trust that next session the Prime Minister will introduce a Bill alter the basis of the 'Commissioner's authority and power, and to abolish the present system of classification. Public Service at present consists , clerical, and geneI ral. At the Federal Capital we found that those in the professional division would not associate with the clericals, and that the latter would not associate with those The result of classification is that we have a snobtembreeding class institution. We ought to in the Public Service only one class. Where you find in a Department a man of real ability, then you ought to promote regardless of whether or not he is able read Greek, L at in , or Sanscrit; its whether he can say how long Napoleon to prayed before ""going down the Italian side of the Alps, or how long Hannibal was but in Rome before he was defeated. Coming to the point raised by the honourable mema ber for Barrier, I wish to say that I gave these cleaners 9s. per day because I claim having regard to the cost of living, no one can live on less than such a wage. I gave them that wage, not because they were in a union- I do not think that there in is a cleaners' union-bu t because I regarded the rate as a standard one. These poor cleaners have since had their wages What meanness ! The permanent man in the Public Service has a position for life-as long as He has any every sympathy behind him, and every one encourages and loves him. He is in a close class corporation, but the casual employee, at the end of nine months' sergets the royal order of the boot. hope that the Prime Minister will take this matter into consideration, and bring down next year a Bill for the complete amendment of the Public Service Act .",40
257,Mr RILEY,Unknown,South Sydney) [3.43] I hope that the Prime Minister will give I do not think that he is going to try to,40
258,Mr JOSEPH COOK,Unknown,I am going to look I recognise the force of what has been said.,40
259,Mr RILEY,Unknown,We can take it that we have the Prime Minister's assurance that If he is not going to get behind the award ?,40
260,Mr JOSEPH COOK,Unknown,"I am going to see, as far as I can, that no injustice is done (Darwin) to these men.",40
261,Mr RILEY,Unknown,"If any injustice is done, to it will debar some of the best mechanics from offering for the Commonwealth Service. I am satisfied, however, with the The Prime Minister's assurance that he w i ll of three see that no injustice is done.",40
262,Mr HANNAN,Unknown,"Fawkner) [3.44] - I support of what the honourable member for Barrier has said, I would draw the Prime ister's Department. Minister's attention to the fact that Judge Heydon, in the New South Wales Arbitratio n Court, on several occasions has made an increase, as high as 25 cent., in the wages of what are termed casual employees in different trades. What a Judge in a Court of that description is prepared to give to those employed any form of industry, the Commissioner of the Commonwealth Public Service bers should be prepared to give to casual emthis ployes.",41
263,Mr TUDOR,Unknown,"Yarra) [3.45] - I have before me a political pamphlet entitled The Financial Carnival, which was written by the present Prime Minister. One well say, "" Oh, that mine enemy would write a book."" At page 28 of pamphlet, we have this statementThere is, for instance, a new Department created, called "" The Prime Minister's Departthere ment,"" and the sum of £50,000 is set down for the cost thereof. Last year the amount voted, for the first time, was the modest sum. of £24,000. This year there is a jump to £50,000. headings. That statement is made in respect of the financial year 1912-13.",41
264,Mr MCWILLIAMS,Unknown,We never wanted that Department.,41
265,Mr TUDOR,Unknown,"It is wanted, just as much as is a Public Works Committee. We now find the author of this very pamphlet increasing last year's Estipriation mates of the Prime Minister's ment from £50,800 in 1912-13, £83,458, an increase of £33,000, or about 66 per cent. This is the proposal of economical Prime Minister, the writer The Financial Carnival.",41
266,Mr MCWILLIAMS,Unknown,The Department was never wanted.,41
