speakerGroups,Speaker,Title,text,pageNumbers
0,NA,Unknown,"fflous? of flxeprcscntatibcs. Friday, IS December, 1913. Mr SPEAKER took the chair at 10.30 a.m., and read prayers. DEATH OF THEHON . C. E . FRAZER.",12
1,Mr SPEAKER,Unknown,"I desire to read tha following letter to the House:White Hart Hotel, Melbourne, nth Dec., 1913The Hon. the Speaker, House of Representatives. Mrs C. E. Frazer desiies to express ber Met) appreciation of the resolution of sympathy passed by the House of Representatives OD the occasion of the death' of her husband, and to convey her sincere thanks to the Speaker and members of the House of Representatives for the kindness they have shown her in her recent bereavement. SMALL - P OX OUTBREAK .",12
2,Mr JOHN THOMSON,Unknown,Some days ago I informed the Minister of Trade and Customs that it had been reported in the press that thoro had been a ease of small-pox at Thornleigh. Has the honourable gentleman any information on the subject?,12
3,Mr GROOM,Unknown,"I have received a communication from the Public Health Department, Sydney, in which the writer saysI am directed to inform you that a case of small-pox has riot occurred at Thornleigh, and it is not known how the press came into possession of incorrect information. NEW; HEBRIDES . - Mr FOWLER --At a meeting held in Melbourne last night to discuss the New Hebrides question, the statement was made by a gentleman who, I understand, is personally acquainted with the conditions existing in theislands that the death-rate among the natives employed on the French plantations there is 40 per cent, per annum. I ask the Minister of External Affairs to ascertain, if possible, whether the statement is correct, and if he finds it to be so, will he make representations on the subject to the I m perial authorities, and, through them, to the French Government?",12
4,Mr GLYNN,Unknown,"I have not seen or heard of the statement referred to, but I had recently before me, in the report presented to the Colonial Office, official figures relating to the mortality on the New Hebrides plantations. The figures were for a period ending 1911, but I do not think that they showed the mortality to be as great as 40 per cent. In some parts of the islands there has been lately a heavy mortality from measles. I shall make the inquiry asked for, and I give the House the assurance that every aspect of the New Hebrides question which affects Australia is receiving the closest attention. TEMPORARY CENSUS CLERKS.",13
5,Mr ARTHUR,Unknown,"I believe that it was understood that temporary census clerks who served for twelve months would, at the end of that period, be given three weeks' extra pay in lieu of leave of absence. Will the Prime Minister see that that is done 1 I have been informed that the pay has not yet been given.",13
6,Mr JOSEPH COOK,Unknown,"The matter has not come before me, but I am prepared to look into it . TOBACCO INDUSTRY . PRICES-IMPORTATION-CULTUR EI N  ister for Trade and Customs whether he has a statement to make regarding the letter sent out by a certain tobacco company to various growers of tobacco leaf in Australia ?",13
7,Mr GROOM,Unknown,"Yesterday afternoon several members representing the tobaccobilities growing districts joined me in an interare view with Messrs A . D . H a r t and kins, representing the British Australian Tobacco Company. We discussed with them the letter to which the honourable member refers, and as a result of the in terview they assured me that it is not the intention of the manufacturers to refuse to pay .fair prices for fair quality leaf; [152] that there is a fair prospect for the in dustry in the f u t u r e ; but that there is not sufficient good quality leaf at present produced. I was informed that there is only room for a gradual expansion in the industry, and that much of the local leaf is inferior, due to causes arising from the nature of the soil, climatic conditions, selection of seed, and preparation of leaf, but that attention paid to these matters would produce better results in quality. I have obtained several reports from our own officials, which I am forwarding through the Prime Minister to the Agricultural Departments of the States, to get the opinions of their experts on the subjects dealt with, and I hope to make a fuller statement to the House later.",13
8,Mr TTJDOE,Unknown,"Can the Minister, before the Estimates are discussed, inform the House what quantity of Australian grown leaf is used by our local manufacturers today, and what quantity was used ten years ago; and can he also obtain the same information regarding imported leaf? I think he will find that there is a big discrepancy.",13
9,Mr GROOM,Unknown,"I shall endeavour to get that information. The quantity of unmanufactured tobacco imported in 1910 was 13,586,845 lbs., the importation of 1911 being 14,900,520 lbs.; and of 1912, 15,035,532 lbs. I am informed that the increase is due to the fact that they are now storing tobacco here instead of in the United States, as formerly.",13
10,Mr AGAR WYNNE,Unknown,As good tobacco can be grown in Australia as in any part of the world. PAPUA.,13
11,Mr GROOM,Unknown,"In places where the - climatic conditions and soil are suitable, leaf of very good quality can be grown. Mr FINLAYSON ; - Will the Minister consider the advisableness of obtaining from Papua, through the Minister of External Affairs, a report on the possiof tobacco culture there? There exceptional facilities for growing toW i l - bacco leaf successfully in Papua.",13
12,Mr GROOM,Unknown,I shall do that. PUBLIC DEBTS BILL.,13
13,Mr FENTON,Unknown,"The Prime Minister, when he stated last night the programme for the remainder of the session, made no reference to the Public Debts Bill , which stands sixth on the business-paper. that important measure to be discussed this session ? If not, what action does the honourable gentleman propose to take during the recess regarding the transfer of the public debts?",13
14,Mr JOSEPH COOK,Unknown,It is not proposed to discuss the measure this session. We should like to have a further talk with the States on the debts question.,14
15,Mr FENTON,Unknown,Will there be a conference with the State Ministers? Mr. JOSEPH COOK : - If possible. OLD-AGE PENSIONS . ASYLUM .INMATES-STAT E,14
16,Mr JOSEPH COOK,Unknown,"Las t night, in stating the business for the remainder of the session, I omitted to mention that we desire to put through a small Bill providing for the increasing of the payments to old-age pensioners who are inmates of charitable institutions. I hope that my honourable friends opposite will not think this a breach of the agreement arrived at last night.",14
17,Mr RILEY,Unknown,Do you intend to increase the pensions?,14
18,Mr JOSEPH COOK,Unknown,I am afraid that that matter must stand over for the present.,14
19,Mr JENSEN,Unknown,"Is the Treasurer aware that some of the State officials of Tasmania, who act for the Commonwealth as Registrars for the payment of old-age and invalid pensions, have to work u n t i l 10, 11, and 12 at night to do what is required of them; and that the money which we pay to get the work done goes, not to the officers who do the work, but to the consolidated revenue of the State?",14
20,Sir JOHNFORREST,Unknown,"I am not aware of the circumstances mentioned. I believe that some of the States refuse to allow their officers to accept anything from the Commonwealth, and apply the Commonwealth payments to their own purposes. That seems to me not very generous. I shall make inquiries into the matter. POSTMASTER-GENERAL'S Is DEPARTMENT. WAGES-DISTRIBUTIO N OF BRITISH NEWSPAPERS-ERECTIO N OF TELEPHONE LINES-NEWSPAPE R PROHIBITION.",14
21,Mr LAIRD SMITH,Unknown,I ask the Postmaster-General whether he will kindly arrange for the payment of the postal and telegraph employees on or before Christmas Eve.,14
22,Mr AGAR WYNNE,Unknown,I think that there is no doubt that they will be paid on or before that date.,14
23,Mr THOMAS,Unknown,"-Will the Postmaster General inquire whether British newspapers could not be distributed in AusOFFICIALS' tralia under the "" printed matter "" rates. WORK. If that could be done, then, it seems to me it would achieve the object which the honourable gentleman had in view in connection with a clause in the Postal Rates Bill which we had under consideration yesterday.",14
24,Mr AGAR WYNNE,Unknown,"There is no difficulty in that regard at the present time. Newspaper agents like Messrs. Gordon and Gotch distribute by hand most of the British newspapers coming here, and those requiring to be sent in land are put through the post under the rates relating to printed matter. The trouble is, that the present system does not allow Australian newspapers to be distributed in Great Britain in the same way.  General state whether any steps have been taken to have telephone lines erected under the contract system ?",14
25,Mr AGAR WYNNE,Unknown,"We are erecting such lines both by day labour and under contract. All our men are being employed as far as possible, and tenders are also being called and accepted in many cases.",14
26,Mr MCDONALD,Unknown,I desire to ask the Postmaster-General whether it is true that the Department refuses to carry certain newspapers through the post. The particular publication I have in mind in putting this question is Reynold's Newspaper.,14
27,Mr AGAR WYNNE,Unknown,"The matter has not previously been brought under my notice, but I shall inquire into it . PERSONAL EXPLANATION .  personal explanation, I desire to bring under the notice of the House a quotation from the report of a speech delivered by the honourable member for Gwydir on the 26th November last at Glen Innes, and published in the local newspaper on 28th ultimo. I am sorry that the honourable member is not present. According to this report, the honourable member, who was supporting the candidature of a member of the Labour party for the representation of the district in the State Parliament said I have not seen much of Mr Abbott; he dues not often come to the House, and when he does come he does not stay long. He is all right in the Police Court badgering some unfortunate; but, judging by his first speech in Parliament, he should attend more and learn that the Federal House is not a Police Court. I have always endeavoured to take up a fair attitude in this House, and I hope that I shall always do so; but in justice to myself I should like to draw the attention of the honourable member for Gwydir to the records of the House, which show that up to the 26th ultimo, the date on which he delivered this speech, ""he had attended forty-eight sittings of the House during the session, whilst I had attended forty-six. The records show further that up to the 10th instant I had attended fifty sittings of this House, whilst the honourable member for Gwydir had attended forty-nine. I am pleased that the honourable member has now come into the House. I make this statement in justice to myself and to my electors.",14
28,An HONOURABLE MEMBER,Unknown, course  galah will keep* quiet,15
29,Mr WEBSTER,Unknown,"I never spoke; what s i . (a) N i l . are you talking about?  out that the peculiar constitution of the House and the exigencies of the made it absolutely essential that, on leases every one of the days that I was in atactually tendance, I should not leave even for. a moment the precincts of the House. I intend quite admit that the flood of oratory on the part of the honourable member for of Gwydir rendered it impossible for me to stay in the chamber the whole day long.",15
30,Mr SPEAKER,Unknown,"The honourable mem- »at ber is now going beyond a personal exenter planation. [152]- 2  vour to keep on the right track; but I must say that I have been led away from the course I should follow by the honourable member for Gwydir. Like other honourable members, I have found it absolutely essential on many occasions to leave the chamber itself in order to attend to correspondence from my constituents and to other matters affecting my electorate, and very often I have done so while the honourable member for Gwydir has been addressing the Chamber, but I have always been within the precincts of the House. UNPARLIAMENTARY LANGUAGE.",15
31,Mr MANIFOLD,Unknown,H as the Prime Minister's attention been called to a report in the newspapers this morning that the leader of the Opposition in the Legislative Assembly of Western Australia has been suspended for using what is considered in that State to be unparliamentary language?,15
32,Mr SPEAKER,Unknown,"Order . NORTHERNTERRITORY : LEASE S.  External Affairs, upon notice I. How many applications have been received for leases under the Northern Territory Land Ordinance(a) Ordinary Leases? (*) Leases as provided for under section 12? 2. How many applications under the above headings have been granted ? Of 3. How many areas of each class are now in actual occupation by the applicants?",15
33,Mr GLYNN,Unknown,"The answers to the honourable member's questions are(i) 359 for Cultivation Farms; 274 for Mixed Farming and Grazing Blocks; making a 2. 26 for Cultivation Farms; 20 for Mixed situation Farming and Grazing Blocks. 3. Eight of the persons who have been granted under section 12 of the Ordinance have taken up their allotments at the Daly River. ' Three others have intimated that they taking up their blocks, whilst four have been granted an extension of time, viz., to the middle of April next, in which to enter into occupation their allotments. It . may be mentioned that successful applicants for blocks at Daly River need not take up their allotments until the 14th December, whilst those who were allotted farms Stapleton are allowed until 5th February to into occupation. So far, no blocks have been taken up at Stapleton. MANOEUVRE AREAS: RENTALS. Mr MoWILLIAM S asked the Minister representing the Minister of Defence, upon notice What amount was paid last year in rent or. compensation for the land used by the Defence Department for manoeuvre or camp purposes?",15
34,Mr GROOM,Unknown,"£1,22 6 13s. 5d. AUDIT BILL . Bill returned from the Senate with the message that the Senate insists upon its amendmeut. Ordered That the message be taken into consideration forthwith.",16
35,Mr JOSEPH COOK,Unknown,ParramattaPrime Minister and Minister of Home Affairs) [10.54] - I move That the Bill be laid aside. I do not feel able to permit the Senate to tear up our financial. proposals in the way they are doing.,16
36,Mr THOMAS,Unknown,Is this a financial measure ?,16
37,Mr JOSEPH COOK,Unknown,"It is in its very essence, and the Senate has taken out of it its most useful provision. The Opposition there may do as they please, as they are all powerful, but I am not under any obligation to accept such an amendment, and I therefore move, formally, that the Bill be laid aside.",16
38,Mr FISHER,Unknown,"Wide Bay) [10.53] The Prime Minister has a right to say what he proposes to do, but I think there were too many first personal pronouns in his statement. The Senate has a right to do what it thinks proper.",16
39,Mr JOSEPH COOK,Unknown,"I said that. Question resolvedin the affirmative. PUBLIC WORKS COMMITTEE BILL . Mr SPEAKER reported the receipt of a message from His Excellency the Governor General recommending that an appropriation be made for the purposes of this Bill. Ordered That the message be taken into consideration forthwith. In Committee: Motion (by Mr. JOSEPH COOK) proment, posedThat it is expedient that an appropriation of revenue be 'made for the purposes of a Bill the various public works. for an Act to provide for the establishment of , a Parliamentary Standing Committee on Public Works and for other purposes.",16
40,Mr FISHER,Unknown,"Wide Bay) [10.56] The Bill to which this message relates has just been circulated, and I understand the Prime Minister proposes to proceed at once with its consideration. I presume that he does not intend to do more today than move that it be read a second time.",16
41,Mr JOSEPH COOK,Unknown,I thought that we might run it through and get on with the Estimates.,16
42,Mr FISHER,Unknown,"I should like the debate on the second reading of the Bill to be adjourned after the Prime Minister has made his speech. The Bill has just been circulated, and it is impossible for one to be able at a moment's notice to become seized of all the facts relating to a measure of such far-reaching importance.",16
43,Mr JOSEPH COOK,Unknown,"Ver y well. Question resolved in the affirmative. ""Resolution reported and adopted. SECOND READING.",16
44,Mr JOSEPH COOK,Unknown,ParramattaPrime Minister and Minister of Home Affairs) [10.58] - In movingThat this Bill be now read a second time. I do not think I need take up much of the time of the House.,16
45,Mr FISHER,Unknown,I hope that the Prime Minister will deal with the whole subject.,16
46,Mr JOSEPH COOK,Unknown,What subject?,16
47,Mr WEBSTER,Unknown,Mak e it clear to the House what the Government propose to do. .,16
48,Mr JOSEPH COOK,Unknown,"I shall do my best. 'Tis not in mortals to command success, But we'll do more, Sempronius, We'll deserve it. This Bill is founded largely on the Public Works Committee Acts of the States of Victoria and New South Wales. I think it is patent to every one at this time of day that the methods of conducting our Public Works ipolicy are crude, inefficient, and altogether inadequate-for the purpose of securing the taxpayers against loss and waste. We are spending in public works every year from £3,000,000 to £4,000,000; and ParliaI am afraid, is not so well informed as it ought to be regarding the expenditure of this money and the projection of Every one knows that we pass Bills through this Chamber, sometimes, in circumstances which, do not permit of full and detailed investigation of the projects to which they relate; and, consequently, I fear that Parliament occasionally knows very little of the actual details of the expenditure of large sums of public money. It is in order to remedy that defect, as well as to insure a more efficient spending of the money, and the wiser disposition of our public works policy, that this Committee Is proposed. Experience, both in Victoria and New South ""Wales, abundantly justifies this proposal. I do not hesitate - to say that, in the State of New South Wales, a similar Committee has saved the country millions of money.",16
49,Mr SAMPSON,Unknown,And the same in Victoria.,17
50,Mr JOSEPH COOK,Unknown,"I suppose I am safe in saying that similar results have been the outcome of the Victorian Committee. There arises, first of all, the question whether a Committee composed of members of Parliament is the hest court of inquiry into these huge public undertakings-whethe r outside experts, permanently appointed as a board, would not conduct the inquiries more efficiently, and with a greater degree of .knowledge and intelligence. From my experience-and it is a pretty large one - I think that a board of experts would not do this work as well as a Committee of this House would. Mr KING O'MALLEY - We are all experts here.",17
51,Mr JOSEPH COOK,Unknown,"That is not so; but members have a wide knowledge - of human nature. They have that invaluable quality called common sense, and a sense of responsibility for their actions which enables them to make inquiries into all such matters with an open mind, and, perhaps, with a detached view of things which does not pertain to the mind trained to special courses. Moreover, I ahould like to point out that all the available expert ability that such a Committee would care to call to their aid is at their disposal, and the members may, therefore, inform themselves concerning all the projects submitted, and be in a position to pass judgment in a way that, perhaps, an expert, biased by his training and immersed in details of the undertakings to which he has given his life's work, may not do. I am not so sure that outside unbiased judgment, even relating to technical matters, is often the best that we can obtain. That is an argument that goes as far as it may; but, further, I say that in connection with public works and public undertakings, the responsibility of this Parliament should be preserved inviolate. That is the point, I think, which ought to decide this matter. No outside body should have to do with projects in a responsible way which relate to the initiation of the spending of the public funds of the country. The determination of what, where, to what extent, and in what shape our public functions shall be initiated and utilized must always, it seems to me, rest with those who have charge of the purse of the country, and have the responsibility, finally, for the spending of the money. In other words, I think that this* proposal preserves the power of Parliament over the whole province of public expenditure. This appears to me to be the vital thing in deciding whether this shall be a Committee of members inside the House, or a Committee of experts outside the House. There is just another point that should be mentioned here. Ought a Minister-ough t a Government-to delegate this Ministerial function-for after all it is a Ministerial function and Ministerial responsibility-to any body of men either in Parliament or outside ? The reply to that is a very easy one-the Government will not delegate their responsibility, which is preserved at every stage. The Bill will provide that the Minister himself must express his views concerning the proposals in submitting them for the consideration of the Committee. Further, the Minister must take full responsibility for the initiation of the proposals, and for the provision of plans and specifications, and all data collectable within his sphere of responsibility, for submission to the Committee. More than that, after the inquiry has been made, and the information supplied to Parliament, a further responsibility, that is made statutory in the Bill, rests on the Minister,. and makes it mandatory on him to submit the proposals for the final consideration of Parliament within a given period after the inquiry has been conducted. It seems to me that there is nothing here inconsistent with the full responsibility of the Minister or with the financial responsibility which the Government and the House have to undertake.",17
52,Mr THOMAS,Unknown,"Supposin g the Committee "" turns down "" a proposal, can the Minister still present it to Parliament?",18
53,Mr JOSEPH COOK,Unknown,"Parliamen t "" turn s d o w n "" the proposal, not the Committee.",18
54,Mr WEBSTER,Unknown,"If the Committee reports against a proposal, have the Government still the right to submit it to Parliament ?",18
55,Mr JOSEPH COOK,Unknown,"Parliamen t takes full responsibility, but if the Minister and the House "" ' turn down "" a proposal, as a result of the rejection of it by the Committee",18
56,Mr THOMAS,Unknown,"Will the House have an opportunity to deal with a proposal even if the Committee report against it ? Mr JOSE PH COOK - The House , does not delegate any of its rights to the Committee or any other body.",18
57,Mr FISHER,Unknown,The point is that no body can bring a proposal to this Parliament except the Ministry.,18
58,Mr JOSEPH COOK,Unknown,That is the point on which I am trying to insist. Ministerial responsibility is preserved full y and entirely.,18
59,Mr THOMAS,Unknown,"That is different from the procedure in New South Wales. There, if the Committee reports against a proposal, that proposal cannot be submitted for twelve months.",18
60,Mr JOSEPH COOK,Unknown,"The honourable member has got hold of the wrong idea. If a proposal is "" turn e d down "" by the Committee in New South Wales, that proposal cannot be re-submitted to the Committee for twelve months.",18
61,Mr FISHER,Unknown,"This Bill proposes to reserve the power to submit a proposal to Parliament at any time, even if the Committee do "" turn d o w n "" that proposal.",18
62,Mr JOSEPH COOK,Unknown,I think the provision to which I have been referring is a very useful one.,18
63,Mr FISHEH,Unknown,"But what I have indicated is the proposal in the Bill ? It provides that the Governor General may at any time submit a proposal, notwithstanding that it has been rejected by the Committee. . Mr. JOSEPH COOK - But these are two distinct points. We are talking now about a re-inquiry into a work which the Committee have "" turned down."" There is a provision in this and all other Bills of the kind that, once the Committee have "" turned down "" a proposal, the Committee cannot be asked to re-inquire intothat proposal for a period of twelvemonths. The point is that, whatever the' Committee reports, this Parliament is supreme and master of its own proceedings.",18
64,Mr THOMAS,Unknown,"After the Committee hasreported against a proposal will the Ministers have the power to immediately present that proposal to Parliament, and carry it , without re-submitting it to the Committee ?",18
65,Mr FISHEH,Unknown,Practicall y that could be done through the Governor General.,18
66,Mr JOSEPH COOK,Unknown,"Clause 16 of the Bill providesI f the resolution of the House of Representatives declares that it is not expedient to carry out any proposed work, no proposal for a public work in substance identical with that work shall be submitted to the House of Representatives until after the expiration of one year from thedate of the resolution. I take it , however, that this House is supreme, and, notwithstanding any report of the Committee, could decide to proceed with the work if it thought fit. The function of the Committee is to be the eyes, and ears of Parliament.",18
67,Mr FISHER,Unknown,Why not read the rest of clause 16 ?,18
