speakerGroups,Speaker,Title,text,pageNumbers
125,Mr SAMPSON,Unknown,"Hav e we any power to deal with that matter?  it by suggestion; and, by working hand in hand with the State Departments, we could ascertain whether those Departments could not bring influence to bear on the State Governments in this direction., Then, again, we have a number of noxious weeds which require to be in vestigated. Prickly pear is one of these* As far as I have been able to ascertain, it is of very little commercial value. I conducted some experiments, at one time, to ascertain whether it could not be used, after being boiled, or as ensilage, for feeding dairy cattle, but the results were not satisfactory. There are also a number of stock-poisoning plants in different parts of Australia that need to be dealt with. We could have the opinions of the authorities promulgated in those useful publications known as bulletins, and now issued in connection with the United States of America Bureau of Agriculture. In such bulletins we could give the latest information concerning the efforts of scientific men to solve all these problems. These bulletins must result in better work. In conclusion, I want to point out that a bureau similar to that which we propose to establish in the Commonwealth is in existence in Canada, and isdoing good work. I have before me a report by the Live Stock Commissioners of the Dominion ; and looking through it I find that ' they act upon the suggesi n the tion I have made in regard to the employment of veterinarians at the head of the different Departments. In nearly every case where bacteriological investigation has to be made, we find that a gentleman holding veterinary degrees is in charge. The result has been a grand success, and the reports of these Commissioners have been most encouraging. I hold that it will not be necessary, in connection with our bureau, to commence experiments de novo. If we are wise we should go on with our experiments where others have left off. Let us take advantage of their experience, cheerfully acknowledging the sources which we have drawn upon, and I feel satisfied that as a result of the establishment of this bureau our wealth will be largely in creased; that we shall be able to discover methods of dealing with portions of Australia that at present look somewhat hopeless, and of dealing with them in such a way as to attract to them the surplus populations of other parts of the world.",24
126,Mr HIGGS,Unknown,"Capricornia) [12.8] - I am sorry that the Prime Minister did not allow this measure to stand over until next session, because it has certainly been brought forward without due consideration. It is quite incomplete, and should not have been introduced until the Prime Minister had consulted the Premiers of the States, and had a conference with the directors of the State Agricultural Departments with a view of ascertaining how far the Commonwealth might take over work that is now being done by the individual States. I cannot refrain from expressing my continued surprise at the action of the great anti-Socialist party opposite, which is every day abandoning its professions, and adopting socialistic and even communistic experiments.",25
127,Mr RODGERS,Unknown,Does the honourable member think it would be logical to abolish our universities and public schools ? It is all a question of education.,25
128,Mr HIGGS,Unknown,"Ha d my honourable friend been acquainted with the Labour movement for the last twenty years he would know that we have claimed all along that all expenditure of public money in the interests of education is of a socialistic, and in some cases, of a communistic character. Where a community is taxed to find funds for free education, that, in my opinion, is a b it of Communism. The honourable member for Hume thinks that there is a difference between a socialistic experiment and a public utility carried on by a Government or a municipality. What we try to impress on the Liberals and anti-Socialists is that the expenditure of Government or municipal funds to carry on services they do not carry on for themselves is of a socialistic character. I regard posal to establish a Bureau of Agriculture as being very much in the nature of to Communism-- a step, of course, greatly beyond Socialism, under which people have to pay for services rendered. Our honorto able friends opposite who declaim against us, and declare from every public platasked form that we are Socialists, while they anti-Socialists, are going to dip their hands into the public purse to take thousands, and, perhaps, some hundreds of thousands, to assist one or two sections of the community, and principally the farmers and pastoralists.",25
129,Mr GROOM,Unknown,But the proposal is a good one.,25
130,Mr HIGGS,Unknown,"Rightl y carried out it is, but my honourable friends opposite in sist upon abusing the Labour party throughout the Commonwealth because we ask for a little Socialism or Communism for the man who is on the lowest rung of the ladder. When we asked for pensions for the aged poor we were called Socialists. g",25
131,Mr ARCHIBALD,Unknown,"It was said that we were ""sapping their independence.""",25
132,Mr HIGGS,Unknown,"Ye s j * some honourable members opposite were always in favour of old-age pensions, but others have always opposed the system, and tolerate it only because they dare not say from a .public platform that they would vote to abolish it . I do not think we can sufficiently impress upon the Liberals and the public generally what Socialism and Communism really are; how far they enter into the lives of the people at the present time, and how we ought to extend Communism and Socialism in the interests of civilization. I am agreeable to this proposal provided the Prime Minister will consult the States. Honourable members opposite say that we have been extravagant as a party, but what about their financial methods? What have the honourable member for Robertson and the honourable member for Riverina, who take an interest in financial matters, to say of this proposal on the part of the Government? The Prime Minister says, "" We propose to establish a Bureau of A g r i culture.""",25
133,Mr ARCHIBALD,Unknown,"Will it not "" sap the which independence ' ' of the farmers ?",25
134,Mr HIGGS,Unknown,"I shall come to that. this proThe Prime Minister saidWe want a Bureau of Agriculture. It seems me that we have great opportunities to effect a lot of fine work. I think we ought to have a small body of competent investigators. When I put a question to him as what the cost would be, I think he said that my question was frivolous. I ' him whether he had prepared any are estimate of the cost that would be involved in the establishment of the proout posed Bureau of Agriculture. The reply of the Prime Minister was, "" That is the last of those frivolous questions that I shall answer."" I asked that that statement should be withdrawn as objectionable, and the Prime Minister withdrew it , though he added that the question I had asked was objectionable to him. And no doubt the question was objectionab.' :, seeing that the Prime Minister knew nothing whatever as to what the cost would be. To his great surprise, from which he has not yet recovered, the honourable gentleman became Prime Minister. , He never had any constructive policy when he was in Opposition abusing the Labour Government in the language of the pot-house.",25
135,The CHAIRMAN,Unknown,Order !,26
136,Mr HIGGS,Unknown,"I have never been in the pot-house, and I wonder how the Prime Minister obtained his knowledge as to the kind of language used there.",26
137,The CHAIRMAN,Unknown,Order !,26
138,Mr HIGGS,Unknown,"However , the honourable gentleman got into office; and I suppose, prompted by the Minister of Trade and Customs, who, as a private member, had made a speech in favour of an Agricultural Bureau, he hurriedly introduced this measure. Some weeks ago the Prime Minister, in answer to a question by myself, said he would lay on the table the sketch which had been prepared of the duties to be carried out by the experts, but it has not yet appeared, and I suppose that really it is not ready. Probably the Minister of Trade and Customs, when he speaks, will give us his view of the scope and character of the proposed bureau. Before I leave the subject of the great Liberal anti-Socialist party, I think I ought to indicate an amendment, of which I had intended to give notice but for the fact that I thought the Bill had been dropped. That amendment proposed to make the preamble of the Bill read thusWhereas the so-called Liberal or Fusion party have abandoned their alleged policy of anti-Socialism, and have wisely determined to spend a portion of the people's money, known as the Consolidated Revenue, in assisting farmers, dairymen, horticulturists, viticulturists, owners and others in an unmistakable Socialistic . and Communistic manner, be it therefore enacted. I have here an enormous quantity of literature which I have collected, thanks to the kindness of various State Ministers of Agriculture and their officersliterature showing what the States are already doing in assisting those engaged in laud pursuits. The Prime Minister, when he assumed office, said . that it would be his aim to bring about harmony between the States, 1 and we know his method and the results. He began by abusing Mr Holman, the Premier of New South Wales, in very violent language regarding the small-pox business.",26
139,The CHAIRMAN,Unknown,I cannot connect these remarks with the Bill .,26
140,Mr HIGGS,Unknown,"I shall try to connect them by showing that the Prime M in ister, in introducing the Bill in the way that he did, was not in any way endeavouring to bring about harmony, between the States. Two or three years ago the farmers themselves, in conference at Sydney or Brisbane, carried a resolution against the establishment of a Federal Bureau.",26
141,Mr SAMPSON,Unknown,The honourable member is confusing the farmers with the f r u it growers.,26
142,Mr HIGGS,Unknown,"I am not, and I resent that remark. Really there is some cause for some of the language quoted in the Senate, for Parliament seems to be the place where people indulge in fibs to an inordinate extent.",26
143,The CHAIRMAN,Unknown,The honourable member must not make 'reflections of that nature on Parliament.,26
144,Mr HIGGS,Unknown,"I withdraw the words, but honourable members will admit that we f l i r t too frequently with the truth . The Prime Minister had been with his back to the wall for so many years that he never thought that he would be in office again; and, therefore, he had no policy, and had to rush in with this Bill before it was ready. When introducing the measure he had no idea of what was to be the scope of the Federal Bureau. He said It has always appeared to me that what we most need in Australia is a small select body of the best original investigators we can get. I am afraid' that we have never gone to the top of the tree in engaging the kind of ability that we stock- want in these matters. This was immediately after referring to the fact that one Commonwealth officer was receiving £1,000 a yearAltogether, a great realm of exploration lies open to us, and we have to persevere until we find a solution for many of our difficulties. The honourable gentleman went on to refer to the diseases of apples, and to the prickly pear, and said If we got a man to deal with one of these troubles and solve it for us, he would be ^50,000 a year to this country. For years in Queensland there was a standing reward of £10,000 for any method by which land could be the prickly pear at a cost of £ 1 per acre, and no one was ever able to claim it . Prime Minister had in his mind a small body of experts who were to go into laboratory and conduct certain experigentleman, ments; and he seems to have been quite unaware of what had been done by the States. In Queensland, Victoria, and New South Wales there are agricultural bureaux at the present carrying out all' the experiments which it is supposed are to be carried out under this Bill .",26
145,Mr RODGERS,Unknown,Not at all.,27
146,Mr FALKINER,Unknown,What have those State bureaux done?,27
147,Mr HIGGS,Unknown,"The honourable member for Riverina is a pastoralist, and, perhaps, has not given the attention he might to the agricultural industry. As I say, have an enormous mass of literature here which I cannot hope to deal with in the limited time at the disposal of honourable members. We ought to be dealing with would the Estimates instead of this Bill , which is being rushed through without proper consideration. I have a long and very interestpenditure ing letter, of many typewritten the work.' pages, from the secretary of the Victorian Agricultural Department, in which he informs me that Victoria has experinumbers mental farms, a chemists' branch, a science branch, a field branch, and a horI ticultural branch, with farmers' classes and lectures. The object of the agriculmiles tural division under the State is briefly to assist in raising the standard of culCollege, tivation and production in every part of the State where agriculture is carried by the means of demonstration plots and experimental farms, regular courses of lectures, and by the distribution of pamfarms phlets, bulletins, and so for t h, bearing directly on the work of the farmer. Plant diseases, and soil, and manurial problems are also a marked feature of the work.",27
148,Mr FALKINER,Unknown,"Does the letter say anything about the Wyuna experimental farm on which was lost £10,000 or the £15,000 ?",27
149,Mr HIGGS,Unknown,"Liste n to the honourable member for Riverina, who is a supporter of the Bill before us! He points out that the State of Victoria, in assisting the worth farmer by means of this farm, has sunk from £10,000 to £15,000.",27
150,Mr ANSTEY,Unknown,Because the Liberal Government put a man there who knew cleared of nothing about farming..,27
151,Mr HIGGS,Unknown,"I am not, as I have exThe plained before, a Unificationist, and I draw special attention to the remark of a the honourable member for Riverina. That by supporting this Bill , proposes to supersede the State in such efforts; but if the State of Victoria, which has a comparatively small area, has lost £10,00 0 or £15,000, how much is the Commonwealth likely to lose in experiments, with the heads of the bureau, probably, in Melbourne, and farms and other experimental stations in the other States, say, for example, in the Northern Territory. I emphasize this to show the necessity for postponing the carrying of this Bill until such time as the Prime I Minister or his representatives have consulted with the State Premiers and the representatives of the State Agricultural Departments, to see to what extent it be better to leave certain duties in the hands of the States, and to what extent the Federal Government ought to take over the work. Otherwise, there is going to be foolish and extravagant exof public money in duplicating I can show honourable members of bulletins issued in the various States on all kinds of subjects. n Victoria, they have a central Research F a r m at Werribee, situated about 19 from Melbourne; the Rutherglen Experimental F a r m and Viticultura l in the North-eastern D is t r i c t; the Wyuna Irrigation F a r m in the Goulon, burn Valley ; and an Experimental Farm at Bamawm, in the Goulburn Valley. It is stated that "" the general object of these is to carry out exhaustive experiments and demonstrations to show the varieties of the different crops best suited to each of the several districts, the manurial requirements of the various soils; the cultural and tillage methods most likely to give best results, and the methods of crop rotation which will give best financial results ""-jus t what one honourable member was asking the Federal Government to do. "" Hundreds of permanent experimental plots have been laid out at these experimental farms, and the intelligent settler who visits these plots may read from the results of the plots those practices which are likeiy to give him the best financial results. Expert officers, skilled in the various branches of production, are attached to these various farms, and give personal advice on all agricultural matters free. The results of the researches and experiments are published as they accrue in the monthly journal of the Department, and so are made available to all farmers in the State."" What is the Prime Minister going to do about that? Is he going to spend public money in duplicating that work without consulting the State Premiers and the State Ministers of Agriculture as to how far Federal interference is called for?",27
152,Mr GROOM,Unknown,"When the Bill is passed, arrangements can be made.",28
153,Mr HIGGS,Unknown,Coul d we not come to an understanding before we pass the Bill?,28
154,Mr GROOM,Unknown,It is agreed now that there is a fairly large field of scientific research work that can be undertaken by the Commonwealth. There is no trouble about that.,28
155,Mr HIGGS,Unknown,"This Bill only shows the slip-shod method of legislation of which we have the right to complain - Honourable members who went throughout the Commonwealth talking about the extravagance of the Labour Government, ought surely to come down to this House with a proper scheme of finance, instead of a Bill which may cost, we do not know how much.",28
156,Mr FALKINER,Unknown,Have ' the State Departments ever .cured any one disease to which our stock were liable?,28
157,Mr HIGGS,Unknown,"We know that in Queensland they have discovered certain cures. One man discovered a formula for treating ticks- a matter affecting the pastoralists particularly. The Government of Queensland spent public money in assisting the stock-owners to get rid of the ticks, or to keep them down. The State Governments of Australia have assisted pastoralists to an enormous degree, and if a balance-sheet were published showing the amount of Government money that had been spent in that way the public would be astounded. Almost millions of money have been spent by the Governments of the States in giving the stock-owners wire netting and rabbitproof fences, at very great cost, to fence their runs when, in some cases, there were no rabbits within hundreds of miles.",28
158,Mr SAMPSON,Unknown,They paid it all back.,28
159,Mr HIGGS,Unknown,"They have not paid it all back in Queensland, by any means. The State Governments of Australia, and of Queensland in particular, have given the pastoralists long leases of huge areas at 5s. per square mile-the leases running in some cases to forty-two years. They .let the pastoralists in Queensland have land at | d . an acre, where they charged the farmer 3d. per acre for similar quality land, so that pastoralists like the honourable member for Riverina should never say anything about the parsimony of the States.  be got?",28
160,Mr HIGGS,Unknown,"If the honourable member will write to the Bureau of Intelligence in Brisbane, and ask for the latest Crown Lands Directory, he will find that he will be able to get land in Queensland from small agricultural farms of 150 acres up to farms of 1,280 acres, or get up to 2,500 acres of prickly-pear country, and up to hundreds of square miles of country further back from the railway line.",28
161,Mr GROOM,Unknown,A Bill like this was included in your Government's programme.,28
162,Mr HIGGS,Unknown,It might have been. We are always willing to assist the farmers.,28
163,Mr GROOM,Unknown,And now the practical test comes.,28
164,Mr HIGGS,Unknown,"We shall assist the farmers by protecting them and the general public from the duplication of the expenditure on many of these services. Why should the Federal Government issue, through its Bureau, pamphlets on cotton-growing for the Queensland Government? There are pamphlets already' printed on cotton-growing. I have here a large number of pamphlets that have been issued, and these are only about a quarter of the total number. Here is Western Australia issuing a bulletin on ""mil k and cream: its care from the cow to the consumer,"" by the chief of the dairy division. Are the Federal Government going to issue a similar pamphlet to the farmers? Here is another on the examination of Western* Australian poison plants. The honourable member for Riverina asked what the States had done to protect stock. That pamphlet supplies the answer. Here is another pamphlet from Western Australia from the horticultural and viticultural division in relation to lemon-curing. There is another on "" hints to stockbreeders, together with diseases common in stock, for the use of breeders of all kind of far m animals,"" issued by the Department of Western Australian Agriculture. There is another on ' ' orchard rigation and drainage."" Now we come to Queensland, which issues a very large list of pamphlets, beautifully printed, and containing 'a great deal of information. Here is a pamphlet on ""poultry-farming,"" issued by the Department of Agriculture and Stock. There is another on citrus culture. There is no place in Australia where .citrus f r u it s can be produced so well as in that country. To show what we are doing to assist the farmer, here is a book on elementary lessons on the chemistry of the farm , dairy, and household, to be obtained free. My antiSocialist friends on the other side can get these pamphlets free on application to the Queensland Department. There is a pamphlet on lamb-raising, which is described as an undeveloped industry in Queensland, and no doubt, considering the territory that we have, it is. Here is a lecture on the drug cure of tick fever. Here is a pamphlet concerning the very matter the honourable member for Hume spoke about-in reference to diseases in sheep, and another with reference to contagious abortion in cows. Here is another to assist the exporters of our products. I am not too keen about that matter, because, unhappily, the more we assist the exporters to send away our produce, the higher becomes the price for the consumers here. We assist them to send their butter and meat to London, and the combine charge the people here a higher price than they ought to charge.",28
165,Mr FENTON,Unknown,"There would be none of us here if we did not export. Mr HIGGS.^-Let me tell the honourable member that in the ten years we exported about £60,000,000 worth of agricultural produce, but we consumed Locally about £273,000,000 worth, so that if there were no other countries in the. world we could still get along here. Here is a pamphlet on cotton-growing in Queensland, so that we have done a great deal in our State to assist all kinds of producers.",29
166,Mr RODGERS,Unknown,"Clause 46 of this Bill enables an arrangement to be made with the Government of any State for the supply and distribution of information, so that there will be no duplication.",29
167,Mr HIGGS,Unknown,"The , Government might first have inquired of the States whether ir- they were prepared to join with them. Yet they pose before the public as being people who object to Unification. I would point out that the resolution objecting to the proposal to establish a Federal Bureau of Agriculture, passed by the Conference of Farmers, was the direct outcome of the agitation of the so-called Liberal or State Rights party and their opposition to many of the functions now carried on by the Commonwealth. Queensland has also published a pamphlet on cotton plantations, and on dips and sprays for cattle and horses. It is remarkable how much we spend in assisting the pastoralist and farmer, and how little the pastoralists and farmers, as a body, realise it I quite agree that we ought to assist both pastoralists and farmers, but, in my opinion, it is about time we also commenced to assist the poor people in the community. What are we doing for sailors, wharf labourers, miners, and those poor fellows who work in the trenches in the streets, about whom cultured men, like the honourable member for Parkes, and others, complain, and say "" They are all idlers,"" if they should happen to straighten their backs during their work? What are we doing for these men ?",29
168,Mr RODGERS,Unknown,The more production is increased the better it is for them.,29
169,Mr HIGGS,Unknown,"That may be so in a properly organised community, but not in one where combines or trusts can increase the cost of living. I admit that if we make two blades of grass or two potatoes grow where one grew before, it is better for the community, providing we can get the goods to the consumers, and I hope that later on we shall assist the farmers to dispose of their produce by municipal, or possibly State, agents. Another pamphlet issued by the Queensland Government gives instructions to dairymen. The State Government have also gone into the matter of assisting the pastoralist by information and expert advice to enable him to secure the* best horses for stock-breeding purposes. They also publish a pamphlet on broom millet, and they supply the Dairy Produce Acts free of charge. They publish a pamphlet on the cultivation of potatoes in Queensland, and a pamphlet concerning sisal fibre growing. In fact, they do a great deal in Queensland to assist farmers by a series of beautiful pamphlets; such a one as "" a n abridged text-book on plant life and botany for Queensland students."" Where are the pamphlets to assist boot operatives? Is anything done to assist boot operatives?",29
170,Mr RODGERS,Unknown,Yes ; Working Men's College.,30
171,Mr MCWILLIAMS,Unknown,"And a 40 per cent, duty.",30
172,Mr HIGGS,Unknown,"Whil e we give the boot operative protection against foreign competition we also give the farmer assistance at the Customs House, in the shape of import duties on butter, cheese, and bacon.  to us.",30
