speakerGroups,Speaker,Title,text,pageNumbers
68,Mr JOSEPH COOK,Unknown,"We shall deal with that when we come to it . The Committee will collect information in a responsible way, and the House will deal with their recommendations as it sees fit-that is the great, point I wish to make in connection with the Bill . For the rest, I think I need not go into details.",18
69,Mr FISHER,Unknown,The Committee has no. restrictive powers at all over the Ministry as I read clause 16.,18
70,Mr JOSEPH COOK,Unknown,No ; the Committee goes out as really a scout to obtain information for the Government.,18
71,Mr FISHER,Unknown,"Not for the Government,, but for the country.",18
72,Mr JOSEPH COOK,Unknown,"To in for m Parliament, so that Parliament may assume its responsibility with an enlightened mind and judgment. The constitution of this body will require some littl e consideration in Committee. I candidly think I have made a mistake in regard to the number which I haveplaced at nine, three of whom are to befrom the Senate.",18
73,Mr FISHER,Unknown,I suppose that the Prime Minister would give more satisfaction if lie composed the Committee of the whole of Parliament-that - is the sentiment I find about!,18
74,Mr JOSEPH COOK,Unknown,"It seems to me the Committee must be composed of even numbers, because the Chairman will have - a casting vote.",19
75,Mr THOMAS,Unknown,"How is it proposed - elect the members of the Committee-by - a straight-out vote, or the Hare-Spence .system ?",19
76,Mr JOSEPH COOK,Unknown,"That is provided for in clause 3, and it is the same method as that by which we appoint Select Committees. It is quite clear, I think, that this Committee must be a littl e larger than the Public Works Committee of a State. It will have to travel over a great deal more ground, and, as sectional Committees will be required, it would be difficult, with a small number, to set up these Committees in the requisite strength to insure the work being carried on continuously. While a committee of six or seven may be all right for a State, eight or nine, I think, would Joe more like the proportion for a wide - continent such as Australia.",19
77,Mr THOMAS,Unknown,Will the Committee sit while Parliament is sitting?,19
78,Mr JOSEPH COOK,Unknown,"Yes , but I take it only with the consent of Parliament. I think the rule in the States is that the Committee does not sit while Parliament is sitting. In New South Wales it sits in the mornings before the House meets. My recollection is that it also sits in the afternoon, with the consent of Parliament, but I do not know that that is a very good rule.",19
79,Mr TUDOR,Unknown,If this Committee sat in the afternoon would its members receive only the one payment for the morning and afternoon sittings?,19
80,Mr JOSEPH COOK,Unknown,"I am not quite - clear on that point. I think the payment is so much per sitting. Both Victoria and New South Wales very wisely l i m it the amount which may be paid to members during any one year. I think the limi t in Victoria is £1,200, and in New South Wales £2,000.",19
81,Mr FLEMING,Unknown,It was nearly doubled in New South Wales last year.,19
82,Mr JOSEPH COOK,Unknown,"At any rate, that is the total amount fixed by law that may be spent in any one year in payment of allowances or expenses to the whole of the members of the Committee.",19
83,Mr WEBSTER,Unknown,The honourable member does not realise how much the members of the New South Wales Works Committee have received.,19
84,Mr JOSEPH COOK,Unknown,"I am only stating what is in the New South Wales Act , but I shall be quite prepared to hear that to since the honourable member's friends came into power over there they have set such provisions aside. At any rate, £2,000 is the total amount allowed for the members of the Committee in New South Wales. There is provision both in New South Wales and Victoria that, if there are more sittings than would allow for the amount set out in the Act as payment for services, that amount is to be proportionately reduced so as to bring the total payments within the amount specified.",19
85,Mr BAMFORD,Unknown,"What is meant by "" other purposes "" ?",19
86,Mr JOSEPH COOK,Unknown,"I do not know. T presume it means other purposes incidental to the inquiry, but here I am up against a difficulty. I am not clear whether, under our Constitution, we can pay our members at all.. There is a great and wide divergency of opinion on this serious constitutional point. The M in ister of External Affairs, on my right, says he thinks it is all right, and' I suppose the honourable member for Bendigo would say that perhaps it is all right. However, I have left the matter blank, and we shall have to fill it in when the Bill gets into Committee, but there is no doubt that whether we can pay members a fee or not we can pay them expenses. The Committee has power to divide it self up into sectional Committees so as to facilitate their work, and all the necessary machinery is provided.",19
87,Mr THOMAS,Unknown,"Will the Bill apply to works costing over £25,000 in the Northern Territory and Papua as well? If it will, it will mean delay.",19
88,Mr JOSEPH COOK,Unknown,"It will apply to any big public work. The honourable member is raising an important point, and I do not deny that the Bill may create some difficulty. It is an experiment, and it has to be seen whether provisions that . work so admirably in the States will work as satisfactorily over this wider field. My own impression is that they will . I believe the common sense of the Committee, and of the House generally, will triump h over all difficulties caused by the scale and range of things in the Commonwealth. Although there may be difficulties in going to the Northern Territory and elsewhere, I do not think those difficulties will be greater for monwealth. the Committee than they are now for Ministers. Whatever the Ministry can do regarding the Northern Territory, or Papua, this Committee, with its even greater facilities for inquiry, can do.",19
89,Mr MATHEWS,Unknown,"I do not know you have left out the military crowd. They want watching more than anything. Mr KING O'MALLEY - We must include defence. Those are the "" roosters "" .we want to watch.",20
90,Mr RICHARD FOSTER,Unknown,Why is defence omitted ?,20
91,Mr JOSEPH COOK,Unknown,"I am, in that respect, following precedent. A good deal of the defence works are connected with questions of strategy.",20
92,Mr THOMAS,Unknown,"If you want to experiment, experiment with defence.",20
93,Mr JOSEPH COOK,Unknown,"Honourable members themselves must take the responsibility for that new departure. Defence has been specifically excluded from all such inquiries in both these large States. "" Mr RICHARD FOSTER - Does the question of strategy apply to the erection of buildings?",20
94,Mr JOSEPH COOK,Unknown,"They may be part of the entire strategic scheme, and it may be difficult to separate them. However, I shall be glad to hear any argument on that question in Committee; but at present my judgment is that the defence of the country should be excluded from the ordinary public works.",20
95,Mr CONROY,Unknown,"Do you mean the purchase of war materials only, or, say, the erection of new buildings at Canberra?",20
96,Mr JOSEPH COOK,Unknown,"I mean the construction of works in connection with our Naval Bases, and all that kind of thing.",20
97,Mr SAMPSON,Unknown,What is it proposed expend on Naval Bases?,20
98,Mr JOSEPH COOK,Unknown,I cannot tell the honourable member; but that mean many million pounds before we are through with it. We have an inquiry going forward now by the best expert could obtain in the Old Country regardthings. ing these very matters.,20
99,Mr FISHER,Unknown,"Onl y in a portion of Australia. You declined to let Queensland to inspect the manoeuvre area and naval training area at Wide Bay,, which is one of the best areas in the Com",20
100,Mr JOSEPH COOK,Unknown,"Did we? If the honourable member can show any good reason why the expert should go to Queensland, there will be no difficulty in. the way. Let him make out his case, and why he shall have the expert. We do not want to prevent him from going anywhere where he can do useful work for us; but he is a very expensive man, and we do not want to send him about unnecessarily. This is the first time. I have heard of this. I thought'he was going to Queensland.",20
101,Mr FISHER,Unknown,Onl y to Brisbane.,20
102,Mr JOSEPH COOK,Unknown,"If the honourable member can make out a good case why he should go farther north than Brisbane, he shall go there. The question of the public works of the DefenceDepartment has to be considered in the light of the strategical requirements of the Army and Navy; and that consideration, I think, differentiates those works from ordinary works of utility whicK have relation to the Civil Service and theordinary business of the country.",20
103,Mr CONROY,Unknown,"Would woollen mills come under the heading of "" defence "" ?",20
104,Mr JOSEPH COOK,Unknown,That is a very pertinent inquiry.,20
105,Mr RICHARD FOSTER,Unknown,O r a harness factory?,20
106,Mr JOSEPH COOK,Unknown,"All I can say is, that as to factories already established the Committee will not operate.",20
107,Mr THOMAS,Unknown,Supposin g we want to put up another one?,20
108,Mr JOSEPH COOK,Unknown,In that case the Committee should have a function.,20
109,Mr TUDOR,Unknown,What if we decided to have a new boot factory to make boots for the military?,20
110,Mr JOSEPH COOK,Unknown,"I think that matter should come under the review of the Committee. We shall have to to modify the measure later on, to meet those objections.",20
111,Mr WEBSTER,Unknown,Would a small-arms work will factory be included?,20
112,Mr JOSEPH COOK,Unknown,"We have taken our Socialism so far now that one does we not know where to draw the line in these We must try, in Committee, toframe a series of definitions which will enable us to cover this more civil sidehim go to of the Defence Department.",20
113,Mr FALKINER,Unknown,Why not exclude works except buildings?,21
114,Mr JOSEPH COOK,Unknown,"I shall not at all object. Meanwhile, I submit the was £837,490. Bill to the House, believing that it has a useful function to serve in regard to these huge expenditures of public money, and that it will make our services and decisions in Parliament more enlightened and informed when we come to face that responsibility for the spending of the people's money which is one of our turned chiefest functions in the Federal Parliaworth ment. Debate (on motion by Mr FISHER adjourned. BUREAU OF AGRICULTUREBILL . America, SECOND READING . Debate resumed from 21st November, 1907, which says(vide page 3430), on motion by Mr . JOSEPH COOKThat this Bill be now read a second time.  dress myself to the second reading of this Bill with considerable pleasure, because the departure projected in it is one that I think the Commonwealth is perfectly justified in taking. I do not agree with .some honourable members who have already spoken that it will be an economic measure. To be effective, a Commonwealth Bureau of Agriculture must necessarily be a costly Department.",21
115,Mr KING OMALLEY,Unknown,"He a r , hear.  nent in the world to come into the compeprecisely tition in the demand for population, in order to obtain a satisfactory populastantial tion we must hold out certain inducements to immigrants to come here and fill up our empty spaces. In establishing our bureau we shall be well advised if take advantage of the experience of other countries, and I point with great satisfinest faction to the useful and important done by the Agricultural Bureau of the United States of America. No finer reNew sults have been achieved anywhere by that bureau. For many years to our only source of wealth by way of portable surplus will be wool, wheat, meat, and butter, and any difficul Mr. ties we have can only be removed by havgation experts in the world. ing a greater increase in the exportable surplus of our primary productions. Since 1904 our imports and exports have been gradually coming together, until all last year the exports only exceeded the imports by 1.2 per cent.",21
116,Mr FLEMING,Unknown,"The value of the excess  is greater the better off we shall be. According to the 1912 Tear Book issued by the Department of Agriculture in the United States of America, every million dollars spent upon the Department is rei n the shape of ten million dollars' of wealth produced through the increased production of the land due to fol) lowing the advice given by the experts of that Department. To be a little more definite as to the work done in I shall read from the historical sketch of the Department of Agri culture in the United States for the year In 1879 there were 35 bushels of corn raised for every person in the country, and in 1889 only 34 bushels; but the production per acre increased from 28.1 bushels in 1879 9-5 ' «88o. to 2 n And in relation to corn, the largest product of the United States, this was 23 bushels in 1839 and 44 bushels in 1899. I am pleased to notice that, under the provisions of the Bill before us, there are certain matters which the Commonwealth can investigate for the benefit of coming generations. First of all, the proposed bureau will deal with the acquisition and diffusion of information connected with agriculture and so forth . To do this we must have eminently qualified professors or experts who know what they are talking about, and and we shall have to pay these meD very subsalaries in order to obtain their services. The States havemade several mistakes through haggling over dollars in the matter of giving increases to their exwe perts. SoiLe years age New South Wales had the services of Dr Cobb, one of the bacteriologists in the world, but the work United States very soon found out his reputation, and got hold of him, because South Wales was not prepared than to go to the expense of the dolcome lars America was prepared to pay. exAnother illustration is to be found in Victoria. The State has the services of Elwood Mead, one of the finest i r r i He has made wonderful alterations in the irrigation schemes in existence in Victoria, but his position is now in jeopardy, owing to advanced offers being made to him from another country. I have not heard whether he has decided to remain here, or whether Victoria is to lose his eminent services. If we are to succeed in the direction we hope to attain, that of attracting the people looking for land in a - new country, we shall have to pay well to get the services of these experts. As to our relationship with the States, I can see no evidence of any antagonism between the States' Departments and our proposed bureau. Mr . Valder, Under-Secretary for Agriculture m New South Wales, has told me that he can see no reason why there should be any friction between an agricultural bureau, under the Federal auspices, and the Agricultural Departments of the States. He considers that the two could work hand in hand, that the experience of the State Departments will probably be of benefit to the Federal bureau, and that ultimately Australia will be able to take its place in the councils of the world in this regard.",21
117,Mr RODGERS,Unknown,That is the attitude the Victorian Director of Agriculture.,22
118,Mr HIGGS,Unknown,"Where does your Socialism come in 1  a proposal so broad as the one before us, I hope we are not going to intrude party considerations. If the honourable memket? ber would think for a moment, he would discover the difference between a public tion's business. utility and a Socialistic project. They are as wide apart as the Poles. Howable ever, I do not wish to be drawn to one side on a matter of this kind.",22
119,Mr RODGERS,Unknown,"This proposal is on same footing as universities and schools, which we all support.  number of matters that the Commonbald wealth can investigate by appointing the eminent laboratory and other experts, such matters as animal pathology, field research, the introduction of new crops, new plants, and new methods.",22
120,Mr KING OMALLEY,Unknown,D r y farming.  comes under the heading of new methods.,22
121,Mr LAIRD SMITH,Unknown,"Is not the State of Victoria already doing that work?  tagonistic to what the State is doing, I hope to be able to show that there is large portion of Australia for which no State has endeavoured to make better provision.",22
122,Mr THOMAS,Unknown,"Will not this Bill mean, the creation of more Government officials ?  bureau will be a costly Department, but as the result of the money spent therewill be the production of much morewealth than we have at the present time. In the United States, for every million, a similar Department has cost in the way of agricultural instruction, the result has been ten million dollars' worth of wealth produced. This is one Department ini which we can see a direct return ahead of us for the money we shall spend. W f r could follow the lines of the United States Agricultura l Bureau, and divide: the work into several divisions, each, under control of a noted expert. In the. first place, we should have a good laboratory in which eminent men can make in-: vestigations into such things as infectiousand contagious diseases of all sorts, pleuro pneumonia in cattle, tetanus,. of Texas fever, tuberculosis, and other i m portant diseases that ought to be invesantitigated by the very highest authorities, if we wish to be as successful in our prowith duction as we hope to be.",22
123,Mr HIGGS,Unknown,"As an anti-Socialist, whydo you not do that out of your own poc",22
124,Mr KING OMALLEY,Unknown,"That is the na member for Capricornia does not. realise that we are now dealing with a. national matter, and not with one that the should be approached from an individual point of view. To invite the individual to deal with the national aspect of affairs would land us into such troublea that the honourable member would goi n a week. In the initia l stages of work of this proposed Bureau of A g r i culture, I see no reason why we should be at all antagonistic to the States. I hope we shall never be antagonistic towards them, and I trust that we shall utilize their work as part and parcel of a great scheme. The State Departmentsare doing a lot of work that might well be published in the Federal reports for the benefit of the whole of Australia. Thei n New South Wales, V i c but toria, and Western Australia are doinga good, work, each for its own State, but the results ought to be made available to the whole Commonwealth. A few months ago Western Australia took from New South Wales the finest wheat experimentalist we had. He was the senior pupil of the late Mr Farrar, and New South Wales could ill afford to lose him, but Western Australia offered him more than he was getting in New South Wales, and, naturally, he went where his services were better recognised. As the controlling genius of the laboratory, I would suggest the pointment of a gentleman possessing a veterinary science degree, or of one holding a double degree, that is, a medical degree, and a degree in veterinary science. In most European countries the men at the head of affairs-possess double degrees. Sir John MCFadyean, a doubledjegree man, is an eminent authority, particularly on bacteriology and pathology, in Great Britain , and Sir Stewart Stock is Chief Veterinary Officer and head of the Department of Agriculture and Fisheries there. In South A f r i c a , Dr Thale is the bacteriologist. In America, Dr Mohler is the Chief Pathologist of the Bureau of Animal Industry, and in India Professor Holmes is the Imperial Bacteriologist. In Australia we have an eminent bacteriologist in Dr Gilruth, the Administrator of the Northern Territory, and another in Dr Dodds of the Sydney University. A name of wide-world reputation in bacteriology is Professor Bang of Denmark, who is the discoverer of the cause of epizootic abortion in cattle, which is at the present moment a matter of considerable importance to us. It is necessary that there - should be a gentleman possessing a veterinary degree at the head of affairs, because the British Medical Association objects to an individual who has not had special training in medical prudence entering the field of bacteriological investigation. A doctor of veterinary science must diagnose wholly from - symptoms, and thus acquires a more in t imate knowledge of the causes of many of the troubles which affect the lower creation than the ordinary medical man obtains of the causes of human disease. I - say that with the greatest respect for the medicai profession, and in justice to the eminent veterinary surgeons who bave so wide a knowledge of the bacteria and micro-organisms affecting animal life. - Coming to m 'other matter, I have before me a map prepared by the Commonwealth Meteorologist, which shows that one-third of the area of Australia has a rainfal l of less than 10 inches. It does not follow that that country cannot be settled, and should be abandoned as if it were a Sahara. It should be a function of the Agricultural Bureau to experiment with a view to ascertaining the methods to be employed to make good use of these dry areas. The Department should endeavour to find out also what constituents are ap- lacked by the soil, and how they can be best supplied, and should generally ascertain the possibilities of the country for agricultural and pastoral occupation. Magnificent crops may be obtained with a rainfal l of only 10 inches a year, provided that the rain falls in the growing season between May and October. In deed, I would sooner have a rainfal l of 10 inches between those months than one of 40 inches between October and March. In the Northern Territory, we have a Government farm on which £19,000 has been spent to date. The rainfall in the locality is 40 to 50 inches per annum, but according to the Government Meteorologist, no rain is to be expected in May, June, July, August, and September. Consequently, agriculture in the ordinary sense of the word is not possible there. What are needed are experiments to ascertain the possibilities of intense culture, or of crops, possibly even of wheat, which may be sown at times of the year differing from the times of sowing in the more favoured and cooler parts of the continent. The dry area to which I referred, if proved by careful experiments to be capable of settlement, would give room for a huge population that would help us to hold for ourselves what is probably the best country under the sun. The chemist has within the last juris- few years revolutionized our knowledge of agriculture, and I look forward hopefully to a considerable alteration of our methods. There are in the soil two kinds of micro-organisms, which are hostile to each other. There are bacteria, which are beneficial, and protozoa, which are harmful, and the discovery of methods which will keep the protozoa in check and cause the bacteria to thrive will greatly increase the yields of the soil. Experiments have been made which go to show that, land which has been gradually getting weaker and weaker, or "" sick,"" to use the word of the farmer, can be brought back to almost pristine vigour. It has been found that by subjecting soil to a heat of from 56 to 100 degrees centigrade the protozoa in it is killed, but that the bacteria can withstand a heat of 150 degrees centigrade, even though it may be forced back into the spore state. Honourable members interjecting  with this question from a broad point of view; and if my remarks are having no educational effect upon honourable members opposite, who are always telling us that they are the friends of the farmer, I am sorry for them. My object is to show some of the difficulties that have to be faced in connection with the greatest industry in Australia. The men on the land are responsible for the only exports of surplus production that we have; and honourable members opposite, who pose as the friends of the agriculturists, should be anxious to help them in every way. If we could have agricultural experts of eminent reputation engaged in connection with the bureau to carry out experiments such as are being conducted in other parts of the world, the whole country would be benefited. If the new agricultural theories developed by agricultural chemists can be effectively brought to bear in many of the older settled districts, where we have to resort to what is known as the rotation of crops and fallow-, ing, then our older ground will retur n a yield twofold greater than it is returning today, and the result must be a great increase wealth of Australia. Anything in that direction would be costly, no doubt, but the money would be well spent. I feel quite satisfied that the results which have been obtained in this direction in the United States of America would also be obtained in this great Commonwealth. ""We might have experts engaged also in connection with the important subject of the afforestation of many parts of Australia. At present a wicked, wanton waste is going on. Some of the finest timbers in the world are being ruthlessly destroyed. This waste is largely due to the ignorance of the individuals concerned, and perhaps, also, to the fact that although these timbers are of commercial value, there are no facilities at hand to encourage agriculturists to prove this great source of wealth, with tlieresult that they are simply burnt off.",22
