speakerGroups,Speaker,Title,text,pageNumbers
324,Mr SPEAKER,GOVERNMENT PREFERENCE,"I ask the honourable member to connect his remarks with the motion for the third reading of the Bill. Mr YATES\- I am endeavouring to refute arguments that have been advanced, in. support of the Bill. Our contention is that the Government will not stop at the prohibition of preference to unionists in Government employment as proposed, by this measure. The Attorney-General has admitted that if he had they power he would do away with preference to unionists in every shape and form-. There is. more behind the Bill than, meetsthe eye'. If we let the Ministerialiststell the country that we cepted the Bill, having, no-reasonable ment to advance against it, the thin edge of> the wedge, would be inserted to force the. principle of preference to unionists out of the arbitration law. Therefore we feel that we are doing the right thing in offering the strongest opposition to the Bill. We contend that no member of the community should be allowed to be the camp follower of any section; that non-unionists should not' be permitted to benefit Bytlie efforts of unionists who sacrifice tliemselves to obtain that which is just for : tlieir fellows. We say that those who bear the burden should aloneenjoy the benefits obtained. I should not object if it were provided, that those who do not subscribe to union funds, and take part ih the struggles which gain extra emoluments, shorter hours, and better conditions, should not enjoy, those benefits,, and thaf when the wages and' the"" industry to whichthey belong were increased as the result of' unionism they should be left to what the honourable member, for Werriwa has called the inexorable law of supply and demand. It is not only the workers who have to complain of men who wish to take advantage of the efforts of others. At the present time the bakers are-objecting to night work, which they say is detrimental' to the health of the operatives. They contend that bread should be baked in. the daytime, and that the day-baking system can be adopted, without, hardship to the public. Mr Eldridge, a prominent. Adelaide baker, who' has taken some partin the fight against the unions on this matter, writing to the local-newspapers) in reply, to the secretary of the Bakers - Society,, says; referring to a ballot taken by the Master Bakers Association to determine whether they should fight the unions, or allow the dispute to be dealt with by arbitration and conciliationSome who did not send in their papers gave verbal answers and financial assistance. The rest, unfortunately, were willing that we should do the work and shoulder the expense, while they meanly took any advantage that might bo gained. That class of individual is to be found in all societies and associations. That statement shows that those who have been calledthe sneaks of society are not found wholly among the workers. But the employers have methods of dealing with those who will not come into line. Sooner or later pressure is brought to bear, and on the next occasion those who ac- now will not take part in concerted action argu- will be no longer standing aloof. The employers'do not find it necessary* to ask for preference, because they have methods for enforcing"" combined action upon their members. The employees, however, are not in the same position. The unionists among them are fighting to benefit the community at large, and ask that a lawbe placed' on the statute book which will make it incumbent upon all to take their fair share of the work of improving the conditions of. the workers. The honourable member, for Wakefield spoke of Mr Lundie-wlio , I am proud to say, is a friend of mine-as . a good fellow who always says 1 straight out what he wants. He made a similar reference to the honourable member for. Darling. There are honourable members opposite who, in fighting unionism, accuse the. paid, officials; of the unions,, the union, bosses^ of causing strife. In view of the statementsthat we have h a i from such speakers, it was strange to hear, the honourable member for Wakefield' expressing, the highest admiration, for these, two bosses of the biggest union in Australia. I hope that when trouble again, takes place, and it may occur in connection, with a request for preference to the Common1 wealthi Government,, this eulogium will be remembered. Should any contest occur, it"" will be Mr Lundie's duty to see that any business betv: een' the Government and. the members of the Australian Workers Union is transacted through him. When he makes a demand, it is always for a few shillings more, or for better conditions. The time will come when we shall demand betterconditions, and I trust that the honourable member for Wakefield will assist those on this side of the Housewhb will support Mr Lundie and the Australian Workers Union in their attempts to better the conditions of the lowest grade of labour,, whose needs are greater than' of the skilled artisan. I hope that Govei'nment will not gain from the passhowever, ing of the measure what it hopes to gain. Personally I cannot' be accused of being afraid of going to the country, because - representa constituency in which Labour is not afraid of defeat. But this Parliaam ment has only recently been elected, has a three-year term to go. I shall iterate the constitutional arguments against a double dissolution; I wish dwell upon the Heedlessness of forcing country to spend £100,000 on an election two years before the due time. have heard a great deal of late of rights of thetaxpayer, and those who so considerateof those rights should loth to impose this burden upon the people. Having, gained their battle, .hope that the Ministerialists will tent with tlieir win, and will not try further. I appeal to them not to necessarily squander the people's money. ., There could be an amicable arrangement under which non-contentious legislation of benefit to the country could be with, without an appeal to the electors. Were Ministers really sincere in their jection to"" preference to unionists, would propose to amend the Arbitration and Conciliation law. Had they proposed suchan amendment, I should have drawn attention to a provision which is injurilation ous to trade unions. The union of which whole. I am a member has experienced, the hardship of it. The provision to which refer prevents unions from suing for rears. The quotation that I have from Mr Eldridge'sletter shows that there are bakers who refuse to honour their obligations-, and there are afew persons among the unionists. Notwithdoes-the . standing-, anything that may be said contrary;.I know that the union subscripness tion fees and entrance fees are not prohiis-bitive, and that in most cases no entrance .fee is charged. The Australian Workers Union does not charge an« entrance That union has never any occasion prosecute members for payment of arrears or to trace up recalcitrant legs, simply because the organizer calls on a manand. sells him a ticket prac©- which covers? the whole year's - scrip tion. In th© union withwhich-1 connected, there are some members who have got back in their payments-, and, according to a section in the Act, we ar© those forced to sue under a State statute in a the court of summary jurisdiction. Here, there comes into operation what is known as the statute of limitation, which makes it impossible to sue for I any arrears over six months. I see from your demeanour, Mr Speaker, that I somewhat wandering from the subject and before the Chair, but I may say that I not-ream still hopeful that the Government will introduce some amending Bill to to make the Conciliation and Arbithe tration Act more acceptable to trade unionists-. If they do that the GoWe vernment will bestow a boon on organized . the labour, and remove some ground for the are charge that they hav© been some eighteen be months in office and have not introduced any legislation of public benefit. I shall I say no more, but leave my remarks to be conhave tfieir effect on the Government. I to go feel positive that when the great day uncomes, if ever it does come, for an appeal to the people, the Labour party will have nothing to fear. In thedevelopment of this party from industrial unionism we dealt have no cause to be ashamed; and I am optimistic enough to think that, when the obnumbers go up, instead of finding the they figures 38 to 37, we shall come back with a greater majority than that with, which we left office on the last occasion, and that we shall be able tointroduce legisto' thebenefit of the peopleas a",49
325,Mr TUDOR,GOVERNMENT PREFERENCE,"Yarra) [8.34] - This , I I suppose, is .the "" last lap,"" but I do not arthink tfiat the vote willsettle the quesmade tion. We know that no question is settleduntil it is settled aright, and certainly this"" Bill does not represent the right such way""; and no one knows that better than Attorney-General. This Bill has to-the beenconceived' in a spirit of vindictiveagainst the industrialunions, and it an attack on< those' unions, and those unions alone. If it were not for the* fact that during .the' last few years theindusfee. trial unionshave takenpolitics more to Seriously than everbefore, this Bill' would not have been introduced'; and it is only blackbecause the workers have seen fit to organize politically, as well as industrially, for a that we have this proposal before us. subHere, again, no one is better aware of the am facts-than is .the Attorney-General'. The unions are now beginning to make their weight felt ab the polls. In 1890, at the time of the maritime trouble, the men were told not to strike, but to get their grievances redressed by their representatives in Parliament; and the corollary of organization is the representation of organizations before the industrial tribunal. That being so, those who undertake the work of organizing the workers, and the work of the organization, and of settling these industrial matters are entitled to some reward in the shape of preference. It is within the memory, I suppose, of every member of this House that unionists, as workers, were at one time divided into two political camps, as they are now to a large degree in Great Britain, the United States and other countries; and it is only when they organize themselves definitely as workers that any fault is found with them. To-day the honourable member for Wakefield taunted some honourable members on this side with not having been very long in the trade union movement-wit h coming into that movement simply because they desired to obtain what he termed "" political plums."" That view of the matter is, however, an entirely incorrect one.",50
326,Mr HANNAN,GOVERNMENT PREFERENCE,The honourable member has slandered every working man in the community.,51
327,Mr TUDOR,GOVERNMENT PREFERENCE,"That is not new in the case of the honourable member for Wakelikely field. It may be that some who have come later into the movement have risen minent places by reason of their ability, and, at any rate, it would be quite easy to point to some honourable members opposite who have not been in politics very long, hut who have found places in this House and positions in the Liberal party. employees. As I said on the second reading, I am not so concerned with the Bill as with the fear that honourable members opposite will not put the position fairly before the satisfied. people if there should be a general election on this question. orable members opposite ought to tell to the truth. the electors that this Bill has no relation whatever to permanent employees in the Public Service, but that applies to the temporary hands, and that it gives no advantage over any other sons in the community. My fear in this regard is strengthened by what appears the current issue of The Liberal, a periodical which is published in Victoria in support of the present Government. do not know whether the extract is a report of a speech delivered by the Minister of Trade and Customs or is an article contributed to The Liberal by him, but it is as follows:PREFERENCE IN ADMINISTRATION. MINISTER OF CUSTOMS, HON. L - E. GROOM, EXPOSES THE INJUSTICE OF THE CLAIM. If men are to be appointed to the Public Service, not because they are the best men for the jobs, but because they have rendered some service to the community, why should that service to the community be confined to one object only? The Minister of Trade and Customs knows full well that this Bill applies only to the temporary employees of the Government, and my fear is that it may be represented to the people that permanent appointments are involved.",51
328,Mr GROOM,GOVERNMENT PREFERENCE,When I spoke on Friday I said distinctly that the Bill applied only to temporary employees.,51
329,Mr TUDOR,GOVERNMENT PREFERENCE,"This is not the only publication which supports honourable members opposite, and which misrepresents the position; and the statement. I have read is an absolutely unfair one.",51
330,Mr GROOM,GOVERNMENT PREFERENCE,The Liberal is one of the 0 fairest papers in Australia.,51
331,Mr TUDOR,GOVERNMENT PREFERENCE,"If I were permitted, I could draw attention to another paragraph in this paper which expresses the opinion that the honourable member is not to drop dead with heart disease owing to the speed with which he is dealto proing with the Navigation Act. Every lionorable member opposite knows that this Bill applies only to temporary men.",51
332,Mr GROOM,GOVERNMENT PREFERENCE,What the honourable member has to justify is the principle of granting preference to even temporary,51
333,Mr TUDOR,GOVERNMENT PREFERENCE,"If honourable members opposite will present that view, and that view only, on the platform, I shall be",51
334,Mr WH IRVINE,GOVERNMENT PREFERENCE,The honourable Honmember may be sure that we shall stick,51
335,Mr TUDOR,GOVERNMENT PREFERENCE,Then the Liberal party will follow a different line from any they it only have followed hitherto.,51
336,Mr RODGERS,GOVERNMENT PREFERENCE,How many Commonperwealth employees will the Bill apply to?,51
337,Mr TUDOR,GOVERNMENT PREFERENCE,"I gave the figures durin ing the second-reading debate, but I may tell the honourable member that there are three classes of employees in the Public I Service. First, there are the permanent men, who number about 20,000, and get intothe Service by examination, and by examination only, a system which is different from that in practice where Liberal Governments are in existence. I could quote an article from the Age of 21st May to show the rottenness in the Public Service that exists in Great Britain under a Liberal Government. Next, there are about 14,000 or 15,000 exempt officers, who do not come under the Public Service Commissioner; and, lastly, there are about 2,000 or 3,000 employed on temporary work; and, seeing that the Government are abandoning the day-labour system and going in for contract work at double the cost at which they could get work done by day labour-as the Prime Minister showed in connection with the laying of telephone cables in Sydneyand are going to give away more of the taxpayers' money by doing something which they would not do with their own private concerns-ther e they employ direct labour wherever they can, because they know that if they appoint good overseers they can get better work from direct labour than from contractors-ther e will be fewer temporary employees if the Government employ contractors to do the work. The honourable member for Wannon will have an opportunity to speak after me.",51
338,Mr BODGERS,GOVERNMENT PREFERENCE,That is why I wish you to answer my question.,52
339,Mr TTJDOB,GOVERNMENT PREFERENCE,"It is not permitted to answer questions; but I can adopt the attitude of Ministers-if I find a question too knotty, I can ask the honourable member to give notice of it ; if I find that I can score by doing so, I answer it .",52
340,Mr RODGERS,GOVERNMENT PREFERENCE,Will you say that there are no employees outside the Commonwealth Service who will not be affected by this preference?,52
341,Mr TUDOR,GOVERNMENT PREFERENCE,"As far as I understand the Bill, it is supposed to have one specific purpose, and that is to deal with the question of preference to Government employees. If the Government desire it to apply to all, why do they not bring forward a comprehensive measure, and wipe out the provision in the Arbitration Act? But they do not dare to do that. Mr. Deakin, who described the party opposite so ably as the "" wreckage of all parties,"" and who afterwards joined them, and was one of the wreckage thrown up on the beach, showed in another speech how preference to unionists had grown, and how it was agreed to, so far as the Arbitration Act was concerned, by all partiesincluding the wreckage and the political deadbeats. What I object to is that there will be misrepresentation on the platform by our friends opposite, and that it will be made out, as the honourable member for Wannon has tried to infer, that the Bill will operate further than is proposed, and that it will probably apply to rural workers and others, though honourable members know full well that it will not apply to any one but those in the Government Service. Let me quote further remarks by the Minister of Trade and Customs from this publicationIf to reward some service rendered to industrial unionism we may depart from the principle of making appointments to the Public Service on merit alone, we are entitled to depart from that principle on other grounds. Here we have again a reference to appointments to the Public Service.",52
342,Mr GROOM,GOVERNMENT PREFERENCE,"Exactly , to the temporary service.",52
343,Mr TUDOR,GOVERNMENT PREFERENCE,"When we speak of appointments to the Public Service, we mean permanent appointments, and the use of the word "" appointment"" in connection with this matter is deliberate misrepresentation of the case.",52
344,Mr GROOM,GOVERNMENT PREFERENCE,"You have forgotten section 40 of the Act, which says that you are required to appoint the men best qualified for the work, other things being equal. You did not do that.",52
345,Mr TUDOR,GOVERNMENT PREFERENCE,The honourable member is trying to twist and turn the matter to something else. I ask the Attorney General-Would he say that any person who was being employed by the Commonwealth in a temporary capacity was being appointed to the Public Service?,52
346,Mr WH IRVINE,GOVERNMENT PREFERENCE,Yes ; because the Act says so.,52
347,Mr TUDOR,GOVERNMENT PREFERENCE,"The Act says no such thing. They can be put off at any time. They cannot work longer than six months, with an extension of three months under special circumstances.",52
348,Mr WH IRVINE,GOVERNMENT PREFERENCE,"You asked me the question. The answer is in the Arbitration (Public Service) Act. Mr J. H. CATTS - The Attorney General knows perfectly well that it does not apply, for instance, to men engaged on railway work. Mr W. H . IBVINE - Yes , it does. Read the Act for yourself. Honourable members forget their own Acts.",52
349,Mr FENTON,GOVERNMENT PREFERENCE,This is bluff.,53
350,Mr TUDOR,GOVERNMENT PREFERENCE,"Yes , absolute bluff.",53
351,Mr WH IRVINE,GOVERNMENT PREFERENCE,"Will the honourable member read the definition of "" Publio Service"" in thab Act?",53
352,Mr TUDOR,GOVERNMENT PREFERENCE,"The section provides"" The Public Service of the Commonwealth "" includes the Public Service of the Northern Territory and of the Territory of the Seat of Government, and the service of airy public stitution or authority of the Commonwealth, and includes all persons employed in any such service in any capacity, whether permanently or temporarily. But that does not say that temporary men are appointed to the Public Service. No one can say that a man who gets a temporary job on telephone conduits is getting a permanent appointment in the Public Service.",53
353,Mr WH IRVINE,GOVERNMENT PREFERENCE,A loud voice will nob cover an obvious mistake.,53
354,Mr TUDOR,GOVERNMENT PREFERENCE,"I do not claim that it will, and I do not think that a man who adopts a cold attitude will freeze anything. Whether they go through the Public Service Commissioner's office or not, they are not public servants.",53
355,Mr WH IRVINE,GOVERNMENT PREFERENCE,You know that the section answers your question.,53
356,Mr TUDOR,GOVERNMENT PREFERENCE,"I am positive it does not. The Attorney-General may bluff juries and other people, but his bluff will not go down here.",53
357,Mr WH IRVINE,GOVERNMENT PREFERENCE,"Then I shall not attempt to answer any more of your questions. If that is the way you treat them, you need not put them to me.",53
358,Mr TUDOR,GOVERNMENT PREFERENCE,The honourable member need not answer them. He can go on drawing on his pad.,53
359,Mr SPEAKER,GOVERNMENT PREFERENCE,Order !,53
360,Mr TUDOR,GOVERNMENT PREFERENCE,"If the Minister takes up such an attitude, and puts himself on such a pedestal, and thinks himself high and above every one else, he may surely be referred to just a little by humble honourable members of the House like myself. I was referring to the obvious misrepresentation of the Minister of Trade and Customs when he was speaking, as quoted in this paper.",53
361,Mr GROOM,GOVERNMENT PREFERENCE,"Unde r section 40, what was the qualification for appointment?",53
362,Mr TUDOR,GOVERNMENT PREFERENCE,"I suppose the qualification was that the men were wanted, and that they were able to do the work.",53
363,Mr GROOM,GOVERNMENT PREFERENCE,The Public Service Commissioner had to pick the men best qualified for the work.,53
364,Mr TUDOR,GOVERNMENT PREFERENCE,That is what we did every time; we picked the best men qualified to do the work.,53
365,Mr GROOM,GOVERNMENT PREFERENCE,""" Other things being equal, unionists preferred.""",53
366,Mr TUDOR,GOVERNMENT PREFERENCE,"Yes ; if two men arequalified, and one is as good as the other,. I know that 1 would pick the man whoin- had battled in the trade union movement,, who had probably been victimized.",53
367,Mr WH IRVINE,GOVERNMENT PREFERENCE,"Of course, your Government would appoint the men whohad done the ""battling"" for you?",53
368,Mr TUDOR,GOVERNMENT PREFERENCE,"The honourable membersaid he would not "" chip in."" I admit hedid not say "" chip in""-h e - would use more dignified language. But I did not say that we would appoint the men who had done the "" battling "" for us. I said that we would appoint the men best fitted for the work, and that if there were twoequal in capacity I would appoint theunionist.",53
369,Mr FENTON,GOVERNMENT PREFERENCE,"Who had done the"" battling.""",53
370,Mr TUDOR,GOVERNMENT PREFERENCE,"Yes , the men who had done the "" battling"" in connection with< trade unionism, and who had probablybeen victimized for it. I have been "" through the mill,"" and I have beenvictimized. The man who takes a prominent part in union affairs is likely to bevictimized. I can quote some evidencetaken before the last Tariff Commission, of a man who was victimized for that reason. I can show how the secretary of the Employers Federation telephoned! to, or wrote, round urging employers not to employ him because he was the secretary to a union. However, I was speaking of misrepresentation that will' be used, in saying that these are Government appointments, when every honourable member knows that a temporary appointment gives a worker no advantage sueh as is conferred by a permanent appointment, - and that, though a man isappointed to the temporary staff half-adozen times, he will still need to pass an examination before being appointed, to thepermanent staff in the Public Service. If - it had been otherwise, and a man on the temporary staff was a member of the Public Service, would there have been any necessity for me to ask the Postmasters General, in connection with the telephoneconstruction work, why a number of men had been put off? Temporary men canbe dispensed with at any time, and thrown out on to the industrial scrap-heap. The Minister of Trade and .Customs, in this speech, went on to sayNow let ns take the strong reasons against giving - that preference to unionists. First of ail, giving preference to unionists would fetter ajid .tie .the hands of the Commonwealth, and prevent us from having free selection in getting the best men. Tho second objection to preference to unionists is a serious one. It is that unions are becoming daily more and more political. That is the trouble. As a matter of fact, the schoolmaster is at work, and the trade unionist knows that it is absolutely useless for him to pay into his union and then allow the political machinery to be used, as in the past, to his detriment.",53
371,Mr FINLAYSO N,GOVERNMENT PREFERENCE,The Employers TJnipns arc political.,54
372,Mr TUDOR,GOVERNMENT PREFERENCE,"Of course they they have to contribute far more than the members of trade unions. Sir ROBERT BEST,-There is no preferthe ence with them.",54
373,Mr TUDOR,GOVERNMENT PREFERENCE,"There is no need to give preference in the case of the employers' union, because every one is in the organization. I read the other evening the rules of the Meland bourne Carriers ancl Carters Associamember. tion. The members of that union are employed by the Customs Department in every port of Australia in removing goods from the wharves to the King's wareyears ago. houses, and as all the large carriers are in the association, I guarantee that no one else tenders for the work, unions, both of employers and ployes, are strong enough to decide wh-it action they wil l take, and they do bother about asking for preference. The Felt Hatters Union, of which I am financial member, has never asked f o preference anywhere, for the simple son that in most places we have union 100 per cent, of the employees in the trade, and we do not worry about preferpresent time, ence. We can decide on what action we choose. The honourable member f o Echuca stated s",54
