speakerGroups,Speaker,Title,text,pageNumbers
228,Mr FISHER,GOVERNMENT PREFERENCE,"Perhaps I ought, to withdraw the word "" f r a u d , "" and I do but the Bill is admitted by its introducers to be a subterfuge-to be a B i l that does not carry its purport and i tention on its face. It is admitted that, even if the Bill be enacted, it will alter the present condition and of the Government in relation to preference to unionists, and that the only effect it can have, or may have, in the future will be that any sort of men may be employed by the Government. would be far better to take the honest and straightforward course. As regards unionists generally, they axe-shal l I - as much interested in watching each other as in watching non-unionists; and a Government that abused its privileges business. and powers in the way of preference would undoubtedly suffer. Some of the greatest industrial fights have arisen from disputes between unions and sections unions. Many people have the idea that ment. unionists' are a united body, and that all work together in harmony; but the very in his criticism. opposite is the fact. Unionists are quite prepared to see all unions get justice, b no more. If any injustice were done a Government as between unionist and unionist, or between unionist and nonwhich unionist, the fair-minded men in unionsays ism would be the first to make complaint. While, in my opinion, the Government have wasted their opportunities, and failed to cany out their mission, I think they have done great service to the party the other side. with which I am associated. The Governthat ment have shown that they are careless the other day. of the interests and welfare of the people generally. They have shown that the clamours of the unemployed, the failure of immigration, the financial position, and the general difficulties of government, have no weight with them. They only one object in view, namely, to vert the principles of the Constitution the hope of lingering for some time longer on the Treasury bench. I wish again to clearly affirm my view that, so far from Government preference to unionists being a partisan proposition, or one°likely lead to the employment of unionists as are engaged in rearing. against non-unionists to the disadvantage of the country, it is a sound principle that the Government, so far as they are of tragic possibilities. employers, should, through their officers, wherever practicable and possible, give preference in the interests of the smooth working of particular industries or pieces of work, and for the advancement and advantage of society generally. I would gladly defeat this Bill , and I hope that, [57] l whatever contest may arise, it will be n - fought on those high lines which I am sure we all desire. If the battle goes outnot side,.!, for one, shall welcome it.; and the position sooner it comes the better.",33
229,Mr RICHARD FOSTER,GOVERNMENT PREFERENCE,"Wakefield) [5.2] - I wish, as briefly as possible, .to make a few observations on the question It before us. . The debate upon this question has possibly been one of the longest, and certainly one of the dreariest, in the 'hissay't tory of this Parliament. The ex-Prime Minister, on the second-reading motion, gave evidence that his heart is not in the I believe that, not only the right honourable gentleman, but many others associated with him, would be delighted if this vicious principle had never of been introduced by the Labour Govern The Leader of the Opposition this afternoon has '' blown hot and cold '' He, first of all, deprecated the intention of the Government u t to use all constitutional means to have an. by appeal to the people as quickly as possible, in order to settle the dead-lock undoubtedly has arisen. Then he that the Government are clinging tenaciously to the Treasury bench. Hit high or hit low-it does not matter which-the Government are wrong every time, according to honourable members on I appreciate one thing the Leader of the Opposition said It has been a common cry on the other side that the Bill practically means nothing, that it is a mere shadow, that it is a fraud to occupy the time of honourable members, and involve expenditure in discussing it; but the have right honourable gentleman said, very prosubperly, that he did not agree with that in view, that it was not a sham, and that, it was a matter of real importance. Every honourable member knows that it is not only not a sham, but a vital question. It is, for honourable members opposite, the to foundation stone of the structure they Not only do I agree with the Leader of the Opposition, but also I believe that the Bill is full The objective of honourable members on the other side of the Chamber, and the followers of the previous Government, was not only to secure industrial supremacy among the workers of the Commonwealth, but also to secure absolute control of the administration of public affairs-ther e is not the shadow of a doubt that that is the object of the party represented by honourable members opposite-and therefore the Bill is a matter of great concern to them, because their defeat on this vital question means a serious loss of prestige to them. In considering this question, need to look at the evidence on every hand of the extremes to which the Socialistic party directs its efforts day by day. At this moment there is a big amalgamation of forces proceeding, and the intention behind this amalgamation is that Parliament is to be captured, if it is at all possible, while the resort to the general strike on Syndicalist lines is still to be retained. The objective of this movement is not better conditions, but is the destruction of the social order. Let us look at one or two of the claims made by honourable members opposite and their supporters to preference to unionists in the Government service. One their claims has for its basis the assertion that such preference will promote industrial peace. But they know better. That claim is repudiated by one of the leaders in the great Labour movementthe honourable member for Darling-wh o says unmistakably that there will be no peace until the present social order is overthrown. The honourable member is a more powerful man in .the Commonwealth than the Leader of the Opposition; he is the greatest power in the great industrial army of Australia, and on his statement we cannot expect any peace.",34
230,Mr FISHER,GOVERNMENT PREFERENCE,He is a dear old man; long may he live!,35
231,Mr RICHARD FOSTER,GOVERNMENT PREFERENCE,"He is a very fine man; he is also very straight; he does not throw dust in the eyes of the electors; he tells them the truth and the whole truth every time; he makes the same speech whether - he is speaking on the Yarra bank or to the producers of the community; he has a goal in view, and never loses sight of it ; but that is nofcfchecase with the leaders of Socialism generally, for Socialism speaks with many voices, its speech is varied according to the audience. Another claim for preference to unionists in the Government service is based on what unionists have done for the uplifting of their fellows, and the improvement of the industrial conditions of the world. That a very fine sentiment when it comes from the right lips, but when we hear this kind of advocacy we find, as a rule, that it comes from the militants, the new-born enthusiasts, who rush into the limelight and talk as if fchey had sacrificed their lives for the accomplishment of the purpose fchey have in view, and for securing the better conwe ditions that obtain in the industrial world today. When I hear them. I think of the men of the past who have gone through the fire and have had their baptism of blood in the work to which they devoted their lives, and have translated their heroic, self-sacrificing advocacy into Acts of Parliament. We cannot think of the benefits accruing to industrial workers in different parts of the world - and particularly in the Commonwealth-withou t remembering those great men who, in times of unpopularity, faced the position without fee or reward, and on whose great work has been reared the superstructure of of economic laws which benefit, and rightly benefit, the industrial workers of today. In the progress and development of the great Labour movement, where are those men who devoted their lives in a self sacrificing manner to the uplifting of their fellows? Are they recognised as they should be by the union movement of today? I tell the honourable member for Adelaide, the most recent addition to the House, that his advent here is a striking illustration of the fact that they are not recognised. My statement to that effect can be borne out by men who have done nearly everything towards what the workers of South Australia have achieved today. They will tell the honourable member that they have been turned down for these new militants, some of whom have never had a union ticket until they required it in order to open the door to parliamentary representation or some other lucrative billet in the Labour movement.",35
232,Mr YATES,GOVERNMENT PREFERENCE,You know that is absolutely incorrect.,35
233,Mr RICHARD FOSTER,GOVERNMENT PREFERENCE,"I know that it is not, and every honourable member from South Australia knows that it is not. I do not believe in thinking things without saying them. I hope I never shall. I wish to say that, so far as the claim for preference on the ground that is unionists have done so much for the movement is concerned, the greater proportion of the militants of today have got as much outof the Labour movement as they have put into it. I am reminded of an illustration in New South Wales, where one of the solidest and most faithf u l men in the movement was put down and another put in the Speaker's chair in his place. That also serves to drive home the statement. I have made. In fact, the claim put forward is a poor, miserable basis on which to build the argument for preference to unionists in the Government service. There is no tangible reason advanced for the claim for preference to Unionists in the Government service, but there are reasons of great weight why preference should not be extended to them. It is not industrial unionism; it is tical unionism. If we could get back to industrial unionism a lot of the enthusiasm would melt away within twenty four hours. The basis of all this business is selfishness. There is something to be got, some plunder; there are some plums in view, like the proverbial bunch of carrots, that always will be an incentive to patriotism. It is not only political unionism to which wo object, but it is political unionism of a tyrannical and oppressive kind; We have heard during the course of this debate-and it has been reiterated again and again-that the oppressions of the past, the tyrannies of capital, are still ringing in the ears of men, and that because of the deliverance of the workers by the good work of unionism, unionists should have a free hand and no competitors. Let me tell honourable members on the other side that they have not killed tyranny and oppression; they have simply transferred it from the oppressor of the past to the unionist oppressor of today.  your own physic, and you do not like it .",35
234,Mr EICHARD FOSTER,GOVERNMENT PREFERENCE,"-When the Labour physic comes into conflict with the honourable member's own interests at times he will not take it . The honourable member never believed in the attempts of his colleagues to fasten the day labour system on to Government works, and he would not be in the House today, or as well off as he is-and as everybody is delighted to know that he is-if he swallowed all the nostrums that Socialism offered to him. ",36
235,Mr RICHARD FOSTER,GOVERNMENT PREFERENCE,It is an awkward and a nauseous question.  victimized. [ 5 7 ] -;,36
236,Mr RICHARD FOSTER,GOVERNMENT PREFERENCE,"I do, and I detest victimization, and I always did. I detest oppression and tyranny, and I always did, and oppression is just as bad when practised by the unionists as when practised by anybody else. Let me give an illustration. Not many months ago two energetic unionists were seeking to increase the number in the fold. Using a little moral suasion, they were practising what we now and again hear designated "" social Christianity."" They desired a bullock-driver to enter the union, and he refused to do so. All the persuasiveness of those men was of no avail, poli- so what did they do? As soon as he got out of the way, tliey burnt his bullock yokes. That was "" applied social Christianity."" ",36
237,Mr RIOHARD FOSTER,GOVERNMENT PREFERENCE,The names of those two men were E. A. Miller and F. H . Mitchell. ,36
238,Mr RICHARD FOSTER,GOVERNMENT PREFERENCE,"If the honourable member will possess his soul in patience I will tell him all about them. Fortunately those two unionists were caught in the act of burning the bullock yokes; they were brought before a Court, and were sentenced to six months' imprisonment without the option of a fine.",36
239,Mr FALKINER,GOVERNMENT PREFERENCE,B y a Liberal J.P.,36
240,Mr RICHARD FOSTER,GOVERNMENT PREFERENCE,"No, I think a stipendiary magistrate was on the bench. ",36
241,Mr RICHARD,GOVERNMENT PREFERENCE,"FOSTER - The honourable member would not persecute them, nor are the unionists persecuting them for their action. ",36
242,Mr RICHARD FOSTER,GOVERNMENT PREFERENCE,"I am telling the honourable member something of the tender sympathetic side of the unionists. The sentences of these men have just about expired, and in a Labour daily newspaper I find that Mr Lundie, secretary of the Adelaide branch of the Australian Workers"" Union, is about to make a presentation to them of a gold medal each.  cavil at.",36
243,Mr RICHARD FOSTER,GOVERNMENT PREFERENCE,I do not think they will see anything to cavil at either. ,36
244,Mr RICHARD EOSTER,GOVERNMENT PREFERENCE,"Mr . Lundie is a man who speaks out what he has to say, and does not say one thing when he means another. Mr Lundie, on behalf of fellow unionists, is going to present those men with a gold medal each in recognition of their capable services and their loyalty to unionism.  has appreciated their services.",37
245,Mr RICHARD FOSTER,GOVERNMENT PREFERENCE,"The honourable n.ember does not believe in that kind of thing.  recognition of their services to unionism, not to tlieir burning down sheds or bullock yokes.",37
246,Mr RICHARD FOSTER,GOVERNMENT PREFERENCE,"On the representations of honourable members, we are to throw wide open the doors of the Public Service to admit these men who have placed honourable members where they are. I ask honourable members where the public taxpayer comes in ?  know.",37
247,Mr RICHARD FOSTER,GOVERNMENT PREFERENCE,"The taxpayer is the gentleman who gets the last and least consideration in this Parliament, whereas he ought to get the first consideration. What is this policy going to cost the country? There is no getting away fron.' the fact that the previous Government took the money in the Treasury, - contributed by everybody in the community, irrespective of class, contributed whether they pleased or not, and appro- priated it in the interests of the men who sent them into Parliament, and who keep them here. I desire to know whether that is a policy of which honourable members, whether they be the old unionists or the new brand of militan t unionists, can be proud ? Let me here remark that the phrase "" all things being equal,"" in reference to preference to unionists in the Public Service, was simply "" bunkum, "" and farcical; that principle was never practised. In the eyes of honourable members opposite, there is no one equal to the man who is a unionist. They cannot help that attitude, because their masters, who sent them here, ordered that that policy should be given effect to. Mr W . H . IHVINE - Eve n if that were not true, it would not justify preference to unionists.",37
248,Mr RICHARD FOSTER,GOVERNMENT PREFERENCE,"It would not; but the position is that their employees are their bosses, and where can there be any discipline under that system ? Where there is no discipline, there is no efficiency, and when there is no efficiency, God only knows what the cost to the country may be. I do know that if there was one thing more than another responsible for the overthrow of the Fisher Government it was this question of preference to unionists, combined with their shocking administration of the expenditure. I say, without fear of contradiction, that those two things, together with their day-labour methods, have been responsible for the waste of at least half a million a year: and I firmly believe that if we could rescue this country from the demoralized condition into which the Service from top to bottom has sunk, and if we could promote efficiency in all Departments, a million pounds of the taxpayers' money could be saved very easily indeed. Every man who has a spark of manliness rejoices in the improved condition of the worker; everybody rejoices that, during the good years through which we have passed recently, when Australia has enjoyed such a large measure of prosperity, the workers have been sharing in that prosperity by having their wages bettered from time to time. But what is the attitude of unionism today ? It is to extract, not only what is just on sound economic lines, but to exploit the public Treasury and the private employer down to the very last drop of blood which it is possible to draw. I desire to read something to honourable members in illustration of that statement. It is well known that, on the Kalgoorlie to Port Augusta railway, one contractor has been paying the men 13s. 4d. a day. There are railway construction works in progress in South Australia-particularl y along the west coast-and the contractors are paying 10s. a day to the navvies for similar work, but in a different climate, and within reach of a lot of the necessaries and comforts that are obtainable only under great difficulty along the route of the transcontinental line. Mr Verran, the late. Labour Premier of South Australia, was endeavouring, by day work, to construct a piece of railway, on which job the Government paid 9s. per day; but the unionists made things so hot and difficult for him that he had to tell them straight out that they had made it impossible for the - Government ,to do the work. - called in a contractor, and gave him per cent, more than the estimate to plete the railway for the Government. That contractor started straight away paying 10s. per day, and has been buildresisted. ing railways for the South Australian vernment ever since. Tenders are called now for another line on the west coast, the force of public opinion. known as the Decres Bay railway, and I believe that tenders are due to close against a stone wall. about the end of this week. I have in my hand a notice that one contractor has ceived from Mr Lundie, the representaone, tive of the Australian' Workers Union in South Australia, and I believe that it free country by free people. is a copy of a similar notice sent by the fame gentleman to all men who are conral tracting for railway work under the Australian Government. . Mr Laird SMITH - What has that - do with preference to unionists?",37
249,Mr BICHABDPOSTEB,GOVERNMENT PREFERENCE,"It has a - great deal to do with it . It shows that, under preference to unionists, there is limi t to what works may cost the payer.",38
250,Mr FENTON,GOVERNMENT PREFERENCE,That is like the Teesdale Smith contract.,38
251,Mr BICHABD FOSTEB,GOVERNMENT PREFERENCE,"The Teesevery dale Smith contract is the Opposition's work. one little ewe lamb, but, from what I can hear, the results of that contract will f a ls if y their sta'tements,. and Mr Teesdale Smith, for whom I ain no advocate, and whom I do not know, is not going to make out of it the fortune that has been gested. This is Mr Lundie's warningDEAR SIR,- I wish to bring' under your notice that members of the Australian Workers Union will require to be paid the same rates of as are paid on the contract work on the West Line, namely 13s. 4d. per day minimum, on all works ou the west coast of this State, and' will come into operation on the new contract .coming out for the Decres Bay country. Line. . . The price paid by contractors in that - Statehas been 10s - the highest price a good example ?' paid by the Government - and that a Labour Government - was 9s. per day. But Mr Lundie intimates to these conmany more are today. tractors that they are forthwith to pay 13s: 4d-. per day. That is the kind of unionism to which preference is to given. I do not think there is any likelihood' of such a disaster befalling country.",38
252,Mr BAMFORD,GOVERNMENT PREFERENCE,"It will have to be given, question to' aboard. themenw ill see to' that. So he Mr RICHARD FOSTER - Le t me; 10 tell m y honourable friend that they will' comnot, and that, despite the amalgamated forces of unionism, the time is fast coming when such demands will be steadfastly There is one power that is Gostronger even than that of the amalgamated unions, and that is the power and When you 1 are up against public opinion you are up Public opinion, in the long run , will prevail every time. reThere is yet another reason, and a solid why preference to unionists in the Public Service should never be given in a Such a preference is not in the interests of the genetaxpayer, and the future development South of this great country. We have only reached the fringe of the development of to Australia, but under militan t unionism today every time there is more pay there is less work. That is a substantial rea<son why there should be no preference to no unionists in the Public Service or in any taxother employment. Preference should he given only' to merit' - Honourable members opposite may receive that statement with great meekness, but let ine say again that tim'e* there is more pay there is less",38
253,Mr BRENNAN,GOVERNMENT PREFERENCE,"The moral is, I suppose', that there should be less pay?",38
254,Mr RICHARD FOSTER,GOVERNMENT PREFERENCE,"The ' statement doe's""riot' apply to' the honourable, sugmember since the poor"" unfortunate workers, wdienever there is an industrial dispute, have to find the money to pay his 20th Moy, 1914. fees, although every one else goes short. I wish to say with all the earnestwages ness at m y command that the attitude of Eastunionism today in reducing the stroke and in giving a lower value for a higher pay is a most serious outlook for the",38
255,Mr LAIR DSMITH,GOVERNMENT PREFERENCE,Why does not the (honourable member take on the job and set.,38
256,Mr RICHARD FOSTER,GOVERNMENT PREFERENCE,"If I had taken on the job I should be where a good In reply to the Eeader of the Opposition I would say that his charge against the Government of rebe fusing to' deal here and now with the Tariff,- instead of this Bill, cannot be supthis ported by members of his own party. The Government have remitted' the Tariff That is the wisest and most statesmanlike action that has been taken during tke history of this Parliament. There is one newspaper that is everlastingly screeching, in season and out of season, about the T a r if f , and that newspaper is screeching today, because a competent board is analyzing the T a r if f question.",38
257,Mr DEPUTY SPEAKER,GOVERNMENT PREFERENCE,The honourable member is out of order in referring to that matter.,39
258,Mr RICHARD FOSTER,GOVERNMENT PREFERENCE,"T believe that I am, but I was merely replying to the Leader of the Opposition, who, in his concluding remarks, referred to the Tariff question. I shall not, however, follow a bad example. I hope to be able at a very early date to speak with no uncertain sound on the question of the Tariff, which affects the Opposition, in its relation to the cost of living, just as it affects honourable members on this side of the House. There is trouble ahead in connection with the present-day attitude of unionism in discouraging men from giving an adequate day's work for a generous day's pay. This sort of thing cannot always continue. It is not only piling up the cost and increasing the waste in every direction, so far as the public Treasury is concerned, but is having a reflex influence on the work of p r i vate employers, and particularly in great industries for which a fair ly high Tariff is demanded. If I know the temper of the people of the Commonwealth, then ' those very people who converted Labour's majority of ten i u this House into a minority of one will earnestly arrest this practice of preference before it becomes any stronger. The sooner we go to the people for a decision the better, since there is no bigger question, no question more vitally affecting those who have to pay the taxation of this country, than that of preference to unionists.",39
