speakerGroups,Speaker,Title,text,pageNumbers
310,Mr OKEEFE,PORT AUGUSTA TO,"Wester n Australia has a larger population than has Tasmania, but I submit that greater justice would have been done if this Bill had proposed a special grant.",49
311,Dr EARLE PAGE,PORT AUGUSTA TO,The arrangement we suggested to Tasmania was contingent on the acceptance of our proposals.,49
312,Mr OKEEFE,PORT AUGUSTA TO,"On every occasion when I have had the opportunity, on the public platform and elsewhere, I have urged that £100,000 was only a fair sum, but that the payment of it should not he subject to an arrangement made from year to year. I do not feel inclined to move an amendment, simply because I am satisfied that it would not be carried. I am not disposed to offer any objection on the score of the amount, but if any honourable member opposite desires to move that it be increased, I shall support him. However, I welcome the Bill as. at least, an. instalment of justice long overdue, though I should have much preferred if it had provided for £100,000 over a term of five years.",49
313,Mr JACKSON,PORT AUGUSTA TO,Under the proposed new financial agreement Tasmania will get much mdre.,49
314,Mr OKEEFE,PORT AUGUSTA TO,"I am. not in lov« with the proposed new financial arrangements. I have studied and dissected 2804 - Tasmania Grant [REPRESENTATIVES.] them from every angle, and I think I shall be supported by the majority of the electors of Tasmania when I say that they will not work as satisfactorily as would a special grant with a continuation of,the per capita system. I am doubtful what would happen if the proposed new arrangements are accepted, seeing that the Commonwealth would then withdraw the per capita payment of 25s. per head, allowing Tasmania to practically - cover the whole field of taxation with the exception of that relating to companies. Of course, the new arrangements would be quite satisfactory to the large land-holders and other wealthy people-the y would be splendid for the land monopolists of the State-bu t if the per capita, allowance were withdrawn, the Tasmanian Government would have to raise an equivalent in other directions. Bitter experience has shown me that the Legislative Council of Tasmania always leans to the side of the wealthier classes. I have not; the slightest doubt that the Tasmanian Government, in order to make up the loss of the per capita grant, would increase taxation on the necessaries of life, and thus place the burden on the shoulders of those least able to bear it. That has been the way of the Tasmanian Government ever since the State had Government, with the one bright exception of a Labour Ministry for two years and a half. However, the per capita payment still stands, and we.can deal with the proposed new financial arrangements when the time comes. If any honourable member opposite desires to move an amendment increasing the amount, I think 1 can promise fair support from honourable members not on the Nationalist side.",49
315,Mr GABB,PORT AUGUSTA TO,I call attention to the state of the House. [Quorum formed.],50
316,Mr CHARLTON,PORT AUGUSTA TO,"Hunter) [5.25] - I am pleased that assistance is to be granted to Tasmania. Under the Constitution, the Commonwealth has power to assist necessitous States, and Tasmania,I think, comes within that category. The Prime Minister (Mr Bruce) has said that he doubts very much whether this assistance should continue; so there is just a chance that this may be the last grant to the State. I do not quite know what Bill. the position of Tasmania will be if the new proposed financial arrangements are accepted. It is quite possible that the State may be in a worse position than at present.",50
317,Dr EARLE PAGE,PORT AUGUSTA TO,It will be in a better position.,50
318,Mr CHARLTON,PORT AUGUSTA TO,"The Prime Minister introduced a similar Bill in September last year. He then stated that, as the financial relations between the States and the Commonwealth had to come up for review, he could only say that the present arrangement with Tasmania could not continue indefinitely. I do not think we should be put into the position of having to continue it indefinitely; but so long as the State is in need we are bound to come to its assistance. What the Prime Minister means by "" indefinitely "" I do not know, but I shall be pleased to support any proposal to aid Tasmania if aid be required. The Treasurer (Dr Earle Page) and others are advocating the creation of new States, and it is interesting to conjecture what the resultant'financial relations would be if their ideas were carried into effect.",50
319,Dr EARLE PAGE,PORT AUGUSTA TO,My new State would not want any financial assistance!,50
320,Mr CHARLTON,PORT AUGUSTA TO,"I am not sure of that; I have often heard similar statements. When the new States, if they com,© into being, are allotted their fair share of the public debt incurred by the States from which they are carved, and all the paraphernalia of sovereign States is adopted, it is quite possible that financial assistance may be required by them, and that the Commonwealth will be placed in a most difficult position. I do not wish to Be misunderstood. I am not opposed to the establishment of local government in restricted areas, but to set up sovereign States all over Australia is very likely to lead to difficulties much greater than those we are experiencing in the case of Tasmania. It will be seen that care and caution are required when dealing with proposals of the kind. My own opinion is that there ought to be one Parliament only, and that State bodies, such as provincial councils, shire councils, or municipal councils, should be endowed with sufficient power to deal with all matters of local concern, leaving the larger interests to the - Commonwealth. In such circumstances, the present States could be subdivided with advantage. However, all this has little to do with the Bill , except to show the dangerous ground on which we are when we propose the creation of new States. When the subject of the Tasmanian grant was discussed' previously, the Minister for Trade and Customs (Mr . Austin Chapman) had some observations to make. He then objected to the grant, but today he supports it . The honourable gentleman then said that the application for the grant afforded an argument against the creation of more "" t in p o t "" States, and that ,the practice seemed to be to spend, and keep on spending. He added that taxation was up to breaking point, and members should not be "" b l u f f e d into making the grant merely because a certain number of votes are at stake."" Since that time the honourable gentleman appears to have undergone a conversion, though I do not know who in the Cabinet possessed the influence to bring it about.",50
321,Mr SEABROOK,PORT AUGUSTA TO,"The Minister Trade and Customs realizes now that the grant is a right, and not a charitable g if t .",51
322,Mr CHARLTON,PORT AUGUSTA TO,"He has not said so publicly. I thought that perhaps his conversion was due to representations by the honourable member and his friends. The ' Tasmanian representatives looked after the interests of their State very well, and I support them, because I think that the claim to this grant is genuine. I . am ready to support any proposal that is fair and reasonable, ana J think the proposed grant is necessary. I know of many of the disabilities that Tasmania labours under, especially its isolation. Nature has endowed the State with good land, a healthy - climate, and fine water-ways, but it has the disadvantage of being unable to have railway communication with the mainland.",51
323,Mr OKEEFE,PORT AUGUSTA TO,That is the why there should be a regular service by Commonwealth steamers.,51
324,Mr CHARLTON,PORT AUGUSTA TO,"If arrangements were made by which the Tasmanian producers could market their products, possibly the financial position of the State would be so improved that it would not require to ask for this annual dole from the Commonwealth. That is a matter that should be considered by the Government. The Commonwealth owns ""many idle ships, including those captured from"" the Germans, which have cold storage in stallations, and they should be employed in carrying the primary products of Tasmania and other States to markets overseas. Tasmanian members should urge that policy upon the Ministry. I am sure' that the people of Tasmania would not ask for a grant from the Commonwealth if they could do without it . The island State cannot be properly developed unless provision is made for. the producers to get their f r u it and other perishable products to market. I remember the former member for Franklin (Mr . MCWilliams) telling the House of the great losses suffered by Tasmanian producers, owing to the fact that steamers with refrigerated space were not calling at the island to lift their f r u it and vegetables. If some reasonable provision could be made to meet the circumstances of Tasmania in this regard, there would be no need for the State to come to the Commonwealth for assistance. There is no reason why, if its disabilities were removed, it should notbecome prosperous. I recommend honourable memfor bers representing Tasmania to endeavour to induce the Government to make some of the steamers of the Commonwealth Line available to assist their people. The Prime Minister has said that this is the last grant that Tasmania may expect from the Commonwealth. have Mr SEABROOK: - We shall get busy earlier next year.",51
325,Mr CHARLTON,PORT AUGUSTA TO,"The Tasmanian representatives will require to do so. It is - in the power' of the Prime Minister to provide shipping services for the island State, which will mean to its people, not merely £85,000, but, perhaps,£1,000,000, and will provide more employment, and make the State generally prosperous. I support the Bill .",51
326,Mr WEST,PORT AUGUSTA TO,"East Sydney)' [5.35] When this grant by the Commonwealth reason was first sought, we were told that it would be required for only the one year, but ever since Tasmania has been coming cap in hand for financial assistance from the Commonwealth. Mr O'KEEEE - Do not forget that the Tasmanian people pay a fair proportion of the expenditure upon Canberra, which will confer no benefit upon them.",51
327,Mr WEST,PORT AUGUSTA TO,"I have always found that the slowest people are those who return Liberals or Conservatives to represent them in Parliament.. The nature of the Tasmanian representation accounts, to some extent, for the financial position of the island. If Tasmania is to make any material progress, it must change its public men. I cannot understand the people of Tasmania retain a Legislative Council. I have visited the island on many occasions, and its people have always appeared to me to be very slow. Their State has the natural of good rainfall, splendid soil, and attractive scenery; but very little provision has been made to transport tourists from the mainland. If the Tasmanians were as progressive as are the people of New South Wales, they would have supported the proposal put forward by the Labour party in 1913, for a . Commonwealth steam-ship service between the island and the mainland. But they were opposed to the scheme, because they thought meant the socialization of the means of transit. I believe strongly proposal. If proper shipping were provided, many thousands people from Victoria and New Wales would visit Tasmania every year; but at present the service across Bass Strait is very poor, and it will continue to be so under present conditions. Labour Government of 1913 regarded a Commonwealth Line of steamers Tasmania and the mainland as likely to prove a good business enterprise, and to confer substantial benefits upon the people of the island. The latter, ever, took a very lukewarm interest in the project. A few years ago I met a Mr. Davies, one of the largest landholders in Tasmania, and I found him a very conservative person. When I mentioned to him the Labour party's proposal, he lectured me. I told him that I was satisfied that if other Tasmanians adopted same attitude as he did I should day have to put my hand in my pocket to help them. I have to do that today ' in order to help the State out of its financial difficulties. There should be no occasion for Tasmania to ask this Parliament for money, but the men who have controlled the public affairs of the island for some years are not such as could be expected to place the State in a sound financial position. If the people of Tasmania would liven themselves and take a little more interest in the progressive policy of the Labour they would not be in the humiliating tion of having to appeal to the Commonwealth for assistance. They have no Mr West. more excuse than have the people of Western Australia for seeking such aid. why Mr ATKINSON - Wester n Australia receives special treatment, and always has done so.",51
328,Mr WEST,PORT AUGUSTA TO,"I should like the people of Tasmania to be imbued with a spirit advantages of independence and progressiveness. They might also, by abolishing the Upper House of the State Parliament, avoid an unwarrantable expenditure. I shall have to explain the reason for this grant to my electors, and I shall tell them that it is necessitated by the Tasmanian people's lack of independence and their unprogressiveness. Mr O ' KEEFE - We do not mind what the honourable member tells them, so it long as he votes for the Bill ",52
329,Mr WEST,PORT AUGUSTA TO,"As Tasmania is in needy in that circumstances, I must vote for the Bill . facilities In connection with the last grant, a good more deal of electioneering took place, and I South quite expect that honourable members opposite will, tell the people of Tasmania that they owe this grant of £85,000 to the Nationalist Government. I hope the The electors will not be deceived by such catch cries. If they would elect a combetween petent body of men to the State Parliament, they would no longer require to hang on to the apron-strings of the Commonwealth. This Parliament must do how- something to curtail Federal expenditure. Tasmanian representatives cannot consistently preach economy and at the same time cadge £85,000 from the Commonwealth. The action contemplated in this Bill may be compared in some respects to the action taken by the Government in its general financial arrangements. the The time is coming when we shall have some to thoroughly reconsider the financial policy of this country. Something will have to be done to insure a proper expenditure of public money and a proper method of floating loans. I ask the Tasmanian representatives in the House to consider whether the time has not arrived when they should live with in their means. The doctrine of livin g within our means has been preached in this Parliament for a long while. I can quite understand up, that when the Customs and Excise duties were taken away from Tasmania, at the party fame of Federation, she found some difposi- ficulty in squaring accounts, but the same"" was true of all the States. The mem Tasmania Grant - 115 AUGUST, 1923.] bers of the Upper House of Parliamentin Tasmania nave been able to prevent the application of a proper system of land taxation or any other form of direct taxation. What that State needs is a change of .Government.",52
330,Mr JACKSON,PORT AUGUSTA TO,They had one yesterday.,53
331,Mr WEST,PORT AUGUSTA TO,"That was only an exchange of Tweedledum for Tweedledee. It is difficult to tell one Government from the other. Tasmania has been following a system of continuous Ministries, such as Queensland had for a number of years. The northern State has departed from that principle, and is on the highway prosperity. If Tasmania followed the example of Queensland it would be better off. For the good of Tasmania the isting regime should be got rid of lock, stock, and barrel.",53
332,Mr SPEAKER,PORT AUGUSTA TO,I do not see any for thing in the Bill about that matter.,53
333,Mr WEST,PORT AUGUSTA TO,"There may be nothing the Bill about it, sir, but I am pointing out that the reason why the Tasmanian Government year after year comes cap in hand to the Commonwealth Governping ment for assistance is that . it will dismiss from power the party which has control. I do not want to injure the little island in any way, but I its public men would show a more protained gressive spirit, and attempt to establish the State on soiind business lines. would be a good thing for this Governopen ment to run the Commonwealth Shipsent ping Line between the mainland and mania. If that were done, many wealthy people in the other States would visit Tasmania in the holiday season. The ment Fisher Government in 1913 proposed run a steamer from the mainland to mania in much the same way as we run railways, but, unfortunately, it was - able to put its proposal into practice. I advise this Government to use some of the Commonwealth steamers for that purpose. I realise that Tasmania difficulty in establishing manufacturing industries. It has very few tradesmen. Some years ago I found that about every third man in the Government Printing Office in Sydney came from Tasmania. A similar condition of things prevailed in the building trade. I made some quiries to find the reason for this. Bill. 2307 was told that when a young fellow grew to manhood in Tasmania it was hard for him to get a job. The printing offices were run by boy labour. All the land available had been taken up, and young men were not able to obtain blocks. Consequently they had to leave their home ' State and come to the mainland for employment. I hope the honourable members from Tasmania will accept my words as pearls of wisdom. I desire to help their State.",53
334,Mr LAZZARINI,PORT AUGUSTA TO,"Werriwa) [5.54] I shall not oppose the granting of this money to Tasmania. The Treasurer told to us that the isolation of Tasmania prevented the development of its industries and the growth of its business and other exactivities to the same degree as was possible on the mainland, and therefore Tasmanian finances suffer. I shall vote this Bill, but I mupt say that it does not attempt to meet the needs of the situation in a logical and effective way. in Tasmania needs help to develop her industries. If the Commonwealth Government would utilize some' of its ships to provide Tasmania with an adequate shipservice, it would materially help not agricultural and industrial development now in the State. People in many parts of Australia would be glad to receive Taswish manian products if they could be obat a reasonable price. The establishment of a satisfactory shipping service It would make this possible, for it would markets for Tasmania. Under preconditions, much of Tasmania's proTasduce is wasted. The policy of making grants in this way is stupid. It may be compared in some ways with the Governpolicy of paying doles to the unemployed, instead of providing proper emto ployment for the men, so that they may Tasrender useful service to the States for the money they receive. I do not wish not .to compare the people of Tasmania with the unemployed, but honourable members will recognise some analogy. The Government should get down to basic prinhas ciples in dealing with the situation. I understand that thefinancialarrangement which the Government wishes to make with the various States will not be advantageous to Tasmania, and that we may be required later on to grant further money to assist the Tasmanian Governinment. I suppose the Government's finanI cial proposals will be agreed to by this House. It seems to be able to get its supporters to agree to anything. It would act wisely if it did something of a more definite character to develop Tasmania's resources by providing an outlet for the produce of the people. Proper shipping communication with the mainland is necessary before there will be any reliable market for Tasmania's produce. I hope the Government will realise this, and that it will do something definite to enable Tasmania to develop in the same way as the other States are developing. Question resolved in the affirmative. Bill read a second time. In Committee: The TEMPORARY . CHAIRMAN (Mr Watkins) - Is it the pleasure of the Committee that the Bill be taken as a whole ?",53
335,Mr CHARLTON,PORT AUGUSTA TO,"I have no objection, but I hope the Government will not charge us either with hasty legislation or with ""stone-walling."" Bill agreed to. Bill reported without amendment; report adopted. Bill read a third time. NA Bill presented by Mr STEWART, and read a first time. NA SECOND READING.",54
336,Mr CHARLTON,POST AND TELGRAPH RATES,"We appear to have run out of work. The Minister is not present to go on with the business, yet the Government has been guillotining its measures through the House.",54
337,Mr GIBSON,POST AND TELGRAPH RATES,"Corangamite - Postmaster-General) [6.4] - I move That the Bill be now read a second time. I am sorry to have kept the House waiting for a moment or two, because evidently every moment is precious at the present time. The Bill is to provide for the reduction of postal rates. Such a reduction is, I think, necessary. Practically every section of the community has been asking for it . The request has not been confined only to people living in city areas; it has also been made by the residents of country areas 'Many deputations have waited upon me to ask that the existing rates should be somewhat reduced. It is necessary that this Bill should be passed if effect is to be given to the financial proposals set out in the Budget. Practically every country has reduced its postal rates from those existing during war time, to something like the rates which existed in pre-war days. Australia is practically the last country to come into line in this regard. For quite a long time we have been receiving mails fromabroad with-a rate of l ^ d . per half ounce, whilst we have been charging external rates of 2d. per half ounce. An extraordinary anomaly is created by the fact that we fix the whole of our postal rates for inland postage by an Act of this Parliament, and the whole of the rates for postage abroad by regulation. In the case of telephones, the rates are fixed by regulation, whilst the rates for telegrams are fixed by an Act of this Parliament. That has been the practice followed in this country for many years, and it is proposed to let it remain in operation for a little longer. We estimate that the loss of revenue that will be occasioned by the reduction of the postage rate from 2d. per half ounce to l j d . per ounce, will be somewhere, in BILL. the vicinity of £930,000. We have made big profits in the Post Office during the last few years. I have no doubt that some honourable members representing country districts will be inclined to say that profits made by the Post Office BILL. should be utilized for the extension of the services of the Department. If that practice had been followed, we could not expend the amount it is proposed to spend at the present time on the extension of these facilities. Up to 1912, practically no commercial records of the business of the Post Office were kept. From that time onwards records have been kept. A charge of 3-J per cent, as interest on assets has been made against the Post Office, and I find that from 1912 to 1917 the operations of the Department showed a loss of £2,031,417., From 1917-18 up to the present year we have had profits amounting to £4,084,830. If the extension of the services of the Department, had been determined by the profit made by the Post Office, we should have had only some £2,000,000 to spend over that long period. As a matter of fact, we spent £2,000,000 last year; we are proposing to spend £4,000,000 this year, and probably some £3,000,000 will be spent next financial year on the extension of the services of the Department.",54
338,Mr MAXWELL,POST AND TELGRAPH RATES,Would not the honourable gentleman expect the rate of profit from 1917 to. the present year to continue in the future?,55
