speakerGroups,Speaker,Title,text,pageNumbers
0,NA,Unknown,"House of Representatives. Thursday, IBS August, 1988.",14
1,Mr SPEAKER,Unknown,"Et. Hon. W. A. Watt) took the chair at 11 a.m., and read prayers. WAR SERVICE HMS. REFLECTIONS ON MR - RODGERS : SCOPE OF ROYAL COMMISSION.",14
2,Mr MAXWELL,Unknown,"Will the Prime Minister arrange, or has he arranged, terms of the reference to the Royal Commission on War Service Homes in such a way that the ex-Minister, Mr Rodgers, will be afforded an opportunity to deal with the reflections that were recently made on his administration'",14
3,Mr BRUCE,Unknown,"I received a, letter from Mr Rodgers a week ago; requesting an inquiry into the whole of the administration of War Service Homes. That letter was considered by the Government, and I replied to Mr. Rodgers that, while the Government was not prepared to grant an inquiry ranging over the whole administration of War Service Homes, it was prepared to extend the scope of the inquiry into ""War Service' Homes matters so as to embrace the specific charge that was made in connection with certain interviews which took place and certain instructions given by Mr Rodgers. I last night received a wire from Mr Rodgers, saying that he would not accept that offer by the Government. I shall no doubt receive a letter from him dealing further with the matter. That is the position at the moment. SULPHUR BOUNTY BILL . PERSONAL EXPLANATION..",14
4,Mr JACKSON,Unknown,"I desire to make a personal explanation. Last week, during the debate on the Sulphur - Bounty Bill, I made a slight error in the figures I quoted regarding freights from America.. The freight on sulphur from Galveston to Baltimore, 2,500 miles, is 17s. 9d. per ton, while the freight from Galveston, to Australia, a distance something like 7,000 miles greater, is 26s. per toil - l made the charge that this was a dumping freight, and the honourable member for Swan (Mr Gregory) said he doubted very much whether my figures were correct. I pointed out that sulphur was being sold to Australian consumers for 17s. 9d. per ton less than to American consumers, but the position in regard to the freights was as I have just stated. I find now, according to the American trade journals, that the ordinary freight rate for the month of July was £A 10s. j>er ton from American ports to Australia. There is one other matter to which I should like to refer. Owing to absence the from Melbourne, I did not get the Hansard proof of the second portion of my speech, in which I have since found a misprint. I am reported as saying that the Electrolytic, Zinc Company had loaned to the employees £20,000 at 4 per cent., and had guaranteed another £1,000 which seriously reflects on his honourat 6 per cent. This latter figure should have been £30,000 at 6 per cent. PRIVILEGE.",14
5,Mr MAHONY,Unknown,"Dalley) [11.5] - I wish to raise a question of privilege. the notice-paper is a motion in the name of the honourable member for East Sydney (Mr ""West), and I observe that it been placed at the bottom .of the list private members' business. The notice of motion isThat the vote given hy the for Riverina (Mr Eillen) in the House, on the question of the second reading of the Land Tax Asessment Bill 1923, be disallowed. This matter very seriously affects the honour of a member of this House. In the British House of Commons such cases as these are taken very seriously, and immediate action is resorted to in order to settle them. May, at page 353, saysI n the Commons it is a rule that no member who has a direct pecuniary interest in a question shall be allowed to vote upon it ; but in order to operate as a disqualification, this interest must be immediate and personal, and not merely of a general or remote character. In the House of Commons, in such circumstances, the member concerned is heard in his place; then he retires, and leaves the House to discuss and decide the question. In this particular instance there is no doubt about the direct and personal pecuniary interest of the honourable member, because, on the floor of the House, he has admitted that interest; he has admitted that the measure then under discussion would, if passed, be of monetary advantage to him. I do not desire to cast any personal reflections on the honourable member^ but Parliament should take steps to protect itself when its honour is involved. I take the stand that the motion of which notice has been given seriously affects the honour of a member of the House, and, by reflex action, seriously affects the honour of the House collectively; and, therefore, it should be considered and settled forthwith. If immediate action is not taken, and this notice remains on the business-paper, the honourable member for Riverina (Mr Killen) Avill remain under a shadow. The honourable member himself must realise the position in which he is placed. Here is a notice of motion (on his actions as a member of this House. I move That the notice standing in the name of Mr . West, No. 6 General Business, be taken forthwith.",15
6,Mr SPEAKER,Unknown,"Rt. Hon. W. A. Watt). On - The honourable member for Dalley (Mr. Mahony) has submitted this motion as a matter of privilege. In the first place, has I think I ought to infrom him, and of others interested in the motion, that the arrangement of the business of the House is entirely a matter for the Government. May, 10th edition, page 256, makes that honourable member quite clearExcept in the case of motions amounting to a distinct vote of want of confidence in the Government, proposed or sanctioned by the Leader of the Opposition, the question whether the Government should concede priority to a notice of motion, or to an Order of the Day in the charge of an unofficial member, is left entirely to their discretion. As the honourable member for Dalley will see, that leaves the Chair quite powerless to regulate a matter such as that to which he refers.",15
7,Mr MATHEWS,Unknown,Is the Government supposed to have some honour?,15
8,Mr SPEAKER,Unknown,"I am not at the present time concerned with the attitude of the Government, except as it affects the law and practice of Parliament in this matter. It is for the head of the Government, who is the Leader of the House, to declare the attitude of the Government at what he considers the proper time. I am not prepared at this stage to regard this matter as a question of privilege. In some phases it may be regarded as a question of privilege, and to some minds it will probably appear to be . on or near the border-line. But this is not a matter on which the Chair should be asked to rule at this stage; it is rather for the head of the Government, who is acquainted with the circumstances and terms of the motion,, to lead the House in regard to it. I put the matter, therefore, in charge of the head of the Government.",15
9,Mr BRUCE,Unknown,"Flinders-Prime Minister and Minister for External Affairs) [11.10] - This matter has been raised as one of privilege, because, I presume, it could not be raised in any other way at this particular time.",15
10,Mr SPEAKER,Unknown,That is so.,16
11,Mr BRUCE,Unknown,"As you, sir, have ruled that this is not a question of privilege, I suggest to the honourable member for Dalley (Mr Mahony) that the House be permitted to dispose of questions on notice, after which, in Committee of Ways and Means, I shall have an opportunity to indicate the attitude of the Government.",16
12,Mr KILLEN,Unknown,As this is a question of privilege concerning myself I should like to say a few words,16
13,Mr SPEAKER,Unknown,"The honourable member for Riverina (Mr Killen) is aware that an honourable member who raises a question of privilege must conclude with a motion. The honourable member for Dalley has proposed such a motion, and it has been duly seconded. I have said that at this stage I am not prepared to i regard this as a matter of privilege, and - I have, therefore, placed it in the hands of the head of the Government, who is charged with the arrangement of the business-sneet of the House. If the honourable member for Riverina desires to speak, he may do so by leave, or by way of personal explanation.",16
14,Mr KILLEN,Unknown,I should like to say,16
15,Mr BRUCE,Unknown,"Flinders-Prime Minister and Minister for External Affairs) [11.12],-May I interpose a suggestion. As the honourable member for Riverina (Mr Killen) desires to make an explanation, perhaps it would facilitate matters if I now indicated what is the attitude of the Government. perhaps, will prove a more convenient time than after questions have been disposed of. I can state the position of the Government, and then the honourable member may make what personal statement he desires. The Government is only too willing that the honourable member for Riverina shall have every opportunity to speak. If the notice of motion be left on the business-paper, it remains there as a reflection on him, and, of course, the sooner it is disposed of the better for the honourable member and all concerned. The Government placed the notice of motion where it is on the business-paper because we did not take the view that there was any possibility of the honourable member's honour being involved. The standing order under which this matter has been raised providesNo member shall be entitled to vote in any division upon a question in which he has a direct pecuniary interest, not held in common with the ""rest of the subjects of the Crown, and the vote of any member so interested shall be disallowed, but this shall not apply to motions or public Bills which involve ' questions of public policy. I should say that there are very few Bills or questions of public policy in which some member would not have a pecuniary interest. But if the honourable member for Riverina (Mr Killen) takes a serious view of the motion which has been placed upon the notice-paper by the honourable member for East Sydney, the Government will afford every opportunity for it to be discussed.",16
16,Mr KILLEN,Unknown,I understand that the Prime Minister,16
17,Mr CHARLTON,Unknown,"I rise to a point of order. The Prime Minister (Mr Bruce) spoke by leave of the House. The honourable member for Riverina has not asked for leave to make a statement, nor has he stated that he wishes to make a personal explanation. I would not object, to either course, except that honourable members on this side of the House cannot consent to"" be gagged by allowing this matter to be dealt with in such a way that it will be optional for the House to give or refuse leave for each member to speak. If that course is persisted in it will lead to a protracted debate. This matter must be thrashed out in a proper way, and the better course would be to adopt the suggestion made This, by the Prime Minister, namely, that the matter should be discussed on the motion to go into Committee of Ways and Means.",16
18,Mr SPEAKER,Unknown,"Rt. Hon. W. A. Watt). - I permitted the honourable member for Riverina to commence his remarks, because he has the right, as has every honourable member, to claim the indulgence of the House while he makes a personal explanation.",16
19,Mr CHARLTON,Unknown,But a personal explanation will not settle the matter.,16
20,Mr SPEAKER,Unknown,"It may be that the most decisive way of dealing with this question is that suggested by the Prime Minister, and as the right honourable gentleman has promised to provide opportunity for the discussion of the motion standing in the name of the honourable member for East Sydney, possibly a re Minister petition of debate would be avoided if the honourable member for Eiverina ceive consideration. (Mr Killen) were to defer his remarks till that motion is submitted.",16
21,Mr KILLEN,Unknown,I shall do so. UNDESIRABLE IMMIGRANT.,17
22,Mr A GREEN,Unknown,"Is the Prime Minister aware that the following letter was published in the West Australian, on 18th August, above the signature of Mr. J. Thomson, member for Claremont, in the Legislative Assembly of Western Australia:Sir,-Referring to the complaint made by Sir Joseph Cook as to Australian psess reports regarding undesirable immigrants, t hf following extract from the London Evening News, of 24th February last, may be of interest:"" A - present for Australia-Emigratio n for voung man whom police think dangerous. Walter Power, of Tatsfield, well dressed, described by the police as being ' very dangerous ' was charged with stealing a magneto und a dynamo worth £18. His father said that early in life the young man had been crafty, and consumed with overwhelming vanity. The accused man was said to have served several sentences for housebreaking; on one occasion he was carrying firearms and on another he had a dagger. manded for arrangements to be made to send biin to Australia."" Parliament House, 17th August. Will the Prime Minister ascertain if this undesirable immigrant has left for our shores?",17
23,Mr BRUCE,Unknown,I shall have the matter inquired into. INVALID AND OLD-AGE,17
24,Mr COLEMAN,Unknown,Will the Treasurer present the Bill for the amendment of sentation on the Board? the Old-age and Invalid Pensions Act in sufficient time to allow the least a few minutes in which to consider it?,17
25,Dr EARLE PAGE,Unknown,"The Bill will be introduced in due course. Mr Charlton,-Will the Treasurer see that the order of leave is drafted that the House may, if it so sires, increase the pension by 5s. instead of 2s. 6d. as the Government proposes?",17
26,Dr EARLE PAGE,Unknown,The Prime has already told the Leader of the Opposition that that matter will reUNIFORM OF TRAINEES. Mr F. MCDONALD - I understand that owing to the immense physical proportions of some of our compulsory trainees the officers cannot find garments sufficiently large to fit them. Will the Minister for Defence issue the instruction that these young Australians shall not be compelled to wear clothing that makes them a laughing stock?,17
27,Mr BOWDEN,Unknown,The matter will be inquired into. ARBITRATION COURT AWARDS.,17
28,Mr CHARLTON,Unknown,"Will the Attorney General table, before the session terminates, all awards made by the Arbitration Court, so that they will be operative while the Parliament is in recess ?",17
29,Mr GROOM,Unknown,"I signed the necessary documents last night, and they will be laid upon the table either today or tomorrow. He was re",17
30,Mr CHARLTON,Unknown,"I desire all those awards to be tabled before the House Yours, adjourns. J. THOMSON,",17
31,Mr GROOM,Unknown,That shall be done. TARIF F BOARD.,17
32,Mr FENTON,Unknown,"Will the Minister for Trade and Customs (Mr Austin Chapman) say whether the fourth member of the Tariff Board is to be appointed at the . request of the Country party section of PENSIONS. the composite Ministerial party, or has he received any demand from the primary producers that they should have repreI f so, is that the reason why the Government proposes House at to appoint a fourth member?",17
33,Mr AUSTIN CHAPMAN,Unknown,No . HOOKWORM DISEASE.,17
34,Dr MALONEY,Unknown,"Will the Prime so Minister submit, before the session terdeminates, a formal motion expressing the thanks and appreciation of this Parliament to the American Department thai. has expended a sum estimated to between £100,000 and £200,000 in helping to eradicate the hookworm disease in chases. Australia ?",17
35,Mr BRUCE,Unknown,"I shall inquire during the day if any action can be taken. NA SHIPBUILDING CONTRACT.  Attorney-General give the House any formation regarding the £76,000 that is owing to the Commonwealth in connection with the Kidman and Mayoh shipbuildSupreme ing contract?",18
36,Mr GROOM,KIDMAN AND MAYOH,"The Commonwealth have taken all necessary action to recover that amount. The matter is now in the list of cases to be heard by the Court in Now South ""Wales, and is merely awaiting its turn to be dealt with.  waiting a long time.",18
37,Mr GROOM,KIDMAN AND MAYOH,"The Government canthe not be blamed for that. It has taken necessary steps to have the claim dealt Island? with by the Courts. SUGAR PURCHASES COMMISSION . into recess. Mr ""W. M . HUGHES - I understand that the Prime Minister proposes to make a statement today regarding the proposed appointment of a Royal Commission to inquire into certain purchases of sugar. ""Will he in for m the House so urgent as to necessitate the suspension of the Secretary of his own Department has1. installed has been delayed for over a fortnight, during which a charge has been hanging over that officer's head? Parliament to be closed, and we shall have no opporcation tunity of expressing an opinion upon this wrecks matter.",18
38,Mr BRUCE,KIDMAN AND MAYOH,"I shall make a statecome ment today in regard to the appointment of the Commission, and I shall then in - G overnment ? dicate exactly the scope of the inquiry and the points that will have with by the Commissioner. The statement that the Secretary of - my Department has been suspended is quite in accurate. At the time when Mr Deane low :became aware that an inquiry would have to be held he asked to be relieved of his Island duties- a very proper course in view of be the fact that his name had been mentioned previously in regard to these purThe matter is of the greatest urgency, and the Government very much regrets that it has not been able to announce earlier the terms of the Commission and the name of the Commissioner; but I remind the right honourable member for North Sydney that when I first mentioned this matter to the House, I said that the Government desired to obtain in - the services of a Judge of the High Court. Unfortunately it was not.possible to obtain either a High Court Judge or a Court Judge to act as Commissioner, and that involved a certain amount of delay, which the Government deplores as much as does anybody else. COCKAT OO DOCKYARD . SHIP 48: ELECTRICAL FITTING S. Mr C. RILEY - Will the Prime Minister expedite the answer to the question I asked on 14th August regarding contract for electrical fittings in ship the 48, now under construction at Cockatoo",18
39,Mr BRUCE,KIDMAN AND MAYOH,The honourable member will receive a reply before the House goes WIRELESS STATIONS. LOKD HQJWE ISLAND .,18
40,Mr WEST,KIDMAN AND MAYOH,"the Postmasterwhy a matter General, upon noticeIs it a fact that the Postal Department wireless in Bass Straits free of charge to the islanders? 2. Is it a fact that Lord Howe Island is 450 is miles from the Mainland, and itliat communiis by steamier once every five weeks? 3. Is it a fact that owing to several shipat the island the rats have left the ships, have reached the land, and ihave destroyed the palm seed, .which is a source of inof the islanders, who are not now in a position to accept the previous offer of the 4. Is it a fact that if the wireless were placed on the island it would be of assistance to the to be dealt mercantile marine service?",18
41,Mr GIBSON,KIDMAN AND MAYOH,"The answers to the honourable member's' questions are as f o l 1. A iwireless station was installed at King in 1911 by Father Shaw, mainly as an experiment. It was subsequently retained for commercial purposes. Flinders Island station was erected in 1913, mainly as a relay station for ships between Melbourne and Hobart. 2. Yes. 3. I have no information on this matter. 4. Yes, to the limited amount of - shipping in the vicinity of the island. FRUIT POOL, 1921-22. NA GOVERNMENT.",18
42,Dr MALONEY,REQUEST FROM QUEENSLAND,"the Minister for Trade and Customs, upon notice I. Has he received any representations communications from the Queensland Government as to the 1021-22 Fruit Pool? 2. If so, what was the purport of such comable munications ? 3. What does the Government propose to do with reference to such representations? 4. Will he place on the table of the House the - correspondence referred to and the replies thereto?",19
43,Mr AUSTIN CHAPMAN,REQUEST FROM QUEENSLAND,"The for answers to the honourable member's quesNorthern tions are as follow:1. Yes. 2. That the Queensland Government should tions there for. be relieved of its half-share of the loss on 1921-1.922 Fruit Pool in respect of pineapples. 3. The request is ibeing considered and will . 1912-23. be dealt with as soon as 'possible. 4. Yes, as soon as a decision is arrived at. NA THE EAST.",19
44,Dr MALONEY,TRADE REPRESENTATIVE IN,"the Minister the for Trade and Customs, upon noticeIn view of tihe great cost of the upkeep of Mr Sheaf, as Trade Representative in the East, sistants? and his Department, and the alleged small amount of benefit to Australia, does the Minister intend to take action similar to that taken in the case of Mr Little and close the office ?",19
45,Mr AUSTIN CHAPMAN,TRADE REPRESENTATIVE IN,"The apsioners, pointment was made by the Commonwealth, in conjunction with the States, for a period of three years from the 18th January, 1922; one-fifth only of the expenditure is borne by the Commonwealth, the balance being defrayed by the States. MARBLE QUARRIES. CENTRAL QUEENSLAND.",19
46,Mr FORDE,TRADE REPRESENTATIVE IN,"the Minister for Trade and Customs, upon noticeIn view of the fact that the marble quarries in Central Queensland are closed down, with consequent unemployment, owing to large importations of Italian marble, will he announce his decision as to whether he will apply the Industries Preservation Act to the marble industry ?",19
47,Mr AUSTIN CHAPMAN,TRADE REPRESENTATIVE IN,"This matter is being investigated, but the evidence does not j u s t if y the imposition of - )£ dumping duties. NORTHERN TERRITORY LANDS . LEASEHOLD TERMS.",19
48,Mr COLEMAN,TRADE REPRESENTATIVE IN,"the Minister representing the Minister for Home and or Territories, upon notice I. Is it a tfaot that companies and trusts are to rent land an the Northern Territory at Is. per square - mile per annum? 2. If «o, will the Government agree to rent land on the same terms to intending settlers?",19
49,Mr ATKINSON,TRADE REPRESENTATIVE IN,"No . The terms and conditions of lands made available lease are advertised in both the Territory Gazette and the Commonwealth Gazette, and all persons over eighteen years of age may lodge applicaThe applications arethe dealt with in accordance with the Regulations under the Crown Lands Ordinance TELEPHONE ASSISTANTS' PAY.",19
50,Mr YATES,TRADE REPRESENTATIVE IN,"the Postmaster, General, upon noticeMR . SHEAF. 1. In view of the fact of the revenue of the I ostal Department .being such as to allow of generous reductions made in postal rates, is it .the intention to establish the principle of equal pay for equal .work for telephone ase 2. If not, why not?",19
51,Mr GIBSON,TRADE REPRESENTATIVE IN,This is a matter for the Public Service Board of Commisto whom it has been referred. LIGHTING OF WONGASHOA L.,19
52,Mr MAKIN,TRADE REPRESENTATIVE IN,"the Minister for Trade and Customs, upon notice Whether he is now in a position to answer his question regarding the Wonga Shoal light?",19
53,Mr AUSTIN CHAPMAN,TRADE REPRESENTATIVE IN,"The question to which the honourable member refers is as follows:In view of the dangers experienced with the present ill-lighted Wonga Shoal, will the Government immediately institute inquiries as to the advisability of installing quick-flashinfr a light and have same placed above the shorl light? The answer isThe question of establishing lights in the vicinity of Wonga Shoal has already been considered and - a decision arrived at to replace the present light a.t Wonga Shoal on or about the 24th August by a quick-flashing light. Apparatus will shortly be ordered for a powerful shore liglht, to be erected 'to mark the approach to Port Adelaide, and ai permanent structure will be erected on Wonga Shoal. WAR PENSIONS.",19
54,Mr COLEMAN,TRADE REPRESENTATIVE IN,"the Treasurer, upon notice I. Is it a fact that the .provisions patriation Act give the Government power to liberalize war pensions? 2. If so, does the Government - propose to amend the regulations to provide for an improvement in .the pensions of totally incapacitated soldiers and others? 3. Will the Government liberalize the regulations with a view of enabling incapacitated soldiers, who have been refused .pensions and medical treatment on the ground that they suffered from a pre-war disability, to receive a pension and' medical treatment?",20
55,Dr EARLE PAGE,TRADE REPRESENTATIVE IN,"The answers to the honourable member's questions are as follow:I . No. 2 and 3. These matters are receiving the immediate consideration of .the Government. NA COLLEGES. COST OF, AND NUMBER OF, CADETS. Mr E. RILEY asked the Minister for Defence, upon notice I. Whether he will state how many cadets are in training-at the Duntroon Military College, and what does it cost per annum for the maintenance of 'this college? 2. How many cadets are in training at the Naval College, Jervis Bay, and what is the cost of maintenance of this college per annum? 3. Will he bring about the amalgamation of the training staffs at 'both colleges, and transfer the cadets from Duntroon to the Naval College at Jervis Bay, iwith a view to effecting much-desired economies?",20
56,Mr BOWDEN,DUNTROON AND JERVIS BAT,"The answers to the honourable member's questions are as follow :1. The number of cadets at present in training at tihe Royal M i l it a r y College, Duntroon, is thirty-five, and the cost per annum for the maintenance of this college is £41,079. 2. The number of cadets at present in training at the Royal Australian Naval College, Jervis Bay, is forty-five, and the cost per annum for the maintenance of ith'.i college is £63,000. [REPRESENTATIVES!] Empire Exhibition. 3. The whole question of the colleges will be reviewed in the light of the Imperial Conference decision and the proposals of the Government will be placed before Parliament. EMPIRE EXHIBITION . STAMPING OF LETTERS-ADVERTISING .",20
