speakerGroups,Speaker,Title,text,pageNumbers
0,NA,Unknown,"House of Representatives. Wednesday, k June, 198J/,",12
1,Mr SPEAKER,Unknown,"Rt. Hon. W . A. W at t ) took the chair at 3 p.m., and read prayers. COMMONWEALTHNOTE ISSUE. ALLEGED FRAUDS. . Mr ANSTEY - I ask the Treasurer, in connection with the alleged disappearance of Australian notes, what is the amount involved in the supposed frauds? Is it a fact that the Notes Issue Board has ceased to register £1 and 10s. notes designed for cancellation and destruction ?",12
2,Dr EARLE PAGE,Unknown,"I have a statement here, which I have obtained from the Acting Governor of the Commonwealth Bank, in which he saysClose investigation has not disposed any fraud, though it is possible there have been some minor irregularities, but the amount in' volved cannot bo large. The alarmist press reports are quite unjustifiable. The Auditor General concurs in the above remarks. I have the following letter also from the Auditor-General, addressed to the Secretary to the Treasury:-In reply to your memorandum of this day's date, I. have to say, for the information of the Treasurer, that inquiries have been made on my behalf by an Audit Inspector with respect to the alleged abstraction of cancelled notes, and of the placing again j n circulation uncancelled notes in substitution for the cancelled notes. No evidence whatever has been produced, so far as I am aware, lhat su:h action' has taken place, nor that any notes were missing. The whole matter is one merely of suspicion, it having been stated that one of the officers engaged in the supervision over the destruction of the notes appeared to be living beyond his income. Another supervising offlcor, namely, the Audit Officer, representing myself at the burning, was charged with being temporarily absent on oacasiun when burns were commenced or in progress. This charge Mr Mills, the officer referred to, denies, and 'says that on one occasion he had to attend to the telephone. Mr E. RILEY - Will the Treasurer say who were the gentlemen who made the inquiries with regard to the alleged disappearance of Australian notes? Were theyinterested parties employed by the Bank? If so,, will the honourable gentletion man have inquiries made by independent persons ?",12
3,Dr EARLE PAGE,Unknown,"The reports I ing read were received from the Acting vernor of the Commonwealth Bank and one the Auditor-General. Mr E. RILEY --But who made the quiries refer red-, to? NA AUSTRALIA. ECONOMIC Loss.",13
4,Mr MANN,RINDERPEST IN WESTERN,Is the Treasurer yet in a position to answer a question I put the 21st May as to whether any been received from the Committee appointed to inquire into the economic loss due to the outbreak of rinderpest in Western Australia?,13
5,Dr EARLE PAGE,RINDERPEST IN WESTERN,"The report is not yet to hand. COMMONWEALTH ARBITRATION on the COURT. ALLEGED CONGESTION oir BUSINESS. Sir LITTLET ON GROOM - On the motion for adjournment on Friday last the honourable member for Reid (Mr. Coleman) mentioned the matter of the plaint of the Amalgamated Society of Engineers, the Australasian Society of Engineers, and the Blacksmiths Union. He suggested that there was dissatisfaction owing to delay, and a probability of strikes in consequence. I have made inquiries, and I am informed by the President of the Arbitration Court that the matter is going on quite satisfactorily. The date for the hearing has been fixed. The unions concerned have made no complaints to the Court arid do not ask for precedence over other unions, and before leaving for Darwin the President was assured by their accredited representative .that there was no probability of a strike. NA SERVICE. CANCELLATION OF CONTBACT.",13
6,Mr MAHONY,SHIPS FOR LIGHTHOUSE,"B y way of explanaof a question I propose to ask, may I direct the attention of the Prime Minister to the fact that some considerable time ago the House approved of the build* of two ships for the Lighthouse Ser-> Govice. Recently steps were taken by some to cancel the contract for the building of one of these ships. A tender was called for in a public way, the Cockatoo inIsland Dockyard was the successful tenderer, the contract was allotted and the agreement signed. I should like the Prime Minister to tell the House why the contract for one of the ships was cancelled. If he does not know, will he have inquiries made to ascertain the reason for the cancellation of the contract?",13
7,Mr BRUCE,SHIPS FOR LIGHTHOUSE,"I shall have the facts on looked into, and shall advise the honorreport has able member later. PUBLIC WORKS OOMMITTEE. AIRCRAFT DEPOT AT LAVERTON. Mr GREGORY, as Chairman, brought up the report of the Public Works Committee, together with minutes of evidence, establishment of an aircraft depot at Laverton. Ordered to be printed. WHEAT GUARANTEE.",13
8,Mr LACEY,SHIPS FOR LIGHTHOUSE,"In view of the fact that wheat-growers are awaiting a decision on the subject, will the Prime Minister make an early announcement of the Government's intention with regard to a guaranteed price for wheat for a voluntary pool for the current year ?",13
9,Mr BRUCE,SHIPS FOR LIGHTHOUSE,"A similar question was asked me on Thursday or Friday of last week, and I then indicated that the Government would announce its decision on the subject at the earliest possible ' moment. WIRE NETTING DUMPING DUTY.",13
10,Mr GREGORY,SHIPS FOR LIGHTHOUSE,"I ask the Prime Minister whether his attention has been drawn to the imposition by the Customs Department at Fremantle of a dumping duty of £55 on £133 worth of English wire netting, equivalent to £11 per mile, although, the invoice value is only £7 per mile less than the price of Australian wire netting? In the circumstances, will ""the Government seriously consider the repeal of the Tariff Board Act, and the introduction of legislation for the imposition of an absolute embargo upon the importation of manufactured goods into Australia ?",13
11,Mr BRUOE,SHIPS FOR LIGHTHOUSE,"My attention was drawn to the facts in this case by the honourable member himself. With regard to the second part of his question, the Government cannot state its policy in reply to questions asked in this House. LABORATORY AT BROKEN HILL .",14
12,Mr BLAKELEY,SHIPS FOR LIGHTHOUSE,"In view of the portance of the establishment of a Commonwealth Laboratory at Broken Hill, will the Treasurer sympathetically consider the making of sumcient money available for the carrying out of that work?",14
13,Dr EARLE PAGE,SHIPS FOR LIGHTHOUSE,The matter will be considered when the Estimates are being dealt with. - IRISH BOUNDARIES COMMISSION.,14
14,Mr BRUCE,SHIPS FOR LIGHTHOUSE,"I desire to inform the House that the British Government is referring certain difficulties under constitutional law, which have arisen in connection with the Irish Boundaries Commission, to the Judicial Committee of the Privy Council, and the Lord Chancellor is most anxious that Dominion Judges should sit as members of that Committee. An invitation has been issued to Australia to consent to the services of the Chief Justice of the High Court being made . available. It is understood that a similar invitation has been issued in regard to the Chief Justice of Canada. Although it is extremely difficult to make the services of the Chief Justice of the High Court available, the Government has felt that thero is an obligation to comply with the wish of the British Government in this matter, and it has accordingly cabled agreeing to Sir Adrian Knox serving upon the Committee. He will leave for Great Britain by,.the Moldavia, which sails on the. 10th June. WIRELESS TELEGRAPHY.",14
15,Mr COLEMAN,SHIPS FOR LIGHTHOUSE,"I ask the Prime Minister whether, in view of the fact that the British Government promises a statement regarding wireless developments, and of the fact that by the beam method the possibility of transmitting the human voice between England and Australia has been successfully demonstrated, he is in a position to make an announcement on the subject of wireless telegraphy generally?",14
16,Mr BRUCE,SHIPS FOR LIGHTHOUSE,"I assume that the honourable member's question refers, not to broadcasting, but to wireless telegraphic communication generally. During the past week-end, not merely was telegraphic communication possible, but the human voice was actually heard by i m - the beam method of transmission. It is evident from this that the discoveries which have recently been made in further advancement of long-distance wireless transmission, suggest the very greatest prospect of some satisfactory arrangement by which we shall have direct communication with the Mother Country in the near future. At the moment, however, I have no statement to make, although I am in communication with the British Government in regard to the matter. NEW GUINEA TERRITORY.",14
17,Mr FORDE,SHIPS FOR LIGHTHOUSE,"Has the attention of the Prime Minister (Mr Bruce) been drawn to the serious disclosures being made in Tha Labour Daily, of Sydney, in connection with the administration of the mandated territory of New Guinea? If so, has any action been taken in consequence thereof?",14
18,Mr BRUCE,SHIPS FOR LIGHTHOUSE,"My attention has been drawn to the newspaper articles referred to by the honourable member, and the fullest inquiries are being made into them. I hope, during the course of the day, to bo in a position to make a statement to the House. CINEMATOGRAPH FILMS.",14
19,Mr BAMFORD,SHIPS FOR LIGHTHOUSE,"Some days ago I asked the Prime Minister if he could inform the House who are the censors charged with the duty of inspecting and passing cinematograph films,. and if their practice is to examine the filmsthemsolves, as they are thrown upon the screen for public inspection, or if they are satisfied with the synopsis of the story of pictures? The Prime Minister was good enough to say that he would make inquiries and let me know later. Is he now in a position to make a statement ?",14
20,Mr BRUCE,SHIPS FOR LIGHTHOUSE,"I certainly feel that I owe the honourable member an apology. The information he has asked for should have been available already. I have not . it by me now, but I shall certainly get it for him in the course of the clay. I regret the delay that has occurred. WAR DEBT TO GREAT BRITAIN .",15
21,Mr WEST,SHIPS FOR LIGHTHOUSE,"Prio r to his departure to attend the Imperial Conference the Prime Minister promised to get certain details concerning Australia's funded war debt to Great Britain of £92,000,000, and to say what he accomplished at the Conference. It is an important matter for me, as I want to make up my balance sheet.",15
22,Mr SPEAKER,SHIPS FOR LIGHTHOUSE,What is the question?,15
23,Mr WEST,SHIPS FOR LIGHTHOUSE,"I asked the Prime Minister, some time ago, in reference to the £92,000,000 owing by Australia to Great Britain, and he promised to make a statement to the House. I thought this a convenient opportunity to revive his memory.",15
24,Mr SPEAKER,SHIPS FOR LIGHTHOUSE,That is not a question. NA INFORMATION. FOBMAL MOTION or ADJOURNMENT.,15
25,Mr SPEAKER,INCORRECT DEPARTMENTAL,"Rt. Hon. W. A. Watt). - I have received an intimation from the honourable member for Batman (Mr. Brennan) that he desires to move the adjournment of the House for the purpose of discussing an urgent matter of definite public importance, namely, "" In correct and misleading information deliberately supplied to honourable members of this House and others by departmental omcers in connection with the case of exPrivate William Holland, No. 3088, 38th Battalion, to the detriment of that ex-soldier."" vvue honourable members having risen in their 'places, * - - -» ' Question proposed.",15
26,Mr BRENNAN,INCORRECT DEPARTMENTAL," [3.15] The motion is a formal one, and is moved for the purpose of discussing a matter of the greatest importance, which you, sir, have just stated. I am only sorry that, notwithstanding my desire to compress my observations into the smallest reasonable compass, it will be, I am afraid, impossible for me to deal with the whole subject in the short space of half an hour. I shall, therefore, have to ask the indulgence of honourable members for a slight extension. I take it that it needs no argument to establish the seriousness of supplying misleading de« partmental information to this Chamber, to its members, or to representative organizations outside. The case is much more serious when the misrepresentations are considered and deliberate, as in this case. Honourable members know perfectly well that Ministers, for the information they give to this House in answer to questions, are largely dependent upon the good faith and integrity of our public Departments. Honourable members know, equally, that the House itself is largely dependent, in respect of its legislation for the whole of Australia, upon information so received. I am happy to be able to say that it has been, I think, our general experience that the trust which we have placed in our public Departments has not been abused. It would be a very grave matter if we had in this country a secret bureaucracy, working behind closed doors and acting in contempt of Parliament. I undertake to prove that this case is an exception to that good record to which I have referred and admitted. I undertake to prove that the members of the Repatriation Commission, and at least one senior officer of the Department, have deceived and misled members of this House in circumstances that show conclusively wilful deliberation on the part of one or more of the persons concerned. I am in the happy position of being able to base my case upon records already published in Hansard, and upon written communications bearing the signatures of the officers concerned. Some few gaps I shall fill in during this address. The persons to whom these misleading statements were deliberately made-the case goes back: a considerable time-were Mr W. M . Hughes, the present member for North Sydney and then Prime Minister; our late colleague (the late Mr Frank Tudor), then Leader of the Opposition; last and least, as far as this House is concerned, myself; and, outside the House, members of the Fairfield Branch of the Returned Sailors and Soldiers Association, members of the Fathers Association, and others. The substance of the deceit, for so I call it , is(1) The statement by, or on behalf of, the Repatriation Commission, that the medical opinions in Defence, Pensions, and Repatriation Departments were unanimous that military service had not caused nor aggravated Holland's physical condition; whilst, in truth and in fact, the bulk of the medical testimony in possession of the Commission declared plainest possible language that Holland's physical condition was either caused by, or aggravated by, his military service. (2) The statement by, or on behalf of, the Repatriation 'Commission that there was no evidence to show that Holland's condition was attributable to war service, either by way of origin or aggravation; while, in truth and in fact, there was a great deal of evidence by Medical Boards and medical men of high standing supporting the view that Holland's condition was attributable to war service, either by way of origin or aggravation. ('3) The persistent suppression of material facts relating to the medical testimony in the case. In this case Holland is not the defendant; the defendants are the Repatriation Commissioners and their omcers, and I do not want honourable members to be sidetracked into a detailed investigation of the merits' of his claim. I am satisfied that he has been cruelly wronged, but if I refer to the details of his case it is merely for the purpose of establishing the proposition I have set out to prove, which is a much more serious matter than the wrongs of any individual case could possibly be. The following is a short history of Holland's case.:Now living at 57 Gotch-street, Northcote South. Enlisted, 8th January, 1917, at Melbourne; embarked on s.s. Ballarat, which was torpedoed and disabled; and, whilst being transferred to a destroyer with other troops, he slipped off the ladder and was drenched. He spent five or six hours on the deck of the destroyer, and a night in a shed at Plymouth, all of which resulted in a bad cold, which developed, and, after four weeks' training, he was .sent back to Australia and discharged medically unfit. 22nd December, 1917. Tuberculosis had not manifested itself as early as that date, but now Holland is at an advanced stage of that disease. I do Mr Brennan. not guarantee the accuracy of minute details which are not essential to my case, but I guarantee the accuracy of every essential detail. On the 8th July, 1920, the late Mr Frank Tudor wrote to the Repatriation Commission as follows:Ex-private W. Holland, 2088. 57 GotchBtreet, Northcote South - Enliste d on 8th January, 1917; embarked on 19th February, 1917; and returned on 22nd December, 1917. He was. on the Ballarat when she was torpedoed, and later contracted asthma. He has been in the hospital on and off ever since. Only recently he left the hospital after being there ten months. Mr Holland is in need of assistance. Will you kindly look into his case to see what can lie done for him? I ask honourable members to note the fact in the - althoug h they may not see the importance of it for the moment-that the letter contains no request for a pension for Hol land, but is simply a kindly inquiry from a man who is now dead, but who was grossly deceived in the reply he received from the Repatriation Department on the 13th of July, 1920. That letter, which was signed by Major Ryan, Deputy Commissioner, was as follows.: - Re ex-No. 3088, Private' Holland, William, 38th Battalion - Enlisted , 6th January, 1917; discharged, 22nd December, 1917; served, England; disability, over age; pension, nil. In answer to your communication of 8th July regarding the above-mentioned man, I have to inform you that Holland served in England only; he continued camp training until 2nd August, 1917, when; on account of his age, he was medically boarded and returned to Australia. He was not in hospital during this time, and on his return was medically boarded at No. 11 Australian General Hospital, and discharged immediately for senility. His incapacity due to war service was assessed as nil. He was 60 years of age when he enlisted, but gave his age to the Defence Department as 44 years. Several Medical Boards have examined this man between 2nd August, 1917, and 4th February, 1920; on behalf of the Defence, Pensions, and Repatriation Departments, and their opinions are unanimous that military service has not caused nor aggravated his present physical condition, which is due to age and constitution. Re s.s. Ballarat - Hi s claim that he suffered from the torpedoing of the Ballarat is not feasible, in that he continued training without any hospital attention, nor has he claimed his Ballarat experience as a cause of his asthma until last March. It is noted that the troops disembarked from the Ballarat into boats, and were not subjected to extra hardships or immersion. Mr Holland's case has been fully considered by this Department and the honorary medical consultants, and also by the Commission, which body has decided that, as hiB present trouble is not due to nor aggravated by his war service, repatriation benefits cannot be granted in this case. At this stage I acquired certain information from Mr Ratcliffe, secretary of the branch of the Returned Sailors and Soldiers Imperial League to which I have referred, acting for his organization, and from Mr Clayton, president of the Fathers Association. Too much credit cannot be given to these gentlemen for their services in this case. Mr Ratclifte, in particular, has displayed not only remarkable perseverance, but also marked ability in laying the foundations of the case which I am presenting to the House. As a result of the information which these gentlemen supplied to me, I wrote to the Repatriation Commission on the 11th of February, 1924 - this is more modern history-askin g for the production of the file of the Holland case, and on the 13th of February, 1924, I received a reply from Major Ryan in the following terms: I am in receipt of your letter of 11th February, 1924, requesting that you be allowed to inspect the file relative to - the above named. I regret to state that your request cannot be acceded to, as. all the records of this Depart- statedment are confidential. I am, however, prepared to answer any questions relative to Mr. Holland's applications for benefits from this Department which you may be pleased to ask verbally or addressed to me in writing. Perhaps, however, the necessity for further action on your part may be obviated by perusal of the attarhcd copy of a letter addressed to the late Mr F. G. Tudor, M'.P., who made representations on behalf of Mr Holland in July, 1920. Thus in the most solemn manner did the Commission, on the 13th of February, 1924, confirm the letter written on the 13th of July, 1920. The deliberately in correct and misleading statement in that letter was contained in the following passage : Several, medical boards have examined this man between the 2nd of August,. 1.917, and the 4th of February, 1920, on behalf of the Defence, Pensions, and Repatriation Departments, and their opinions are unanimous that military service has not caused nor aggravated his present physical condition, which is due to age and constitution. That statement was false in all material particulars, but, recognizing that these - gentlemen were in the place where they were demanded of conscience to speak the truth, the whole truth, and nothing but the truth, the communication from the Department was falser in what was suppressed than in what was incorrectly expressed. On the 3rd of February, 1920,. which date falls with in the period deliberately chosen by Major Ryan, a Board, consisting of Lieutenant-Colonel Enabling,, who was Holland's commanding officer, Colonel W . Summons, and M a j or H . I r v in g , all eminent medical men, reported on Holland's case as follows:Private Holland is suffering from chronic asthma and bronchitis. He is at present requiring further hospital treatment, and is totally incapacitated. His disability was aggravated by military service, and the Board recommends that he be granted extension of halfpay. That statement alone destroys the validity of M a j or Ryan's letter in regard to the unanimity of the declarations of the medical men. But it is by no means all. M a j or Ryan has taken the period from August, 1917, to February, 1920. When he wrote to me he had before him another report, submitted on the 11th of March, 1920, about a month later than that above quoted, by a Board presided, over again by Colonel Summons, and of which M a j or H . I r v in g was a member. That report Has been in hospital continuously for last four months. Suffering from chronic bronchitis and asthma, and is lately much improved. Aggravated by war service. Present condition weak, and still suffering from chronic bronchitis and' asthma. Disability is permanent; 100 per cent, incapacity. Recommend hospital for one month. I amtold on excellent authority that these Boards were brought about in this way. The first Board was constituted by Lieut - Colonel Embling, who, I have already said, was Holland's commanding officer. He had had this patient under observation for no less than two years. He associated himself with the two other doctors as a Board, and it found as I have said. As the result, of that, the Principal Medical Oflicer, Dr Sturdee, constituted what is known as a Finalization Board. That was the second Boards As a result of its finding, Holland was detailed by the Principal Medical Officer for a pension, and the whole matter was - minuted by General Brand, the State Commandant for Victoria, so that in the most solemn way possible these medical men, who knew best, declared that H o l land's condition had been "" caused by or aggravated by his military service."" Mr R. GKEEN - What was the date of that last Board?",15
