speakerGroups,Speaker,Title,text,pageNumbers
0,NA,Unknown,"House of Representatives. Wednesday, 1 October, 192j.",12
1,Mr SPEAKER,Unknown,"Rt. Hon. W . A . W a took the chair at 3 p.m., and read prayers. LEAGUE OF NATIONS . CONFERENCE AT GENEVA. Mr W . M . HUGHES - Has the Prime Minister received any official message from Geneva ahout the discussions which have been taking place there in the Assembly of the League of Nations ? If so, is he in a position to make a statement to the House, in regard to the matters discussed.",12
2,Mr BRUCE,Unknown,"I have been receiving communications constantly from Sir Littleton Groom with regard to the proceedings of the conference of the Assembly of the League of Nations at Geneva. I received one within the last hour dealing with the question which has been given great prominence in the press during the last two days, the f r a m i ng of the protocol which it is proposed to refer to the governments of the various nations that are members of the League. That cablegram, however, is so mutilated that it is impossible to discover from it exactly what the position is. I hope to be able to make to the House in the course of the next few days a statement with regard to the developments which have taken place. ISSUEOFTREASURY - BILL S.",12
3,Mr WEST,Unknown,"The Treasurer has announced the issue in London of treasury bills for £2,000,000 at 3£ per cent., and ' for £1,000,000 at 4 per cent. These will have to be covered by a loan at some future date. I ask the honourable gentleman whether the business has been carried out by stockbroking firms or by the London branch of the Commonwealth Bank 1",12
4,Dr EARLE PAGE,Unknown,The Commonwealth Bank does the whole of the banking business of the Commonwealth in London. BRITISH PREFERENTIAL TARIFF .,12
5,Mr GREGORY,Unknown,"In view of the statement made yesterday by the Minister for Trade and Customs relating to an alteration under a customs regulation of the proportion of British manufacture required in imports from Great Britain to secure the preference given to such imt t ) ports under the tariff, I ask the Prime Minister whether the regulation will be gazetted and laid on the table immediately, so that Parliament may have an opportunity to discuss it , or is it the desire of the Government to materially alter the in cidence of the tariff without submitting the matter to the House ?",12
6,Mr BRUCE,Unknown,"The question the honourable member has raised was referred to by the honourable member for Perth (Mr . Mann) last night, and I then said that the Government would consider whether it would be possible to find an opportunity to permit the House to discuss the whole matter. DELIVERY OF TELEGRAMS .",12
7,Mr MAKIN,Unknown,"In the absence of . the Postmaster-General I have addressed questions to the Minister representing him on the subject of the delay in the delivery of telegrams, and I mentioned that in one case sixteen and a half hours were occupied in sending a telegram from Melbourne to Adelaide. Will the Postmaster General make himself conversant with the questions which have been asked on this subject and supply an answer to them at the earliest possible moment?",12
8,Mr GIBSON,Unknown,I shall look into the matter to see exactly what the position is and shall let the honourable member know the result. LOAN TO EQUALIZE EXCHANGE.,12
9,Mr MANNING,Unknown,"In view of the fact that Commonwealth loans will be maturing in London this year, and that the exchange difficulty in connection with the marketing of our products is likely to become more acute, I ask the Prime Minister if the Government, will consider whether it is not possible to arrange with financial institutions to float a loan in Australia, and use the money to equalize exchange ?",12
10,Mr BRUCE,Unknown,"The honourable member's question should more properly have been addressed to the Treasurer. I remind him that an arrangement was come to by the council representing the Commonpossible wealth and State Governments with reintroduced. gard to loans to be issued in Australia on their behalf during the present year. The amount of loan money which could be raised in Australia without detrimentally affecting persons requiring money for private purposes was considered by the council, and a decision arrived at. I afrai d it would be impracticable to give effect to the suggestion that the honourable member has made - of the Northern Territory? COMMONWEALTH BANK. BOARD OJ? DIBECTOKS. Mr E . RILEY - In view of the fact that the Prime Minister made the bill to amend the Commonwealth Bank Act an very near future. urgent measure, I ask when he is going to announce to the House the personnel of the board of directors of the bank.",12
11,Mr BRUCE,Unknown,"I hope to do so very early date. The Government has been anxious in constituting the board to obtain the services of directors who will command the confidence of ihe whole of the people of Australia, and it is for that reason that the appointment of the board has been delayed longer than we otherwise should have wished. POSTMASTER-GENERAL'S DEPARTMENT. ALLEGED RETBENCHMENT.",13
12,Mr YATES,Unknown,"I have before me a telePederal gram which states that men employed in threatened the telegraph section of the Postmastersea General's Department are being retrenched, and it is expected that 200 or 300 more will be put off shortly. the Postmaster-General give the House mills? *ny information as to why this retrenchment is taking place?",13
13,Mr GIBSON,Unknown,"It is not the intention of the department to put any men off. being obtained. The information conveyed by the wire which the honourable member has received is, therefore, not correct. SUPERANNUATI ON BILL .",13
14,Mr COLEMAN,Unknown,"I ask the Treasurer when will the Superannuation Bill be tabled, so that members of the House who are interested in matters affecting the Public Service can give it reasonable consideration ? <3>",13
15,Dr EARLE PAGE,Unknown,As soon as it is to introduce the bill it will be WRECK OE DOUGLASMAWSON . RESCUE OE WHITE WOMEN .,13
16,Mr MAKIN,Unknown,When is it expected that information will be given to this House and the country generally respectam ing the expedition sent by the Huddersfield to rescue the white women reported to be held in capti\rity by the aborigines,13
17,Mr BRUCE,Unknown,"As the honourable member knows, the John Alee some days ago proceeded from Darwin to the assistance of the relief expedition, and it is hoped that information will be available in the WOOLLEN GOODS.",13
18,Mr COOK,Unknown,"the Minister for at a Trade and Customs, upon notice I. Will he state(n.) The total value of woollen goods imported into Australia during the past twelve months. (6) The description of manufactured goods imported, also the country whence imported. (c) The wages paid to employees fir woollen factories in Germany. {cl) The wages paid to woollen factoryoperatives in Bradford, England. (e) The rates of wages in the Australian Woollen Mills? 2. Is it a fact that many of the woollen mills that were started, largely on the advice of the Bureau of Science and Industry, are with extinction as the result of overimportations of woollen goods? 3. What are the rates of duty now paid on imports of woollen material into Australia? 4. Is the Government prepared to financially Can assist hy loan the under-capitalized woollen 5. If not, what action, if any, does the Government intend taking to save the small woollen mills?  NA DEPARTMENT. DRAUGHTSMEN'S SERVICES.",13
19,Mr COLEMAN,IMPERIAL ORDNANCE SURVEY,"the Minister for Defence, upon notice I. Ts it a fact that draughtsmen from the Imperial Ordnance Survey Department, England, are being brought to Australia by the Commonwealth Government in connection with, the preparation of a series of - maps? 2. If so, why were not applications for this employment invited in Australia?",13
20,Mr BOWDEN,IMPERIAL ORDNANCE SURVEY,The answers to the honourable member's questions are as f o l low : 1. No. 2. See answer to No. 1. PAPU AN PUBLIC SERVICE.,14
21,Mr YATES,IMPERIAL ORDNANCE SURVEY,"the Minister representing the Minister for Home and T e r r i tories, wpon notice I. Is it a fact that dissatisfaction exists in the Public Service in Papua owing to the failure of the department to fix a date for the reclassification 1 2. Is it a fact that the Service has, on t\yo occasions, sent a delegate to Melbourne in connection with the matter? 3. Is it a fact that the Minister promised, last yeai. that a mpmbnr of the Public Service Board would visit Papua and report to him? 4. If so, when is it intended that the visit shall take place?",14
22,Mr HILL,IMPERIAL ORDNANCE SURVEY,"The answers to the honourable member's questions are as f o l low : 1„ The Public Service of Papua was reclassified in 1020. and a further reclassification was asked for last year. Disappointment has been expressed by the local Public Service Association, at the fact that it has not yet been possible to comply with this request. 2. A deputation of Papuan officers, who were at the time on leave in Australia, waited upon the Minister in A p r i l, 1023, and asked for a reclassification of the Papuan Service by an officer of the Commonwealth Public Service. In May last, another officer, also on leave, called at the Home and Territories Department and inquired when ""the reclassification was likely to bo made. 3. The Minister promised the deputation referred to that lie would bring their request before the Commonwealth Public Service Board upon its appointment. The Commonwealth Public Service Act 1922 came into operation on the 1.0th July. 1923. and on the 4th August. 1023, the deputation's request was duly brought under the notice of the board. 4. Owing to the pressure of work in connection with the classification of the Commonwealth Public Service, the Public Service Board is unable to indicate when it will be possible to make the services of an officer available the reclassification of the Papuan Service. view of the fact that, there seemed to be no likelihood of the Public Service Board bein* able to give the matter its attention for considerable time, the Lieutenant-Governor of Papua suggested to the local Public Service Association that he should ask the Minister for a reclassification to bo made by the SecJanuary, retary, Home and Territories Department, but this suggestion was declined by .'the associaa tion. UNIFORM RAILWAY GAUGE.",14
23,Mr MANN,IMPERIAL ORDNANCE SURVEY,"the Prime Minister, upon notice I. Has the Commonwealth Government made proposals to the states that if the complete scheme of main lines unification is carried out the cost should be met by the Commonwealth and the states on the same basis as that proposed for the Grafton-South Brisbane line now projected ? 2. If so, when? 3. What is the estimated quota for each state and the Commonwealth of the total estimate of £21,600,000? 4. Did all the states accept this basis? If not, which declined to do so? 5. Did those who accepted do so subject to approval of their respective Parliaments?",14
24,Mr BRUCE,IMPERIAL ORDNANCE SURVEY,"The answers to the honourable member's questions are as follow:1. The Commonwealth Government has made definite proposals to each of the five mainland states regarding the uniform railway gauge - scheme recommended by the royal commission in September, 1921, at an estimated cost of £21,600,000. This scheme provides for(ol a standard-gauge railway fro m Fremantle to Kalgoorlie; (6) a standard-gauge direct railway from Port Augusta, via Eed Hill , Long Plains, and Salisbury; (c) conversion to standard gauge the broad-gauge lines of South Australia, standardizing with 80-lb. rails, &c, certain portions of the railway from Adelaide to the Victorian border; also new railway bridge over the river at Murray Bridge, and deviation in connection therewith; (d) conversion to standard the broadgauge lines of Victoria; (e) standardizing the existing railway between North Grafton and Kyogle, and construction of a standard gauge railway from Kyogle to Brisbane. The proposal was that the Commonwealth, in the first instance, should find the money, for that the Commonwealth's quota be one-fifth, Tn the remaining four-fifths to be borne by the five mainland states in the proportion that the population of each state bears to the populasome tion of the whole of the five states. 2. At a conference of the Commonwealth and state Ministers, held in Melbourne in October and November, 1921, and again in 1022 (see printed reports of discussions, &c.), the proposals were committed to draft agreement painted and circulated to each of the State Governments. 3. Tho cost of the work within each state, and in Commonwealth Territory, and the quota from each state and the Commonwealth, is follows:- in the Western Australia . . 5,030,000 South Australia 4,674,000 Victoria 8,324,000 New South Wales . . 1,657,000 Queensland 1,848,000 Commonwealth 67,000 Total 4. Each of the states agreed to the basis of payment, viz., one-fifth by the Commonwealth, and remaining four-fifths"" by the states on a per capita basis. At the conferences referred to (in reply to Question 2) the states of Queensland, New South Wales, and Western Australia were in agreement generally that the works proposed by the royal commission (estimated to cost £21,600,000), should be put in hand; but Victoria and South Australia, whilst accepting the standard gauge of 4 ft. Si in., and agreeing that "" the adoption of a uniform gauge is . . . . essential to the development and safety of the Commonwealth,"" would not assent to the work being proceeded with for the present. 5. Acceptance by the states was subject to approval of the respective Parliaments. This was a proviso in the draft agreement referred to in reply to Question 2. MAIZE INDUSTRY. SOUTH AFRICAN RECIPROCITY.",14
25,Mr CORSER,IMPERIAL ORDNANCE SURVEY,"the Minister for Trade and Customs, upon notice I. Arc negotiations for a new reciprocal trade treaty with South Africa now going on? 2. Is maize one of the commodities included in the negotiations? 3. If so, will the Government carry out the promise made to rectify the tariff anomaly now existing in connection with this commodity ?  honourable member's questions are as f o l low :1. Yes. 2. \'es. 3. The Government recognizes the absolute necessity that exists to give better protection to the Australian maize-grower. RUBBER GOODS.",15
26,Mr MAHONY,IMPERIAL ORDNANCE SURVEY,"the Minister for Trade and Customs, upon notice What was the value and country of origin of the following imports for 1921-2, 1922-3, 1923-4:-{a ) Bubber goloshes; (6) rubber sandshoes; (c) rubber boots; [d) plimsolls; (e) rubber tyres.  Cost of Work being obtained. State, &c. Quota. PAPUAN INDUSTRIES. £ PREFERENTIAL TARIF F. £ 1,078,103 - Mr YATES asked the Minister for 1,632,292 Trade and Customs, upon notice4,939,349 7,094,388 1. Whether it is the intention of the Minis2,535,868 ter to provide for preference to be given under 4,320,000 the tariff schedules on rubber, maize, sugar, coffee, hemp, cocoa, and other tropical pro£21,600,000 £21,600,000 ducts grown and produced in the Territory of Papua ? 2. Vvill such legislation be introduced during the present session? 3. If not, when will such legislation be Introduced?  ceiving the earnest consideration of the Government. There are several difficult problems involved. It is my intention to go very full y ancl sympathetically into the whole matter during the coming recess. EEDERAL CAPITAL.",15
27,Mr LACEY,IMPERIAL ORDNANCE SURVEY,"the Minister for Works and Railways, upon notice I. What is the estimated amount of expenditure on authorized work at Canberra to date? 2. iWhat was the estimated cost of the completion of the design submitted and accepted from Mr W. B. Griffin?",15
28,Mr HILL,IMPERIAL ORDNANCE SURVEY,"The answers to the honourable member's questions are as f o l low :1. The expenditure exclusive of land, to 31st August, 1924, was £2,295,222. 2. The design submitted and accepted from Mr Griffin was a sketch plan only of the layout for a city. It contained no developed details of the' actual works involved, each of which would have to bo the subject of special design, as required. Prior to the war, the Government had put in hand certain engineering services, and in 1921 it appointed an advisory committee which drew up a scheme of works necessary to enable the Seat of Government to be transferred as early as possible. The scheme was based generally on Mr Griffin's design, but many of the larger works involved therein were postponed indefinitely for financial reasons, provisional services being meantime arranged to meet present requirements. CANADIAN PREFERENCE.  tember, the honourable member for Indi (Mr Cook) asked the following questions :1. Is it a fact that Canada is willing sider preference upon Australian wines with her importation of 60,000 gallons of wines, on dried' fruits with her importation of_ 33,000 tons annually, also on brandy, of which she imports 114,000 gallons annually, conditionally upon the Commonwealth granting admission of Canadian newsprint on equal terms with British newsprint? 2. Is it a fact that 60 per cent, of British newsprint that is admitted free is of Scandinavian origlin? 3. If the Minister is not aware of the tion, will he ascertain the facts? 4. If found to be in time, will he at once place Canada on a favourable footing conditionally upon Canada granting reciprocity in respect of wines, brandy, and dried fruits? I am now able to furnish the honourable member with the following information :1 and 4. The proposals submitted to the House in connection with the reciprocal tariff agreement with Canada provide for this. 2 and 3. The information sought is not available locally. The following paper was presented:Canada-Applicatio n to Canada of Bnitish Preferential Tariff and Intermediate - Repor t on proposal Joy the Tariff Board. NA RICHMOND, NEW SOUTH WALES.",15
