speakerGroups,Speaker,Title,text,pageNumbers
56,Mr ARCHDALE PARKHILL,IMPORTATION OF PEDIGREE," That is so. It is due to the men who fought for this country that the work should be continued. There is an urgent need for the absorption of the workless in the country today, and the construction of the memorial would serve the dual purpose of carrying out the decision of Parliament and. also meeting the sentimental views of a very large section of the people. Further, it would have the effect of at least relieving in some degree the distress that is now prevalent through unemployment. understand that a considerable sum is now paid by the Government in rent for the housing of the valuable war relics and trophies that have been collected. Everything seems to point to the wisdom of continuing the work. There should be a clear statement by the Minister as to whether he has sufficient money in hand for this purpose to last uutil the end of the year without Parliament voting a further sum. I realise that the Government has not yet been in office for a sufficient period to enable it to propose a comprehensive scheme for the absorption of the unemployed, but, it should take steps in that direction, instead of denying that we have unemployed in Canberra and that retrenchments have occurred. If the Government frankly informs the House that it has uot had sufficient time to enable it to formulate its policy regarding unemployment, honourable members on this side will accept its assurance, so long as they know that a scheme is being developed. ' I doubtwhether a Federal Government can satisfactorily solve the problem of unemployment; but this Government has promised to do it, and I think that the counti-y expects some explanation from it as to the way in which it proposes to carry out its election promises.",16
57,Mr BLAKELEY,IMPORTATION OF PEDIGREE,"Darling-Minister for Home Affairs) [11.40] - In reply to the question of the honourable member for Fremantle (Mr Curtin) whether the sum of £20,000, placed to a trust fund, is able, I may say that that amount has been set aside for the building of the War Memorial, but the money is not available; if it were spent, our cash reserves would be depleted to that extent. Honourable members are discussing what is purely a bookkeeping entry. An amount is not paid into a trust fund in gold or bank notes.",16
58,Mr ARCHDALE PARKHILL,IMPORTATION OF PEDIGREE,"Then , when money is put into a trust fund, it is not put in.",16
59,Mr BLAKELEY,IMPORTATION OF PEDIGREE,"No money is actually paid into a trust fund. The sum of £20,000 will be available for this work when our financial conditions improve, and it can only be used for the purpose for which it has been allocated.",16
60,Mr BELL,IMPORTATION OF PEDIGREE,"What was the idea, in putting that amount into a trust fund ? I Mr BLAKELEY - The honourable member might well ask those of his colleagues who were members of the last Government.",16
61,Mr CURTIN,IMPORTATION OF PEDIGREE,"Did the late Government invest the £20,000 or did it propose to leave it idle, earning nothing?",16
62,Mr BLAKELEY,IMPORTATION OF PEDIGREE,"The sum of £20,000 was merely credited to the trust fund. I suggest that the ex-Treasurer, the right honourable member for Cowper (Dr Earle Page) might be asked any further questions-on this matter. The Government accepts full responsibility for its action.",16
63,Mr FRANCIS,IMPORTATION OF PEDIGREE,"Does the Minister mean that the trust fund is overdrawn, and thai this £20,000 is not in it.",16
64,Mr BLAKELEY,IMPORTATION OF PEDIGREE,"I have uot said that the trust fund is overdrawn. I have tried to make it clear that although the sum of £20,000 was placed in a trust fund last year, only a book-keeping entry was made, and no actual cash is now available. If this amount were spent, it would deplete our cash reserves accordingly. The Government is confronted with an extremely difficult position, and it has been decided temporarily to suspend operations in connection with the War Memorial. We had a comparatively short time to check over our Estimates and make investigations. We were confronted with the fact that we had to get the Estimates to the printer as quickly as possible, in order that Parliament might have them. It was not until after the Estimates had gone to the printer that availwe decided to discontinue temporarily the work of erecting the War Memorial. Unfortunately, it is impossible under present financial conditions to proceed with it at present. Eleven years have elapsed since the war ended, and the War Memorial is not yet started.",16
65,Mr FRANCIS,IMPORTATION OF PEDIGREE,All the more reason to begin with it.,17
66,Mr BLAKELEY,IMPORTATION OF PEDIGREE,The late Government must accept any censure that is applicable to the delay.,17
67,Mr GULLETT,IMPORTATION OF PEDIGREE,Henty) [11.46] I find it exceedingly difficult to believe that the Government intends to arrest all work upon the development of this National War Memorial.,17
68,Mr SCULLIN,IMPORTATION OF PEDIGREE,"A thing that is not, started cannot be arrested.",17
69,Mr GULLETT,IMPORTATION OF PEDIGREE,"The Prime Minister says that our National War Memorial is not started. He is speaking with little knowledge of this great work. National War Memorial is in its final stages of completion and the work has been proceeding for eleven years. late Government advanced the work steadily over that period, and there has been no unnecessary delay. There has previously been no cessation of this noble enterprise. The development of the War Memorial falls into two parts. There is first the collection which is to be housed in the memorial, and, secondly, the building itself. No useful purpose would be served in proceeding with the erection of this building at considerable expense unless we were close to the completion of the collection, but the position today is that the finest collection of its kind in the world is practically complete It will, we hope, be complete within the next year or two. This work, which the Prime Minister says is. not started, has been proceeding.since 1917.",17
70,Mr BLAKELEY,IMPORTATION OF PEDIGREE,The Prime Minister referred to the building.,17
71,Mr GULLETT,IMPORTATION OF PEDIGREE,It is all one work.,17
72,Mr BLAKELEY,IMPORTATION OF PEDIGREE,That is not so. item on the Estimates deals with the construction of a War Memorial and not with operations outside it.,17
73,Mr GULLETT,IMPORTATION OF PEDIGREE,"It is all part of the one memorial and this is the final stage. The collection is almost complete, as to the building, the site has been selected and allotted and some preliminary work has been done. The dedicationthat stone was laid a few months ago. The architect's plans are ready, and, indeed, have been partly paid for. The Gofell overseas. vernment is now asked to take the final step in completing the War Memorial. Let me tell the committee briefly the origin and story of "" the memorial. Early in 1917 a few Australians on service in France turned over in their minds the idea of a future memorial to those who fell for us at the Avar, and out of their consultation came the proposal made to the GoA'ernment of that time that Australia's nationa] memorial - that is one for which the Federal Parliament Would be responsible-shoul d take the form of a great collection of historical Avar records, of trophies and souvenirs of all kinds; in other Avords, that Ave should put together a collection which would tell, as no Avritten Avord could tell, the This story of the Avar and the sacrifices of those who served overseas. The proposal made to the Government of the day in 1917 The was that there should be, first, this collection, and, secondly, at the national capital a memorial building in which to house it. This Avas approved by that GoAernment, subject, of course, to the r endorsement of the Parliament. The Avork of collecting Avas then begun in Franco, Palestine, and the other theatres of war in which Australians were serving. A few years later the project Avas placed before the Parliament. This House agreed, certainly Will an occasional dissenting voice, but Avithout a single diA>ision, to the form of the memorial and the successive steps to be taken towards its completion. The magnitude and range of the Avork that has been done on the memorial is shown by the fact that substantially more than £100,000 has been voted by the Parliament for the deAelopment of the collection. It is no r new beginning that we are asking for at present. We are asking the Government The to take the final steps to the completion of the undertaking by building a memorial in which to house the collection. There is one thing in connection with this plea that I make as a member of the and War Memorial Board that will not be lightly disregarded either by the present Government or by this Parliament, and is the very definite promise in connection Will the memorial that this country gave to the men Avho served and The collection we now possess Avas contributed to by the soldiers themselves while on service in France, Palestine, and otlier fields of warfare. was got together largely in this way: Our troops oversea were promised a memorial in this form, and were invited to contribute to it souvenirs and trophies gathered by our soldiers individually and by the units with which they were serving. Out of that scheme grew a collection the like of which has never been in existence in the world before. The proposal was taken up with the greatest enthusiasm by the troops. Unit vied with unit in its contributions, with the result that we have an extraordinarily large and varied collection of intimate and personal souvenirs and trophies of the war. Thousands of men contributed souvenirs and trophies to the collection, and many of these men afterwards fell at the war. ""We have, therefore, an obligation of the most solemn and sacred kind. The collection was contributed to by the troops under a definite undertaking from the government of the day, afterwards repeatedly endorsed by the Parliament, that at the earliest practicable date this memorial would be built, and the collection which they themselves made would be housed in it . With regard to the suggestion of delay on the part of the last Government, made by the Prime Minister and the Minister for Home Affairs, I have already pointed out that there has been no delay; that the collection is not ready today, and would not be ready even if the memorial building were now complete. But it will be ready within a year, certainly within two years. It will be ready by the time the building is constructed if the work is now proceeded with. appeal strongly to the Government not to delay the construction of the memorial building. I would remind it not only of our sacred pledge to our troops, but also of the amazing sentiment that there is in Australia behind this project. The incomplete collection, which consists of pictures, models, and a thousand and one small personal souvenirs, telling of the service and life of the men overseas, has been on view in - Melbourne and Sydney during the past two years, and no fewer than 2,300,000 Australian people have visited the exhibition. The interest taken in this collection, even in its incomplete stage, has been unparalleled. Mr Gullett. It It does not represent idle curiosity. These people have viewed the collection in no militarist spirit. They have not visited it to revive the lust of battle or memories of the actual fighting. They have gone there in awe and reverence, to associate themselves again with the memories of those four or five years of service and sacrifice. The attendances at the exhibition have been made up almost entirely, not of detached people who have never been associated with the war, but of the diggers themselves with their wives, and children born before or since the war; with their fathers and mothers. I do not wish, and should be most loath, to make a party quarrel of this issue. This War Memorial project is something sacred, and I ask honourable members not to make a party question of it. I appeal to the Minister not to arrest this noble project. I recognize that the Government is in an embarrassing position because of the present financial stringency; but surely it should be possible to find at least £20,000, so that a beginning may be made on the actual building this year. I appeal to the Government not to be the first Federal Government that has allowed the grand progressive work of this memorial to be arrested or to lapse even for one single financial year. I trust that before their decision is final Ministers will visit the collection at the War Museum in Sydney where they will see something in no way calculated to stir up racial or international passions. It is a sacred memorial. I challenge any-one to visit that collection without coming I to loathe war more than ever, and without a prayer in his heart that we shall never again be plunged into such an international conflict as that which it commemorates. I appeal to the Government to find at least a few thousand pounds for building operations this year so that the progress of the work may not be arrested. I make my appeal in the name of those who fought and died overseas, and in the name of hundreds of thousands of the relatives of those who gave their lives for their country. The completion of this work should not be delayed a day longer than can be avoided.",17
74,Mr BLAKELEY,IMPORTATION OF PEDIGREE,"Darling-Minister for Home Affairs) [12.2] - I wish to say something about the matter raised by the Deputy Leader of the Opposition. I agree with him that very valuable work is still in progress in connection with the erection of this memorial. Plaster casts are being made, and the ultimate casts of metal figures showing the activities of the Australian Imperial Forces will be completed within twelve months. Ten such casts are to be made, and already four of them are finished in the war museum. When the estimates for this work were being framed, apparently the Deputy Leader of the Opposition was not aware that the museum in Sydney would have to be closed.",19
75,Mr GULLETT,IMPORTATION OF PEDIGREE,"The museum has never been closed before, and would not have been closed by the last Government.",19
76,Mr BLAKELEY,IMPORTATION OF PEDIGREE,I can only point out that the amount of irioney made available on the draft estimates was not sufficient to keep the museum open.,19
77,Mr GULLETT,IMPORTATION OF PEDIGREE,"The museum might have been closed temporarily, but there would have been no cessation of the work on the memorial.",19
78,Mr BLAKELEY,IMPORTATION OF PEDIGREE,I was under the impression that the Deputy Leader of the Opposition was not aware that the museum would have to be closed owing to the inadequate provision in the Estimates prepared by the last Government. He now admits that it might have had to be closed temporarily.,19
79,Mr GULLETT,IMPORTATION OF PEDIGREE,That is not the War Memorial.,19
80,Mr WHITE,IMPORTATION OF PEDIGREE,"The war museum that was in Melbourne, and afterwards in Sydney, is merely an exhibition that must close some time or other. The Minister does-not understand the position.",19
81,Mr BLAKELEY,IMPORTATION OF PEDIGREE,"I do understand the position, and I assert that, but for the action of the present Government, the museum would have been closed.",19
82,Mr GULLETT,IMPORTATION OF PEDIGREE,The museum does not exist.,19
83,Mr BLAKELEY,IMPORTATION OF PEDIGREE,"It does exist, and one and a half million people have visited it in Sydney. When I took over this department, I found that the sum of £9,500 had been made available for the museum. This would enable certain work to be done, but would not be sufficient, keep the museum open.„. The articles in the museum would have had to be stored and the museum closed. I was able to bring the amount allocated to the museum up to £14,500, which will be sufficient to keep it open. Notwithstanding the plea of the Deputy Leader of the Opposition that this should not be made a party matter, every speech from the Opposition side of the House has been a party speech. Mr E. RILEY - I shall vote against the Government on this matter. I stand by my pledge.",19
84,Mr BLAKELEY,IMPORTATION OF PEDIGREE,The honourable member may vote as he likes. I have been able to raise sufficient money to keep the museum open.,19
85,Mr GULLETT,IMPORTATION OF PEDIGREE,"The museum has never been open, and never will be at the rate the Government is going.",19
86,Mr BLAKELEY,IMPORTATION OF PEDIGREE,"I cast that statement back at the honourable member. His Government was.in power for many years, but during all that time nothing was done beyond making provision for the temporary housing of the exhibits. No steps were taken for the erection of a permanent building except the holding of architectural competitions, and the preparation of plans. The project of this War Memorial was first put forward in 1917, but from then until 1929 not one stone was laid other than the commemoration stone.",19
87,Mr GULLETT,IMPORTATION OF PEDIGREE,"Would the honourable member have had us erect a building, and leave it empty until the collection was ready ?",19
88,Mr BLAKELEY,IMPORTATION OF PEDIGREE,The museum in Sydney has been open for a considerable time..,19
89,Mr GULLETT,IMPORTATION OF PEDIGREE,The honourable member himself has said that only a few of the models are finished.,19
90,Mr BLAKELEY,IMPORTATION OF PEDIGREE,"Whil e it is true that the models form an important part of the exhibition, it is nevertheless a fact that other exhibits have proved so interesting as to induce one and a half million people in Sydney to visit them. Even without the models there is a large and varied collection. It is nonsense to say that there was nothing to put into the building if it had been ready. The collection has been ready for many years, and provision could have been made by the to last.Government to erect a museum and war memorial in Canberra. So far as I can see, however, nothing was done, in spite of the fact that during those years there was a succession of extraordinarily good seasons and good budgets.",19
91,Mr WHITE,IMPORTATION OF PEDIGREE,"Balaclava) [12.10] The statement of the Minister for Home Affairs is disappointing. It is good to know that the war memorial scheme is not being definitely abandoned, but something more should be done than the Government proposes to do.",20
92,Mr BLAKELEY,IMPORTATION OF PEDIGREE,The . work on the War Memorial is being only temporarily suspended. I have made sufficient money available for continuing the work on the casts.,20
93,Mr WHITE,IMPORTATION OF PEDIGREE,"I ask the Government to make sufficient money available to enable the work on the memorial to be continued for at least a year. A few days ago I introduced a deputation from unemployed returned soldiers in the Territory. I then reminded the Minister that there was supposed to be in existence a trust fund of £20,000 for work on the memorial. I am very sorry if the Minister has found in the meantime that that fund does not exist. What has happened to it? Trust money should be put into an account and interest should be payable on it. If the trust fund money is not available I make an earnest plea to the Government that other provision be made for proceeding with this work. I emphasize what the Deputy Leader of the Opposition has already said, that this should not be a party matter. I intend to say nothing in criticism of the Government, aud I ask all honourable members to. treat this matter as something above party and financial considerations. It is our definite moral obligation complete this work, and if we are honourable men we shall go on with it. We owe a duty to the men who did not come back. It is their names which will be engraven on the memorial. Those dear to them will not forget, but if we remain inactive through some slip in accountancy over a trust fund we shall be breaking faith with the men who died. Published in the press this morning was a statement that the Government intended to spend £1,000,000 for the relief of unemployment. The Prime Minister .was asked this moruing whether this was correct, and he said that he was about to consult with the Premiers of the States on the matter. Is there any reason why, if £1,000,000 can be spent for the relief of unemployment throughout the Commonwealth, it is not possible to find £20,000 this year for work on the War Memorial, seeing that the work has already been approved by Parliament? There are from 30 to 50 unemployed soldiers in the Territory alone, and it goes without saying that returned soldiers should be employed, as far as possible, on the construction of the memorial. The memorial may be somewhat grandiose in design, and personally I think that something simpler, such as a cenatoph, would have met the case. However, we are committed to the present undertaking, and we should go on with it. We must remember that it is not only a memorial, but will also be the repository of the priceless records of the Australian Imperial Force, the perman ent home of the documents and trophies associated with the war. It is our definite obligation to erect this memorial, and I ask that the money for this year's work be found from sums allocated for the relief of unemployment. I trust thatmembers of the Government who have previously spoken in support of this memorial will continue to urge that the work be proceeded with.",20
94,Mr SCULLIN,IMPORTATION OF PEDIGREE,"Yarra-Prime Minister) [12.13] - There is apparently misapprehension in the minds of some honourable members regarding this matter, and I hope to make the position clear. The statement of the Minister for Home Affairs did uot in any way indicate that the previous decision of the to Parliament to erect the War Memorial building was to be disregarded. The item on the Estimates is still before the committee. A sum of £20,000 has been allocated to a trust fund. It has been stated that this sum is lying idle, but that is entirely erroneous. If that money had been spent it would have meant merely that our cash overdraft had been increased hy that amount. When the Minister for Home Affairs was asked - whether it was proposed to proceed immediately with the work he said that it was not; that it had been decided to suspend work on tke memorial temporarily. As soon as this Government has had an opportunity of ascertaining the exact financial position of Australia the work will be resumed. All members of the committee, as well as the Government, must take their share of responsibility for this. The condition of Australia's finances is such that any responsible government must hesitate before beginning a building unless it can see its way to complete the work. There is lying idle at the present time in Canberra £50,000 spent on the foundations of public offices, buried in the ground with the dust ready for it. blowing over them. Apart from the doubt as to the security of these foundations, there remains the fact that the last Government was responsible for spending £50,000 on them without knowing whether it would be able to proceed with the erection of the buildings they were intended to sustain. That £50,000 is a dead loss to the Commonwealth of Australia. The proposed memorial is estimated to cost £412,000 and in the present state of Australia's finances the Government cannot see how that expenditure can be undertaken. If we spend £20,000 on excavations and foundations and then withdraw the plant because we cannot afford to proceed further, we shall be throwing away the public money.",20
95,Mr WHITE,IMPORTATION OF PEDIGREE,That often happens.,21
96,Mr SCULLIN,IMPORTATION OF PEDIGREE,"It should not happen, and we are trying to prevent a recurrence of such folly. The Government is not attempting to evade the decision of the Parliament to erect a memorial in the National Capital. On a previous occasion, when the financial position was apparently better than it is today, I was favourably impressed by the remarks of the honourable member for Fawkner (Mr Maxwell) who said nothing against the erection of a memorial to commemorate the names of the men who went to the war and made the supreme sacrifice, but who questioned whether the time was opportune for taking the initial steps. The Deputy Leader of the Opposition (Mr Gullett) has contended that the Government might spend £20,000 this year and thus provide some employment.",21
97,Mr WHITE,IMPORTATION OF PEDIGREE,The work will be forgotten if it is not commenced now.,21
98,Mr SCULLIN,IMPORTATION OF PEDIGREE,"The war ended eleven years ago, and although in the interim past governments had a succession of surpluses, they did nothing.",21
99,Mr GULLETT,IMPORTATION OF PEDIGREE,All along the years the last Government spent a lot of money in preparing for the erection of this memorial.,21
100,Mr SCULLIN,IMPORTATION OF PEDIGREE,"Apar t from architects' fees amounting to about £6,000, not a penny was spent on the War Memorial during the six and a half years of the Bruce-Page regime.",21
101,Mr GULLETT,IMPORTATION OF PEDIGREE,The collection was not,21
102,Mr SCULLIN,IMPORTATION OF PEDIGREE,"The Government has been in office five weeks, just long enough to realise that it has inherited from its predecessor financial obligations that will cause anxiety for some years.",21
103,Mr WHITE,IMPORTATION OF PEDIGREE,This work would relieve unemployment in the Federal Capital Territory.,21
