speakerGroups,Speaker,Title,text,pageNumbers
104,Mr SCULLIN,IMPORTATION OF PEDIGREE,"Every penny that can be afforded for necessary public works will be expended, not only to relieve unemployment but also to carry out the Government's programme. We are told that there are unemployed and that a sum of money voted towards this work is in trust. My reply is that while the money remains in the trust fund it is not adding to the deficit and the interest bill.",21
105,Mr FRANCIS,IMPORTATION OF PEDIGREE,Why pick on this item for retrenchment?,21
106,Mr SCULLIN,IMPORTATION OF PEDIGREE,Because it is not the most urgent. The proof of that is that the last Government did nothing towards the erection of the memorial in all the years it was in office.,21
107,Mr GULLETT,IMPORTATION OF PEDIGREE,"Every year the committee of supply, of which the honourable member was one, voted money for the erection of the memorial.",21
108,Mr SCULLIN,IMPORTATION OF PEDIGREE,"I have never voted against this item on the Estimates. The previous Government had to take the responsibility of assuring the Parliament that this work would be proceeded with. Now, visualizing the prospects for the next few years, I tell the committee frankly that the Government sees no possibility of completing this work at present in a regular and business like way. If , when the Treasurer is preparing his budget for the next financial year, a survey of the whole financial situation shows that work may be carried steadily to completion, it. will be commenced, and the cision of this Parliament will be honoured. To spend £20,000 now, merely because the money has been voted, and next year to declare that funds are not available for proceeding with the would be to betray the trust of the people as the last Government did in connection with the foundations of the administrative block. A commencement with the erection of the War Memorial may be made before the end of the financial year. The outlook may so change that the Government will feel justified in saying that the country can afford the gradual construction of memorial, but before reaching that decision the Government must be satisfied that once the work is started, whether by contract or day labour, the plant and the workmen will remain on the job until it is finished. There are good ways and bad bad ways of undertaking public works, and the worse of all ways is that which was adopted in connection with the new administrative block.",21
109,Mr MAXWELL,IMPORTATION OF PEDIGREE,Requiescat in pace.,22
110,Mr GDLLETT,IMPORTATION OF PEDIGREE,There is a way of inremarks definitely postponing the commencement of a work.,22
111,Mr SCULLIN,IMPORTATION OF PEDIGREE,The late Government would have done infinitely better if had postponed the commencement public offices whose foundations are today abandoned.,22
112,Mr LATHAM,IMPORTATION OF PEDIGREE,The whole Parliament shared in the responsibility for that,22
113,Mr SCULLIN,IMPORTATION OF PEDIGREE,"The last Government accepted 'responsibility when it let tract for the foundations without being sure that it could finance the subsequent operations. The Leader of the Opposiseveral projects. tion (Mr Latham) is shirking that responsibility. The honourable member exceed cuses the last Government by saying that the Parliament supported the exence penditure on the administrative block. Unless Parliament has reason to oppose a proposal it accepts the word of the Government that it can see its way to finance a work to its conclusion. The last Government took the responsibility of advising the House to vote money for foundations for the administrative block, contractor? - this the assumption being that the buildings would be carried to completion. Subde- sequently our predecessors discovered that money was not available for proceeding with the work. I take the responsibility of saying that my Government does not at present believe that the £412,000 work, required for the War Memorial can be found during the period in which the work should be completed. At the beginning of the next financial year or earlier we may see brighter prospects which will justify us in recommending that the work shall be commenced. The Government is not opposed to the memorial ; it is not even making a hostile gesture. The majority of the members the supporting the Government have never opposed provision for the work on the Estimates.",22
114,Mr GULLETT,IMPORTATION OF PEDIGREE,"The honourable gentleman must recognize the danger of postponement, and that the War Memorial is different from other public works. '",22
115,Mr SCULLIN,IMPORTATION OF PEDIGREE,The Government does not intend to ignore the obligations of this Parliament to our fallen soldiers. The honourable member for Balaclava (Mr White) was reported in the press as having alleged that I had made certain derogatory to the soldiers. There is not a tittle of truth in the allegation.,22
116,Mr WHITE,IMPORTATION OF PEDIGREE,The Attorney-General also denied that he had made certain it statements. I replied to him and I shall of the reply to the Prime Minister.,22
117,Mr SCULLIN,IMPORTATION OF PEDIGREE,"I have never said, and I hope I never shall say, one word against the men who went across the seas and risked their lives on the battlefield. work. The proposal to defer the commencement of the War Memorial does not arise a confrom any lack of appreciation of the soldiers. Other works also must be postponed. The last Government had to defer",22
118,Mr ARCHDALE PARKHILL,IMPORTATION OF PEDIGREE,Why prowith the construction of the road between Goulburn and Canberra in preferto building the War Memorial?,22
119,Mr SCULLIN,IMPORTATION OF PEDIGREE,"That road is being constructed in accordance with a contract made by the last. Government, and the Commonwealth is under a financial obligation to proceed with it. Does the honourable member suggest that we should break the contract and compensate the.",22
120,Mr LACEY,IMPORTATION OF PEDIGREE,The last Government proceeded with that work without referring it to the Public Works Committee.,23
121,Mr SCULLIN,IMPORTATION OF PEDIGREE,That is so.,23
122,Mr ARCHDALE PARKHILL,IMPORTATION OF PEDIGREE,But with the consent of Parliament.,23
123,Mr SCULLIN,IMPORTATION OF PEDIGREE,"The last Government ignored the statutory requirement to submit the proposed expenditure to the Public Works Committee for investigation and report. The present Government is rectifying that wrong and making legal the illegality for which the last Government was responsible. The amount for the commencement of the War Memorial will remain on the Estimates, and I assure the committee that the work will be commenced as soon as the Government can see some prospect of being able to carry it to completion.",23
124,Mr LATHAM,IMPORTATION OF PEDIGREE,"Kooyong) [12.27] Often the Prime Minister makes speeches which in themselves are convincing, but which when considered in conjunction with facts other than those stated by him leave a different impression. An item appears on the Estimates for the commencement of the National War Memorial, and naturally Ministers are asked whether they propose to proceed with the work. The Prime Minister has announced that the Government does not propose to do so at the present time. In those circumstances this item should not appear on the Estimates.",23
125,Mr SCULLIN,IMPORTATION OF PEDIGREE,That is entirely wrong. The work may be commenced before the end of the financial year.,23
126,Mr LATHAM,IMPORTATION OF PEDIGREE,"Havin g regard to what the honourable gentleman has said regarding the ultimate liability of £412,000, the Government would be acting logically if it removed this item from Estimates, but it appears to be trying to win both ways.",23
127,Mr THEODOBE,IMPORTATION OF PEDIGREE,Why not build up the trust fund?,23
128,Mr LATHAM,IMPORTATION OF PEDIGREE,The Prime Minister has been at pains to explain that a mere addition to the trust fund achieves nothing.,23
129,Mr SCULLIN,IMPORTATION OF PEDIGREE,I said that the spending of the money that is placed in the trust fund would increase the overdraft and the interest bill.,23
130,Mr LATHAM,IMPORTATION OF PEDIGREE,"On e could understand the Prime Minister's speech if the Government had not placed the item on the Estimates. If the financial outlook improved the Government could, if necessary, introduce supplementary estimates to enable this work to be proceeded with. But, by putting an amount on the Estimates, and thereby pretending that the money is to be expended during the current financial year, the Government is merely playing with the committee.",23
131,Mr CURTIN,IMPORTATION OF PEDIGREE,"The last Government placed £30,000 on the Estimates and expended only £10,000.",23
132,Mr LATHAM,IMPORTATION OF PEDIGREE,"We have the declaration that, at some time in the indefinite future, when provision has been made in every other direction that is considered necessary, some progress may be made with this work.",23
133,Mr SCULLIN,IMPORTATION OF PEDIGREE,That is not a correct interpretation of my remarks.,23
134,Mr LATHAM,IMPORTATION OF PEDIGREE,"It is always possible to compare this with that, and to suggest that one work should have priority over another; but it is difficult indeed to discover any work that at the present time ought to have priority over this War Memorial. Some years have elapsed since the conclusion of the war. The collection of exhibits has been proceeding; extensive public works have been constructed at Canberra; and there is a limit to the .amount of labour which, at a particular time, it is desirable to concentrate in any place. It was intended to move further departments to this city and to proceed with other works; but the financial position which developed during last year and this has led to an alteration of the programme of construction. It would have been unwise to commence work on the War the Memorial until the nature of the collection that would need to be housed was known with approximate accuracy; or during the progress of other extensive works. Other speakers have argued that there is a national obligation to erect in the national city a memorial to our soldiers; but the way that I view the matter is that the memorial and museum should be completed at the earliest possible date in the interest of the city of Canberra. I should like it to be fine and grand, so that it would appeal to the people of Australia and attract tourists to this city. Honourable members are aware that at the present time unemployment exists in the Federal Capital Territory. I do not accede to the proposition that a particular work should be undertaken because there is unemployment; that is not a fair argument. Every work must be considered on its merits. This is a work which, on its merits, ought to appeal to every honourable member. There are ample reasons for its not having been commenced at an earlier date; but there is now an opportunity to begin it. The statement of the Prime Minister (Mr. Scullin), in effect, means that there is to be an indefinite postponement of the performance of a primary obligation.",23
135,Mr YATES,IMPORTATION OF PEDIGREE,"Adelaide) [12.33] - The honourable member for Henty (Mr Gullett) has made what I may call a perfervid appeal to the sentimentality of the nation. He traversed the history of the War Memorial movement from as far back as 1917. I was in Blighty in 1918, and there were very grave doubts even then as to which side would win the war. Fritz was pushing back the allied armies, and it was not known whether ho would succeed in getting through to Paris. When I was sent across to France it was said by those who were acquainted with the area to which I was going that I was being drafted into an ironmongery establishment. To talk of collecting material for a museum in 1917 would have been something in the nature of "" cooking your hare before you had caught it . """,24
136,Mr GULLETT,IMPORTATION OF PEDIGREE,A great deal was collected in 1917.,24
137,Mr YATES,IMPORTATION OF PEDIGREE,"Perhaps the honourable member held a position which afforded him opportunities to collect. That, however, does not concern me. But I am opposed to any attempt to play up to the sentimentality of the people. When I raised this question in the last Parliament I was accused of endeavouring to defeat a vote that would provide employment. The position has not altered in the last three months. The honourable member for Henty stated that the war museum had attracted over 2,000,000 people. That would be in the last ten years. Nearly as many persons could be induced to attend a series of test matches.",24
138,Mr GULLETT,IMPORTATION OF PEDIGREE,The collection has been open to the public only two or three years.,24
139,Mr YATES,IMPORTATION OF PEDIGREE,"I am not belittling the collection in the slightest degree. I have inspected these souvenirs and have been most interested in them. They revived memories which were not very pleasant. But what is the use of placing them in cold storage at the foot of Mount Ainslie? Who will be induced to come to Canberra to see them? The only thing that this place has in large numbers is the blowfly. If the proposal were to incur the expenditure where the museum is at the presenttime, and add to the beauty of one of the best cities in the Commonwealth-Sydne y - I should say "" Go ahead with it."" I am opposed to bringing the collection to Canberra, not to the idea of honouring the heroes of the Great War.",24
140,Mr WHITE,IMPORTATION OF PEDIGREE,The States have their own memorials.,24
141,Mr YATES,IMPORTATION OF PEDIGREE,That fact makes this proposal all the more unnecessary. Every little town has a memorial upon which appear the names of the soldiers who enlisted in it. I noticed in Melbourne last week that a big drive is being constructed to the memorial there.,24
142,Mr GULLETT,IMPORTATION OF PEDIGREE,"This is the national city and, therefore, is the right place for a national memorial.",24
143,Mr YATES,IMPORTATION OF PEDIGREE,"^The honourable member has been bitten by a ""national"" bug; I have not. To me this place is nothing but a big tragedy. I am concerned for the well-being of the public servants who have to rear families here, and send them away at a time when they need the protection and guidance of their parents. In both its conception and development, Canberra is a reflection upon our intelligence. The honourable member cannot convince me that this is a practical proposition.",24
144,Mr WHITE,IMPORTATION OF PEDIGREE,"The honourable member made a perfectly sincere statement. . Mr YATES - Fro m the honourable member's point of view, that may be so. I contend that these war relics ought to be placed where the greatest number of people can see them. My little grandsons play at soldiers with my tin hat and gas helmet. What would they know about a tin hat or a gas helmet if they had to come to Canberra to see them in cold storage? Therefore, I am unable to understand how any person can be sincere in advocating the transfer of the War Memorial to Canberra. I agree that we should honour those who are dead. On the other hand, however, why should we not do something for the men who are suffering from war disabilities and paying the penalty of their heroism and sacrifice ? I have done everything I can do to obtain more sympathetic treatment for such men, but have not been very successful. The honourable member for Henty (Mr. Gullett) said that the men were promised a war memorial. Other promises also were made, and it would bring the blush of shame to our cheeks if we were confronted with them, and made to realise to what a slight extent they have been fulfilled.",24
145,Mr WHITE,IMPORTATION OF PEDIGREE,The honourable member has his chance now.,25
146,Mr YATES,IMPORTATION OF PEDIGREE,"I have never allowed a moment to pass without pleading for the recognition of the sacrifices that our men made. On the 12tb December next, I propose to move a motion concerning men who are tubercular as a result of their war service. A man has written to me from the Waterfall Sanitarium expressing the hope that that motion will be carried. He says, "" The sacrifices made by the men who lost a leg, an eye, or au arm are apparent to the general community; but our clothes cover our agony, arid the time comes when we have to pay a most exacting penalty."" Any soldier who cau fairly claim that his health has been undermined, or that he is suffering great pain on account of a war injury, should be given at least sufficient to live on. He would be earning at least a living wage if he had not gone to the war. In this way we can honour and give satisfaction to our returned soldiers.",25
147,Mr WHITE,IMPORTATION OF PEDIGREE,Why not give them work here?,25
148,Mr YATES,IMPORTATION OF PEDIGREE,"I should uot mind doing that. But the man who is merely out of work at least has his health. My first concern is for those whose health will not permit them to work. I am acquainted with a tubercular soldier, whose wife is maintaining the family by helping to keep clean the Adelaide railway station. She is gradually being worn to a shadow by that work which she has to perform simply because her husband went to the war. If honourable members wish to do the right thing, let them take such action as will make it impossible for any soldier to say that the nation has not stood up to the promises which it made. - It staggers me to find that, although the Estimates show that a certain amount has been expended, in some cases an investigation reveals the fact that the money has merely been placed in a trust fund.",25
149,Unknown,IMPORTATION OF PEDIGREE,Sitting suspended from 12.hh to 2.15 p.m. [Quorum formed.],25
150,Mr YATES,IMPORTATION OF PEDIGREE,"There was a vote on the last Estimates of £50,000; but, according to figures supplied to honourable members, there is an item on the expenditure side of £30,ll3. Unless there is some strange method of dealing with public money, the trust account should amount to more than £20,000.",25
151,Mr THEODOBE,IMPORTATION OF PEDIGREE,The balance lapses at the end of the year.,25
152,Mr YATES,IMPORTATION OF PEDIGREE,"Althoug h that may be the case, I call attention to the manner in which members are treated when they try to find out the exact financial position in regard to an item. In the last Parliament, I asked to be informed as to the details that made up the expenditure of £30,113, and, on the 4th September last, I was furnished with the following particulars:Expended fro m Commomoealth Funds to 31st August, 1929. £ s. d. Architectural competition .. 2,5S2 9 4 Architects' fees .. 3,795 0 0 Sinking five trial holes 33 4 8 Commemoration stone .. 96 4 6 6,506 18 6 Expended from Commission Funds to 31st August, 1929, upon Engineering Services in Association with the War Memorial Site. £ s. d. Roads 9,851 10 0 Stormwater drainage, including culverts .. 3,089 13 1 ^Sewerage reticulation .. 334 5 0 13,275 14 1 Total expenditure to 31st August, 1929 19,782 12 7 Included in that table is expenditure for the purpose of developing Canberra apart from the erection of the War Memorial. The officers, when they supplied me with that information as relating to expenditure on the War Memorial, knew that they were misleading me. presume that that expenditure would have been incurred in any case in the. development of Canberra. I tried to discover the facts, and on the last occasion when I asked the Minister for an explanation of the £19,782, representing the total expenditure to 31st August, 1929, he saidTlie following statement explains the parent discrepancy between the figures in my reply and those shown in the budget:Expended from Commonwealth funds to 31st August, 1929 .. .. Unexpended balance of amount advanced to and held by the Federal Capital Commission to meet expenditure on the, memorial, chargeable against Commonwealth funds .. .. Amount transferred from the Consolidated Revenue Fund to Trust Fund Australian War Memorial towards cost of erection .. .. 20,000 0 0 Total expenditure by the Commonwealth, as per budget statement .. 30,112 9 4",25
153,Mr MACKAY,IMPORTATION OF PEDIGREE,"The £3,605 must be held in cash.",26
154,Mr YATES,IMPORTATION OF PEDIGREE,"I presume that it would be; but this information is contrary to the first reply received by me. criticizing the late Government; I am not questioning the present method of managing the finances. I desire that he should not be ""sold a pup,"" as the late Treasurer was. If it is necessary for honourable members to examine elosely every item of public expenditure, - what state must the finances be in? There appears to be good reason for the complaints of members as to the manner in which their questions are answered. If any way can be found to continue the work of erecting the War Memorial, it will enable the unemployed in the Federal Capital Territory to be given a decent Christmas. Mr D. CAMERON (Brisbane) [2.22]. - I listened with particular interest to the Prime Minister this morning, and gladly accept his assurance that he and the members of his Government recognize that the building of the National War Memorial is a solemn and inescapable obligation of this Parliament. I also I appreciate his contention that his Government has not yet had sufficient time to ascertain the exact financial position of the Commonwealth in . regard to our various national obligations, but I share the fear of my leader that the Government's expressed intention not to continue the erection of the memorial during the present financial year will result in apthe indefinite, if not complete, postponequoted ment of the undertaking. I make, that statement with some experience of what £ s. d. has happened in regard to other war memorials. 6,506 18 0",26
155,Mr BLAKELEY,IMPORTATION OF PEDIGREE,"The honourable member sat behind a government that did nothing. Mr D. CAMERON - Surely , if there is one subject that we can discuss in this 3,605 10 10 House without introducing party politics, it is the proposal to erect a national memorial in honour of those who served and died in the late war.",26
