speakerGroups,Speaker,Title,text,pageNumbers
0,NA,Unknown,"House of Representatives. Friday, 89 November, 1989. '",10
1,Mr SPEAKER,Unknown,"Hon. Norman Makin) took the chair at 11.0 a.m., and read prayers. NA CONFERENCE.",10
2,Mr LATHAM,INDUSTRIA L PEAC E,Is the Prime Minister able to inform the House of the names of the organizations of employers and employees which arc likely to be represented at the resumed sittings of the Industrial Peace Conference?,10
3,Mr SCULLIN,INDUSTRIA L PEAC E,"The only step I have taken so far is to meet the management committee of the conference in Melbourne and invite it to call representatives of the various bodies together in order to discuss specifically industrial legislation and particularly the amendment of the Arbitration Act. I have received no communication from either employers or employees as to how they will be represented. RELIEF OF UNEMPLOYMENT. Mr E. RILEY - The Canberra Times of this morning reports that the Government is preparing a scheme for the expenditure of £1,000,000 to relieve unemployment throughout the Commonwealth. I ask the Prime Minister whether there is any truth in that statement.",10
4,Mr SCULLIN,INDUSTRIA L PEAC E,"I have requested the State Premiers to meet me as early as possible in order to discuss a scheme which, if agreed to, will enable the State Governments to proceed immediately with a considerable amount of work. Until I have discussed the matter with the State Premiers, I cannot make a statement on the subject to this House. EXPORT OF GOLD.",10
5,Dr EARLE PAGE,INDUSTRIA L PEAC E,Will the Treasurer be good enough to arrange for the reprinting of the speech made in the House of Commons on the 3rd October by the British Chancellor of the Exchequer regarding the export of gold! Honourable members will be convenienced if the Treasurer will have copies of the speech distributed.,10
6,Mr THEODORE,INDUSTRIA L PEAC E,I shall arrange for the speech to be reprinted. TARIFF SCHEDULE.,10
7,Mr FRANCIS,INDUSTRIA L PEAC E,On the 22nd November I asked the Minister for Trade and Customs if he would lay on the table of the House all reports of the Tariff Board which have a bearing on the new tariff schedule. The honourable gentleman undertook to place the majority of the reports on the table this week. I remind him that this is the last day on which he can redeem that promise.,10
8,Mr FENTON,INDUSTRIA L PEAC E,The honourable member is under a misapprehension.,10
9,Mr FRANCIS,INDUSTRIA L PEAC E,The Minister's promise is reported in Hansard.,10
10,Mr FENTON,INDUSTRIA L PEAC E,"Eithe r I misunderstood the honourable member's question or he misunderstood my reply. The honourable member for Richmond (Mr R. Green) asked if I would follow the customary practice of having prepared a memorandum setting .out the duties that were in operation prior to the change in the tariff schedule of August last, together with the duties imposed by the Validation Bill that was passed at the end of the last Parliament. I promised that such a memorandum would be prepared, together with all other information essential for the proper consideration of the schedule. The reports of the Tariff Board will be made available to honourable members as soon as practicable; some of them are still receiving consideration, and I do not know whether they can yet be released. I assure honourable members that when they are discussing the tariff schedule complete information will be available to them. JAPANESE CHERRY TREES.",10
11,Mr CHIFLEY,INDUSTRIA L PEAC E,Will the Prime Minister say whether further consideration has been given to the representations of fruit-growers against the admission of the cherry trees which have been offered to the Commonwealth by the Government of Japan for planting in Canberra?,10
12,Mr SCULLIN,INDUSTRIA L PEAC E,"Yesterday I directed a letter to the Consul-General for Japan asking him to thank his Government for its generous gift, and also for its consideration in offering to withhold that gift if likely to cause us any embarrassment. I assured him that the Commonwealth Government was satisfied with the assurances that had been given regarding the care that would be taken to ensure that the trees were healthy at the time of shipment, and also with the precautionary measures proposed by the Health Department, but that in view of the uneasiness of orehardists I would be obliged if the Government of Japan would withdraw the offer. NA COMMISSION. Mr M . CAMERON - Will the Prime Minister inform the House whether the Development and Migration Commission are continuing their investigations, or are, as redundant officers, merely awaiting the Government's decision as to their future ?",10
13,Mr SCULLIN,DEVELOPMENT AND MIGRATION,The members of the commission are still in office. The future of that body cannot be decided until a reply has been received by the Commonwealth Government to the cablegram sent to the British Government a few weeks ago. When that reply has been received the Commonwealth Government will confer with the State Governments and then determine the future of the commission. CARBIDE INDUSTRY.,11
14,Mr GUY,DEVELOPMENT AND MIGRATION,"Has the Minister for Trade and Customs received from the Tasmanian Government a communication stating that although the carbide works at Electron a are able to supply the whole of Australia's requirements of carbide, the industry is working only half time because of the competition of imports? Did such communication ask for further protection for the carbide industry. If so, will the Minister state when the decision of the Government is likely to be announced ?",11
15,Mr FENTON,DEVELOPMENT AND MIGRATION,"Communication s have been received in regard to the carbide industry in Tasmania, but obviously it is impossible for 'me to announce at this stage what tariff assistance the Government will propose. REMISSIONS OF DUTIES.",11
16,Mr GREGORY,DEVELOPMENT AND MIGRATION,"Some time ago I applied to the Minister for Trade and Customs for the remission of the duty imposed on an imported Raymond crusher required for the breaking up of phosphatic rock used in the manufacture of superphosphates. Its chief attribute was the exclusion of all dust from the factory, thus materially contributing to the health and comfort of the employees. My request was refused. I read, however, in the last weekly bulletin issued by the Trade and Customs Department, that the Minister has approved of the importation, duty free, of a steel tank 10 feet in diameter for the storage of beer, and also certain aluminium vessels for use in connection with Nathan's brewing process. In view of this I ask the Minister if he will review his previous decisions regarding the heavy duty on the Raymond crusher ? Does he not consider the manufacture of superphosphates as important as the brewing and storage of beer?",11
17,Mr FENTON,DEVELOPMENT AND MIGRATION,Inquiries will be made into this matter and if the question is put on the notice-paper a full reply will be furnished to the honourable member. NA STOCK.,11
18,Mr LACEY,IMPORTATION OF PEDIGREE,"The former Minister  in the course of a speech at the Melbourne Royal Show, to have made an announcement of great interest to the primary producers. The report states:Arrangements had been made by the Commonwealth Government to give generous assistance in connection with the cost entailed in the importation of pedigree stock from Great B r it a into improve Australia's flocks and herds. According to the Minister the details of this assistance to be given were that while the purchaser was to pay the cost of the animal the shipping companies would carry it free of freight. All other incidental expenses, such as the cost of stalls, water and fodder during the voyage from the port of export in Great Britain to the port of importation in Australia was to be borne in the following proportions:-One-thir d by the purchaser; one-third by the Empire Marketing Board; one-third in equal snares by the Commonwealth Government and the State Government concerned. Is the Minister for Markets prepared to extend similar assistance to persons desirous of importing draught stock? people in my electorate are very much interested in draught stock, the improvement of which is just as necessary to primary producers as is the improvement of flocks and herds.  make inquiries into this matter and let the honourable member have a reply later. DURATION OF SESSION.",11
19,Mr LATHAM,IMPORTATION OF PEDIGREE,"The Prime Minister would study the convenience of honourable members if he would announce the intentions of the Government regarding the duration of the present session, and the date upon which our sittings are likely to be resumed in the New Year.",12
20,Mr SCULLIN,IMPORTATION OF PEDIGREE,"I can understand the desire of honourable members to have that information so that they may be able to make their private arrangements accordingly. The Government hopes that this portion of the session will terminate about the 13th December, but that must depend on the assistance which honourable members lend in the transaction of business. It will be necessary to pass the Commonwealth Bank Bill ; a Loan Bill ; an Income Tax Bill ; Estimates. The Government believes that if reasonable despatch is shown that programme can be disposed of in sufficient time to enable honourable members to reach their homes for Christmas.",12
21,Mr LATHAM,IMPORTATION OF PEDIGREE,- I thought the Prime Minister believed in a full discussion of the Estimates?,12
22,Mr SCULLIN,IMPORTATION OF PEDIGREE,"I do. The programme I have indicated will allow ample time for the discussion of the Estimates; indeed honourable members will have opportunities in that regard such as have been denied to them in past years. The Government hopes to call Parliament together again early in March. NEW POLITICAL PARTY. Mr E. RILEY - The Canberra Times this morning makes the very important announcement that the right honourable member for North Sydney (Mr Hughes) is about to form a new party. I ask the right honourable gentleman whether he has madp any arrangements for the absorption by that party of the Country party; and, if The so, upon what conditions he is prepared to admit to it the right honourable member for Cowper (Dr Earle Page.)",12
23,Mr SPEAKER,IMPORTATION OF PEDIGREE,"Hon. Norman Makin). - Order ! Questions cannot be addressed to private members unless they relate to a bill, motion, or other public matter connected with the business on the notice-paper of which he may have charge. Mr E. RILEY - In the event of this new party being formed, Mr Speaker, what arrangements are you likely to make to provide the necessary room when it absorbs the Country party?",12
24,Mr SPEAKER,IMPORTATION OF PEDIGREE,"I shall await developments, and when the necessity arises, make whatever provision may be necessary. NEW TARIF F SCHEDULE. POSITIO N OF TABIFF BOARD.",12
25,Mr GULLETT,IMPORTATION OF PEDIGREE,"In view of the fact that, in the preparation of the tariff schedule which has been tabled in this House, the Government has apparently, to a major extent, acted independently of the Tariff Board, will the Prime Minister consider whether that board is not now reand the dundant and unnecessary, and whether in the interests of the taxpayers it ought not therefore to be abolished?",12
26,Mr SCULLIN,IMPORTATION OF PEDIGREE,I am interested to hear the suggestion of the late Minister for Trade and Customs that we might consider the Tariff Board redundant and unnecessary.,12
27,Mr GULLETT,IMPORTATION OF PEDIGREE,The Government has made it redundant.,12
28,Mr SCULLIN,IMPORTATION OF PEDIGREE,"I have not yet arrived at that conclusion, although the honourable gentleman's suggestion may lead my thoughts in that direction. Fur ther, I am not aware that the major portion of the tariff schedule introduced by the Minister for Trade and Customs (Mr. Fenton) has been prepared without regard to the views of the Tariff Board.",12
29,Mr GULLETT,IMPORTATION OF PEDIGREE,"Inasmuc h as the Tariff Board is now inquiring into applications for increased duties on rice and prunes, and that, in anticipation of its reports upon those matters, the Government has made provision for an increased duty in each case, will the Minister for Trade and Customs withdraw those inquiries from the Tariff Board in the interest of hoth economy and common sense ?",12
30,Mr FENTON,IMPORTATION OF PEDIGREE,There is on the notice-paper a question that is almost identical with that which the honourable member has raised. If he will await my reply to it he may get the information he desires.,13
31,Mr HAWKEB,IMPORTATION OF PEDIGREE,Arisin g out of the reply given by the Prime Minister to the honourable member for Henty (Mr. Gullett) that he was not aware that the Tariff Board had been ignored,13
32,Mr SPEAKER,IMPORTATION OF PEDIGREE,Order ! It is distinctly out of order for an honourable ber to base a question upon an answer given to a previous question.,13
33,Mr WATKINS,IMPORTATION OF PEDIGREE,"Seeing that there is on the notice-paper a question calling for all available information in relation to reports of the Tariff Board,* these questions without notice are out of order.",13
34,Mr SPEAKER,IMPORTATION OF PEDIGREE,"That is a matter for me to determine; and until the question that the honourable member for Wakefield (Mr Hawker) wishes to ask, has been heard, neither I nor any honourable member is in a position to determine whether it is in order or not.",13
35,Mr HAWKER,IMPORTATION OF PEDIGREE,Is the - Minister for Trade and Customs in a postion to state whether the new tariff schedule was introduced in accordance with the recommendations of the Tariff Board?,13
36,Mr SPEAKER,IMPORTATION OF PEDIGREE,"The question anticipates one in the notice-paper, and therefore cannot be asked. TIMBER FREIGHTS.",13
37,Mr GREGORY,IMPORTATION OF PEDIGREE,"In view of the position complaint made last night by the tion early next week. honourable member for Bass (Mr. Guy) in regard to the timber industry, will the Minister for Markets and Transport have inquiries made and information supplied to this House respecting the cost per hundred super feet of conveying timber from therein Launceston to Adelaide and from thp inquiry and report? Baltic ports to Adelaide?  have inquiries made, and at a later date supply the honourable member with the these information I obtain. [21] TARIF FA ND MIGRATION. VIEWS OF BRITISH GOVERNMENT.",13
38,Mr ARCHDALE PARKHILL,IMPORTATION OF PEDIGREE,"I D view of the cabled statement that the British Government is greatly concerned regarding the policy of the Commonwealth Government in relation to the tariff and migration, will the Prime Minister disclose whatever communications he has received on the subject from thai Government ?",13
39,Mr SCULLIN,IMPORTATION OF PEDIGREE,I have received no communications on that subject from the British Government. mem- AUSTRALIAN DISTILLED SPIRIT. WITHDRAWALS FROM BOND.,13
40,Mr HAWKER,IMPORTATION OF PEDIGREE,"the Minister for Trade and Customs, upon notice What was the quantity removed from bond, during the last financial year, of the following Australian distilled spirit:1. Brandy bottled under customs or excise supervision; , 2. Brandy not bottled under customs or excise supervision; 3. Whisky bottled under customs or excise supervision; and 4. Whisky not bottled under customs or excise supervision ?",13
41,Mr FENTON,IMPORTATION OF PEDIGREE,"The information is not available. BOUNTIES, BONUSES, SUBSIDIES.",13
42,Mr GREGORY,IMPORTATION OF PEDIGREE,"the Treasurer. upon notice What has been the amount paid by the Commonwealth in bounties, bonuses, subsidies, or assistance to industries, primary and secondary, in each State, during the past seven years, enumerating the special industry and the financial assistance afforded in each case?",13
43,Mr THEODORE,IMPORTATION OF PEDIGREE,I hope to be in a to furnish the desired informaNEW TARIF F SCHEDULE.,13
44,Mr FRANCIS,IMPORTATION OF PEDIGREE,"the Minister for Trade and Customs, upon notice I. What items in the new tariff schedule recently tabled in the House were included after reference to the Tariff Board for 2. What items, if any, have been included in the new tariff schedule, on which the Tariff",13
45,Mr FENTON,IMPORTATION OF PEDIGREE,F u l l in for m at i o n on p o in ts will be f u r n is h e d when the t a r if f schedule is being discussed. COAL COMMISSION.,13
46,Mr THOMPSON,IMPORTATION OF PEDIGREE,"the Prime Minister, upon notice-^ 1. How long has the Coal Commission been sitting ? 2. What is the total cost of the commission to date? 3. How has the cost been allocated amongst the various members, including the payments to each? 4. When is it expected that the commission will complete its work?",14
47,Mr SCULLIN,IMPORTATION OF PEDIGREE,The answers to the honourable member's questions are as follow :1. Approximately six months. 2 and 3. The information is being obtained. 4. The report of the commission is to be furnished on or before the 31st December next. POSTAL DEPARTMENT. ECONOMY COMMITTEES.,14
48,Mr LYONS,IMPORTATION OF PEDIGREE,"On the 22nd November, 1929, the honourable member for E as t Sydney (Mr We s t ) addressed to me the following questions:1. Is it a fact that a number of what are known as economy committees have for some time been in operation in the Postmaster General's Department? 2. Is it a fact that in some cases the bers of the economy committees are junior officers, who report on officers senior to themCooper's selves ? 3. If so, what are the functions of these committees, and what amounts have been paid to them since their inception in salaries, travelling expenses, and living allowances? I am now in a p o s it i o n to give the honourable member the following in f t i o n :1. A number of committees have been gaged for some time overhauling the adminispended tration of various sections of the department's activities. 2. The members of the committees, who are not required to report on officers, are not always of high rank. They were selected because their special knowledge, experience, and fitness to undertake these duties. 3. The function of the committees is to detailed investigations into the character of the duties performed and the procedure which is being adopted, and to assist in bringing about the highest degree of efficiency attainable in the conduct of the department's services. The investigations of the various committees ing out the function referred to have undertaken over a period of years, special mittees being formed to deal with different phases of departmental business in particular localities, and they have ceased to operate conclusion of their tasks. Particulars of salaries, & c , paid to members of the several committees are being compiled, and will be furnished to the honourable member as soon as available. ROYAL AUSTRALIAN NAVY. PAT. Mr A. GEEEN - On the 27th November the honourable member for Corangamite (Mr Crouch) asked the following questions:With reference to his answer yesterday to a question by the honourable member for Corangamite concerning training in the Australian Navy, what number of men receive petty officers' pay amongst the 717 referred to in paragraph 2 (6 ) ? I am now in a position to inform the honourable member thatOf the 717 petty officers and men who received their first training elsewhere than in Australia, 388 were in receipt of petty officers' pay, namely, chief petty officers 183, petty officers 205. BRISBANE ALB POET.",14
49,Mr A GREEN,IMPORTATION OF PEDIGREE,"On the 27th November the honourable member for Moreton (Mr Francis) asked the following questions :1. Whether provision is made in the Estimemmates for the present financial year for the * construction of an air port for Brisbane, near Plains,; and, if so, what is the amount? 2. When will the work be actively under* taken, and when is it anticipated that this new air port w i ll be available for use? I am now in a p o s it i o n to in for m the honourable member that 1. A new aerodrome is to be established by o r m a - the Commonwealth at Archerfield, Cooper's Plains, Brisbane. To meet the cost of initial preparation of this aerodrome site an amount enof £11,500 has been reserved out of the unexbalance of the trust fund, civil aviation trust account, the funds for which were appropriated in the financial year 1927-28. 2. The work in connection with the preparation of the first portion of the site has been of approved, and is being taken in hand at once. The provision for other services is under consideration. It cannot be stated at present make when this aerodrome will be ready for use. CANBERRA-GOULBURN ROAD.",14
50,Mr LYONS,IMPORTATION OF PEDIGREE,"Yesterday the right carryhonorable member for Cowper (Dr been Earle Page) sought information respectcoming the anticipated date of the completion of the Federal highway from on Canberra to Goulburn. When the work was commenced it was anticipated that it would be completed by the 30th October, 1930. The officers of the Works Department have assured me that that is still the date upon which it is anticipated the work will be completed. PAPERS. The following papers were presented:Railways Act-Repor t on Commonwealth Railways Operations, for year ended SOth June, 1929. Seat of Government (Administration) Act - Fift h Annual Report of the Federal Capital Commission for year ended 30th June, 1929. Ordered to be printed. ESTIMATES (No. 2) 1929-30. ADDITIONS, NEW WORKS, BUILDINGS, &O. In Committee of Supply: (Consideration resumed from the 22nd November (vide page 213). DEPARTMENT OF HO ME AFFAIRS. Proposed vote-£33,000 .",14
51,Mr CURTIN,IMPORTATION OF PEDIGREE,"Fremantle) [11.30] When the War Memorial at Canberra was previously the subject of the committee's consideration, it was stated that the sum of £20,000 had been placed in a trust fund in the previous year for carrying on the work. Therefore, if £30,000 in addition is now to be made available, there will be a total amount of £50,000 to be expended during the current financial year. We have been told, however, that it is not practicable to expend the whole of that sum in the current year. I suggest that if the £20,000 that was placed in a trust is available, it may be sufficient for the requirements of the coming year, and that, therefore, it is unnecessary to vote another £30,000 now. I ask the Minister for Home Affairs (Mr. Blakeley) whether it is a fact that there is £20,000 in a trust fund, definitely earmarked for this purpose, and, if so, whether he does not regard that sum as sufficient for expenditure on the memorial this year? If he considers that another £30,000 should be voted on the Estimates for this year, will he tell us whether it is proposed to add that £30,000 to the £20,000 now in the trust fund. can see that it is possible that if we pass this item a considerable portion of the money voted cannot be expended, on the voices. and, in that case, the trust fund would be built up unnecessarily. The money we vote for current expenditure should be expended in the year in which it is voted. I think that that was the intention of Parliament in connection with the previous year's vote. Will the Minister say whether the £20,000 that it is said was put into a trust fund is there in cash?",15
52,Mr ARCHDALE PARKHILL,IMPORTATION OF PEDIGREE,"Warringah) [11.33] - When this debate was adjourned last Friday I asked you, Mr. Chairman, if I could resume the discussion when the Estimates were next before us, and you informed me that I could. I should like to know, therefore, why you did not call me first this morning?",15
53,The CHAIRMAN,IMPORTATION OF PEDIGREE,"Mr MCGRATH) In committee there is no adjournment of a debate, and no honourable member can be given the right to continue a speech on the resumption of a committee's consideration, though sometimes the chairman notices first the honourable member who has expressed his desire to continue the discussion which was going on when progress was reported.",15
54,Mr ARCHDALE PARKHILL,IMPORTATION OF PEDIGREE,"I have risen to emphasize the points taken by the honourable member for Fremantle (Mr Curtin). I understood the Minister to say in an earlier speech that the Government intended to proceed with the construction of the War Memorial. It seems that it is not now intended to go on with it, although the Government has £20,000 in hand in a trust fund, in addition to some surplus under a vote already authorized. It appears to me that it is unnecessary to place the present item on the Estimates. Clearly, as remarked by the honourable member for Fremantle, the Government cannot expend £50,000 on this work in the present financial year. I desire to know whether it intends to continue the present trust fund, and whether the money now available is not sufficient for the work for this year. In the brief time during which I have been in this House, we have twice discussed the matter of the memorial, and on two occasions, hy overwhelming majorities, it was I decided that the work should proceed.",15
55,Mr GULLETT,IMPORTATION OF PEDIGREE,"That was determined,",15
