speakerGroups,Speaker,Title,text,pageNumbers
0,NA,Unknown,"House of Representatives. honourable Friday, IS July, 1930.",11
1,Mr SPEAKER,Unknown,"Hon. Norman Makin) other took the chair at 10 a.m., and offered good? prayers. SITUATION IN EGYPT.",11
2,Mr GULLETT,Unknown,"Has the right honas I think it should be presented. orable the Prime Minister any informashall tion to give to the House concerning the disquieting news which appears, morning's newspapers about the situation in Egypt?",11
3,Mr SCULLIN,Unknown,I have no information on the subject at the moment; but I am having inquiries made. BUDGET PROPOSALS.,11
4,Mr CEOUOH,Unknown,"Has the right honourable the Prime Minister seen the report Western Australia? of a so-called non-party meeting which was convened by the Lord Mayor of Melsent bourne on Wednesday last, and at which Nationalist representatives alone were present. Is it a fact that two of speakers were defeated Nationalists who formerly were members of this House? Has .not the present Lord Mayor' of MelAustralia bourne been in office for nearly three 1154] years, but did he during the three years when a Nationalist Government waa in power call any meeting to protest against the gross extravagance of that Government which makes the present budget necessary? Question not answered. TAXATIO N OF NECESSARIES.",11
5,Mr ARCHDALE PARKHILL,Unknown,"1 direct the attention of the right honourable the Prime Minister to the statement appearing in the Canberra Times and various other newspapers, including the Lobor Daily",11
6,Mr SPEAKER,Unknown,Does the honourable member for Warringah intend to ask a question ?,11
7,Mr ARCHDALE PARKHILL,Unknown,"  Snowden, Chancellor of the Exchequer, was to the effect that he could not point, in regard to the safeguarding of Australian industries, to any marked effect which the duties have had in improving the position of trade. Will the right the Prime Minister, when he attends the Imperial Conference, endeavour to persuade Mr Snowden that the taxation of the people's food and necessaries is done for their materia]",11
8,Mr SCULLIN,Unknown,"When abroad I shall present the Australian opinion as truthfully and vigorously as I can, and I not be side-tracked by any one. I shall put the Australian policy clearly, in this declaring exactly what it is. NA IN WESTERN AUSTRALIA.",11
9,Mr CURTIN,RELAY BROADCASTING STATION,"I ask the Postmaster General what steps, if any, have been taken with respect to the representations made some time ago to establish an additional relay broadcasting station iD",11
10,Mr LYONS,RELAY BROADCASTING STATION,"The matter is at prereceiving the serious consideration of the department, and while it has not been finalized, I can assure the honourable the member that one of the relay broadcasting stations at present on order will be erected on a suitable site in Western with the object of improving, the service generally in that State. PRIMAGE DUTIES.",11
11,Mr NAIRN,RELAY BROADCASTING STATION,"1 8 primage duties are to be levied on goods in bond if imported prior to the 10th July; and is it intended to discriminate between goods previously dutiable and those previously duty free, by charging primage duty on goods in the bonded warehouses while exempting goods previously on the free list received in warehouses prior to the 10th July?",12
12,Mr FENTON,RELAY BROADCASTING STATION,"I shall make inquiries into the matter, and supply the honourable member with the information be requires. NA SYSTEMMr MoGRATH - I ask the Minister for Defence if he has read a statement in the press to the effect that the Government of New Zealand has followed the example set by the Labour Government in Australia in abolishing compulsory military training, and if so, will he congratulate the New Zealand Government on its humane action?",12
13,Mr A GREEN,VOLUNTARY RECRUITING,"I have noticed the statement, and I cannot help feeling a certain amount of satisfaction in regard to it, inasmuch as it justifies the decision reached by this Government. It entirely refutes the alarmist declarations of some honourable members and other persons in various parts of the Commonwealth to the effect that we are leaving this country open to the risk of invasion. The New Zealand Government undoubtedly recognizes that this is a time when expenditure should be curtailed in view of the general economic-position.",12
14,Mr WHITE,VOLUNTARY RECRUITING,You naturally pat each other on the back.,12
15,Mr A GREEN,VOLUNTARY RECRUITING,"The honourable member^ for Balaclava (Mr White), because he is permitted to strut about on Saturday afternoons with a sword, should - not interrupt.",12
16,Mr GULLETT,VOLUNTARY RECRUITING,I rise to a point of order. Is the Minister in.order in referring to an officer in the voluntary forces as otic who struts about on Saturday nnnns with a sword ? That expression is grossly offensive and I ask that it be drawn.,12
17,Mr SPEAKER,VOLUNTARY RECRUITING,"I do not regard a it a fact that general remark of that nature as offensive, but if it is so regarded by the honourable member to whom it was directed, I ask that it be withdrawn.",12
18,Mr WHITE,VOLUNTARY RECRUITING,"We all know the Minister, and I treat the remark with indifference. TARIFF BOARD'S REPORTS.",12
19,Mr GREGORY,VOLUNTARY RECRUITING,"I ask the Minister for Customs if the Tariff Board's report on the timber industry has yet been printed, and, if so, when is it. likely to be made available?",12
20,Mr FENTON,VOLUNTARY RECRUITING,At present the Government Printing Office is so overwhelmed with work that there is little likelihood of the report being available within two or three weeks.,12
21,Mr AKCHOAMS PAKKHILL,VOLUNTARY RECRUITING,Why not give the work to outside printers?,12
22,Mr FENTON,VOLUNTARY RECRUITING,"The printing of the report could be further expedited only by the employees in that department working overtime, but this would mean unnecessary expense. The work is being expedited as much as possible, and I assure honourable members that the reports will be made available as early as possible. EXPENDITURE AT CANBERRA.",12
23,Mr CROUCH,VOLUNTARY RECRUITING,"At the "" non-party "" meeting called by the Lord Mayor of Melbourne on Wednesday .last, it was stated that £3,000 had been spent in planting tulips in front of Parliament House, Canberra. I ask the right honourable the Prime Minister if such expenditure has been incurred while the present Government has been in office?",12
24,Mr SCULLIN,VOLUNTARY RECRUITING,I regard that statement as a gross exaggeration. No such expenditure has been incurred by this Government. NA PARLIAMENTARY ALLOWANCE. PERSONAL EXPLANATION .,12
25,Mr THOMPSON,REDUCTION OF,"I desire to make a personal explanation. An article apaf terpears in yesterday's Labor Daily nn the snhiect of the reduction of with- the parliamentary allowance of Ministers and members suggested in a motion of which notice has been given by the Leader of the Opposition. In the article, my name appears amongst a number of others who are referred to as wealthy capitalists who are sponsortug this proposal. Without expressing tny views upon the subject, I desire to - state that I was not in any way associated with the motion of which the Leader of the Opposition gave notice; I knew nothing about it until notice was given. The paragraph to which I draw attention also states that I own a very big country newspaper, and that that places me in the category of the wealthy members of this House. ' I do not own a country newspaper, and I am not in the category referred to. DUTY ON GLASS. air. ARCHDALE PARKHILL - I tsk the Assistant Minister for Customs tf, in view of the important representations made to him yesterday by a deputation with respect to the taxation on glass, be is yet prepared to make a statement on the subject, and if not, will he expedite inquiries, and supply an answer to the points raised by the deputation?",12
26,Mr FORDE,REDUCTION OF,The representations made to me by a deputation yesterday will receive the same sympathetic consideration as all deputations which wait 'ipon me or any other Minister receive. BROADCASTING INQUIRY.,13
27,Mr HAWKER,REDUCTION OF,"Has the Prime Minister seen a report of the inquiry which is being conducted into matters arising out of the claims made by the Wireless Broadcasting Companies in which the Commissioner states thatHe did not think that any further evidence ,-ould be given to alter his state of mind about *U the members of the committee with the exception of Green and Coleman. Supposing tny suggestion were entertained that they were guilty of impropriety in the way of accepting bribes or being approached with bribes, he would say that they had disproved this completely so far as they wore concerned. oosition regarding Green and Coleman was difficult. Will the right honourable gentleman as<ure the House that he will facilitate the return of Mr COLEMAN - if he wishes to return immediately-to give evidence before the Royal Commissioner in order fo clear up a difficult situation?",13
28,Mr SCULLIN,REDUCTION OF,I deprecate the asking of such questions before the Commissioner has made his report. It is unworthy of the honourable member to cast aspersions or to throw suspicions on any one while the matter is sub judice.,13
29,Mr ARCHDALE PARKHILL,REDUCTION OF,The honourable member for Wakefield (Mr. Hawker) merely quoted the commissioner's words.,13
30,Mr SCULLIN,REDUCTION OF,"Bu the did not read them all. The newspaper report continues The commissioner said that nothing had been proved against Mr Coleman. His bank accounts are consistent with his complete innocence . and inconsistent with his guilt. Neither a positive nor a negative proposition had been established. There is no need for me to facilitate the return of the honourable member for Reid (Mr Coleman). The conduct of his case is in his hands, or in those of his legal representatives; it is not in the hands ,of the Government.* NON-COMMISSIONED OFFICERS NA FORCES.",13
31,Dr MALONEY,OF THE AUSTRALIA NIMPERI AL,"through Mr C. RILEY ) asked the Minister for Defence, upon notice.1. Is it a fact that sergeants and sergeantsmajor of the Permanent Forces who went te the war, and on the battlefield, through gallant conduct, were appointed to rank as high as that of major, on their return to Australia were compelled to revert to the rank of sergeant or sergeant-major, and had no chance of further promotion? 2. Can a man entering the ranks, and rising to the rank of sergeant-major, gain commissioned rank? 3. If not, will the Minister bring in an amending bill to allow Australian men who enter the ranks to have the opportunity of rising to the highest position?",13
32,Mr A GREEN,OF THE AUSTRALIA NIMPERI AL,"The replies to the honourable member's questions are as follow :1. In accordance with the Defence Act an The expeditionary force, altliough a regular or permanent force for the time being, is an entirely separate force to the existing Defence Force, and rank gained therein does not confer similar rank in the Australian Permanent Forces. Warrant and non-commissioned officers of the Permanent Militar y Forces who served as members of the Australian Imperial Force would normally, on their return to duty in the Permanent Military Forces, have resumed the ranks they previously held. As part of a scheme for recognition of distinction gained in the great war, approval was given in 1919 for the appointments as quartermasters with honorary commissions in the Australian Military Forces of a number of those warrant and non-commissioned officers of the Permanent Military Forces who had been granted commissioned rank on active service. Those who held rank in the Australian Imperial Forces as lieutenant-colonel, major, or quartermaster and honorary major were granted the honorary rank of major, and those who held the Australian Imperial Force rank as captain were granted the honorary rank of captain. The remainder of those who had held commissioned rank in the Australian Imperial Force were offered cither continuance of their employment as warrant officers or appointment to that rank with the rank of honorary lieutenant, being graded as warrant officers holding commissions. 2. Yes, in accordance with the second and fourth provisos of section 148 of the Defence Act. 3. See reply to 2. It is not proposed to bring in an amending bill to alter the provisions of the above quoted section of the Defence Act. HMAS. AUSTRALIAAND JJ.M.A.S. CANBERRA. Mr C. RILEY asked the Minister for Defence, upon notice I. What is the estimated cost of all alterations and additions to HMAS. A.ustralia and HMAS. Canberra, as recommended by the Admiralty and ships' officers? 2. What is the cost of alterations tions on these two vessels-(o ) actually carried out, and (6) approved but not yet carried out?",13
33,Mr A GREEN,OF THE AUSTRALIA NIMPERI AL,"The information is being obtained, and a reply will be f u r nished to the honourable member as possible. MOBILIZATION OF AUSTRALIAN paragraph FUNDS IN LONDON.  the Treasurer, upon notice I. Is it a fact that a conference was recently held in Melbourne over which Sir Robert sion, Gibson, chairman of the Commonwealth board of directors, presided, and that one of the objects of the conference was to formulate a scheme for the purpose of mobilizing London funds coming into the hands of the banks which through exports and other channels, so as to provide that in the immediate future the requirements of the Government of Australia respect of interest and overdrafts would be low :met ns the first obligation from the funds available in the hands of the various banks in London? 2. Will he make a statement to the House, giving information as to the power it possesses and the effects of interfering with the Austhe tralian business people in London by transcontrol ferring their credits as proposed?",14
34,Mr SCULLIN,OF THE AUSTRALIA NIMPERI AL,"The replies to the honourable member's questions are as follow:1. Yes. 2. I propose next week to discuss the scheme with representatives of the banks. If the scheme is adopted, the House will be duly informed. PARLIAMENT HOUSE ROOF.",14
35,Dr MALONEY,OF THE AUSTRALIA NIMPERI AL,"through Mr C. RILEY) asked the Minister for Home Affairs, upon notice I. Were there any leakages in the roof of Parliament House and the buildings attached after the placing of SO tons of gravel on the roof, up to the time that the Department of Works commenced making repairs? 2. If so, in what rooms were the leakages, and how many separate leakages were there? 3. On the parts of the roof repaired by the Department of Works, have there since been any further leakages?",14
36,Mr BLAKELEY,OF THE AUSTRALIA NIMPERI AL,"The replies to the honourable member's questions are as follow :1. Yes. 2. Ministerial party room lobby, House of Representatives; ministerial party room lobby, Senate; President's room, Senate; library; room adjacent to King's Hall, formerly whips' and addiroom; sundry leaks over kitchen. 3. No. SUPPLY OF CURRENCY.  as soon the Treasurer, upon notice I. Has his attention been drawn to a press by a professor of Trinity College, Cambridge, with reference to our present financial disabilities, in which the writer conafter consideration, that what is causing trade depression is an underlying influence much deeper and stronger than any other cause already mentioned during the present depresand that cause is believed to be an insuffiBank ciency of currency? 2. Will he take the essential steps to bring about an elastic currency, the fluctuation of will be regulated by business conditions?",14
37,Mr SCULLIN,OF THE AUSTRALIA NIMPERI AL,"The replies to the in honourable member's questions are as f o l1. No. 2. The note circulation in Australia is already elastic, and varies in accordance with seasonal requirements. As regards the future, policy of the Government in relation to the of the notes circulation is set out in the Central Reserve Bank Bill. SALES TAX EXEMPTIONS.  upon notice Whether the exemption from sales tax of milk, butter and condensed milk is intended to include milk powder, casein, concentrated milk, table cream and other milk products?",14
38,Mr SCULLIN,OF THE AUSTRALIA NIMPERI AL,Yes . CHAIN STORES SYSTEM.,15
39,Mr CROUCH,OF THE AUSTRALIA NIMPERI AL,"the Treasurer, upon notice I. In view of the disastrous consequences to country shopkeepers of the system of chain stores, will he consider the advisability of taxing each additional store, at a progressively double rate? 2. Can he estimate the revenue obtainable from such taxation? 3. Would such taxation lead to decentralisation and larger local control of business?",15
40,Mr SCULLIN,OF THE AUSTRALIA NIMPERI AL,The information is being obtained and will be furnished as soon as possible. WAR BORROWING.,15
41,Mr YATES,OF THE AUSTRALIA NIMPERI AL,"the Treasurer, upon notice I. What was the total amount borrowed for war purposes, including war gratuity, repatriation, and the amount funded with the British Government ? 2. What is the total amount of interest paid to date? 3. What is the total amount at present owing, and the yearly amount of interest on such amount?",15
42,Mr SCULLIN,OF THE AUSTRALIA NIMPERI AL,The information is being obtained and will be furnished as soon as possible. NA DECISIONS.,15
43,Mr CROUCH,NAVAL CONFERENCE,"the Minister for Trade and Customs, upon notice I. At the recent Naval Conference what reductions were agreed upon (a) in Australian ships; (6) in English ships; and (c)in shipB of other Dominions respectively, giving in each case their number, class and tonnage? 2. Were the Australian reductions regarded by the conference separately, or were they grouped under the heading of Great Britain? 3. Was any agreement made in the reduction of Australian ships by Great Britain as to co-ordination or protection of Australian coasts and trade? 4. Are the Australian Bhips to be sunk, sold, put out of commission or how otherwise disposed of? 5. Are any to be handed to Great Britain OT used by that country on any naval station; if so, on what station?",15
44,Mr FENTON,NAVAL CONFERENCE,"It is desired that the honourable member will please await the presentation of my report on the Conference. I anticipate that the report will be submitted within a few days. LEAGUE OF NATIONS ASSEMBLY. AUSTRALIAN DELEGATION. Mr D. CAMERON (through Mr. MACKAY ) asked the Prime Minister, upon notice Whether he can inform the House of the personnel of the Australian Delegation to the forthcoming League of Nations Assembly at Geneva ?",15
45,Mr SCULLIN,NAVAL CONFERENCE,"The delegation will be the Honourable Frank Brennan, M.P.,  Robert Garran, KC.M.G., M.A.; Miss M . A. Holman, M.L.A.; and, if circumstances permit, I shall attend the Assembly for a few days on my way to the Imperial Conference. NA OFFICE. PURCHASING POWER OF WAGES.",15
46,Mr CROUCH,INTERNATIONAL LABOUR,"the Prime Minister, upon notice I. Has the Government received any request .for information from the International Labour Ofiice of the League of Nations organization as to the relative international purchasing power of wages? 2. Has he received any reports or other communications from the officials of this office, and, if so, are they available for inspection by honourable members?",15
47,Mr SCULLIN,INTERNATIONAL LABOUR,"The replies to the honourable member's questions are. as follow:1. No. The International Labour Office receives all the relevant publications of the Commonwealth Bureau of Census and Statistics, some of wheh contain information in relation to the purchasing power of wages in Australia. 2. The Commonwealth Government regularly receives the reports and other publications of the International Labour Office. Copies of these are distributed to inter alia the Commonwealth Parliamentary Library where they are available for honourable members. Communications are received from the International Labour Office, which are dealt witli in the usual way of correspondence. It is not the practice to make such correspondence generally available, but if honourable members are interested in any particular subject no objection would be raised to their inspecting the official files in connection therewith. NA",15
48,Mr SCULLIN,STABILIZATION OE INTEREST,"On the 11th July the honourable member for Melbourne (Dr Maloney) asked the following questions, upon notice I. Is it a fact that during the war the Commonwealth Bank stabilized interest at 6 per cent.? 2. Is it a fact that unemployment, w i attendant misery, is today more acute throughout Australia than during the war years of 1914-18? 3. Is is a fact that the banks can call up their overdrafts at a day's notice? 4. Under these circumstances, w i ll he request the Commonwealth Bank to stabilize interest on advances at G per cent.? 5. Will the Minister ask cabinet the granting of a moratorium, or the passing of a resolution, that banks should give three months' notice for the calling up of overdrafts, or a period of time equal to half the period the overdraft had existed? I am now able to answer the honourable member's questions as follow:1. The Commonwealth Bank advises that its overdraft rate during the war remained at 6 per cent., this rate being based on the fixed deposit rates then paid. 2. Yes. 3. Yes. 4. The Commonwealth Bank advises that it is not possible to stabilize interest on advances at 6 per cent, as the rates for advances must always have relation to the rates which have to be paid for deposits. 5. It does not seem practicable to provide for the notice referred to. NA EXPENDITURE .",16
49,Mr SCULLIN,COMMONWEALTH,"On the 8th July the honourable member for Perth (Mr. Nairn) asked the following questions, upon notice What is the cost to the Commonwealth, since 1900, under t l i c following heads:(a) Governor General ? (6) Federal Parliament? (c) Commonwealth Public Service? I am now able to answer the honourable member's questions as follow:(a) £720,142. This expenditure includes salary of the Governor General, maintenance of Government houses (rent, repairs, fittings, furniture, lighting, upkeep of grounds, &c.), railway services and official expenses of the Governor General's office. (6) Federal Parliament £8,002,723. expenditure includes parliamentary allowances, cost of elections, cost of referenda, and all other services associated with the Parliament. (c) It would be necessary to make a complete analysis of Commonwealth expenditure in all departments for the last 29 years in order to furnish the information desired. In RATES. view of the heavy work and cost involved, it is regretted that the preparation of such a return cannot be undertaken. GREAT WAR. CHARGES BY BRITISH GOVERNMENT.",16
50,Mr SCULLIN,COMMONWEALTH,"On the 8th July,.the honourable member for Corangamite (Mr. t h its Crouch) asked the following questions, upon notice I. Whether it is correctly stated in the Australian Financial Statistics Bulletin, Ko. 20, page 22, that the total cost to Australia of the 1914-1919 war, to 30th June last, was £713,997,704? 2. Will he state what was the cost of the to consider war to Canada to the same date? 3. Did the English Government charge the Commonwealth £43,398,098 for payments made, services rendered and goods supplied for the war? 4. Did it charge the Canadian Government any, and, if so, what amount for similar services? I a m now able to s up p l y the honourable member with the following in for m a tion : 1. The correct amount is £713,977,704. ThiB amount includes all loan expenditure on war and repatriation services, and all expenditure from the Consolidated Revenue Fund to the 30th June, 1929, in respect of interest and sinking fund .on war loans, war pensions, repatriation services, &c. 2. Particulars of the cost of the war to Canada to the same date arc not published in any available Canadian documents, nor are the war interest charges distinguished from other debt charges in the Canadian budget papers. 3. Yes. This amount was included in the indebtedness funded in 1921 under the Funding Arrangements Act. 4. It is understood that the British Government charged the Canadian Government for all similar services. During the war Canada made payments in Canada on behalf of the British Government. At the close of the war, the payments made by each Government on behalf of the other were set off against one another, and a settlement was effected in respect of the balance. The amounts involved are not available. HOUR OF MEETING. Motion (Mr Scullin) agreed toThat the House, at its rising, adjourn until Monday next at 3 p.m. This SUPERANNUATION BILL. Message reported recommending appropriation for the purposes of amendments to be moved by the Assistant Minister, the Honourable J. A. Beasley, in this bill. In committee (Consideration of Deputy Governor General's message). Motion (by Mr BEASLEY) agreed toThat it is expedient that an appropriation be made. of revenue be made for the purposes of ments to be moved by the Assistant Minister, the Honourable J. A. Beasley, in a bill for an act to amend the Superannuation Act 1922-24. Resolution reported and-by leave adopted. In committee (Consideration resumed do so. from 3rd July, vide page 3687). Clause 2 agreed to. Clause 3Section four of the Principal Act is amended(a) by inserting, after the definition "" Actuary"", the following definiof tion:-""'Children ' includes ted children; "";",16
