speakerGroups,Speaker,Title,text,pageNumbers
257,Mr BRENNAN,PENSIONS INSURANC EBILL,"I disagree with the Acting Minister. On previous occasions when motions have been moved for the postponement of clauses of this bill, the Treasurer has not complained .about the waste of time involved, but has invariably addressed himself to the reasons advanced in favour of postponement. This motion "" That the clause be postponed "" was moved in precisely the same spirit as previous motions of the same description, and in conformity with many excellent precedents. The honourable member for Swan (Mr Gregory), after submitting his amendment, intimated that he was not surprised by the view the Chairman of Committees had taken of it. He even said that he expected such a ruling, but he added that as his amendment was declared to be out. of order he had to take the only course open to him to secure the end that he desired, and so he moved "" That the clause be postponed "". He further said that if his view were not accepted by the committee on this point, he would oppose the bill to the very utmost of his power. What occurred subsequently? When the motion for the postponement of the clause was moved, no member of either the United Australia party or the Labour party rose to speak. The speeches all came from the Country party corner, and they were directed to the substance of the amendment. As one after another of the Country party representatives rose the Treasurer ticked them off on his fingers, and when a sufficient number had risen to show him that it was impossible for the Government to avoid defeat on the issue, he said "" I agree to the postponement"". This, of course, is a vital clause of the bill. I remind the Treasurer that whereas the speeches on this subject have all come from the Country party corner, when a similar move is made a little later to exempt small shopkeepers, the speeches directed to that end will be delivered by the honourable member for Wentworth (Mr Harrison), the honourable member for Barton (Mr. Lane), and the honourable member for Moreton (Mr Francis), who hurried across the chamber to tell the Treasurer to ""pull out"". The pressure that will then be brought upon the Treasurer will be increased onehundredfold. The bill is doomed, and the Treasurer knows it.",47
258,Mr BAKER,PENSIONS INSURANC EBILL,"Griffith) [9.14] - The speeches delivered on this subject to-night have been most interesting, more particularly as this is a major clause of the bill. It is obvious that the Government has been defeated, although no vote has been taken. If the Treasurer (Mr Casey) is prepared to take the situation which he now faces as other than an instruction to make a fundamental alteration proposed by the honourable member for Swan (Mr .Gregory) his conduct can only be characterized as gross political chicanery. Honourable members are aware that the only method by which an amendment can be moved to is by submitting a motion "" That the clause be withdrawn"", or "" That the clause be postponed"". Such a motion bas been submitted on quite a number of clauses. Even when a clause is postponed for a specific purpose, the records merely show that the clause has.been postponed. The Treasurer (Mr Casey) said that he was not present when the amendment was submitted, but when speaking earlier today on a previous clause, he accused me of being absent during a portion of the debate. The Minister was absent because he was attending a party meeting which was held between 7.30 and S p.m.",47
259,The CHAIRMAN,PENSIONS INSURANC EBILL,Order ! The honourable member's remarks are not relevant to the clause.,48
260,Mr BAKER,PENSIONS INSURANC EBILL,"The supporters of the Government were holding a meeting at which they were to decide how they were to vote on this clause, and when the bells rang at 8 o'clock, many honourable members of the Opposition were in their places, but only about two supporters of the Government were present.",48
261,The CHAIRMAN,PENSIONS INSURANC EBILL,Order ! I again ask the honourable member to discuss the clause.,48
262,Mr BAKER,PENSIONS INSURANC EBILL,"A m I in order in saying that the Treasurer, in interpreting the motion to postpone the clause, indulged only in specious reasoning?",48
263,The CHAIRMAN,PENSIONS INSURANC EBILL,The honourable member's remarks are now in order.,48
264,Mr BAKER,PENSIONS INSURANC EBILL,"During the debate on the clause, there was considerable activity, amounting almost to consternation, amongst Government supporters. Some honourable members of the Country party were opposed to the clause, but said that they would support its postponement. As only two honourable members on this side of the chamber debated this provision, we cannot be accused of stone-walling. The Government Whip was busy, and even the Minister for Defence (Mr Thorby), who is so over-worked that a Minister to assist him has been suggested, was helping to whip up the Government supporters.",48
265,The CHAIRMAN,PENSIONS INSURANC EBILL,"If the honourable member persists in disregarding the direction of the Chair, I shall order him to this bill ' resume his seat.",48
266,Mr BAKER,PENSIONS INSURANC EBILL,I was merely saying that the Minister for Defence was assisting the Government - Whip in an endeavour,48
267,The CHAIRMAN,PENSIONS INSURANC EBILL,The honourable member for Griffith will resume his seat.,48
268,Mr CLARK,PENSIONS INSURANC EBILL,"Darling) [9.19] - The honourable member for Swan (Mr. Gregory) has moved an amendment .which, if agreed to, is to be regarded as an instruction to the Government to exempt small farmers, graziers and business men whose income is less than £208 a year from contributing to this scheme in respect of employees. I support the proposal of the honourable member because I also believe that all part-time workers, particularly those receiving less than the basic wage, should not be expected to pay Is. 6d. a week. It has been said from time to time that the operation of a contributory system is most inequitable, particularly as men working for part-time and receiving only perhaps £1 or £1 10s. a week will have to pay the same contribution as men who may be earning £10 a week. If the clause be postponed, I trust that all those whose income is less than £208 a year will be exempt from contributions to this scheme. [Quorum formed.] Clause postponed. Clause 27 (Contributions by voluntary contributors).",48
269,Mr CURTIN,PENSIONS INSURANC EBILL,"Fremantle) [9.22] - In view of the fact that this clause relates to voluntary contributions and certain subsequent clauses deal with contributions by juveniles, I ask the Treasurer (Mr Casey) to. report progress at this stage. Up .to the present the committee has not agreed to any clause which provides that contributions be levied, and therefore no clause has been agreed to for levying contributions or for laying it down specifically that they shall be paid by the persons by whom it is declared that they shall be payable. In these circumstances it would appear that the principle of the bill has not been agreed to by the committee; therefore the other clauses which are derivatives of clause 26 ought to be deferred until the Government has decided what it proposes to do' with that clause. The Treasurer must have agreed to the postponement of previous clauses for reasons which we shall be told about later, and until clause 26 is dealt with the bill should not be considered further. The Treasurer can tell the committee tomorrow what he proposes to do in respect of clause 26.",48
270,Mr CASEY,PENSIONS INSURANC EBILL,Corio-Treasurer ) [9.23]. - The other clauses are not dependent upon clause 26. Clauses 27 and 28 deal with voluntary contributions in respect of which no compulsion will be exercised.,49
271,Mr CURTIN,PENSIONS INSURANC EBILL,What of clauses 29 and 30?,49
272,Mr CASEY,PENSIONS INSURANC EBILL,Clause 29 relates to juvenile contributors. There is no reason whatever why progress should be reported at this stage.,49
273,Mr WARD,PENSIONS INSURANC EBILL,"East'Sydney) [9.24] I move That the clause be postponed. If the motion be agreed to it shall be regarded as an instruction to the Government to give further consideration to the rates of contribufor tions from voluntary contributors. The Treasurer has said that there will be no compulsion upon the persons covered by this clause to make any contribution. It seems rather contradictory on the part of the Treasurer to agree to the postponement,of a previous clause so that provision may be made for the exemption from payment of contributions of certain persons receiving small incomes, while at the same time he is prepared to impose the full penalty upon voluntary contributors who in many cases will be persons who, at the time they become voluntary contributors, will not be receiving any income whatever. It is easy for the Treasurer to say that it will not be compulsory for any person other than those engaged in insurable employment to come under this scheme; but there will be instances of persons who have paid into the scheme for a number of years, finding that they will either_have to continue as voluntary contributors or sacrifice the money which they have already paid compulsorily. Thus a form of compulsion is exercised upon a section who will come under the scheme compulsorily, and who for various reasons have left the insured field, to continue membership as voluntary contributors. Eor that reason I think it unfair that the Government should agree to exempt certain employers and small farmers whose incomes do not exceed £208 per annum, and at the same time be proposing a clause under which a penalty of 3s. a week will be imposed on persons who are without any income but who wish to continue in the scheme, a large number of whom may probably have been contributing for many years.' The committee having agreed to the postponement of clause 26 for the purpose of giving the Government an opportunity to carry out certain instructions of the Country party, should, if it wishes, to be consistent, also agree to the postponement of this clause. Voluntary contributors, who at the time may not be earning any income whatever, will have to meet their contributions out of thesavings made when they were employed, or by means of the assistance granted to them by friends or relatives.",49
274,Mr CASEY,PENSIONS INSURANC EBILL,"Corio-Treasurer ) [9.28]. - The remarks of the honourable member East Sydney (Mr Ward) are quite irrelevant to the clause, which merely sets out its relation to the first and second paragraphs of part 1 of the second schedule in respect of contributions. QuestionThat the clause be postponed (Mr Ward'S amendment). The committee divided. (CHAIRMAN-MB . PBOWSE.) Ayes .. .. . . 23 Noes .. .. . . 34 Majority 11 AYES. Baker. F. M. J. Martens, G. W. Beasley, J. A. Mulcahy, D. Blackburn, M. M. Pollard, R. T. Brennan, F. Riordan, W. J. Clark, J. J. Kosevear, J. S. Curtin, J. Sheehan,. T. Drakeford. A. S. Ward, E. J. Forde, F. M. Watkins, D. O. Frost, C. W. Green, A. Holloway, E. J. Tellers: Lazzarini, H. P. Gander, J. H. Mahoney, G. W. Lawson, George Badman, A. 0. J^yons, J. A. Cameron, Arcliie Marr, Sir Charles Casey, H. Or. MCEwen, J. Collins, T. J. Nairn, W. M. Corser, Bernard Paterson, T Fadden, A. W. Perkins,.J. A. Fa'-lmirn, J. V. Price, J. L. Francs, J. Scholfield, T. H. Gregory, H. Spender, P. C. Gullett, Sir Henry Siacoy, F. H. Harrison, 12. J. Street, G. A. Hawker, C. A. S. Thompson, V. C. Holt, H. E. Thorby, II . V. C. Hutch nsou, W. J. Wilson, A. Jennings, J. T. Jolly, W. A. Lane, A. Tellers: Lawson. John Gardner, S. L. Scullin, J. H. Hughes, W. M. Barnard, H. C - Rankin, G. J. Maloney, Dr Menzies, R. G. Scully, W. J. MCCall, Ay. V. James, R. Anthony, H. L. Makin, N . J. O. Stewart, Sir Frederick Question so resolved in the negative. - Clause agreed to. Clause 28 agreed to. Clause 29 postponed. Clause 30 (Continuance of liability to pay contributions).",49
275,Mr CURTIN,PENSIONS INSURANC EBILL,"Fremantle) [9.35] The Treasurer (Mr Casey) has just given a demonstration of consistency by moving that clause 29 be deferred because it is relevant to a previous clause which had been postponed. I maintain that clause 30 is relevant to clause 26, which also has been postponed. clause 2 of clause 30 is as follows:2. The amount of contribution payable the employer of an employed person shall tinue to be paid so long as the person remains in h'is employment notwithstanding that person has attained the maximum age. Surely the Treasurer does not suggest that that sub-clause has no relation clause 26? I am opposed to this clause, and I suggest that the whole clause be postponed. The effect of subof clause 2 would be to place a penalty on the employer who keeps in his employ a person who has attained the maximum age. The employer of a person who would be eligible to draw the old-age pencumstances, sion, but decides to continue in work, would, under this clause, have to continue making contributions to the fund. What is the purpose of this provision? NOES. Mr Casey (Corio-Treasurer ) [9.37] -^Clause 30 reads as follows:1. The amount of contribution' payable by an employed contributor and the contribution paynb.e by a voluntary contributor and by n special voluntary contributor shall cease to be payable when he attains the maximum age. 2. The amount of contribution payable by the employer of an employed person shall continue to be paid so long as the person remains in his employment notwithstanding that the person has attained the maximum age. Thus, an insured man, at the age of 65, or an insured woman at the age of 60, will cease to contribute under the scheme, Nock, H. K. but his or her employer will be obliged PAIRS. to continue making contributions so long as the insured person remains in employment. The purpose is to avoid differentiation in favour of any class of employees. If this provision did not exist, the tendency might be for employers to employ persons of pensionable age to the exclusion of others. ",50
276,Mr BLACKBURN,PENSIONS INSURANC EBILL,"Bourke) [9.40] The only logical course for the Government to pursue, after the postponement of clause 26, is to postpone all those clauses in Part IV . of the bill which relate to compulsory contributions. Clause 26 statesSubject to this act, contributions at the rates declared by the Parliament shall be levied and paid by the persons by whom the contributions are so declared to be payable. The bill provides for compulsory contributions, and for voluntary contributions, Subthe latter by persons who choose to continue contributing after they are no by longer required to do so. This bil l does connot prescribe the rates of contribution because that, presumably, 'would be contho trary to the provisions of - the Constitution. The rates must be set out in a separate measure, in respect of which the to appropriate resolutions had been moved subin Committees of Ways and Means. Clause 26, which embodies the principle compulsory contributions, though not the rates, has been postponed, and, therefore, Parliament has not approved-of the principle of levying contributions from anybody. It is only logical, in the cirto postpone all those clauses which relate to the levying of compulsory contributions, u n t i l we have decided whether they shall be levied by compulsion, how they shall be levied, and what exemptions shall be recognized. The agreement of the Treasurer (Mr Casey) to postpone clause 26 had no meaning it did not imply that favourable considerabody. tion would be given to the proposition put forward by the honourable member for Swan (Mr Gregory) in support of motion for postponement. The Government has already refused to accept motions from honourable members on this side of the House for the postponement of clauses because it did not agree the purpose behind the motions. In this instance, presumably, the Government not does agree with the purpose behind the motion of the honourable member for Swan, namely, that certain classes of employers should be altogether exempt from the making of contributions. When the honourable member was told that amendment to this effect would be out of order, be moved that the clausebe postratesContributions poned, and the Government, after honorsions able members had addressed themselves the in support of the mover, agreed. It Contributions) could have done so only for one by special of two reasons-eithe r to gain net. time, or because it had decided to accept the honourable member's proposal. I do not think that it was actuated merely by desire to gain time, because I cannot see that there is any possibility of its getting the numbers defeat the proposal of the honourable member for Swan and his supporters. Therefore, the Government could only have meant that it was prepared to sider how far it could go in the direction to acceding to the proposal of the honourable mombqr for Swan, and the postponemember ment of the clause involves also the ponement of the decision to exact compulthe sory contributions from any one. That being so, it would be illogical for committee to consider other clauses affirm that there shall be exacted compulsory contributions from insured persons. Clause 30 is one of those clauses. The only logical course for the committee is agree not to' deal further with Part IV . some decision. until the Treasurer is again ready'to consider clause 26. The honourable gentleman apparently thinks that the committee may continue with those clauses in Part IV which deal with voluntary contributions; tributions. there are not many of them, and the only logical course for him to adopt is to pone the further consideration of Part IV . until we have decided whether coni f tributions are to be exacted from anyClause 26 is the clause which provides for the levying of contributions and their payment by the people. That means his the exaction of contributions.",50
277,Mr BRENNAN,PENSIONS INSURANC EBILL,Does not that apply equally to voluntary contributions?,51
278,Mr BLACKBURN,PENSIONS INSURANC EBILL,"No . Levying with means exactions of contributions from people against their will. The rates have been set out in the bill for the reasons advanced by the Treasurer in his second reading speech, namely, that section 55 of the Constitution would not permit the rates to be set out in the bill, because they might be regarded as taxes. This bill an defines "" contributions "" as meaningconsisting of payments at the imposed by the National Health and Pen(Employers' Contributions) Aet 1938 and National Health and Pensions (Employees' Act 1038 and includes contributions made by voluntary contributors and voluntary contributors under this The measures referred to are to follow this bill. The Treasurer,. having postponed clause 19, was consistent in postponing all the clauses relating to juvenile to contributors, but having postponed the decision Avhether there shall be compulsory contributions, he is not consistent in asking the committee to proceed as if conit had decided that there shall be.",51
279,Mr CASEY,PENSIONS INSURANC EBILL,"Corio-Treasurer ) [9.47] - The contentions of the honourable for Bourke (Mr Blackburn) are postbased on the erroneous assumption that Government, in agreeing to the postponement of clause 26, has thrown over the board the contributory principle. That which is far from being the case.",51
280,Mr BLACKBURN,PENSIONS INSURANC EBILL,I did not say that.,51
281,Mr CASEY,PENSIONS INSURANC EBILL,The honourable member to spoke as if this committee had registered,51
282,Mr BLACKBURN,PENSIONS INSURANC EBILL,The Treasurer invited the committee to postpone decision . as to whether or not there shall be con,51
283,Mr CASEY,PENSIONS INSURANC EBILL,"I do not agree with postthat for one moment. If the honourable gentleman - suggests that clauses having nothing to do with compulsory contributions are to be deferred, he is wrong.",51
284,Mr BLAOKBUBN,PENSIONS INSURANC EBILL,"Nevertheless , the committee may decide to do so.",52
285,Mr CASEY,PENSIONS INSURANC EBILL,"That is for the mittee, not for the honourable member for Bourke, to determine. If the further sideration of clause 21 necessitates any new clauses in this bill, the Government will bring them down at the proper time. employees. Meanwhile, these other clauses are strictly relevant and the Government intends to proceed with them. The Government has not thrown overboard the principle of compulsory .contributions on which the whole bill is framed.",52
286,Mr BRENNAN,PENSIONS INSURANC EBILL,"Batman) [9.49] The only extent to which I disagree, i may be called a disagreement reasoning of the honourable member for Bourke (Mr Blackburn), is that I submit, with some confidence, that the ponement of clause 26 renders it just as necessary to postpone the consideration of the clauses relating to voluntary contributions as it is to postpone those relating to Compulsory contributions. My reason foi' saying that is that although contributions are in certain circumstances voluntary, nevertheless, this bill proposes to set machinery for receiving these contribuscheme. tions into the revenues of the Commonwealth, and it takes control of those tributions precisely in the same way as it the Government. takes control of the compulsory contributions. The whole o.f the contributions, voluntary or compulsory, required clause 26 are an essential part of the bill, and it is impossible logically to consider any clause in this bill dealing with tributions, voluntary or compulsory, until the committee has first decided that there shall be such contributions. I submit with great respect that to proceed to deal incidental matters relating to contribuof tions is an affront to this committee, paid by employer and employee. which has deliberately postponed for ther consideration the whole question of ment might consider whether these contributions shall be levied compulsorily or made voluntarily or at all. To attempt to proceed with the details of contributions that have been deliberately postponed, I repeat, is affront to this committee. Sir . CHARLES . MARR (Parkes) [9.52] - Clause 26 was postponed at the invitation of members of the committee, simply on the proposal of the honourable member for Swan (Mr Gregory) to consider a certain class of the community. comThe question of whether the scheme should be contributory was not under disconcussion. This committee has yet to decide the amount of contributions to be paid by the various sections, both employers and",52
287,Mr BEENNAN,PENSIONS INSURANC EBILL,Voluntaril y and compulsorily.,52
288,Sir CHAELES MARR,PENSIONS INSURANC EBILL,"I agree that machinery has to be set up to collect the voluntary contributions. Clause 30 merely states that the contributions arranged by Parliament to be paid by f it employees, whatever they may be, shall with the cease at the maximum age.",52
289,Mr BEENNAN,PENSIONS INSURANC EBILL,How do we know that postthere will be any contributions?,52
290,Sir CHARLES MARR,PENSIONS INSURANC EBILL,Whether the contribution be 3d. or 3s.,52
291,Mr BEENNAN,PENSIONS INSURANC EBILL,It may be nothing.,52
292,Sir CHARLES MARR,PENSIONS INSURANC EBILL,It cannot be nothing because the Government's proup posal is for a compulsory contributory,52
293,Mr BEENNAN,PENSIONS INSURANC EBILL,The Government's conproposals depend on the numbers behind,52
294,Sir CHAELES MARR,PENSIONS INSURANC EBILL,"I accept that. If the Government has not the support in of the committee for a contributory scheme it must go out of office; there is no alternative. It has brought before conParliament certain proposals, under which contributions are to be made by both the employer and the employee, and the only question to be decided, unless with the Government has lost the confidence the committee, is as to the rates to be We furpostponed clause 26 so that the Govern the further question raised by the honourable member for Swan. Clause 30 provides that whatever contributions Parliament may decide shall be paid by an employee, shall cease an when he reaches the maximum age. That is the only question before the committee. The amount of the contribution is to be decided later. Sub-clause 2 of clause 30, which provides that the employer of an employed person shall continue to pay contributions in respect of his employees so long as they remain in his employ, and irrespective of their age, is a very necessary provision. With due respect to the legal training of the honourable members for Bourke and Batman, I think their contentions are erroneous.",52
295,Mr BRENNAN,PENSIONS INSURANC EBILL,"Batman) [9.55] Clause 30, sub-clause 1, says that the amounts of contribution payable by the employed contributor, voluntary contributor, and special voluntary contributor, shall cease to be payable when the employee attains the maximum age. When the committee was faced with the necessity, if this bill is to proceed, of deciding whether there should be a contribution payable by the employed contributor, it discussed the matter for a time and, by reason of the opposition to it in some particulars, postponed decision. The question remains undecided.",53
296,Sir CIIAKLES MAKE,PENSIONS INSURANC EBILL,Onl y the amount.,53
