speakerGroups,Speaker,Title,text,pageNumbers
0,NA,Unknown,"House of Representatives. Tuesday, l/ June, 193S. t",12
1,Mr SPEAKER,Unknown,"Hon. G. J. Bell) took the chair at 3 p.m., and read prayers. NA PENSIONS INSURANCE BILL.",12
2,Mr CURTIN,NATIONAL HEALTH AND,Will the Prime Minister state whether it is a fact that the Government intends to adopt measures under the Standing Orders to prevent the consideration of amendments which have been circulated by honourable members on the Opposition side in connection with the National Health and Pensions Insurance Bill?,12
3,Mr LYONS,NATIONAL HEALTH AND,"On a previous occasion, I mentioned that the Government did not intend to curtail the discussion of the bill, provided it followed along the usual lines, and provided there was no indication of stonewalling, or unnecessary prolongation of the debate; but it is the duty of the Government to carry through the legislation which has been approved by the people of this country, and I hope that there will not be any need to adopt the methods indicated by the honourable gentleman. Nevertheless, if such action becomes necessary, the Government will have to give serious consideration to the position.",13
4,Mr FORDE,NATIONAL HEALTH AND,"Has the Treasurer been asked to receive a deputation from the British Medical Association next Thursday with regard to the National Health and Pensions Insurance Bill, and, if so, does the Minister intend to comply with the request of the association?",13
5,Mr CASEY,NATIONAL HEALTH AND,"I received a letter from the association, and, before it reached me, I read its contents in the press. That, I think, showed a lack of courtesy on which comment should be made. Up to the present time, the Government has made no decision in the matter. DEPARTMEN T OF TRANSPORT.",13
6,Mr JOHN LAWSON,NATIONAL HEALTH AND,"Does the Minister for the Interior propose to recommend to the Government the establishment of a federal department of transport, as reported in the daily press yesterday ?",13
7,Mr MCEWEN,NATIONAL HEALTH AND,"I am glad the honourable member has asked this question, because it gives me an opportunity to correct a misapprehension. Having received an inquiry on this matter from a member of the press, I said in reply that, later in the year, I expected to preside at a. conference of State Ministers for Transport, and that, if such a proposal were raised at the conference, it would be considered afterwards' by the Comforth monwealth Government. NA REPORTS.",13
8,Mr NOCK,BROADCASTING OF MARKET,"Will the Minister representing the'Postmaster-General state why the Australian Broadcasting Commission now postpones until the night sessions the broadcasting of corn trade news and wheat market reports, which, until recently, were issued during the earlier sessions, since this prevents people in country districts from obtaining the latest news? Country agents receive the latest information by telegram.  that such a change has been made, but I understand that the alteration is considered to be in the best interests of the men on the land, as the news is broadcastat a more convenient hour than before. However, I shall direct the attention of the commission to the honourable gentleman's question. OVERSEAS AIR - MA IL SERVICE,",13
9,Mr NAIRN,BROADCASTING OF MARKET,"Is there any foundation for the report that, on the arrival of the overseas air mails at Darwin, the Western Australian mails are to be carried via Adelaide, or is there any truth in the alternative statement that one only of the thrice-weekly consignments of mails to arrive at Darwin will be carried on by the north-west route?",13
10,Mr THORBY,BROADCASTING OF MARKET,"No definite pronouncement has heen made hy the Government regarding the details of the scheme now .being formulated in connection with the overseas air-mail service, the distribution of the mails in Australia, and the question of surcharges. When the whole plan is complete, the Government will make a statement regarding it.",13
11,Mr HARRISON,BROADCASTING OF MARKET,"Will the Minister for Defence state whether the pfess report is correct that the Government proposes to subsidize existing air lines in connection with the carriage of mails from Darwin to Perth and Adelaide, and, if that is correct, does not the Minister consider that tenders, should be. called for such services?",13
12,Mr THORBY,BROADCASTING OF MARKET,"The Government has made no pronouncement whatever setting the details that have been referred to by various newspapers. As I have already stated i u reply to another question, immediately a complete plan, has been evolved a ful l statement will be made by the Government. NA REFRESHMEN;T-ROOM EMPLOYEES.",13
13,Mr SCHOLFIELD,PARLIAMENTARY,Will the Minister for the Interior endeavour to devise means whereby the men employed in the parliamentary refreshment-rooms while the Parliament is in session may be more assured than they are now of permanent employment when the Parliament is in recess ?,14
14,Mr MCEWEN,PARLIAMENTARY,"That , Mr Speaker, is a question which, I think, could be more appropriately directed to you.",14
15,Mr SPEAKER,PARLIAMENTARY,The matter was mentioned on the adjournment on Friday last by the honourable member for Griffith (Mr Baker). I then stated that the employment during the recess of stewards employed in the refreshment-rooms when the Parliament is sitting was a matter with which I could not deal. Later:,14
16,Mr SCHOLFIELD,PARLIAMENTARY,I now ask the Minister for the Interior whether he will give consideration to my question?,14
17,Mr MCEWEN,PARLIAMENTARY,"I understood, at first, that the honourable member was referring to employment within Parliament House. If he has in mind other than parliamentary employment during the parliamentary recess I shall be glad to sideration to the subject. I point out, however, that at present every person registered for unemployment relief work in Canberra is occupied on a full time job.",14
18,Mr BAKER,PARLIAMENTARY,That may not be the position during the next recess.,14
19,Mr MCEWEN,PARLIAMENTARY,I appreciate that. TOKYO EXHIBITION . on the subject.,14
20,Mr CURTIN,PARLIAMENTARY,"Will the Prime Minister state whether the Government has decided to have Australia represented at the Tokyo Exhibition, and, if the answer is in the negative, is there any good reason for such a reply?",14
21,Mr LYONS,PARLIAMENTARY,"The desire of the Goticipation vernment is to be represented at the Tokyo Exhibition, but certain technical Pageant ? difficulties will have to be removed. Under the International Exhibitions Convention, certain exhibitions are approved, and, at the present time, the Tokyo Exhibition does not fall within the category of approved exhibitions. The Government is seeking to have the objection removed, so that Australia may be represented. NA DIVISION.",14
22,Mr MULCAHY,PUBLIC TELEPHONE IN LANG,"In reply to a request for the installation of a public telephone in my electorate, I was notified by the Deputy Postmaster-General in Sydney on the 10th January last, that the telophone would be installed, but that some time would elapse before the service could be provided. Five months having now elapsed, I desire to know from the Minister representing the Postmaster General, the reason for the delay in the provision of this public service.  quiries made, and the honourable member will be advised later regarding,the matter. CANBERRA-SYDNEY RAILWA Y SERVICE.",14
23,Mr JOHN LAWSON,PUBLIC TELEPHONE IN LANG,"In view of the wholly inadequate facilities provided for refreshments on the railway journey from Sydney to Canberra, will the Minister for the Interior endeavour to arrange with the Government of New South give conWales for a dining car to be attached to the day train which runs between the two capitals, so that persons who are obliged to use this train may be enabled to avoid the suffering dependent upon the development of chronic dyspepsia?",14
24,Mr MCEWEN,PUBLIC TELEPHONE IN LANG,"I shall confer with the Commonwealth Railways Commissioner, and also make contact with the railway authorities of New South Wales BALLARAT AERI AL PAGEANT.  for Defence whether he will consider waiving the conditions which have been laid down in respect of the proposed parof Royal A i r Force machines in the Ballarat Aero Club's Centenary",14
25,Mr THORBY,PUBLIC TELEPHONE IN LANG,"The conditions are those usually imposed in respect of A i r Force machines taking part in aerial pageants in different parts of the Comthis monwealth. It should be borne in mind that most of these pageants are intended for money-making purposes, to additional funds either for some charitable organization or for the aero club years concerned. In most instances the public is charged an admission fee. The usual practice is for the clubs to cost involved by the A i r Force machines while they are in the air at the pageant. No charge is made in respect of the journey to or from the location of the pageant, as this is regarded as part of the training course. PAYMENTSTO DR. G. L . WOOD.",15
26,Mr MAHONEY,PUBLIC TELEPHONE IN LANG,"I ask the Prime Minister what fees, salary, and travelling expenses have been paid to Dr G. L Wood since he became a member of the Commonwealth Grants Commission, and also what fees, salaries, and travelling expenses have been paid to him since began his talks for the Australian Broadpaid casting Commission? - Mr LYONS - I shall obtain the inforbeen mation for the honourable member. NA NA In committee: Consideration resumed from the 10th June (vide page 2049) Clause 25(1.) A woman who has been insured for not less than five years, who has ceased to employed, and by and in respect of whom less than two hundred and eight weekly tributions have been paid, may, if she married and gives notice within the prescribed time and in the prescribed manner, elect become a special voluntary contributor under this act for old-age pension only, and upon she shall become such a contributor. (2.) Except in accordance with this section, a married woman who is not insured tue of insurable employment shall not be insured under this act. M i \ BEASLEY (West Sydney) [3.15]. I move That the clause be omitted with a view to insert in lieu thereof the following clause:""25 - (1.) When a woman being an in that sured person marries if she(a) had at any time before marriage ceased; or (6) at any time during the period of her maruiage ceases, to be a person whose normal occupation is insurable employment within the moaning of act, she shall until the expiration of a period of 'two years from the date of her marriage be treated as if she were an insured pei'doii in respect of whom contributions have provide been continuously paid. (2.) At the expiration of the period of two referred to in the preceding sub-section, such a married woman may, if she gives notice in the prescribed time and in the prescribed miiiiucr, elect to become a special contributor pay the actual under the act for (a.) sickness benefit, disablement benefit and old-age pension; (Ii) sickness benefit'and disablement benefit; or (c) old-age pension only, and thereupon she shall become a contributor. (3.J Except in accordance with this section, at the expiration of a period of two years from the date of her marriage, a married woman who is not engaged in insurable employment shall cease to be insured."" The clause in the bill stipulates harsh . conditions in relation to married women. For example, not only must they be in sured for five years to be able to obtain by voluntary contribution even an oldhe age pension, but they must also have not less than 20S weekly contributions. In other words, they must have paying into the f u n d for about four years. Honourable members who are familiar with the conditions laid down in the British act, will appreciate that this clause is far more severe on married 193S. women than the relevant section of the British measure. My amendment follows, to some extent, the British practice and is in direct opposition to the clause now before the committee. In the be first place, it does not demand insurance not for five years previous to marriage, but conprovides that for two years after maris riage, an insured woman may be treated to as though her contributions had been continuously paid. Further, if , at the thereend of the two-year - period, she gives notice in the prescribed manner she may by virbecome a special contributor for (a) sickness benefit, disablement benefit or old-age pension; (6) sickness benefit and disablement benefit; or (c) old-age pension only. Honourable member's will appreciate some concession to women in respect of medical and health benefits in the two years following their marriage would be of great value to ' them. Having had cover to that extent, married women should then be permitted, in my opinion, to continue as special contributors for any of the benefits to which I have"" referred. The amendment I have moved is similar to a section of the British National Health and Insurance Act of 1936, which makes special provision for married women in the circumstances I have mentioned. Section 126 of that act readsWhere a woman being an insured person under the age of 65 and a member of an approved society marries, she shall, if she had before the date of her marriage ceased, or if at any time during coverture and within twelve months after the date of her marriage she ceases, to be a person whose normal occupation is employment within the meaning of this act, ceases as from the date of her marriage or as from the date on which she ceases to be such a .person (which last date is hereinafter referred to as "" the date of unemployment"") whichever is the later, to be entitled to the benefits to which she would otherwise have been entitled under the provisions of this act, and in lieu thereof she shall(<jl subject to the provisions of this act. be entitled to the following benefits, that is to say(i) sickness benefits for an aggregate of not more than six weeks in the period of twelve months commencing next after the date of unemployment, or if the date of unemployment was anterior to the date of her marriage, within so much of that period as is subsequent to her marriage; and for the purposes of this paragraph the first disease or disablement in respect which such sickness benefit able shall not be deemed to be a continuation of any previous disease or disablement . . . That section also makes provision' for single maternity benefits irrespective of arrears, medical benefits and any additional benefits provided by societies. Women contributors entitled to the same considerations other insured persons for two years from the date of their marriage. visions of the British section I have q noted should bring clearly under the notice of the committee the object of my amendment. The clause now under discussion is particularly harsh on married women. For instance a woman, who, prior to her marriage an employee paid all Mr fieaslcy. tributions, ceases as soon as she marries to derive any benefit whatever, particularly in the event of sickness. It seems strange that the Government should ask the committee to agree to this clause under which unnecessarily harsh conditions are imposed upon married women.  the amendment moved by the honourable member for West Sydney (Mr Beasley) would increase the benefits, bring a larger number of persons under the scheme than would otherwise be the case, and increase the charge upon Consolidated Revenue, I rule that it is not in order.",15
27,Mr BEASLEY,PENSIONS INSURANC EBILL,"In those circumstances I move That the clause be postponed. Should my motion be agreed to it will be regarded asu direction to the Government to redraft the clause in such a way as to provide for the persons mentioned ""in the amendment circulated.",16
28,Mr CASEY,PENSIONS INSURANC EBILL,"Corio-Treasure r ) [3.24] - The intention of the honourable member for West Sydney(Mr Beasley) is to include in the bill women who, at the time of marriage, were either employed or were in their free insurance period. The honourable member has apparently overlooked the laet that the free insurance period, which was discussed at great length a few days ago, applies to women in the circumstances I have already of described. A woman whose contributions is pay- were paid up to the date of her marriage and who goes out of normal insurable work would still be entitled to the full .scope of the free insurance period. For instance she could claim medical benefits for an average of 21 months after her marriage. She would be entitled to free approved doctor's attention and free medicine for are at least eighteen months, and. for pOssibly as two years. For about twelve months after marriage she would also be entitled The pro- to sick pay in the free insurance period. Such benefits would be available without further contributions, and would be very valuable particularly in respect of the first year or so of married life, when the periods of disability or incapacity are rather frequent. I venture to suggest has as that the honourable member has entirely her conoverlooked the fact that, the free insurance period applies fully to paid-up women contributors for a period after their marriage. The honourable member has also overlooked that women on marrying can, for the relatively small contribution of Is. a week, continue their contributions in respect of an old-age pension. The average age at which women in Australia marry-at least in recent years-ha s been slightly over 25, and at that age the pension under this bill is worth 2s. 6d. a week. In these circumstances every married woman who contributes Is. a week would, on an average* be getting something worth 2s.i 6d. a week. Should a woman not marry until she is 32 years of age the proper contribution in respect of an old-age pension would be 4s. Id. per week. The right to contribute Is. weekly for an old-age pension is a very valuable provision, apart from the additional option, of which the Government has given notice by way of an amendment, that women may by paying Is. 6d. instead of Is. weekly obtain an old-age pension of 20s. weekly at 60 years of age. The optional contribution of Is. weekly or more, particularly the optional contribution of Is. 6d. weekly, is a very valuable provision to married insured female contributors. The Government has also announced its proposals to provide financial assistance to persons outside the scope of the bill by insuring the wives and children of male contributors in respect of medical benefits. The Government has already made known in broad terms its proposals in that regard. If a woman who has been insured marries an insured man, as in most cases she will, she will get the benefit of a potential widow's pension for herself and a children's allowance in respect of the children. Under clause 75 a woman can contribute Is. or Is. 6d. a week and in relevant circumstances draw both a widow's pension and an old-age pension, towards the cost of each of which she has contributed. The Government has gone to great lengths in this regard, and it believes that it has dealt fairly with women. Two, at least, of the largest of the friendly societies do not provide any cover for women in the circumstances mentioned by the Leader of the Opposition. They are specifically excluded, and are not allowed to contribute for these benefits. For instance, the Grand United Order of Oddfellows, in Rule 164, lays it down thatA married woman shall not be permitted to contribute for, nor to receive, sickness benefit. Married women are permitted only to contribute for funeral benefit. A rule of the Manchester Unity Society statesA married woman member shall contribute for funeral, benefit only, and shall not be entitled to contribute for sickness benefit. I do not know whether this rule, or a similar one, is general in all friendly societies, but I believe it is in most. I am having inquiries made now regarding the position. The Leader of the Opposition overlooked the advantages of the period of free insurance, and also refrained from mentioning the two liberal options which the Government provides for women who marry in the circumstances mentioned by him. Therefore, I submit that the Government has gone to the limit in regard to benefits, and cannot accept the amendment.",16
29,Mr HOLLOWAY,PENSIONS INSURANC EBILL,"Melbourne Ports) [3.33] - I cannot understand why the Government refuses to permit women to participate in all the benefits under this bill, provided they are prepared to pay for them. Why does the Government so carefully exclude the wives and children of contributors from medical benefit? If the benefit had been granted, there would have been no need for this amendment. The point I wish to make is that women, even though they are prepared to pay, will not be permitted to receive all the benefits of the scheme. The amendment simply provides that if a woman, after marriage, desires to continue for the rest of her life as an insured person, she should be able to do so, and will be eligible to receive all the benefits of the insurance scheme. The principal reason why a woman may desire to do this is that, when her husband becomes an insured person under the act, he will lose the right to medical benefit for his wife and children which he. enjoyed as a member of a friendly society.",17
30,Mr JENNINGS,PENSIONS INSURANC EBILL,"Watson) [3.35] Under the scheme female contributors will pay Is. a week for a pension of 15s., or, if they choose, Is. 6d. for a full pension of £1, in addition to medical,. sickness and disablement benefits in both cases. When a woman marries, the scheme ceases, unless she or her husband chooses to continue contributing on a voluntary basis. She may become entitled to medical benefit if her husband makes the necessary contribution through a friendly society. We should ask ourselves, however, whether it is equitable that the female contributor should lose her contributions upon marriage. We know that the scheme has been worked out on an actuarial basis, and there is good insurance value, but I wonder whether the Treasurer (Mr Oasey) has considered the possibility of arranging for some surrender value of the contributions of women when they marry. Of course, any sickness benefit a woman may have had during the period would be deducted. Every encouragement should be given to women in these circumstances.",17
31,Mr HOLLOWAY,PENSIONS INSURANC EBILL,"In any case, why should not women have the same rights under the scheme as men?",18
32,Mr JENNINGS,PENSIONS INSURANC EBILL,"When the scheme is in operation, the benefits no doubt will be extended. Indeed, that has been indicated by the Government.",18
33,Mr CLARK,PENSIONS INSURANC EBILL,"Darling) [3.37] - Unde r the clause as it stands, women who have paid contributions for five years, will be permitted to continue as insured persons, if they so desire, by keeping up their payments, but women who have contributed for less then five years will be denied this choice. I have looked up the statistics, and find that 30 per cent, of women marry when they are less than 22 years of age. The approximate number involved is 20,000, and if they contribute at the ra te of Is. a week between the ages of sixteen and 21, each would have paid into the fund approximately £13 at the time of marriage. Taking the average yearly contribution at £2 12s., the total sum paid by women in this group would be £50,000 a year, which the Government would collect, and for which it would give nothing in return.",18
34,Mr CURTIN,PENSIONS INSURANC EBILL,The Government will collect as much more from the employers.,18
35,Mr CLARK,PENSIONS INSURANC EBILL,"Yes , that makes the total of about £100,000 for which the contributors will obtain no return. They are even to be denied the right to continue their contributions in order to keep within the scheme. It is a sharp practice. These women will have to pay for an old-age pension as well as for sickness and disablement benefits, but the only benefit that they are likely to receive in the five years in which they will be contributing is sickness benefit and perhaps disablement benefit. In his second-reading speech the Treasurer (Mr Casey) said that women were to receive privileges in excess of those for which they would contribute. The women who marry before they have participated in the scheme for five years will not receive any such privileges. Either women from sixteen to 22 years of age should be required to contribute only for sickness or disablement benefit, or they should be permitted after their marriage, if they so desire, to continue their mem. bership of the scheme. At Is. a week each woman in five years will have paid £13 into the scheme, and that money will be entirely lost to her on her marriage. I stress the fact that she will have to contribute for an old-age pension which she may never receive. Figures cited last week showed that only .8 per cent, of women in the 55 to 59 years age group are employed in industry. That means that less than 1 per cent, of the women who will contribute for the old-age pension will receive it. Furthermore, whereas, male contributors will receive a pension of £1 a week, the pension for women is to be only 15s. a week. I think that they should be entitled to receive £1. I urge the Treasurer, however, to accept the amendment and thereby permit women, if they so desire, to continue their insurance after their marriage.",18
