speakerGroups,Speaker,Title,text,pageNumbers
176,Mr BAKER,PENSIONS INSURANC EBILL,"Then , logically, it would be best not to include any women who want to be married.",35
177,Mr CASEY,PENSIONS INSURANC EBILL,This class is not carrying anything like the total medical risk for which it is covered; I am not talking about pension benefit.,35
178,Mr BAKER,PENSIONS INSURANC EBILL,"That means that one women as a whole are not carrying the benefits which they will be entitled to receive; therefore, the contributions of that section which become unemployed, and will themselves be no longer able benefit, will be used for this purpose?",35
179,Mr CASEY,PENSIONS INSURANC EBILL,That is not so at all.,36
180,Mr BAKER,PENSIONS INSURANC EBILL,"Any woman who, oppressive within the next five years, becomes unemmunity ployed will lose whatever benefits' she may have been entitled to in respect her contributions. Except that she will now be entitled, under the amendment which the Treasurer has just moved, certain free insurance benefit, her ments during the next five years will be totally lost to her.",36
181,Mr CASEY,PENSIONS INSURANC EBILL,I do not agree with the honourable member.,36
182,Mr BAKER,PENSIONS INSURANC EBILL,"The words of the clause speak for themselves. Should a court called upon to interpret the clause it will not be concerned with the meaning placed upon certain words'by the Treasurer; it will be concerned purely with the nary meaning of the words used. We do not want a repetition of the incident which occurred in a certain case in which a lay attorney-general intervened and his opinion as to where a particular comma should haye been placed, and for his pains was censured, and rightly so, the court. Courts interpret the words an enactment in the ordinary meaning is involved. attached, to such words, and I suggest that the ordinary meaning of the words in this instance is that apart from free insurance, a woman who has been insured for less than five years will lose all contributions.",36
183,Mr CASEY,PENSIONS INSURANC EBILL,I do not agree with the honourable member.,36
184,Mr BAKER,PENSIONS INSURANC EBILL,"And she will lose those contributions in order to assist in balancing of the budget so far as this particular aspect of the scheme is concerned. Amendment agreed to. Clause, as amended, agreed to. Clause 26Subject to this Act, contributions at rates declared by the Parliament shall be levied and paid by the persons by whom contributions arc so declared to be payable.",36
185,Mr GREGORY,PENSIONS INSURANC EBILL,"Swan) [6.10] - I cial regret that owing to ill-health I was unplaints able to participate in the second-reading debate and to make my position clear respect of this measure to honourable memscheme. bers. I wish the Government to understand clearly that unless amendments can indeed. to bo made with regard to exemptions I certainly will do all I can to defeat the bill. This provision as it stands is unjust and to that section., of the comcomposed of small employers who will be compelled to pay for the insurance of of their employees although in many cases an employee will be in a better position than his employer to meet such conto tributions. The Treasurer (Mr Casey) payhas described this measure as a grand national scheme designed to benefit the workers. To me it seems extraordinary how little this scheme is being appreciated by the people of Australia as a whole. I do not know how many letters be of congratulation the Treasurer has received in respect of it, but I have received hundreds of telegrams and messages from all sections of the community in every ordipart of Western Australia pointing out how difficult it will be to operate the scheme, and how it will affect many sections unjustly. I cannot understand the gave Government's haste in so important a matter. Members of Parliament may be enabled to study fully the provisions of by the bill, but the public is not being of afforded any opportunity to realise what",36
186,Mr CASEY,PENSIONS INSURANC EBILL,What does the honourable used gentleman mean by haste?,36
187,Mr GREGORY,PENSIONS INSURANC EBILL,"I point out that ' her many bodies dealing with the administration of charities and pensions and controlling such institutions as country hospitals complain that the people generally are not acquainted with either the advantages or disadvanages of the scheme. In the that respect the Government has acted Will undue haste, and so far as I can see the attitude adopted by the Treasurer towards honourable members is that this is the Government's scheme and they can take is or leave it. Consequently it is difficult for any honourable member to have an the amendment accepted. Various organizathe tions representing women and primary producers, as well as banks and commerassociations, are making serious comin this respect. In fact, I venture to say that the Treasurer has received in very few letters of commendation on the",36
188,Mr CASEY,PENSIONS INSURANC EBILL,I have received very many,36
189,Mr GEEGOEY,PENSIONS INSURANC EBILL,"And I have received hundreds of protests against the scheme. In reply to certain remarks by the Leader of the Opposition (Mr Curtin) the Treasurer heatedly pointed out that one in his position had to consider the financial aspect of the scheme from the - point of view of what burden it placed on the nation as a whole, and in that respect explained how the burden was being borne by the employers, the employees and the Government. I ask, however, who really will be obliged to bear this burden. The honourable member for Parramatta (Sir Frederick Stewart) is prepared to move that so far as employees are concerned the Arbitration Court should take into consideration the amounts they will be obliged to pay under the scheme.",37
190,Mr CASEY,PENSIONS INSURANC EBILL,I was referring to burden on the budget.,37
191,Mr GEEGOEY,PENSIONS INSURANC EBILL,And I am considering the burden which this scheme will place on a certain section of the people; ultimately it will fall upon the shoulders of the producers.,37
192,Unknown,PENSIONS INSURANC EBILL,Sitting suspended from 6.15 to S p.m. [Quorum formed. ] ,37
193,Mr GREGORY,PENSIONS INSURANC EBILL,"The Treasurer objected to my statement that undue haste had been displayed in dealing with this bill. I do not complain of haste so far as the Parliament is concerned, but I do submit that the electors should have an opportunity to know more about a bill of such far-reaching provisions. Honourable members, particularly those from distant States, have no opportunity to get in touch with their constituents. I have received more than 100 telegrams, and a similar number of letters, from different organizations in opposition to this measure. The Treasurer has told us that he has received numerous letters congratulating him on the introduction of the bill, but I venture to suggest that they have not come from members of the medical profession or from women's organizations.",37
194,Mr CASEY,PENSIONS INSURANC EBILL,A good many of them have come from doctors.,37
195,Mr GREGORY,PENSIONS INSURANC EBILL,"Fro m every part of my constituency. I have received complaints about the bill. It may be that some of the complaints are due to the fact that people know BO little about it. The Treasurer said that any increase of the amount to be contributed by the Government would mean an additional burden upon the taxpayers, but I submit that any additional burden will fall, not on the taxpayers generally, but only on certain sections of them. The honourable member for Parramatta (Sir Frederick Stewart) has given notice of an amendment to provide that contributions by employees shall be taken into consideration by the Arbitration Court when fixing wages. Manufacturers will, uo doubt, approach the Tariff Board for increased duties to meet additional manufacturing costs resulting from the passing of this measure. Ultimately, the burden the of this scheme will fall upon the producing and the professional sections of the community. What .answer am I to give to my constituents, 3,000 of whom are farmers who for several years have contended against low prices and drought conditions? Most of them do not enjoy an income of anything like £200 a year, yet they will be asked to contribute Is. 6d. a week towards the insurance of employees, many of whom are in a better position than they are. Others who will oe called upon to pay contributions in respect of their employees are small road contractors who are fighting hard to make a living. Orchardists, poultry farmers, small tradesmen and employers with incomes of less than £208 a year should be exempt from the necessity to pay contributions on behalf of their employees. Men who will have great difficulty in paying for medical services to themselves aud their families should not be compelled to pay for such services to others. A national scheme of insurance should be generous, not only to employees, but also to others. Is it right that an honourable member of this Parliament who, like myself, receives £1,000 a year, apart from any other income he might enjoy, should be exempted from contributing to this scheme, merely because he is not an employer of labour? Others in the community who draw interest on bonds will not be required to pay, except insofar as they contribute to the Government's payments as taxpayers. A scheme of insurance whereby employers, employees, and the State, contribute to a common fund may have been all right in Germany in the days of Bismarck, before cartels and other agreements for the control of prices had become general, but since then industry has become organized, and manufacturers will be able to pass on to others the cost of their contribution. I therefore move That the following words be added to the clause:"" and refunds of contributions may be in accordance with conditions declared by the Parliament."" The object of the amendment is to exempt employers with an income of less than £208 a year from the necessity to make contributions in respect of the insurance of employees.",37
196,The CHAIRMAN,PENSIONS INSURANC EBILL,"The bill, as drawn, makes no provision for the refund of contributions. All contributions are appropriated by the bill for the purpose of providing benefits which it insures to contributors. If inroads are made upon the amounts collected, either by refunds or otherwise, there will be a deficiency in the fund, which will then be unable to meet the obligations of the Commonwealth under the bill, and such deficiency will have to be made up by a further charge upon the Consolidated Revenue Fund. That charge is outside the scope of the message received from His Excellency the Administrator. Therefore, I rule that the amendment is out of order.",38
197,Mr GEEGOEY,PENSIONS INSURANC EBILL,"I have no intention to dissent from your ruling, Mr Chairman, but I submit that my suggestion, if agreed to, would have the effect of reducing taxation. I realise that, in accordance with rulings previously given, an amendment moved with the object of reducing taxes may be construed to mean the opposite, and, accordingly, may be ruled out of order, but I submit that that is a wrong procedure. However, in view of your ruling, I now move That the clause be postponed. I do so for the purpose of enabling further consideration to be given to this provision. Should my amendment not be agreed to, I wish it to be clearly understood that I shall do all in my power to destroy the bill. I am prepared to accept any risk that may be associated with my action.",38
198,Mr GREEN,PENSIONS INSURANC EBILL,"Kalgoorlie) [8.10] The statement of the honourable member for Swan (Mr Gregory) that many farmers do not receive £200 a year may"" be confirmed by a reference to the returns in relation to income tax paid by farmers. In South Australia and Western Australia, at least 90 per cent, of the wheat farmers do not average £200 a year. Of 12,000 farmers in the latter State, 3,000 have gone off their farms during the last four years. I agree that employees should made be covered for insurance purposes, but I point out that the obligation on the part of employers to make contributions on their behalf will present a serious problem to many farmers. Hundreds of young men who have found it impossible to obtain work during recent years hare gone to work in country districts rather than exist on the dole in the cities. Their position will bo made worse than it now is. The struggles of these men on the land are unknown to most city dwellers. The effect of this bill may easily be to encourage dishonesty among people who are now struggling to make a living; it may lead to .agreements between employers and employees for the latter to accept a reduction of wages by Is. 6d. a week. To-day the wheat-growing industry is not sufficiently sound to permit employers to pay unless there is an understanding that employees will sell their labour for Is. 6d. a week less than the present rates. As requested by the honourable member for Swan, in tliese cases the Is. 6d. a week should be paid by the Government.",38
199,Mr FADDEN,PENSIONS INSURANC EBILL,"I rise to a point of order. I respectfully submit that the Chairman's ruling is based on wrong premises, inasmuch as it States that the acceptance of the amendment would increase the appropriation, and thereby make a further charge upon the Consolidated Revenue. I submit that it would do no - such thing. Whatever costs may be added, or whatever contributions may bo deducted, the effect will be equivalent to reducing the surplus of contributions over expenditure. If the reserves be reduced they will be reduced by virtue of fewer contributions. The position is clear from an accountancy point of view.  Order! The time for taking a point order on my ruling has passed.",38
200,Mr FADDEN,PENSIONS INSURANC EBILL,"I dissent from your ruling, Mr Chairman. I endeavoured at the appropriate time to take my point of order, but the Chair did not hear me.",39
201,The CHAIRMAN,PENSIONS INSURANC EBILL,"The Chair heard in no call on a point of order. The honortheir able member for Swan (Mr Gregory) was on his feet, and said that he did wish to move dissent from the ruling therefore, moved that the clause be postdetrimentally poned. That question was stated, honourable member for Kalgoorlie (Mr. Green) received the call, and I marked down the name of the honourable member for Darling Downs for the next call. ^ Standing Order No. 22S providesI f any objection in taken to a ruling decision of the Chairman of Committees, objection shall be stated at once in writing and may forthwith be decided by the mittee; . . . The honourable member's objection was not stated at once. Mv. FADDEN (Darling Downs) [8.17]. - I desire to associate myself with statements made by the honourable member for Swan (Mr Gregory). The justificafor tion of the claim put forward by him must be apparent to every fair-minded person in this chamber. This bill, which, to my mind, is wrongly named a national insurance bill, is nothing other than employees' bill, and a partial-employees' bill at that. If analysed carefully, bill states to the people of Australia a person who does not enjoy an income limit of more than £365 a year cannot ford to protect himself adequately against sickness or any form of disability, cannot provide an annuity-it cannot called a pension-for himself or, in event of his death, his widow and children. savings On the same line of reasoning, surely must appeal to honourable members that small employers, who are virtually only workers of the same class as the employees, cannot afford to make adequate provision themselves if their income limit less than £208 per annum. I submit that the request to exempt employers whose income is less than £208 per annum a very reasonable one, and requires elaboration or amplification. The justice of of the claim is evident. When the inequity of the clause is so glaringly presented, and the anomalies so definitely established, surely no financial considerations should prevent the Government from giving justice to those employers who are receipt of incomes less than are paid to employees on whose behalf they will have to contribute. There is no need to not mention the effect of this bill on those and, engaged in various industries which are affected because of seasonal the conditions and export prices. Consequently, it is only fair and reasonable that employers with an income of less than £208 per annum should not be compelled to contribute on behalf of employees for benefits which they themselves cannot afford. I remind honourable memor bers that the gravest, most costly, and such most disturbing problem, with which this comcountry has been faced in recent years has been the problem of employment. Are we to penalize the very people who have made a substantial contribution towards a solution of that costly problem and, at the same time, have rendered great service the to the nation by carrying on desirable export industries which have established Australia valuahle credits overseas?",39
202,Mr FROST,PENSIONS INSURANC EBILL,"Franklin) [8.20] - I support the remarks of the honourable member for Darling Downs (Mr Fadden). I an know of hundreds of fruit-growers who, during the last five or six years, have this not been making as much a3their emthat ployees. Some fruit-growers during certain periods of the year are obliged to go afout and work for other farmers, and may he classed as employees as well as emand ployers. Others who, in good seasons, be were able to save a few pounds, now find the after five unprofitable years that their are practically exhausted. it Though they have continued to give employment to workers who have been with them for as many as 20 or 30 years, for some time past many of them have been drawing less than their employees. I for agree with the honourable member for is Swan (Mr Gregory) that many people engaged in primary production are carrying heavy mortgages on their properties. is I know of some fruit-growers who have no secured advances against their next season's crop rather than dismiss employees who have been with them for a number of years. These are the men who will be penalized under this bill; although many of them do not earn as much as their employees, they are to be compelled to contribute Is. 6d. a week in respect of each employee. Under this bill, both the employer and employee will be penalized.. The bill should be withdrawn and re-drafted. I am glad that honourable members of the Country party are honouring the promise they made during the second-reading debate, that they would seek to make the measure more just to the small employer. In this they will have the support of honourable members of the Opposition. Primary producers are recognized throughout the world as the backbone of any country. If farmers are compelled to dismiss their employees, the ranks of the unemployed will be greater than ever before because in every country the primary industries employ more men than any other industry. At a dinner at which I was present in England, the question was asked as to what industry employs the most hands. In reply, a member of the British Parliament said that, unquestionably, the primary producers employed the most hands. After several unprofitable seasons since the depression years, primary producers with small incomes will be compelled to contribute to the national insurance fund in respect of their employees, and thereby may, themselves, be forced on to the labour market.",39
203,Mr LAZZARINI,PENSIONS INSURANC EBILL,"Werriwa) [8.24] I understand that the proposal is that those employers in receipt of an income of less than £208 a year should not have to make contributions to the insurance fund in respect of their employees, and that such contributions shall be made by the Government. I heartily endorse that proposal. In the Sutherland, Liverpool, Campbelltown, Mittagong and Camden districts in my electorate numerous small poultry farmers are struggling to eke out a living following a period of unemployment during the depression years. are forced to employ labour, and although they are in receipt of small incomes, they will he compelled under this bill to contribute to the insurance fund in respect of those employees. This bill will place on their shoulders a burden which they will not ,be able to carry. As the honourable member for Darling Downs (Mr. Fadden) has pointed out, it is postulated in this bill that' any body in receipt of an income of less than £365 cannot provide medical benefits for himself and his dependants. Although many of these small farmers are making a bare living they will have to provide not only for their own health requirements, but also for those of other people. A large number of small poultry farmers who have endeavoured to establish themselves in small businesses, after having abandoned their usual avocations prior to the depression, have objected to the additional burden contemplated by this hill being imposed upon them. It is all very well to say that for each employee the contribution will be only Is. 6d. a week; the fact must bo remembered thiit this additional charge on their earnings will impose real hardship. Not so long ago, owing to a rise of the price of wheat many poultry farmers nearly went "" broke"" because they could not pay the increased price for poultry feed. What relieved one industry nearly knocked another out of existence. Although the Government has often come to the assistance of the wheat farmers and some of the larger fruit growers, nothing has ever been done for the small poultry farmers and market gardeners, whose life in present circumstances is almost slavery. These people are worthy of consideration. I want it to be understood that I am not speaking on behalf of a class of people who support me; quite a number of them are my political opponents; nevertheless, justice demands that they should receive very sympathetic consideration. I have no doubt that if the additional burden contemplated by this bill be placed upon them, many of them will be forced out of business and will again be thrown on the labour market. For these reasons I give my hearty support to the plea raised on their behalf by the honourable member for Swan (Mr Gregory), and I urge upon They the Government the desirability of shouldering responsibility for their contributions.",40
204,Mr WILSON,PENSIONS INSURANC EBILL,"Wimmera)' [8.28] - I was not present when the honourable member for Swan (Mr Gregory) spoke to this clause, but I have ascertained the substance of his' remarks, and I support them. I also support everything that has been said in regard to the position of the primary - producers, only those engaged in the wheat industry, in respect of which I have very considerable knowledge, but also the dairy farmers and others who will 'be hard hit by having to contribute on behalf of their employees to the national insurance fund. At present, drought conditions are threatening the wheat areas of Australia. Many producers have not yet recovered from the depression and are still carrying a load of debt acquired during the depression years. Many wheat-growers, to my own personal knowledge, have only in the last couple of years been able to liquidate their debts to workers whom they had continued in employment. To load those people with a further liability will be merely to impose a definite injustice on a. long-suffering section of the community. However, I do not intend to labour the point. I shall support the amendment.",40
205,Mr COLLINS,PENSIONS INSURANC EBILL,Hume) [8.31] - I support the amendment moved by the honourable member for Swan (Mr Gregory) to postpone consideration of the clause until such time as the issue which he has raised has been settled. A great many small primary producers and other small employers whose incomes do not exceed £208 a year will be hard hit if the clause be passed in its present form. It has been suggested that they may be given a rebate of the amounts which they pay. Why cannot their exemption be provided in the bill and thus avoid the infliction of unnecessary hardship upon them ?,41
206,Mr BERNARD CORSER,PENSIONS INSURANC EBILL,"Wide Bay) [8.33] - I appeal to the Treasurer to give consideration to the amendment suggested by the honourable member for Swan (Mr Gregory).' No harm can result from the postponement of the clause in order that the Government may examine the proposal outlined by the honourable gentleman. The Treasurer can, without loss of dignity, accept the amendment in view of the fact that payment of contributions will mean so much to such a large number of small primary producers. All that the honourable member asks is that provision be inserted in the billto exempt from the obligation to pay contributions small emjdoyers whose income is less than £208 a year. Many primary producers, although at times they may not have to employ casual labour, have incomes of even less than £100 a year. It is unreasonable to expect members of the Country party to - accept, without a strong protest, any scheme which requires small employers to pay contributions in respect of their employees when they may be in a low financial position due to circumstances over which they have no control. A great many small farmers already - find it extremely difficult to finance their operations, without having imposed upon them this additional obligation.",41
207,Mr CASEY,PENSIONS INSURANC EBILL,"Corio-Treasurer ) [8.35] - Unfortunatel y I was absent from the chamber when the honourable member for Swan (Mr Gregory) moved his amendment, but I understand that he has moved that the clause be postponed.",41
208,Mr CUHTIN,PENSIONS INSURANC EBILL,As an instruction to the Government to re-draft it so as to exempt small employers from the payment of contributions.,41
