speakerGroups,Speaker,Title,text,pageNumbers
87,Mr BLACKBURN,PENSIONS INSURANC EBILL,"Bourke) [4.23] I would not have put this point forward had I thought it had.no substance. I did not take objection merely to the Government's drafting of the clause. I repeat that I am not satisfied that the clause, as drafted, does cover the case of the perin his note. son enjoying a free insurance period. I very much doubted whether the clause was intended to cover such a person. The only reason I say this, is because of the obdurate attitude taken up by the Treasurer (Mr Casey) as to the draftsmanship of the clause. I suggested that the clause should be so drafted as to make clear beyond any possible doubt that a married woman leaving industry on marriage shall enjoy a fr.ee insurance period. It will not be for the Treasurer, for me, or for the Parliamentary Draftsman, to interpret this measure; it will have to be interpreted, by the commission, and, possibly, by the courts. Eor that reason, the clause should make it perfectly clear beyond the slightest possible doubt, that a person who is not insured solely by reason of unemployment, but by reason of having a free insurance period, shall be entitled to benefit. It seems to me highly doubtful-and I could' put it stronger than that-whethe r this clause does cover the case of a person enjoying; a free insurance period. There is nothing: at all in this measure to' suggest that a married woman, upon leaving employment for marriage, is to get a free in surance period. To say that a person, ceases to be employed merely because shemarries and gives up her work seems tome a most unnatural construction to heplaced on the words "" ceased to be employed "". The words of the clause should, be made perfectly clear. I can see no reason, except, perhaps, egotism on the part of the Treasurer, for his refusal toaccept my suggestion. I , myself, did not propose an amendment of the clause; I merely suggested that it might be desirable that it be amended. I am not concerned whether it is amended or not because I do not think the bill will give the benefits proposed; but if the Treasurer wants to make people believe that he intends to give this benefit to married women, he should lose no opportunity to make the wording of the clause perfectly clear.",24
88,Mr CASEY,PENSIONS INSURANC EBILL,Corio - Treasurer) [4.26] - The words of the clause are those which the Parliamentary Draftsman regards as most appropriate to carry out this particular purpose..,24
89,Mr BLACKBURN,PENSIONS INSURANC EBILL,He does not say that,24
90,Mr CASEY,PENSIONS INSURANC EBILL,"He says that a free insurance period is attributable to some prior insurable employment and to contributions paid during a period specified in the bill, and that a person who enjoys a free insurance period is, during that period, insured by virtue of insurable employment. That is perfectly relevant to the words used in the clause which were designed for that particular purpose.",24
91,Mr BLACKBURN,PENSIONS INSURANC EBILL,He does not say that in the note.,24
92,Mr CASEY,PENSIONS INSURANC EBILL,"The words of his note are: "" L f it were intended to apply to those actually engaged in employment, the clause would have been differently worded."" The clause as it stands is perfectly clear.",24
93,Mr BEASLEY,PENSIONS INSURANC EBILL,"""West Sydney) [4.28]. - Jus t to carry that point a little further, it means, in fact, that a married woman, after her marriage, can enter a free insurance period for an average of 23 months, with a maximum of two years, so that every woman who marries passes on to a period of free insurance with all benefits.",24
94,Mr CASEY,PENSIONS INSURANC EBILL,"The same as any other person who ceases employment, no more and no less.",25
95,Mr BEASLEY,PENSIONS INSURANC EBILL,"Every married woman, irrespective of the circumstances, who had contributed for 26 weeks prior to her marriage, is entitled to free insurance with all benefits. In that respect, she is entitled to the same benefits as a male, though, in the case of a male, the receipt of benefits arises mainly as the result of unemployment. In the case of the female, benefits will become payable because of her marriage.",25
96,Mr CASEY,PENSIONS INSURANC EBILL,"Marriag e is an incident that ceases a woman's insurable employment. That is not different from any other incident that may cease insurable employment. A ll that I said the other day about the free insurance period applies to the woman the same as it does to the man. I take exception to the use of the words "" irrespective of the circumstances "" used by the honourable member.",25
97,Mr BEASLEY,PENSIONS INSURANC EBILL,"I qualified that by saying that a free insurance period would accrue after 26 weekly contributions had been made prior to marriage. If an insured person, either male or female, makes contributions for 26 weeks, such a person is entitled to benefit. MT. CASEY - That is in accordance with clauses 20 and 21.",25
98,Mr BEASLEY,PENSIONS INSURANC EBILL,"In the case of the male, benefits would accrue as the result of unemployment; in the case of the female, it might be unemployment, but it would be largely because of marriage. That means, then, that after marriage, every woman who, as an employee, had made not fewer than 26 contributions to the fund, would be entitled to a free insurance period and all the benefits of the scheme.",25
99,Mr CASEY,PENSIONS INSURANC EBILL,In accordance with the provisions of clauses 20 and 21.,25
100,Mr BEASLEY,PENSIONS INSURANC EBILL,"Why does the Treasurer try to involve the issue ? It is most desirable that the point which has been raised should be settled beyond all doubt. This scheme will affect, at the outset, 1,850,000 people, so its provisions should be stated in the plainest language, and free of all legal ambiguities. May we understand that after her marriage a female employee who, as an employee, had made 26 contributions, would be entitled to the.free insurance period and all the benefits of the scheme?",25
101,Mr CASEY,PENSIONS INSURANC EBILL,I really cannot say more than I have said on previous occasions.,25
102,Mr MAHONEY,PENSIONS INSURANC EBILL,"Denison) [4.33] - As I understand the position, from the statement of the Treasurer (Mr Casey), a female contributor to the fund will not be entitled to the medical benefit following her marriage.",25
103,Mr CASEY,PENSIONS INSURANC EBILL,I was referring to the sickness benefit.,25
104,Mr MAHONEY,PENSIONS INSURANC EBILL,"Then a female contributor, upon marriage, will get no benefits under this scheme?",25
105,Mr CASEY,PENSIONS INSURANC EBILL,The honourable gentleman is ignoring everything that I have said with reference to the free insurance period.,25
106,Mr MAHONEY,PENSIONS INSURANC EBILL,"I do not think it is possible for the Treasurer to give a clear interpretation of this clause. He cited the practice of lodges and then told us that this bill would not take away from married women any of their privileges under the scheme although he said he would be willing to reduce the insurance period for special voluntary contributors from five years to four years. A female contributor, when she marries, should be entitled to all the benefits which she would receive under' this scheme if she remained single. The Treasurer is somewhat non-committal about the effect of this clause. He simply says that it will not take from married women rights to which they are entitled under clauses 20 and 21. We should not do anything to discourage women from getting married. Under this scheme female employees will pay contributions from the time they become employed-say , sixteen or seventeen years of age-until the time of their marriage. They will then cease to be employed persons. According to the Treasurer, they will then enter the free insurance period, arid, under this clause, they may become special voluntary contributors for the old-age pension only. It is not fair to require female employees to contribute to the fund for so many years and then withold from them any benefits which they might enjoy by remaining single.  This clause is undesirable from its probable impact, not only on the scheme, but also upon our vital statistics. Recently the former Minister for External Affairs (Mr Hughes) was so much concerned about the declining birth rate that he coined the slogan for Australians"" Populate or perish This Government is giving financial assistance to various organizations to bring child migrants from Great Britain to Australia, yet in this clause it imposes an injustice on female contributors who, following their marriage, may desire to become voluntary contributors to the scheme. Since women are entering industry at a much later age than formerly, it is reasonable to assume that proposals of marriage are made at a correspondingly later age. This clause is a distinct inducement for women to remain in industry instead of marrying. Por economic and other reasons it is desirable that the women of this country should be encouraged to marry as early as possible. The Treasurer (Mr Casey) should make the insurance period, not five years, but three months, in order, possibly, to reduce .the cost ' of assisted migration, and to help in other ways to improve the position in regard to our vital statistics. When women remain in industry longer than necessary they unduly deprive men of employment. That is another factor which should be considered by the Treasurer. He referred to the scheme generally as big and brave, and he feared that its repercussions 'might be such that Australia could not carry the financial burden that it would impose; but I ask him to remember that this country produces sufficient foodstuffs and clothing to meet the needs of all of the people, and'that there is a large surplus for export. Every year large numbers of young men become qualified as doctors. Therefore, it appears to me that the problem is not one of avoiding an undesirable impact on the public finances, but one of framing such a measure as will enable those who have more than sufficient of the good things of life to help the section which has too little.",25
107,Mr HOLLOWAY,PENSIONS INSURANC EBILL,"Melbourne Ports) [4.43] - In refusing to accept the amendment submitted by the member for West Sydney (Mr Beasley), the Treasurer (Mr Casey) has shown clearly that he has determined not to receive suggestions from the Opposition. Apparently there is no hope of a helpful discussion of the measure, and its passage without recourse to the steps to which reference has been made, unless the Treasurer takes honourable members on both sides into his confidence. I protest against the Government making promises to the members of its own caucus when particulars of those undertakings have not been made known to the Opposition.",26
108,The TEMPORARY CHAIRMAN,PENSIONS INSURANC EBILL, The honourable member should confine his remarks to the question before the Chair.,26
109,Mr HOLLOWAY,PENSIONS INSURANC EBILL,- I protest against the failure of the Treasurer to take all parties into his confidence in connection with this bill. He recently referred to other measures which the Government contemplated.,26
110,Mr CASEY,PENSIONS INSURANC EBILL,As announced hy the Prime Minister.,26
111,Mr HOLLOWAY,PENSIONS INSURANC EBILL,"The Treasurer will not tell the Opposition what he proposes to do to bridge the gaps in the bill to which attention has been drawn by the Opposition, but he suggests that other measures will be introduced later. Members of the Country party and of the United Australia party have said that they are quite satisfied that the Government intends to meet their objections to the bill by bringing down a further measure.",26
112,Mr CASEY,PENSIONS INSURANC EBILL,Wit h regard to selfemployed persons.,26
113,Mr HOLLOWAY,PENSIONS INSURANC EBILL,I suggest to those members who have put up a fight on behalf of small farmers and shopkeepers,26
114,The TEMPORARY CHAIRMAN,PENSIONS INSURANC EBILL,The honourable member must connect his remarks with the clause under discussion.,26
115,Mr HOLLOWAY,PENSIONS INSURANC EBILL,"How can we accept the promise of the Treasurer, meagre as it is, that a new measure, which is to be introduced later, will meet the situation contemplated by the honourable member for West Sydney.",26
116,Mr CASEY,PENSIONS INSURANC EBILL,I said nothing of the kind.,27
117,Mr HOLLOWAY,PENSIONS INSURANC EBILL,"It was suggested by some members that the Government intended to bring down further measures to deal with women and children. First of all, we protest that the wives and children of insured persons would not receive medical attention under the bill as it stands. The Treasurer, I think, said on one occasion that this omission would be remedied by a later bill, but, whatever he may have said in other places, he has given the committee no indication of the scope of the supplementary measures. Almost his last remark was that he doubted whether the country would be able to meet the cost of the scheme now before the committee.",27
118,Mr CASEY,PENSIONS INSURANC EBILL,"The honourable member does not usually distort what I say, I do not suggest that he is intentionally doing so now.",27
119,The TEMPORARY CHAIRMAN,PENSIONS INSURANC EBILL,i again urge the honourable member for Melbourne Ports to connect his remarks with the clause.,27
120,Mr HOLLOWAY,PENSIONS INSURANC EBILL,My sole object to help the Treasurer to secure the sage of this legislation. A good deal of time would be saved if the Treasurer would inform the committee whether the Government proposes to introduce and supplcmientaryi legislation covering matters regarding which the Opposition has drafted amendments.,27
121,Mr CASEY,PENSIONS INSURANC EBILL,"Corio-Treasurer [4.50] - I must protest against what honourable member for Melbourne Ports (Mr Holloway) has said. No member, of any party knows more than the Prime Minister (Mr Lyons) has already stated in respect of proposed provision for the wives and dependants of insured persons. The sneering reference to caucus meetshould ings is as uncalled for as it is No caucus meetings are held by honourable members on this side of the chamber.",27
122,Mr HOLLOWAY,PENSIONS INSURANC EBILL,I did not sneer. Opposition holds caucus meetings.,27
123,Mr CASEY,PENSIONS INSURANC EBILL,"But we on this side not. You were good enough, Mr Chairdeserve man, to allow the honourable member for Melbourne Ports a little latitude, and, perhaps, I may be permitted *- reply to some of his remarks.",27
124,The TEMPORARY CHAIRMAN,PENSIONS INSURANC EBILL,-I cannot allow the Treasurer any more latitude than is. provided for by the Standing Orders.,27
125,Mr CASEY,PENSIONS INSURANC EBILL,"The statement has been made by the Prime Minister that the Government will, after due consideration, give financial assistance to such approved societies as provide for medical benefits, in order to enable persons insured under this compulsory scheme to have their wives and families covered in respect of medical benefits. That is all that has been announced. No member of any party has more specific information than that. The Government will, after making proper investigations, embody a provision of that kind in some future, and I hope not very long delayed, bill.",27
126,Mr CLARK,PENSIONS INSURANC EBILL,"Darling) [4.52] - The and clause provides that women who marry will not be entitled to remain contributors unless they have been insured for five years before their marriage. I take - it that the point which the honourable member for West Sydney (Mr Beasley; wished to clear up was whether the free is insurance period of 21 months would pasapply to' women who married and tad not been insured for five years previously. Apart from this clause, if a woman or a man had made 26 weeks' contributions, had become unemployed, she or he would be entitled to sickness benefit. the The point that needs to be cleared up is whether a woman who marries, and has been previously insured during a ) period of 26 weeks, is definitely covered the for the period of 21 months after marriage, whether she is in the same position as a man who has ceased to be insured for any other reason. If the Treasurer would accept the amendment, or postpone the clause to enable it to bp re-drafted as desired by the Opposition, I think that the requirements of the irrelevant. committee would be met.",27
127,Mr FORDE,PENSIONS INSURANC EBILL,"Capricornia) [4.55] The purpose of the amendment of the The honourable member for West Sydney (Mr. Beasley) is to ensure the liberalizing of do the provisions of the clause. Women every consideration from honourable members on both sides of the committee. Notwithstanding the statement of the Treasurer (Mr Oasey) that women will get more out of this fund than they will, pay in, honourable members on this side of the committee hold a different view. The Treasurer said that two or three months ago he had made certain calculations on this point,, but he was not able, at the moment, to give the exact figures. We question the accuracy of the honourable gentleman's calculations. Surely it should not be difficult to place before us figures which he has prepared so recently, particularly as he has statistical assistance at his elbow. The honourable member for West Sydney referred to ""the actuary's on the financial provisions of the bill, but his comments in this connection were very lightly brushed aside by the Treasurer. In these circumstances I am entitled to ask for some more convincing information than the Treasurer has yet made available. The view of the Opposition is that many of the provisions of this measure discriminate unfairlyagainst women. It cannot be denied that the British act is more generous in this respect. justice has undoubtedly been disregarded by the Government. Even at this late stage. I urge the Treasurer to give more serious consideration than he seems disposed to do to the contentions of the honourable member for West Sydney and the honourable member for Bourke (Mr. Blackburn). I direct attention to section 11 of the Widows, Orphans and Old-age Pensions Contributory Act 1936, of Great Britain, which provides that women who reach 70 years of age shall be entitled to a pension at the rate of 10s. without submitting to a means test. Moreover, that pension is not dependent upon conditions of residence or nationality. shows clearly that the British outlook is more liberal than that of this Government, for the nationality and residence tests in relation to the granting of old age pensions in Australia are very strict. A foreigner must have resided in Australia for twenty years to become entitled to a pension under our existing legislation. The honourable member for West Sydney and other members on this side have made out such a very good case in this respect that I shall not pursue the matter further. The Treasurer has enllr. Forde. tirely ignored the claim of honourable members on this side of the committee for more consideration for women who leave their employment upon marriage. No surrender value whatever has been stipulated in respect of the payments of such persons for the periods during which they are employed. We contend that that point should be equitably met. The honourable member for Bourke has a just grievance in respect of the ambiguous language of some clauses of the bill. We feel that the intentions of the Government should be stated so clearly that all interested parties could easily understand report them. The real meaning of this clause, as of other clauses of the bill, should be put beyond all doubt. I trust, therefore, that consideration of the clause will be postponed so that a re-draft may be submitted to us.",27
128,Mr LAZZARINI,PENSIONS INSURANC EBILL,"Werriwa) [5.1] The case submitted to the Treasurer (Mr. Casey) by the honourable member for Bourke (Mr Blackburn) deserves a. better answer than it has yetreceived. The Sex Treasurer says that he is quite satisfied with his understanding of the position, but the points at issue will be determined ultimately by legal minds. The honourable member for Bourke is a legal practitioner and the Treasurer is not. We have, therefore, to take care that as little room as possible is left for difference of opinion by lawyers on this subject.",28
129,Mr BRBSTNAH,PENSIONS INSURANC EBILL,"Lawyer s and then judges disagree. The matter may go to the Privy Council. During all this time married women are, apparently, to be left waiting for a clear statement of their position. This Mr Lazzarini - Every time an honourable member on this side of the committee suggests the widening of any of the provisions of this bill, the Treasurer' or some other representative of the Government replies that another bill will be introduced at a later date to cover the point at issue; but the injustices inflicted upon married women under this clause, for example, cannot be remedied by bills unrelated to this subject. Parliament should deal with the position now and not at some later date. Undoubtedly if this clause is passed as it is, the contributions of tens of thousands - of married women to the national insurance fund will be confiscated. Mr BAKER,-That is how the Government proposes to keep the fund solvent.",28
130,Mr LAZZARINI,PENSIONS INSURANC EBILL,"The honourable member for Darling (Mr Clark) pointed out that fact very clearly. It seems to me that the Government is seeking to enact in this bill some of the worse features of old time insurance before the insurance companies were compelled to .set a surrender value on policies. The Treasurer is looking to confiscated contributions under this scheme-and I call it a "" scheme "" deliberately-to keep the fund solvent, and many such contributions will come from women before marriage. We have been told that women will receive greater benefits than men under this bill, but that remark must be applied strictly to women before marriage. Undoubtedly women contributors will lose the advantage of their contributions if they marry. If the Treasurer insists on the committee passing this clause without amendment, tens of thousands of pounds contributed hy unmarried women will be forfeited by them, and they can ill afford to lose the money. Beference has been made to women who marry at the age of 21 or 22 years, but what about women who marry at any age up to 28 years? The more this clause is examined, the more apparent it becomes that its main purpose is to provide money to keep the fund solvent. It is,, in fact, a back door way to financial stability. For this reason, I strongly support the amendment. If the Treasurer has any real desire to combat the charge that one of the principal purposes of this measure is to relieve the Commonwealth Treasury of the liability to pay invalid and old-age pensions, he will accept the amendment. the honourable member for Watson (Mr Jennings) contended that a surrender value should be fixed in respect of contributions of insured females who subsequently married, I ask him to support the amendment in order that justice may be done to women subscribers. I can see no possibility of the complaints that honourable members on this side of the committee are making in respect of female subscribers being remedied by the introduction of some other bill. The contention that women subscribers will reap greater benefits than male subscribers from this scheme, and, in fact, greater benefits than they are really entitled to receive, is eyewash and hocus-pocus. The basis of this clause is wrong. Honourable members who hold the view that more equitable treatment should be accorded to women subscribers should support the amendment.",29
131,Mr FROST,PENSIONS INSURANC EBILL,"Franklin) [5.6] - I support the amendment. The clause as drafted is undoubtedly disadvantageous to female subscribers. The Government should do everything possible to encourage women to marry. If this clause is passed without amendment, it, will discourage them from doing so. It is apparent from even a casual reading of the clause that any woman subscriber who marries between 1939, when the bill is expected to come into operation, and 194*4 will be at a great disadvantage, for all her subscriptions will be confiscated. Obviously unmarried women may pay into the fund for periods varying from a few months to four years and eleven months and still forfeit all their payments. That is entirely unjust. This discussion has brought from the Treasurer (Mr Casey) at least one new statement. In replying to the speech of the honourable member for Wakefield (Mr Hawker), the honourable gentleman admitted that a profit would be made out of the contribution of Is. a week by females. Mr Casey,-Oh , no!",29
132,Mr FROST,PENSIONS INSURANC EBILL,"If a profit will be made out of the contribution of Is. a week by females, clearly a greater profit will be made out of the contributions of Is. 6d. a week by males, and also out of the emAs ployers' _ contributions. I am becoming more convinced than ever that the purpose of this measure is to relieve the Treasury of part of its responsibility to pay invalid and old-age pensions. The Government is seeking to compel the workers to contribute towards the pensions they expect to receive in their old age. I notice that the benches on the Government side of the chamber are very bare. I suppose this is the result of decisions of caucus this morning. Mr LANE.*-We do not hold caucus meetings.",29
133,Mr CASEY,PENSIONS INSURANC EBILL,We had no party meeting this morning.,30
