speakerGroups,Speaker,Title,text,pageNumbers
0,NA,Unknown,"Tuesday, 22 April 1969",13
1,Mr SPEAKER,Unknown,"Hon. W. J. Aston) took the chair at 2.30 p.m., and read prayers. NA Export of Merino Sheep Mr MUNRO presented from certain electors of Ihe Division of Eden-Monaro a petition showing that the decision of the Government to lift the 40-year old ban on the export of merino rams will do irreparable harm to the present and future merino wool industry of Australia; that the initial quota of 300 rams will be sufficient to make any future protest worthless; and that the production of fine medium quality merino wool in cheap labour countries will put the Australian merino wool grower and all connected wilh this industry out of business. The petitioners pray that the Government will cause to be held a referendum of wool growers to determine this issue. Petition received. Education Mr HAYDEN presented from certain citizens of Australia a petition showing that there is a crisis in education in Australia; that a transformation of the classroom situation is necessary, where children will have reasonable freedom to develop as self reliant, independent individuals and where they can learn to function as members of a democratic community; that proper preparation for school and thorough guidance there by qualified teachers are crucial to a proper education for Australia's children; that the present rate of teacher training is far below the requirement determined by the Martin Report which shows that 75% additional teachers in government schools alone will be required by 197S compared with those in service in 1963; that to obtain maximum benefit from the education system preschool facilities should be available to all children; that insufficient State or Federal assistance bas been made available to meet these requirements; that adequatefinanceto meet these requirements can only be provided by the Commonwealth Government; that there is an urgent need for a national inquiry into all aspects of Australian education. 13861/69-R-f49 ) The petitioners pray that the House of Representatives in Parliament assembled will give earnest consideration, during Human Rights Year, to this most vital matter. Petition received and read. NA",13
2,Mr BARNARD,ABOLITION OF MEANS TEST,"My question is directed to the Prime Minister. I refer the right honourable gentleman to his statement in this House on 20th March during the debale on poverty. Does the right honourable gentleman recall describing the undertaking by the Australian Labor Party to abolish the means test as 'inane'? Does he recall saying that the abolition of the means test would not assist to relieve poverty where the need really lies? Did the Minister for Social Services support him by describing the proposal as 'fatuous'? Has the right honourable gentleman seen the heavy vote polled in the Curtin by-election by a candidate supporting the abolition of the means test? If so, does he still think that the abolition of the means test would be 'inane* and 'fatuous'?",13
3,Mr GORTON,ABOLITION OF MEANS TEST,"I have noticed ihe vote referred to by the Deputy Leader of the Opposition but I think it must be accepted, even by him, that the abolition of the means test would not be directing governmental taxation assistance to the greatest areas of poverty, and this is what was stated at the time. NA",13
4,Sir JOHN CRAMER,DEFENCE LANDS IN SYDNEY,"The Minister for Defence will recall that recently 1 asked him a question in connection with the proposal to release certain lands held by the defence departments in Sydney, particularly at South Head, for the purpose of public recreation. In view of the statement' made by the New South Wales Minister for Lands that he intends to create a national park, which if it i.s to be effective must obviously include defence land on the Sydney headlands, will the Minister for Defence inform the House what definite decisions have been made about this matter?",13
5,Mr FAIRHALL,DEFENCE LANDS IN SYDNEY,"I think that the House and the people of Australia generally will very much appreciate the fact that the New South Wales Government has decided to preserve what remains of the public heritage in relatively unencumbered land on the foreshores of Sydney Harbour. I have noted the proposal to set aside a 1,300-acre Sydney Harbour national park. I have noted also with a bit of interest that no less than 1,000 of those 1,300 acres are sought as a contribution by the Commonwealth. The Commonwealth Government has never been disinterested in either this proposal or any steps it might take to assist this grand design. Indeed, it has re-arranged the proposals for the land at South Head. We have decided to move the Department of the Army installation from that area, thus providing 33 acres there for use by the Stale. It should be recalled that the balance of this harbourside land is really functional to the purposes of the Department of the Navy, at least for the time being. As the Minister for Lands knows very well, the Commonwealth Government has had the North Head area under study for some time to see what disposition of the land might be made to assist the State. More recently the Commonwealth Government has sold to the State six parcels of land at a valuation satisfactory to it. The whole of the defence lands in New South Wales are under consideration at the present time. This indicates that the Commonwealth is co-operating as best it can wilh the State, but it must not be expected that these lands will be made available in the immediate future. I draw attention to the tact that such lands as the State itself held around the Sydney Harbour foreshores have been alienated and if it were not for the fact that the Department of Defence had held these other lands for so long there would be no chance whatsoever of the State Government establishing a national park that area. The Commonwealth will cohe operate to the best of its ability in bringing to fruition the grand design of the South Wales Government. SERVICEMEN'S LEGAL OBLIGATIONS",13
6,Mr GRIFFITHS,DEFENCE LANDS IN SYDNEY,"I ask the Minister for the Army whether all Australian Army Service Corps men, including national servicemen, are liable to meet the cost of their own defence, including travelling and legal expenses, if involved in police traffic offences while on duty. If so, are servicemen made aware of this prior to taking up duty? Is it a fact that recently a New South Wales national serviceman who was sent to Queensland to do his service was involved in a traffic accident in that State and, although exonerated from blame by the Army was refused financial assistance to return to Queensland to defend a police traffic prosecution arising from the accident? As the case is still before the court will the Minister review his earlier decision not to provide assistance to this soldier? Alternatively, will he tell the Parliament why it was not ensured that the case would be disposed of while the soldier was still serving in Queensland?",14
7,Mr LYNCH,DEFENCE LANDS IN SYDNEY,"I could not quite hear the full question posed by the honourable gentleman, but 1 caught the major part of it. The circumstances to which he draws attention are largely true. The matter has been very fully considered and there is no intention on my part toreview the case. I point out to the honourable gentleman that, as a matter of general policy, any soldier involved in a case in a civil jurisdiction bears the cost of and takes the responsibility for arranging his own defence, except where a matter of litigious Commonwealth interest per se is involved. This is a question of policy. NA",14
8,Mr GRAHAM,NATIONAL DEVELOPMENT,"1 address my question to the Minister for National Development. I refer to recent announcements of major new mineral developments, particularly to reports that a contract is about to be signed for huge iron ore exports from the Robe River area of Western Australia. 1 also refer into the Treasurer's reported statement that expects the gross national product to rise by a record amount this year. Can the New Minister indicate the extent to which mineral developments are contributing to the nation's growth rate?",14
9,Mr FAIRBAIRN,NATIONAL DEVELOPMENT,"So far no contract has been signed for the Robe River project, to which the honourable member refers, although [ understand from both the head of the company concerned and the Western Australian Minister for Industrial Development that they are hopeful that a contract will be signed in the very near future. If a contract is signed, I believe it will be one of the largest contracts ever signed for mineral exports; it will be of the order of SI,200m. However, I stress that not only has the contract not been signed but it has not been considered by the Commonwealth Government, which wiU have to decide whether to give authority to export after it reviews all the factors associated with the contract. The honourable member asked what contribution minerals are making to the nation's growth. Mineral developments have increased enormously in recent years. My Department regularly issues projections of mineral exports and in fact has produced one which I hope to issue very shortly. It shows that in the year 1970-71 Australia for the first time will have mineral exports in excess of Si,000m per annum. This is 3 years earlier than was shown by a previous projection which was made only 10 months before this projection was made. In addition, at (hat time there will be a quite considerable saving to national funds by replacement of oil imports, which will be running at about $130m per annum then. In fact, if we take the 6-year period from 1966-67 we believe that the increased contribution of minerals to export income, either by way of exports or of replacement of imports, will exceed $ 1,000m per annum in that period. NA",14
10,Mr CURTJN,CONSCRIPTION,"My question is directed to the Prime Minister. Can he advise the House whether reports are correct that he agreed with President Nixon on his recent visit to the United States to repeal the National Service Act and so bring Australia into line with the policy of the United States Government recently announced by President Nixon, which is no conscription for overseas service?",15
11,Mr GORTON,CONSCRIPTION,"If there are such reports, thcy are incorrect. NA",15
12,Mr CORBETT,GOVERNMENT EMPLOYMENT,"I ask the Prime Minister whether his attention has been drawn to article attributed to Dr. J. F. former Chairman of the Federal Valuation Board, when speaking to the Pan Pacific Congress of Real Estate Valuers and careful Appraisers. Dr Murray stated that the major capital cities in Australia were suffering from a proliferation of governin ment employees and that the advantages removing departments to country towns would be very great. Can the Prime Minister advise the House whether the Government is considering this form of decentralisation with its attendant advantages to country towns and the nation generally?",15
13,Mr GORTON,GOVERNMENT EMPLOYMENT,"I think perhaps the first point 1 ought to make relating to the article is that it refers to government employees and is not to be taken as referring to Commonwealth Government employees but rather to Commonwealth, State and municipal employees. At least that is the way in which I would interpret it. The honourable member will also know that there has been a considerable programme of decentralisation-and that is all it can be called-in the transfer of Commonwealth Government employees from the main cities of Australia to Canberra. It is often suggested that building houses for Commonwealth Government employees in Canberra is a waste whereas clearly if they were not built here they would need to be built, or occupied, in some other major city. In relation to other matters, the Post Office clearly does decentralise as far as it is possible for it to do so, and so do various other departments. As an instance of that, 1 would remind the honourable member of the construction of the Army camp at Townsville, which was in itself a measure of decentralisation in that the soldiers and all the administrative facilities connected with them were required to move to a country town. Clearly where it is possible with advantage for this to happen it is a good thing for it to happen. NA",15
14,Mr NICHOLLS,INFLUENZA VACCINE,"My question is directed to the Minister for Health. In view of the chaotic confusion that exists in all States, and particularly in South Australia, in regard to the inadequate supplies of Hong Kong 'flu vaccine will the Minister give consideration to importing sufficient an supplies of the vaccine to alleviate this N. Murray, a serious situation?",15
15,Dr FORBES,INFLUENZA VACCINE,"My department has made inquiries about the possibility of importing influenza vaccine. The only vaccine that is available to be imported has fact been imported, and that was only of 150,000 doses. The honourable gentleman talks critically about the situation in relation to 'flu vaccine. 1 think I should just make the point to him and to the House that ""flu vacine is almost unique as a pharmaceutical product. Unlike other pharmaceutical products it cannot be stockpiled because the situation in relation to it can never be clear in Australia until January or February. Not only is it not clear how much will be required-whethe r or not there is likely to be an epidemic-bu t also it is not until that time of the year that sufficient information is available as to what the cocktail is lo have in it, in other words, what strain of virus the vaccine will have to counter. All 1 want to say is that in this situation inevitably there will be temporary shortages at some distribution points. Some chemists and some doctors will experience temporary shortages and there will be shortages at other points where drugs and medicaments of this sort are normally available. Since the Commonwealth Serum Laboratories Commission has received a good deal of abuse in relation to this matter, let me say that never before-despit e the fact that 'flu vaccine has been on the market for many years-ha s the demand in Australia for 'flu vaccine exceeded 500,000 doses. The Laboratories have produced, since the February dateline of which I have been speaking-the y were unable to produce earlier to meet the situation in Australia-2. 5 million doses and they expect to have produced 4 million doses by the end of May. Under an Act of Parliament the Commonwealth Serum conducts Laboratories Commission has complete independence in this matter. I have requested the Laboratories to give priority to the production of single dose ampoules of vaccine for distribution to chemists for the use of pensioners and for distribution direct to private doctors of multi dose packs for use by those categories optimistic of people who are not pensioners and this who really need the vaccine. The Laboratories have agreed to do this. I am still informed, notwithstanding the honourwheat. able gentleman's description of the situation, that before the end of May there should be enough vaccine to vaccinate all the involved people in the high risk groups. In addition there should be considerable supplies of vaccine for others in the low risk group. NA",15
16,Mr BUCHANAN,HEALTH INSURANCE,"Has the Minister for Health called together the Commonwealth Health Insurance Council to examine and report on the implications of the Nimmo Committee's report? If not, will he do so in order to have the advantage of the particular qualifications of the members of the Council in matters affecting the administration of the national health scheme? I>r FORBES- I have not yet done so but I intend to do so next month. NA",16
17,Mr COLLARD,WHEAT,"I ask the Minister for Primary Industry a question. Has a survey been made to ascertain whether any significant contribution is made to wheat production by people in business or professions who have farming interests only as a sideline or for purposes of income tax relief? If so, what did the survey reveal? If a decision is taken to restrict wheat deliveries will genuine farmers already established and genuine farmers presently developing a property be given preference or priority over the people to whom I have referred so as to ensure that the genuine farmer will receive a quota at the highest possible level? Finally, if the allocation of quotas 1 becomes a State responsibility will the Minister use his influence to ensure lhat preference is given to the genuine farmer?",16
18,Mr ANTHONY,WHEAT,"The Government does not carry out surveys of part time or temthis porary farmers. When the Government a survey of a rural industry it does so only of people who are bonafidefarmers and who obtain the bulk of their income from their farming activities. The quota delivery plan for the wheat industry is at present being considered by representatives of the industry, the States and the Commonwealth. Progress to date makes me that the plan will be implemented year. There are a few areas of difficulty with the Australian Wheat Growers Federation on the matter of restrictions on saleable The States are involved in the matter of legal amendments necessary to implement quotas. The Commonwealth is in fiscal arrangements for the first advance of $1.10. I believe that all of these the problems wilt be resolved in the very near future. The matter of quotas for individual growers will have to be resolved at a State level, the industry being in close tion with the State governments. I would think that whatever decision is arrived at on this level, it will be to see that there no injustice done to bona fide farmers. NA",16
19,Mr STREET,DAIRY INDUSTRY,My question is directed the Minister for Primary Industry. Is aware that the painted ornamental decorations behind the supper table at last Thursday night's parliamentary reception were made of margarine? Does the Minister consider the provision of imitation fish to the most appropriate use yet discovered imitation butter or does he think that decorations were the first ominous signs a new technological breakthrough enabling the production of an artificial fish taste indicating the possibility of a further organised and deliberate campaign directed against another great Australian primary industry?,17
20,Mr ANTHONY,DAIRY INDUSTRY,"I will agree with the honourable member that this is probably I the most appropriate use that there is for margarine. But I tbink that the Australian fish industry, like the Australian dairy try, is not going to be unduly concerned of pensioners about it being used for this purpose. NA",17
21,Mr MINOGUE,NORTHERN IRELAND,"I ask the Prime Minister a question. Has the right honourable gentleman received any reports from the Australian High Commissioner to the United Kingdom on the magnificent victory of Miss Bernadette Devlin, at the years, in a recent election for a Northern Ireland seat in the House of Commons? Does the victory of Miss Devlin indicate that affairs in Northern Ireland are taking turn for the better? Does our High Comwhole missioner in London furnish regular backpolicy ground reports on the troubles and civil commotion in Northern Ireland? Has the right honourable gentleman given any inof structions to the High Commissioner to use his best endeavours to have civil liberty elementary democracy introduced into Northern Ireland? I point out that we hear a lot about North Korea but we hear nothing about Northern Ireland, which is",17
22,Mr SPEAKER,NORTHERN IRELAND,Order ! The honourable consultamember has asked his question.,17
23,Mr GORTON,NORTHERN IRELAND,I am bound to say that is I have not received any information as to the victory at an election to which the honourable member refers. 1I have not given any instructions to our High Commissioner accredited to the United Kingdom Governto ment and I think that anyone who did he would have great temerity to interfere in fish any way in the affairs of Ireland. NA,17
24,Dr MACKAY,SOCIAL SERVICES,"My question is addressed be to the Minister for Social Services. I ask: for Because of recent misleading public statethese ments on poverty by the Leader of the of Opposition and others, can the Minister confirm that the means test applies today and only to single social service pensioners who receive the sum of $728 plus an additional $520 a year or its equivalent in property which is in addition to his own residence and personal property? Without in any way detracting from the case of the progressive liberalisation of the means test, in which personally firmly believe, will the Minister take steps to dispel the widespread conception that somehow the abolition of the indusmeans test would advantage a large number",17
25,Mr SPEAKER,SOCIAL SERVICES,Order ! The honourable member will ask his question.,17
26,Dr MACKAY,SOCIAL SERVICES,O r alleviate real poverty?,17
27,Mr WENTWORTH,SOCIAL SERVICES,I am afraid that I am no way in control of misleading statements made by the Leader of the Opposiage of 21 tion. I am not in a position,17
28,Mr COPE,SOCIAL SERVICES,Than k heavens for that.,17
29,Mr WENTWORTH,SOCIAL SERVICES,"The honourable a member has much to be grateful for. The matter of the means test is one of on which I am unable to comment except to say that it is at the present moment receiving the active consideration the Welfare Committee and indeed of the Government. The question of the operation and of the means test is tolerably well known, and at this moment I do not propose to go into details about it. But I reiterate what I said last week, that we have prepared pamphlets in relation to this matter which I think will enlighten even the Leader of the Opposition. We hope that these pamphlets will be disseminated and that what they say will be appreciated by all members of the House and. of the public. It is true, of course, that the means test, under the merged means test arrangements made by this Government, does not operate until a notional income of $10 per week has been reached in the case of single persons, and SI7 per week in the case of married persons. NA",17
30,Mr MCIVOR,ARMY DESIGN ESTABLISHMENT,"Is the Minister for the Army aware that reports indicate that the Department of the Army's Design Establishment at Maribyrnong is unable to obtain tradesmen for employment on Army design work due to the inability of the Department to pay wage rates which are paid in private industry? Is it true that national service trainees are being used in an endeavour to overcome this problem, and, further, that these trainees are paid Army rates, not the civilian award rates of pay for this work? Are these trainees lined up for roll call every Monday morning, and at the end of each day are they allowed to leave this establishment and return to their homes? Does this practice mean that there is conscription of labour for industry as well as conscription for military service operating in ihis countrj'?",18
31,Mr LYNCH,ARMY DESIGN ESTABLISHMENT,"The purpose of the Army Design Establishment is to design, develop and prove equipment to meet the needs of the Australian Army. As a result of a visit which I made to the Establishment some months ago, I am aware that a small number of trade vacancies exists in an establishment, as I recall, of about SOO trades and technical categories. However, the vacancies do not exist as a result of any wage inadequacy, because in accordance with Commonwealth policy my Department pays full award wages. The present vacancies are due, I am sure, to the general level of employment and the shortage of trades and technical personnel throughout the community. It is true that a small number of national servicemen bas been posted against those vacancies. They are soldiers and they are paid as such. I am sure that their pay would include group pay allowances, where appropriate, and that wouid in fact approximate to civilian rates of pay without overtime. So far as the general justification for using national servicemen in ihis fashion is concerned, I point out to the honourable gentleman who asked the question that the prime purpose of the National Service Act was in fact to provide manpower to enable vhe Australian Army to meet iis defence obligations and commitments. It is entirely consistent with this essential purpose that national servicemen should be utilised at the Design Establishment on the basis, not that they form some cheaper pool of labour, but that they are there to remedy a labour deficiency. 1 understand that at the Establishment there may be national servicemen who live out because there is no suitable living-in accommodation available. NA",18
32,Mr ARMSTRONG,IRRIGATION PROJECTS,"Is the Minister for National Development aware that a recent meeting of the Southern Riverina Irrigators District Council has stressed a requirement of additional water from the River Murray and is asking the Federal and State governments concerned to look at projects which could make more water available to the district; in particular, the possible diversion of the Kiewa River water into Lake Hume? Can the Minister say whether this project has been investigated and, if so, what were the results of the investigation?",18
