speakerGroups,Speaker,Title,text,pageNumbers
65,Mr CREAN,INCOME TAX,"Jus t in passing, I regard the French proposition as a reasonable of one. Here, at least, we have equality. grow. Jt seems silly to me to have an arrangement to file returns in Australia and in France and then share the income afterwards. should decide that any ticket that is sold in France should be regarded as French earnings and that any ticket sold in Australia tralia should be regarded as Australian earnings. As I understand it, most people when they leave one country or the other want to return to it. So the position tends to even out. I think that the administrative advantages outweigh any problems. The same thing, to a greater extent, ought apply to shipping. Australia has had enough sense to develop an international airline system but it has been very belated in developing an international shipping line. Nevertheless, we welcome the suggestion that we are beginning to do so. At the moment a shipping arangement would be rather one-way traffic. Such an arrangement would favour the P. & O. organisation. There is no equivalent as far as shipping is concerned. In airways Qantas Ltd is just as good a performer as is Air France-UTA . I have every confidence we will derive from our airline operation as much as or probably more than, will the French equivalent. But this will comparatively minor matter in total. I urge the House to support my amendment.",44
66,Mr SPEAKER,INCOME TAX,Is the amendment possible. seconded? Mr Connor- I second the amendment and reserve my right to participate at later stage in the debate.,44
67,Mr WHITTORN,INCOME TAX,"Balaclava) [5.30]-A the honourable member for Melbourne congratulate Ports (Mr Crean) has said, this is an when we once again formalise income lax international agreements, commonly called double taxation agreements, between Australia and various countries. This form of debate was adopted last year, 1 think on 30th April, when we formalised an agreement between the United Kingdom and Australia. On that occasion the Opposition gave the impression that it was not very interested in investment from overseas, even from the United Kingdom, and again the Opposition has indicated that it i.s not too keen on investment in Australia, either from Japan or from any other counsort try which has money to help Australia. I find it difficult to understand the attitude of the Australian Labor Party because We it was Mr Chifley who, as Leader of the Labor Government in 1946, first formalised double taxation agreements between Ausand the United Kingdom. It is coincidental that in the same year he also look steps, which were successful, to encourage the mighty General Motors Corporation of America not only to invest in Australia but also to build up in Australia a motor manufacturing industry which is second to none. to As all honourable members know, the motor manufacturing industry is the second largest industry in Australia. It provides jobs for Australians. It ensures that the families of the people engaged in the industry have an excellent future ahead of them. It also provides the people engaged in it with good over award wages and superannuation, and it enables their children to go to good schools. It seems to me that the Labor Pr.rly of 1946 is quite different Airways from the Labor Party of 1969. As I have said, the original agreement that was formalised in 1946 by Mr Chifley, who was then leader of ihe Labor Government, but now we Iind that the Opposition be a has moved an amendment which refers particularly to the proposed double taxation agreement with Japan. Of course, we will negative that amendment as soon as I think it is important from the point of view of a capital hungry country that we should make this form of agreea ment with the United Kingdom, as we have done, with the United States of America, with New Zealand which is a good trading s area for Australia, and with Canada. I the Treasury officials and the occaTreasurer (Mr MCMahon) in taking this form of agreement a step further, by negotiating and signing agreements with Singapore and Japan. I am told that the Singapore agreement was signed on llt h February J969. and thaf when ratified by this Parliament it will become effective from 1st July this year. The Japanese agreement was signed on 20th March 1969. but it will become effective from 1st January of this year; in other words, it will be made retrospective by about 6 weeks. I am sure I speak on behalf of the Government when I say that we believe that this form of agreement is i good thing. It is interesting in this case that there are two different types of countries concerned with the agreement. Singapore is a very small yet progressive country, and the other country, Japan, is a much larger country which trades heavily throughout the world. The honourable member for Melbourne Ports conceded that Japan now takes the greatest proportion of our exports, namely 21%, whilst the United Kingdom has reduced its imports from Australia, from 32% in 1958-59 to 14% today. Jn other words, I believe that the relationship built up between Australia and Japan is a formidable and useful one which should be formalised by a double taxation agreement so that this trade can continue. The Japanese are astute with (heir trading, as the honourable member for Melbourne Ports mentioned. The Japanese gentleman to whom he referred could well have said that a month ago. Ji there is no continuity of the type of trade which the Japanese want with Australia, they could easily look elsewhere for the produce which they are now obtaining from Australia. This is one of the purposes of the double taxation agreement. I feel sure that the honourable member for Melbourne Ports has read the draft economic conditions which were established by the Organisation for Economic Cooperation and Development, commonly known as the OECD. It put the purposes of double taxation agreements in simple language. It stated that one of the purposes is to ensure a continuity of trade between two countries on a bilateral arrangement, or between more than two countries, if possible, on a multilateral arrangement. The Organisation's draft report which was issued in 1963 contains three main clauses. I think 13861/69-/t-[50 ] that for the purposes of the record it is worthwhile stating them. One clause stated that the purpose of double taxation agreements is to achieve a sustainable economic growth arid employment - and a rising standard of living in member countries while maintaining financial stability, thus contributing to the development of world economy. What better purpose can Australia have than the international development of trade and the better development of international economies throughout the world? This form of agreement sustains trade between two countries in particular and between more than two countries generally. The second clause of the. OECD draft report stated that double taxation agreements contribute to sound economic expansion in member as well as non-member countries, in the process of economic development. In other words, when one country invests in another country, economic development is sustained as between the source of revenue and the source offinanceand causes some stimulation of business in the country which produces the revenue. The third clause of the report stated that double taxation agreements contribute to the expansion of world trade on a multilateral non-discriminatory basis in accordance with international obligations. Those are the three points on which OECD based its draft report, and I believe that we in Australia would do well to note these points, not only in financial matters but also in other matters. As a result of the double taxation agreement with Japan there could well be additional capital inflow from Japan to Australia. What does this mean? What it means to me is quite different from what ; .t means to honourable members opposite. To me it means that because of the double taxation agreement the Japanese will say that Australians are bent on selling their goods and services, if possible, to the Japanese. When I speak of goods, of course, I refer to the iron ore and bauxite which the Japanese are buying from us, to the coking coal which they were buying from us in ever-increasing quantities, and to the liquefied gas from Bass Strait which they will shortly be buying from us. This additional trade will mean that railways ancl deeper ports, which otherwise we would never have, will be constructed. It is hardly necessary for me to mention that if it were not for this additional trade we would not have the port of Dampier which will accommodate iron ore carrying ships of 120,000 tons, on 2, 3 or 6 occasions a week. It is hardly necessary for me to say that Port Hedland in the north west part of Western Australia would never have been developed to its present state if it had not been for overseas investment in Australian enterprises. What has happened at Weipa in the northern part of Australia due to the efforts of Conzinc Riotinto of Australia Ltd and other companies? These areas have been built up by overseas investment in Australia, and they will be consolidated. These efforts are being made because we are establishing double taxation agreements with certain countries. I find it difficult to realise that the sition could oppose a double taxation agreement with Japan because the agreeturing ment will encourage the Japanese to have reinvest their earnings in Australia. AU the statistics issued by the Commonwealth legislation. Bureau of Census and Statistics indicate that at least 50% of the money invested in Australia by overseas companies and of the profits earned from those moneys is reinvested in Australia in railways, services and other things which are good for Austhe tralia and for Australians. Furthermore, this investment builds up the technical skills, the technical know-how and the efficiency of Australians because they new equipment and new techniques. The OECD carried out its investigations between 1956 and 1963. The European countries wanted to know what they should do about the reinvestment of profits made in their countries by other countries. They established this Organisation of Economic Co-operation and Development. The United States of America is a member of OECD and it supported and encouraged the activities of the Organisation. The main purpose of the draft report of the is related to the development of interthem national trade. It said, as I have already stated, that this is best done agreements between two countries or multilateral agreements between more than two countries. It suggested that these should take the form of double taxation agreeNorth ments. It is easy to see why bilateral ments are easier to negotiate, because the taxing arrangements of individual countries do have an effect on the form of the agreement. That is why the agreements with Singapore, Japan and the United Kingdom vary one from the other, but the structure established by the OECD has been used as the basis in each case and I think the Treasury will give official recognition to this assertion. The reports prove conclusively that when taxation is imposed by two countries the investor could easily be led to the stage where 50% of his profit was taken by the country of source and 50% was taken in his own country. In other words he would get no return at all from his profits. The honourable member for Melbourne Ports mentioned royalties and. other matters, but I do not think that they are related to this legislation. If. we need to Oppostrengthen the control of royalties going lo pther countries from companies manufacand producing in Australia, let us a look at the situation; but I do not of think it has much relevance to this type of As I have said, the entrepreneur from Japan, Singapore or the United Kingdom who invests in Australia must see that he can get some return. He must be sure that two governments concerned look with some sympathy at his prospects of receiving a dividend. I do not believe that those countries that have invested in Australia use have a tremendous future in respect of their investment and we need only to look back on the records to appreciate this. For instance, in 1911 the mighty Broken Hill Pty Company Ltd was classified as an overseas company because 74% of its capital was held by overseas interests, the balance being held in Australia. Of course, the position is quite different today, 84% of the company being owned by Australians and only 16% by overseas countries. This is a classic case of overseas investment assisting Australia. It has generated sufficient capital OECD among employees and others to enable to buy into this magnificent company and reverse the situation. Admittedly it has by bilateral taken nearly 60 years. Let us take another company as an example. The Australian ownership in Broken Hill Ltd increased from 34% agree in 1913 to 84% today-agai n a tremendous reverse. Initially this company was practically owned by overseas interests, but now it is practically owned by Australians. The Western Mining Corporation, a company which is often in the news in Australia, was once owr-ed totally by overseas interests, but now 90% of the capital is Australian owned. This is the type of company that overseas investors are interested in, but it is the type of company that has a diminishing asset. With mining and oil exploration the asset diminishes immediately the first barrel of oil is taken or the first ton of ore is mined. Overseas companies find that they have to keep up exploratory work in mining or in oil exploration to make sure that their investment pays off. Before they self their first ton of ore they have to build tremendous railroads, as has been done between Mount Tom Price and Dampier and between Mount Newman and Port Hedland. We read in the Press yesterday of a new venture. It appears that an overseas company, with a 25% Australian interest, will be selling S 1,250m worth of iron ore to a certain Japanese firm, but it will have to build another railway ancl another port in the north west part of Western Australia. What does this do to Australians? It gives them better jobs, better education ancl better schools. We have men in Australia today whom' we did not have 5 years ago - me n who can run an. oil rig and do all the things that' we used to read about the newspapers and see in the newsreels being clone by Americans. This work is being clone by Australians. We are more less self-contained in respect of oil drilling, oil exploration and oil production. I often wonder why members opposite worry about Esso-BHP and the fact that, some 6 months ago. it called up $30m Australian debenture capital. The criticism in the Press and by the Opposition was quite fantastic. What, has the company done with that money? It has expended S20m in Australia on capital works. If it ever moves out of Australia it cannot possibly take those capital works away'. Conzinc Riotinto of Australia Ltd cannot take its railroads out of Australia. Any company which invests; in Australia and provides ports is building up a workforce of highly qualified Australians on high wages, with good superannuation and a continuity of employment. I believe that the Treasurer feels that the capital upsurge in Australia - Australia n capital and overseas capital as well-ha s initiated a regeneration of capital in Australia. He feels- I agree with him-that some of this capital will have to be reinvested, or should be reinvested, overseas because we want to look after our markets overseas the same as the Japanese, the British and the Americans want to look after their markets. By signing this agreement with Singapore, we have an opportunity of encouraging Australian businessmen, commercial enterprises and entrepreneurs to invest in Singapore. As the honourable member for Melbourne Ports said, the Government of Singapore has requested that overseas countries invest in its country. What does Prime Minister Lee Kuan Yew say? He says what I say-that because of the control of Hong Kong by Communist China in the years gone by and the effect of that control in the years ahead, Hong Kong will lose its power as the international port of South East Asia and will be replaced by Singapore. I believe he is right. He is encouraging overseas investment and I do not think, to use Sir Henry Bolte's words, he is very choosy about where the investment comes from. Those who invest in h>s country will, of course, obtain a tax holiday during the first 5 years of their investment. In other words, he wants them to re-invest in their profits in Singapore to ensure that the people of Singapore continue to have now an increasing rate of production and ar. or improving standard of living. This is what Mr Lee Kuan Yew has in mind, and I believe he is right. We should encourage him in this. We should have another international port in the South East Asian area. of The amount of goods and services that will be processed through Singapore in 20 years' time or 30 years' time will be tenfold what it is today. Goods coming from overseas countries like Australia and America are transshipped there and sent into the South East Asian area. The Treasurer rightly said that we in Australia provide only 3% of imports being acquired by South East Asian countries. Here is an opportunity for Australians to invest in Singapore and elsewhere if they like in South East Asia to build up manufacturing procedures and processes, because there is no doubt in my mind that when a biscuit company or any other company sets up in Singapore the Singaporean Government will establish trade or tariff barriers to ensure that that company, wherever it comes from, will be protected in Singapore. This is the process as I see it, and this is what Australian businessmen and the Australian Government should encourage and help along the way The honourable member for Melbourne Ports gave me the impression that he considered there was no future for Australia in the agreement with Japan, that all the advantages could be credited to Japan. I say first that the profits Japanese companies make in this country will be reinvested, because the records have shown that overseas investors will reinvest 50% of their profits. The second point is that the Japanese, like any other country that imports goods and services from Australia, want a continuity of these goods and services. If they find that Australia is not sympathetic to their needs so far as continuity is concerned they will look elsewhere for iron ore, bauxite and oil. There is no doubt in my mind that this is the reason why we are signing a double taxation agreement with Japan. The Japanese will obviously find that Australia is a country that can be dealt with on a long term basis. It is a strange thing that Japan has not increased its military prospects in South East Asia in the way it did before World War II . It has not increased its efforts in foreign affairs but it has built up in the areathroughout the world, in fact- a tremendous image as an industrialised country and a country that has the ability to trade. After the war the image of Japan in Australia was the lowest of any country in the world. Let us face this fact. It is because of the Japanese tenacity and the procedures they have adopted with exports and imports to and from various countries that they have built up an image of trustworthiness. Thousands of Australians go to Japan and visit Tokyo, Osaka and other areas they find it a useful procedure to take their wives and families to see how the Japanese live. By the same token, the people of Australia. Japan come to Australia-no t to the same extent and not to the extent 1 would like to see them come but they are coming here in increasing numbers-and they are beginning to understand Australians a good deal better than they did before. In this matter of international relations mentioned by the OECD it is important that we should formalise an agreement with Japan of all countries, firstly, because of the tremendous amount of trade we are doing with it and, secondly, to ensure that the personal relationships that have been built up in recent years are continued and made to grow. This is very important from Australia's point of view, and it is certainly important from the Japanese point of view. They, of course, are a little over-suspicious of Western type people but they have learned to trade with us on Western lines. We encourage them to think the way we do in business, and they realise that we have financial controls on our. economy which are useful to us and handy to them in many, many instances. I find the Opposition's reason for opposing this double taxation agreement with Japan contrary to good reasoning, because it must be in the long term beneficial to Australia, and of course it will be beneficial to Japan. The honourable member for Melbourne Ports said that it will benefit Japan because the investors from Japan will not be paying the same amount of tax us they would normally pay. This is true, but it is the short-sighted view that he gives to the people of Australia when he points this aspect out. The Treasurer and members on this side try to take a longer range point of view to ensure that the"" trading we now do with Japan is continuous and is a growing trade and that the people of Australia will have an ever-increasing standard of living because of the investment by Japan, Britain or America, and there will be goods and services available to Australians in the future as they have never been available before. We know that the level of unemployment in Australia is lower than it has ever been. In Victoria only 0.9% ot"" the work force is out of work. Most Australians, whether they work for private companies or in government departments, own and their own cars, and wherever we go we can see the goods and services that they enjoy because of overseas investment in It is interesting, too, that the honourable member for Melbourne Ports said that we can do these things ourselves with our own capital. The first point I would like to make is that we are one of the highest taxed industrialised countries in the world. In other words, 1 do not believe that we can tax the people of Australia any more. I believe lhat real consideration should be given and must be given to reducing income tax in Australia. We cannot take any more from the people of Australia for this additional development. Australians, on the other hand, are among the best investors in the world in capital equipment in Australia. We have the reputation that we do invest in goods and services to a greater extent than people in other countries. I will concede that some of it is forced because the Government takes it in the form of tax and builds roads, dams, bridges and the like, but it is a capital investment for the good of future Australians. Therefore, we cannot expect the investors in Australia to spend any more money on investment to build up these goods and services, particularly the mining ventures that we have in Australia. As I see it, the Australian Labor Party would leave the iron ore in the ground until we had time to do something about it. I say as a technical man-as an engineerthat already technological processes have shown that there is a plastic as strong and as pliable as steel. I suggest that in 20 or 30 or 50 years' time steel will be replaced as a commodity. I do not suggest that honourable members opposite sell their shares in BHP today, but I am suggesting that technical processes are such that there will be replacement of steel in the future. We all know that the developments of atomic energy are such that oil is being replaced as a fuel. It will not happen in Australia in 20 years' time or even in 50 years' time, but we all know that at least five atomic energy plants have been built in Japan to generate the electricity that it needs for its tremendous factories. This will be a multiplying process in all countries throughout the world. In other words, coal and gas in 50 years' time will be quite useless as generators of electricity. So I would suggest that the sooner we get our oil out of the bottom of Bass Strait, Moonie or wherever it is in Australia, the better for Australians. The sooner we use our bauxite, the sooner we use the copper from Mount Isa and elsewhere, the sooner we use the iron ore from Mount Tom Price and Mount Newman and other places, the better for Australians. We oppose this amendment proposed by the honourable member for Melbourne Ports and support the Bill.",44
