speakerGroups,Speaker,Title,text,pageNumbers
213,Mr LLOYD,PAIRS,"In seconding the amendment I wish to say that the Australian Country Party supports the establishment of the Apple and Pear Corporation. It is one of a great number of reorganisational to proposals in relation to which the previous Minister for Primary Industry was well adif vanced when the change of Government took place. I hope that if the previous Government had been returned there would have been a few things in the Bill rather different from what is in this one. Nevertheless this Bill is an important step to help an industry that is in real trouble. The honourable member for Franklin (Mr Sherry) stated that the previous this Government had not done anything for the disindustry in a decade. The most important measure which brought stability to the apple and elecpear industry in a long time was that introto duced by the previous Government, namely, the apple and pear stabilisation scheme. Income in stability is of tremendous importance to any exporting industry. I believe, and the amendment states, that the apple and pear stabilisation scheme should be updated now, but it has given some level of stability which otherwise would not have existed. The honourable member for Franklin also conveniently forgot about the success of the previous Minister for Primary Industry in reducing the multitude of labels, shipping arrangements, etc., for exports from Tasmama down to one single label. This action by the previous Minister helped in some way to overcome the Tasmanian ports' bad record of being the most expensive series of ports in the world. The honourable member also mentioned the crime of fruit trees being uprooted while we have hungry people in the world. I agree with him on this. I only hope that some success is achieved. One of the first things I did when I became a member of Parliament was to check the official list that the Australian Government has of goods and other items which it is prepared to offer in its foreign aid gram. The proposition of offering fruit as foreign aid has been promoted by the Government, but I think the important point is that if we are genuine in our desire to help less fortunate people we should give them what they want rather than thrust on them what we have in surplus, as has been the situation. Unfortunately fruit is not a high priority food with people in need of assistance, and when they have wanted something from us they have asked for grain or some other staple food. The deep seated problems facing the apple and pear industry, particularly the export section of the apple industry, go far beyond what this Apple and Pear Corporation will be able to achieve. This applies more to the apple industry than to the fresh pear industry. I remind honourable members that there is also a canning pear industry which probably has equally deep seated problems as has the apple industry. I think that some aspects of the Apple and Pear Corporation Bill are very good. The power to control exports is essential. The power to charter and to arrange shipping is also essential. I think it has already been mentioned that approximately 60 per cent of the value of exported fruit represents freight charges. In addition there is to be a 16 per cent increase in those charges this year and I do not think that will be the last increase for the coming season because the industry is faced with the prospect of surcharges being imposed due to the oil shortages affecting shipping. The power to organise sales within Australia is of tremendous importance because unless breakthroughs can be made with new export markets-and I wish the Minister well in his discussions with Japanese officials on the problem of codling moth which is affecting our exports to that country-particularl y apple markets there will be tremendous pressure on the domestic market as the export sales to our traditional markets become less and less. There is increasing competition for available export markets from New Zealand and South America the industries of which in some ways are more efficient than ours and unless we have an overall authority to try to save the situation from chaos I think chaos could eventuate before very long. The power in respect of research and promotion is also welcomed. The honourable member for Corangamite (Mr Street) mentioned some alternative pear products. I will just reiterate what he said about perry wine pro- and dehydrated pears. I congratulate the people at Shepparton who are world leaders in the field of dehydration of pears. But I would repeat that the problem facing the successful innovation of perry or pear wine and various pear alcohols is that there is no excise or sales tax on apple alcohols, wine alcohols or grape alcohols. Yet there is a IS per cent sales tax on other fruit alcohols of which perry wine would be a major product at the present time. It is hard enough to introduce a new product onto a market alongside the established products such as cider and wine without having a IS per cent hurdle to overcome at the same time. I ask the Government once again as I have asked it several times to give favourable consideration to the removal of this sales tax because it does not bring in any income. It is an anomaly. The only way to sort it out is to remove the sales tax on all other fruit alcohol. There are some points in this legislation that I am not happy about and one is the fact that the members of the Corporation are to be appointed, not elected. As the honourable member for Corangamite mentioned, the growers in the industry were told by the Labor Party spokesmen before the general election that they believed in elected representatives. They were following that belief through faithfully I suppose when they required a referendum on the embargo on the export of merino rams. If they required a direct vote of the industry in that instance in order to ascertain the effect on growers rather than a vote of appointed representatives, why did they not be consistent and stick to the same formula for the Apple and Pear Corporation? They should be consistent. All the grower representatives will be appointed from the Australian Apple and Pear Growers Association. This provision has certainly resurrected this organisation. The legislation places tremendous responsibility on it to be truly representative of all the apple and pear growers in this country and to act in an exemplary and emcient manner on behalf of the industry. After all, it has been given a statutory monopoly as a growers organisation with real power. I suppose that a reasonable distribution the 4 growers appointed as representatives initially would be two from Tasmania, one from Western Australia and one from Vicpeople toria. The Victorian representative would so represent the pear export section of the industry. Honourable members will remember that approximately 70 per cent or two-thirds of our fruit exports are apples and the remainspecial ing percentage is pears. Victoria is responsible for about two-thirds of our pear exports. think it is only just that one out of the four should represent the pear growers and ought to be a Victorian. There are 2 points in the legislation with which I am most unhappy. One is in clause interest. 6 (0 which sets out the functions of the Corfruit poration. Clause 6 reads: The functions of the Corporation are(0 such other functions in connection with apples and pears as are provided by the regulations. The Opposition will not attempt to delete paragraph (f) of clause 6 although it does give power to the Corporation to extend by regulation its powers when we have, one would hope, in the Bill restrictions of a legislative nature. The other point is the more important one. We will be moving for the deletion of clause 7 (3). In an attempt to justify the provisions in clause 7 (3) the Minister in his second reading speech said: There is also expressed in Clause 7 (3) of the Bill a general requirement that the Corporation must comply with any directions given it by the Minister with respect to the performance of its functions and the exercise of its powers. This power of direction over the Corporation is a power which would only be drawn on in unusual circumstances. It might need to be used, for example, to restrain activity by the Corporation if such activity is having serious and undesirable repercussions in important areas outside the cognizance of the Corporation. I think the Government should make up its mind. It either has faith in this Corporation to act on behalf of the industry-in which case it will give it the power to carry out its responsibilities-o r it should openly state that it has not any faith in the industry or the apple and pear growers representatives or the members of the Corporation who have special qualifications because there will be a head prefect to keep them in line and to overrule their decisions. I refer to the Minister for Primary Industry. Therefore we will be moving for the deletion of that sub-clause. In respect of the membership of the Corof poration, 3 members with special qualifications are to be appointed by the Minister. It has been mentioned that the expertise of those should be in marketing, transport and on. One gets the impression that one of these members will be from the Australian Shippers Council. I hope that the Minister will adhere to the proposition that the members will have qualifications. We do not want to see a unionist as one of the 3 members chosen just I because he happens to be a unionist. If he is somebody with special qualifications in marketing or shipping that would be fair enough but he should not be appointed just because he happens to be unionist. The question of the levy also is of some A levy is to be collected on fruit and products sold locally, as I understand it. How will this levy be collected? What rate will be charged? In the second reading speech the Minister states that no final decision has been made in respect of the levy. The Minister said: The Government currently has under study, in consultation with the industry, the most practicable method of imposing and collecting such a levy and will be submitting measures to the Parliament for adoption in the near future. I would hope that when this is submitted to the Parliament that the growers who I believe generally are in support of this legislation will still support it and they will not be hit in what they consider to be an unfair way either in various parts of the industry or in total by the levy. Other speakers in this debate have mentioned apples. I think that is reasonable because apples represent the most important sector of this industry. But the fresh pear industry is of considerable importance in northern Victoria. The fresh pear industry has developed some very important new markets in South East Asia. It is not facing quite the same marketing difficulties for the future as is the apple industry. I believe that there is not the same sort of competition from other countries either in markets outside Europe or even during the off season in Europe itself on the fresh pear market. One can look ahead with reasonable confidence if income stability can be provided and a profitable return maintained for the growers in this industry. But this Bill falls far short of establishing a complete statutory marketing authority which would acquire the crop and provide financial stability. Many growers in the industry, rightly or wrongly, believed that such an authority would be established after Labor came to power. If that had been done perhaps our amendment tonight would not have had to list these particular points. With the present arrangements there are still serious deficiencies in the industry. There is the problem of providing immediate financial assistance to growers by way of compensation. Compensation was granted because of the 1972 revaluation of Australia's currency. This was considered by most to be an unsatisfactory form of compensation because of the way in which it was administered. A grower, whether he was a fresh fruit grower or a canned fruit grower, was limited to receiving a certain upper limit of compensation. Most growers who were solely producers of this type of crop were eligible for far more compensation than provided by this limit. Since the 1972 revaluation there has been a series of revaluations. I hope that' the Government can provide revaluation compensation to this industry in the immediate future to ensure more liquidity in the industry to help it with the costs of the season ahead. The second point in our amendment relates to the adjustment of the stabilisation scheme to provide for increased costs and freight rates. I think that is reasonable. In the long term a stabilisation scheme is still the best provider of some form of stability for this industry. But because of increased costs and particularly increased freight rates, the maximum levels of assistance which were provided when the Bill was introduced are no longer adequate and I believe that adjustments should be made to the maximum rates at present provided. The Labor Government in Tasmania promised that it would provide a guaranteed price to growers of export fruit. Ever since it has been trying to back out of that promise. We were told that the Premier of Tasmania was in Canberra again early this week, presumably on the same errand of asking the Commonwealth to take over responsibility for that which the Tasmanian Labor Government promised the growers of Tasmania. This is why this point is included in the Opposition amendment. The Tasmanian growers, particularly the apple growers, were told and believed that they would be given some guarantee to cover the cost of exports for this season. They really believed that the guarantee would be provided for more than one season, but at least for this season because of the serious conditions facing the industry. It is up to this Government to sort the matter out, either by itself or in conjunction with the Tasmanian Labor Government. Apparently the priorities of the Tasmanian Labor Government are such that it can spend a considerable amount of money on Lake Pedder and nothing to carry out its promise to provide some cover for the growers. It is up to these governments to sort out the matter. But I suggest that if the Tasmanian Government had its priorities right it would adhere to its promises. Finally, I turn to the matter of having elected representatives of growers on the Corporation as promised by a Labor spokesman prior to the last election. The honourable member for Corangamite and I have made this point. I am glad that this Apple and Pear Corporation is coming into being. It is one promise, or part of a promise, that this Government is fulfilling, even it is is only picking up the groundwork done by the previous Government. When one considers all the other problems the industry faces and the other promises made by a Labor opposition anxious to get into power, one would hope the Government will now fulfill those promises to a greater extent than it has done so far.",82
214,Mr DUTHIE,PAIRS," I appreciate the concern of Opposition members who have spoken. I appreciate their constructive suggestions, which are most unusual coming from that side of the House. I appreciate, also, suggestions as to how this legislation can be improved. The establishment of the proposed Apple and Pear Corporation is a major step forward in the organisation of the apple and pear industry in Australia. I am grateful that the honourable members who have spoken have wished the Corporation well, even though they might not agree with other aspects of it or with other clauses of the Bill. However, I think that the Opposition agrees with 80 per cent to 90 per cent of the Bill. It is gratifying that approval for this measure is so overwhelming. The establishment of the Corporation comes at a time when the apple and pear industry is in crisis-as if it has not been in crisis for many years. But the crises that are occurring are becoming worse and more serious every year. For instance, in Tasmania a few years ago there were 1,350 growers; there are now fewer than 600-les s than half. I said, by way of interjection to my colleague the honourable member for Franklin (Mr Sherry), that 5 years ago this industry was worth approximately $20m annually to Tasmania. It is now worth less than half of that- $ 10m. This illustrates the decline in the apple and pear industry as it affects my State of Tasmania whdch grows 70 per cent of Australia's apple production. Therefore, if there is a decline in production in the major apple growing State the industry is really sick. This measure is an endeavour to try to pump some sense into the organisation of the industry. The new corporation will go a long way beyond the Apple and Pear Board which it replaces. I am chairman of the Government Primary Industry Committee. Before the election when we were still in Opposition we hoped to establish a statutory marketing authority for apples and pears which would take over the entire crop and handle it from the paddock to the plate, wherever it was sold-at home or overseas. Members of that committee envisaged a very strong marketing authority with full powers. But we were only 3 people within a party. Honourable members opposite have brainy ideas at times but how far do they get in their party rooms? It is the party that decides issues. This applies to all parties. The majority decides. Our rural committee fought hard for the establishment of a statutory marketing authority even if it were to operate initially only in Tasmania and later spread to the other States. We were not able to convince enough of our colleagues that this was the ideal way to solve the problem and the Minister for Primary Industry (Senator Wriedt) and the majority in our Party decided on the establishment of this Corporation. The Minister has put a tremendous amount of work into this legislation to get it to the stage tonight where it is being debated in this Parliament. When the Minister introduced the proposal our rural committee suggested amendments to the draft legislation. He accepted two or three amendments that we suggested including one which related to grower representation on the Corporation. He thought that 3 grower representatives would be sufficient but we said that we wanted four. Four was accepted as the appropriate representation and tonight it is written into the legislation that on the Corporation there shall be 4 growers out of a total membership of nine, including the independent chairman. Though some of us might have wanted a stronger measure with far more teeth in it we must be happy with what is provided. It is far more than what we had in the past. The people appointed to this Corporation must make it work as the legislation requires and it is up to members of Parliament to keep on the Minister's back, or anybody else's back, to ensure that the requirements are carried out in to to as they are stated in the legislation which will be passed tonight in this chamber and I hope in the Senate very soon afterwards. The election of the grower representatives was referred to by the honourable member for Corangamite (Mr Street). He tried to make out that we said before the election that there would be a grower controlled board. Mr Street-Growe r representatives selected by the growers.",85
215,Mr DUTHIE,PAIRS,"Yes , growers' representatives selected by the growers. I think it is a tweedledum and tweedledee type of argument to make a great point of the fact that by this measure the growers will select their 4 members and those names will be submitted to the Minister. He is not going to select them. They will be selected by ballot by the Apple and Pear Growers' Association in Tasmania, which represents the majority of growers there, and like organisations in other States. Of course they will elect their own growers. There has been no breakdown in our suggestions at all. The method may be slightly different but the end result is exactly the same. Mr Street-Where does the legislation say that the growers are going to do the electing themselves?",86
216,Mr DUTHIE,PAIRS,"The Bill says that all members of the Corporation shall be appointed by the Minister for Primary Industry. By 'appointed' it means that members representing growers will be selected from nominations submitted by the Apple and Pear Growers' Association. Mr Street-Yes , but they are nominations. There is nothing in the legislation to say that they will be elected.",86
217,Mr DUTHIE,PAIRS,The point is: How do they nominate their own members except by ballot? Mr Street-That is right.,87
218,Mr DUTHIE,PAIRS,"They will have a ballot, and those names selected in the ballot will be mitted to the Minister. The 3 other members referred to in the Bill-member s with special qualifications-wil l be appointed after consultation with the Apple and Pear Growers' Association and any other appropriate bodies. The Minister is not picking names out of the air; he will appoint the people nominated by these representative bodies.",87
219,Mr LLOYD,PAIRS,How many Tasmanian growers are there?,87
