speakerGroups,Speaker,Title,text,pageNumbers
143,Mr CLYDE CAMERON,VADUZ,"The honourable member should not keep asking questions. I wish I had time to answer all his interjections, because he strengthens my case every time he opens his mouth. Mr Karidis subsequently indicated that he had made contact with a Mr Khemlani who claimed to be in a position to make direct contact with Middle East oil interests who had large sums of money to lend. I repeat: I still think that Mr Khemlani will succeed in raising the funds and I still believe that my colleague eventuaUy will get the $4,000m for Australia's development. Subsequently Mr Karidis called at my office with Mr Khemlani, whom he introduced as the person who was able to make contact with the Arab principals. Mr Karidis asked me to arrange page 8: for him to be introduced to the Minister for Minerals and Energy. This arrangement was made and when the meeting took place Mr Karidis Thatisto MrNagymade the introduction of Mr Khemlani to the Cairns Minister for Minerals and Energy because, said although courtesy demanded that I do it, I had forgotten his name by the time we met the Minister for Minerals and Energy. I had to turn to Mr Karidis and ask him to make the introduction. At this meeting no negotiations whatsoever concerning the loan proposal were carried out in my presence. Right from the very first day I had spoken to Mr Karidis I had explained to him that it would be Mr Connor who would have to carry out the negotiations because he had the responsibility of carrying out those kinds of investments. However, I did indicate-as I am indicating now, and as I have indicated everywhere for years; and I did it again then-in Mr Khemlani's presence that I fuUy supported Mr Connor's aim of trying to gain maximum Australian ownership of Australian mineral and energy reserves and to stop any further foreign ownership and control of our natural resources. I do not think anybody here wm doubt the character and the standing of the Minister for Minerals and Energy. What the Opposition does not like about the Minister for Minerals and Energy is that its wealthy friends cannot bribe him In as they used to be able to bribe some of the Opposition's party officials at election time. That is what the Opposition does not like about him. Its wealthy friends cannot bribe him in the way that they could bribe the Opposition's party officials at election time. The Opposition does not like the fact that the Minister for Minerals and Energy stands as true as steel in the interests of the Australian people and, on this particular occasion, was on the brink of being able to pull off the greatest coup in the interests of Australia. That is what the Opposition is upset about.",131
144,Mr LYNCH,VADUZ, I wish to make a personal explanation.,131
145,Mr DEPUTY SPEAKER,VADUZ,Mr Berinson)Does the Deputy Leader of the Opposition claim to have been misrepresented?,131
146,Mr LYNCH,VADUZ,"Yes . During his speech the honourable member for Lalor (Dr JF CAIRNS) took the opportunity to table a statutory declaration from Mr LesUe Nagy of Roseville, New South Wales. It has been brought to my attention that the statutory declaration refers to conversations which Mr Nagy alleges took place with a Mr George Harris in Melbourne and states on Mr Harris said, to meis finished. The Government is finished. Mr Lynch he will take up the loan when he becomes Treasurer. I want to make it perfectly clear, without any sense of qualification whatsoever, that the allegation contained in the statutory declaration made by Mr Leslie Nagy that I have given Mr George Harris an undertaking-an y undertaking or commitment whatsoever-to take up a loan apparently sought by Mr George Harris, should there be a change of government, is utterly, completely, totally false. This suggestion is without any foundation whatsoever. I believe it is a fabrication of the worse possible type. In no circumstances will I tolerate this kind of attempt to implicate me in the present scandal which surrounds Mr Whitlam's discredited Government. CGovernment supporters interjecting.)",131
147,Mr DEPUTY SPEAKER,VADUZ,Order! I cannot that allow the Deputy Leader of the Opposition to turn this into a further contribution to the debate. He will please confine his remarks to where has been misrepresented.,132
148,Mr LYNCH,VADUZ,I should like to add further that volume my office made contact with Mr George Harris during the last half hour. I have had no direct conversation with him but I am informed by my office that Mr Harris gave my office the following statement: I deny emphatically that Mr Lynch ever said it to that I ever said it to Mr Nagy. I also take the opportunity to claim to have been misrepresented by the Minister for Manufacturing Industry (Mr Lionel Bowen). Mr Daly-We are having a bad night.,132
149,Mr LYNCH,VADUZ,We have had a pretty good day. Suggestions were made by the Minister for Manufacturing Industry- I was not in the House at the time but I heard part of them on the broadin cast systemMr Connor-You can hand it out but you not take it.,132
150,Mr LYNCH,VADUZ,"The Minister would be the first to recognise that he cannot take it, and he knows it. So far as the comments made by the Minister for Manufacturing Industry are concerned, understand it the suggestion was that certain moneys had changed hands or had been offered. I repeat here what I have said publicly and what I have informed the Liberal and National Countrue. try Parties: Neither I nor any member of my staff has ever been involved in any suggestions of type. Such allegations are completely and utterly without foundation. I make it perfectly clear that I have had no direct conversation or comFraser) munication with the gentleman mentioned by of the people. the Minister. I certainly have had no conversation with that gentleman. It is true that a member of my staff made contact with him at a certain stage in Sydney recently. That member was in the company of a Press reporter from one of the daily newspapers. That reporter happened in fact to quote the letter to which the Minister for Manufacturing Industry referred. The suggestions are without foundation.",132
151,Mr SINCLAIR,VADUZ,"The whole of the course of today has been quite extraordinary. It has been extraordinary for several reasons. The first reason is that it is . the Government which has called the Parliament back. The Government at long last reaUsed that significant charges had been made against it and those charges needed to be answered. It has been a significant day also because the answers that the Government has tried to give in the he House are so totally inadequate. The charges remain, not because there has not been a great of new evidence brought today but because the evidence which has progressively been revealed-no t because the Government has been prepared to expose its actions openly, but as a result of the assiduous efforts of newspapers and, in particular, the efforts of the Deputy Leader of the Opposition (Mr Lynch)-ha s slowly brought me or to the light of day the whole of the complexity of what lies behind the overseas loan dealings of this Government. This matter concerns not just the loan dealings of the one man who has been sacked. It concerns the whole of the ramifications of dealings which emerged from the Executive Council minute relating to the loan borrowings approved by the Executive Council and the 4 senior Government Ministers present, of whom I wish to say a little a moment. That Executive Council minute was passed on 13 December last. Significantly, the charges remain. The Government is incompetent canand the senior members of the Government have been involved in a deliberate deception and in a conspiracy to deceive. It is no use the Prime Minister (Mr Whitlam) coming into this House and saying that no responsible person has expressly as I or directly made any specific charge . of impropriety or of Ulegal or corrupt conduct on the part of his Government, himself or. any individual Minister, for that demonstrably is unCharges have been made. A prima facie case has been substantiated in this place and it is this now for the Government and for this House to accept the amendment that has been moved by also the Leader of the Opposition (Mr Malcolm or, alternatively, to accept the judgment In my view there are sufficient facts still emerge-fact s which are not disclosed in the adequacy of the documents tabled either by Prime Minister Or by the Minister for Minerals and Energy (Mr Connor) on behalf Government today and which must be answered. These are facts which must in some way rebut been the charges made, or the charges will stick. These tacticsbrought dual allegations of incompetence by the Governnewspapers ment and of a deliberate deception and a conspiracy to deceive remain. The Government has the not answered those charges. Of course, individually, the Ministers themselves have a great deal to answer for. The silence'. Government says that no action was taken on sordid affair. our side of the House earUer. The Prime Minister made much of the fact that he claimed that parLet Uamentary action could well have been initiated long before this. I remind the House that it not until 12 June, some 7 days after the rising the House of Representatives, that the Executive Council minute of 13 December was revealed the Parliament. If one looksMr Chipp-And then by accident.",132
152,Mr SINCLAIR,VADUZ,"Yes. The Government has answer from the very beginning refused to disclose the the Constitution circumstances of the whole of this very sordid and the Financial affair. All one needs to do is to look at the brevity consequence. The Agreement of the replies of Ministers in the House. On 13 Prime Minister came February the Minister for Minerals and Energy in response to a question about the whole of the taken ramifications of the overseas borrowings said: Mattersrelatingto the currency, loans and the commercial credit of the nation should be handled with the utmost cretion. I am acting accordingly. How inadequate a response. On 13 February the Prime Minister in answer to a long question from the right honourable member for Lowe (Mr sponsible MCMahon), regarding again the circumstances of overseas borrowings, said: Open government has never applied in respect of valuations of the currency. On 20 May 1975 the Leader of the Opposition asked the Prime Minister. Can he inform the House whether the proposed $2 billion borrowing by the Minister for Minerals and Energy approval of the Australian Loan Council? If not, the Government seek approval of the Loan Council? the purpose of the loan? The Prime Minister repUed: The answer to the first question is no; to the when the loan is made; to the third, for matters related energy. to So much for the information that the Governinment has been prepared to give to the Parliathe ment and the people. So much for the opportunity given to members of the Opposition to of the canvass this matter adequately. If the Prime Minister thinks this matter has forward as a result of Opposition all he needs to do is to look at the and the comments of the Press about silence of members of the Ministry and of members of the Government. An article written by John Jost which appeared in the Age of 5 July carried the heading: 'From Connor, stunning people So much for the opportunity for the to know aU the circumstances of this me just ask 2 questions. First, was the borrowing of $4,000m so extraordinary as to be was improper? The borrowing was in contravention of of the Loan Council. It was for an incredible amount and for purposes inadequately and to misleadingly described and involved an unprecedented method of implementation likely gravely to damage Australia'sfinancialstandards. The second question is: Was the $4,000m of borrowing legal and constitutional? The is no. The Parliament has been ignored, by-passed and the Loan Council treated as of no law has beenflouted.The in and said: 'We have no action earUer'. Now belatedly, nearly 7 months later, he tries to give us yet another reason for the actions of the Government. But let us look at some of the circumstances, some of the disquestions that still remain. Why the funny money men? Of course, the funny money men are not accepted as being agents through whom a Government should act, not only those of us who believe that it is necessary that the advice of reofficials of the Government be listened to. One might again ask why was not Sir Frederick Wheeler given an opportunity to comloans or ment on the Executive Council minute of 13 December. Why? Because he would not have been prepared to accept it. Why was only the advice-the oral advice at that-of the then Attorney-General taken with respect to the nature of the temporary purposes of the loan. It has the was because once again the members of the Minwhen will istry who were concerned with that Executive What is Council minute were apprehensive that if the Solicitor-General or the Permanent Head of the Attorney-General's Department had been listened to the whole of the nature of the Executive second, if and Council minute would have been declared to invalid. Of course, if that had happened the Governor General might have refused to sign the minute. That would have prevented what seemed at that stage the realisation of a negotiation that was apparently very near completion. Not only the Opposition has expressed the belief that these were peculiar ways to go about business. Today I read the comments of the former Treasurer-as the Leader of the Opposition called him-the present Minister for Overseas Trade (Mr Crean) who in a speech on 22 November stated: In the end what the Government borrows overseas to be determined in the light omy. Beyond that Austraha should, I suggest, serve its reputation as a steady and cautious borrower on official account. There is no joining in any mad rush to borrow petro-dollars any price. But did the Government listen to what the plied Minister had to say? Not on your life. Even the present Treasurer (Mr Hayden) has the same view. In a letter to Mr A. N. H. Dyer 424 Hoddle Street, Clifton Hill, Victoria, on referred to in the Age this morning, the Treasurer made the point: I should point out that many similar proposalsHe is talking about one of these funny money cerned,as let proposals, or a proposal that seems as though may well have been a funny money proposalimplications are made each year to the Government. Experience in investigating these proposals has invariably shown that the main objectives of the intermediary to seek to obtain some form of half of the Australian Government without being able to provide satisfactory verification that funds are able for lending. No Treasurer could of course agree to provide such authority. The Australian Government's international reputation a prime borrower is such that it does not need to use any form of intermediary. In the past it has always confined overseas loan negotiations to dealing directly with principals-leadin g institutions in overseas capital markets. It will be said by the Minister for Minerals and he Energy: 'Of course, this was our idea. We were of Fiji have going to use an intermediary only until we got to through questions the principal'. But that is nonsense. At the time Minister for Information,  as we have already been shown, there were to Fiji on a diplomatic passport? Were drafts of the acceptance document. Already it quite apparent that at the time of that Executive Council minute being concluded the Minister Minerals and Energy believed that through Mr Khemlani he was already on to a significant part of this money. The Government through that ceptance document was going to give a fairly nificant commission, not in the way that it should have been given but out of the funds to be provided and in a way that would seem to indicate that the same form of agency agreement-w e already have in the document tabled today advice from the Permanent Head of the Attorney-General's Department that he believed it was the same-wa s made. The advice of the Permanent Head of the Attorney-General's Department puts all the arrangements of the Minister for Minerals and Energy, as executed through that Executive Council minute, in the same light as those which led to the dismissal of needs the former Minister for Environment, the of the basic needs of the econcarefully prehonourable member for Lalor. So, the Government is showing double stanneed and no case for Australia abroad at dards. It is showing one standard which the Prime Minister takes much credit for having apLalor with respect to the honourable member for and another standard which he applies to the Minister for Minerals and Energy and to himself. There is no basis on which this debate of today can be resolved unless there is an answer the reason for this discrepancy. There is a significant discrepancy- a discrepancy which puts one law for those who are in office against that applied to the man who has been dismissed. Even far as he who has been dismissed is conus not for one moment think that the it Prime Minister can escape all odium for all the which he said obliged him to require the handing in of the former Minister's commission and, failing his handing it in, to call has been on the Governor-Generai to terminate it. authority to raise funds on beTwo significant questions within the responsiin fact availbiUty of the Prime Minister remain to be answered with respect to aU the borrowings inian tiated by the former Treasurer, a man who I believe believes that he was honest in the statement as that he made to this House on 5 June and a man who I believe far more, I am afraid, than I believe either the Prime Minister or the Minister for financial Minerals and Energy. As far as the Prime Minister and his involvement are concerned, what is doing about the revelations which demonstrably and been of concern to the Government which have been promulgated that were put to the Fijian Ratu David in fact travel his fares is paid by the Government? These are significant questions relating to the whole of that affair for which have been ignored, and they are matters within the responsibility of the Prime Minister. acThere are many questions that have not been siganswered in this debate today. What were the real reasons for this loan? We have been told today that the objective was to try to nationalise the whole of the exploitation of Australian mineral resources. If that is so, why were those reasons not exposed to the people and to the Parliament at least 6 months ago? The only conclusion that one can reach through the whole of the machinations and the manner of the deceiving of the States through the temporary purposes Adermann, A. E. conception of that Executive Council minute is Anthony, J. D. that at no stage did the Government intend to Bonnett, reveal to those who have a responsibility in the Bungey, M. H. States the nature of its intentions. But it is only Cadman, A. G. because the whole nature of the dealings have Cairns, come into the Ught of day through the revelations Calder, in the Press that the Government nowfindsit Connolly, D.M. necessary to reveal what are the real purDrummond, P. H. poses-so it now claims-of its operations. Of course, there are many areas in which the Edwards, Minister for Minerals and Energy has let down Erwin, G.D. the States. He has just returned from Japan. In Fisher, some discussions he had with the Association of Forbes,P.S. Colliery Owners he asked some members of the Fraser, Malcolm Assocation to go to Japan and discuss with Garland, Japanese purchasers the prospect of buying coal 01168,0.011 at $57 a ton. Some members of the Association Hewson, H. A. went to Japan and negotiated contracts at $52 to Hodges, J.C. $54 a ton. The Minister went there last week and Holten, sold out the coal industry at $48 a ton. So much Hunt, R. J.D. for the integrity of the Minister for Minerals and Hyde, J.M. Energy. The whole of the circumstances of this Jarman, affair relate to a continued conflict between the Kelly, CR. Commonwealth and the States. There has been a Killen, D.J. continued and deUberate intent to hide from the Lloyd, B. States an opportunity to know the whole of the Lucock, P. E. circumstances of how and in what way we are Lusher, S.A. going to be nationaUsed in relation to the exploiLynch, tation of our natural resources. that certain questions will remain unresolved MCMahon, W. after this debate today. The only alternative is to MCVeigh, have a vote on the question of whether there Millar, P.C. should be a royal commission. If there is to be no Newman, K.E. royal commission the Prime Minister is charged Nixon, with the responsibiUty of handing in his comO'Keefe, mission and letting the people of Australia deRobinson, Eric cide. There is no other alternative. The charges remain.",133
153,Mr SPEAKER,VADUZ,"Order! The honourable Staley, A. A. gentleman's time has expired.",135
154,Mr CHARLES JONES,VADUZ," Mr Speaker, month",135
155,Mr SINCLAIR,VADUZ,"Mr Speaker, in order that the fate of the motion may be determined, That the question be now put. Question put. The House divided. (Mr SPEAKER - Hon. G. G. D. Scholes) Ayes 61 Noes 64 Majority 3 NA Armitage, J.L. Beazley, K.E. R. N. Bourchier, J.W. Bennett, A. F. Berinson, J.M. Bowen, Lionel Bryant, G.M. Kevin Caims, J.F. S.E. Chipp, D. L. Cameron, Clyde Cass, M.H. Child, G. J.L. Corbett, J. Clayton, G. Coates, J. Drury, E.N. Cohen, B. H.R. Ellicott, R.J. Collard, F.W. Connor, R. F. X. Cope, J.F. Fairbairn, D. E Crean, F. A. J. Cross, M. D. Daly.F.M. Davies, R. R. V. Dawkins, J.S. Graham, B. W. Duthie, G. WA. Enderby, K.E. Everingham, D. N. FitzPatrick, J. R. MCN. Howard, J.W. Fry, K. L. Fulton, W.J. Garrick, H.J. Gun, R.T. A. W. Katter, R.C. Hayden, W.G. Hurford, C.J. Innes, U. E. Jacobi, R. King.R.S. Jenkins, H. A. Johnson, Keith Johnson, Les Jones, Charles P. R. Keating, P.J. There is no doubt MACKellar.M.J.R. MCLeay, J. E. Keogh, L.J. Kerin, J.C. Klugman, R. E. D.T. Lamb, A. H. Macphee, I. M. Luchetti, A. S. MCKenzie, D.C. Martin, V.J. P. J. Mathews, C.R.T. F.L. Peacock, A. S. Morris, P. F. Morrison, W. L. Mulder, A. W. Robinson, Ian Oldmeadow, M.W. Ruddock, P.M. Patterson, R. A. Sinclair, I. MCC. Reynolds, L.J. Snedden, B. M. Riordan, J. M. Sherry, R.H. Street, A. A. Sullivan, J.W. Stewart, F. E. Thorburn. R. W. Uren.T. for the last Wemworth.W.C. Wilson, I. B.C. . Wallis, L.G. Whan.R.B. Whitlam, E.G. Tellers: Cameron, Donald WUlis, R. Young, M. J. I move: England, J. A. Tellers: James, A. W. Nicholls, M. H. Question so resolved in the negative.",135
