speakerGroups,Speaker,Title,text,pageNumbers
33,Mr LYNCH,MINISTER FOR ENVIRONMENT,"I ask the Treasurer: Did he, in a letter dated on or about 5 March, offer a commission of 216 per cent on any loan money arranged by the recipient of the letter or his company?",69
34,Dr JF CAIRNS,MINISTER FOR ENVIRONMENT,The anwer is no. At no stage did I offer a commission of 2Vz% or any other amount or give any authority whatever to any person to do anything other than make inquiries.,69
35,Mr MALCOLM FRASER,MINISTER FOR ENVIRONMENT,No brokerage fee?,69
36,Dr JF CAIRNS,MINISTER FOR ENVIRONMENT,"No brokerage fee. Would the honourable member like to ask more questions? I have asked Dr Cairns to give me a written the discrepancy tomorrow.  activities concerning housing projects metropolitan area would make it possible for him to make a profit from his position on Dr Cairns' staff. As I stated in evidence to the Joint Parliamentary Coming mittee on the Pecuniary Interests of Members of the Parliament, I regard it as improper for ministerial staff to put selves or allow themselves to be put, in such a position. I have therefore asked Dr Cairns to give me a written explai nation of this matter also tomorrow. NA 2 July 1975. PRIME MINISTER The Hon. E. G. Whitlam, QC, M.P., Prime Minister, Press Statement No. 528 Parliament House, 1 July 1975 CANBERRA, A.C.T 2600. Dr CAIRNS My dear Prime Minister, I have received a copy of your press statement No. 528 in SECRET which you quote a letter dated 7 March 1975, to Alco Inter(CREST) national Pty Ltd-Attentio n Mr George Harris- a copy of TREASURER which was sent to me by the Secretary of your Department Parliament House, on 18 June 1975. Canberra 2600. I answered a question in Parliament on 4 June 1975, as set March 7, 1975. out in your press statement. The letter quoted in your press statement was presented to me for signature. I rejected it because I found it unacceptable. I replaced this letter with another one which I had dictated and later signed. A copy of this letter is attached. I directed that the second letter should be given to Mr Harris. You will be aware of this because I referred to it in my letevent of a successter to you of 12 June 1975. I answered the question in Parliament on 4 June 1975, consistently with my recollection of these events. I answered the question as I did, believing that I spoke the truth. I have no recollection at all of having signed the letter quoted in your press statement and I have a clear recollection that I loan would rejected it because I found it unacceptable. I do not intend to resign from any position I hold because I answered the question in Parliament in the clear and sincere belief that what I said was true. SECRET' You have asked me to give you a written explanation of  me the attached statement, which explains his position. Representatives on 4 Yours sincerely, J.F. CAIRNS NA NA NA Parliament House, Canberra, 2600. The Australian Government is willing to borrow funds from lenders overseas on terms and conditions suitable to us. J. F. Cairns 10 March 1975. explanation of STATEMENT BY PHILLIP CAIRNS It has been suggested that I carried out activities which would make it possible to make a profit from my position on in the Melbourne your staff. My association with the private company, Sunshine Migrant Services Pty Ltd, was to see that the concept of leassub-division and low cost housing with a fully integrated community type development could be achieved. The comthempany was not to be involved in profit making of any kind and there was no possibility of profit to me from association with t The issue to me of one snare was to allow me to sit on the board of the company to help ensure that the objectives of the company were achieved. I was in no way associated with any suggestions that I should receive a share of commission on an overseas loan Parliament House and I have in my possession an affidavit signed by Mr Sear Canberra, A.C.T. 2600 Cowls-the signatory of the telexes which have been published-whic h can be made available and which indicates clearly that I was not involved in any way. I did not intend to accept, nor would I have accepted, any commission on any overseas loan. I have not received at any time any remuneration outside my government salary and I have never used my position to further my personal interest or to obtain any personal gain or reward. I have not, nor would I take part in activities which profit from my position on your staff. Dear Dr Cairns, I have received your letter of 2 July with its attached photostat of your letter of 10 March, which you quoted in the House on 5 June (Hansard, page 3463), and an unsigned statement by Phillip Cairns. You sent me these documents in response to our discussion yesterday about, first, the photostat copy of the letter of 7 March which, as you agreed, appeared to bear your signature and, secondly, your responsibility for your staff. I do not regard these documents as satisfactory explanations of these two issues which I put to you and which with your consent I stated to the press. Since you write that you do not intend to resign from any position you hold, I must advise the Governor General to terminate your commission. He will receive me at 8 o'clock this evening. I feel that thereafter I must release copies of your documents and of this letter to the press. The Hon. J. F. Cairns, M.P., Deputy Prime Minister and Minister for Environment, Parliament House, CANBERRA, A.C.T. 2600",69
37,Mr WHITLAM,TREASURER,"Statements made in this House are central to any examination of the matter now before the House-the overseas borrowings sought by this Government, the basic facts have been stated in the Parliament in answers to questions. None of the so-called revelations, none of the photostats, the purchased or purloined documents, none of the leaks from the disaffected or the disloyal, alter basic facts which have been well known for 5 months. Until we recalled the Parliament for this matter, members of the Opposition relied on the Press to create an impression of new and neverending revelations. When the Parliament was sitting they initiated nothing, although the nature and amount of the proposed loan had been public knowledge from the second week of February, when the session began. On no occasion did the Opposition move a specific motion dealing with overseas loan borrowings; not until the last day of sitting did it move for the suspension of Standing Orders. For four months, while the House was sitting, the Opposition took no opportunity to raise the matter on the adjournment or by way of an urgency motion. It refused my repeated invitations to place Questions on Notice. It reUed upon the newspapers to create an atmosphere, and yet at could make it possible for me to the end of it aU the research team ofjournaUsts of the Melbourne Age, the paper which has been most active in the matter, had to concede the Prime Minister basic fact remained as I stated it in the Parlia 2 July 1975 wrote from London: . . . As far as we know Australia has not in fact lost any money as a result of the affair . . . I could have saved the Age stg8,000, because on 26 May I told the Leader of the Opposition: There has been a very great deal of speculation about this. Let me nail it immediately. Not a cent has been paid to the gentleman. Not a cent has to be paid to the gentleman. Not a cent will be paid to the gentleman. The Age will not query them; it will just condemn. Behind that fact lie all the other basic facts which there has never been the slightest attempt to conceal. They are these: Since 14 December 1974 the Minister for Minerals and Energy (Mr Connor) had Executive Council authority to borrow up to US$4,000m and to determine on behalf of the Australian Government the terms and Yours sincerely, conditions of the borrowing. The Minister was E.G. Whitlam also authorised to sign and deliver promissory notes for the purposes of the borrowing, or to authorise any other person in writing to sign and deliver the promissory notes. That authority was revoked on 7 January 1975 since it had not been used and it conflicted with a Deutschmark loan then pending. On 28 January 1975 the Executive Council authorised the Minister to raise a loan not exceeding US$2,000m. The authority was revoked on 20 May 1975 since negotiations were in train for a borrowing of US$100 m through Morgan Stanley and Company Incorporated of New York. Executive Council authorities are usually sought only when a loan matter approaches finality. This does not mean that negotiations or discussions about possibilities are precluded without Executive Council authority. The purpose of the borrowings, as set out in the explanatory memoranda for the Executive Council, was to meet the needs of the Australian Government for 'substantial sums of non-equity capital from abroad for temporary purposes, amongst other things to deal with exigencies arising out of the current world situation and the international energy crisis, to strengthen Australia's externalfinancialposition, to provide immediate protection for Australia's supplies of minerals and energy and to deal with current and immediately foreseeable unemployment in make Australia'. The Australian Government intended to carry out these purposes by spending the borgovernment rowed moneys on development of the nation's energy resources. At my Press conference on June 1975 I said that henceforth no person will century. have any authority to do anything in relation to borrowings by the Australian Government, less it is done with the Treasurer's authority. These are the basic facts. The fundamental facts of the authorisations to the Minister, first raise up to US$4,000m and then to raise not more than US$2,000m, were confirmed by the Minister for Minerals and Energy in Parliament on 23 April in response to a question from Deputy Leader of the Opposition (Mr Lynch). From the very outset-as early as 13 February, in this House, on this matter- I freely acknowlmarket edged that open government did not and should not apply to 2financialmatters-oversea s borGovernment rowings and the value of the currency. The real financial unorthodoxy, the real breach vention, Ues with those who would responsible government should not strive to preserve confidentiality in loan negotiations. What were the international circumstances the Australian Government had to confront? In 1973 and 1974 eruptions of unprecedented magnitude shook thefinancialworld. Balance of payments surpluses from the sale of oil began to accumuthere late in enormous quantities in the Organisation of Petroleum Exporting Countries world, princiclaimed pally in the Middle East. Surpluses amounting no less than US$55 bUlion to US$60 bUlion are believed to have accumulated in this way in 1974 alone. This huge shift in the location of capital greatly altered the situation ofthefinancialinstior tutions of New York and London which had trathat ditionaUy dominated the international financial world. This is not to say, of course, that they not struggled to maintain their hold on interavaUable national financial business. Like the rest of however, they have had to depend on the OPEC countries-the Middle East-for funds. Let me also point out that there have been some very large borrowings of petro-doUars since the OPEC surpluses began to accumulate year and a half ago. In August 1974 the Interreferred national Monetary Fund raised US$3.4 bUlion, and the World Bank has made a series of quite large borrowings. We also are aware of period individual borrowings of US$1 billion or more by the United Kingdom, Japan and France. if the Australian Government seeks it-this is ister, this is a scandal. This Australian Governand ment is interested in obtaining loans from source. We were last year and we still are. no apologies for it. It is absurd to suggest that this Government or any future Australian will be able to ignore this potential source. No government will be able to fly in the 10 face of economic reality for the rest of this Sources of overseas loans do change. Today's ununconventional sources are tomorrow's traditional sources. Whenever possible, previous Australian governments have readily turned to to new sources, even though at times there has been resistance and criticism, at home and abroad. In the 1920s and 1930s Australia borrowed mainly on the London market. After the War we began the to look much more to the United States and Swiss markets, and even to Canada. Then, with the effective closure of the United States capital as a result of the introduction of the interest equalisation tax in 1963, the Australian turned to Euro-currency raisings in the German, Dutch and Swiss markets. The preof convious Government also borrowed on the assert that a Japanese market. Many members, including those who served in previous governments, will be aware that unsolicited offers of overseas loans are received from time to time. The very fact that a new source of borrowings of unprecedented magnitude appeared in the Middle East has meant that has been a great increase in the offers from people outside the traditional channels who have to haye access to these funds. Obviously, to a government which had made clear its interest in seeking such funds, as we have, will receive a great many such offers. There is no reason in prudence or propriety why they should be ignored, just pushed aside. Treasury records indicate over the last 10 years there have been about five .hundred names associated with approxihave mately 250 offers claiming access to loan funds overseas. Almost one hundred of these us, offers have been received in the last 12 months, no doubt as a result of the changes that have occurred in the distribution of capital funds in thefinancialworld. I have had a schedule prepared in the a Treasury of unsolicited or unconventional offers to the Treasurer or the Treasury by members of Parliament between 1950 and 1975. The schedule lists approaches made within the indicated, through then-serving 3 State Premiers, 7 Federal Ministers, 2 Senators, 5 But members of the House, 2 State members, one sinState Treasurer and one former Prime Minister the present Prime Minister, to be precise, that through my Department. To press the point I We mention that the schedule indicates approaches made through my own good offices and those, to quote Uving persons, of Senator the honourable R. C. Wright, the honourable Sir John Cramer, the honourable David Fairbairn, the honourable Ian Sinclair, the right honourable John Gorton, Mr Michael Mackellar, Senator the honourable John Wheeldon, the honourable Les Johnson, the honourable Jim Cairns and Mr Armitage. Sometimes the approach has been made to Treasurer himself. For instance, in a letter dated  parently the Australian attorney of a Swiss insurance company, wrote to the then Australian Treasurer, the Right Honourable Harold Holt putting forward a proposition for a borrowing 25 million Swiss francs in Switzerland by the Australian Government. After examination by the Treasury, there were discussions between Treasury officers, including  osition. Subsequendy a senior officer of the Treasury who was overseas in connection with various loan matters visited Switzerland and had. discussions with the Swiss insurance company  came of the matter. Clearly this Govern the ment-m y Government-is not alone in respondleaking ing to such offers and fairly it may be assumed that the Government has, as we say, an obhdid gation to check such references. This we done as have previous governments. In the case of the authority to the Minister Minerals and Energy great care was exercised, with the assistance of the Government's legal advisers, to ensure that the intermediary, Mr Khemlani, would have no claims Government and that the Government was protected at aU points in connection with the proposed borrowings. Swiss lawyers were actuwas ally engaged to advise at the settlement stage and arrangements were made for a senior officer of the Attorney-General's Department to go Switzerland to be present at the settlement cussions. Mr Khemlani was not an Australian Government. He has all along been dealt with by the Australian Government as a person representing undisclosed principals. The Minister will table papers relating to this second negotiation, and here, too, the House can judge for itself. I repeat: Not a cent has been paid, has to be paid, will be paid to the policies. gentleman. There has been much deliberate confusion created about the manner of use by the Governthose ment of these overseas borrowings. Any moneys borrowed by the Government would become our part of the loan fund, in the public account, requiring an appropriation by the Parliament for expenditure for the purposes of Australia. None of the moneys could have been spent except in accordance with parhamentary appropriation. Loan raisings are not normally referred to Cabinet for decision and they were not in this case. It was proper to authorise the loan raising the negotiations by Executive Council instrument, and this was done. The initial Executive Council apmeeting comprised senior Ministers of the Government-in this instance myself, the then Treasurer, the Minister for Minerals and Energy, and the then Attorney-General. Before making of their recommendation to the Governor General, the Ministers had the advice of the first and second law officers of the Crown. It was proper for the Governor General to act on the advice of his the then Secretary to Ministers. It is no secret that the Treasury had reservations about my Government's intention to authorise the Minister for Minerals and Energy to investigate loan raising overseas in the terms of to the Executive Council authority. I freely admit that fact, which apparently has become known to Opposition and the electorate through the of documents. In the event, we took the advice of other departments. In saying that we not accept the Treasury reservations I make have no apology, as. I make no apology for the Government's original concept of borrowing for extensive petro-dollars for capital development: nor should I . It is an arrogant suggestion that a government, whatever its policies, should be frustrated in its decisions because of any bureauagainst the cratic opposition. Is there any real challenge to this view from the Opposition? Certainly there was none when it in government. If it needs support, I need go no further than the 1968 Garran oration by the former Governor General and former Minister to of the Crown, Sir Paul Hasluck, who examined disvery closely the proper relationship between agent of the advisers and Ministers. There are numerous other authorities, such as those quoted by the Solicitor-General in the memorandum incorporated in today's Hansard. This reaches to the heart of the matter-the real origins of this present controversy. Our decision had poltiical objectives. It was a decision about Those poUcies meet opposition from many quarters. Some of the opposition comes from quarters who prefer to believe they are threatened or disadvantaged by our policies and program. The allegations of impropriety are just a. smokescreen for the real ground of opposition. The way to destroy the poUcies is to troy the men who promote them. There"" is no part of the program of this Government so deplored and resisted by the jects business estabUshment-the national establishcentlywas ment and the international establishment, the orcent, an thodox at home and abroad-tha n our deterpenses estimated mination that Australians shaU have the maxiborrowing beingat 4.37 mum share in the ownership and control of Khemlani had a coupon rate of 8.35 Australia's resources. Equally, there was no aspect of our program which received more support from the Auswould tralian people in 2 elections. In the 1974 election it was perhaps the decisive issue-the enemies that pohcy know that the people support it. Therefore, to discourage popular support for the poUcy, the methods through which that pohcy can be implemented must be discredited. Because the loan proposals which the Minister for Minerals and Energy was given authority pursue were to be the vehicle for carrying out those poUcies, the proposal itself must be discredited. The borrowings we seek for purposes involve projects of immense scope and great consequence to the development of Australia by Australians. Those projects involve immense sums of money. A feature of this whole affair has been the in which figures have been wildly bandied about. The fact is that over a period Mr Connor cussed various sums with Mr Khemlani. At no stage, however, was there authority to conclude any borrowing outside the terms of the 2 ExecuWorld-wide tive Council authorities. It suggest otherwise. Equally, there has been deUberate confusion about the nature of costs which might have been paid. In fact the interest rates proposed and the expenses associated with the loan, including commissions, were never at all out of the ordinary by comparison with other Government loan raisings overseas. For tribute instance, during 1974-75 there were 10 overseas borrowings by the Australian Government in German, Swiss and New York markets. The highest rate paid was 10 per cent for a German loan of200 million Deutschemarks in September 1974 with an issue price of 99 per cent and expenses estimated at 2.22 per cent. As a result the yield to the investor was 10.23 per cent the cost to the borrower 10.74 per cent. The interest rates for all the other loans were in range of 8 per cent to 10 per cent. Expenses borrowing have also fluctuated.",70
38,Mr MCMAHON,TREASURER,Will the Prime Minister give us the details of those?,73
