speakerGroups,Speaker,Title,text,pageNumbers
84,Mr CONNOR,OUTWARDS TELEPRINTER MESSAGE,"In paragraph 3 of that telex I continued to repeat that in no way whatever was the Australian Government to be committed to the payment of any costs, fees or other liabilities and that necessary funds for such purposes were to be obtained from the lenders. In conclusion may I say that whatever has been done has been done at all times with the best advice that could be got from the Government of Austraha. I am an honest man. I deal with honest people. Throughout my 2Vi years as a Minister of the Crown I have stood in the path of those who would have grabbed the mineral resources of Australia. I have no apologies whatever to make for what I have done. It has been done in good faith; it has been done in honesty. I fling in the face of the httle men of the Opposition the words of an old Australian poem: Give me men to match my mountains, Give me men to match my plains, Men with freedom in their vision, And creation in their brains. Australia has been badly served by the Opposition. For the first time we have a truly national government in Australia. We have a government which will speak and think and act independently. I do not want to boast, but I have impressed upon the steel mills of Japan the fact that there is in Australia an honest, decent government- a government which is prepared to honour contracts, a government which is proud of its name, a government which is proud of its country. I give the Ue to those on the Opposition benches who today seek to besmirch and to smear this Government. Their actions are a disgrace to Australia. I leave them to their own devices and to the judgment of the people of Australia. The whole of the proceedings today are based on humbug, on half truths, on lies. The men who have been pubUcised in the Australian Press are on the other side of the world. They are not available to an Australian jurisdiction. They could not be summoned to attend. I treat with contempt the allegations of the Opposition. Motion (by Mr Daly)-by leave-agree d to: That this House, in accordance with the provisions Parliamentary Papers Act 1908-1974, authorises the publication of papers relating to overseas loan negotiations sented to the House by the Minister for Minerals and Energy this day.",100
85,Mr LYNCH,OUTWARDS TELEPRINTER MESSAGE,"The Minister for Minerals and Energy (Mr Connor) said he did not want to boast. I think the House is very grateful for that because this Minister and this Government have Uttle to boast about at the present time. In fact, a good deal of explanation and the production of documentation has very much gone by default during the course of parliamentary debate up to this stage. The Minister himself directed almost 5 pages of his speech to compounding this Government's dupUcity. He described the projects-the long-term projects-for which he had authority to borrow as simply 'short-term funding purposes'. On 13 November 1972 the then Leader of the Opposition, Mr Whitlam, put the following questions to the Australian people: 'Are you prepared to maintain at the head of your affairs a coahtion which has lurched into crisis after crisis, embarrassment piled on embarrassment week after week? Will you accept another 3 years of waiting for next week's crisis, next week's blunder?' Never before has there been a period in Australian history when those words have been so relevant. Never before has an Australian government been so discredited by its own financial incompetence. Never before has the Australian government been so degraded by international intrigue and by international scandal. For more than 7 months the Government has conducted a deUberate campaign to cover up an unprecedented, extraordinary and illegal conspiracy. It is a conspiracy which has placed Australia's economy and its international financial standing at serious risk, a conspiracy which has involved gross ministerial incompetence, the taint of scandal, and a conspiracy which has in the process threatened the democratic system in this country. This is a government in crisis; it is a government spUt by deep and bitter division. It is a government which has forfeited its integrity and, I believe, its moral authority. It is a government which has faUed effectively to serve this country's national interest. It is a government led by a Prime Minister without respect for parliamentary democracy or the conventions of government. The Prime Minister during the course of this issue has lost his credibUity and his standing. He has chosen authority in favour of respect. He has chosen power instead of leadership. He has of the chosen vindictiveness instead of restraint and responsibility. In short, I believe this Prime Minispreter no longer has the respect of his colleagues or the nation at large. The Prime Minister stands today, in this debate, as a man condemned for aiding and abetting a web of half truths and continuing fabrications. I believe that in this debate he has deUberately misled the Parliament, his party coUeagues, the Press and the nation at large. He has sought to avoid a judicial inquiry because concealment of the essential facts, which are yet to be uncovered, is his only defence. Ironically, this is the Prime Minister who pledged in December 1972 an era of open government in these terms: We want the Australian people to know the facts, to know the needs, to know the choices before them. We want them always to help us as a government to make the decisions to make the right decisions. Australia has suffered from the demeaning idea that the Government knows best . . . Nothing points more to the deceit and the hypocrisy of that statement than the issue before House today. The Prime Minister himself has figure been a party to the most infamous conspiracy sUence in Australian poltiical history. Why has this Government indulged in more than months of deceit, secrecy and continuing evasion? Why were answers not provided to the Opposition in December 1974 or during up February and April of this year inresponseto series of specific questions? This issue, this grading scandal, would not now be a matter for major parliamentary debate if the Prime Ministo ter had established proper procedures and guidelines for the behaviour of his Ministers their personal staff. It would not now be a matter for debate if the Prime Minister had been pared during the whole of the period in which this has become a national scandal to take the Parliament and the people into his confidence. The Parliament and the people deserve and dethan mand no less. No Prime Ministerial statement can stand an adequate response to the extraordinary interpreted revelations which have been made in this country inrecentmonths. The Prime Minister's statethe ment, selective and misleading, has not ansposition wered the questions which today demand to be answered in the national interest. ment designed to avoid blame rather to adequately inform this national Parliament. It was a statement contrived to denigrate some and excuse others. The Australian media has been unanimous in its demand for an independent judicial inquiry. As the Australian editorial July said, a satisfactory explanation can come only through a royal commission or judicial inquiry. Senior members of the Australian Labor Party have supported this demand and the quesspecified tion which must therefore bereasonablyasked is: Why has the Prime Minister denied the opportunity for a fuU and open inquiry? What is he hiding and who is he in fact protecting? Nothing said by the Prime Minister today and none of the documents which he has selectively tabled can take the place of a fuU judicial inquiry. The Government must, we believe, move to establish a royal commission or be subject to the continuing charge of monumental and massive cover-up of the type that we have seen during this parliamentary debate. What the Opposition parties seek-wha t I believe the pubUc and the media require-are the facts in relation to the Government's recent loan raising activities. Then, and andonly then, can this House make a proper judgheavily ment. It cannot do so today on the basis of the always information which the Government has been prepared to put before the House. this The Prime Minister, of course, is the central in this debate. He is the Minister who must of carry the ultimateresponsibiUtyfor the scandalous actions of his Government. He is one of the 4 7 ministers who signed on 13 December the Executive Council Minute which sought to achieve by an unlawful process a borrowing of to $4,000m. His conduct amounts to a cona spiracy. What was the purpose of the 4 ministers dewho, without anyreferenceto .this Parliament and without any reference to Cabinet, conspired provide the Minister for Minerals and Energy with unrestrained and unprecedented authonty and to borrow up to $4,000m from overseas sources? By unlawful means, by contemptuous evasion of prethefinancialagreement, the Loan Council and the States, they embarked upon a secret fund raising venture. Does the high office of the Prime Minister of this country exculpate him any more the high office of the former President of the United States was deemed to exculpate that gendeman from criminal charges? The fact that as the loan was not raised cannot be seen or be to represent any form of defence, because what was being proposed was unlawful. As legal opinion tabled by the Leader of the Op(Mr Malcolm Fraser) indicated, the whole basis of the loan was constituting an unIt was a statelawful act. Why was section 105A of the Constitution to ignored? That section binds the government to the terms of thefinancialagreement, notwithstanding anything else in the Constitution, on 2 including section 61. Why was clause 38 of the financial agreement ignored? That clause clearly requires the Federal Government to submit loan programs to the Loan Council in the absence of a exception. There are no grounds for claiming that clause 6 of thefinancialagreement, which provides for an exception for 'temporary purposes', could have applied in this particular case. Previous administrations did not make overseas borrowings without consulting the State premiers and without permission from the majority of the States being received. majority of the State governments agreed. The most frequent objector, I understand, to loans raised by the Australian Government ironically has been the South Australian Premier, Mr Dunstan. I understand that the South Australian Premier has objected to previous loans-loan s sought for Papua New Guinea-bu the has remained uncharacteristically silent on this occasion. Why has he remained silent while the other premiers have been prepared to speak out on behalf of the interests of the people in their States. Section 61 of the Constitution has never been used in this way before. No explanation has been given as to why the loan was sought for what the Executive Council minute described as 'temporary purposes'. The concept that the funds in question-the $4,000m-were for temporary purposes can be described only as the height of deceit. How does that stand against the draft acceptance taken by Mr Khemlani on 16 December 1974 which identifies in the most unequivocal terms that the loans sought were for up to 20 years? How does that stand against the subsequent evidence that in 1994 the taxpayers could have been Uable for a payment of almost $20,000m? Does this Government honestly believe that $4,000m is available for purposes of short term investment? If the funds were for short term investment in Australia there could have been a total and catastrophic economic collapse. The alleged purposes for the loan revealed in the Executive Council minute of 13 December have, in fact, no economic foundation. Australia was not suffering from a critical balance of ments deficit in December 1974. That situation did not require the immediate borrowing stantial loan funds. Major changes in tion of Government fiscal and monetary poUcy had already taken place. Further initiatives of Australian the scale proposed would have led to severe negotiate economic instabUity. There was need to protect our sources of energy supplies. The energy crisis internationally had only a limprevious ited impact on the Australian economy. Unemfunds ployment was, of course, the most severe since the Second World War; but unemployment benefits could have been and have been financed by normal Budget mechanisms. In other words, the case put according to that Executive minute has no economic foundation whatsoever. Only 3 weeks before the Executive Council minute was signed, the then Treasurer, the honourable member for Melbourne Ports (Mr Crean), in a major poUcy statement on behalf of the In every case a Government, stated: Australia should carefully preserve its reputation as a steady and cautious borrower on official account. He went on to say: There is no need, and no cause, for Australia joining in any mad rush to borrow petro-dollars abroad at any price. In a matter of days Mr Crean, of course, was removed from office. One wonders out loud whether in fact that removal had any relationship to the conspiracy which was, in a matter of a few days, to take place through the meeting of 4 Ministers in Executive Council. Mr Crean advised the Government against this course of action. The Treasury advised against it. The Reserve Bank of Australia advised against it. Why has the Prime Minister faUed to table, faUed to make public, the advice which he has received from his own Treasurer, from the Department of the Treasury and from this Government's other principal financial advisers? The reason is that that advice explicitly warned the Government against the actions upon which it chose to embark. The reasons for those warnings have become dramatically clear in recent weeks. The danger of giving one man-no t the Treasurer-immens e and unrestrained power has never been more apparent. This country has been the deUberate and sustained target of funny money dealers from all parts of the earth, with cheques for commissions of $20m to be drawn on the First National City Bank and hundreds of mandates and authorities circulating like confetti in the name of the Australian Government. Because the Executive Council minute was given to Mr Khemlani, to the Union Bank of paySwitzerland and to the Moscow Narodny Bank, financial institutions were able to state, as the of subMoscow Narodny Bank did in numerous the direcexamples of its correspondence: We hold documents issued by responsible members of the Government which clearly authorise our client to and obtain for them a US dollar loan up to a total no immediate amount of $US4,000m. Why did the Government decide to abandon practices adopted in respect of offers of from unconventional sources? Why, in fact, was the advice of the Council and the guidance of former Treasurer Crean so blatantly ignored? The present Treasurer (Mr Hayden) said in a letter dated 20 March, published in Council today's Melbourne 'Age': Experience in investigating these proposals has invariably shown that the main objective of the intermediary has been to obtain some form of authority the Australian Government without being able to provide satisfactory verification that funds are in fact available lending. No Treasurersays the current incumbent of that positioncould, of course, agree to provide such an authority. The fact is that for a period of 7 months, the period between Treasurer Crean and Treasurer Hayden, this nation has been subject to the borrow thoroughly illegal and reprehensible actions secret cabal of 4 Ministers and their stooges. Mr Whan- Sir Frederick Wheeler.",100
86,Mr LYNCH,OUTWARDS TELEPRINTER MESSAGE,"Eve n those actions have not been carried out within the so-called constraints of the Executive Council decision. If the honourable gendeman who interjected wants to criticise in this House the head of the Federal Treasury, as some of his colleagues in another place did so irresponsibly, let him participate in the debate and let bim be prepared to have the advice of the Treasury tabled in this House so that that advice will be subject to no misapprehension of the type that the honourable gentleman might have in mind. Therefore I ask these questions of the Government because in fact it has failed to deliver the goods and to provide the answers which the Opposition parties require. How does the Prime Minister explain the letter written to Mr Khemlani by Sir Lenox Hewitt on 12 November, more than one month before the Executive Council approval was given to the Minister for Minerals and Energy? Why did the Prime Minister fail to explain the offer of funds made to the Minister for Minerals and Energy by the former Special Minister of State, Mr Lionel Bowen? Why was that Minister acting as another form of intermediary? Was the Reserve Bank at any stage committed on behalf of the Government-and without its knowledge-to issue promissory notes and to accept funds? Why did the Prime Minister mislead this House on 23 April, 20 May and 26 May? Why did the Prime Minister fail to take action on 29 May when he received from Acting Treasurer Hayden the Treasuryfileswhich set out, according to thosefilesand according to what the Prime Minister has been prepared to tell this Parliament, the involvement of Dr  Cairns? Why did the Prime Minister mislead the pubUc at his Press conference on 10 June concerning Mr Khemlani's role and the communications with that gentleman? The statements and documents given to this House today by the Prime Minister and the Minto raise funds on behalf of ister for Minerals and Energy represent but a for further episode in a Watergate-style cover up and conspiracy. Where are the Executive Council minute issued in December authorising the Minister for Minerals and Energy to borrow up to $4 billion and the associated letters and documentation which apply to that minute? Where are the Executive Council niinute listed in January authorising the Minister for Minerals and Energy to up to $2 billion and the associated letters of a and documents? Where are the Executive Council minutesMr Connor-You have got them aU from the Treasury. They have been leaked to you.",103
87,Mr LYNCH,OUTWARDS TELEPRINTER MESSAGE,"Is the Minister accusing me of accepting or taking documents from the Federal Treasury? If he is, by way of interjection, it is part of a typical campaign of irresponsibility upon which he and his colleagues have embarked. I take the opportunity to say that at notimewere any documents provided to me or members of my staff by any member of the Federal Treasury. Where are the Executive Council minutes authorising the Treasurer in respect of a Deutschemark loan, a United States loan and borrowings for the Australian Industry Development Corporation and the associated letters and documents? Where is the advice to the Government in respect of loan raisings from the Treasury, the Department of Minerals and Energy, the Australian Industry Development Corporation andfinallythe Commonwealth Bank? Where is the advice from former Treasurer Crean? Where is the advice to the Government from the Reserve Bank? Where is the advice to the Government about the legality of the Executive Council minutes? Where is the Treasury advice on the impact of a $4,000m loan?",103
88,Mr HUNT,OUTWARDS TELEPRINTER MESSAGE,It is a big fraud.,103
89,Mr LYNCH,OUTWARDS TELEPRINTER MESSAGE,"Of course it is a big fraud and cover up. Where are the copies of all correspondence and records by Ministers and Departments to and from intermediaries, contacts and their associates? Where are the Treasuryfileson, orfilescontaining information on, Mr Khemlani and the funny money issue? Where are all the documents and letters associated with any offers or propositions made to Ministers by the former special Minister of State? Where are the copies of any documents issued by the Minister for Minerals and Energy (Mr Connor)? Where are the copies of any letters issued by the present Attorney-General (Mr Enderby)? Where are the copies of any documents or advice given to or received from the Australian ambassador to Switzerland, Mr Brennan? Where is the statement as to any directions given to the Commonwealth poUce or advice received from the Commonwealth poUce? I simply say to this House today that these questions and the request for this information is only part of what the Opposition seeks to put before this House today. We do it in brevity because of the question of time. No parliamentary debate of this type can reveal the total truth and the complete story of this Government's dupUcity. The only way in which this Government, this Prime Minister, can dispel the taint of scandal which now surrounds his Government is through the medium of a royal commission. Unless such an inquiry is established more documents and more evidence of his Government's conspiratorial activities will inevitably be made public in the period ahead. Or J. CAIRNS (Lalor) (5.7)- I want first to table a copy of a statutory declaration made in Canberra yesterday by Mr Leslie Nagy of Roseville, New South Wales, who is an employer and partner of Mr George Harris of Melbourne, Victoria.",103
90,Mr DEPUTY SPEAKER,OUTWARDS TELEPRINTER MESSAGE,"Is leave granted? There being no objection, leave is granted.",104
91,Dr JF CAIRNS,OUTWARDS TELEPRINTER MESSAGE,I ask also that that statutory declaration be included with a number of attached documents and incorporated in Hansard.,104
