speakerGroups,Speaker,Title,text,pageNumbers
94,Mr WILLIS,TRADE UNIONS,"The Minister for Employment and Industrial Relations (Mr Street) accused the Opposition of losing ar-touch with reaUty. I suggest that his own statement, that the irresponsible action of a few trade union officials was preventing economic recovery in this country, shows how much out of touch with reality this Government has become. The fact is that, despite the Minister's protestations, in the period it has been in office this Governdeal ment has engaged in a campaign of denigration and vilification of at least part of the trade movement. In fact, when the Government talks about only a few people being involved, usually it is accusing the trade union movement of actionworking which encompasses many more than just a few people. The Newport project dispute, to which will come later, is a good example of that. Firstly, let me say that even before Government came to power its members ran a campaign of vilification against trade union officials. They concentrated on a few unions, such as the Amalgamated Metal Workers Union, and said that the leaders were unrepresentative of their unions because they were elected by very small proportion of the membership. The sheer cynicism of the action of Government members in that regard has been shown by whatvironmental has happened this year. The Government, havlost ing provided for compulsory secret postal ballots for the election of union officials, found that legislation had endangered the tenure of office some ultra right wing officials. The Government then passed legislation to allow union officials be elected by an amazingly small proportion their union membership. For instance, approximonths mately 0.02 per cent of the membership now elect the officials of unions which decide to the collegiate system. The sheer cynicism of Government's action in this regard has been amply displayed. Members of the Government Parties have blamed the union movement for lems existing today. The Minister has mentioned some of them in this debate. For instance, in regard to the economy there is no doubt that theticularly Government has tried to use the union movegration ment as a whipping boy for its failure to get economy going. We heard that claim from the Minister who preceded me. In regard to wage indexation, the Government, having broken its promise to support wage indexation, has tremendous attacked the trade union movement for not try accepting a form of wage indexation which of would mean drastic cuts in the real wage levels workers. To expect the trade union movement support drastic cuts in the real level of wages absolutely absurd, particularly given the in Government's initial promise. Yet, that is the line that the Government has pursued. The same can be said with respect to strikes. The Government has tried to pretend that strikesthe have been so high that this has been a problem in regard to economic recovery in this country. The fact is that, with the exception of the various strikes on the Medibank issue, with which I will in a moment, the number of strikes in Australia this year has been extraordinarily low. unionIn the first 7 months of this year, excluding Medibank strikes, the number of working days lost has been 56 per cent less than the number of days lost last year. So, Medibank strikes excepted, there has been a much lower level of Istrike activity. The Government cannot blame that level of strike action for the problems that it this has in regard to the economy. It is true that strikes have been held on the Medibank issue. On one day, some 2 million working days were lost. Overall, the number of working days lost this year is sUghtly in excess of what it was in the period up to August last year. a Nevertheless, the fact remains that only 4 per cent of all strikes have been poUtically motivated or motivated by sociological reasons such as enissues. The number of working days this year is only fractionally higher than the number lost last year. Let us put this into context thatand compare it with losses being caused to the ofeconomy through unemployment. If the Government were able to put another 100 000 people toback to work it would have achieved 14 million of extra working days in the course of thefirst7 of this year. As against that there have canbeen 1.2 million working days lost through adoptstrikes apart from the Medibank strike. If we the include the Medibank strike the figure is just over 3 million. That puts the losses to the economy into context. Losses to the economy from strikes are minor when compared with losses various probthrough unemployment. Then the Government has blamed the unions for the destruction of particular industries, parthe ship building industry. In its deniit ignored the union's actions in relation theto the shipbuilding industry and it continually ignored the basic problems which that industry is having internationally, such as the problems of low prices from the Japanese which are causing difficulties in the shipbuilding indusin Western Europe. It also ignores the paucity new investment in the industry in this country ofand the fact that the industry is operating on a to one off or two off basis all the time without is specialisation. These factors are very important relation to productivity but they get practically no mention from Ministers who discuss the shipbuilding industry in this countiy. Their whole emphasis is on eUminating strikes. In fact over past year or so the unions have gone a long way towards eliminating strikes and stoppages in the shipbuUding industry. Demarcation disputes have virtually disappeared. Again the Governtorian ment is using the unions as an excuse for probrelating lems that it has in that industry. Denigrating union motives in other disputes such as the Newport power station dispute also been popular with this Government. In fact the actions of the unions in placing port have not resulted from the actions of a few. They have been the result of the action of a jority of delegates to the Trades Hall Council Melbourne, not some small unrepresentative ing group of militants but a majority of the unionsern just a majority admittedly, but a majority. The Prime Minister (Mr Malcolm Fraser) and the Minister for Employment and Industrial Relaworkers, tions have said that the motivation of the unions is poltiical. Patently that is untrue. The unions' motivation in this dispute has been utterly altruagement istic. Their motivation principally has been of the environment but there are also other issues, as the honourable member for Melbourne (Mr Innes) mentioned, such as town planning and resources. If we look at the environmental issues briefly we can see why the unions are so conindividually cerned. There is a great amount of evidence about now regarding the poisonous level of the atmosphere in Melbourne. If we look at the tory of"" the granting of the licence for the power station in Newport we can see that in fact the Government pressured the Environmental Proto tection Authority and the Appeals Board in a way which enabled the Newport power station to be given the okay. The fact is that after the first decision by the Environmental Protection Authcan ority the State Electricity Commission appealed it. Because the limits set were too tight consertion. vation bodies appealed it as well. When the ter went to the Environmental Protection AuthOpposition ority Appeal Board the Board increased the allowable Umits for ozone in the atmosphere so that the power station could get a licence. To give the House an idea of the enormous increase, it provided a standard of 13 parts per 100 million for ozone in the atmosphere compared with parts per 100 million laid down by the World Health Organisation and 8 parts per 100 mtflion laid down by the United States Environmental Protection Agency. So there is no doubt that Appeal Board lifted the standard to provide cence for the power station because sured very hard by the Victorian Government. Through those cases the State Electricity Commission said that it would build the station ever happened at the inquiry. Whilst those inquiries were going on the VicGovernment let contracts worth $100m to Newport despite the fact that it did not have environmental approval. Then it said that if the unions did not let the project go ahead $100m would be wasted. It is the fault of that has government because it took quite precipitate action in letting those contracts before it had enbans on Newvironmental approval. maThe fact is that the Newport power station disin pute is only representative of what is a developtrend in this countiy and the rest of the westcapitalist world-that unions are increasingly concerned not only with straight industrial issues such as wages and conditions of employment but through their unions, are becoming increasingly concerned about what they do with their labour. They want to be involved in mandecision making and they are challengone ing managerial prerogatives. That is one very substantial development in worker participation. It is not just happening in this country but is happeningrightacross the western capitalist world. This raises the issue of whether we believe that just workers should have the right, either or collectively, to withhold thenlabour from projects which they believe are contrary to the best interests of society. This Aushistralian Government denies them that right, as indeed do all the conservative governments in this country. The Victorian Government denies it the point where it has introduced and passed legislation which virtuaUy amounts to civil conscription. It has said that workers who will not work on vital State projects, as it declares them, befined;that people who oppose such projects can befined.This is a form of civil conscripIt is opposed strongly by the Labor movematment, the Australian Labor Party and the in this Parliament. It goes totally against the evolving role of unions and extends beyond their conventional industrial issues. The answer to all this is to extend the role of unions to allow them to be involved in the planning process. No one wants this confrontation at the end 6 after a decision has been made and investment has been made. The project then has to be blocked by union decision. It is better if workers are involved in the planning process at the very the outset. That is proper worker participation in a Umanagement and governments eventually will it was preshave to abide by it",34
95,Mr DEPUTY SPEAKER,TRADE UNIONS,Mr Lucock)whatOrder! The honourable member's time has expired.,36
96,Mr CONNOLLY,TRADE UNIONS,This morning we have heard 2 speeches from Oppo-the sition members in support of a matter of public importance. It is regrettable that neither speaker spoke to the subject which was meant to be the substance of the debate.,37
97,Mr WILLIS,TRADE UNIONS,That is totally untrue.,37
98,Mr CONNOLLY,TRADE UNIONS,"Let me go through this decided matter item by item and take the opportunity define the terminology used. Let us analyse the Opposition has said and compare that with the facts of the situation. We were told that Federal Government had instituted a campaign to denigrate the trade union movement. We werefew also told that it denies the trade union movementAugust the right to be involved in matters of legitimate trade union interest. Let me go through those step by step. Where is this campaign? As the con-accept stitutionally elected, government of the people Australia it is our responsibility and ours alone lay down the guidelines for the economic development of this nation-economi c developupset ment which at this stage has faltered. One oftheelected reasons why it has faltered is because there is small group- I emphasise that it is a small group-of militant communist and left-wing ment trade union leaders who have made it quite at every opportunity they get, that they do not Uke the arbitration system, that they do not to Uve under the social system and that they wishconsensus. to destroy the system. Let us look at the realities. If they do not the system they can go and live in the Soviet Union. If they wish to destroy the system they process. can take to the streets where they will be subject to the laws of the land. But if they are prepared to work through the constitutional system, the electoral system of this Parliament, they have right to do that too. What I fail to see is small group, and it is such a small group, can encouraged by the Australian Labor Party to be-of Ueve that it can use its power to destroy, to denigrate and to disrupt the daily activities of the jority of Australian people and of its own trade union rank andfilemembers. If it were not for the fact that one-third of trade union members vote for non-Labor partiesSecretary we could never form a government. If honourquestion: able members examine the trade union movement as a percentage of the total workforce they will see that the trade union movement the represents only just over 50 per cent. What about the remainder? Is it not to be given any What about the mUlions of people in Australia The union who do not belong to trade unions but who system dutifully live by the democratic system they understand and which they respect? Does Opposition seriously suggest that the Government, for some extraordinary reason, is presenting itself as a campaigner against the rights of the trade unions? We are here because the majority of Australians put us here. We are not going to fail them because a small group of trade unionists- I again emphasise that pointthat it does not Uke us, does not like our topoUcies, does not like the system of government whator anything that comes from it. the When we consider the harassment which has fallen upon the average trade unionist, in the last months, in fact in the period from January to this year, trade unionists and workers as a whole in Australia lost $95,894m in wages. In case members of the Opposition do not wish to this fact, I stress that when trade unionists of lose their wages they suffer as much as anybody toelse. When the ordinary people of Australia cannot take a train, a bus or a hydrofoU, they get and say to the Government: 'You are the government. We put you in power to conatrol these situations'. Yet a small group of people including the Opposition is denying the Governits right to administer adequately the activiclear,ties of the Australian economy. May I remind those who wish to destroy our democratic system wishof government that a democracy must exist on a A government cannot effectively carry out what is required of it by the law and by the traditions of the parliamentary system if a small likegroup of people are encouraged to believe that they can usurp power outside the democratic Let us be quite frank about it. We have been told about the so-called democracy in the trade the union movement. How could anyone believe that how a the Amalgamated Metal Workers Union is bedemocratic when 1.1 per cent of the membership approximately 180 000 can elect the Secretary and the Deputy Secretary? Honourable members ma-opposite have the temerity to talk about union democracy. In this week's Bulletin there is an article on a book entitled Inside Australia's Top 100 Trade Unions. The article contains an allinteresting quotation from Mr J. D. Garland, the of the AMWU. He was asked this Statistics show that the AMWU represents 3 per cent of work force and is responsible for some 30 per cent of disputes. Why? rights? He gave 3 reasons. One of them was: has for a long period not accepted the capitalist as one which either in the short or long term is in the which best interests of the working people. He speaks for the union. As I pointed out, he elected by 1.1 per cent of the union membership. Not one member of this Parhament would have the temerity to make such an allegation on half of his electorate. Yet certain people in the trade union movement are encouraged to believe that power once gained by various at all costs. We were elected to protect the interests of aU Australians-trad non-trade unionists alike. We cannot sacrifice the Australian people because a small group are prehadA been pared to use their power in an irresponsible manalso ner. Anyone reading the newspapers preciate what continuous strike action, very minor matters, means to the Australian economy in lost wages and productivity. The Deputy Leader of the Opposition spoke about The mass action by trade unions. What he meant mass anarchy. He was referring to the export uranium, and said that the trade union movethey ment must stop the export of uranium. Fortuline nately for Australia the Labor Party and the trade union movement have since seen the error of his ways. This man who sets himself up as Deputy Leader of the Opposition finds himself Une reads: totally isolated on that subject. Nevertheless urged direct union action against government Another: policy. What of therightsof the ordinary people? What of governmentrightshaving been elected on a platform which the people accepted? Is it Every right that a militant handful, representing perhaps 30 per cent of the trade union memberstrikes ship, which is the absolute maximum constitubut ency for which they speak, can usurp the right speak for the trade union movement? I question their right to speak when so many of them have not been elected by an acceptable democratic process. Upon what authonty do they walk roughshod over the rights of the Australian eople? In the Australian of 3 June 1976 this E eadline appeared: Strikers walk off for the fiftieth time. That was from a building project and we wonder why the Australian economy has gone into the doldrums. In the Australian of 22 July this headline appeared: 7000jobs hang on bans decision. When a small group of people has the power to decide whether 7000 other men and women have the right to work where is democracy? What became of the rights of the majority? (11.57)-I move: There is another headline: Union threat to stall Tasmanian shipping. We know the shambles and difficulties which Tasmania faces. The Government is well aware of those problems. But where lie the interests was this small extreme group of communist-led trade union officials who sabotage the Tasmanian people who go to the polls in a few days? What bethanks can they give to honourable members opposite for their efforts? I quote from an article in the Sydney Morning Herald of 3 September. The means is held headline reads: Officer forced to pay men for not working. e unionists and The article states: shipping officer told a royal commission today that he forced to pay men who had not worked, and had paid a port levy, payroll tax and insurance for the time will apthey had not worked. often on Another headUne reads: Air traffic controllers disrupt all airlines. article referred to 1000 air traffic controllers was who lodged a claim with the Public Service of Board. It was rejected by the Board. What did do? They went on strike, stopped every airand caused confusion throughout Australia. Another headline referred to a dispute stopping work on a hospital in Tasmania. It was the State's largest building project. Another headhe Brewery men to strike over hours. Dispute between unions threatens work on docks. day it is the same. It might be true in a statistical sense that the number of trade union this year is fewer than it was previously, most of the strike action is controUed by comto munist-dominated unions whose leaders do not care for their members, who do not wish to work within the arbitration system to improve it, but wish only to destroy the elected Australian Government and to weaken the standard of living of the Australian people. It is our responsibility to defend these people, and we shall do it.",37
99,Mr DEPUTY SPEAKER,TRADE UNIONS,"Mr Lucock)Order! The honourable member's time has expired. The discussion has now concluded. NA AMENDMENT BILL 1976 Bill received from the Senate, and read a first time. Second Reading",38
100,Mr NEWMAN,DEFENCE SERVICE HOMES,"Bass-Minister for Environment, Housing and Community Development) That the Bill be now read a second time. The prime purpose of this Bill is to reconstitute the Australian Housing Corporation in accordance with the Government's announced poUcy of and to change its name, nature and function so that its sole responsibihty will be the administraAct. tion of the Defence Service Homes Scheme. The Liberal and National Country Parties stated prior to the 1975 election that the activities of Australian Housing Corporation would be critiporation cally examined. Following that examination, the Government decided that the Corporation should be aboUshed, a decision which was announced by the Prime Minister (Mr Malcolm Fraser) on 2 February 1976. When the Australian Housing Corporation Bill 1975 was debated in this Parliament, the attitude adopted by the Liberal and National Country Parties was that the Australian Housing Corporation represented an unnecessary and desirable duplication of services already availcontribution able, particularly those services provided by the various State governments. The Government found no evidence to the contrary in its investigaSpeaker, tions. On the other hand, the Government is wholeheartedly committed to the preservation and continuation of the Defence Service Homes Scheme, which we see as a scheme of historical and social importance for a large number of Australians. This Bill therefore provides for the estabUshment of a Defence Service Homes Corporation, the affairs of which wiU be conducted departmental framework by the Secretary to the Department of Veterans' Affairs. The very recent estabUshment of this Department is evidence of referred the Government's interest in the welfare of those Works for who have served this country in the armed proposed Services. Those provisions of the Australian Housing Corporation Act concerned with the powers functions of the Corporation, other than those related to the provision of assistance under the Defence Service Homes Scheme, are repealed. The Corporation will be renamed the Defence Service Homes Corporation and continue its existance as a corporate entity solely for the pose of administering the Defence Service Homes Act. The Australian Housing ation Act as amended will be renamed the Defence Service Homes Corporation Act. Australian Housing Corporation was estabUshed, the assets and UabiUties of the Defence Service Homes Scheme were taken over by the Corporation and new financial were developed to facilitate the provision of benefits at that time under the proposed The staff administering the Scheme, who had always been members of the PubUc Service, lent to the Corporation and employed by it outside of the PubUc Service Act under the proproposed work. visions of the Australian Housing Corporation To ensure that there is no break in continuity in the administration of the Defence Service Homes Scheme, the finance and staffing prothe visions contained in the Australian Housing CorAct will be retained for the ume being and the present staff will continue in employment under the new Corporation. I wish to take the opportunity to indicate the Government's appreaation of the contribution made by the members of the Board of the Australian Housing Corporation during their tenure of office, under the leadership of their distinguished Chairman, Mr A. M. Ramsay, CBE. These members have given of their ume and unhave individually and collectively made their towards the operation of the Corporation in its short Ufe. Their contribution is aphas preciated by the Government. Mr Deputy I commend the Bill to the House. Debate (on motion by Mr Willis) adjourned. NA SCHOOL AT KATHERINE SOUTH, NA Reference to Public Works Committee",38
101,Mr MCLEAY,NOTHERN TERRITORY," I move: That, in accordance with the provisions of the Public Works Committee Act 1969, the following proposed work be to the Parliamentary Standing Committee on Public investigation and report: Construction of a primary school at Katherine South, N.T. The proposal is for the construction of an air conditioned primary school for 480 students plus 50 and pre-school chUdren. It will be of a modular design being developed for future Northern Territory primary schools. It is proposed to phase completion of the school with the objective of having a learning unit for 240 students and a multi-purpose hall available for occupation from purthe beginning of 1979, and the remainder by June 1979. At completion the school will comCorporprise the following accommodation: When the Two 240 student learning units One Ubrary/resources centre One adrninistration building arrangements One multi-purpose unit Scheme. One single unit pre-school. The estimated cost of the proposal at November were 1976 prices is $2.6m. I table plans of the Question resolved in the affirmative. NA BILL (No. 4) 1976 Debate resumed from 18 November, on motion by Mr Hunt: That the Bill be now read a second dme.",39
