speakerGroups,Speaker,Title,text,pageNumbers
60,Mr FALCONER,DEPARTMENT OF SCIENCE,"When the first came to office it an unemployment rate of about left office the rate was 328 000. to office the rate of unempeople under twenty that figure had to 152 000.1 suppose we have to give Labor They are experts on creating unemployment so they ought to be able to talk about that subject to some extent. In their 3 years in government the rate of youth unemployment doubled. I suggest fire that the answer to the problem of youth unema ployment is not in more and more government as honourable members opposite often I tend to suggest. That was the solution tried by Labor Government when it was in office. The is huge increases in government spending, together with the high wage explosion that was brought about at least partly through the use of the Public Service as a pacesetter in wage fixation, and the consequent lack of competitiveness of Australian industry, led to the high rate of unemployment. It was that very lack of competitiveness of Australian industry which largely brought about the recent devaluation. That devaluation has in fact saved the jobs of 400 people at Mount Lyell in Tasmania. I was interested to note the comments of the honourable member for Gellibrand (Mr Willis) that devaluation would not save jobs. He should tell that to the Tasmanians. They certainly will not accept that for a moment. Many other jobs will be saved as a result of be devaluation. Most of last year's school leavers have employed. The Minister for Productivity (Mr Macphee) said earlier in this debate that 95 cent of last year's school leavers have found jobs. I suggest to the House that the major difficulty youth unemployment is not so much with school leavers but with the young person who perhaps left school at an early age without obtaining a high degree of skill and who has had two or three jobs which he has lost for either ;ood or bad reasons. As a result that person ! ooks a very bad prospect for any potential ployer. That person would look to be a potenhonourable tially unstable employee. I suggest that it is that area of youth unemployment that we the major problem; it is not so much with the reIn cent school leaver. Most employers will give the have recent school leaver a chance at least in his first job. It is when he develops some record of inquiries instability, combined with a lack lack of qualification that he becomes, in an emThe ployer's eye, a bad risk. I want to tell the House what has happened under the special youth employment training advice. program which this Government introduced. I vocational think it must rate as being an by any measure. Some 2300 young people have now been placed in training under the program. It has been particularly pleasing to note that almost half of the trainees have been placed New South Wales where previously it had been extremely difficult to obtam vacancies for young people. The honourable member for Denison for Gellibrand. (Mr Hodgman) would be quick to tell me that Tasmania has had the best pro rata achievement with respect to this program. In Tasmania alone 153 young people have found jobs under this program. In Victoria 385 people have found jobs under the program. In New South Wales the figure is 818 people. This is the largest number any one State, as I mentioned earlier. honourable member for Gellibrand also said, I understood him, that the careers guide was being printed. I want to inform him and the House that the careers guide is being printed Tasmania, Victoria and South Australia. Next year a national careers guide will be printed supplements for each State. The project is definitely going ahead.",34
61,Mr WILLIS,DEPARTMENT OF SCIENCE,It is not available now.,35
62,Mr FALCONER,DEPARTMENT OF SCIENCE,It is being printed.,35
63,Mr WILLIS,DEPARTMENT OF SCIENCE,It will be available next April.,35
64,Mr FALCONER,DEPARTMENT OF SCIENCE,"The honourable member for GelUbrand was saying that it was not going to printed. To continue with my own remarks, I would Uke to say a Uttle more about the work been that this Government is doing in offering vocational guidance to young people. Again I per thought the honourable member for Gellibrand was quite scathing in his criticism of what was in happening in that respect. Through the officers of the the Commonwealth Employment Service the Government provides not only job placement assistance but also job information and counselling. I would Uke to quote what the Minister for Employment and Industrial Relations (Mr Street) said on 7 September in a debate on a emsimilar subject. It is to the discredit of the member for GelUbrand that he apin parently did not take any notice of what was said have on this occasion. The Minister said: relation to job information, career reference centres been established in all capital cities and some major provincial cities throughout Australia. Over 200 000 were made at career reference centres in the last of skill and a financial year. offices of the CES also have several hundred counsellors who visit schools through the year with advice and information on careers. In the lastfinancialyear over 140 000 school leavers received such information and Both the employment offices and the regional offices are equipped with trained psychologists, who provided guidance to over 24000 people in the last outstanding success financial year. It may be argued that more could be done. I do not quarrel with that proposition. I assure the in House that a considerable amount is being done. I think more is being done than the House was led to believe earlier by the honourable member The Government beUeves that, in its measures to assist the young unemployed, it should concentrate on programs which give themrealjob experience in a real commercial and industrial environment. I suggest that one of the problems with programs such as the former Regional Eminployment Development scheme is that job creThe ation programs can too easUy become job as replacement programs. Quite often these pronot grams do not necessarily give the people employed a degree of skill which will make them in an attractive employee to a potential employer. The programs keep them busy for a while. Such with a program may keep them occupied for several months or even longer depending on now long the project lasts, but it does not necessarily impart any skills that will be of continuing use to them in a real commercial or industrial environment. This is why the Government sees the special youth employment training scheme as being so advantageous. It means that young people will be taken out of the ranks of the unemployed and put into an office or a factory- (b) by some genuine place of employment-wher e they (c) will do a productive job alongside long term employees. They will learn skills that are of use to them and are of use to their employer. After the initial 6 months in which they have undertaken that training scheme they are likely to be attractive as ongoing employees to that same employer or, if not to that same employer, to have developed skills and a knowledge of the real work environment which would be of use to another employer. We believe that this type of scheme is of much more benefit to the young unAfter employed than a job creation have said, in many respects, becomes a job replacement scheme. I know of some municipal authorities which used the RED scheme not to create additional jobs for unemployed people but which, in fact, used the scheme as a way of getting tenance work done on the cheap-replacin g the work that would have been done by other time council officers. I think we need to consider the disadvantages of a scheme such as the RED scheme. Let us not examine the short-term soluaction tions-the short-term palliatives-bu t try to introduce schemes which will give to the unemBill ployed real job experience.",35
65,Mr DEPUTY SPEAKER,DEPARTMENT OF SCIENCE,"Order! The Parliament honourable member's time has expired. The disby cussion is now concluded. BILLS RETURNED FROM THE SENATE are, of The following Bills were returned from the Senate without amendment: States Grants (Water Resources Assessment) Bill 1976. Pay-roll Tax (Territories) Assessment 1976. Road Acts Amendment Bill (No. 2) 1976. Customs Amendment Bill (No. 2) 1976. Sales Tax (Exemptions and Classifications) Amendment Bill 1976. Narcotic Drugs Amendment Bill 1976. HISTORIC SHIPWRECKS BILL 1976 Bill received from the Senate, and read a first time. OMBUDSMAN BILL 1976 Bill returned from the Senate with an liamentary amendment. In Committee Consideration of Senate's amendment. Clause 5. (2) The Ombudsman is not authorized to investigate(a) action taken by a Minister; action taken by a Justice or Judge of a court created the Parliament; action taken by a magistrate or coroner for the Australian Capital Territory or the Northern Territory; (d) action taken by any body or person with respect to persons employed in the Australian PubUc Service, the PubUc Service of the Northern Territory or the service of a prescribed authority, being action taken in relation to that employment, including action taken with respect to the promotion, termination of appointment or disripline of a person so employed or the payment of remuneration to such a person; Senate's amendmentparagraph (d) of sub-clause (2) insert the following scheme which, as I new paragraph: '(da) action that a person employed in the PubUc Service of the Northern Territory as a member of the staff of the Legislative Assembly for the Northern Territory takes, or purports to take, by virtue of his being a member of that staff;'.",36
66,Mr ELLICOTT,DEPARTMENT OF SCIENCE," I move: That the amendment be agreed to. fullThe purpose of the amendment made to the Ombudsman Bill 1976 by the Senate is to ensure that the Ombudsman is not able to investigate taken by officers of the staff of the Legislative Assembly for the Northern Territory. The already provides that actions taken by officers of the departments associated with this are not to be subject to investigation the Ombudsman. Tbis is because the Government sees these departments as outside the ordinary course of government administration. They course, responsible to one or both of the Presiding Officers of the Parliament and not to a Minister. The amendment made by the Senate is consistent with that existing provision and is acAmendment Bill ceptable to the Government.",36
67,Mr LIONEL BOWEN,DEPARTMENT OF SCIENCE,"The Opposition does not object to this amendment and can fully understand the need for it. I have not had a chance to discuss this matter with the Attorney-General (Mr Ellicott). The amendment, in part, refers to 'action that a person employed in the Public Service of the N.T.' may take. The interpretation clause-claus e 3 of the Bill-exclude s action taken by the staffs of the House of Representatives, the Senate, other Pardepartments, and also the Public Service of the Northern Territory. One wonders why the proposed new paragraph could not have been included in that clause by adding the words 'other than action taken by a person'. I believe that the amendment has been added to clause 5 because Senator Kilgariff suggested that that course of action be adopted. The point I make is that administrative actions are the subject of the Ombudsman's purview, as set out in clause 5(1). I invite the Attorney General to address his mind to the fact that no objecdon is proposed at all to any action being excluded if it relates to the employment of that person as a member of the Legislative Assembly for the Northern Territory. But should such a person have power to take action other than administrative action? One would think that that should be the subject of some investigation if it falls within the ambit of clause 5(1). I do not wish to press this matter any further other than to mention it briefly. I would have thought that it would have been better to exclude this category under the interpretation of'Department' in clause 3 rather than to amend clause 5 to include 'an action', which is not denned. In my view such administrative action should not be excluded unless it is action by a person employed as a member of the staff of the Legislative Assembly. In other words, whatever the powers of the staff of the Northern Territory Legislative Assembly they are not necessarily the same as those of the staff of the Department of the House of Representatives or the Department of the Senate. Acts of those officers are excluded; but should we have a wider ambit for the Northern Territory? One may not want to exclude all those actions. I only mention this point briefly. I no doubt that the Attorney-General will address his mind to this aspect if he has not already done so. The Opposition still wants the administrative actions of the staff to be within the ambit of clause 5(1).",36
68,Mr ELLICOTT,DEPARTMENT OF SCIENCE," I am satisfied that the amendment is intended only to take out of the scope of the ombudsman's considerations actions by persons employed as members of the staff of the Legislative Assembly which would be the equivalent of actions taken by the staff of this Parliament, either of the House of Representatives or of the Senate. It is not intended to exclude any actions that they may undertake of an administrative character. Of course, as the honourable member for Kingsford-Smith (Mr Lionel Bowen) will be well aware, the Legislative Assembly is established as a form of parliamentary institution and it has privileges, etc., which it enforces and maintains just as this House maintains them. This amendment is simply to put the staff of that body in the same position as staff of the Senate or of the House of Representatives. I should not think there would be any problem. Should any problem arise, should the legislation be interpreted as so wide that it enables those officers to do more than what is described in the amendment to encompass administrative action, then that is a matter which would receive early consideration by the Government. Amendment agreed to. Resolution reported; report adopted. NA AMENDMENT BILL (No. 2) 1976 [No. 2] Second Reading Debate resumed from 18 November, on motion by Mr Eric Robinson: That the Bill be now read a second time.",37
69,Mr MACKELLAR,BROADCASTING AND TELEVISION," Mr Deputy Speaker, may I have the indulgence of the House to raise a point of procedure on this legislation? Before the debate is resumed on this Bill I would like to suggest that it may suit the convenience of the House to have a general debate covering this Bill, the Broadcasting Stations Licence Fees Amendment Bill and the Television Stations Licence Fees Amendment Bill (No. 2) as they are related measures. Separate questions will of course be put on each of the Bills at the conclusion of the debate. I suggest therefore, Mr Deputy Speaker, that you permit the subject have matter of the 3 Bills to be discussed in this debate.",37
70,Mr DEPUTY SPEAKER,BROADCASTING AND TELEVISION,"Mr Lucock)Order! Is it the wish of the House to have a general debate covering these 3 measures? There being no objection, I will allow that course to be followed.",37
