speakerGroups,Speaker,Title,text,pageNumbers
126,Mr MCVEIGH,PRESCRIPTIONS,"The honourable member for Hunter asks where they get the money from. can tell him that they earn it, which is more I can say for the workers in the shipbuUding industry who are subsidised by the Australian taxpayer to the tune of $20,000 a year- a golden handshake for inefficiency with the net result exporting jobs out of the country. Our approach to the home savings grant is part of a package program. I believe that, given time, our sound economic policies and the associated exploration of the wide range of policies on land, urban transport, infrastructure, decentralisation, regional development, urban rehabUitation and finance will overcome the serious housing probment, lems which exist in many areas of Australia. A tendency has developed to buy old homes. would hope that the Minister, who has created a tremendous feeling of goodwUl for his part this area of housing, would consider a scheme to employ inspectors to go out and inspect houses prowhich are termed 'second-hand' because, surely, any scheme that gives the opportunity to second hand home purchasers to overcome some of the associated with purchasing a secondthis hand home is one which should receive the assent of all members of this Parliament. This sort of scheme appUes already in relation to the purchase of second-hand cars. We could extend it to the area of home ownership, bearing into mind recent tendencies of an increasing number people to purchase second-hand homes rather it than to build new homes. These facts are backed up by recent figures released by banking instituthe tions in Australia which indicate an increase in second-hand home sales in the quarter from July to September of 12.9 per cent. I hope that the Minister does take cognisance of the fact that it is an eminently desirable proposition to give second-hand home buyers the opportunity of having a reservoir of inspectors who go out to he inspect homes prior to purchase so that the propurchasers would know the exact stanown dard of the house to be purchased and what have to be rectified. The time for the debate is running out and I know other honourable members want to be associated with this measure, to lend their support to the positive initiatives of the Government and to reject completely the amendment moved by the Opposition because of the fundamental false proposition it",61
127,Mr LLOYD,PRESCRIPTIONS,Thei r amendment is only good for little houses.,61
128,Mr MCVEIGH,PRESCRIPTIONS,"The honourable member for Murray made a remark on which I , as an innocent country boy, would prefer not to comment. The Opposition's amendment states that I the scheme does not recognise that each housethan holder in Australia is entitled to adequate and conveniently located accommodation at a price which does not impose too great a strain on household resources. I cannot understand the of reasoning behind this amendment and the thinking that prompted its movement. This Bill is aimed directly at overcoming the very serious problems that exist. Already 360 000 people have been beneficiaries under the home savings grants scheme. Now other people will be able to enjoy the same privUege.",61
129,Mr NEWMAN,PRESCRIPTIONS," I do not want to take up too much time. I of the House, but there are a few points I should like to answer. First, I should like to respond to in the honourable member for Hughes (Mr Les Johnson) and the Deputy Leader of the Opposition (Mr Uren) who said that the last home savings grants scheme-and now this one-wa s merely an election gimmick and a way to win votes. I find it incredible that they would actually put themselves into the position where they would say such things and suggest an amendment to this Bill so that people would be denied this grant. Let us examine some of the facts. The honourLabor able member for Hughes said that the 1964 scheme was a gimmick. Some 362 were made under that scheme. It was a long term scheme which benefited many household units and many young families. In no way could that scheme be described as a gimmick. The Deputy Leader of Opposition said that the scheme would spend $90m m any one financial year and that this was a waste of money and a misdirection Government funds. Again, that statement is silly and inconsistent. The fact is that the $90m will benefit many thousands of young people who are trying to build their first home. My Department estimates that about 50 000 to 60 000 grants will be involved in any one year. The arguments of the honourable member for Hughes and the tiating Deputy Leader of Opposition seem to be based on what the Labor Government did in its 3 years in office for people who wished to own their homes. The Deputy Leader of the Opposition went to great lengths to show what the Labor Government had achieved in the way of providence ing houses, reducing the cost of land and so on. The honourable member for Hughes, after an horrendous explanation of the situation that existed in December 1972, did not bother to us about the situation that developed in the years in which the Labor Government was in office. The honourable member for Mitchell (Mr Cadman) enlightened us about what happened during the 3 years of Labor Administration: The cost of land had soared in those 3 years and cost of construction of houses rose. Let us look further at some of the other facts. Let us examine the consumer price index for houses in various areas. First of all, I refer to those people who to rent houses in 1972. For privately owned dwellings the index figure in 1972 was six. In December 1975 it had risen to 15.3. In this December 1972 for Government owned houses which were rented the figure was 4.6; in any December 1975 it was 31.1. This is the sort penalty that those people who owned houses had to pay for 3 years of Labor Administration. In December 1972 the index figure for prices for repairs and maintenance stood at 7.3; in this December 1975 it was 16.3. Another problem associated with home ownership is local government rates and charges. The index figure for local government rates and charges was 7.9 in December 1972 and 29.8 in December 1975. Mention has been made of the long term bond rate. The long term bond rate in December 1972 was about 6 per cent and in August 1975 it had risen to 10 per cent. That is the sorry record of the Labor Administration. That is what the Government did for people who wanted to own a house or simply wanted to Uve in a 951 grants house and rent it. The Deputy Leader of the Opposition went to great lengths to tell us what a magnificent scheme had been introduced in the 1973-74 Commonwealth-State Housmg Agreement. I will not deny that a great deal of money was put into of it. I wiU not deny that many people have been helped. But I will say this: That scheme is not satisfactory. It is abundantly clear that the housing needs of people who really need housing are not being met. The provision of houses, whether for rental or for purchase, is leaking to people who really should not have that benefit. We are negowith the States, hopefuUy, to produce a better scheme. I am able to say that it would seem that the States agree with us. I am very glad own to see that the New South Wales Government has taken up the lead given by the Prime Minister (Mr Malcolm Fraser) at the Premiers Conferin May of this year when he asked the Premiers to consider this problem that I have just described. The Labor Government in New South Wales has responded. I notice that it is moving tell now towards charging economic rents and 3 towards selling houses at proper market prices. Let me summarise what I have said in this way: We have heard the same old tired, weary cries that we always hear in this House, to the effect that this Government somehow or other is directing its endeavours towards helping the silthe vertaUs of the community and forgetting those who are really in need. That catalogue of facts which I have just given speaks for itself. I do not know how Opposition members make the deduchad tion that the matters that I have detaUed helped people in need. I do not wish to continue talking about the errors made by Opposition speakers in debate; but I must pick up one more. It is one that has been peddled for too long now to go on further. Let me try to naU it once and for all. of Everytimea Labor spokesman speaks about the homes savings grant scheme, he goes on to ask who can afford to save $40 a week or $48 a week over a 3-year period to win a grant. Let me make point clear: A person does not have to save for 3 years to qualify for the grant. Any savings that a person had in an approved account before the savings period commenced can count towards a grant. Thus, somebody who kept $2,000 or $3,000 of his or her savings in an approved savings account will, in January 1977, immediately qualify for a grant of about $700, provided that that money has been in that approved account since May of this year. That person does not need to have saved one single additional cent in that account between May of this year and January 1977.1 hope that that explanation makes the position clear. What the Labor Opposition tries to put around the community in this respect is a misconception; it is totally wrong. Ifinishon this note. The Homes Savings Grant Bill that we are now considering, as I have pointed out, will benefit many thousands of Australians, whether they are married or single and whether they Uve in the country or in the cities; but this is not the only initiative that ment is taking in the housingfield.It is one of a total package that we are offering on housing for the people of this countiy. Let me speU what that package involves: First of all, it volves the responsible fiscal management country. I stand by what I said 2 or 3 days On the best advice avaUable to me, the effect devaluation on the cost and availabiUty of finance will be marginal. So, responsible fiscalhelpful management is thefirstpoint. The second matter to which I refer is the introduction allowance voucher experiment which is probably one of the most exciting programs initiated in this place for many a long day. It is directed those most in need, namely low income and meintent dium income earners who deserve decent shelter and who should not be penalised by the cost of getting that shelter. I have great hopes for experiment. I mention next the Housmg Loans Insurance Corporation, We are looking closely at the Coroffice. poration, as we promised in the last election campaign we would, to see whether we cannot find ways and means of improving the opermission ations of the HLIC as they affect not only home purchase market but also the home renting market. As I mentioned, we are continuing agreements with the States to housing. I hope that, in the next year or so, the discussions and negotiations that we are having with the States wiU result in a much more effecmission tive deUvery of welfare housing through Statenot Federal co-operation. That is the total package, the very comprehensive package, that this representative Government graduaUy and surely is working towards, in order to improve the ability of Australians to achieve an Australian dreamthat is, the ownership of then: own home. Amendment negatived. Original question resolved in the affirmative. Bill read a second time. Message from the Governor General recommending appropriation announced. Third Reading Leave granted for third reading to be moved forthwith. Bill (on motion by Mr Newman) read a third time. NA BILL 1976 (No. 2) Ministerial Statement this Govern Mr ERIC ROBINSON (MCPherson-Minispart ter for Post and Telecommunications)-by leave- Mr Deputy Speaker, I thank the honourout able member for Maribyrnong (Dr Cass) and in the House for their courtesy this afternoon. of this EarUer, the House was given a number of ago. amendments which we will discuss next week in of the debate on the Broadcasting and Television Bill (No. 2) 1976; but I beUeved that it would be to that debate if this afternoon I gave informadon on the amendments that have been of the housing circulated. The first of these is in relation to clause 9 of the Bill which deals with the composition of the Austo tralian Broadcasting Commission. The basic of this clause is to provide for representation on the Commission from each State as well as ensuring that at least two of the commissioners that will be women. It has now been decided that, during the implementation of this intention, provision should be made for all present commissioners to serve out their remaining terms of This, in turn, leads to the desirability of providing someflexibUityin the numbers of members who may be appointed to the Comso that State representation and an the increase in the number of women on the Commission can be achieved, without prejudice to the our unexpired periods of office of the existing provide welfare commissioners. Accordingly, I now propose that the Comshall consist of not less than nine, and more than eleven, commissioners. Because of the intention for the Commission to comprise a from each State and also at least 2 women, as well as the Government's intention to aU retain all existing commissioners, it wiU be necessary to deem certain of the present comto missioners as representing a State. This is now provided for in the new amendment. I emphasise that this will have no effect on the remaining terms of the present commissioners. It will also be necessary to change the quorum provisions the Act in the Ught of the number of comdesigned missioners who may now be appointed to the not Commission. Clause 6 of the Bill provides for a new substations, section 16 (1) (c) of the principal Act. This subbasis. section empowers the Australian Broadcasting Tribunal 'to determine the hours during which programs are to be or may be broadcast or televised by Ucensees'. This provision from the original wording which gave simUar power to the Australian Broadcasting Control Board in the principal Act, by the addition of words 'are to be or'. These words were included on the advice of ParUamentary Counsel, and their purpose was to remove any doubt which may arise if the vaUdity of this provision rested on the words 'may be' as is now the case in respect of sub-section 16 (1) (c) of the present Aa However, there have been a number of leviate representations to me on this amendment and as own the present legislation is largely transitional in nature, I have agreed to withdraw the words 'are to be or' from sub-section 16(1) (c) of the tive Government may, with present Bill. Clause 13 of the Bill introduced sistance to a particularatindustry, interim provisions for the Ucensing and adrninisdesire, from funds appropriated forshould tration of stations in the pubUc broadcasting sector. Section 111B of that clause was drafted provide that, in this transitional legislation, pubclause Uc broadcasting and television stations would subject to the same Ucensing, regulatory and administrative procedures as commercial broadcasting and television stations. However, drafting has been interpreted by some to enable the public inquiry process to be avoided. of this I am proposing a further amendment to make it abundantly clear, that a pubUc hearing 1976. will be necessary before a Ucence of this type can be granted under the Broadcasting and Television Act. I stress again that legislation to be prepared for introduction next year wiU provide in detaU for the administration of this new and important sector of our broadcasting system. I also propose an addition to clause 14 to provide for clarification of the responsibUity of the secretary the Postal and Telecommunications as detaUed in section 11 ID. This section vests the planning responsibUities for the development of the Australian broadcasting system in the department. Future plans will be heavily oriented social and economic issues as well as to technical considerations. It is necessary, however, to ensure that this important overaU planning responsibUity cannot be interpreted as permitting the secretary to direct stations in matters of proof gram content. Accordingly, the new provision is to make it quite clear that clause 14 will convey a right for the secretary to in any way require changes in the program formats of on either an individual or collective A further amendment proposed is that section 111C of clause 14 of the present BUT be deleted. This section was originaUy included as one of a differs number of machinery amendments which reaUocated the powers and functions of the Australian Broadcasting Control Board. It provides the that the Minister may, subject to the approval of the Treasurer, provide financial assistance to commercial broadcasting and television stations to ensure that programs of adequate extent standard and variety are provided in the areas served by those stations. Apart from the possibiUty that a provision of this nature could lead to some commercial operators applying pressure on the Government to make assistance avaUable to alcommercial financialdifficulties resulting from their practices, the inclusion of such section in the Act does not, in reaUty, provide the Minister any additional powers. The Execuany time, provide asit so that purpose to by the Parliament. It therefore does not need legislation as now provided for in section 11 lc of be week. 14. I look forward to the debate next the BILLS RETURNED FROM THE SENATE The following Bills were returned from the Because Senate without amendment. Nitrogenous Fertilizers Subsidy Amendment Bill (No. 2) Queensland Grant (Special Assistance) Bill 1976. States Grants (Nature Conservation) Amendment Bill 1976. Softwood Forestry Agreements Bill 1976. SEAMEN'S COMPENSATION AMENDMENT BILL 1976 Second Reading of Debate resumed from 30 November, on Department motion by Mr Hunt: That the Bill be now read a second time.",61
130,Mr ERIC ROBINSON,BROADCASTING AND TELEVISION,"May I ft have the indulgence of the House to raise a point of procedure on this legislation? Before the debate is resumed on this Bill I would like to suggest that it may suit the convenience of the House to have a general debate covering this Bill, the Compensation (Commonwealth Government Employees) Amendment Bill and the United States Naval Communications Station (Civilian Employees) Amendment Bill as they are associated measures. Separate questions, of course, will be put on each of the Bills at the clusion of the debate. Therefore I suggest, Mr Deputy Speaker, that you permit the subject matter of the 3 Bills to be discussed in this debate.",64
131,Mr DEPUTY SPEAKER,BROADCASTING AND TELEVISION,"Is it the wish of the House to have a general debate covering the 3 measures? There being no objection, I will allow that course to be followed.",65
132,Mr HASLEM,BROADCASTING AND TELEVISION,"In this debate on the Seamen's Compensation Amendment Bill 1976, the Compensation (Commonwealth Government Employees) Amendment Bill 1976 and the United States Naval Communications Station (Civilian Employees) Amendment Bill 1976 I would Uke to spend some Uttle time on the Compensation (Commonwealth Government Employees) Amendment Bill and leave it to others who follow me in this debate to cover and canvass the other areas. The Compensation (Commonwealth Government Employees) Amendment Bill, naturally enough, is of some interest and concern to my constituents in Canberra. The Bill provides for workers compensation for employees of the Commonwealth Government and its statutory authorities. The legislation for this purpose was last amended during the 1974 Budget session of the Parliament and since then there have been certain increases in the cost of Uving and benefits payable under workers compensation legislation in most of the States. Therefore it is quite proper that some amendments should be made to the legislation to bring it into Une with the influences on employees in 1976. Thefirstchange to which I would like to refer briefly is the increase in compensation for total incapacity. The weekly compensation payment for employees when they are incapacitated means that for thefirst26 weeks of total incapacity they would receive normal full sick pay and following that period they would receive $80 a week. This in an increase from the present rate of $57 a week. There is an additional weekly supplement for a dependent spouse and it is increased from $15 a week to $21 a week. For each dependent chUd the increase is from $7 a week to $10 a week. The Bill covers compensation on death and increases the amount of compensation payable where injury results in the death of an employee from $20,000 to $25,000. It also increases payments in respect of dependent children of a deceased employee from $7 a week to $10 a week. The maximum amount payable in respect to funeral expenses has been increased from $450 to $650 in line with the sort of expenses that people would expect to pay over con- that 2-year period. There also are increases in lump sum payments for specific losses. For example, the payment for permanent facial disfigurement is mcreased from $10,000 to $12,500. Another example is that compensation for loss of sense of taste, sight or smell is increased from $2,000 to $2,500. In addition there are increases for alterations to buUdings or vehicle repairs or replacements of certain aids from $500 to $700. In 1974 there were some changes to the Social Services Act which mean that this legislation could fall out of paraUel. Therefore in the Bill changes have been made to section 38 (1) so that the 2 areas of compensation-compensatio n under this legislation and under the social services legislation-wi U be dealt with on a simUar basis. The result of the Bill before the House will be that no person receiving compensation payments, or a person undergoing rehabUitation or vocational training, will receive less than would have been received under the social services legislation when undergoing simUar training. Another important provision in this Bill is that the amendments wdl come into operation as from 1 September 1976 so that any people who have been affected by the legislation will be covered from that date. One of the problems that we must face with legislation such as this is how generous we can be to Commonwealth employees. Naturally when any person suffers some sort of accident or a family loses the breadwinner the Government would Uke to be, and usually is, as generous as possible. There have been some comments about the level of generosity to employees under this legislation. When one looks at comparative State legislation one can see that no State offers higher benefit for chUdren of deceased employees than is provided in the Bill-that is, $ 10 a week, subject to a minimum of $1,000. Only one State, Tasmania, provides a higher Umit on funeral expenses than the $650 provided in this Bill. The lump sum payment to a dependent widow of a deceased employee, which is $25,000, is either equal to or higher than the same benefit offered in the major States-Ne w South Wales, Victoria, Queensland, South Australia-and in the Northern Territory. In Western Australia thefigureis marginally higher at $27,617. In Tasmania it is $25,674. the Austrahan Capital Territoiy it is just $25,000. Naturally, legislation such as this into account what is applying in the States, and think we can say quite clearly that the legislation is fair to people in the Commonwealth seivice, when it is looked at in relation to the State services. I would Uke to canvass a few matters Minister in relation to what might happen during the period when this legislation is being with a view to improving it. The first one is can see no reason at aU why members of ParUawhich, ment should not be covered by simUar legisday, lation. They could be injured or could die tragiin cally. There is not a great deal of assistance their famUies or their loved ones in those circumpohcy stances, other than the parUamentary pension. The next point is that one would hope that as economy picks up, as it is showing signs of doing at the moment, it would be possible for the adjustments to this legislation to be more of automatic nature. Some sort of indexation could be involved so that we do not need to go through the tortuous process each year, with each Budget, of having to decide the level. The third suggesone tion would be that the Seamen's Compensation Amendment Bill 1976, although simUar legissom. lation, does not seem in aU respects to parallel the Commonwealth employees legislation. I hope that over the next 12 months some work will be done by the Minister for Social Security (Senator GuUfoyle) and her Department to make the 2 pieces of legislation parallel. When one deals with legislation such as one will always be accused of not being at sufficiently generous to people who are in needy circumstances. I daresay that when members of the Opposition speak to this Bill they forward quite a list of reasons why the Government should be more generous. I remind the people of Australia when these suggestions are made that there is only one good reason why the Government cannot be more generous at the ment, and that is that the economy cannot it. We must always remember why the economy is in this state of depression, which we are cerary tainly getting out of. Why is it in that had the handout mentaUty only a couple ago that caused us all the problems we have?",65
133,Mr KEATING,BROADCASTING AND TELEVISION,This will not save you in Canberra.,66
