speakerGroups,Speaker,Title,text,pageNumbers
112,Mr UREN,PRESCRIPTIONS," I move: That all words after 'That' be omitted with the view to as a substituting the following words: 'whilst not declining to give the Bill a second reading the House is of the opinion that this scheme does not recognise that each household in Australia is entitled to adequate and conveniently located accommodation at a nee which does not impose too great a strain on houseold resources, rather it perpetuates existing inequalities'. Third Reading This legislation in no way assists the housing problem in this country. This Government does not have a housing policy, just as it does not possess a consistent economic policy. It does not understand the problems facing those people who need basic accommodation. It does not deunderstand that only a comprehensive approach pickto the whole housing accommodation problemboth public and private, owned and rented, as it concerns the poor andrich-is the way to come to Minisgrips with the problem. The Government does not recognise that every person in Australia has a basicrightand entitlement to adequate accomwas modation at a price which they can afford. This the Government, by reintroducing a scheme which inadequate and'inequitable 10 years ago is adding to the housing problem. It is acting in a sectional way; it is perpetuating inequalities that have arisen after a decade of inflation and it has compounded those inequalities by devaluation and economic mismanagement. There can be no doubt that housing finance will become tighter and more expensive in the. year ahead. This will inevitably make the scheme more inequitable. This Government claims that it believes in the principle of home ownership but its actions are just the opposite. The first home savings grant scheme was introduced in 1964 to help to overcome the then problem of the deposit gap. The same philosophy underlies this proposal but this is no longer the main problem. Today, the basic problem is the repayment gap. Even if the scheme removed the deposit gap completely the problem of the income gap and repayment gap will remain. The scheme before the House does not even start to come to grips with these major problems which should be the focus of the Government's housing pohcy. An even more basic flaw of the scheme is its lack of equity. It redistributes from the poor to the more unfortunate in the community. These grants will be financed from revenue to which the poorer groups in the community contribute but those poorer people will be denied assistance for housing because of their inability to save. It is a of justice to these poorer groups, and to the younger people in particular, to hold out a reward for savings which they cannot make; savings which are now beyond their ability because of this Government's economic mismanagement. We all know that banks and building societies do not lend if the rate of repayment exceeds 25 per cent to 30 per cent of earnings. In most cases, this means that people who earn less than 135 per cent of the average weekly earnings-les s than $248 a week-ar e denied the opportunity of home ownership. Only 12 per cent of the work force earns above that percentage of average weekly earnings. When the 1964 scheme was introduced every person on or above the average weekly earnings was a potential home buyer. The only problem was raising the deposit. This was entirely due to the favourable market for housing finance that existed at that time. To take an example based on South Australian figures for 1966, in that year a home seeker could buy an average home for $ 10,000 on a deposit of $2,100 with weekly repayments of about $13.50. This was the situation when after-tax average weekly earnings were $52 a week. Repayments approximately amounted to 25 per cent of the person's income. On this basis a home seeker had access to homefinanceand could buy a home. This is in complete contrast to the situation which now exists. The 20 years from 1945 to 1965 was an era of progress, so far as home purchases and home ownership in Australia is concerned-hom e ownership rose from 50 per cent to 72 per cent of householders and building costs declined in relative terms. This was followed by a slump in new ownership. Today, the cost of an average home and land in the western suburbs of Sydney is between $30,000 and $35,000. In Melbourne it is only slightly less. Fewer young families can afford to buy new homes because even if they could save the deposit they have no access to home finance. I refer again to the South Austrahan example: In 1975 the average home and land package cost $31,700. This required a deposit of up to $6,350 with repayments of $55 a week. After-tax, average weekly earnings were $123. Repayments amounted to 45 per cent of income. No lending institution would advance funds to a home seeker who had to devote such a high proportion of his or her income to repayments. As interest rates rise in the next year and denial money becomes scarcer, only the top few per cent of income earners will be able to obtain homefinance.Most Australian families will be excluded altogether and greater pressure will be placed on the State public housing authorities. The homes savings grant scheme will do nothing to arrest this situation. If anything, it will intensify the pressure on the State housing authorities. It highlights this Government's lack of understanding of the very nature of the housing problem and this Government's lack of overall policies and priorities. The cost of this scheme in a full year will involve the misallocation of $90m. That is what it will cost in a fullfinancialyear and I say quite clearly that it is a misallocation of resources. This Government's record in housing is poor. Since 1949 the normal government approach has been a series of ad hoc measures to patch up particular failures in parts of the housing market and to meet the demands of the best organised pressure groups. Even the Labor Government started off with this approach. But we recognised the need to have a comprehensive pohcy and we were working towards it. We showed this by establishing the Australian Housing Corporation- a body which would have played an evolutionary role in developing a comprehensive housing pohcy in Australia. It was under the ministerial portfolio of my colleague, the honourable member for Hughes (Mr Les Johnson) that the Australian Housing Corporbut ation evolved. He drew on the mistakes that been made in the past and even the mistakes we made, when in Government, were examined. I think the honourable member for Hughes will agree with me when I say that we learned from the mistakes of the past and also drew on our perience in government. This Government has abolished the Australian Housing Corporation. When we estabonourable Ushed that Corporation we recognised the value placed by the community on housing. We recogbody nised that housing pohcy was an integral part our policies concerned with the quality of both the natural environment and the built environthe ment. We recognised that housing policies affected the location and pattern of settlement and the development and provision of services and facUities. We recognised the effect of ownership and the use of property on the bution of wealth. We recognised that housing was an important part of policy directed towards achievement of our equity and welfare tives. We recognised the importance of the housI ing sector in poUcies of overall economic mannot agement. The Fraser Government faUs to underomic, stand and even fails to try to understand this most complex and human problem. This Government, unlike the Labor Governhis ment, attempted to pass the responsibiUty for housing back to the States and to wash its of involvement in the housing sector. Governhousing, ment members know that the Government tried to do this even in relation to war service homes, which had been a traditional area of Commonconcern wealth involvement under our defence legisand lation. This Government wanted to transfer sponsibUity for war service homes to the In fact, it carried out negotiations with many of Any the States. Because of the heavy volved in war service homes, the States did want to assume that burden; therefore, they rejected those approaches. That has been the role of this Government. It has sought hands completely of a matter, which is important in both the human sense and the economic sense. point We recognised that a Federal government not must be deeply and collectively involved with the States in housing pohcy. It is an essential sponsibihty of a Federal government because of the vital poltiical importance of housing for the general welfare of the nation and because main factor in achieving housing policy objecunderstand tives is the supply and price of money for publicinflows and private housing purposes. These are matters offinancialand monetary management. These are a direct Federal Government responsibUity; problems in housing, Uke so many other had aspects of Ufe and other responsibilities of thatgovernment, can be solved only by the Federal Government acting in co-operation with the other tiers of government, the community, private enterprise and the trade unions. Unless we ex-work together at all levels of government and with the private and community groups, this Eroblem cannot be solved. My colleague, the member for Hughes, brought all of these sections together in an indicative planning to look at the future of housmg. It was our of Government that took that initiative to try to bring out the importance of the leadership role of Australian Government in this vital sector. The Government and in particular the Minister for Environment, Housing and Community Development, who is at the table, do not appear home to understand the importance offinancialand distrimonetary management to housing policy. Neither housing nor the institutions which provide housingfinanceare given a high priority in objectheir economic poUcies. say to the Minister at the table that housing is only a very human problem but also an econsocial and poltiical one. The Minister is not a member of the Economic Committee of Cabinet. He is not even a member of Cabinet. He and Department are part of the outer Ministry. That is an indication of the priority that this hands Government gives to the important issue of not to mention the environment and community living. The Minister, as recently as last Monday, showed this Government's lack of for and lack of understanding of housing its position in the nation's economy. In a rePress statement headed 'Devaluation and the States. Building Industry', the Minister said: effect on the cost and availability of housing finance subsidies inwill only be marginal. not The Minister nods his head. He was talking about the devaluation. I repeat what he said: Any effect on the cost and availability of housing finance to wash itswill only be marginal. We on this side of the House have a different of view in that regard. The Minister does reaUse that, if the Government still intends to hold the annual growth in the money supply to rearound 12 per cent, interest rates must rise. He does not seem to understand that the money supply has been growing at an annual rate of 16 per the cent thisfinancialyear. He does not seem to that, because of devaluation, capital from foreign speculators are likely to amount to at least $ 1,000m. We are told that $850m of speculators' money flowed out of Australia. If that money is reinvested, at its higher value resulting from the 1714 per cent devaluation, the sum will exceed $ 1,000m. The influx of that money will result in enormous pressures on the inflationary situation country. The Minister obviously does not stand this; if he did, he would not make such naive statement as he did on Monday last. There is no doubt in my mind that interest rates on homefinancewill rise by at least 2 cent in the next year. If the Government intends to hold the annual growth in the money supply around 12 per cent, interest rates must rise m next year. The effect of this on potential buyers, on recent purchasers, on the housing industry and on the economy will be disastrous. A 2 per cent increase in interest rates is not ginal. Its effect will be to increase average repayments by amounts ranging between $28 and $36 a month. Not even many of those better off people who will benefit from the homes ings grant scheme will be able to cope with this increase. The average worker, let alone the really poor amongst us, will have no hope of ever ing a home. That will be the result under this Government's policies. The effects of this devaluation undoubtedly will widen the repayment gap. It is pointless to introduce measures aimed at overcoming the posit gap when the major problem facing home buyers is worsening. If interest rates rise by cent in the next year, only those people earning more than 150 per cent of average weekly ings will be considered by lending institutions housing loans if the 25 per cent to 30 per cent repayment rules are maintained. It is about time that this Government faced up to the situation and took positive measures to implement ble loan repayment scheme. It was the key to its December 1975 housing pohcy; but the GovernAnother ment has refused to do anything to introduce thateffect scheme. Rather than do that, the Government has aboUshed the Australian Housing Corporwas ation which the Labor Government estabUshed to introduce such a scheme. This is a sectional Government. It is a GovernI ment whose entire ideology revolves around widening the gap between the rich and the poor. The homes savings grant scheme introduced by this legislation is regressive. Tins and other direct subsidy schemes to home owners are regressive when they involve transfer of resources from the poor to the rich. These forms of assistance to home owners particularly amount to no more than the poor subsidising the rich. This scheme is particularly regressive. It obvious that low and middle income households cannot save around $40. a week on average, rise which is the amount needed to take full benefit of the carrot being waved in front of their noses. The scheme is a blatant subsidy for those whose in this capacity to save is above average. underThis scheme will benefit only people whose a earnings are well above the average. It wiU do nothing to provide assistance to people whose ability to save is low. Are these people to be per ignored while the Government takes deUberate action to perpetrate class differences and injusto tices? There can be no doubt that the $90m that thethis scheme will cost in a fuU year of operation home would be better spent on assisting people in other ways. It could be used to provide a deferred mortgage repayments assistance scheme marsuch as was put forward by the Labor Government in the Budget of 1975-76. It could be used for a second mortgage scheme such as we put forward in that Budget. By that I mean that secsavond mortgages would not run for a short period of some 8 years but would be spread out over the full Ufe of a loan covering 20 years or 25 years. ownThis money could be used to provide more welfare housing. The amount allocated for this purpose this year is frozen to thefigurespent by the Labor Government 2 years ago. The pressure on welfare housing is enormous deand this present scheme is going to put even greater pressure on this sector. There can be no 2 perdoubt that this money could be used more equitably. This scheme will only marginally increase earnthe number of owner-occupied dwellings befor cause the only people who will be able to use the benefit of this subsidy are those who would purchase a home in any case. People with the ability to save, people with access to homefinance,will a flexibe the only ones who will benefit. worrying feature of this scheme is its on inflation. We must draw on experience. The benefits paid under the old scheme when it in full operation merely resulted in an addition to the price of land and dwellings. That was the experience of builders and real estate agents during the years the old scheme operated. have no doubt that the long-term effect of this scheme will be to add $2,000 to the price of an average home and the land it is built on. That is being the experience of the past. Colleagues, I said earlier that housing was a the human, social and economic problem. The present economic climate is what worries me at the present time. High inflation will continue. In fact we will be lucky if we can is keep inflation down to 16 per cent in the next year. Some economic observers believe it will to at least 20 per cent in the next year. The panic devaluation will have an enormous conseof quence on the home building industry. I see interest rates rising by at least 2 per cent next year. I see money for housing drying up becoming hard to get. I see the Government's savings bonds scheme drawing in money from both the banks and the building societies. Already the interest rate has moved to 10 per cent. That was announced yesterday. We know from previous experience that when the Auscould tralian savings bonds rate rose to that level was a drawing off offinancefrom both the build-grams ing societies and the banks.",47
113,Mr KEATING,PRESCRIPTIONS,It is going to go up.,51
114,Mr UREN,PRESCRIPTIONS,"Of course it is going to go up. predict that interest rates for housing will rise at least 2 per cent in the next year. We know that that situation will create chaos in the home ing sector. I see gloom for the financial and struction sectors of the housing industry. already know that the home building sector both New South Wales and Queensland is under-used at present. I believe that the same pressure wiU be felt in other States and this matter of great concern. The general situation has been extremely difficult. I am not trying say that we in the Labor Party had a magic and that we had aU the answers to the problems. My colleague the honourable member for Hughes, who wiU foUow me in this debate, knows that we had a very difficult problem solve. In fact to some extent we did solve the problem offindinghousing for people earning up to 95 per cent of average weekly earnings. One cannot divorce the homes savings grant scheme from any section of the housing mdustrythe because aU sections are interrelated. Referring now to the problem of welfare housing, when came to power this question was tied up with the moneys made avaUable under the Common- (Mr wealth-State Housing Agreement. Moneys made available at the long-term bond rate but with a rebate formula. BasicaUy the money was the people's money but they were paying for it the long-term bond rate. In our first year in officeI we were able to introduce a scheme whereby weon made money avaUable at 4 per cent. The longthese term bond rate was 9.5 per cent when we wentend out of Government but we were making money avaUable for welfare housmg at 4 per cent. In last year of the MCMahon Government $167m weekly was made available for welfare housing but in our last year of office we made $375m avaUable.erage In 3 years we had increased the amount from $167m to $375m and the terms and conditions under which we made that money avaUable werebelieve great assistance to the States in trying to overcome the backlog of welfare housing. People in the earning up to 85 per cent of average weekly andearnings were able to apply for welfare housmg. Further, 30 per cent of the money that we made avaUable went into what is caUed the builders advance account and was made avaUable to terminating building societies so that people with up to 95 per cent of average weekly earnings apply for a loan. So to some extent, under thereour Administration, there were housing profor people earning up to 95 per cent of average weekly earnings. The great difficulty in the period of our I Administration was meeting the need of that bygroup of people earning between 95 per cent of average weekly earnings and 135 per cent. That buildwhy we introduced several schemes in our is con-1975-76 Budget. Thefirstproposal was the deWe ferred mortgage repayments scheme. The second in was the second mortgage proposal whereby repayments for second mortgages were spread over the full Ufe of the original loan rather than is aover a short period. We were experimenting with those 2 proposals in order to try to overcome the to problems facing that group of people earning bewandtween 95 per cent of average weekly earnings and 135 percent. We were also looking at other schemes such as to co-operative schemes m the inner suburbs. We were trying to establish co-operative housing schemes to cater for people who had Uved for most of their Uves in dwellings which were being taken over by speculators. Under that scheme such people would have been able to approach Australian Government and join in cooperatives to acquire their homes. We were wetrying many other innovative ideas. Only two weeks ago the Minister for the Capital Territory Staley) opened a co-operative scheme here were in Canberra which was developed and encouraged under our Administration. We were trying to do those things in other areas as well. atThings were difficult under our Government and make no excuse about that but we were getting top of the situation and were trying to solve very difficult problems. I predict that by the of this financial year not only the Government will be in a difficult situation but also the people earning up to 135 per cent of average earnings will be in great difficulties. I predict that people earning up to 155 per cent of avweekly earnings wuT not be in a position to meet the repayments of a normal housing loan. This scheme will in no way solve the problem. I it is a misallocation of resources. The $90m could be spent far more widely to overcome many of the critical housing problems. Therefore I ask the House to give consideration and support to the amendment ",51
115,Mr DEPUTY SPEAKER,PRESCRIPTIONS,Is the amendment seconded?,52
116,Mr LES JOHNSON,PRESCRIPTIONS,I second the amendment and reserve my right to speak.,52
