speakerGroups,Speaker,Title,text,pageNumbers
0,NA,Unknown,"Monday, 29May 1978",13
1,Mr SPEAKER,Unknown,"Rt Hon. Sir Billy Snedden) took the chair at 2.15 p.m., and read prayers.",13
2,The CLERK,Unknown,"Petition s have been lodged for presentation as follows and copies will be referred to the appropriate Ministers: Medical Benefits: Abortions To the Honourable the Speaker and Members of the House of Respresentatives in Parliament assembled. The petition of the undersigned citizens of Australia respectfully showeth: That Item 6469 of the standard Medical Benefits Table is the means by which payment is made for the slaughter of thousands of unborn babies every year. Your petitioners therefore humbly pray that the Government should ensure that Item 6469 is removed from the standard Medical Benefits Table. And your petitioners as in duty bound will ever pray, by Mr Anthony, Mr Falconer and Mr Dobie. Petitions received. Medical Benefits: Abortions To the Honourable the Speaker and Members of the House of Respresentatives in Parliament assembled. A petition of the undersigned respectfully showeth: That withdrawal of government benefits under schedule 6469 for first trimester abortion would discriminate against and disadvantage the least privileged in our society. Your pedtioners most humbly pray that the House of Representatives, in Parliament assembled, should: Under no circumstances withdraw government benefit under schedule 6469 forfirsttrimester abortion. And your petitioners as in duty bound will ever pray, by Dr Cass. Petition received. To the Honourable the Speaker and Members of the House of Representatives in Parliament assembled. The petition of the undersigned citizens of Australia respectfully showeth: That those who have retired and those who are about to retire, are being severely and adversely affected by inflation and Australian economic circumstances. The continuance of the mean's test on pensions causes undue hardship of them. We call on the Government to immediately abolish the means's test on all Aged Pensions. To ensure a pension for all on retirement, and a guarantee that All Australian Citizens will retire with dignity. Acknowledge that a pension is a: 'right and not a charity', by Mr Dawkins. Petition received. Children's Hospital To the Honourable the Speaker and Members of the House of Representatives in Parliament assembled. The petition of the undersigned citizens of Australia respectfully showeth: 'We mothers of Penrith and the outer Western Suburbs feel most vehemently that a childrens hospital should be esPETITIONS tablished within this area, operating on the same principles as Royal Alexandria Hospital, Camperdown, allowing mothers to remain with their children for the duration of their hospitalisation. If a childrens hospital were not feasible then we would submit that Nepean Hospital should be extended to provide these facilities. And your petitioners as in duty bound will ever pray, by Dr Klugman. Petition received. Pensioners: Home Maintenance Loans To the Honourable Speaker and Members of the House of Representatives in Parliament assembled. The petition of the undersigned citizens of Australia respectfully showeth: That it is necessary for the Commonwealth Government to renew for a further term of at least 3 years the States Grants (Dwellings for Pensioners) Act 1974-77, renewed for one year expiring on the 30 June 1978. The demand for dwellings has not slackened as the waiting list (all States) of 12,060 single and 4,120 couples as at the 30 June 1977, showeth. Your petitioners respectfully draw the attention of the Commonwealth Government to the Report of the Committee of Inquiry into Aged Persons' Housing 1975 under the Chairmanship of the Rev. K. Seaman (now Governor of South Australia) which recommended additional funds to State housing authorities to meet the demand for low-rental accommodation in the proportion of $4 for $1 with the proviso that the States do not reduce their existing expenditure and That the Act include married pensioners eligible for supplementary assistance and migrants as specified by the Seaman Report and that particular consideration be paid to the special needs and requirements of the prospective tenants in the location and design of such dwellings. Furthermore, your petitioners desire to draw the Government's attention to the hardship of many pensioner home owners caused by the high cost of maintenance. Pensions The Social Security Annual Report 1976-77 shows that 24.6 per cent, or 283,000 home owning pensioners, have a weekly income in excess of the pension of less than $6 per week. Your petitioners strongly urge the Commonwealth Government to establish a fund whereby loans can be made to means tested pensioners for the purpose of effecting necessaiy maintenance to their homes. Such a loan to be at minimal interest rates sufficient to cover administrative costs and to be repaid by the estate upon the death of a single pensioner before probate or upon the death of the surviving spouse in the case of married pensioners or where two pensioners joindy own the dwelling. Administration to be carried out by local government bodies. And your petitioners as in duty bound will ever pray, by Mr Morris. Petition received. To the Honourable the Speaker and Members of the House of Respresentatives in Parliament assembled. The humble peddon of undersigned citizens of Australia respectfully showeth: That the existence of a system of double taxation of personal incomes whereby both the Australian Government and State Governments had the power to vary personal income taxes would mean that taxpayers who worked in more than one State in any year would: (a) be faced with complicated variations in his or her sonal income taxes between States; and (b) find that real after-tax wages for the same job would vary from State to State even when gross wages were advertised as being the same; and (c) require citizens to in each State. Your pedtioners therefore humbly pray that a system of double taxation on personal incomes be not introduced. And your pedtioners as in duty bound will ever pray, by Mr Morris. Petition received. To the Honourable the Speaker and Members of the House of Representatives in Parliament assembled: The humble petition of the undersigned citizens of the Commonwealth of Australiarespectfullyshoweth: That the citizens of Australia totally reject communism and call upon the Government to: (a) ban all communist organisations, and (b) prohibit all communists from holding office in all industrial organisations, government departments, and in parliament. And your petitioners as in duty bound will ever pray, by Mr Shipton. Petition received. To the Honourable the Speaker and Members of the House of Representatives in Parliament assembled the petition of the undersigned citizens of Maryborough, Victoria, respectfully showeth: that money spent on armaments could better be spent on food and health programs in third world countries; on education and the eradication of illiteracy and poverty; that Australia should support complete world disarmament at the forthcoming United Nations General Assembly's Special Session on Disarmament; And your petitioners as in duty bound will ever pray, by Mr Short. Petition received. Television: Warburton Area To the Right Honourable the Speaker and Members of the House of Representatives in Parliament assembled. The humble petition of the undersigned citizens of the township of Warburton in the electorate of MCMUlan respectfully showeth: Whereas: Taxation (a) Since the introduction of television into Australia twenty-two years ago, one half of the residents in the township of Warburton in Victoria have not been able to receive a viewable picture. (b) The community Television Antenna System (CTAS) could be introduced into the Warburton area to remove this inabUity and provide television to all those wishing to view that means of community education and entertainment. Your petitioners therefore humbly pray that the Governper- ment of the Commonwealth of Australia per medium of the Minister for Post and Telecommunications give all directions to ensure the instaUation of all equipment necessaiy to install CTAS of such other means to produce television viewing for the citizens of Warburton. And your petitioners as in duty bound will ever pray, maintain records of income earned by Mr Simon. Petition received. Aboriginal Land Rights To the Honourable the Speaker and Members of the House of Representatives in Parliament assembled. The humble petition of the undersigned residents of Mossman Gorge Mission Portions 11 and 67 Parish of Victory, County of SoCommunism lander a Reserve set aside for the benefit of aboriginal inhabitants of the State-respectfull y showeth: 1. That the Federal Government recognise land rights in the States, such as Queensland, in a similar manner to the recognition of land rights in the Northern Territoiy i.e. enact an Aboriginal Land Rights Act for Queensland. 2. That the Federal Government support the abolition of the Aborigines Act (Queensland) 1971 and the Torres Strait Islanders Act (Queensland) 1971 and take such action as they may deem necessary to ensure that the provisions of the Queensland Discriminatory Laws 1975 and the Racial Discrimination Act 1975 be enforced in so far as they relate to Aborigines and Islanders; 3. That the Federal Government assume responsibUity for Aboriginal Affairs in Queensland under the powers given them by the Referendum of 1967. The State Department of Aboriginal and Islander Advancement Queensland should Disarmament be aboUshed and Aboriginal and Island reserves in Queensland should have the choice to be self-governed with local government status. 4. That the Federal Minister for Aboriginal Affairs make a declaration on behalf of Mossman Gorge Reserve under Section 5 (1) (b) of the Aboriginal and Torres Strait Islanders (Queensland Reserve and Communities Self Management) Act 1978. That this Reserve is a Reserve under which the Aboriginal and Torres Strait Islanders (Queensland Reserves and Communities Self Management) Act 1978 appUes. 5. That in making the Declaration (4 above) the Minister also takes necessary steps and actions to: (a) Acquire the 25.2 ha occupied by the Reserve to enable development by the community as a result of self management obtained under the act. (b) In lieu of 5 (a) above-arrang e for a special purpose less adequate to meet the development requirements of the community. And your petitioners as in duty bound will ever pray, by Mr Viner. Petition received. National Family Policy To the Honourable the Speaker and Members of the House of Respresentatives in Parliament assembled. The humble peddon of undersigned citizens of Australia respectfully showeth: That 'The family is the natural and fundamental group unit of society and is entided to protection by society and the state'. Your petitioners therefore humbly pray that the government initiate a national family policy and use the concept of family impact statements as a means highlighting family needs. And your petitioners as in duty bound will ever pray, by Mr Wilson. Petition received. NA",13
3,Mr MALCOLM FRASER,MINISTERIAL ARRANGEMENTS, I inform the House that the Minister  yesterday for discussions with the United Nations in Europe. He is expected to return to Australia on 22 June. During his absence the Minister for Primary Industry (Mr Sinclair) will act as Minister for Foreign Affairs. NA,15
4,Mr HAYDEN,CENSURE OF PRIME MINISTER, I give notice that on the next day of sitting I shall move: That the House censures the Prime Minister for failing to require consistent standards of proper conduct from his Ministers; his complete reluctance to defend his Government's policies in debate in the House; his failure to properly discharge his responsibilities to the House; his interference in matters of public administration which should have been administered impartially; his lowering of public esteem of the office of Governor General; his extravagant self indulgence in the matter of his personal overseas travel; and his erratic and undesirable style of personal control over the Government.,15
5,Mr MALCOLM FRASER,CENSURE OF PRIME MINISTER,"Mr Speaker, I suggest that the proposed motion be dealt with now.",15
6,Mr SINCLAIR,CENSURE OF PRIME MINISTER, I seek leave of the House to move a motion to enable the Leader of the Opposition (Mr Hayden) to move forwith the motion of censure of the Prime Minister of which he has given notice for the next sitting. Leave granted. Suspension of Standing Orders Motion (by Mr Sinclair) agreed to: That so much of the Standing Orders be suspended would prevent the Leader of the Opposition moving forthand with the motion of censure of has given notice for the next sitting. Motion of Censure,15
