speakerGroups,Speaker,Title,text,pageNumbers
74,Mr CHAPMAN,ARMS CONTROL,"Yes , but honourable members have to bear in mind the comparison between the interest rate being charged and the long-term bond rate. That is thefigurethat one must look at. The honourable member for Reid also opposes the concept in this Bill of increasing rentals to a market-related level. He claimed that this would create a great deal of hardship within our community, and moved an amendment which would result in the Commonwealth Government meeting, to a minimum uniform level, the cost of rental rebates. The honourable member for Reid should be reminded that, in the initial negotiations on the agreement, this kind of proposition was offered to the States. At that time the States rejected it in favour of the continuation of concessional interest rates. They chose to retain those rates instead of receiving a subsidy for market-related rents. However, negotiations are continuing and it is quite possible that if agreement is reached with the States a subsidy to a certain level will be provided by the Commonwealth Government. The honourable member for Reid also claimed that the movement towards marketrelated rents would substantially increase the total expenditure on rebates. It may well do so, but that does not mean that it will increase the net cost of subsidising the housing of occupants of pubhc sector housing. The combined effect of the concessional interest rates and marketrelated rents charged to those on incomes sufficient to be able to afford them will mean that the overall cost to the State Government of providing such housing will be less. Even if the amount provided by way of subsidy may be more, they will recoup more because of the charging of market-related rents. Also, of course, costs will not be so great because the concessional interest rates will be retained. The honourable member also suggested that the rents charged for Housing Commission dwellings should be set by the Commonwealth at 85 per cent of the rental rate on the open market for those with incomes of up to 135 per cent of to average weekly earnings. He justified this by saying that the concept of market rent had an artificial meaning; that, in fact, the level of market rents had been increased because of the limited amount of rental housing that was available in the private sector; that this had pushed up rents; and that the Commonwealth was at fault for not providing sufficient housingfinance.Once again, this is criticism merely for the sake of criticism. It offers nothing constructive in that regard at all. Clearly, the aim of the proposed 1978 Housing Agreement is to provide adequate rental housing for those members of the community who are deemed to be in need of government assistance, at a price that will be within their capacity to pay. The basis of the rental part of this agreement the operation of the rental rebate system sociation with market-related rents. Rental bates are designed so that the rent paid is related to the income of the tenant and to other family circumstances. The concessional interest rate of per cent on funds advanced to the State is the means by which they are able to afford to grant rebates. The subsidies inherent in this concesphed, sional interest rate, however, are not intended subsidise the rents of those who are no longer need, those who can afford to pay market-related rents. What the honourable member for Reid is suggesting is that the Commonwealth Governtenants. ment should impose a means test to determine who can and who cannot afford market-related rents. Once again, he wants heavy handed Canberra control of that means test, whereas the agreement and the legislation provide the States with flexibility to determine, on the basis of their own situation and circumstances, what that means test shall be. Of course, as we are aware, situations and circumstances vary from State State. Therefore it is appropriate that the State governments should have the right to determine the level at which assistance in the form of rental subsidy should be provided and the level of income of people who should be required pay market related rents. Mr Kevin Cairns-The Minister is agreeing their with you on that.",43
75,Mr CHAPMAN,ARMS CONTROL,"Yes, I am glad to see that the Minister is in agreement. Of course, he guidelines knows, as I know, that this is a significant piece of legislation which will provide benefits to people in the low income area. Mr Kevin Cairns-In his heart the honourable member for Reid agrees too.",44
76,Mr CHAPMAN,ARMS CONTROL,"Of course he agrees. He is only playing politics, and we The other significant factor is that the rental policy will be one of market related rents. The States are not required to charge the rent that the ket will bear. Therefore if through the factors that the honourable member for Reid suggests, the rent that the market will bear is higher than he believes will normally transpire because of some sort of artificial shortage, the State Governincrease ment can take account of that in assessing what an appropriate market related rent. So it is market related rent that is required to be charged and not the rent that the market will bear. That is a point that bears remembrance. This proposal is justified, particularly on the grounds of the evidence that was presented to is the Henderson poverty inquiry. The evidence in asshowed that on the one hand some 146,000 repeople who lived around the poverty line were not assisted by State housing authorities while on the other hand some 132,000 people who were 5 well above the poverty line hved in public housing and gained concessional benefits in terms of rent. Under the State rental policies that had apsubstantial inequities had developed beto tween differing groups of tenants. Tenants no in longer in need paid rents well below private market rates and recent public tenants in some States paid substantially higher rents than longer term That is why this change to market related rents has been initiated. The policy will be progressively implemented, and the hardship that the honourable member for Reid suggested will occur will not occur because of this progressive implementation. It is also worth noting that the States have already moved towards this situation. The New South to Wales Government was the first State government to implement the policy from 1 July 1977. Clearly, the States have resented the Coma monwealth dictating an inflexible means test. This is what would again transpire if the second to paragraph of the amendment moved by the honourable member for Reid were accepted. The individual States are better able to judge priorities and relate to this particular circumstances and regional needs within the general framework of the Commonwealth provided in this legislation. In fact, the assistance which will be provided in the form of rebates on the basis of the charging of market rents will mean that many lower income families will pay substantially less than 85 per cent of the market rate which was suggested as being appropriate by the honourable member for Reid. His amendment would introduce an element of inflexibility which the States would not be preall know that too. pared to accept. The honourable member for Reid then remarferred to the charging of interest rates by the Commonwealth Government, which is required of the State authorities, for on-lending for home purchases. Interest paid on money lent to purchasers for the purchase of welfare housing will by half of one per cent a year until it is reaches one per cent below the long term bond the rate. The honourable member for Reid claimed that this rate of increase in the interest rate is too steep. He also claimed that it wdl mean a weekly repayment increase of some 5 per cent each year. Apparently his mathematics have changed. Last September he released a Press story in which he claimed that weekly repayments would increase by 10 per cent per annum. I wonder which ofhis calculations are correct. He also said that this may well be possible with the current rate of inflauon but that people would have severe difficulties in meeting these repayments if inflation were to fall to a level of 3 per cent or 4 per cent. He therefore suggested in another paragraph of his amendment that interest rate increases should be geared to capacity to pay. Of course, the first thing he needs to remember is that if the rate of inflation falls per cent, as it most definitely will under the pohcies of this government, the long term bond rate will also come down. Therefore the half of one per cent increase a year will reach a ceUing within one or two years. So the increases in weekly repayments which the honourable member claims will have to be made will not occur when inflation falls to 3 per cent or 4 per cent because the long term bond rate will follow down that rate of inflation. The other factor is that when inflation falls to that level the cost of living will also fall. Therefore the real household disposable income of famUies will increase and that will also reduce their hardship situation. The new policy in which there is no restriction on the number of houses allowed to be sold, vided they are sold for cash at market value replacement cost, will mean fair treatment for because concessional home loans will be avaUnow, able to tenants on the escalating interest principle on the same terms as those wishing buy private houses. The poUcy also means that housing authorities will be able to replace dwellcome ings that are sold so that a run-down in rental stock does not occur. Under the previous Agreedictatorship. ment the States had sold off assets and therefore created a continued demand for Commonwealth funds. Of more than 300,000 dwellings conin structed under previous agreements, only 170,000 were left for rental to needy families. The new poUcy, by ensuring that public housing is sold at market cost for cash, will ensure that there is a continuing fund avaUable to ensure a continuing stock of rental housing for the poor while stUl maintaining our objective of encouragexactly ing home ownership. To meet this new demand the Agreement allows forflexiblelending practices to individlong uals so that those on lower incomes will have variety of means of meeting their repayments. Despite the fact that interest rates will increase by half of one per cent a year there are a variety offlexiblerepayment schemes possible under the new legislation to assist those on low incomes. These variable schemes will provide far greater benefit than would afixedrate of interest for low income earners. The legislation provides the opportunity to maximise both home ownership and home rental opportunities for those on low incomes. The amendment moved by the honourable member for Reid would in no way enhance those opportunities. As I have said, it is mere criticism for the sake of criticism and mere political point scoring. I oppose the amendment and support the to 3 per cent or 4 legislation.",44
77,Mr DEPUTY SPEAKER,ARMS CONTROL,Mr Armitage)Order! The honourable gendemen's time has expired.,45
78,Mr BRYANT,ARMS CONTROL,"We have just listened to the honourable member for Kingston (Mr Chapman) express his rather Utopian view of the Liberal Party. It is a pity that he did not read his speech before speaking this afternoon. If he had done so he would have seen the complete nonsense of it aU. It has nothing to do with reality-that is all that is wrong with it. I think the honourable member expressed the view that home ownership will be made easier by selling houses to housing commission tenants at market cost for cash. That is a terribly simple operation prothese days. I do not even know what 'market or cost' means. We can talk about the cost of a aU house when we put it up and its market price but what on earth is the market cost? The rate honourable member for Kingston gave a rather to odd apologetic speech for the Liberal Party and his Government. He used terms which have bepart of the mythology of Australian politics. He talked about the heavy-handed centralist He was, of course, speaking about the Labor Government of 1972 to 1975, the Government which initiated innovative schemes schools and introduced the Australian Assistance Plan and self-determination and self government for Aboriginal people on their land. The honourable member talked about militant unionism putting up the cost of housing. It would not be a bad idea if he went off and found out what has happened to the labour cost in housing. Over the last five or six years it has diminished as a proportion of the cost of housing. Then the honourable member talked about the term bond rate. I am always intrigued with a that term. Apparendy the long term bond rate is an objective force in the Australian economy over which humanity and governments have no management or control. Who sets it? The honourable member can explain that to me afterwards. Then he spoke about interest rates. He said that interest",45
79,Mr CHAPMAN,ARMS CONTROL,What are you talking about? don't think you know.,46
80,Mr BRYANT,ARMS CONTROL,"I think that we can explain Scheme that to the honourable member afterwards not in thetimethat I am allowed in this debate. is obvious that I would have to explain it two three times. The honourable member used this wonderful terminology-it is hardly terfor minology-and said that interest rates are increasing, although he did admit that they would be going up. I am lost as to what that means. He spoke also of market related rents things such as that. No social area with nonsense than housing, particularly when it is what might be termed pubhc housing or pubhcly-owned housing. There is no policy on housing; there is no philosophy on housing. on this side of the House admit that we are searching for a philosophy. We have to make completely new analysis of the social and omic situations and of the financial structures that we can put behind housing. In 1972 we inherited the formula which had been used since 1945 under the Commonwealth-State Housing reduced Agreement. This was an advance on the previous system established in the late 1930s but we all must now look for a new approach to housing. What on earth do we mean by such terms as 'market-related rents', 'economic rents', ' family income as related to rents'?",46
81,Mr ROGER JOHNSTON,ARMS CONTROL,We will give you a reduced lesson later.,46
82,Mr BRYANT,ARMS CONTROL,"I know what the honourable member would do. He is one of the aposdes of private enterprise and exploitation, and of ing people down. So I know what he would do. We are always searching for a magic formula but there is none. The objectives which the GovernMelbourne ment has spelt out, of adequate housing for all, of home ownership for all income groups and of ensuring economic conditions which will permit a stable and adequate building industry, laudable. However, how far do this Governfloors ment's economic policy and the housing pohcy of the Minister for Environment, Housing and Community Development (Mr Groom) go sure towards achieving those objectives? They do nothing. The fact is that the achievement of housing for all people is further away than it even 10 years ago, and certainly three or four years ago. There is nothing in this legislation which will guarantee it or improve the situation. The Austrahan scene is clear enough. It is true that all Austrahans probably would hke a home of their own, a spot of their own, by whatever means make it easy to them to get hold of it. The most desirable system we have had-it has been I amended a bit-wa s the original Defence Service Homes Scheme, or the War Service Homes as it was known up until not so long ago, but which created the opportunity for people to It achieve home ownership in the most flexible or way. They could do what they wanted with the housing and, as the great proportion of the funds the scheme came from public funds, the not Government was able to providefinanceat very low interest rates. That system has been under constant and persistent attack for a long while. and There are all sorts of reasons why that system is more beset ought to be maintained. I regard home ownership, or the occupancy of a piece of property and a home which we can call We our own and with which we can do what we Uke, as a fundamental social need. The size of the a house is something to which we have paid very econUttie attention. As houses have become more complicated inside they have generally speaking become smaUer inside. As we put in more power points, more refrigerators and more heating we the size of the house. The house in which I was born sometimeback had fair sized rooms of 15 or 16 feet square with ceUings of nine feet or 10 feet. Of course, it had nothing much else. However, astimehas gone by we have got down and to rooms measuring nine feet by 10 feet in Government houses-in all sorts of houses-as an average second or third bedroom. We have also the capacity for privacy inside the modern home because of the size and structure of the home and the way we use the space. We are beset with all sorts of odd emotive grindattacks upon the system by people who hke to call themselves planners. We talk about the suburban sprawl. This has always intrigued me. In the great planners in the Housing Commission who talk about the suburban sprawl said that we should put up blocks of flats. Now such places tower all over Melbourne and Sydare ney and elsewhere and people are living 21 up. However, the people who designed these buUdings went out to live at Warrandyte, Mount Eliza and places like that. They made that they were not part of the system. We talk about the waste of resources because people have a half or a quarter acre of land or a 60 foot was land frontage, but as Ufe goes on, as society changes and as we have more leisure and all the things that go with the reduction in workmg hours and the demands of working times upon us, the more space we need around us. There are people who disagree with that but in general that seems to me to be the objective of most people I know, no matter what their wealth or station. Apart from the few little extras that go into houses, generally speaking most Australians are not ostentatious about housing. They need plenty of space and they need privacy, comfort, security and the services that go with housing. Has this legislation done anything to assist in that direction? No. This is not because of the technical machinery of the legislation but because of the philosophy behind it, as it was expounded by the honourable member for Kingston who spoke about market rates and all that nonsense. Let me pause for a moment to look at the question of interest. I am regarded as a slight heretic on this side of the House on the question of interest but, disregarding the basis upon which interest is generally calculated as part of the economy, the fact is that interest rates have become a generator of inflation and not a product of it. When we put up interest rates five years ago it was part of the economic theory of the timeand still is-that interest rates had to be closely related to inflation rates, but the fact is that once interest rates rise to 7 per cent or 8 per centhonourable members can do their own calculations-the cost of the money, particularly for housing is often greater than the cost of bricks and window panes and other materials. We have to find new techniques of handUng that problem. I want also to speak this afternoon as the former Minister for the Capital Territory because I can bring to the notice of honourable members my experience of the Australian Capital Territory housing system. For the benefit of honourable members, most of whom come into the place and go out again at a rate of knots, the Australian Capital Territory housing system is a very large system, particularly in view of the size of the population. It is nearly as large as the operations of the Western Australian Housing Commission. There are 11,000 units, including flats, in the system and rents this year will gather in about $20m. The maintenance of the dwellings will cost approximately $4m and the cost of administration will be about $2m or $3m but this cost is not easUy determined. The interesting question is what has been the capital outlay since the system started in 1924 or thereabouts. I would think it would be about $ 150m. It is hard to determine the outlay exactly because back in the 1930s thefigureswere buried too deeply in Budget papers and elsewhere. What is the capital value of the dwellings today? It is at least $350m. Apart from that, the system has made loans to about 20,000 people. So when we look at formulae and talk of market rates and so on let us consider what we are really talking about. One of the great problems as I see it is that we are incUned to look upon a house as having an easUy determined life. It has no such thing. There are houses in my electorate",46
83,Mr CHAPMAN,ARMS CONTROL,It depends how well they are looked after.,47
84,Mr BRYANT,ARMS CONTROL,"And it depends of how they are built. It is remarkable how long houses will stand. For instance the most humble houses in this city are those in the Causeway. They were put up in the 1920s at a cost of $1,463 each. The rent on an average house in that area that is still occupied, but not many of them are now, on rough calculation has amounted to $6,800. What is the economic rent of those places as a piece of investment? I shall cite another example of what might be caUed the long life of houses. There are houses in my electorate that were buUt during the Depression in the 1890s. At that time they were empty so people were paid five shillings a week to Uve in them. They now sell for $25,000 to $30,000 and are let at $40 to $50 a week. So what are we talking about when we talk about terminating loans, amortisation and all the rest of it? I think these are irrelevant to a public housing, commercially operated poUcy. I cite a couple of examples of the better class of house, those which were buUt in the 1930s in this city. For example, a brick house in Griffith cost $3,668 at that time. We have collected over $ 13,000 in rent on that house so far. I know of one in Ainslie which cost $4,337. So far we have collected over $13,400 in rent. What does that house owe us? We have collected about three times the capital outlay over that period. What are those houses worth now? They are worth at least $30,000 each. As a matter of fact, considering their location and their proximity to the city, they are probably worth more. I have given a rough estimate.  Mr Burns-They are your houses.",47
85,Mr BRYANT,ARMS CONTROL,"They are publicly owned houses. They are part of the Canberra rental stock. The honourable member owns them. He has one fourteen-millionth of them, and so have 1.I am pleased to be a partner in the ownership with him.",47
86,Mr SCHOLES,ARMS CONTROL,"If we are not careful, the Irishman will pull them down and take them away.",47
