speakerGroups,Speaker,Title,text,pageNumbers
193,Mr COHEN,PAIRS,"I shall be brief. I wish to answer one of the comments made by the honourable member for the Northern Territory who suggested that there should be consultation with the people of the Northern Territory. I do not think anybody on this side would disagree with that. In fact if honourable members look at the Opposition's original amendments they wiU see that the Opposition suggested a wide ranging number of areas for consultation. The Opposition is happy to see this improvement. The important thing that needs to be remembered, with all due respect to the people of the Northern Territory, is that the question of uranium mining is not just a question for the people of the Northern Territory to decide. It will affect the whole of Australia and the whole world. It is true that the Kakadu National Park is located in the Northern Territory as is the Uluru National Park. I believe these things are",68
194,Mr CALDER,PAIRS,"A m I getting a lecture on this, when I was unable to discuss it?",68
195,Mr COHEN,PAIRS,"No. I am dealing with the clauses in the Bill, which relates to the Alligator Rivers Region.",68
196,The DEPUTY CHAIRMAN,PAIRS, The That honourable member is not entitled to deal with the clauses in the Bill. The Committee is considering the amendments.,68
197,Mr COHEN,PAIRS,"I am sorry, I am dealing with the amendments. The honourable member for the Northern Territory raised these points. It is important to remember that the questions of the Kakadu National Park and supervising scientists are national questions that are not just restricted to the people of the Northern Territory. I do not want to canvass the whole range of amendments and the Bill. I spoke for some 30 minutes on the Bill when it was presented before.",68
198,Mr UREN,PAIRS,"The Opposition has been disturbed about the whole question of the appointment of the Supervising Scientist. The proposed amendment relates to the conditions of that appointment or to the conditions under which he is to work. The situation is that the Supervising Scientist was an employee of the Atomic Energy Commission. People who are impartial on this issue are gready concerned about that. I might say that the Supervising Scientist involved himself in the Ranger Uranium Environmental Inquiry. At pages 249 and 250 of the second report of the Ranger inquiry we find the following: A strong body of evidence demonstrates a widespread lack of confidence in the Atomic Energy Commission as the final arbiter of standards for the proposed mining operadons, and as monitor of them. This is in part because it is proposed that the Commission be actively engaged as an entrepreneur, and in part because one of its ordinary rolesMr Groom- I wish to raise a point of order. This sort of comment is totally irrelevant to the amendments before the Committee. We are concerned with the question of the Supervising Scientist consulting certain people, with the Supervising Scientist sending a copy of his report, it having been tabled in the Parliament, to the relevant Minister in the Northern Territory Government. Those are the specific issues with which these amendments are concerned. If we are to become involved in the way in which the Supervising Scientist is appointed, his past history and so on, we will be here not only all night but all week as well.",68
199,The DEPUTY CHAIRMAN,PAIRS, I uphold the Minister's . . .,69
200,Mr UREN,PAIRS,How can the Chair uphold him when it has not yet heard me on the matter?,69
201,The DEPUTY CHAIRMAN,PAIRS,"The honourable member has not heard what the Chair has to say yet either. I ask him to resume his seat for a moment. In my view, the Minister is perfectly correct: It has nothing to do with the Atomic Energy Commission. Quite frankly, the Chair does not know anything about the background of the Supervising Scientist. What it knows is that the Supervising Scientist, according to this amendment, consults the Director of National Parks and Wildlife and the Director of the Territory Parks and Wildhfe Commission and what have you. That is as far as the Chair knows. It is hard for the Committee because perhaps we are learning more about the relevance as we go along. We must try to be relevant.",69
202,Mr HOLDING,PAIRS,"On the point of order: Clause provides that the Supervising Scientist 'shall sult with, and have regard to'. Surely if an amendment encompasses the provision that a the supervising scientist shall consult with and have regard to, one is entitled to presume that opens up the question of the the capacity to have regard to, and capacity in . that sense just does not go to the question scientific quaUfications or knowledge. It goes matters of prejudice, of background, and of Uef. I would submit that, having regard to the fact that we are dealing with the role and duties of the Supervising Scientist, it must be perfectly open to an honourable member to address the Committee, within the framework of those claims, on the basis that the proposed amendition ments cannot be achieved because the Supervisbeen ing Scientist in our view-concernin g which we wish to address the Committee-woul d not be able to carry out those functions. That is the in which the argument is put. It would be, with great respect, an unduly narrow view which would say that that argument could not be put the Committee.",69
203,The DEPUTY CHAIRMAN,PAIRS,"I thank the Scientist honourable member for Melbourne Ports help to the Chair in this matter; but because the Supervising Scientist is a man, does that we can discuss everything that men do. I would be horrified if the honourable member were to think me too narrow in Chair must be at least more narrow than Is the honourable member's liberal interpretation. I call upon the honourable member for Reid.",69
204,Mr UREN,PAIRS,The whole point that I am trying to make is that the Supervising Scientist concerned was an employee of the Atomic Energy Commission.,69
205,The DEPUTY CHAIRMAN,PAIRS,I think the honourable member has made that point.,69
206,Mr UREN,PAIRS,"He did give evidence before the Ranger inquiry. I am trying to quote the words of the Commissioners on that subject. I think that it should be heard by the Committee. It will take but a few words tofinalisethe quotation. I repeat, there is disquiet on the part of people who gave evidence about how impartial they would be if they were involved in the business of uranium mirting. The position of the Supervising Scientist was not advertised. He was appointed internaUy, by the Government. We know that there has been a struggle within the bureaucracy; that the Department for Environment, Housing and Community Development in many cases lost out to those under the administration of the 33 Deputy Prime Minister (Mr Anthony), the congrowth sector. This is why there is so much disquiet about this appointment, about the role of Supervising Scientist. It is for that reason that I draw the attention of the Committee to the rethat marks that I have made. The quotation capacity to consult, concludes: . . one of its ordinary roles is the promotion of uranium of mining and nuclear development generally. to That is a reference to the Atomic Energy Combemission. An ex-employee of that Commission is involving himself in this position of the Supervising Scientist. There should be great disquiet about the whole attitude that is being adopted. More should be known about the problems that have occurred within the Government. The posof the Supervising Scientist should have advertised nationally. Because of the grave, unresolved problems relating to the environment in the area concerned, the gentleman in question way should never have been put in that position. One has only to read the first and second reports of the inquiry to realise the grave, unresolved ento vironmental problems that remain in the area, and the grave responsibility that the Supervising would have. That is why there is so for his much disquiet on this side.",69
207,The DEPUTY CHAIRMAN,PAIRS,I caU on the not mean honourable member for Hughes.,69
208,Mr LES JOHNSON,PAIRS," Mr any way, but the Deputy ChairmanMotion (by Mr Bourchier) put: That the question be now put. The Committee divided. (The Deputy Chairman- Mr G. O 'H. Giles) Ayes Noes Majority NA Adermann, A. E. Howard.J.W. Aldred.K.J. Hunt, R. J.D. Baillieu, M. Hyde, J.M. Baume, M. E. Johnston, Roger Birney, R. J. Katter, R. C. Bourchier, J. W. Killen, D.J. Bradfield, J. M. Lloyd, B. Braithwaite, R. A. Lucock, P. E. Brown, N . A. Lusher, S. A. Bungey, M. H. Lynch, P. R. Burns. W.G. MACKellar, M. J.R. Burr, M. A. MCLean, R. M. Cadman, A. G. MCLeay, J. E. Cairns, Kevin MCVeigh, D.T. Calder, S.E. Macphee, I. M. Cameron, Ewen Millar, P. C Carlton, J. J. Moore, J.C. Chapman, H. G. P. Newman, K. E. Connolly, D. M. O'Keefe, F.L. Cotter. J. F. Poner.J.R. Dobie, J.D. M. Ruddock, P. M. Drummond, P. H. Shack, P. D. Edwards, H. R. Shipton, R. F. Ellicott, R.J. Shon, J.R. Falconer, P. D. Simon, B. D. Fife, W. C. Sinclair, I . MCC. Fisher, P. S. Staley, A. A. Garland, R. V. Street. A. A. Gillard, R. Thomson, D.S. Good luck, B. J. Viner, R. I . Graham, B. W. Wilson. I . B .C Groom, R. J. Haslem, J.W. Hodgman, M. Corbett, J. NA Armitage, J. L. Jones, Charles Brown, John Keating, P.J. Bryant. G. M. MCMahon, Les Cohen, B. Martin, V.J. Dawkins. J. S. Morris, P. F. Everingham, D. N . Scholes. G.G.D. FitzPatrick, J. Uren.T. Holding, A. C Wallis, L G. Howe. B. L. West,S.J. Jacobi, R. Willis, R. James, A. W. Tellers: Jenkins, H. A. Johnson, Keith Jones, Barry Johnson, Les NA Manyr, J. R. Whitlam. E.G. Peacock, A. S. Humphreys, B. C Jull, D. F. Stewan, F. E. Dean, A. G. Klugman, R. E. Yates, W. Young, M.J. Question so resolved in the affirmative. Original question resolved in the affirmative. Amendments agreed to. Resolution reported. Adoption of Report Motion (by Mr Groom) put: That the report be adopted. 67 The House divided. 25 (Mr DEPUTY SPEAKER - D r H. A. Jenkins) 42 Ayes 68 Noes 24 Majority 44 Adermann, A. E. Howard.J.W. Aldred, K.J. Hunt, R. J.D. Baillieu, M . Hyde, J.M. Baume, M. E. Johnston. Roger Birney, R. J. Katter, R.C. Bourchier, J. W. Killen, D.J. Bradfield, J.M. Lloyd, B. Braithwaite, R. A. Lucock, P. E. Brown, N . A. Lusher, S.A. Bungey, M . H. Lynch, P. R. Bums, W. G. MACKellar, M. J.R. Burr, M. A. MCLean, R. M. Cadman, A. G. MCLeay, J. E. Cairns, Kevin MCVeigh, D.T. Calder, S.E. Macphee, I . M. Cameron, Ewen Millar, P. C. Carlton, J. 1. Moore, J.C. Chapman, H. G. P. Newman, K. E. Connolly, D. M. O'Keefe, F.L. Cotter, J. F. Porter, J. R. Dobie, J.D. M. Ruddock, P.M. Drummond, P. H. Shack, P. D. Edwards, H. R. Shipton, R. F. Ellicott, R.J. Shon, J.R. Falconer, P. D. Simon, B. D. File, W.C. Sinclair, I. MCC. Fisher, P. S. Staley, A. A. Tellers: Garland, R. V. Street, A. A. Giles, G.O'H. Thomson, D. S. Hodges. J.C. Gillard, R. Viner, R. I . Good luck, B. J. WUson,I.B.C. Graham, B. W. Groom, R. J. Tellers: Haslem, J.W. Corbett, J. Hodgman, M . Hodges, J.C. Armitage, J. L. Keating, P. J. Brown. John MCMahon, Les Bryant, G. M. Martin, V.J. Cohen, B. Monis, P. F. Dawkins, J. S. Scholes, G.G.D. Everingham, D. N . Uren,T. FitzPatrick, J. Wallis, L.G. Holding, A. C. West, S.J. Howe, B L. Willis, R. Jacobi, R. James, A. W. Tellers: Jones, Barry Johnson, Keith Jones, Charles Johnson, Les NA Manyr, J. R. Peacock, A. S. Whitlam, E. G. Humphreys, B. C. Jull. D.F. Stewan, F. E. Dean, A. G. Klugman, R. E. Yates, W. Young, M. J. Question so resolved in the affirmative. NA NA Bill returned from the Senate with amendments. Consideration of Senate's amendments. Clause 3. (e) by inserting after the definition secuon (I) the following definition: ' ""Region"" means so much of the Alligator Rivers Region, within the meaning of the definition of that Region in the Environment Protection (Alligator Rivers Region) Act 1978, as does not include(a) the area shown as the Arnhem Land Aboriginal Reserve on the map referred to in that definition; and (b) the areas (being map as Mount Bundey, Goodparla, Gimbat and Eva Valley;'; and Senate's amendment No. 1 After paragraph (e), insert the following new paragraph: '(ea) by inserting after the definition of ""Territory"" in sub-section (1) the following definition: ' ""Territory Commission"" means the Territory Parks and Wildlife Commission established by the Territory Parks and Wildlife Conservation Ordinance 1976 of the Northern Territory;'; and "". Clause 4. Section 6 of the Principal Act is amended by omitting subsection (2) and substituting the following sub-section: ' (2) Land in a State shall not, without the consent of the State, be acquired by the Commonwealth for the purposes of this Parliament if it is under a law of the State for purposes related to nature conservation or the protection of areas of historical, archaeological or geological importance or of areas having special significance in relation to Aboriginals.'. Senate's amendment No. 2After proposed sub-section 6 (2), add the following new sub-section: '(3) Land in the Northern Territoiy, other than land in the Uluru (Ayers Rock-M t Olga) National Park or in the Alligator Rivers Region as defined by the Environment Protection (Alligator Rivers Region) Act 1978, shall not, without the consent of the Territory, be acquired by the Commonwealth for the purposes of this Pan if it is land that is dedicated or reserved for purposes related to nature conservation or the protection of areas of historical, archaeological or geological importance or of areas having special significance in relation to Aboriginals.' Clause 9. Section 11 of the Principal Act is amended(a) by omitting paragraph (c) of sub-section (2) and substituting the following paragraph and words: '(c) specify an address to which such representations may be forwarded, and, in the case of a plan of management in respect of a park or reserve wholly or partly within a prescribed area, shall serve a copy of the notice on the relevant Chairman.'; 1978 (f) by omitting paragraph (d) of sub-section (10) and substituting the following paragraph and words: In Committee '(d) specify an address to which representations in connection with the plan may be forwarded, and, in the case of the plan of management in respect of a park or reserve wholly or partly within a prescribed area, shall, not later than the date of pubUcation of the notice in the Gazette, serve a copy of the plan and of the notice on the of 'ranger' in subrelevant Chairman.'; and '(14) Where, under sub-section (13), the Minister refers to the Director the plan of management in respect of a park or reserve wholly or partly within a prescribed area, he shall cause a copy of his suggestions referred to the Director with the plan to be served on the relevant Chairman, and the Chairman may, within the period of 14 days after receiving a copy of the suggestions, make representations to the Director in connection with the suggestions. pastoral leases) described on that '(21) When a plan of management is laid before both Houses of Parliament under section 12, the Minister shall cause the plan to be accompanied by(a) copies of any representations and comments, and of any report and recommendations, submitted to him under this section in connection with the plan, other than those that have been given effect to in the plan; and (b) in a case where he has made alterations to the plan under sub-section (19)- areportspecifying the alterations and setting out any views expressed by the Director, and, in the case of a plan of management in respect of a park or reserve wholly or partly within a prescribed area, by the relevant Chairman, in respect of matters to which the alterations relate. Senate's amendment No. 3After paragraph (a), insert the following new paragraph: land that is dedicated or reserved '(aa) inserting in sub-section (3) ""(including the Territory Commission and the Chairman of an Aboriginal Land Council established under the Aboriginal Land Rights (Northern Territory) Act 1976)""after""person"";'. Senate's amendment No. 4In paragraph (f), proposed paragraph 11 (10)(d), leave out 'and, in the case of the plan of management in respect of a park orreserve,wholly or pardy within a prescribed area, shall, not later than the date of publication of the notice in the Gazette, serve a copy of the plan and of the notice on the relevant Chairman', insert under a law of the Territory 'but, where the plan of management is in respect of a park or reserve wholly or partly within the Northern Territory, he shall, at least 14 days before the date of publication of the notice in the Gazette, serve a copy of the plan and of the notice on the Territoiy Commission and, if the park or reserve is also wholly or partly within a prescribed area, on the relevant Chairman'. Senate's amendment No. 5After paragraph (f), insert the following new paragraph: '(fa) by inserting in sub-section (11) '(including the Territory Commission and the Chairman of an Aboriginal Land Council established under the Aboriginal Land Rights (Northern Territoiy) Act 1976)' after 'person'; and'. Senate's amendment No. 6In paragraph (g), proposed sub-secuon 11(14), leave out 'a prescribed area, he shall cause a copy of his suggestions referred to the Director the relevant Chairman, and the Chairman may,', insert 'the Northern Territory, he shall cause a copy of his suggestions referred to the Director with the plan to be served on the Territory Commission serve is also wholly or partly the relevant Chairman, and the Commission and, as the case may be, the Chairman may,'. Senate's amendment No. 7In proposed paragraph l l (2 1 ) (b ) , leave out the proposed paragraph, insert the following paragraph: '(b) in a case where he under sub-section (19)- a report specifying the alterations and setting out any views in respect of matters to which the alterations relate expressed by the Director and, in the case of a plan of management in respect of a park or reserve wholly or partly within the Northern Territoiy, by the Territoiy Commission and, if the park or reserve is also wholly or partly within a Chairman.'. Clause 11. Section 16 of the Principal Act is amended by omitting paragraph (a) of sub-section (1) and substituting the following paragraph: '(a) to administer, manage and control parks, reserves and conservation zones;'. Senate's amendment No. 8Leave out the clause, insert the following clause: '(a) by omitting paragraph (a) of sub-section (1) and substituting the following paragraph: '(a) to administer, manage and control parks, reserves and conservation zones;'; and (b) by adding at the end thereof the following subsection: '(4) In relation to the performance of his functions and the exercise ofhis powers with respect to a park, reserve or conservation zone wholly or partly within the Northern Territory, the Director shall, from time to time, consult with, and Territory Commission and, if the park, reserve or conservation zone is also wholly or partly within an area for which an Aboriginal Land Council has been established under the Aboriginal Land Rights (Northern Territory) Act 1976, the Chairman of the Council."".'. Clause 13. After section 17 of the Principal Act the following sections are inserted: '17A.(1) '(3) It is a reasonable excuse for a person to fail to furnish information or a document that he is required to furnish under this section if the furnishing of the information, or the document, may tend to incriminate him. ' 17c. (1) Where a person who has been served with a notice under section 1 7A has refused or failed to comply, or to comply fully, with the notice, the Director may apply to the Supreme Court of the Northern Territory of Australia for an order under this section against that person. with the plan to be served on '(4) The Court shall not, under this section, require a person to furnish information or a document if the Court is satisfied that compliance with a requirement to furnish that information or document might tend to incriminate that person. and, if the park or rewithin a prescribed area, on ' 1 7E. (1) Sub-section (2) applies to every person who is or has been the Director or a member of the staff assisting the Director. '(5) Nothing in this section shall be taken to affect the operation section 9 of the Ombudsman Act 1976. has made alterations to the plan Senate's amendment No. 9In proposed sub-section 17E (5), line 25, at end of proposed sub-section, add 'or the operation of any similar provision in a law of the Northern Territory that confers functions on a person similar to functions conferred on the Ombudsman by that Act'. prescribed area, by the relevant Senate's amendment No. 10After clause 14, insert the following new clause: ' 1 4A. Section 19 of the Principal Act is amended(a) by omitting paragraph (b) of sub-section (1) and substituting the following paragraph: ""(b) co-operate with a State or the Northern Territory or with an authority of a State or of the Northern Territoiy in formulating and implementing,""; and (b) by adding at the end of sub-section (3) ""or of the Northern Territory''.'. Senate's amendment No. 11After clause 18, insert the following new clause: ' 1 8A. Section 36 of the Principal Act is amended by adding at the end thereof the following sub-sections: ""(3) The Government of the Commonwealth(a) shall, fromtimeto time, consult with, and have regard to the views of, the Administrator of the Northern Territory in relation to the performance of functions and the exercise of powers under this Act by officers of employees of the Territory or of an authority of the Territory; and have regard to the views of, the (b) may make arrangements with the Administrator for the performance of those functions and the exercise of those powers by such officers or employees. ""(4) The Director may make arrangements with the Head of a Department of the Public Service of the Northern Territory, or with an authority of the Territory, for the performance of functions and the exercise of powers under this Act by officers or employees of the Department or of the authority, as the case may be. ""(5) An arrangement under this section shall not be inconsistent with any law or with any agreement between the Commonwealth and an Aboriginal Land Council established by the Aboriginal Land Rights (Northern Territory) Act 1976 or between the Director and any such Land Council. ""(6) The references in paragraphs (3) (a) and (b) to the Administrator of the Northern Territory shall be read as references to the Administrator tory acting with the advice of the Executive Council of the Northern Territory.''.'. Clause 25. Section 71 of the Principal Act is amended(a) by omitting paragraph (d) of sub-section (2) and substituting the following paragraph: '(d) regulating or prohibiting the pollution of soil, air or water in a manner that is, people or wildlife in, or to the natural features of, parks and reserves; '(da) regulating or prohibiting tourism in parks and reserves;'; (b) by omitting paragraphs (m) and (o) of sub-section (2); and (c) by inserting after sub-section (3) the following subsection: '(3A) A law of a Territory does not have any force or effect to the extent to which it is inconsistent with a provision of the regulations having effect in that Territory, but such a law shall not be taken section to be inconsistent with such a provision to the extent that it is capable of operating concurrently with that provision.'. Senate's amendment No. 12In paragraph (c), proposed sub-section 71 (3A), Unes 33 and 34, leave out 'does not extent to which it is inconsistent', insert 'has effect to the extent to which it is not inconsistent'.",69
209,Mr GROOM,CONSERVATION AMENDMENT BILL,"Braddon-Minister for opment) Environment, Housing and Community Develmade opment) (10.29)- I move: That the amendments be agreed to. These amendments arise from the agreement reached in Darwin on 10 May, to which I reployees ferred when I introduced the amendments to the Environment Protection (Alligator Rivers gion) Bill. Following the discussions in Darwin, the Government is pleased to see that there is agreement on the way in which the Park should be managed, respecting the rights and responthe sibilities of both the Northern Territory Executory) tive and the Northern Land Council. The amendments represent the agreed proposals. The amendments provide that the Director National Parks and Wildlife shall consult with the Northern Territory Parks and Wildlife mission in respect of the preparation of the plans of management for parks and reserves declared under the Commonwealth Act in the Northern Territory. Provision is made for the Commona national park. wealth to consult with the Northern Territory and to make arrangements with the Territory in respect of the performance of functionsMr Armitage- Mr Chairman, I take a point order. It is now 10.30 p.m.",73
210,The CHAIRMAN,CONSERVATION AMENDMENT BILL,Order! The honourable member will resume his seat. of the Nonhern TerriMr Armitage-It is now 10.30 p.m.,73
211,The CHAIRMAN,CONSERVATION AMENDMENT BILL,"It was not 10.30 p.m. when the honourable member took his point of order. I caution him against such precipitate behaviour. It now being 10.30 p.m., I shall report progress. Progress reported. or is likely to be, harmful to NA",73
212,Mr DEPUTY SPEAKER,ADJOURNMENT,"I propose the question: That the House do now adjourn. Mr Groom- Mr Deputy Speaker, I require that the motion be put forthwith without debate. Question resolved in the negative.",73
213,Mr DEPUTY SPEAKER,ADJOURNMENT,The Committee will resume. for the purposes of this subNA NA 1978 In Committee Consideration resumed. have any force or effect to the,73
