speakerGroups,Speaker,Title,text,pageNumbers
118,Mr MCGAURAN,MEMBER FOR BARKER,"They hate success. Labor can never help itself. It always has to tear down the public's popular figures because it has no-one to compete. There is no doubt that the viciousness and the personal attacks are their stock-in-trade or routine, as the Minister for Finance (Mr Beazley) would have us believe. With the Minister for Finance, every dirty trick imaginable is routine. The breathtaking hypocrisy with which the government comes to this censure motion leaves even those of us who have witnessed a few stunned. The Minister for Finance and those before hirri tried to portray the use of a document' misdirected to the honourable member for Banks (Mr Melham) as part and parcel of the rough. and tumble of politics. What they forgot to remind the House is that the member for Banks boasted to the media that he misled a female staffer from the Liberal Party who came around to collect the document According to press reports, when . she came around to collect the document he said to her, 'It must be in the fax machine.' She went up to the fax machine and, of course, he had already collected it and had it on his desk. Where are the ethics there? He lied, and he lied for a political purpose.",59
119,Mr SPEAKER,MEMBER FOR BARKER,Order! I remind the member for Gippsland that he pulled up the minister' earlier about that.,59
120,Mr MCGAURAN,MEMBER FOR BARKER,"I will withdraw that, but the member for Banks, who boasted to the media about his deception, carried it beyond the ordinary political rough and tumble. Talking of stolen material, did it not make you weep tears of shame and suffer from embarrassment when they spoke about stolen material? After it had been stolen, it was hand delivered to the member for Barker's office with his name on the outside. You want to talk about stolen material? What about the burglary of the Roy Morgan organisation, which allowed you to canvass all over Australia? Why do you not send in the police there? Where are the copyright issues there? Where is the Solicitor-General now? It is always one rule for everybody else and another rule for the hard men and women of the Labor Party. But this time you have overplayed your hand, and you have revealed yourselves to be political opportunists who will seize on anything to distort the picture. The sloppiness and incompetence of the Minister for Aboriginal and Torres Strait Islander Affairs is laid bare for all in. this parliament to witl').ess. The minister cannot even get his story right. He stood before this parliament half an hour ago and claimed that the envelope in which the sensitive lettersthe attachment to the Fergie report-were contained were sealed, covered and could only be broken into as part of a larger box. It is quite the contrary. The statutory declaration by Mary Malaris, the administrative officer responsible for sending the box to Parliament House, states: I am not sure whether the envelope was sealed or not. In his contribution, the Minister for Finance continued the misrepresentations when he said that the envelope containing the sensitive and secret letters was marked in addition to being sealed. Ms Malaris went on to say: I am. not certain whether I marked the outside the envelope or not. . This document containing this very se.cretive and sensitive material was carelessly and negligently handled. The member for Barker received this material not of his bidding. did not deceive anybody like the member for Banks or the Labor Party apparatchiks did regard to the Morgan poIling material. It landed on his doorstep. There is no use in your trying to portray member for Barker as trafficking in sensitive documents. You need concern yourself only with the sensitive letters. He will deal with the other material in that box as he sees Do you stick the Solicitor-General onto every journalist who receives a leak from a governdebate ment department? No. The Federal Police? No. It is just when members of the opposition are involved that you send in either a law enforcement agency or the legal henchmen. The member never read the secret letters, and the remainder of the material should not, and we will not allow it to, be equated with the sensitive letters attached to the Fergie report; There is a clear differentiation between the two. You have totally failed to substantifor ate your case in regard to the sensitive letters. This is purely and simply an attempt to attack the member for Barker, to intimidate him and to bluff him into revealing documents for which he will decide their future destination. I presume that we are moving onto question time at the end of this censure motion. If not, this has to be seen simply as a political device to divert attention from the Prime Minister's little altar boy.",59
121,Mr BEAZLEY,MEMBER FOR BARKER,You shouldn't say that if we have question time.,60
122,Mr MCGAURAN,MEMBER FOR BARKER,"The Minister for Communications and the Arts (Mr Lee) has a lot of answering to do. So, Minister for Finance, we are moving onto question time, are we? .",60
123,Mr BEAZLEY,MEMBER FOR BARKER,Yes.,60
124,Mr MCGAURAN,MEMBER FOR BARKER,"There is no doubt about the government: it will do only what it thinks is in its own political interest. What hypocrisy by the government in trying to appeal to some higher notion of conduct in public life. Fancy of government members trying to lecture anybody, let alone the opposition, about the ethics of parliamentary behaviour. They have only the most base political motives. They will exploit every possible situation to their He own perceived political benefit. This government has no morals and no in standing in the community. There are a great many issues that we want to pursue, and you take up the time of the parliament with the patently trumped up charges that are only designed to attack the member for Barker in a very personal sense. You will always individually and personally attack members of the fit. Liberal and National parties. You know no other practice of politics. You will never issues and policies on their merits. You will always attack individuals. That is how you operate outside of the parliament, and that is quite obviously how you operate inside this parliament. This censure motion is a joke. You have not, apart from all of the generalisations and all of the contrived outrage, lan.ded a single punch on the member for Barker. You have not in any way established that the member Barker has committed any misdemeanour, let alone an indictable offence. Quite the opposite: the member for Barker is perfectly entitled to deal with those documents as he sees fit-apart from the sensitive letters. You will have to answer why those documents were not discoverable in the Federal Court. If Tickner, R. E. they are so privileged, why did you not claim that privilege in the Federal Court? The member for Barker enjoys the respect and support of the federal National and Liberal parties. Nothing you do in this parliament by way of trumped up charges will diminish his standing. Motion (by Mr Beazley) agreed to: That the question be now put. Original question put: That the motion (Mr Lavarch's) be agreed to. Fischer, T. A. The House divided. [4.57 p.m.] Hall, R. S. (Mr SPEAKER - Hon. Stephen Martin) Ayes Noes Majority NA Adams,D. Baldwin, P. J. Beazley, K. C. Beddall, D. P. Bevis, A. R. Bilney, G. N. Brereton, L. J. Brown, R. J. Chynoweth, R. L. Cleary, P. R. Cleeland, P. R. Crawford, M. C. Crean, S. F. Crosio, J. A. Cunningham, B. T. Deahm,M. J. Dodd, P. G. Duffy, M. 1. Duncan, P. Easson, M. Elliott, R. P. Evans, M. J. Fatin, W. F. Ferguson, L. D. T. Fitzgibbon, E. J. Free, R. V. Gear, G. Gibson, G. D. Gorman, R. N. J. Grace, E. L. * Griffin, A. P. Griffiths, A. G. Haviland, C. D. Henzell, M. M. Holding, A. C. Hollis, C. Home,R. H. * Howe, B. L. Humphreys, B. C. Jenkins, H. A. Johns, G. T. Jones, B. O. Kerr, D. J. C. Latham, M. W. Lavarch, M. H. Lawrence, C. M. Lee, M. J. Lindsay, E. J. Mack,E. C. MCHugh,1. MCLeay, L. B. Melham,D. Morris, A. A. Morris, P. F. Newell, N. J. O'Connor, G. M. O'Keefe, N. P. Price, L. R. S. Punch, G. F. Quick, H. V. Sciacca, C. A. Scott, L. J. NA Simmons, D. W. Smith, S. F. Smith, S. J. Snow, J. H. Snowdon, W. E. Staples, P. R. Swan, W. M. Tanner, L. J. Walker, F. J. Willis, R. Woods, H. F. NA Abbott, A. J. Aldred, K. J. Anderson, J. D. Andrew, J. N. Andrews, K. J. Atkinson, R. A. Beale, J. H. Bishop, B. K. Bradford, 1. W. Braithwaite, R. A. Cadman, A. G. Cameron, E. H. Charles, R. E. Cobb, M. R. Connolly, D. M. Costello, P. H. Dobie, J. D. M. Downer, A. J. G. Evans, R. D. C. Filing, P. A. Forrest, J. A. Gallus, C. A. Georgiou, P. Halverson, R. G. Hawker, D. P. M. * Hicks, N. J. * Howard, J. W. Jull, D. F. 74 Katter, R. C. Lieberman, L. S. 63 Lloyd, B. MCArthur, F. S. MCGauran, P. J. MCLachlan, I. M. 11 Miles, C. G. Moore, J. C. Moylan, J. E. Nehl, G. B. Neville, P. C. Nugent, P. E. Prosser, G. D. Pyne, C. M. Reid, N. B. Reith,P. K. Rocher, A. C. Ronaldson, M. J. C. Ruddock, P. M. Scott, B. C. Sharp, J. R. Sinclair, I. MCC. Slipper, P. N. Somlyay, A. M. Sullivan, K. J. Taylor, W. L. Truss, W. E. Tuckey, C. W. Vaile, M. A. J. Wakelin, B. H. Williams, D. R. Wooldridge, M. R. L. Worth, P. M. NA Langmore, J. V. Kemp, D. A. * denotes teller Question so resolved in the affirmative.",60
125,Mr BEAZLEY,PAIRS,I table several documents related to the debate that we just had. NA,61
126,Mr SPEAKER,QUESTIONS WITHOUT NOTICE,Has the Attorney-General finished his answer?,61
127,Mr LAVARCH,QUESTIONS WITHOUT NOTICE,"I think so, Mr Speaker. Packer, Mr K.",61
128,Mr HOWARD,QUESTIONS WITHOUT NOTICE,"My question is addressed to the Minister for Communications. I ask the Minister: given that Mr Kerry Packer has now stated that the Prime Minister's allegations of a secret deal with me regarding media policy are' categorically untrue' , is the minister now  truth?",61
129,Mr LEE,QUESTIONS WITHOUT NOTICE,I think we have every right to ask questions about this issue when the Leader of the Opposition has had so much trouble owning up to who he has met and what he has been talking about. This could be settled very simply. The Leader of the Opposition could tell us what he has said to Mr Packer and he could tell us what Senator Alston has been saying to PBL' s executives in his many conversations with PBL' s executives over the last few months. He could also  any reasonMr Tim Fischer-I rise to a point of order. The minister was asked by the Leader of the Opposition a very direct and clear cut question. He is not allowed to go on a major bushwalk. He ought to come back and give a direct answer in respect of the Leader of the Opposition's question.,62
130,Mr SPEAKER,QUESTIONS WITHOUT NOTICE,"Order! As far as the standing orders are concerned, the honourable the Leader of the National Party has raised a very valid point and I invite the minister to come to the substance of the question.",62
131,Mr LEE,QUESTIONS WITHOUT NOTICE,"We do not disclose our sources, but I tell you what, we can ask the Leader of the Opposition a question. We can ask wheth that a Howard government would relax or abolish or weaken the cross-media ownership rules.",62
132,Mr HOWARD,QUESTIONS WITHOUT NOTICE,You have not got the guts to put the allegations up. You are a faithful Little Sir Echo.,62
133,Mr SPEAKER,QUESTIONS WITHOUT NOTICE,Order! The Leader of the Opposition will restrain himself. Media Ownership,62
134,Mr GIBSON,QUESTIONS WITHOUT NOTICE,My question is directed to the Treasurer,62
135,Unknown,QUESTIONS WITHOUT NOTICE,Opposition members interjecting,62
136,Mr SPEAKER,QUESTIONS WITHOUT NOTICE,Order! The honourable member for Moreton has the call and I am trying to hear the question. Mr Howard interjecting,62
137,Mr SPEAKER,QUESTIONS WITHOUT NOTICE,The Leader of the Opposition!,62
138,Mr HOWARD,QUESTIONS WITHOUT NOTICE,Why should I?,62
139,Mr SPEAKER,QUESTIONS WITHOUT NOTICE,"Because the standing orders say so, that's why you should.",62
140,Mr GIBSON,QUESTIONS WITHOUT NOTICE,My question is directed to the Treasurer. Has the Treasurer seen reports that the Trade Practices Commission can ensure the diversity and plurality of media ownership? What is the government's response to these reports?,62
141,Mr WILLIS,QUESTIONS WITHOUT NOTICE,"In response to the honourable member for Moreton can I say that I have seen statements from members of the opposition indicating that they would seem to be relying on the Trade Practices Act to ensure that there was plurality and diversity in the media, to quote the expression used by the opposition communications spokesman, Senator Alston. In so doing, it is quite clear that the opposition has no regard for the cross-media rules. The disregard for them was shown",62
142,Mr SINCLAIR,QUESTIONS WITHOUT NOTICE,"Mr Speaker, I raise a point of order. I thought ministers were supposed to be asked questions dealing with areas of their responsibility. As far as I am aware, the Trade Practices Commission is within the ambit of the Attorney-General. I am just wondering in what way the Treasurer is getting into the ambit of the Minister for Communications or the Attorney-General?",62
143,Mr SPEAKER,QUESTIONS WITHOUT NOTICE,"I understand that the Trade Practices Commission comes under the Treasurer's responsibility and, to that extent, the Treasurer is in order.",62
144,Mr WILLIS,QUESTIONS WITHOUT NOTICE,"That is absolutely right, Mr Speaker; it has been for years. As I was saying, the disregard for the cross-media rules was shown in the comments of the shadow Treasurer as reported in the Herald Sun on 18 February when he said: The cross-media ownership rules are designed, I think, to make media owners cross, but having little other discernible effect. That demonstrates what the opposition thinks about the cross-media rules. Essentially, what we seem to be seeing from the opposition is that it would rely on the Trade Practices Act as being sufficient to ensure that we had plurality and diversity of media ownership--in particular to deal with the possibility of Mr Packer owning Fairfax as well as Channel 9. This morning on ABC radio the shadow Treasurer was interviewed and he was asked this direct question:  and Channel 9? He responded: Look, what we have always said is we want strong anti-monopolistic laws run by the Trade Practices Commission and we have always been opposed to market monopolisation-always, always. The journalist, Cathy Job, asked: Would that be a market monopolisation? Senator Alston said: Well, that is what you have the Trade Practices Commission there for. He went on with a bit of a diatribe against the Prime Minister. Then he came back and said: You give it to independent people and you let them make the decisions. That has always been our policy and it always will be.  own both Fairfax and Channel 9?', the shadow Treasurer is clearly saying, 'We would rely on the Trade Practices Act.' In that context, it is interesting to see what the chairman of the Trade Practices Commission, Professor Fels, has said about this issue. He has already said that the Trade Practices Act  controlling both Fairfax and Channel 9. The Australian of 18 February, in an article headed 'Control bid for newspapers ""too big a risk for democracy''', states: The chairman of the Trade Practices Commission, Professor Alan Fels, said there were no real  Fairfax. The Trade Practices Act was designed to limit concentration of ownership of any particular market, he said, but newspapers and television were  effectively be treated as a new player in the newspaper market. ""Generally speaking, the history ofTPC laws has been that television and newspapers have been regarded as being separate markets,"" Mr Fels said. ""Accordingly, there is a reasonable likelihood would be regarded as a new entrant to the newspaper market."" What is clearly being said there by the Chairman of the Trade Practices Commission is that TV and newspapers are separate markets. Tests of concentration of ownership under the Trade Practices Act would address these markets separately, so there is no real trade practices hurdle to Packer controlling Fairfax. When the shadow Treasurer is asked the  to own both Fairfax and ChanneI9?', he says, 'That's for the Trade Practices Commission to decide.' But what he is really saying is yes, because that is what the Trade Practices Commission chairman has already said would be likely to be the case. In other words, the opposition has a policy  9 and Fairfax, and that has been the hidden message so far. It has not been said explicitly but it comes through quite clearly when you look at what Professor Fels has said and when you take away the fig leaf of the Trade Practices Commission-which is what it is. It is being held there to say, 'Yes, we'd go through the proper process. We'd have the Trade Practices Commission. We wouldn't allow any sort of deal to be done. We'd go through an independent process.' But the chairman of that independent process has already said that that would most likely result in Packer being allowed to own Fairfax as well as Channel 9. Mr Speaker, we clearly have an opposition which has now made it quite clear to the Australian public that its policy is to allow Mr Packer to own Channel 9 and Fairfax. Of course, in so doing, it is absolutely playing in ",62
145,Mr TUCKEY,QUESTIONS WITHOUT NOTICE,"That is untrue, Ralph.",63
146,Mr SPEAKER,QUESTIONS WITHOUT NOTICE,Order! The member for O'Connor constantly runs a commentary when ministers are on their feet. Can I suggest very strongly that he not do so in the future.,63
147,Mr TUCKEY,QUESTIONS WITHOUT NOTICE,"Mr Speaker, I rise on a point of order. There is a responsibility of ministers he in this place to tell the truth. When ministers start rewriting our policy, that is Goebbels' principle and I believe I am entitled",63
148,Mr SPEAKER,QUESTIONS WITHOUT NOTICE,"OrderlResume your seat. That is not a point of order and I warn the member for O'Connor for taking such spurious points of order. Packer, Mr K.",64
149,Mr COSTELLO,QUESTIONS WITHOUT NOTICE,"Mr Speaker, my. question is directed to the Minister for Communications and the Arts. Minister, yesterday you said that the.· Prime Minister's claims that senior executives inside the Packer camp had informed him that the Leader of the Opposi change media ownership laws were 'dead right'. If these claims are dead right, as you claim, will you inform the House who these alleged senior executives are? Is it a fact that the senior executives you are referring to are, in fact, Graham Richardson and Peter Barron? If not, who are they?",64
150,Mr LEE,QUESTIONS WITHOUT NOTICE,"I refer you to my earlier answer, and I make the point that on five occasions this morning you were asked whether you  anyone else to own a television station and a newspaper in the same market, and on five occasions you walked away from it. That is the point. As the Treasurer pointed out, the Deputy Leader of the Opposition said that he thought that the Trade Practices Act should be relied upon, and that the opposition supported tighter trade practices laws to enforce these rules instead of the cross-media ownership rules. . Mr Costello- Mr Speaker, I rise on a point of order. Earlier, in relation to the last attempted evasion by the minister, you directed him-and he is getting his instructions from the Leader of the House now-to answer the question. The question is very simply this: is he referring to Peter Barron and Graham Richardson? If not, who?",64
151,Mr SPEAKER,QUESTIONS WITHOUT NOTICE,"Whilst the honourable deputy leader does draw my attention to what I said earlier, I also point out that ministers have on various occasionsMr Downer---':'""You are changing the ruling.",64
152,Mr SPEAKER,QUESTIONS WITHOUT NOTICE,"No, I am not changing anything. I. am saying that, if you read House of Representatives Practice, the chair has some limited discretion in what it can ask ministers to do, but I would ask the minister to be relevant to the question;",64
153,Mr LEE,QUESTIONS WITHOUT NOTICE,"The point I make, Mr SPEAKER Mr Costello-No, be relevant.",64
154,Mr SPEAKER,QUESTIONS WITHOUT NOTICE,"Order! The minister has the call. You will listen to the answer. . Mr LEE-The point I make is that the Leader of the Opposition, in his many comments on this issue, has said that his private and his public comments are the same. Therefore, Mr Howard has obviously told Mr Packer in his telephone conversations and Senator Alston has obviously told PBL and its executives the same things they are saying in public-that is, 'I will rely only on the Trade Practices Act.' That is what you said this morning on AM. This is what I find ironic: you were the shadow Attorney-General who opposed a tightening of the Trade Practices Act and the Leader of the Opposition was the person who watered down the Trade Practices Act. Mr Reith- Mr Speaker, I rise on a point of order. My point of order is on the question of relevance and I take a lead from what you have already said. The fact is· that this minister is blatantly flouting your direction and your request to him. Furthermore, Mr Speaker, as part of my submission to you, the fact is that you have wider discretion than you are prepared to exercise. You have the authority and the support of this parliament to require ministers to desist. If the government does not like it, then it can take the matter up with you at that point in time. As previous clerks have said publicly, you have a wider discretion than that which you have been prepared to exercise. You should exercise it. Mr SPEf\KER-What I am relying on is the section in House of Representatives Practice which quotes former speakers as having said just the opposite to what the honourable member for Flinders has put to me. Prescriptions",64
155,Mrs EASSON,QUESTIONS WITHOUT NOTICE,My question without notice is directed to the Minister for Human Services and Health. I ask the minister: what has been the impact of the introduction of the 20-day rule for the provision of prescriptions?,64
156,Dr LAWRENCE,QUESTIONS WITHOUT NOTICE,I am sure members would be aware that the pharmaceutical benefits safety net provides very significant financial protection to people who use medicines in quantity. Mr Bruce Scott interjecting,65
157,Mr SPEAKER,QUESTIONS WITHOUT NOTICE,I warn the honourable member for Maranoa.,65
158,Dr LAWRENCE,QUESTIONS WITHOUT NOTICE,"Butwe were very concerned before the end of last year that we had seen very considerable increases in what was clearly hoarding. People, when they approached the November-December period when the safety net issue was raised, were going in and getting repeat prescriptions more frequently than was necessary for their illnesses. They were hoarding those medicines because they wanted to save money and, as a result, had material in their cupboards that often would degrade and therefore would not be useful for the illness or disease that they had. It also posed a substantial risk to other members of families, particularly young members who might be able to get hold of such large quantities of medicines. I am sure members will be aware that we introduced a so-called 20-day rule as at 1 November last year, so that the resupply period for drugs relating to those long-term illnesses was some 20 days. They were designed to last the patient a month, so there was not really any significant problems for patients. In any case, the pharmacists could override the 20-day rule if they thought it was necessary in the interests of the patients. I am very pleased to inform members that we have already seen a very significant reduction in the cost of the PBS because of this rule and some other changes that we brought in last year. I hope all members will recognise that it has not been at the expense of patient care but rather it has reduced hoarding and the dangers associated with that. In fact, since November last year the number of prescriptions that have been dispensed is down 1.2 million prescriptions as at the same period last year. That has resulted in savings to Australian taxpayers of some $30 million just in that very short period. Not only that, it poses less of a risk. I would like to congratulate pharmacists on that achievement. They have worked very closely with government to ensure that significant saving and to reduce the danger to people hoarding medicines. I would like to say to the doctors in the community that we would like to cooperate with them, too. What we have seen, despite that very significant reduction in the number of prescriptions and in the cost to the PBS, is an increase in the cost of drugs that doctors are prescribing. Sadly, some of them are trying to pervert the process of generic substitution. So I urge them to take a leaf from the book of the pharmacists and to look after their patients and the Australian taxpayers at the same time. Packer, Mr K.",65
159,Mr TIM FISCHER,QUESTIONS WITHOUT NOTICE,"My question is directed to the Minister for Communications and the Arts. Last night on PM you stated that you were aware of information about an alleged secret deal between the Leader of the Opposition and Mr Kerry Packer in relation to the future of the cross-media rules that was given to the Prime Minister by someone in the Packer camp who is absolutely in a position to know. Given the utmost seriousness of that accusation, your accusation, I ask a direct question: what is the unspecified information that has been given to the Prime Minister?",65
160,Mr LEE,QUESTIONS WITHOUT NOTICE,The Leader of the National Party has misquoted me. I suggest the next time he asks a question like this he quote me accurately.,65
161,Unknown,QUESTIONS WITHOUT NOTICE,Opposition members interjecting,65
162,Mr SPEAKER,QUESTIONS WITHOUT NOTICE,Order! Those on my left. World War II: Campaign Awards,65
