speakerGroups,Speaker,Title,text,pageNumbers
0,NA,HOUSE OF REPRESENTATIVES,"NA FIRST SESSION OF THE THIRTY-SEVENTH PARLIAMENT The House of Representatives, on8 December Tuesday, 31 January 1995 at 12.30 p.m. Pursuant tives met on Tuesday, 31 January 1995 at 12.30 p.m. Tuesday, 31 January 1995",11
1,Mr SPEAKER,HOUSE OF REPRESENTATIVES,"Hon. Stephen Martin) took the chair at 12.30 p.m., and read prayers. SPEAKER AND CLERKS: DRESS",11
2,Mr SINCLAIR,HOUSE OF REPRESENTATIVES," Mr Speaker, on indulgence, as this is the first time we have had the opportunity to comment on a point of procedure, could I say that I note the changed attire of the clerks at the table. If the clerks are to adopt that format, would it not be appropriate for you, Mr Speaker, too to wear a gown? I suggest that if you did so it would add dignity and status to a position which we on this side of the House regard as of prime importance, and I commend to you the thought that if the clerks can change why can you not change.",11
3,Mr SPEAKER,HOUSE OF REPRESENTATIVES,"I thank the right honourable member for New England for bringing this matter to my attention, 'as he has done this place once before. The decision taken in relation to the clerks is one which with party leaders over, and I made an appropriate direction which I think is in keeping with taking this parliament into the next century. NA Hansard 1995 (SIXTH PERIOD) 1994, pursuant to resolution, adjourned to to that resolution the House of RepresentaWith respect to my own position, I think I have made it clear in the past that anyone who occupies the very important position of Speaker in this place should not necessarily rely on any outer garments to distinguish himself or herself from other members in this place. I would hope, therefore, that whoever occupies this position should earn-and I use CODE that term deliberately-the respect of members of this place.",11
4,Mr REITH,PARLIAMENTARY DEBATES,"On indulgence, I think it should be put on record that it is my understanding that there have been some consultations about this but that the decision you have taken, Mr Speaker, does not reflect the views of many people in this chamber who value the traditions of this place. Whilst we can debate the ins and outs of it, it should be said that there is a point of view for maintaining those conventions and the status quo. I am informed by my colleague the Leader of the National Party of Australia (Mr Tim Fischer) that he, amongst others, put the point of view that the traditions of the House ought to be preserved. This government is in very quick to dispose of the great traditions of this country, and some of us intend to I consulted stand for them in the future.",11
5,Mr SPEAKER,PARLIAMENTARY DEBATES,"I thank the honourable member for Flinders for his contribution, but again I say that if he could take the opportunity to look at some comments that have been made by members of another parliament as recently as today about that whole issue I think he might just find some interesting reading. NA",11
6,Mr SPEAKER,RESIGNATION OF MEMBER,I inform the House that on 30 January 1995 I received a letter from the Hon. Ros Kelly resigning her seat as the member for the electoral division of Canberra Consideration is being given to possible dates for the by-election and I am consulting with party leaders on this matter. I will inform the House in due course of the dates which I have fixed for the by-election. SPEAKER'S PANEL,12
7,Mr SPEAKER,RESIGNATION OF MEMBER,"I have received advice that following his appointment to the Opposition Executive the honourable member for Wide Bay (Mr Truss) is unable to continue as a member of the Speaker's panel. Pursuant to standing order 18, I now lay on the table my warrant revoking the nomination of the honourable member for Wide Bay and nominating the honourable member for Lyne (Mr Vaile) to be a member of the Speaker's panel to assist the chair when requested to do so by the Speaker or Deputy Speaker. NA Messages from the Governor General reported informing the House of assent to the following bills: Copyright (World Trade Organization Amendments) Bill 1994 Customs Legislation (W orld Trade Organization Amendments) Bill 1994 Customs Tariff (Anti-Dumping)(World Trade Organization Amendments) Bill 1994 Customs Tariff (World Trade Organization Amendments) Bill 1994 Dairy Produce (World Trade Organization Amendments) Bill 1994 Patents (World Trade Organization Amendments) Bill 1994 Sales Tax (World Trade Organization Amendments) Bill 1994 Trade Marks Bill 1994 Social Security (New Zealand Agreement) Amendment Bill 1994 Industrial Relations Legislation Amendment Bill (No.2) 1994 Departure Tax Collection Amendment Bill 1994 Infrastructure Certificate Cancellation Tax Bill 1994 Social Security (1994 Budget and White Paper) Amendment Bill 1994 Supported AccommodationAssistanceBiIl1994 Taxation Laws Amendment (Infrastructure Borrowings) Bill 1994 Veterans' Affairs (1994-95 Budget Measures) Legislation Amendment Bill (No.2) 1994 Australian Capital Territory Electoral Legislation Amendment Bill 1994 Complaints (Australian Federal Police) Amendment Bill 1994 Pipeline Legislation Amendment Bill 1994 Qantas Sale Amendment Bill 1994 Quarantine Amendment Bill 1994 Royal Commission into the New South Wales Police Service (Accessto Information) Bill 1994 Income Tax (F orrner Complying Superannuation Funds) Bill 1994 Income Tax (Former Non-resident Superannuation Funds) Bill 1994 Income Tax Rates Amendment Bill 1994 Social Security (Parenting Allowance and Other Measures) Legislation Amendment Bill 1994 Supported Accommodation Assistance Amendment Bill 1994 Crimes and Other Legislation Amendment Bill 1994 Employment Services Bill 1994 Employment Services (Consequential Amendments) Bill 1994 Higher Education Funding (Student Organisations) Amendment Bill 1994 Human Rights (Sexual Conduct) Bill 1994 Income Tax (Deficit Deferral) Bill 1994 Taxation Laws Amendment Bill (No.4) 1994 Student Assistance (Youth Training Allowance) Amendment Bill 1994 Student Assistance (Youth Training AllowanceTransitional Provisions and Consequential Amendments) Bill 1994 NA (ORIGIN LABELLING) BILL 1994 Second Reading Debate resumed from 19 October, on motion by Ms MCHugh: That the bill be now read a second time.",12
8,Mr SPEAKER,TRADE PRACTICES AMENDMENT,I call the member for Wide Bay. That is a rapid promotion.,13
9,Mr TRUSS,TRADE PRACTICES AMENDMENT,"Wide Bay) (12.35 p.m.)Thank you very much, Mr Speaker. It was a very quick change, wasn't it? I congratulate the member for Lyne (Mr Vaile) for taking a position as an Acting Deputy Speaker. I am sure he will fill that position admirably. Mr Speaker, I thank you for the courtesies which were extended to me during my term in that office. I think every member can learn a great deal by occupying that chair for a brief period. You certainly see things from a different perspective. I also welcome members home. I guess it is a surprise to many of us that we are welcomed back with the resurrection of the Trade Practices Amendment (Origin Labelling) Bil11994, and that this legislation has been given priority at the beginning of this year. There has been a widespread view in the community that the government has been unable to win much support for its legislation and that it has given up altogether on the whole idea of country of origin labelling. After being long promised, this legislation was introduced into the parliament on 23 March last year. In a welcome and historic precedent, it has been subjected to inquiry by committees from both the House of Representatives and the Senate. This is certainly legislation that Australia needs and wants but, in this form, it is rejected by almost all. the Minister for .Consumer Affairs (Ms MCHugh) spoke on this bill on 19 October, she foreshadowed a small number of government amendments. While these amendments are an improvement, there'is still widespread criticism about the content of the legislation. The government's bill has been opposed by the Australian Consumers Association, the National Council of Women, the Country Womens Association, the Australian Pensioners and Superannuants Federation, the Housewives Association, Women in Agriculture, the National Farmers Federation and almost every farm organisation in the country, the Pork Council of Australia, the National. Fishing Industry Council and the Wine grape Growers Council. If that is not enough, it is also opposed by the Australian Council of Trade Unions and a host of other unions, including the Automotive, Food, Metal and Engineering Union, the Public Sector Union, the National Union of Workers, trades and labour councils from several states and many other organisations. For different reasons, reservations about the legislation have also been expressed by the Advance Australia Foundation, the Australian Owned Companies Association, the Canned Food Information Service and the Grocery Manufacturers of Australia. Has the minister got any friends left at all? Indeed, the minister has been spending some time trying to persuade the legislation's detractors, but the critics certainly remain. She has attended some hostile meetings. She has been running away from trade union officials and everyone over recent times. MsMCHugh-1I have never left a hostile meeting on this--'-ever.",13
10,Mr TRUSS,TRADE PRACTICES AMENDMENT,"Yes, but you have faced some hostile meetings and you have failed to persuade anyone that you have got your legislation right. One can only ask why the government is pursuing this legislation which it knows is opposed by a broad cross-section of the community-including many of Labor's traditional friends-and which it knows the coalition must seek to amend. Obviously, the legislation has been dragged off a dusty shelf for crass political reasons. When The government is desperately trying to secure for itself a trigger for a double dissolution election later this year. It knows that it cannot get control of the Senate at a normal election. It is scared that its years of economic mismanagement and irresponsible spending are finally coming home to rest and' that an election will be unwinnable for it by the end of this term. All this legislation is going to do is put the government further in the mire. Its approach to this legislation demonstrates Labor's utter arrogance in government. Despite having almost a year to respond to public concerns about the content of the legislation, the minister refuses to make the necessary changes. She knows what is right; the people are all wrong. That is the reason why the people are welcoming this year as a new beginning for the coalition and the beginning of the end for the government. This legislation could have provided a wonderful new opportunity for a new beginning for Australian industry and an opportunity to promote genuine Australian products. With the decline in international trade barriers and the establishment of the World Trade Organisation, a much more liberal trading environment is establishing around the world. Australia has a strong vested interest in promoting freer trade. We have a relatively small domestic market and to develop worldclass industries we often need the economies of scale that can only be provided by selling our products to more populous countries. On the other hand, some other countries see Australia as a potential market for their goods. Some of those goods are the best in the world and will naturally be chosen by some Australian consumers but others are of doubtful quality and add little of value to our marketplace. In some industries market share has been lost to imports and this has caused considerable economic and social damage especially in regions which are dependent upon particular industries. Consequently, many buy Australian campaigns have been launched around the nation. The federal government itself has spent more than $15 million promoting the buy Australian campaign over recent years and these initiatives have been supported by many local campaigns. In my own home town of Kingaroy the local newspaper the South Burnett Times in association with the Queensland Grain Growers Association and other primary industry and community organisations have undertaken a major local 'buy Aussie' campaign. These campaigns have been very successful, and there is a strong desire among Australian consumers to buy Australian products. A recent survey by Coles revealed that 89 per cent of shoppers prefer to buy Australian, and that percentage has been increasing. Even more revealing was the fact that 60 per cent of shoppers were prepared to pay a 10 per cent premium to buy items made in this country and nearly 7- per cent said they would purchase Australian produce even if the quality of the imported goods was slightly better. They know they can contribute to our national economic security and progress by buying Australian. They know that shoppers who buy foreign made goods contribute just as surely to our country's national debt as do high-flying entrepreneurs or overspending governments. Coles, in a recent campaign, used the slogan, 'Buy Australian and buy your kids a job'. This slogan really puts another important element of the case for purchasing Australian goods clearly and succinctly. John Corboy of SPC said recently: People need to understand the issue is not just a short-term marketing issue but strikes at the very heart of maintaining jobs for our children in the future. It could also be said that buying Australian is the only guarantee of buying goods that meet Australia's quality standards. Nowhere is that more significant than in buying food. All Australian food producers are required to meet rigid health and quality standards. In a recent series of articles in the Courier Mail its rural editor, Gordon Collie, reported on information he had obtained under the Freedom of Information Act regarding imported food. He said that between 1 July 1993 and 17 March 1994 there were 142 instances recorded where imported foods did not comply with Australia's food safety or standard requirements-142 cases! The most common breaches were in peanuts and seafoods, but the list of violations covered more than 30 food categories from 28 countries. China was by far the worse offending country with 44 consignments failing to meet food standards, many being peanuts contaminated with cadmium. But AQIS, the Australian Quarantine and Inspection Service, only undertakes sporadic inspections of imports and, while certain high risk areas are targeted, who knows how many shipments have actually entered the country and been sold to Australian consumers that could not have met local standards. Even more alarming is that, of the 142 instances which AQIS detected, only 33 of the food consignments were actually destroyed; 32 were re-exported to another country, presumably where the standards were not so high. But in many instances the consignments had already been distributed. In the case of 20 failing shipments AQIS notified the relevant state health authorities but advised Mr Collie, 'AQIS is unaware of what action, if any, was taken.' So there are many good reasons why Australians should buy locally produced products. They cannot, however, be assured of buying Australian unless our nation has a fair and honest labelling system. Too often manufacturers intent on exploiting the Australian desire to buy locally produced products have attempted to give the impression of Australianness, even for products that are fully imported. A large flag, a kangaroo, or words like 'Designed in Australia' and even 'Made in Australia' are sometimes used on products with foreign ingredients. I have brought along today a classic example of that. This was brought to my attention in my own electorate. I have here an enlarged copy of a packet which on the front states 'Australian traditionto al honey-roasted peanuts'. To add to the image there appears a 1950s version farm truck with the words on the door 'Kingaroy peanut farm'. The label on the back of the packet reads 'Enjoy our combination of the world's finest peanuts'-a slogan Kingaroy uses to promote its peanuts-'enriched with a traditional Australian honey-roasted recipe'. It is only right down at the bottom of the packet that the words 'Product of USA' appear. This is the kind of dishonest advertising that I think everyone believes should be stamped out. Perhaps ironically, these goods were on sale in a supermarket in Kingaroy. The company really picked the wrong place to launch its product. In fairness, the company, when this labelling was brought to its attention, withdrew the product from the marketplace. But it is an example of the kind of thing that I am sure the minister wishes to stamp out and which the coalition also believes ought to be stamped out. Frankly, it is dishonest and it is probably a breach of existing trade practices legislation. This legislation certainly gives us the opportunity to get it right for the future. The coalition enthusiastically supports the concept of truthful country of origin labelling. It is disappointing, therefore, that the government has got it so wrong. There are a number of areas of concern, many of which were outlined by my colleague the honourable member for Ballarat (Mr Ronaldson) when he responded to this legislation on behalf of the coalition last October. Because the coalition believes in country of origin legislation, we will be proposing amendments to the legislation to make it more in keeping with the wishes of the Australian public and the majority of Australian industry in this matter. The bill proposes that the terms 'Produce of Australia' and 'Product of Australia' can be used on items where the place of origin of each major ingredient or component of the goods is Australia and where all operations involved in the manufacture or production of the goods is Australia. The legislation gives a lesser status to the term 'Made in Australia', which will be able be used on goods which acquired their essential character or qualities in Australia but could include imported ingredients. This flies in the face of public opinion and is against the will of consumer organisations, the trade union movement, the rural sector and much of industry. In a recent Quadrant survey, 74 per cent of consumers stated that products labelled 'Made in Australia' should not contain imported ingredients. In the CSIRO national nutrition survey of January 1994, 98 per cent agreed that food should not be labelled Australian unless it is both grown and processed entirely within Australia. Ninety-eight per cent is not a bad popularity rating. Even the Leader of the Opposition (Mr Howard) would be thankful for a popularity rating of 98 per cent. It seems that only the Minister for Consumer Affairs and perhaps one or two of her colleagues are left thinking that the words 'Made in Australia' should be allowed to be used on goods with foreign ingredients. The government itself has spent $15 million promoting the opposite view. This' legislation overturns all of that effort and destroys years of carefully nurtured campaigning. The Australian. government is now proposing to three-quarters of a million dollars OVer two yeats to persuade the public that everything they believed in the past and everything had been told by the government in the no longer applies. This is clearly a stupid for the government to be proceeding. It is no secret to the government that there are concerns about this particular matter. Many representations have been made to, it organisations around the country. In its and the like. magazine, the consumers' organisation has quite loudly condemned the government's downgrading of the term 'Made in Australia'. Yesterday, I received a letter from the Pork Council of Australia Ltd which states: We believe it is important to have 'Made Australia' mean precisely what consumers think means. In other words, we should not try to reinvent the English language or try to persuade people to believe something contrary to the will government's promotional efforts over the years. This concern is also expressed in letter from Mr Martin Ferguson, the President of the ACTU. He writes: The Bill's focus on representations about Australian origin carried on consumer goods supplied Australia fails to recognise the widely-held public ards. perception that goods marked 'Made in Australia' denotes that Australia was the place of origin of each major ingredient or component of the product on offer. This is not Martin Ferguson speaking alone, as the minister suggested in one of her media releases. Mr Ferguson emphasises: The ACTU Executive has unanimously endorsed this submission to change two sections of the Bill in order to address our concern. There is widespread concern about the government's action in seeking to downgrade the importance and meaning of the' term 'Made in Australia'. The coalition is proposing amendments which faithfully take up these concerns and elevate the term 'Made in Australia' to a similar status as that of 'Product of Australia'. In that way, Australians who buy a product that has the words 'Made in Australia' on it will be getting something that is genuinely Australian. People beJieve that it is genuinely This legislation should not interspend a mere fere with those views. Concerns have been raised in many other they areas, including the question of regional past labelling. These concerns have emanated way especially from Tasmania, but they have been raised in other states as well. This matter has been raised in some areas where the name of the town has been proudly promoted as part of the origin statement-'Made in Bendigo', by 'Product of Ballarat', 'Made in Wangaratta' This legislation, as it was originally drafted, would have resulted in mort,d damage to that terminology. It is true that the minister has acknowledged that failing and is now proposin ing some amendments which the coalition has it indicated a willingness to support. However, there will still be some problems for the users of many of these labels, and many Australian manufacturers of a wide range of products have to amend their labels as a result of this legislation-not all of them because they a have been dishonest in the past. Many manufacturers have been abiding by the law as it stands at the present time and have been faithfully recording the origin of their proin ducts in accordance with the existing standThis legislation will change the standards and will require those Tasmanians who want to record the Tasmanianness of their product to put extra words on their labels. Naturally, that is a matter of some concern. In the past, a lot of effort has been put into promoting labels and changes will now have to occur. This bill could have beeD-:-and should be-a major advance, and it, could have provided effective origin labelling in Australia. I am confident that the amendments proposed by the coalition-if the government has not yet woken up to the fact that they enjoy over:' whelming community support-will receive the endorsement of the Senate and the government will have to confront this issue again. I hope that wise counsel will prevail and that the minister will listen to the consumer organisations, the farmers, the manuf-cturers and the unions and acceptthe wisdom of the coalition amendments. Consumers want to buy Australian, and they have a right to know that the products that they buy are indeed Australian. Therefore, country of origin labelling legislation has its genesis in a worthwhile objective. Much of this legislation has a commendable approach but, regrettably, some changes need to be made. I am disappointed that, even after a year of attempts at persuasion, the minister has not accepted the wisdom of the proposed amendments. Busy shoppers do not have time to read page after page of labels; they want to know the information that is important to them, and that information needs to be supplied readily and simply. There is an opportunity in this legislation to give Australia the sort of labelthat view. ling laws that we need and want. I hope that the minister will see the wisdom of the coalition amendments and accept them before the passage of this legislation.",13
