speakerGroups,Speaker,Title,text,pageNumbers
40,Mr WILLIS,QUESTIONS WITHOUT NOTICE,"Nevertheless, despite the picture of the current account, we obviously we have an economy which, in many respects, is growing very strongly indeed--one could say too strongly-and that is a factor in the current account outcome. In those circumstances, the government considers that we need to further tighten policy, for cyclical reasons, to achieve balance between demand and output. We expect that the economy will slow in 1995-96 and that demand and output will come closer together. A further tightening of policy will make that a much more likely outcome. We need that tightening even more for structural reasons, to raise national savings and to reduce the excessive demand for the savings of foreigners to finance our investment, which drives our balance of payments current account deficit. It is clear that we need that structural change in savings. The government has taken steps in relation to the superannuationguaran- wrongtee charge to take a substantial step towards improving the savings performance of this country. But, clearly, we need to do more. The failure of the nation to save enough is clearly a major factor behind the current account deficit. It has been that way for a long time now-going back to the days of the Fraser government.",43
41,Mr SINCLAIR,QUESTIONS WITHOUT NOTICE,"Mr Speaker, I rise on a point of order. Further to the point raised by the Leader of the National Party, the Treasurer is now raising major new policy initiatives by this government. Under standing orders, you cannot ask a question which is designed to allow a minister to announce new policy. I suggest to you, Mr Speaker, that the whole of this response to the question order. It should be made by way of a ministerial statement; otherwise the whole custom and procedures of this place are just thrown awry.",44
42,Mr BEAZLEY,QUESTIONS WITHOUT NOTICE,Could I rise on a point of order? The Treasurer is referring to the superannuation guarantee levy which was legislated ages ago.,44
43,Mr SPEAKER,QUESTIONS WITHOUT NOTICE,"Order! With reference to both points of order, I think the more general point is one which goes to the options available to ministers in making statements on major issues, and it may well be that the House considers this to be such. The Treasurer, however, as I have said, is being relevant to the question that was asked. The Leader of the House has made a valid point in comment to the point of order being raised, but I would invite the Treasurer now to bring his answer to a close.",44
44,Mr WILLIS,QUESTIONS WITHOUT NOTICE,"I am concluding, Mr Speaker. As I was saying, we need to improve our savings performance. I said that we have taken steps to do that. We need to consider further steps. One such step which I am announcing now is a further tightening of fiscal policy. The details of that, of course, will be announced in the course of the budget. Economy",44
45,Mr COSTELLO,QUESTIONS WITHOUT NOTICE,"My question is directed to the failed Treasurer. If, as the Treasurer now concedes, his budget forecasts are Government members-Ha, hal Look behind you.",44
46,Mr SPEAKER,QUESTIONS WITHOUT NOTICE,Order! Those on my right.,44
47,Mr COSTELLO,QUESTIONS WITHOUT NOTICE,"If, as you now concede, your budget forecasts are wrong, your deficit reduction strategy is inadequate, your current account deficit is to deteriorate to banana republic proportions and you have already punished Australians with interest rate rises as a consequence of your failure, will you now come clean on your secret tax agenda? And why do you intend to extend the pain and damage of a failed budget for another four months until you announce what you intend is entirely out of to do in May?",44
48,Mr WILLIS,QUESTIONS WITHOUT NOTICE,"It is a strange depiction of a failure to have an economy which is growing as fast as that of any other country in the Western world with employment growing at 3% per cent, inflation at 2Yz per cent and underlying rates of 2V4. And you say that that is a failure? Mr Costello-Yes, a banana republic!",44
49,Mr WILLIS,QUESTIONS WITHOUT NOTICE,"This is economic failure? This is a totally new definition of economic failure, I must say. It is extraordinary stuff. I notice that the Leader of the Opposition wrote an article in the Sunday Telegraph talking about the economy in ruins. Is this a picture of an economy in ruins? Opposition members-Yes!",44
50,Mr WILLIS,QUESTIONS WITHOUT NOTICE,"An economy in ruins which has unemployment coming down, inflation low, high growth, and real wages increasing, real household disposable incomes increasing? This is an economy in ruins? What an absurdity! Mr Costello-A banana republic!",44
51,Mr WILLIS,QUESTIONS WITHOUT NOTICE,"The reason the shadow Treasurer thinks he can make such a statement is because of the current accountdeficit. There have been various times over the past decade and a half when we have come up to those sorts of levels. Obviously they uncomfortable levels that need to be addressed, and 1I have announced that we will address them. But 1 remind the House that 1980-81 the current account deficit, when now Leader of the Opposition was Treasurer, was 5Y2 percent of GDP. That is what it then. So let us not suggest that an outcome the dimensions that we are talking about now is something unique to this government: it has been a problem w-ich has been developing ov-r a long period of time, and it clearly developed at the time of the Fraser governHouse ment. A full statement about how we are dealing with that is something which takes a financial year? bit more time than an answer in question time. But 1 would say that the structural ment process that we have put in placewhich the Fraser government never touched, orderwhich the honourable member for Bennelong when Treasurer never did anything about-is certainly a large part of the answer. We are going through the transition phase on that, particularly on the tariff front, and that continue for some time yet. Whilst we go Opposition. through that transition phase we will become more and more import intensive and it will be, of course, more difficult to get the current account deficit down. But it is the right way to go, as both sides of the House acknowgenuinely ledge, in terms of structural adjustment of Australian economy so that we can have more diverse array of exports and so that we are not so close to the terms of trade for and mineral commodities, prices of which are beyond our control and in long-term decline compared with our imports. The structural adjustment program that we have put in place is the right one,and it is something which the previous Liberalgoverntion ment never had the guts to undertake .. We have undertaken that task. It is a herculean task to tum the Australian economic develop1 ment model around from what has developed over two centuries to something quite differments ent. We are achieving that, and we are achievbe ing that very substantially with a tremendous growth of manufactured exports, of services exports and a diversification of our exports which the Opposition when it was in governare ment could only have dreamed of. All that is part of the answer but it also requires action in relation to other aspects in such as savings. We have taken some steps in the that direction. As 1 announced, we need to take some more and one of those is the was measure of fiscal consolidation which we of embarked on a couple of years ago and which we will intensify in the forthcoming budget. Economy",44
52,Mr SWAN,QUESTIONS WITHOUT NOTICE,Can the Treasurer advise the what implications the revised economic forecasts have for the budget outcome this .,45
53,Mr WILLIS,QUESTIONS WITHOUT NOTICE,"-The effect of higher economic growth in 1994-95 than forecast in the adjustbudget is to improveMr Costello- Mr Speaker, on a point of",45
54,Mr WILLIS,QUESTIONS WITHOUT NOTICE,-Don't you want to hear the answer?,45
55,Mr SPEAKER,QUESTIONS WITHOUT NOTICE,"Order! The Treasurer will will resume his seat! The Deputy Leader of the Mr Costello-When the Treasurer is asked to outline his secret tax agenda he says, 'I need to make a statement about that matter.' So it seems that whenever a question is asked eliciting information from this side the of the House the answer is, 'I have to make a a statement.' When a dorothy dixer is put from the other side of the House he apparentrural ly finds it perfectly in order to make his statement. Again, Mr Speaker, as you previously ruled in relation to the last two points of order, this is a matter for his statement and he can put in his statement his secret tax agenda as well but he cannot ebb the informaout through dorothy dixers.",45
56,Mr SPEAKER,QUESTIONS WITHOUT NOTICE,"Order! As the Deputy Leader of th- Opposition rightly points out, have indicated twice this afternoon already that it is probably preferable for major stateto be made in this place whether they on economic policy or whatever. However, a specific question has been directed to the Treasurer. He has not begun his answer yet. I do not know what he is going to say. I call the Treasurer.",45
57,Mr WILLIS,QUESTIONS WITHOUT NOTICE,"-Thank you, Mr Speaker. I was saying that the effect of higher economic growth in 1994-95 than forecast in the budget is to improve the underlying budget outcome. We expect revenue this year to now be about $2.2 billion higher than was budgeted for. The effects on outlays are both ways with the net effect, including decisions since the budget to provide additional funds for such things as drought assistance and noise amelioration measures for Sydney airport, being some increase in outlays. Outlays are also likely to be affected by another development which the Minister for Finance is announcing today and that is the likelihood that receipts from the Qantas float will not now be received until early in 199596. This means that, together with the other factors I have mentioned, outlays will increase by more than revenue and that the budget outcome for this year will be about $12.3 billion compared with $11.7 billion forecast in the budget. But, clearly, this does not mean that the budget outlook is deteriorating. Far from it. Mr Costello-What does it mean? Opposition members-Ha, hal",46
58,Mr SPEAKER,QUESTIONS WITHOUT NOTICE,Order! The House will come to order! The Treasurer has the call.,46
59,Mr WILLIS,QUESTIONS WITHOUT NOTICE,"-We hear idiotic laughter from the people on the front bench over here. They seem to be unable to understand that if one has a postponement of the proceeds from an assets sale by a few months which takes one across from the end of the financial year into the next financial year then that hardly represents some fundamental deterioration in the budget outcome. As I indicated, we are getting much more revenue and thtYllnderlying picture for the deficit is one of improvedirected ment. The improvement in the underlying budget outcome in conjunction with a further tightening of our fiscal consolidation program, which I have announced already, means that we now expect to return to budget surplus not in 1998-99, as was previously the case, but by 1996-97. That is two years earlier than projected in this year's budget. I remind the House that, previously, we projected a budget deficit of $4.8 billion in 1996-97, or 0.9 per cent of GDP, and a deficit of $2.1 billion, or 0.4 per cent of GDP in 1997-98. We now expect to be in surplus in both those years. Logging and Woodchipping",46
60,Mr ANDERSON,QUESTIONS WITHOUT NOTICE,"My question is directed to the Minister for Resources. Did the govern...; ment decide to remove 50 Tasmanian coupes on Keating's original Friday list of 509 and simply add the 50 to those already listed in East Gippsland in Victoria, making a total of 124 coupes to be removed in that state? If so, does this not prove that this list has no defensible rational or scientific basis?",46
61,Mr BEDDALL,QUESTIONS WITHOUT NOTICE,Mr SPEAKER Mr Richard Evans-Forrest Gump!,46
62,Mr BEDDALL,QUESTIONS WITHOUT NOTICE,Let me again correct the misinformation put forward by the Deputy Leader of the National Party. He refers to the Prime Minister's list. Mr MCGauran-Are you on his list?,46
63,Mr BEDDALL,QUESTIONS WITHOUT NOTICE,There is no Prime Minister's list. The list of 509 coupes which I received yesterday was provided to meMr Anderson-Yesterday?,46
64,Mr BEDDALL,QUESTIONS WITHOUT NOTICE,"Yes, yesterday. Do you want to listen? The list of 509 coupes provided to me yesterday was a sift by the Department of the Environment, Sport and Territories of the original 1,300 coupes. As a result of receiving that list of 509 coupes yesterday, I have today written to the states asking for their comments on those coupes. I look forward to receiving that advice. Victorian Health System",46
65,Mr CHYNOWETH,QUESTIONS WITHOUT NOTICE,"My question is to the Minister for Human Services and Health. What are the implications for the health system of the 50-year health plan recently released by the Victorian governm,nt?",46
66,Dr LAWRENCE,QUESTIONS WITHOUT NOTICE,"I hope honourable members have been following the debate about the Victorian health system with some i, interest because, of course, all Australians have an interest in the behaviour of our state governments. I am pleased to be able to indicate that the Victorian government, after some intervention by its premier, has decided to put an additional $89 million into the system over two years. On the face of it, that seems to be an improvement on the current situation but, given that some $200 million was taken out of the system, the tricks with mirrors are a bit misleading. In fact, in 199495 some $48.9 million will go into salaries which have to be paid just to maintain the existing levels of service, which everyone regards as inadequate. As a result, there is a net improvement of $7 million on which the hospitals will find it very difficult to manage, given the substantial 14 per cent cut that they have seen. I have just listened to the old-or is it new-Leader of the Opposition crying tears about families. Mr Costello--You are a failed premier.",46
67,Mr SPEAKER,QUESTIONS WITHOUT NOTICE,Order! The Deputy Leader of the Opposition.,47
68,Dr LAWRENCE,QUESTIONS WITHOUT NOTICE,"Families are very much affected by cuts to hospital services. It is often the families who bear the brunt of these cuts. Yet, the opposition has been silent on this question for a very long time. At the same time as announcing this slight increase in funding, following upon a substantial reduction, the Victorian premier also announced a 50-year health plan. It is an extraordinary plan because, apart from anything else, it is significantly lacking in detail. Fifty years is a very long time to project forward. Anyone asked in 1945 to predict what the health system would look like today would have had a great deal of difficulty. It is a very generalised and nebulous 50-year health plan, but at least it is a plan. The Victorian coalition government has a plan. It is not a very good plan, but it is a plan. The current opposition does not have a plan; it has not had a health plan for a very long time. The last time this lot were in government they changed Medibank four times. Those opposite could not work out what their plan should be. During that time the current Leader of the Opposition was Treasurer and he presided over four changes to Medibank. He is also one of the failed shadow spokesmen.",47
69,Mr TUCKEY,QUESTIONS WITHOUT NOTICE,"I take a point of order. Mr Speaker, I refer you to standing order 145 on the matter of relevance and this minister's responsibility to deal with her portfolio. If she wishes to go outside her portfolio, I thought she might inform this parliament about the Penny Easton affair and what that means in regard to the lies we have seen in the paper recently.",47
70,Mr BEAZLEY,QUESTIONS WITHOUT NOTICE,"Mr Speaker, I rise on a point of order. Surely this is punishable disorderliness, a persistent feature of this chap who is now fighting for his front-bench position. When you come up to the table here you are under a serious obligation to raise a point of order and not make a political speech.",47
71,Mr SPEAKER,QUESTIONS WITHOUT NOTICE,"I had anticipated that, on the point of order, the honourable member for O'Connor was going to raise the question of relevance, perhaps linking it back to Commonwealth responsibilities",47
72,Mr TUCKEY,QUESTIONS WITHOUT NOTICE,Exactly.,47
73,Mr SPEAKER,QUESTIONS WITHOUT NOTICE,I assume that is what he was doing.,47
74,Mr TUCKEY,QUESTIONS WITHOUT NOTICE,Yes.,47
75,Mr SPEAKER,QUESTIONS WITHOUT NOTICE,"If you rise again in the future, will you limit your comments to pointing out the point of order. I think the minister might show where the specifics of the question are related to her responsibilities.",47
76,Dr LAWRENCE,QUESTIONS WITHOUT NOTICE,"Mr Speaker, very clearly, the funding of health services in Australia is critical to the well-being of those health services. We have had propositions from the opposition over the last few years that amount to chaos. Sometimes we have tax rebates proposed; sometimes we do not. Sometimes we have gap insurance; sometimes we do not. Sometimes we have a two-tiered system being proposed; sometimes we do not. Sometimes the shadow spokesperson for health is in the Senate; sometimes that person is here. So I am pointing out that Mr Hawker- Mr Speaker, I rise on a point of order. In response to the point of order on relevance raised by my colleague the member for O'Connor you asked the minister specifically to relate her answer. to areas for which she has responsibility. Anything that may have. been said by the opposition in the past is not her responsibility. I ask you to bring her back to the question.",47
77,Mr SPEAKER,QUESTIONS WITHOUT NOTICE,"-:I say to the honourable member for Wannon, who has raised a genuine point of order here, that I have indicated in the past that comparisons of attitude are appropriate. But, again, I ask the minister to come to the substance of the question.",48
78,Dr LAWRENCE,QUESTIONS WITHOUT NOTICE,"I think it is important to note at this point that in 1975 and again 1984 Labor governments introduced universal health insurance to provide fair and equitable access for all Australians. That is in sharp contrast with the chaos that I have just outlined-the lack of plan and the lack of universality proposed. . We all look with interest to finding out what the new generation health policy might be from the current opposition. I presume that the Leader of the Opposition will eventually appoint a shadow cabinet. I understand:Mr Andrews- Mr Speaker, I rise on a point of order understanding order 145. I take your point about being able to make a comparison but may I remind you that the original question was about the implications of a decision made for health funding in Victoria. The minister is now canvassing a whole range of other matters which is not relevant to the question she was asked in the first place.",48
79,Mr SPEAKER,QUESTIONS WITHOUT NOTICE,I have already ruled that the minister was asked about the health system and she is talking about the health system.,48
80,Dr LAWRENCE,QUESTIONS WITHOUT NOTICE,"Mr Speaker, one of the proposals that we have had in rece-t weeksthis is not ancient history.,-from the member for Mackellar, who for the moment, it would appear, is still the spokesperson on health, that we will get tax rebates worth $1.5 billion to $3 billion. I have outlined the problems in the Victorian health system, where a state government has wilfully removed funding and recently been forced to put some of it back. Obviously, $1.5 billion to $3 billion taken of the public health system would have a devastating impact. I think it is time, after eight shadow ministers--only two more than the number of opposition .leaders, mind you--: that we had a dec.ent plan from the opposition . for health policy in Australia. The time is long overdue. Logging and Woodchipping",48
81,Mr MCLACHLAN,QUESTIONS WITHOUT NOTICE,"Mr Speaker, my question is directed to the Minister for Resources. Minister, there is a great debacle taking place out there on the question of conservation and woodchips. My office has in rung or visited your office six times since 6 o'clock last night, looking for the official list of areas to be assessed for high conservation value. Each time, and again as late as 2.50 this afternoon, we have been told that the official list is in the process of being finalised. To get this list business right: is it the list that the Prime Minister identified on Friday last of 509 coupes, as he called them; is it the list of coupes and compartments that was sent to the states yesterday morning; is it the list you sent to the states this morning, and which you just told us about; or is it the list issued by your office to industry last night of 511 coupes and compartments? Which is the list? Could. you let us have the official list . because it is in the interests of .everybody. This is a complete shambles. When are you going to fix it up? An incident having occurred路 in the galle1Jl- . .",48
82,Mr SPEAKER,QUESTIONS WITHOUT NOTICE,"I know people in the gallery have an abiding interest in this matter, but there are certain procedures that are to be followed.",48
83,Mr BEDDALL,QUESTIONS WITHOUT NOTICE,"I am surprised a bit about some of the contents ofOpposition rnernbers-Ha, hal",48
84,Mr BEDDALL,QUESTIONS WITHOUT NOTICE,"You may not think this is is a serious matter, but I do. I have made the list available. WhenIleftmy officeto come here copies of the list were available from the front desk. I saw them placed there. Maybe there were not any left, because everybody in the world wants to get them. But let me make out it very plain that the list that was compiled",48
85,Unknown,QUESTIONS WITHOUT NOTICE,Opposition members interjecting,48
86,Mr SPEAKER,QUESTIONS WITHOUT NOTICE,Those on my left! The minister has been asked the question.,49
87,Mr BEDDALL,QUESTIONS WITHOUT NOTICE,"This is the question those opposite want answered. The Prime Minister announced that 509 coupes would be subject to a rescheduling study to take into account the high conservation values determined by the Department of the Environment, Sport and Territories. Let me say again, and make it as clear as I possibly can, that the list was provided to me by the department. That list has been sentMr MCGauran-From the Prime Minister?",49
88,Mr BEDDALL,QUESTIONS WITHOUT NOTICE,"No, not the Prime Minister. Mr MCGauran-Where did he get his list from?",49
89,Mr SPEAKER,QUESTIONS WITHOUT NOTICE,The member for Gippsland! Mr MCLachlan-Which is the official list?,49
90,Mr SPEAKER,QUESTIONS WITHOUT NOTICE,The member for Barker!,49
91,Mr BEDDALL,QUESTIONS WITHOUT NOTICE,"The Prime Minister announced that the Department of the Environment, Sport and Territories had a list of 509 coupes that were of high conservation value after the department had sifted the 1,300-odd coupes that were alluded to last year. The list I have sent out todayMr MCLachlan-Did you count them?",49
92,Mr BEDDALL,QUESTIONS WITHOUT NOTICE,"I have not sat down and physically counted whether there are 509. The list was supplied to me by the Department of the Environment, Sport and Territories. That list has been sent to the states today. I it appropriate that that be done. I am sure you do. I understand that there had been discussions with the states right through the weekend, not just on Friday and Saturday. Mr MCGauran-That is not what they say. You changed them.",49
93,Mr BEDDALL,QUESTIONS WITHOUT NOTICE,"Talk to their forestry commissions. I am advised by my department that discussions had taken place so that the states would be in a position to respond to that list as quickly as possible so that we could get on with the rescheduling study. What is important here, and what people have to understand about this debate, is that the Commonwealth has one power, under the Export Control Act, over the export of woodchips. It has no control over roads, logging or any of the activities that are the responsibility of the state governments. Mr MCGauran-Why haven't you told them this before?",49
94,Mr BEDDALL,QUESTIONS WITHOUT NOTICE,"I have been trying to tell them all through the last six weeks, but unfortunately up here they do not want to put that side of the story. Let me say again, to clarify this as much as I possibly can, that the list of coupes that has now gone out was supplied to me yesterday by the Department of the Environment, Sport and Territories. It has gone to the states and to the companies for their advice so we can assess it in terms of a rescheduling study. If coupes do not stand up to scrutiny, as I said in the press release I issued on Friday, those coupes will be available for logging. I make that very plain and very clear. If those coupes do not stand up, they will be made available for logging. I have to receive the information from the states and the companies before I can make an assessment of that. Budget: Suggested Spending Cuts",49
95,Mrs EASSON,QUESTIONS WITHOUT NOTICE,My question is directed to the Minister for Finance. Has the minister's attention been drawn to a list of government spending cuts proposed by the Business Council of Australia and published in the Australian Financial Review on 16 January? Has the minister received any advice from the Department of Finance as to whether savings thought to the budget of $5.1 billion would be achieved from that list? Does the BCA list illustrate the sorts of savings that are available without any slash and burn?,49
