speakerGroups,Speaker,Title,text,pageNumbers
86,Mr HOWARD,QUESTIONS WITHOUT NOTICE,"I think there is a very direct link between foreign debt and national debt and there is a very direct role that the Commonwealth can play in influencing the levels. The point I am quietly making to the Deputy Leader of the Opposition is that since we have been in government we have been making a massive contribution to improving the situation. We have cut the deficit you left us. We are reducing our public debt charges by a very imaginative program of privatisation-which you tried to stop, although you know quite well that if you had won the election you would not have done a third of Telstra; you would have done the whole lot, just as your colleague Bob Carr in New South Wales is demonstrating. A debt to GOP ratio of almost 20 per cent in 1995 by the tum of the century will have been cut to 10 per cent. That is a monumental achievement. It is a great gift to future generations of Australians. When you remember that we have accomplished that in the face of the terrible legacy of debt you left us, it is a quite remarkable achievement.",66
87,Mr SLIPPER,QUESTIONS WITHOUT NOTICE,Mr SPEAKER ,66
88,Mr SPEAKER,QUESTIONS WITHOUT NOTICE,The honourable member for Fisher. Mr Gareth Evans- Mr SPEAKER ,66
89,Mr SPEAKER,QUESTIONS WITHOUT NOTICE,"No, I have called the honourable member for Fisher. Mr Gareth Evans-I know that, but I have a supplementary question.",66
90,Mr SLIPPER,QUESTIONS WITHOUT NOTICE,"Sit him down, Mr Speaker.",66
91,Mr SPEAKER,QUESTIONS WITHOUT NOTICE,"No, I have called the honourable member for Fisher.",67
92,Mr SLIPPER,QUESTIONS WITHOUT NOTICE,"My question is addressed to the Minister for Primary Industries and Energy. Minister, have you seen reports in today's newspapers that the Bureau of Meteorology has predicted that the dry El Nino weather pattern will strengthen? What action is the government taking to meet the ongoing welfare needs of farm families in drought affected areas of Australia, including those in south east Queensland?",67
93,Mr ANDERSON,QUESTIONS WITHOUT NOTICE,"I thank the honourable member for his question. I begin by saying that the government-and I am sure those opposite would share this opinion-is very deeply concerned by the Bureau of Meteorology's confirmation yesterday that large areas of Australia appeared to be heading, again, into drought. The re-emergence of the EI Nino pattern and the continuing negative trend in the southern oscillation index suggest, unfortunately, that the prospect of good rains over winter and spring is increasingly remote. I have to say that the possibility of many farmers not seeing useful rainfall until next autumn is a terrible blow, particularly for those farmers in eastern Australia who are still struggling to recover from what they have been through in recent years-the worse drought on record. I know all of us sincerely hope that it unfolds differently. Nonetheless, of course the government has to be prepared. I point to the fact that, since we came to office last year we have provided some $170 million in additional funding for drought relief. Very importantly, in October last year we extended that drought recovery period from six months to 12 months, in recognition of the ongoing hardship being experienced by farm families. A six-month recovery period was simply insufficient. As a result of that, all eligible farmers in areas where Drought Exceptional Circumstances declarations have been revoked can receive a drought relief payment, which is an income support payment for 12 months. But tragically, even under these circumstances, there are farm families experiencing continuing hardship because of the unbelievable toll taken by drought and the impact of extremely low commodity prices, particularly in the Drought livestock sector. Many families in areas where the 12-month recovery period was due to end next week faced an impossibly bleak immediate future. This included large parts of northern and south-eastern Queensland from where the member comes, north-eastern New South Wales, New England, parts of Tasmania, Victoria and the Eyre Peninsula of South Australia. The government therefore announced earlier today that the drought relief payment would be extended for a further three months in these areas. This will ensure that these hardpressed families continue to be able to put food on the table. The government has granted this extension because it has not yet finalised detailed consultation with stakeholders, including the states and farm leaders, over the integrated rural policy package which is shortly to be announced. It has to be said that this approach can be contrasted very favourably indeed with what farmers saw under the previous administration. The reality is that there is a real contrastMr O'Keefe-On a point of order, Mr Speaker: the minister has had absolute cooperation on this issue because we treated it seriously, as he does.",67
94,Mr SPEAKER,QUESTIONS WITHOUT NOTICE,What is your point of order? We are not going to debate the issue. Mr O'Keefe-The point of order is that you laid down the guidelines. There was a specific question from the member.,67
95,Mr SPEAKER,QUESTIONS WITHOUT NOTICE,There is no point of order. Resume your seat. Mr O'Keefe-You have had cooperation. It is not about bagging us,67
96,Mr SPEAKER,QUESTIONS WITHOUT NOTICE,Resume your seat! I invoke standing order 304A in respect of the member for Burke. The honourable member for Burke thereupon withdrew from the chamber.,67
97,Mr ANDERSON,QUESTIONS WITHOUT NOTICE,"There is a very important point to be established here. A lot of the damage that was done, a lot of the terrible circumstances that these peoplp. are experiencing, are because of the sorts of parameters that they ran when they were in government and their refusal to put anything in place until it was so deep into the drought, until Queensland in particular was in",67
98,Mr BEAZLEY,QUESTIONS WITHOUT NOTICE,"On a point of order, Mr Speaker: not only is this deceitful but also it is out of order. In the order of relevance, this has absolutely nothing to do with the question he was asked.",68
99,Mr SPEAKER,QUESTIONS WITHOUT NOTICE,I thank the Leader of the Opposition. I ask the minister to stop digressing and return to the question.,68
100,Mr ANDERSON,QUESTIONS WITHOUT NOTICE,"I simply make the point that a lot of that hardship came about because we had farm costs through the roof, we had interest rates over 20 per cent for an indefinite period of time and then we had a Prime Minister who said that drought is a normal part of management responsibility for farmers. They left the place in such a mess that people are still now trying to recover. Mr O'Connor-On a point of order, Mr Speaker: on relevance: I think it is about time you rule that the minister is out of order.",68
101,Mr SPEAKER,QUESTIONS WITHOUT NOTICE,The minister has concluded his answer. Mr O'Connor-He is not addressing his answer specifically to the question.,68
102,Mr SPEAKER,QUESTIONS WITHOUT NOTICE,"I said, 'The minister has concluded his answer.' Any further intervention on your part will be treated most severely. You defy the chair; you suffer the consequences, believe me. Tariffs: Motor Vehicle Industry",68
103,Mr CREAN,QUESTIONS WITHOUT NOTICE,"My question is directed to the Minister for Industry, Science and Tourism. I refer to the fact that the manufacturing sector is now in recession following two successive quarters of negative growth-all your own work, minister. Why won't you start to repair the damage caused by your lack of an industry policy by embracing Labor's car plan, a plan which will create 10,000 new jobs in manufacturing and treble automotive exports?",68
104,Mr MOORE,QUESTIONS WITHOUT NOTICE,"-I am surprised that the member for Hotham should believe what he reads in newspapers because, if he did, he would find in that wonderful Glenn Milne article that he is one of the two, with the Deputy Leader of the OppositionMr Crean-On a point of order, Mr Speaker, as to relevance: I asked a specific question about the recession that his policies have caused for manufacturing industry and why he will not do something to increase jobs in manufacturing, like embrace our car plan, where the car industry has committed to 10,000 new jobs.",68
105,Mr SPEAKER,QUESTIONS WITHOUT NOTICE,"Order! The member will resume his seat. Your point is well taken. Unfortunately, you have not afforded the minister adequate time to even get the first sentence or two away. I am sure the minister will address the question.",68
106,Mr HOWARD,QUESTIONS WITHOUT NOTICE,Give the Minister a go!,68
107,Mr MOORE,QUESTIONS WITHOUT NOTICE,"-As I was saying, CJ should not jump in quite so quickly. It shows his sensitivity. Mr Crean-Thank you, Black Jack!",68
108,Mr SPEAKER,QUESTIONS WITHOUT NOTICE,Order! The member for Hotham has asked his question. An answer is on its way.,68
109,Mr MOORE,QUESTIONS WITHOUT NOTICE,"-If CJ keeps this up, he will find that all the young egos will be after all the old egos. As a consequence of that, Simon-CJ-you should not really think too much about aspiring to leadership. Mr Crean-On another point of order, Mr Speaker: I thought you had clearly required ministers to address their comments through the chair",68
110,Mr SPEAKER,QUESTIONS WITHOUT NOTICE,I did ask the ministerMr Crean-And not make comments across the table.,68
111,Mr SPEAKER,QUESTIONS WITHOUT NOTICE,"Order! I did ask the minister to address the question. I can understand his enthusiasm to join the battle, but I do invite him to resume his comments and address the thrust of the question.",68
112,Mr MOORE,QUESTIONS WITHOUT NOTICE,"CJ should not be too worried about all these points he is obviously worried about. Upsetting himself like this does not give him the right profile to take on the leadership. Mr O'Connor-On a point of order, Mr Speaker: earlier you reminded me about my responsibilities to you and the Speaker's chair.",68
113,Mr SPEAKER,QUESTIONS WITHOUT NOTICE,"What is your point of order? Mr O'Connor-I am wondering whether you could remind the minister of his responsibilities not to contravene standing order 80, which requires that he address members by their correct title.",69
114,Mr SPEAKER,QUESTIONS WITHOUT NOTICE,I thank the honourable member for Corio. The minister is aware of the conventions of the House. I ask him to return to the question.,69
115,Mr MOORE,QUESTIONS WITHOUT NOTICE,"In view of the seriousness of the question he asked-despite the colour and the movement he interjected into it all; I mean, that is part of the profile-I just want ask him to draw himself to some of the facts. Areas of manufacturing are growing quite strongly-in equipment, manufacturing machinery and other areas-with 5.7 per cent growth in a quarter and 4.3 per cent growth in a quarter. Employment (do you remember employment? You are the $2 billion man; you spent that on unemployment) in the manufacturing sector in the year to February grew by just short of 22,000 positions.",69
116,Mr HOWARD,QUESTIONS WITHOUT NOTICE,Really?,69
117,Mr MOORE,QUESTIONS WITHOUT NOTICE,"Yes, 22,000 posItIons. Profitability in the six months to March 1997 grew by 19 per cent in the manufacturing sector. As I said, CJ really ought not read too much into the newspapers, because when he does he gets the wrong line altogether. Legal Aid",69
118,Mr ANDREWS,QUESTIONS WITHOUT NOTICE,"My question is addressed to the Acting Attorney-General. Is the Acting Attorney-General aware of media reports today regarding the current status of legal aid negotiations with the states and territories, can he advise the House of the current situation?",69
119,Mr RUDDOCK,QUESTIONS WITHOUT NOTICE,"I thank the honourable member for Menzies for his question. I can tell him in relation to the issue that he raised concerning the negotiations with the states that New South Wales yesterday informed us that it would be establishing a new Legal Aid Commission to undertake legal aid for New South Wales and that the Commonwealth will be able to contract with the commission to provide Commonwealth services. This does mark the latest stage in the Commonwealth's move to new legal aid arrangements from 1 July, and we are pleased that legal aid will continue in New South Wales through a single shopfront. We are heartened that the New South Wales government, in view of the difficulty in getting the states to fully commit to their areas of responsibility, has provided an additional $4 million to the commission for matters arising under state law. The Commonwealth will continue to provide funding for matters of priority under Commonwealth laws. Negotiations with all states and territories towards new arrangements are progressing very well, which I am sure honourable members will be pleased to hear. In principle, we have agreement with South Australia, Queensland, the Northern Territory and the Australian Capital Territory, and New South Wales can obviously be added to that list. Negotiations are continuing constructively with the two remaining states, and I believe there will be a smooth transmission to the new arrangements from 1 July. Unemployment",69
120,Mr MARTIN FERGUSON,QUESTIONS WITHOUT NOTICE,"My question is to the Prime Minister. Isn't it the case that today's economic data, showing growth running at a pathetic 2.4 per cent, is little more than half the level needed to even begin making inroads into unemployment? Doesn't it mean the unemployment outlook is bleak under your government? When will you start to show leadership by creating jobs and getting the unemployment rate down, includand ing the youth unemployment rate that has grown by two per cent in your first 12 months of government?",69
121,Mr HOWARD,QUESTIONS WITHOUT NOTICE,"Both the Treasurer and I have had something to say objectively and, I think, very accurately about the message that comes out of the national accounts. It is clear, if you analyse the national accounts and you make allowances-as the Treasurer quite rightly did in his answer-for the impact of the change in the area of stocks and put that to one side, you can see some very, very positive signs. You can see that net exports made a very - trong contribution. The figures do confirm that consumer demand is picking up, and there is plenty of evidence around-including the most recent approvals figures-showing that the housing sector is beginning to experience quite a firm recovery. There is certainly some very bright news so far as the resource sector is concerned. It is true, as the honourable gentleman knows, that unemployment in this country remains too high. It is also true that high unemployment did not arrive on 2 March 1996. It is true, as the honourable gentleman knows, that high unemployment has been a feature of the Australian economic and political landscape for some time. In fact it reached more than 11 per cent when the honourable gentleman ran the ACTU and Kim Beazley was the employment minister. I do not think anybody who thinks about the unemployment problem should gainsay those undeniable facts. You need higher levels of economic growth in this country-nobody denies that-over a sustained period of time. You also need structural changes to the labour market, which have been begun by this government, the quality and breadth of which are now starting to filter through the business community. Some of the early critics of the Workplace Relations Act, some of those people who said that it did not go far enough, are now beginning to acknowledge the contribution that it will make to freeing the Australian labour market. Only on Monday I had a lengthy meeting with a very representative group of Australian businessmen and women, and the point was made at that gathering that many of the benefits of that act, after a period of five or six months of operation, are now becoming apparent. I might remind the House, remind the Australian people, remind the workers of Australia and remind the employers of Australia that the Australian Labor Party did everything it could to stop that act coming into force. The Australian Labor Party did everything it could to frustrate the coming into force of that legislation-as the Labor Party has done everything it can to frustrate the modifications that have already been made to the unfair dismissal laws and the further modifications that will be made in accordance with the announcement that I made at the time of the small business statement. Unemployment remains a significant economic and political challenge. In the 14 months that I have been Prime Minister, I have never gainsaid that fact. Until the goal that all of us have of a significant reduction in unemployment is reached, it will continue to have that high priority and major preoccupation with my government. In order to reduce unemployment in a sustained way over a long period of time you need higher growth, you need an infinitely more flexibility labour market and you also need taxation reform. One of the things that will help reduce unemployment in this country is the bringing about of taxation reform. That, of course, almost ineluctably brings me again to the Deputy Leader of the Opposition. The Deputy Leader of the Opposition was asked a question when he arrived this morning. Mr MCMullan- Mr Speaker, I raise a point of order.",69
122,Mr HOWARD,QUESTIONS WITHOUT NOTICE,"I would be taking a point of order if I were you too. Mr MCMullan-Yes, you would because you would wish to point out, as I wish to, that this section of the answer is clearly not relevant. Raising taxes as a reform question on the matter of jobs fails to take into account the fact that countries without a GST, like the United States, have half the rate of unemployment of countries with one.",70
123,Mr SPEAKER,QUESTIONS WITHOUT NOTICE,We are not going to debate the issue. I thank you for your point of order. The question centres on jobs creation and the prevailing economic environment with a particular emphasis on youth employment. The Prime Minister's answer is in order.,70
124,Mr HOWARD,QUESTIONS WITHOUT NOTICE,"I have said repeatedly that one of the criteria against which sensible tax reform in Australia has to be judged is whether it creates jobs. If we are interested in the long term and serious about creating jobs in this country we ought to ask ourselves whether or not the present taxation system promotes the creation of jobs. I think it is perfectly relevant to a question about jobs. Of course, I am therefore brought, ineluctably, to the Deputy Leader of the Opposition, who had this to say this morning: How many hookers or drug peddlers are going to sit around filling out their 15 per cent VAT How many blokes with the lawn-mower in the back of the ute are going to be accommodating the tax system? That is a fascinating answer because not only has he used some rather crass examples but he completely demonstrates his utter ignorance of how the tax system works. Of course people who are into tax evasion do not sit around filling out their tax forms, whether they are VAT forms, GST forms, income tax forms or sales tax forms. The point I would simply make is that all of the people engaged in the three professional categories to which you referred in your answer, Deputy Leader of the Opposition, do not sit around filling out forms. I will tell you what they do do: they do go and buy restaurant meals, and they do go and purchase all sorts of other goods and services. In the process of doing so, they will incur a taxation liability. All I can say to the member for Werriwa is that, if you are trying to get an intelligent debate going on taxation reform in your party, give the Deputy Leader of the Opposition a very wide berth indeed. Living Wage Case Decision",71
125,Ms JEANES,QUESTIONS WITHOUT NOTICE,My question is addressed to the Minister for Industrial Relations. The recent decision of the Australian Industrial Relations Commission in the living wage case ensured real wage increases for low-income earners. What is the government's position on the maintenance of the award system as a safety net for low-income earners in my electorate of Kingston? How does it contrast with other points of view?,71
126,Mr REITH,QUESTIONS WITHOUT NOTICE,"I thank the member for Kingston for her question. It is very important to look at the way in which we are going to use our industrial relations system to improve the living standards of people in her electorate of Kingston and generally throughout the country. One of the good things about the recent living wage case decision of the Industrial Relations Commission was that it was a fair deal for low-income people. Because it was economically responsible it also paved the way for the interest rates cuts which were forms? later announced by the Reserve Bank. The point about having awards as merely a safety net is that this provides you with a system that looks after the people who need to be looked after. It also opens up the system for those beyond the safety net to do productivity based deals which give them the chance of earning more. We are not reinventing the wheel here. This used to be the policy so espoused by the opposition when they were in government, which is a policy they are now officially opposed to. You have the gang of four out there opposing the very reforms to the system which they themselves said would be good for low-income earners as well as which would give us a low inflation environment, thereby paving the way for better deals for people throughout the system, including particularly low-income people. You do not get a $292 benefit in terms of lower and reduced interest rates just as a result of circumstance: it is as a result of good policy in both the fiscal area and in the wages area, giving better outcomes. We have seen-when you make these comparisons with other points of view-the ACTU put their living wage claim into the AIRC. Who are they supported by? The ALP. We saw the TWU run a case which was directly opposed to a system that would give benefits to low-income people. Who supported the TWU? None other than the ALP. We have seen the ALP jettison enterprise bargaining, which they once said was good for lowincome people but which now, of course, is not populist. We have seen them abandon non-union certified agreements, which they themselves, in theory at least, once supported and which they now oppose. Essentially, what you have in this debate and with this point of view is the gang of four-the Leader of the Opposition, the Deputy Leader of the Opposition and the two ex-ACTU presidents-running the ACTU line. We know this is starting to generate a few problems within their own ranks. We have seen announced in the press today this sinister conspiracy by others who are mounting some economically literate argument against the gang of four position. There is a bit of unhappiness in the mid-party, cadre levels about economic policy and, in particular, industrial relations. What we now see is a challenge to the centralised wage system which, if you go back to the 1970s and the 1980s, was in fact the position of the ALP. The challenge, of course, is coming from none other than the member for Melbourne, backed up by the member for Werriwa. This is what the member for Melbourne had to say about wages policy. He said the party should: . . . accept that the detenuination of tenus and conditions in the higher-earning sector of the workforce will be much more dominated by the market than previously. The award system can no longer be a comprehensive prescription of tenus and conditions of employment for everyone ... Wages policy should focus primarily on using the award system to increase the real earnings of income workers. So there you have it. You have the economically literate running the proposition that the award should be the safety net, and you have the gang of four-including the two ACTU ex-presidents-running the same old Labor line, which is that you have to have a centralised wage-fixing system, you do not have real and genuine enterprise bargaining, you should have compulsory unionism and you should give as much power to the trade union bosses as they demand of you. In Labour terms, this is a return to a sort purist ideology. This is where they once were. This is the trip down nostalgia lane which the member for Melbourne referred to. But, as Gough Whitlam once said-and perhaps these immortal words were written by the member for Werriwa in his past life-at a time of yet another split in the party: 'Certainly, the impotent are pure.' Tax Pack",71
127,Mr ROCHER,QUESTIONS WITHOUT NOTICE,"Can the Treasurer assure the House that the addition of more than 20 pages to the Tax Pack will, as claimed by the Commissioner of Taxation, make it simpler to understand?",72
128,Mr COSTELLO,QUESTIONS WITHOUT NOTICE,"The additional 20 pages are designed to elucidate provisions of the taxation law and to assist people if they happen to be interested in those particular areas. Of course, it sounds as if it makes it much longer-and in fact it does-but can I point out that, as the member would know, taxpayers do not have to read every page. In fact, most taxpayers whose income consists solely of PA YE and have a bank account or two covered by an interest withholding tax would have very slight requirements, and they would not have to go to those pages. So I am optimistic. The tax commissioner is probably a touch more optimistic, but I am quite optimistic that those pages will actually assist. Natural Heritage Trust",72
