speakerGroups,Speaker,Title,text,pageNumbers
282,Mr ALBANESE,REPRESENTATIVES MAIN COMMITTEE,"Thank you, Mr Deputy Speaker, of those opposite on the government benches. people from over 100 different ethnic groups. Marrickville where my office is located, backgrounds all working together. The thing to because these are the people that the Prime budget. On the whole, my electorate can be families and, I can tell you one thing for advantage of the government's incentives with his background in share transactions and mates welcoming the savings initiative of the Australian will not benefit. The average Australian in the bank and this translates Of those people living in Grayndler who are per cent are wage and salary earners. Not many system, unlike the 463 people in Australia with average interest earnings of $52,000 a year. They But, as Mr Howard so clearly pointed out have enough savings to attract the full $450 said that he will not take this fee, but that We now have self-regulation of the taxation because this rebate is of little or no assistance of no use to pensioners, to the unemployed, to or the mortgage and to feed and clothe their children. Let us look to the people who work hard to rebate. What are they going to do with it when They are most likely to see it as a bonus and tax refund. This is hardly going to help national Sydney Morning Herald on 15 May, the rebate is: ... much more a reward for past and already intended in the future ... Mr Costello's incentive involves government's saving, offset by a smaller and uncertain to involve a net decline in national saving. What Let us talk a little more about national savings the government's most important economic objective in this budget that promotes national savings. neutral impact. However, the most likely outcome MAIN COMMITTEE 4975 an electorate, I dare say, where the member example of the success of multiculturalism. The honourable member for Wannon (Mr here in the chamber, so he will just not for drawing to attention the rudeness My electorate is certainly made up of working When you walk down the main street of you will find people from different cultural emphasise here is that they are ordinary people, Minister and Treasurer have forgotten in this seen to be made up of lowerand middle-income sure, not many of them will be able to take full rebate system. Perhaps the member for Richmond, being involved in the finance sector might have Howard government, but certainly the average has savings of only a few thousand dollars to a rebate of less than $1 a week. lucky enough to still have a job, close to 90 of them will benefit from the incentives rebate incomes of over $1 million per year with their are the winners from this so-called initiative. in this very house a few weeks ago, people who rebate do not need it. That is why he himself has is a poor excuse for public policy decision making. system regarding what rebates will be claimed, to the bulk of the Australian population. It is young families struggling to pay either the rent save money and are therefore eligible for some they get it as part of their tax return cheque? so go out and spend it along with the rest of their savings; is it? As Ross Gittins wrote in the saving than it is an incentive to greater saving a certain decline of $2 billion a year in the increase in yours and my saving. It's thus certain it's intended to save is not money, but votes. because, after all, the Treasurer tells us it is arising from this budget. There is nothing At best, the government's plans will have a is negative. That has been shown this week NA 4976 in the Senate where, in the economics estimates cannot guarantee and they do not think it The government, to the contrary, has abandoned cent co-contribution to the superannuation an additional $400 billion to national savings scheme, which would benefit all workers, the incentive rebate that will only benefit some coalition's natural constituency, those people these people the maximum benefit of $450 government may as well have thrown in a free pension bonus plan is another one. Here we address the unemployment problem in this Australians to work longer. The government has also announced that will be able to opt out of the superannuation among our poorest paid and most vulnerable outworkers, part-time workers and often unskilled ensuring that they will have some retirement wolves. From 1 July 1998, these people will contribution but only with the agreement of insistence of their employer. Low income workers and part-time workers do not fully understand the superannuation background. They may be told to opt out as it may also be told quite falsely that the extra thing this proposal is guaranteed not to do go into a bank account but in all likelihood towards simply cannot afford to save additional money. If this is the plan the government has for to think what plans they may eventually formulate That is of course if the government ever gets two key areas. At a recent community meeting of the Australian Business Chamber told the plan to boost economic growth. The biggest policy. The Business Council of Australia has vision and any strategic policy for industry. The government has shown no leadership The Prime Minister was not even informed Obviously he has little standing with this company. this crisis hit? Firstly, at lunch, and then, meeting in Newcastle because he chose Melbourne. There he was, swanning about down in Melbourne when the workers of Newcastle future. Unlike this government, the Labor Party MAIN COMMITTEE Wednesday, 4 June 1997 committee, Treasury has pointed out that they will necessarily lead to increased savings. its previous support for Labor's three per of workers. This co-contribution would have added by the year 2020. Instead of supporting this government has substituted for it the savings people. In other words, it is a reward for the on high incomes. The joke of course is that for is chicken feed; it is just a gimmick. The set of steak knives. Speaking of gimmicks, the have a government with no clues about how to country and yet they are encouraging older There is no logic in this move. workers earning between $450 and $900 per month guarantee and take wages in lieu. These are members of the work force: they are women, workers. Instead of protecting them by income, the government is throwing them to the be able to opt out of their superannuation their employer. It is more likely to be at the are often in a weak bargaining position. Many scheme and many are from a non-English speaking means less paperwork for their employers. They money in their pay packet is a pay rise. The one is help out national savings. The extra money may it will be spent because the people it is directed its most important economic objective, I shudder to deal with unemployment and industry. around to formulating any plans at nIl in these on the budget, held in my electorate, a member audience that this budget had no vision or game missing ingredient was in industry development said that the budget lacked both a broad national over the closure of the BHP plant in Newcastle. earlier of the decision by the BHP board. And where was the industry minister when when he finished his lunch, he could not attend a to go to the opening of the Crown Casino in with the high society from the Melbourne Club were having a meeting to discuss their does have a steel plan. The shadow minister for NA Wednesday, 4 June 1997 industry and regional development has provided investment in new technologies. Nor does this is that the Labor Party has a plan-which sitting across the other side of the room, agrarian socialist friends in the National and to protect the workers in those industries. The government's record on unemployment when Labor left office in March 1996, was 8.5 average rate of employment growth in Labor's created-2.9 per cent. The average",167
283,Unknown,REPRESENTATIVES MAIN COMMITTEE,Government members interjecting,169
284,Mr DEPUTY SPEAKER,REPRESENTATIVES MAIN COMMITTEE,"Order! There has certain amount of latitude in this chamber, honourable member for Richmond has just spent member for Wannon is about to spend 20 minutes and listen to the honourable member for Grayndler.",169
285,Mr ALBANESE,REPRESENTATIVES MAIN COMMITTEE,"Thank you. The fact is that today, have created only one per cent of employment last year's budget, 34,300 full-time jobs Grayndler is up 58 per cent since March Treasurer, nor the minister responsible have in employment creation. The Treasurer in fact has had to revise down This was largely due to the government's disastrous the economy which has slammed the brakes averaged a rate of growth in Labor's last year four per cent per year every year in our last cent growth forecast for next year is not enough government on about? The Prime Minister himself at a Liberal growth going was to create economic growth suggest not only will that not happen this year the end of this decade. If you look at the last is particularly depressing. Issues affecting my electorate include the million over four years but will particularly The drugs affected by this new tax are used cholesterol, ulcers and depression. People who one-off prescriptions every now and then. ongoing treatment. People will have to pay more Pensioners in particular will be hard hit. that are not as effective in their treatment. health system. On top of this, 44 Medicare offices just outside my electorate. MAIN COMMITTEE 4977 details of how to encourage value adding and government have a clue on car tariffs. The fact has the agreement of many of the backbenchers and it certainly would have the support of my Party-for government involvement to protect jobs is particularly woeful. The unemployment rate, per cent. The current rate is 8.7 per cent. The last term of office was 700,000 new jobs rate of employment growthbeen far too much talk. I know there is a but I have asked members to remain silent. The 20 minutes on his feet and the honourable on his feet. I suggest that they remain silent the mob opposite, the rabble interjecting here growth in their first year in office. Since have been lost. Unemployment in my electorate of 1996. Clearly, neither the Prime Minister, the a clue about the need for government involvement to 3% per cent his forecast for growth this year. policy of slash and bum and contracting right on. It is an economy, I might add, that of office of 4.4 per cent, and it averaged over term. If it is the accepted wisdom that the 3% per to achieve real jobs growth, then what is this Party fundraiser said that the way to keep job of four per cent, but the budget's own figures but that it will not happen in the lead-up to two budgets as part of a larger plan, the outlook government's new drug tax, which may save $561 affect many Australians, particularly the elderly. for the treatment of high blood pressure, need drugs for these conditions do not just get They are chronic conditions and they require for medication that they need to stay alive. They may be forced to opt for second-class drugs Once again, we see the emergence of a two-tiered are to close-two in my electorate and one NA 4978 Mr Hawker-None are closing in my electorate.",169
286,Mr ALBANESE,REPRESENTATIVES MAIN COMMITTEE,"The member for Wannon points electorate. That is the point. The point government that says, if you live in a working your facilities and access to those, but not if a look at where they have been closed on the the impact of their closure on the Leichhardt just directly on the health system but is a employment and the access that those offices, centres, bring in terms of a multiplier The changes to public housing will also disadvantaged. The government has spoken about However, the states and territories already in the household and charge their rents accordingly. state's revenue from rental collections, but the Commonwealth-state housing agreement, which decline. Once again the government's free market ideology rears its ugly head. The private sector, particularly quality and affordability but by profit. Accordingly, not appropriate for the private sector to take first 20 years of my life, is certainly one of those areas. The government continues its assault on child has cut $821 million from child care. Child decades. On top of that, you have the changes actually be charged through the private employment a job. I would have thought that that was the minister (Mrs Moylan), in having to apologise before the House this week, has shown that of these changes. On top of that, you have the federation no doubt, in the coming years an opportunity electorates, get out the big whiteboard, and I want to say something also about the something to say on the Aged Care Bill later government, whereby the elderly will be forced home care, is an absolute disgrace because very traumatic and distressing time. People now adjust to their loss of independence and they enter a nursing home, they are unfortunately home. However, for many of these vulnerable gives them hope. I fear for people's longevity if they are forced that they hold dear-their family home. Selling may as well be nailing the coffin down and saying MAIN COMMITTEE Wednesday, 4 June 1997 out that there are none closing in his is that this is a vicious government. This is a class area that votes Labor, we will shut down you are in a Liberal or National Party area. Have North Shore of Sydney-there are very few. But and Marrickville offices in my electorate is not further drain on the local economy in terms of which bring people into the local shopping effect on local small businesses. have negative effects on the most economically removing double subsidies in rent assistance. take into account the income of all people living This change will adversely affect the big king hit for public housing is the cut to the will mean that public housing stock will of letting market forces sort things out in relation to housing, is not motivated by there are some areas which simply are over. Public housing, which I grew up in for the care in this budget. So far this government care is now less affordable than it has been for to the CES where unemployed people will placement agencies for assistance getting one of the primary objectives of government and for the third time for misleading parliament she just does not have a clue about the impact slush fund being implemented which will provide, for the coalition to spend money in marginal that is no substitute for real public policy. impact of this budget on the aged. I will have on today. I think that the policy of this to sell their homes in order to get nursing for many people going into a nursing home is a who have up to this point been independent must privacy. The reality for most people is that, once unlikely to be able to return to their own people, the fact ,that their home is still there to relinquish the one symbol of independence this home is such a final act. The government that is it: your life is over. It is that sort NA Wednesday, 4 June 1997 of impact that this uncaring government has is highlighted by this budget. I want to conclude by talking about the the Minister for Transport (Mr Sharp) on cutbacks are contrary to the government's government's insulation program. It is now Marrickville and some 2,500 people who were of noise will miss out under that reconsideration. The fact is that Sydney airport is still creation of a second Sydney airport and, under this government would take away from people which they were promised. I urge all to expired)",170
287,Mr HAWKER,REPRESENTATIVES MAIN COMMITTEE," Mr honourable member for Grayndler (Mr Albanese), to hear the way he seems to have fallen back view towards some sectors of the community the class war-something that I thought Australia really is most unfortunate to listen to someone the politics of envy. One of the things that all honourable members the thinking ones from the other side-is that Labor Party lecturing us on unemployment. After per cent unemployed, I would have thought rather inclined to stay right off that subject would want to be talking about At the same time he made some comments figures to 3% per cent. Some of us have a long ago when Labor was in power that the growth that long ago and you have been around long to the recession we had to have and the growth to hear someone saying that. Getting on to the budget, the member for point about savings. He talked about the savings to think are an excellent development, but encouraging people to increase their savings. instead of looking forwards. What he ought has brought in this incentive for savings is savings. It is not about trying to benefit encouraging those who want to get into savings many times, it is capped, so in fact it will be Of course when he raised the question about overlooked one of the fundamental changes that is the moving of the budget into surplus. than to move the budget into surplus? Likewise, MAIN COMMITTEE 4979 towards the most vulnerable in our society which changes foreshadowed in this budget and since by the insulation program for Sydney airport. The promise, which was to maintain the previous saying the insulation will stop at Stanmore Road, promised proper insulation against the impact there. There is no funding in this budget for the those circumstances, it is just an outrage that the insulation to which they were entitled and campaign against this government budget. (Time Deputy Speaker, after listening to the I must admit that I was rather disappointed into the bad old habit of taking a patronising and the way he seems to be trying to reinvent was rather pleased to have got rid of. It having to resort to going back to things like particularly on this side would say-and all they really could not accept anyone from the going out of office after 13 years with 8'12 that all members of the Labor Party would be with a track record like that. I do not think they unemployment for a long time. about the Treasurer revising down the growth reasonable memory you know and it was not that figures were actually negative. It was not enough to know that you only have to go back figures were negative. It is very disappointing Grayndler seems to have completely missed the initiatives of the government which I happen he missed the whole point. It is all about He was trying to look backwards all the time to realise is that the reason why the government to actually encourage people to increase their people who may have savings now. It is all about to start to do so. As has been pointed out of limited benefit to those on very high incomes. national savings, he seems to have completely have occurred with this government and that Now what better way is there to improve savings as a contrast, what worse way is there to NA 4980 destroy national savings than to continue to government inherited from the previous government-a budget deficit. Ten billion dollars was irresponsible government that was of course thrown out by the people of Australia because this country. Not only is this budget all about building already started in the last budget to bring parliamentary term, but it also in fact reduces level of Commonwealth outlays. It reduces them parliament and it brings the level of Commonwealth Whitlam era. In other words, it is the lowest Indeed, that is a tremendous achievement government and all members of the Australian story about the budget gets better. It is the first time in over a decade that dollar. That is indeed a great achievement. ratio to GDP will have literally halved from In other words, we are moving away from Labor's today, not worrying about it, just racking generation; a 'send the bill to the kids' budgeting. This is something that all Australians achievement. Of course, this budget also builds on many family tax cuts that came in on 1 January of the very people that the member for Grayndler him talking about the benefits of these tax something that this government is very proud of. Mr Albanese-Was there anything in this year's budget?",171
288,Mr DEPUTY SPEAKER,REPRESENTATIVES MAIN COMMITTEE,Order! I ask honourable,172
