speakerGroups,Speaker,Title,text,pageNumbers
32,Dr NELSON,REPRESENTATIVES MAIN COMMITTEE,"Bradfield-Minister for Education, reply- Mr Deputy Speaker Baressi, I offer my as a deputy speaker on the Speaker's Panel. I fute the remarks of the member for Jagajaga ernment's commitment to it. I will The Student Assistance Amendment Bill and the Abstudy and Assistance for Isolated ecutive schemes funded through the appropriation vides the statutory mechanism in relation these schemes. There is little point repeating peating the contributions made by honourable the member for Barker in particular. MAIN COMMITTEE 1269 Speaker Barresi, I offer my congratuladiscuss the merits of the Student Assistance comprises a list of amendments designed to bring 1973 into line with other social security acts. assistance program already embarked upon over the times and provides both students and the The proposed amendments will help to ensure Assistance Act and the Social Security Act and also the required notification period. sets out firstly to permit social security, vetoverpayments to be offset against benefits payscheme and the Abstudy scheme. These overact until amendments in 1998 took effect to under the Social Security Act. Not only will it to recover up to $4.4 million by offsetadministrative procedures for both the govbasis while at the same time provide that welfare cheats cost the Australian taxpayer everyone has a story about someone who is that could be used to help the more vulnerof our generous welfare system, despite the and not the greedy. Our government is extremely Australian taxpayers and as such has been parmethods to catch welfare cheats. It is expected to which is $4.4 million we can use to help those in designed to update the definitions in the StuAboriginal Overseas Study Assistance scheme no in the present Abstudy scheme and the governdefinitions of the current special assistance scheme to reflect this change. the seven-day notification period in which stuevents, in section 48 of the act, to a 14-day peindividuals with regard to overpayments, it is withholding payments when moneys are owed to it goes a long way to improving the consistency I commend the bill to the House. Science and Training) (1.07 p.m.)-in congratulations on your appointment to serve thank those who spoke to the bill. I strongly rein relation to indigenous education and the govaddress those issues at another time. 2002 amends the Student Assistance Act 1973 Children schemes, which are non-statutory exacts. The Student Assistance Act 1973 proto debt recovery and administrative appeals for what I said in my second reading speech or remembers, and the very good contribution from NA 1270 There are three points that should be Breaches and Penalties in the Social Security security system conducted by Professor Dennis budsman and professor of law at the Australian on 11 March, two days ago. I also, on behalf tion's claim that this report in some way shows use the opposition's terms, ‘reducing costs,' further from the truth, and that This amendment bill aims to assist students Children benefits and who have a debt from offset against future entitlements. A withholding easier for the repayment of debt, and Question agreed to. Bill read a second time. Ordered that the bill be reported NA Debate resumed from 20 February, on motion by Mr Tuckey: That this bill be now read a second time.",171
33,Mr MARTIN FERGUSON,TRANSPORT AND REGIONAL SERVICES LEGISLATION AMENDMENT,"Batman) (4.36 Regional Services Legislation Amendment (Application to firstly congratulate you, Madam Deputy Speaker. I think this is your first occasion wish you well in your new endeavours. The purpose of this bill is to make consequential in legislation, for which the Minister for Transport sponsibility, to reflect the application of ensure that the offence provisions operate in the Criminal Code. The bill affects a small cluded in the Transport and Regional Services Criminal Code) Bill 2001 and are therefore The amendments arise from the requirement element of an offence is not one of strict liability; offence; thirdly, clarify the fault elements vary from those specified by the Criminal Code; from offences and identify the evidential The opposition supports the bill, and I am other issues of concern to the opposition. I draw of the bill is the Criminal Code. When a member they are immediately drawn to what is specified as we all appreciate, sets out the law of the of what is expected as acceptable behaviour in in the eyes of the Australian community. moral and ethical code, but there certainly Code. I suppose it is about what we as With respect to the bill before us, I simply that makes certain changes across all federal MAIN COMMITTEE Wednesday, 13 March 2002 made in conclusion. The Independent Review of System is an independent review of the social Pearce, who is a former Commonwealth OmNational University. The report was released of the government, strongly refute the opposithat the government is more interested in, to than helping people in need. Nothing could be  receiving Abstudy and Assistance for Isolated other Commonwealth programs to have that debt facility is a far more efficient way to go and as such I commend the bill to the House. to the House with an amendment.",172
34,Unknown,TRANSPORT AND REGIONAL SERVICES LEGISLATION AMENDMENT,"Sitting suspended from 1.10 p.m. to 4.36 p.m. (APPLICATION OF CRIMINAL CODE) BILL 2002 Second Reading p.m.)-Before turning to the Transport and of Criminal Code) Bill 2002, I want Speaker Corcoran, on your appointment as Deputy occupying the chair of the Main Committee, and I amendments to certain offence provisions and Regional Services has ministerial rethe Criminal Code Act 1995. The amendments will the manner they did prior to the application of number of offence provisions that were not inLegislation Amendment (Application of inconsistent with the Criminal Code principles. to, firstly, specify that an offence or a physical secondly, clarify the physical elements of an of an offence, especially where the fault elements and, fourthly and finally, separate defences burden in relation to a defence. pleased it provides an opportunity to raise some the House's attention to the fact that the topic of the House thinks of the Criminal Code as appropriate behaviour. The Criminal Code, land to guide us in a daily life-the ground rules the eyes of the judiciary and, more importantly, What the Criminal Code does not specify is the are values and ethics that underpin the Criminal a community expect as acceptable behaviour. say that this is the culmination of an exercise legislation with respect to fines, punishments and NA Wednesday, 13 March 2002 liability. In short, the bill makes the portfolio try that is bound by it-comply with certain I call into question the ethics of, and the degradation Deputy Prime Minister, Minister for Transport tional Party, John Anderson. Yesterday at question time in the House Minister and Minister for Transport and Regional nounce some, as he described it, ‘major aviation aside with respect to this matter that everything a month ago. In fact, he made the same announcement House that he hid behind the Friday of a parliamentary parliamentary sitting week or a prime time ment had ceased sitting. I suggest that he had still did not do anything. Finally yesterday, to say that we had been completely silent about the tag and glory of Deputy Prime Minister, Transport and Regional Services, I believe from his own announcement in the manner in yesterday. I want to digress at this point. I do not propose aviation reform announcement because it does number of occasions since the change of government the minister announced a measured approach been so measured, it has not been on the screen-it announcement included the corporatisation of Airservices deadline on this. If I remember correctly, it overdue, yet we can measure that because that from when the original announcement was This is the same minister who boasted with his aviation reforms delivering aviation competition. workers and their families, communities in Mount Macedon-that, when it comes to his and the requirement to deliver on that, the collapse hend the need for sustainable competition which and which, more importantly, meant that we try. It reminds me of his blind approach to shipping about ideology in question time again today. the needs and aspirations of Australian workers, foreign shippers and hang the Australian shipping debate on another transport bill, when he wants does not stop at going out of his way to foster tax regimes propped up by other countries, do not crack down on border protection and on those continuous and single voyage permit length in an earlier debate on a bill We often see the minister stand up and take mind the House of another one today. We also September 2000 and beat his chest, because Transport and Regional Services-just ask his parliament with fewer members of the National MAIN COMMITTEE 1271 legislation-and implicitly, therefore, the indusstandards and therefore ethics and values. Today, of office and responsibilities by, the and Regional Services, and Leader of the Naof Representatives, Australia's Deputy Prime Services accepted a dorothy dixer to reanreform processes'. I might point out as an in the minister's dorothy dixer was announced on 15 February this year. I remind the sitting week-not any other day of a spot-and made his announcement after parliaa whole week of sittings the following week and the dorothy dixer came through. He had the hide the announcement of the reform process. With Leader of the National Party and Minister for that he could not have gone any further to hide which he handled it prior to the dorothy dixer this afternoon to go into the detail of the not deserve it. We have been there before on a in 1996. For example, three years ago to so-called aviation reform. His approach has has actually been invisible. The February Australia. In fact, I recall an earlier may have been the end of 2000. It is two years is what it is about. We can at least measure made to the deadline and nothing was done. great fanfare in the House 12 months ago about We all appreciated-especially Ansett the federal seat of Burke, in Hume, Sunbury and so-called commitment to aviation competition of Ansett says it all. He did not compreeffectively meant that consumers benefited kept Australians employed in the aviation induscompetition. I know that he wanted to talk His approach to ideology, competition policy and seafarers and their families is to subsidise industry out to dry. As I said earlier in the to subsidise overseas shipping companies, he overseas companies coming into Australia with he also goes out of his way to make sure that we visa arrangements with respect to people working vessels. But enough of that; I dealt with that at about the pollution of coastal waters. dorothy dixers in the House, and I want to resaw the minister stand up in the House on 7 he is a very important man, the Minister for backbench. However, he has returned to this Party caucus than he had when he went to the NA 1272 MAIN COMMITTEE last election. I know that brings some smiles tion partner, the Liberal Party. What did he beat his chest about on 7 September? Aviation Safety Authority, and the Australian sised this by banging the table-sort out their ter of great urgency. It was of great urgency, dent which saw the loss of Australian lives. was first brought to the attention of CASA another fatality was narrowly avoided. This responsibilities, a minister who would have that he gives great and proper attention to safety the aviation industry in Australia. Here we are, 29 months after the minister There was a responsibility on the aviation industry sues of audible alarm systems. For those who ment to actually make change with respect to death. But what do we have 29 months after the the House to events of the last week. In the lian, we are reading the horrific recollections of the eight victims of the Super King Air they were not aware of the oxygen loss. Go to the report of that inquiry. You will troller-one of the very valuable people who had the hide to have a crack at in question stand up for their industrial rights-actually able to alert the pilot about the problem that passengers on that aircraft. Now, 20 months later, in spite of the minister's Aviation Safety Authority-the agency for which been suggesting for a number of years now is not mandated the audible alarms. All I can say minister's duties in an urgent fashion, I would in performing his duties. Frankly, his lack of attention that he is the responsible minister for aviation audible alarm front-so far as I am concerned-through has risked the lives of other ordinary Australians said that this had to be attended What about the press release? It was rushed on the Burketown crash, with promises to fix it opposition is going to be monitoring the performance associated aviation authorities to see whether sion. That will be clearly related to how long people actually participating in the aviation cause of a lack of attention to his detailed Regional Services. One wonders at the gall of the minister, time to time. How many more ATSB recommendations How many more lives is he prepared to sacrifice cepts his responsibilities? That is what he is ister in the current government. I do not mind job he is paid for-to actually go out of his Wednesday, 13 March 2002 to this side of the House and to the other coaliI heard him say that CASA, the Civil Transport Safety Bureau must-and he emphadifferences on audible alarm systems as a matbecause unfortunately we had an aviation acciThe record will show that in October 1999 this by the Australian Transport Safety Bureau, after is a minister who is consumed with his portfolio the House and the Australian community believe standards and pursues the need for reform in said to ‘fix it urgently'. They were his words. to fix the problems with respect to the isunderstand the aviation industry, the requirethe audible alarm system is a matter of life and minister said to fix it urgently? Again, I refer press this week, for example, in the West Austraof air traffic controllers at the coronial inquiry that crashed at Burketown because it seems that find in that report a record of an air traffic conwork in the aviation industry that the minister time today because these people are prepared to crying with powerlessness, recalling not being was obvious to them but not to the pilot or to the so-called plea about urgency, the Civil he is responsible, the agency which we have not performing its duties adequately-has still is that, if that represents performance of this hate to see what he would do if he were tardy to detail, his lack of attention to the fact activities in Australia, his not acting on the proper direction and accountability, since he originally stood up in the House and to as a matter of urgency. out with the release of the ATSB final report by the end of this year. All I can say is that the of the minister, yet again, and all the they meet the so-called deadline on this occathis minister's inaction further risks lives of industry-be it as workers or passengers-beresponsibilities as the Minister for Transport and standing up and criticising the opposition from will this minister let CASA ignore? before he speaks up, opens his eyes and acpaid for and that is what he sought-to be a minif he is a minister, but it is about time he did the way to implement so-called promises to the AusNA Wednesday, 13 March 2002 tralian community with respect to proper regulation doing so, to protect the lives of Australian use the aviation services. Let us also go to some other examples of duties. The minister's measured approach action. What happened to the Aviation Safety regulatory reform processes that received extra instead trying to stretch his measure-stretch march around rural and regional Australia. suggest to the House, is to cover off another up to the most recent federal election, another This takes me back to the all-important question Regional Services and Deputy Prime Minister-in ister-has been involved in what I believe is campaign. The record shows that on previous to the coalition. It is widely known in the industry meeting with Dick Smith and the Deputy Prime just look at the tape of question time yet again Minister when the Deputy Prime Minister doing so, confirmed the Prime Minister's involvement Prime Minister's smirks, the arm patting around in the chair to show off to the team behind of question time yesterday. What you see is the Prime Minister taking the Leader of the National Party, Minister for the seat of Gwydir. It is common knowledge, that Dick Smith did not care who won Gwydir, said on a number of occasions that he was going stump in Gwydir, travelling around in his Commodore good voters, saying that their local member was, in history'. Before the end of the campaign, after the September preneur and aviation amateur suddenly decided support for the current government and the ing-and I should remind the House-that, needs a dictator at times like this.' Before the it began to emerge. The deal between the ging of Dick Smith. The price the Howard Australian travelling public will eventually terday, was giving Dick Smith a third go We should not forget that this is the third aviation reform in this country. First, it was second, as chair of the regulator, the Civil Aviation casion the government is hoping, if not praying, Smith. It will take luck because, for all his up on each of the two previous occasions. government gamble. Dick Smith accuses unions of excessive power. ual who happens to have money and influence. House that not too many people, especially ordinary the Prime Minister's Christmas function, eating MAIN COMMITTEE 1273 of the Australian aviation industry and, in workers in the aviation industry and people who the minister's so-called measured response to his also involves committee after committee and no Forum? What happened to CASA's aviation funding in the last budget? The minister is the elastic side of his boots in which he likes to The measured approach to aviation reform, I also debt-another agreement entered into in the leaddirty little deal for another coalition mate. of ethics. The Minister for Transport and association with his boss, the Prime Mina buy-off of Dick Smith for the federal election occasions Mr Smith has been a generous donor that the Prime Minister was involved in a Minister. If you want any evidence of that, yesterday and look at the reaction of the Prime in glowing terms mentioned Dick Smith and, in and knowledge of the deal. Look at the of the Deputy Prime Minister and the swinging him. It is all on the record, all on the tape credit for bailing out his Deputy Prime Minister, for Transport and Regional Services and member if you go back over the last couple of years, provided it was not the current minister. He to spend the whole election campaign on the ute, staying in pubs and talking to the as he described, the ‘worse transport minister 11 terrorist attack, the erstwhile entreto pull out of the campaign and declare his current minister. Mr Smith was reported as saywhen it comes to aviation reform, ‘Australia end of last year, the real deal had been done and Howard government and Dick Smith was the gaggovernment paid-or should I say, the price the pay-as was clearly proven in question time yesat his personal obsession of aviation reform. time that Dick Smith has been put in charge of as the chair of the then Civil Aviation Authority; Safety Authority. I expect that on this octhat perhaps it is third time lucky for Dick energy, knowledge and courage, he has messed it This is another, can I say to the House, Howard He should remember that he is an individThis has opened doors for him. I remind the Australians, get an invitation to attend Japanese food care of the Australian taxpayNA 1274 ers at Kirribilli House. The record shows them. We will never know if Dick Smith's campaign ister for transport in Gwydir. We will never with his so-called announcements about campaigning the deal that the Prime Minister and the Deputy but we are starting to get a fair idea. What we for the influence of Dick Smith on this government. strike it lucky and succeed in airspace reform beneficial it is to Australia may In looking to the Criminal Code, can I Transport and Regional Services it should also for transport applies to his portfolio duties. contemplation, as he does from time to time, has succumbed to in order to try and guarantee short, the opposition will remain vigilant and draw attention to his ongoing failings But I also want to deal with one other issue blind ideology of the minister for transport today. blind spot in relation to his absolute hatred rier to reform. In question time today the minister criticising Chris Corrigan, the head of Patricks. dia could find because, as I have said and stand fer the House therefore to a statement by ment of the proposed merger between The waterfront dispute of 1998 will not play any dealing with this issue. Our responsibility is to It goes on: Patrick Stevedoring is a fully unionised operation pute, both the unions and the company have worked I hope the Deputy Prime Minister actually has Secretary of the ACTU yesterday, part of clearly supporting the merger of Virgin Blue ple: it is about jobs and looking after Australian who likes to dwell on class hatred, as evidenced would also remind the House of what John Workers Union-the same union that the so-called Minister quoted in the House this afternoon Review: Lang Corp (now Patrick) maintained existing pay and industry and the union had a good I would also remind the House that that same minister took a slap at air traffic controllers, workers and firefighters who are taking action met with some of those people last week in operated in the aviation industry by those very is that they are highly professional people to aviation safety. The attack by the government fied. They are entitled to campaign for improvements way in which I suppose Mr Wooldridge thought money to look after his future with respect to berra. There is one rule for their mates MAIN COMMITTEE Wednesday, 13 March 2002 who was in attendance. Mr Dick Smith was one of would have successfully unseated the minknow if Dick Smith ever intended going ahead in Gwydir. We will never know for sure Prime Minister stitched up with Dick Smith, will know over time is the cost that is to be paid Over time we will see if Dick Smith can or at least succeed in bludgeoning his way. How only become clear in the longer term. simply say when it comes to the Department of look to the code of ethics which the minister When the Deputy Prime Minister sits in quiet I hope he reflects on the undue influence that he his re-election as the member for Gwydir. In continue to hold this minister accountable and as the minister for transport. today. Again in question time we witnessed the Earlier in this place today, I illustrated this of maritime unions and how that ideology is a barcriticised a union official in Queensland for I think that official was the only one the meby, the labour movement has moved on. I rethe ACTU yesterday in response to the announceVirgin Blue and Patricks, and I quote: part in the approach of the ACTU or the unions in the staff of Ansett and also to the staff of Virgin. and notwithstanding the bitterness of the 1998 dishard in recent years to rebuild relationships. time to read the media release put out by the which I have read into Hansard this afternoon, and the Patricks group. The explanation is simfamilies. It is only the Deputy Prime Minister in his performance in question time today. I Allan, the National Secretary of the Transport Queensland official who the Deputy Prime came from-said in today's Australian Financial conditions after its purchases in the road transport working relationship with Mr Corrigan. union covers the staff of Virgin Blue. Then the technical and engineering staff, administrative in Melbourne today. As part of my duties, I Brisbane when I inspected one of the facilities same people at Brisbane airport. All I can say who are dedicated to their industry and committed on them in question time today was unjustiin their standard of living in the same it was appropriate to dip into taxpayers' the grant to doctors to build a property in Canand a different rule for ordinary workers. NA Wednesday, 13 March 2002 MAIN COMMITTEE I point out to the Minister for Transport ing action in accordance with what? They are ernment's industrial laws. They are taking legitimate provements in their wages and conditions. mend the workers not take the action but the action was not accepted by the commission-something Minister for Transport and Regional Services minister and I are fortunate enough to get our gitimate activities of the Remuneration Tribunal. walk back and reject an increase in his own salary. some members of his own party-the National cause they had dipped into travel entitlements workers' standards! He ought to have a look caucus. I remind the House that ordinary workers have der the government's workplace relations They are operating within the parameters of to be condemned for that? I simply suggest to framework, and they are operating within the right for politicians-we get the Remuneration increases. But as soon as it comes to ordinary changes in our wages and conditions', it It reminds me a little bit of the announcement ers' money, all of a sudden we are now entitled rial in our electorate. These workers do not earn gross salary let alone their take-home pay. Mr Cadman interjecting",172
