speakerGroups,Speaker,Title,text,pageNumbers
19,Mr CADMAN,MAIN COMMITTEE,"This committee spent a lot of time travelling Australia the parliament of some hundreds of thousands committee and the inquiry recommenced, trying and strategies that could be introduced on changing things for the better. way to go is ignoring all the evidence. Countries very strong harm minimisation policies have had that have followed the tough on drugs approach. of Sweden's policy with that of other counthat works towards prevention, but it is also base that shows the value of harm minimisation example. It is our most successful program in drug-free but it does result in a person being a meaningful member of our society. I know that that is not the way to go, but the evidence supin favour of naltrexone. I have to say that it is a rapid detox, goes onto naltrexone and then But it is actually quite dangerous because then use the drugs again and have a much lower but those people who have read anything on the people who were alcoholics. They were on a their tablets and then they would not drink. I into the work force. It was great, you had these would get them a job. But within a week they a worse situation than they had been in at the One of them was murdered. I got him a great job where he was murdered. Antabuse is very that you need to treat a person who is suffering and rehab. But it does not finish there. You program. You do not need any sort of quick fix. and the lives of their friends, family and fellow What you need to do is bring about a total change up their family and their lifestyle. They are, They need to find a whole new group of was a unique opportunity to take us forward in this enormous problem facing our society. I think this but I am very sorry that I argued so strongly because I believe it has taken us backwards is a very comprehensive report. The previous making investigations with a total cost to of dollars. The new parliament had a new to pick up the pieces-as often happens with NA many reports-of the previous committee's bers on our committee and we The report is very comprehensive. The majority public presentation-deals with tobacco and you count the pages, two-thirds of the report cause huge damage. I would like to touch on being an absolutely serious and deadly drug lar. Both those groups seem to fail to understand Young people in particular seem to feel can recover very quickly. We took evidence and, whilst there is no doubt that it can be felt that the remediation of that process had already had many alcohol education programs, ernments to stop the mixing of alcohol and driving. Based on all the evidence we took, we decided belling processes. We want the risks of alcohol We want a tax on the alcoholic content of a product. drinks that young people are drinking now is tent-whether it be spirit, wine or some other any indication of the risk factors associated ents and schools need to redouble their efforts sumption of alcohol can cause, particularly The next area that we applied our minds to with because, although it is a terribly addictive factor. I would like to indicate to the Committee smokes 111.8 cigarettes per week compared rettes per week. The problem is that teenage girls there may be a presentation health figure to match to identify it. According to Collins and Lapsley, lion in hospital costs are attributable to involuntary voluntary smoking is massive. There are a number one I think is most significant is that we smoking. I do not know that it is completely ber of factors involved-peer pressure and what the causes or reasons are. One of the startling findings of this report refutable evidence taken from around the country the people who say it is a recreational drug hospital. The committee really could not come hospitals, but we certainly came to a strong its forms. There is no doubt that the strength production. But the thing that led to a conclusion prospect of roadside testing for cannabis use. joint-one cigarette-is enough to produce efforts. We benefited from the continuing memalso had new committee members. of the report, I have to say-unlike the alcohol and treatment programs of all types. If deals with those drugs that are legal and that those briefly. There is no doubt about alcohol for young people and pregnant women in particuhow dangerous their consumption of it is. that an escapist approach is one from which they on the development of so-called binge drinking very much part of a young person's lifestyle, we to go beyond pure education, because we have such as the drink-driving blitzes by state govthat there needed to be a change in the lause to be put on the labels of alcoholic drinks. The raw content of the designer alcoholic marked on the bottle, but the source of that conform of alcohol-is not marked, nor is there with those drinks. We also think that doctors, parin explaining the problems that heavy conto pregnant women and young people. was tobacco. This is a very difficult area to deal substance, it is legal. And it has a high cost some of the costs. An average male smoker with female smokers, who smoke 106.5 cigaare increasing that rate very quickly. I think the model driving factor here, but it is hard 224 deaths, 77,950 bed days and $47.6 milsmoking. As you can imagine, the cost of of recommendations in the report, but the ought to do more research into why people start due to advertising; I think there must be a numa whole range of things. We do not quite know is the change in attitude to cannabis. There is irabout how dangerous this drug is, despite and despite Bob Carr saying you could smoke it into a conclusion about the use of cannabis in conclusion about the damage cannabis does in all of cannabis has changed with different forms of that we need to look at this seriously is the The impairment to driving is quite startling. One a massive impact on a young driver. NA Mrs Irwin-Where is the scientific evidence of that?",141
20,Mr CADMAN,MAIN COMMITTEE,"The scientific evidence from son-it is recorded in our report-saying that drivers because they drove more slowly. In process of driving that we are led to believe than alcohol. The recommendations of the committee with widely disseminate information and to inform cannabis use, including impacts on mental health other drugs. The committee believes that, in pendency, and in view of the health and psychological for that information about the severe negative It is concerned that there are serious dangers links between cannabis and opioid use are not 2001 national household survey, cannabis was tralians and to nearly half of the 14to 29-year-olds. larly important to provide credible, accurate notes that mental health and opioid use is linked of evidence supports real concern about the junction with other drugs-that is, polyuse committee says immediate efforts should be cerns. That is serious stuff, and it is time that not a safe drug. It is not a recreational drug. The role of families in all of this is something that there is not sufficient support or information based programs Australia wide that can really kids', run by Focus on the Family, is one program impact and a good educative effect on a wide not adequately funded. Resources are something sources seem to be hived off into the research coming forward and produce very little impact done, where people are. The programs that actually rehabilitation program or that offer, once detoxification establishment of social contact and a productive ficult for parents to find. The one traumatic thing for me, despite the there is no adequate application available to loved ones or other members of the community. they need changing now. Too much has been The focus should be on ‘Let's try to get some There should be such a focus, and this is what about it. It proposes something for everybody. should be put in place for youth who can be identified program in country towns that looks for kids Victoria is irrefutable. We even had one perthey thought that cannabis users were safer fact, they are so impaired by cannabis for the that cannabis could be as, if not more, dangerous regard to cannabis are basically these: to the Australian community about the level of and the possible gateways to addiction to the absence of proven treatment for cannabis deharm that cannabis can cause, it is vital impacts of cannabis to be made widely known. associated with regular cannabis use. Possible understood. It is alarmed that, according to the offered or available to nearly a quarter of AusThe committee believes that it is particuand comprehensive information on the dangers. It to cannabis use, and it believes that the body impact of cannabis use on mental health in conof drugs-and as a gateway to addiction. The taken to inform the community about these conAustralia changed its outlook on cannabis. It is the committee gave attention to, and we felt for families. There are very few family offer comfort and support. ‘Drug proofing your that I am familiar with. It has had a wide range of families. Many of these programs are that concern the committee, because the reinstitutes, where the results are very slow in on the ground where the real harm is being get people out of danger, that establish a has taken place, opportunities for relife are very thin on the ground and very difhuman tragedy of all of this, is the fact that the community to take action on behalf of their I think that the priorities have been wrong or focused on finding out who does what and why. results for people who are dependent on drugs.' the report does, despite what is being said It looks at youth at risk and what programs as being at risk. Wesley Mission have a who might be suicidal and takes remedial action. NA The identification in schools and in the community are facing risk is something that this committee mitment to a rescue opportunity for every person plicity of opportunities. The goal is to have Some will go back and back. I know that happens. pens in a person's will or outlook to say, ‘I some instances it will take a long time. But we should not give up trying, and that This is an unnecessary and stupid argument, implies that some people do not accept that they accept that there should be drugs, that there ment, and it is a stupid argument too. Mrs Irwin-Rubbish.",143
21,Mr CADMAN,MAIN COMMITTEE,"It is a stupid argument. I have native point of view to zero tolerance. We should tolerate, and we should try to help them, problem. We should not tolerate the people you say is an acceptance of the supply process. Party who put in the dissenting report say, drug trade and we will do everything to stop it.' the government has said. The government has program. It has cut down the supply, it has stopped ventative measures and it can demonstrate the than any other statistics that I know of. The argument seems to be about methadone. talk to Dr John Currie at Westmead. He has tempt to get some users who want to get off was bagged by the medical community of Sydney use of naltrexone. He has been proved right-not ought to be given the opportunity to use naltrexone, something that the opposition, except for a few is time that we offer opportunities to escape follow-up programs because the real risk is not walk away from their responsibilities, when old mates, their old haunts, their old associates quickly. That process is something that our community Our community has walked away from that responsibility, prepared to pick it up. One I want to mention team for young men going out into the community, them in Sydney, Wollongong and Perth. It recovered through this process supporting each be beaten and encouraging others to join a drug scene. For anybody to say that the process of networks of kids and young people who feels strongly about. There is a strong comin this proposal. There is a range, a multithese people-anybody-free of the addiction. It is sad, but until that certain thing hapwant to beat this' then we have to accept that in appears to be the whole argument we are having. if I may say so. The branding of zero tolerance there should be zero drugs in our communityneeds to drugs; that is the alternative argunever seen anybody try to defend an altershould not tolerate drugs. People on drugs we but we should not tolerate what is causing the supplying drugs either, because inherent in what I have not heard those in the Australian Labor ‘We are opposed to drugs. We are opposed to the That is not what they are saying. That is what produced great results with its Tough on Drugs the number of deaths and it has taken preresults of these programs far more effectively I would invite everybody to go and have a been bagged by Dr Wodak and others for his atdrugs to use the naltrexone program. Dr Currie when he produced positive results for the for every user, but for some-and they and that recommendation is in here. It is of their number, have not supported. I think it for everybody. We ought to be offering sensitive at the detox point but after that: when families loved ones leave them and they go back to their and get back into the drug scene again very is not giving any attention to whatsoever. and there are only a few groups in particular is Teen Challenge. This is a rescue grabbing them and doing great work with is a wonderful thing to see young men who have other, talking positively about how drugs can process of escaping the dreadful scourge of the presented in this report is narrow is misNA guided-it talks about harm prevention and treatment; any part. Those words are not used. This is be more reasonable, what could be more compassionate, practical than a report that proposes that approach? vious government did and it is far better than tralian Labor Party. A division having been called",144
22,Mrs IRWIN,MAIN COMMITTEE,"When House of Representatives Standing Committee bled last Monday I was able to make only a give me the opportunity to fully explain my dations. In dissenting from 10 of the committee's along with the member for Cowan and, in part, we have expressed concern for what we saw Strategy. As the report explains at section 11.22: One of the features of the National Drug Strategy supply reduction, demand reduction and harm reduction ... Section 11.22 goes on to say: The Alcohol and Other Drugs Council of Australia its strengths which has contributed to placing Australia That is a fair assessment of our standing in policies in Australia. As I mentioned in my visited several European countries in April this committee did not have the opportunity to see and Frankfurt. One thing that I can confirm Australia is recognised as a world leader in the in minimising harm, particularly the spread world. That is why I am so concerned at the egy. Here we have the Alcohol and Other Drugs approach of our National Drug Strategy, but change the focus from harm minimisation As I stated on the tabling of the report, bring Australia into line with the approach heavily pushed at this year's Commission on about this: what I sought in recommendation minimisation within the strategy of harm prevention and harm minimisation. We need case. As I said in our dissenting report: The consideration of evidence, the conclusions coloured by the personal views of committee members the political process. After all, elected representatives electorate. What are seen as socially acceptable it does not talk about zero tolerance in about harm prevention and treatment. What could what could be more thoughtful or It is far better than anything that the preanything proposed by the members of the Ausin the House of Representatives",145
23,Unknown,MAIN COMMITTEE,"Sitting suspended from 11.38 a.m. to 11.53 a.m. the substance abuse inquiry report of the on Family and Community Services was tafew brief remarks and the time available did not position on many of the committee's recommenrecommendations and two conclusions, the other Labor members of the committee, as a change in the balance of the National Drug is its balanced approach. Balance is sought between saw the National Drug Strategy's approach as one of at the forefront of drugs policy internationally. the international community in terms of our drug speech on the tabling of the report on Monday, I year. I might add that it is a great pity that the the programs that I was able to see in Zurich from every agency that I visited overseas is that treatment of drug addiction and that our record of HIV-AIDS and hepatitis C, is the envy of the prospect of changing the focus of our drug stratCouncil of Australia praising the balanced government members of the committee want to to what they call harm prevention. I am suspicious of changes which would seek to of the United States, an approach that was very Narcotic Drugs in Vienna. Let me be quite open 122 was to include the key principles of harm prevention. The two must go hand in hand-harm a balanced approach, but that was not to be the reached and the recommendations made must be seen as (including ourselves). This can be a strength of should be a sounding board for the views of the recommendations can be expected to prevail. NA But here we have thrown out the window the views of the Alcohol and Other Drugs Council voice of the electorate but to temper it with considered views of those charged with the responsibility what a number of the committee's recommendations fessionals accountable for policies which are ing what is or is not socially acceptable; it not work. Governments can always claim credit-as have done-when things go right, but they That is why we need to listen to the objective may not like what they say, but I turn to some specific recommendations our objection was to the inclusion of the clause drug free status for the client'. In recommendation ommends that when providing: - methadone maintenance treatment to save lives the ultimate objective be to assist them to become As you can see, that includes the magic words-‘prevent achieving abstinence. This may sound like a the scientific evidence is not encouraging. and Alcohol Research Centre at the University Only one-third of heroin addicts achieve and maintain is a chronic, relapsing disease. We That is the scientific evidence. We might like but the facts remain: heroin dependence is chronic, talk about management, not cure. But I have knowing what Professor Mattick had to say, talk about funding for the treatment. It says: … governments ensure that sufficient funding is sive support to opioid dependent people - for as long as it is needed - if possible, to assist them to reduce or eliminate - give priority to treatments including naltrexone I admire the committee's optimism, but naltrexone treating heroin addiction. Professor ... in treatment with naltrexone, compliance is poorer, treatment is ceased or intermittent. Behind these recommendations is the moralistic ment is acceptable. This is very much the case United States of America. Abstinence based treatment name. High-threshold methadone maintenance, stant pressure to move on from methadone maintenance results of scientific studies and the reasoned of Australia. Our role should be not to echo the the logic and reason of scientific evidence and the to deal with these problems. That is fail to accept. We cannot hold health proimposed on them. It is not just a matter of decidis a matter of deciding what works and what does government members on this committee rarely accept the blame when things go wrong. evidence of those who practise in this field. We we ignore their advice at our peril. which we dissented from. In recommendation 21 ‘with the ultimate objective being to obtain a 52 a similar clause was objected to. It recand prevent harm to people dependent on heroin, abstinent from all opioids, including methadone ... harm', but it insists on the goal of worthwhile objective, but is it achievable? Here Professor Richard Mattick of the National Drug of New South Wales told the committee: abstinence. For the remainder, heroin dependence have to talk about management not cure. to see some glimmer of hope for heroin addicts, it is a relapsing disease and we have to to admire the committee for its optimism. Even the committee goes on, in recommendation 54, to available to treatment services to provide comprehenwho are receiving pharmacotherapy: to stabilise their lifestyle; their use of all opioids, including methadone ... … … … that focus on abstinence as the ultimate outcome. is not a magic bullet when it comes to Mattick is again quoted in the report: and the risk of death and overdose is higher when viewpoint that only abstinence based treatfor funding of drug treatment programs in the is a zero tolerance strategy by another which ceases when a client relapses, and conlead to a revolving door cycle with NA addicts moving in and out of treatment. That lists and reduced funding for methadone programs. leads to. That is what happens when the focus parts of harm minimisation will always be affected. under attack. The most effective measures in reducing ing cuts in funding and restrictions on supply drug users are less than three per cent in Australia-thanks they are 10 times greater-more than 30 per cent. gies. That is where Australia The committee's refusal to even consider the cation of this hardening attitude towards one from overdose. The only people who are concerned wrong message are those with moralistic viewpoints setting a workable strategy for saving lives community. But they do not care about the lives is that ‘the wages of sin is death'. That This report sends a disturbing message to drug and alcohol treatment. The social workers, even the nuns who visit people in jails, are verely limits what they can achieve. The message making a worthwhile contribution. The people work in some of the worse conditions imaginable. not provide miracle cures, but they do keep people them. It fails to recognise the value of their funding and the frustration of being forced to help. The big dollars will go to the public relations fight the war on drugs. This report is a great in the field of drug and alcohol treatment. honest belief that their concerns would be listened time. After years of fighting for every scrap down the biggest snake on the board of the of hope that this inquiry offered has been snuffed portunism of some members of this committee. This inquiry covered many other areas of one part. Of the 128 recommendations, our dissenting some of the most important and far reaching In conclusion, I note that Australia's National That review will include an assessment of the supply, demand and harm to individuals and mittee's report makes a recommendation seeking tion to harm prevention. The report asks that the next stage of the National Drugs Strategy. is what is already happening with long waiting That is what a focus of harm prevention of harm minimisation is dropped: other key Needle and syringe programs are already the spread of HIV-AIDS and hepatitis C are facsites. HIV-AIDS infection rates for intravenous to harm minimisation. In the USA, That is the result of harm prevention strateis heading if we go down that path. benefit of safe injecting room trials is an indiof the most effective means of reducing deaths that harm minimisation is sending the who cannot see reason when it comes to and minimising the risk of harm to the greater of the victims of substance abuse. Their view is the consequence of taking illicit drugs. the many dedicated professionals in the field of the doctors and nurses, the counsellors, and already facing cuts to their funding, which sethis report sends them is that they are not who work with alcohol and illicit drug victims Their work is far from glamorous. They do alive. This report is a slap in the face to work and condemns them to a future of meagre turn away so many clients who are desperate for firms to dream up another fridge magnet to disappointment to those many dedicated people Those people came before the committee in the to, but it seems they were just wasting their of funding, they feel like they have just fallen drug-funding game of snakes and ladders. The ray out by the blinkered vision of political opconcern, and I know I have concentrated on only report only covered 10, but they were in their impact on drug policy in Australia. Drug Strategy is at present under review. national drug strategic framework on reducing the community. The final comments of the comto change that strategy from harm minimisaits recommendations assist in the formulation of Our dissenting report makes it clear that the NA committee's view is not unanimous and that advocated. I ask that the Ministerial Council views expressed in the dissenting report. This the doors on the lives of people with a drug I would like to extend my thanks to a number especially in the 39th Parliament when we Shelley MCInnis, who did an excellent job, and Margaret Atkin and Belynda Zolotto: thank you.",145
24,Mr CAMERON THOMPSON,MAIN COMMITTEE,"Blair) (12.08 port of the House of Representatives Standing into substance abuse to be of some considerable mendations that have been brought down as comments of the member for Fowler and I am ceipt and tabling of this report. From what member for Fowler and other members of the this report, they want to discredit it, and I think I have to say that it is not all of the members have been people on this committee from ured in their approach. But this sudden invective not a feature of her behaviour during the committee it is entirely in keeping with the spirit or geously full of invective that you would try shameful. Mrs Irwin-What about saving lives?",148
