speakerGroups,Speaker,Title,text,pageNumbers
0,NA,Unknown,"Wednesday, 8 August 2007 ----",17
1,The SPEAKER,Unknown,Hon. David Hawker) took the chair at 9 am and read prayers. NA AMENDMENT (CITIZENSHIP TESTING) LEGISLATION,17
2,Mr HOCKEY,AUSTRALIAN CITIZENSHIP,"North Sydney-Minister for Employment and Workplace Relations and Minister Assisting the Prime Minister for the Public Service) (9.01 am)-At the request of the Deputy Leader of the House, I move the motion relating to the suspension of standing and sessional orders for the consideration of the Australian Citizenship Amendment (Citizenship Testing) Bill 2007, the terms of which of order. I have a copy of the Notice Paper. Notice was submitted by the Deputy Leader of the House, Mr MCGauran, in whose name it appears. I was wondering whether or not a reason could be given to the honourable members as to why Mr MCGauran, having submitted this notice of motion, is not in the House to move it.",17
3,The SPEAKER,AUSTRALIAN CITIZENSHIP,I believe it is quite in order for another minister to move a motion like this in the absence of the first minister. I call the Minister for Employment and Workplace Relations.,17
4,Mr HOCKEY,AUSTRALIAN CITIZENSHIP,"At the request of the Deputy Leader of the House, I move: That: (1) so much of the standing and sessional orders be suspended in relation to proceedings on the Australian Citizenship Amendment (Citizenship Testing) Bill 2007 such that, at the conclusion of the second reading debate, not including a Minister speaking in reply, or at 1 p.m. on Wednesday 8 August 2007, whichever is the earlier, a Minister be called up the second reading debate and thereafter, without delay, the immediate question before the House be put, then any question or questions necessary to complete the remaining stages of the Bill be put without amendment or debate; and (2) any variation to this arrangement be made only by a motion moved by a Minister.",17
5,Mr CREAN,AUSTRALIAN CITIZENSHIP,"Labor oppose this, Mr Speaker. As I understand it, no notice has been given to us. The government is holding this parliament in contempt. It is abusing every process known to reasonable decision making. Yesterday we had to debate 500 pages of legislation, 300 pages of explanatory memoranda and 200 pages on appropriations-1,000 pages with 24 hours notice to consider them. Later today the Water Bill will be introduced, a bill which runs, as I understand it, to something like 300 pages. That is something the government announced on 25 January. It still has not been able to conclude agreements with the states but it wants this parliament to ram the legislation through-presumably in expeditious time, when we just got the bill yesterday, as I understand it. Now debate on a bill that has been on the Notice Paper for some time is to be guillotined without any notice. This is a bill which many members in this House have a real interest in because they represent constituencies that contain a lot of people from nonEnglish-speaking backgrounds, people who are interested in the future of citizenship in this country. Where is this parliament going, Mr Speaker? This is the point that we are making. There is no consultation. This is a government that cannot even consult with the states on water and now it will not consult with the opposition about procedures. Some consultation, Minister-well done! This was a circumstance in which you were lauding being on the eve of agreement with to sum the Victorians only some three weeks ago. Ms Julie Bishop-You know that was a stunt.",17
6,Mr CREAN,AUSTRALIAN CITIZENSHIP,"You know who was the stunt? The Prime Minister was the stunt, sending that letter to Premier Bracks andagain, without any warning-pulling the plug, saying the government were going to act unilaterally, just as they pulled the plug on Tasmania in its consideration of where public hospitals go, just as they are intervening in local government in Queensland and just as they have intervened in Eden-Monaro to prop up the member against a decision taken legitimately by the New South Wales government. This is a government out of control. This is a government abusing the states, picking a fight with the states at every opportunity, because it cannot get its own house in order. It is not getting this House in order; it is treating this House with contempt. This motion is just the latest manifestation of it, Mr Speaker. This is a disgrace and the Labor Party opposes it. No wonder this government is such a rabble. No wonder it is getting internal",18
7,Mr HOCKEY,AUSTRALIAN CITIZENSHIP,"North Sydney-Minister for Employment and Workplace Relations and Minister Assisting the Prime Minister for the Public Service) (9.05 am)-I move: That the question be now put. Question put. The House divided. [9.10 am] (The Speaker-Hon. David Hawker) Ayes………… Noes………… 53 Majority……… Abbott, A.J. Anderson, J.D. Andrews, K.J. Bailey, F.E. Baird, B.G. Baker, M. Baldwin, R.C. Barresi, P.A. Bartlett, K.J. Billson, B.F. Bishop, B.K. Bishop, J.I. Broadbent, R. Cadman, A.G. Causley, I.R. Ciobo, S.M. Cobb, J.K. Downer, A.J.G. Dutton, P.C. Elson, K.S. Entsch, W.G. Farmer, P.F. Fawcett, D. Ferguson, M.D. Gambaro, T. Gash, J. Georgiou, P. Haase, B.W. Hardgrave, G.D. Hartsuyker, L. Henry, S. Hockey, J.B. Hull, K.E. * Hunt, G.A. Jensen, D. Johnson, M.A. Jull, D.F. Keenan, M. Kelly, D.M. Kelly, J.M. Laming, A. Ley, S.P. Lindsay, P.J. Lloyd, J.E. Macfarlane, I.E. Markus, L. May, M.A. MCArthur, S. * MCGauran, P.J. Mirabella, S. Moylan, J.E. Nairn, G.R. Neville, P.C. Pearce, C.J. Prosser, G.D. Pyne, C. Randall, D.J. Richardson, K. Robb, A. Ruddock, P.M. Schultz, A. Scott, B.C. Secker, P.D. Slipper, P.N. Smith, A.D.H. Somlyay, A.M. Southcott, A.J. Stone, S.N. Thompson, C.P. Ticehurst, K.V. Tollner, D.W. Truss, W.E. Tuckey, C.W. Turnbull, M. Vaile, M.A.J. Vale, D.S. Vasta, R. Wakelin, B.H. Washer, M.J. Wood, J. NA Adams, D.G.H. Albanese, A.N. Bevis, A.R. Bird, S. Bowen, C. Burke, A.E. Burke, A.S. Byrne, A.M. 80 Corcoran, A.K. Crean, S.F. Danby, M. * Edwards, G.J. Elliot, J. Ellis, A.L. 27 Ellis, K. Emerson, C.A. Ferguson, L.D.T. Fitzgibbon, J.A. AYES George, J. Gibbons, S.W. Gillard, J.E. Grierson, S.J. Griffin, A.P. Hall, J.G. * Hatton, M.J. Hayes, C.P. Irwin, J. Jenkins, H.A. Kerr, D.J.C. King, C.F. Lawrence, C.M. Livermore, K.F. MCClelland, R.B. MCMullan, R.F. Melham, D. Murphy, J.P. O'Connor, B.P. O'Connor, G.M. Owens, J. Plibersek, T. Price, L.R.S. Quick, H.V. Ripoll, B.F. Roxon, N.L. Sawford, R.W. Sercombe, R.C.G. Smith, S.F. Snowdon, W.E. Tanner, L. Thomson, K.J. Vamvakinou, M. Wilkie, K. Windsor, A.H.C. * denotes teller Question agreed to. Original question put: That the motion (Mr Hockey's) be agreed to. The House divided. [9.15 am] (The Speaker-Hon. David Hawker) Ayes………… Noes………… Majority……… NA Abbott, A.J. Anderson, J.D. Andrews, K.J. Bailey, F.E. Baird, B.G. Baker, M. Baldwin, R.C. Barresi, P.A. Bartlett, K.J. Billson, B.F. Bishop, B.K. Bishop, J.I. Broadbent, R. Cadman, A.G. Causley, I.R. Ciobo, S.M. Cobb, J.K. Downer, A.J.G. Dutton, P.C. Elson, K.S. Entsch, W.G. Farmer, P.F. Fawcett, D. Ferguson, M.D. Gambaro, T. Gash, J. Georgiou, P. Haase, B.W. Hardgrave, G.D. Hartsuyker, L. Henry, S. Hockey, J.B. Hull, K.E. * Hunt, G.A. Jensen, D. Johnson, M.A. Jull, D.F. Keenan, M. Kelly, D.M. Kelly, J.M. Laming, A. Ley, S.P. Lindsay, P.J. Lloyd, J.E. Macfarlane, I.E. Markus, L. May, M.A. MCArthur, S. * MCGauran, P.J. Mirabella, S. Moylan, J.E. Nairn, G.R. Neville, P.C. Pearce, C.J. Prosser, G.D. Pyne, C. Randall, D.J. Richardson, K. Robb, A. Ruddock, P.M. Schultz, A. Scott, B.C. Secker, P.D. Slipper, P.N. Smith, A.D.H. Somlyay, A.M. Southcott, A.J. Stone, S.N. Thompson, C.P. Ticehurst, K.V. Tollner, D.W. Truss, W.E. Tuckey, C.W. Turnbull, M. Vaile, M.A.J. Vale, D.S. Vasta, R. Wakelin, B.H. Washer, M.J. Wood, J. NA Adams, D.G.H. Albanese, A.N. Beazley, KC. Bevis, A.R. Bird, S. Bowen, C. Burke, A.E. Burke, A.S. 80 Byrne, A.M. Corcoran, A.K. 54 Crean, S.F. Danby, M. * Edwards, G.J. Elliot, J. 26 Ellis, A.L. Ellis, K. Emerson, C.A. Ferguson, L.D.T. Fitzgibbon, J.A. George, J. Gibbons, S.W. Gillard, J.E. Grierson, S.J. Griffin, A.P. Hall, J.G. * Hatton, M.J. Hayes, C.P. Irwin, J. Jenkins, H.A. Kerr, D.J.C. King, C.F. Lawrence, C.M. Livermore, K.F. MCClelland, R.B. MCMullan, R.F. Melham, D. Murphy, J.P. O'Connor, B.P. O'Connor, G.M. Owens, J. Plibersek, T. Price, L.R.S. Quick, H.V. Ripoll, B.F. Roxon, N.L. Sawford, R.W. Sercombe, R.C.G. Smith, S.F. Snowdon, W.E. Tanner, L. Thomson, K.J. Vamvakinou, M. Wilkie, K. Windsor, A.H.C. * denotes teller Question agreed to. APEC PUBLIC HOLIDAY BILL 2007 First Reading Bill and explanatory memorandum presented by Mr Hockey. Bill read a first time. Second Reading",18
8,Mr HOCKEY,NOES,"North Sydney-Minister for Employment and Workplace Relations and Minister Assisting the Prime Minister for the Public Service) (9.17 am)-I move: That this bill be now read a second time. The purpose of the APEC Public Holiday Bill 2007 is to ensure that employees in the Sydney metropolitan area receive a public holiday on Friday, 7 September 2007 if they are covered by certain pre-reform industrial instruments, including transitional awards, pre-reform AWAs, pre-reform certified agreements and preserved state agreements. This public holiday is necessary to facilitate the holding of the Asia-Pacific Economic Cooperation meetings that will be hosted in Sydney over the week of 2 to 9 September 2007. The APEC Economic Leaders Meeting is one of the most important annual meetings of world leaders. In order to allow for the smooth running of the event, the New South Wales government has declared a one-off APEC public holiday for the Sydney metropolitan area for Friday, 7 September 2007. Currently, while many employees covered by the federal workplace relations system in the Sydney metropolitan area will receive public holiday entitlements for the APEC public holiday, some employees covered by pre-reform industrial instruments do not have an entitlement to this special one-off holiday. This bill proposes to ensure that all employees covered by these federal industrial instruments receive public holiday entitlements for the APEC public holiday. The public holiday will have effect in relation to workplaces within specified local government areas of metropolitan Sydney, not on the basis of a person's place of residence within those areas. Debate (on motion Mr Crean) adjourned. WATER BILL 2007 First Reading Bill and explanatory memorandum presented by Mr Turnbull. Bill read a first time. Second Reading",20
