speakerGroups,Speaker,Title,text,pageNumbers
195,Mr WINDSOR,MAIN COMMITTEE,"I sue to all of us in Australia-that is, dental and the changes that should take place. Given moment of moving into areas that they traditionally wealth to look very closely at this issue. It look at not only in terms of the Medicare arrangements some of the training arrangements. I know there there is a bottleneck with the delivery of dental the waiting list now. There is a need for a degree There was a program some years ago with For the life of me I cannot understand why rest of our bodily health when it comes to Medicare the little town of Bendemeer, Mrs Ruth Mathews, liament. I think some 3,000 petitions have make some moves in the dental care area. and I am sure many other Australians would in their Medicare levy for dental care to be included. This issue has been raised on a number of issue that we should be addressing when we ment on its economic activity in terms of surplus shake or half a sandwich back to people in terms there is surplus money, we should transfer with dental problems can avail themselves of problem with their foot, their hand or their heart. part of the election platform of all the major Minister, given his recent attitude,",165
196,Mr KEENAN,MAIN COMMITTEE,"I rise to this chamber on many other occasions, and that do anything about the Reid Highway in my electorate. now has access to a family relationship centre, new service to the southside community. local families and single parents. These are but a the past 2½ years. While the Bonner commumade, there is never time to rest and always our local roads and infrastructure, to addresslocal crime. With the support of the comof the Port of Brisbane Motorway, just as I halls in Bonner are given the means to install I am committed to Bonner. As the 2007 federal even harder to ensure that on a national level ever had so that at a local level even more posiDental Health rise today to talk about a very important iscare, the arrangements that are currently in place the air within the federal government at the blamed others for, I urge the Commonis an issue that they need to have a much closer for dental care but also in terms of is some movement in terms of training, but care-there are some 600,000 Australians on of federal intervention in relation to this. which the Commonwealth government did assist. dental health is considered to be different to the arrangements. A constituent of mine from has been working on a petition to the parbeen presented, urging the federal government to The 3,000 people who have signed the petitiontoo if we asked them-are prepared to pay more occasions by a number of members, and it is an have surplus budgets. I congratulate the governbudgets. But, rather than giving $2, a milkof tax cuts, we should address this issue. If some of that money into Medicare so that people the same provisions that they can if they have a There is a very real need for this issue to be parties. Hopefully, it will be one that the Prime will mention. (Time expired) Stirling Electorate: Roads talk about an issue that I have discussed in is the failure of the state Labor government to Last Friday I had the privilege of hostNA ing the Minister for Local Government, Territories fice to meet with members of the Balga Action campaigning for nine years for an overpass to Reid Highway in Mirrabooka Avenue. The minister as minister he has never, ever come across a cheque for $10 million. The Commonwealth had built, and astonishingly the state Labor Just to remind the House, this road is 100 ment. Yet extraordinarily, when the Commonwealth build infrastructure on one of their roads, they That money has now been reallocated in other will be spending that money. I think The local community, through a recent red nity newspaper group, the RAC and Channel intersection as the 16th worse in Western Australia. continues to say is the worse, based on figures Highway/Alexandra Drive intersection, was The intersection at Reid Highway and Mirrabooka that area develops further. I do not want to have order to get the state government to listen. It ing my colleagues to put that money back on the one of my local community newspapers, the nah MACTiernan, said something along the lines a federal Labor government.' She is essentially Labor, the state government is not going to put what this state government has come to. They narily arrogant and they are extraordinarily out of touch. It is disgraceful that they hold my electorate electorate that I will continue to be lobbying state government to put politics aside and join structure.",165
197,Ms GEORGE,MAIN COMMITTEE,"In January my constituent Michael Boscoscuro seeking on the PBS. Michael's letter set out the circumstances sclerosis at 18 years of age. Michael was a was expected to achieve dux of his school Despite ongoing and severe treatment, Bachelor of Commerce degree at the University sive nature of his condition and the limited decided that he should start a course of mitoxantrone. mum permissible dose of this drug. and Roads, the Hon. Jim Lloyd, in my ofGroup. The Balga Action Group have been be built at the very dangerous intersection of told the action group that in his 2½ years situation where a state government has torn up a offered $10 million for this overpass to be government minister tore up that cheque. per cent the responsibility of the state governcomes and offers them $10 million to fail to match the funding and accept this offer. parts of Australia, and 13 other local councils my community is pretty outraged by that. spot survey which was run by a local commu7 put the Reid Highway and Mirrabooka Avenue The intersection that the state government that they refuse to make public, the Reid not one that was rated by the community at all. Avenue is only going to get busier as another family suffer a devastating tragedy in is time now for action and I will not stop lobbytable. Extraordinarily, in the Stirling Times, WA transport and infrastructure minister, Alanof, ‘Well, we don't do anything until there is threatening my constituents-unless they vote any infrastructure into my electorate. That is are extraordinarily precious, they are extraordito ransom, but I give a commitment to my for this overpass to be built, and I call on the me in building this much needed local infraPharmaceutical Benefits Scheme this year I received correspondence from my assistance in having the drug Tysabri listed of his eventual diagnosis with multiple talented student and a competent sportsman who before he was struck down with MS. he battled on courageously and commenced his of Wollongong in 2006. Due to the aggresability of interferons to stabilise the MS, it was His is rapidly approaching the maxiNA In his letter to me, Michael pointed out slow the progress of the relapsing remitting chael said this: ‘Tysabri may not be a cure, but able at this time. But unless it is placed $36,000-would financially cripple In response to my representations, the government initial application for listing at its meeting manufacturer, I understand that a new application July. I appeal to the minister to ensure that manufacturer, Biogen Idec, is expedited. MS, as we know, is a devastating disease, most productive period of their lives. I understand sufferers in Australia. Many of these sufferers the end of the tunnel. Clinical trials have shown relapses, and yet its prohibitive cost puts urge the government to act expeditiously",166
198,Mr LINDSAY,MAIN COMMITTEE,"I am right behind my local community in thing in the media earlier this week which They are always writing to me and always talking problem all over the Commonwealth, and certainly about these irresponsible drivers. The suggestion was that the police be given Metal and turn it into a cube. The New South ther and said that the cube should then be taken particular hoon. I think it is a very popular community have to make up their minds. Do they hooning, or do they not? I reckon they want it that in the coming weeks, and I am going to think we are going to get a bit of support for that. I am also behind my community in relation to the parliament a number of things that well under construction. It will connect the and have a motorway standard as a bypass for of heavy trucks out of the suburbs. That is going about to officially attend the start of the laning of the Bruce Highway. The people see that happen. In the future, I want something done about frey Bay on Magnetic Island. It is the most dangerous isfactory way that our pedestrians can get across that Tysabri had been shown in trials to markedly form of MS which he suffers. In his words, Miit appears to be by far the best treatment availon the PBS, its prohibitive cost-that is, around most MS sufferers and their families.' advised that the PBAC had rejected an in November 2006. From my discussions with the was in fact submitted to the PBAC on 4 the consideration of the new application from the often hitting people-as it did Michael-in the that there are currently around 18,000 MS see the listing of Tysabri on the PBS as light at a remarkable 68 per cent reduction in clinical Tysabri beyond the reach of most MS sufferers. I and with compassion. Herbert Electorate: Crime Herbert Electorate: Roads to the Minister for Defence) (9.50 their concerns about local crime. I saw someI think my community would think a great idea. to me about hooning in Townsville. It is a in my city it is a problem: what to do the power to impound their car, take it to Sims Wales Police Commissioner went one step furand put on the front lawn of the house of that suggestion. It is a pretty tough penalty, but the want to do something that is effective about to be addressed. I am certainly going to look at ask my community how they feel about that, but I to their concerns about roads. I want to report have happened. The Townsville ring road is now Douglas arterial through to the Bruce Highway the city of Townsville. It will take a whole lot to be a great boon when it is open. I am also Woodlands Shopping Centre to Veales Road fouralong Mount Low Parkway will be very happy to the non-walkway between Nelly Bay and Geofpiece of road, with no footpath, no satbetween the bays, and it is the most popular NA walk on the bay. We must do something about the port access road which now needs to be nity that I will build that road and I will build the life of the next government we will I would also like to report to the parliament lia's roads ministers, Jim Lloyd and Mark Vaile, for their attention, and I thank them for the some great announcements in the not too distant future.",167
199,Ms GRIERSON,MAIN COMMITTEE,"I lems that people in Newcastle and all around healthcare services. Research released just last per cent of people reported that it would be difficult preventative dental treatment. The same number influences their decision to see a dentist regularly. have not seen a dentist for over two years. missions for preventable dental conditions public dental waiting lists. To take just one example from my electorate office seeking assistance. He had been having dentures. After failing to be able to access any months, he finally went to a private dentist and on a pension and is, as you can imagine, barely may even increase after today. How did it come to this? We have pensioners One of the most infamous decisions of the years ago was to abolish the $100 million a over $1 billion the Howard government has years. That is a lot of money, so what would if you are the Howard government hell-bent bought a lot of advertising. In fact, it is ernment has actually spent $2 billion on advertising wealth dental programs worth of advertising 650,000 people wait for treatment. People all over this nation are asking the People have been asking why the Howard government the Howard government's response, currently, buck-passing and the same old blame game. The should direct their concerns to the state governments. think that public dental care is appropriately response. The survey found that 75 per cent least share the funding for dental care. ... Australians are interested in good outcomes, it, and I am going to do something about it. On built, I have given a commitment to my commuit sooner rather than later. I am hoping that in see a start on the port access road. that I have had meetings with both of Austrawith a North Queensland focus. I thank them support that they are giving me. I hope to make Dental Health rise today to share with the House the probAustralia are facing in accessing vital dental week by the Australia Fair group found that 46 for them to pay the $300 needed for basic of people said that the cost of dental care Twenty-three per cent of people said they We know that there are about 50,000 hospital adeach year and that there are 650,000 people on last year, one of my constituents contacted our significant problems with his teeth and needed public services, being told that it would take 18 paid the $4,300 fee with his credit card. He is keeping on top of the interest charge, which putting dental treatment on their credit cards. Howard government when it came to power 11 year Commonwealth dental program. That is just not spent on dental health care in the last 11 it have bought? What does it actually buy? Well, on spending its way back into power, it has uncanny when you look at the numbers-this govin that 11 years. That is two Commonthat we have seen the money spent on, while government to do something about dental health. has abandoned working families and is to blame the states. It is the same old tired Minister for Health and Ageing says, ‘People They need to take responsibility and I in that domain.' People do not care about that of Australians think the Commonwealth should at As the Prime Minister himself said recently: they're not interested in theories of governance. NA Here is a good outcome: Kevin Rudd and federal tal program to make dental care accessible to Labor will end the Howard government's wealth can and should be doing",168
200,Mr BAIRD,MAIN COMMITTEE,"I wish to join the Cronulla Surf Life Saving Club on achieving day there was a special ball held at the Westin the annual general meeting last Sunday on people. This, in the Year of the Surf Lifesaver, part of the group of foundation clubs involved How do you judge a surf club as to how it clubs are iconic in themselves? Cronulla surf Australia's history. How do we judge it? Firstly, the past 100 years, members of the club have lost-a remarkable achievement. Secondly, the most successful clubs in the history of surf only club to win three consecutive world, Australian, scores. Finally, you judge a club according to the strong bond between the members. They are certainly in my electorate and, I think, within president, who is an outstanding surf champion John Holt, an Australian who is part of the Australian ther winners of Australian surf life saving his sister Kate, Peter Tibbitts, Nick Dixon the boat crews. Of course, there is also the come from the one family. Nathan and Krystal South Wales ironman and ironwoman of the year Chris Allum, this year's winner, who is also ship forum here in the parliament this year It is a wonderful club, superb people are involved cent and I congratulate them, in this the Year niversary.",169
201,The DEPUTY SPEAKER,MAIN COMMITTEE,"Order! 193, the time for members' statements has concluded. NATIONAL HEALTH AMENDMENT (NATIONAL HPV VACCINATION PROGRAM Debate resumed from 20 June, That this bill be now read a second time.",169
