speakerGroups,Speaker,Title,text,pageNumbers
227,Mr BILSON,MAIN COMMITTEE,"I speak Frankston-Mornington Peninsula area about port system, and I refer specifically to the Frankston-Mornington Peninsula area. Most Victorians area of extreme growth in population. Over summer, people from the greater Melbourne area and beyond. What we have seen is a welcome announcement money for ambulance services. But embedded good news for our community, which needs improvements to strip the area of its highly valued MICA stretcher-bearing vehicle that can attend trauma tims, some of the most demanding medical circumstances mentioned, is a vast and growing region. The plan is to replace that two-person paramedic in a sedan. I understand that in some pathway. There is some belief that, if there is vehicle or additional MICA or paramedic support, What we know on the Mornington Peninsula is coincidence of availability is not great. So has risen up to raise this issue with the state government. We are pleased that there has been a reprieve, to operate this new format-this ‘reconfiguration' gives the state government, and in particular exacerbated by the explosion in casualisationin the Western world, after only SpainToday, there are over two million workers in of the OECD, which is being paid less than That is almost a quarter of our workforce. of a book, Living low paid, by Helen Mastermanstudy over a couple of years supported by the to this place; the Brotherhood of St Laurence; South Australia. For that book in-depth interworkers, cleaners and room attendants in only the financial hardship that flows from being over the hours of work that they experience and to live full and fruitful family lives and value as a member of our community. I want to of their physically demanding and hazardous labour and educational demands of their why their unsocial hours and exposure to dangerpay.' This is an incredibly valuable study, and Professor Pocock. (Time expired) Dunkley Electorate: Health today about the grave concerns in the greater proposed changes to our emergency health supdual-person MICA unit that covers the greater would know that this is a vast area, an there is an influx of tens of thousands of by the Brumby government of additional within this announcement-which should be in its ambulance service-is a plan 6 paramedic dual-person unit, which operates a victims, car accidents and heart attack vicon the peninsula, which, as I have MICA ambulance with a single operator MICA parts of the world that may be an attractive a critical incident that requires a stretcher bearer a second vehicle may arrive to attend. that with our vast area the likelihood of that concerning is this move that the whole community borne out of an inability to recruit personnel as it is being described. I hope this reprieve the ambulance service and the health minister, a NA chance to revisit this topic. How often do you on ‘Save MICA 6' outlining the grave concerns such as Kevin Grahame, who is reported in the dual-paramedic layout, he would not be with speaks very warmly of that dual-composition themselves plead with the minister to revisit their professional experience. And how often area, ranging from health professionals, specialists is a bad decision-a retrograde step at a time ting in more resources? We must keep the MICA expired)",168
228,Mr CHAMPION,MAIN COMMITTEE,"Today and the components industry and their vital a quarter of the workers employed in the Playford Vale through to Munno Para, are employed ployed in the car manufacturing sector in particular. North: it was striking that, as I went street Bridgestone-literally two or three in every street. that the automotive industry has a strong I have had a lot of meetings with the union-in John Camillo, and the state secretary of the meetings with local delegates at Holden-in steward at Holden-and more generally with all OH&S reps at the factory. I am very glad that local level with me to try and get the best The government's response to the Bracks automotive manufacturing sector a strong and the cars produced in places like Holden into efficient vehicles. That is to be commended, which is really designed to transform the industry skilled ‘green-collar' industry. I would particularly $3.4 billion assistance program-the Automotive 2011 to 2020. There will be changes to the worth $79 million. Most importantly, there will ment through consolidation in the components ment. That is terribly important because so changes in the industry. There will be $20 million with the global supply chain. That is also to be commended.",169
229,Mr ANTHONY SMITH,MAIN COMMITTEE,"I to mention an important event I attended recently, for La Trobe and the member for Wannon. I see a community rise up to take out a petition they have? How often do you see victims newspaper as saying that, if it were not for the us now, he would not have survived? His wife team. How often do you see the paramedics the subject? So concerned are they, based on do you see wall-to-wall clinicians in a regional and even local hospitals, all saying that it when the state government is claiming it is put6 dual-person unit on the peninsula. (Time Automotive Industry I wish to talk a bit about the car industry importance to the electorate of Wakefield. Nearly Council area, which covers from Elizabeth in manufacturing. There are an awful lot emI remember door-knocking in Salisbury by street, I met workers from Futura, Holden and So it is of vital interest to my electorate and viable future in this country. particular, the state secretary of the union, vehicles division, Jon Gee. I have had regular particular, Paul Brown, who is the senior shop of the reps, both the shop delegates and the the union has been such a good advocate at the possible response from the Bracks report. report is to be commended. It aims to give the viable future in this country by transforming both environmentally friendly and more fuelgiven the challenges we face. It is a 13-year plan from a blue-collar industry to a highly like to acknowledge that we will have a Transformation Scheme-running from current ACIS scheme to smooth the transition, be $116 million to promote structural adjustsector and to facilitate labour market adjustmany workers are affected by some of the big to help suppliers become better integrated Kyeema Air Crash want to take the opportunity this morning on 25 October, together with the member attended a memorial service to commemorate the NA 70th anniversary of the crash of the Kyeema, Essendon airport in 1938. Tragically, it crashed, outer east of Melbourne. Madam Deputy Speaker history. It is still Victoria's worse air crash. in the infancy of Australian aviation. A state-of-the-art heavy weather. The crew mistook their bearings, they were some 30 miles ahead of where they into the side of Mount Dandenong. It shocked I mentioned that I was at the service with gers on board was Charles Hawker, a relative had been a federal minister in the Lyons government the time. Another notable Australian on board us. It was great to see his son Sir James Hardy of that tragic event. Mount Dandenong was a wonderful place casion and to see the families come along, curred on that day, at that place, at that weather. Witnesses from the time said that it that they could recall in their lifetime. You The tragedy was that the plane crew thought they crashed into the top of Mount Dandenong. to the day, though, because we heard how that form and safety reform in Australia from that point on.",169
230,Ms LIVERMORE,MAIN COMMITTEE,"I week, on Melbourne Cup day, of visiting the the road from my electorate office. I was learn about what Bush TV is doing and to hear an Indigenous social marketing and media agency. the producers of the Murri Minute. Bush TV tion company and a training organisation. or out at Woorabinda, a nearby Indigenous broadcasting and media skills and to develop media products. It is working very well. Murri Minute every so often on TV, telling achievements and the initiatives Bush TV is really starting to hit its straps, with organisations like National Indigenous and Islander Network. It is getting a lot particular. Bush TV uses 85 per cent Indigenous government is using it a great deal to get health. Bush TV staff go into communities material to get these important social messages across. a DC-2 plane that was en route from Adelaide to in heavy fog, into Mount Dandenong, in the Burke, you would be very familiar with the All 18 people on board died. It was a tragic story plane, of the time, got lost in very mistook Sunbury for Daylesford. In fact, thought they were and, in heavy fog, crashed Australia and the aviation industry. the member for Wannon. One of the 18 passenof David Hawker, the member for Wannon. He and he was a member of parliament at was Thomas Hardy, a name familiar to many of at the memorial service, with his recollections to be to remember what was obviously a sad ocmostly from Adelaide, to remember what had octime, 1.45 pm. The plane came down in unusual was the worse day of weather in the Dandenongs literally could not see the top of the Dandenongs. they were on descent to Essendon airport but There was good news and a positive element crash signalled the start of major aviation reBush TV had the great pleasure and privilege last offices of Bush TV in Rockhampton, just down there with my colleague Senator Clare Moore to about some of its new initiatives. Bush TV is It is well known in Central Queensland as is an organisation that works both as a producIt helps young Indigenous people in Rockhampton community, to get certificates I, II and III in the skills and competence to create their own As I said, for some years now we have seen the stories about local Indigenous people, their that are going on in their community. starting to branch out. It is picking up contracts TV and Imparja, through the Regional Aboriginal of work from the Queensland state government in staff to produce its material. The Queensland messages out about water efficiency, safety and and work with communities to develop their own NA I will be meeting later this week with some TV is doing and to tell them about the potential it. Instead of getting a health message out that could actually get an organisation like Bush training local Indigenous people in those communities skills. Congratulations to the team at Bush and I will certainly enjoy telling people about spend the day with Kaleen and Gabrielle, the there. We want to see a lot more of Bush TV. (Time expired)",170
231,Mr FARMER,MAIN COMMITTEE,"With to speak-although I will be speaking on this state Labor government in New South Wales-I this House to the way the New South Wales this country. We have seen everything in years. I have seen health services go backwards, member for Macarthur and seen paint peeling blocks flooding and I have seen classes of appalling parliament have seen exactly the same. We all transport infrastructure, transport hubs, hospitals New South Wales failing in their duty of care and like everyone can very easily see, they I was thinking about our crest and about selected those animals, the kangaroo and the backwards. I have made a bit of a mock-up of feet of the two animals, the lion and the kangaroo, done another one of the whole country with the New South Wales government are doing to try backwards. I seek leave to have Leave not granted.",171
232,Mr FARMER,MAIN COMMITTEE,"I do not think the people of try can put up with the New South Wales government every single person in New South Wales to Wales, a lovely lady, to ask her to please because this country simply cannot afford for Our transport costs are going up yet services up and services are diminishing, and school Teachers are crying out for extra teachers and bus passes are being cancelled, and it costs $350 just to send their kids to school because",171
233,Ms NEAL,MAIN COMMITTEE,"I rise to my constituents, to bring to the attention of of my federal colleagues to tell them what Bush for the federal government to also start using has been produced in some Sydney studio, they TV to do that work and, in the meantime, be to have those broadcasting and media TV. I have known about them for some time now, them in the federal parliament. It was great to trainees, and Tom Hearn, who is the manager New South Wales Government the limited time of three minutes that I have subject during the course of the reign of the would like to bring everyone's attention in state government is pulling down the whole of New South Wales go backwards over the last 10 I have visited schools in my capacity as the off the classroom walls, I have seen toilet sizes. I know members from both sides of care about our electorates. We all care about and our health. Time and time again we see to the taxpayers of New South Wales. As I say, are pulling the whole country backwards. how we selected the two animals on that crest. We emu, because they had the ability not to go the New South Wales crest, and it indicates the with their feet going backwards, and I have their feet going backwards because this is what our country. They are sending the whole counthe documents incorporated in Hansard. New South Wales or the people of this counfor another two years. I am calling on write a letter to the Governor of New South sack the New South Wales state Labor government them to stay in power for another two years. are diminishing, our hospital costs are going fees are going up yet services are diminishing. support and they are not getting them. School people in Western Sydney, in some cases, up to bus passes have been cancelled. (Time expired) Robertson Electorate: Interest Rates speak on a matter that actually does matter to members the plight of one family in my electorate NA of Robertson during this time of economic uncertainty. son are struggling with rising living costs, including pling mortgages, this couple-to protect their which are not their real names-contacted me ner, Tony, runs his own business. As part of with GE Money. This loan carries a high interest Michelle and Tony wrote to me and raised concerns loan rates and, of course, the Reserve Bank's to pass on none of the recent one per cent drop customers-a complete disgrace. Subsequently, 0.75 per cent reduction provided by the Reserve by the bank that they face a penalty of $5,000 Money to any other lender. The Reserve Bank's recent cuts in official tralians as a timely response to the weakening Australia. While the major banks have not passed tomers, their actions in passing on most of striving to buy their own homes. The actions lot to be desired. GE Money now, following Wizard Home Loans, Australia's largest wholesale $38 billion in Australia and New Zealand. Globally, GE Consumer Finance are a market $117 billion and more than 100 million customers million customers in Australia, including 350,000 strength, they have seen fit in recent times, pass on none of the reductions. I can only say ately pass on the reductions in interest",171
234,The DEPUTY SPEAKER,MAIN COMMITTEE,"Order! 193 the time for constituency statements has concluded. NA Debate resumed from 23 October, That this bill be now read a second time.",172
