speakerGroups,Speaker,Title,text,pageNumbers
105,Mr SNOWDON,QUESTIONS WITHOUT NOTICE,"I thank the member for his question and his interest in this very important subject. I first became acquainted with the horrors of petrol sniffing when I was working in and out of the Ngaanyatjarra Pitjantjatjara Yankunytjatjara Lands of Central Australia in the late 1970s and early 1980s. Over the period, many things have been tried to address what is really a dreadful problem for many individuals and communitiessomething which has split families-and, obviously, young people, who are dying very much earlier than they should. Many strategies have been tried. One which was introduced by the now Leader of the Opposition as Minister for Health and Ageing was the rolling out of Opal fuel, which is a BP product, starting in 2005. In 2008, the government did an evaluation of the program of rolling out Opal fuel and discovered that we were able to reduce petrol sniffing in the communities which were surveyed by 90 per cent over the period. As a result of that, the government further took a decision to roll out Opal elsewhere. You are right: in March of this year we took a decision, and Minister Roxon, Minister Macklin and I announced the rollout of Opal fuel into the Kalgoorlie region, a $2.3 million project to roll this out, working with BP, who would supply the fuel. We would pay for the storage and they would then distribute it. Unfortunately, as you have noted, it has not come to pass, mainly through technical difficulties confronted by BP in getting the facilities in place in Kalgoorlie. However, I am assured by BP that they are looking at providing alternative strategies to ply Opal into the communities by the end of the year, subsequent to the completion of the fuel storage facility, which will be in the middle of next year, we believe. So we are hopeful that we can get Opal into the communities in a far more sustainable and reliable way by the end of this year or early next year, thus providing the opportunity for people in those communities who retail fuel to substitute Opal for their regular unleaded fuels. You asked me about what we can do to prevent regular unleaded fuels being introduced into these communities. Frankly, not a lot. What we have done is look at the possibility of mandating the supply of Opal fuel, but we have taken the decision that it is better in the first instance to provide voluntary compliance. However, we do have in our back pocket the possibility at some future point, if we are not successful in rolling out Opal in those communities that need it, to look at a legislative option. I should say that in the last budget we announced $38.5 million of new expenditure to roll out Opal into 39 additional communities across the Top End of Australia, starting in the western Arnhem Land region around Jabiru and Gunbalanya. That is happening as of December. As with the rollout of the fuel in Ngaanyatjarra communities, we will obviously have a public communications exercise to assure consumers that Opal will not affect their motors either in their vehicles or, in the case of Gunbalanya, in the small boat motors of fisherfolk. It is very important that we adhere to this strategy of rolling out Opal fuel into these communities. It is an extraordinarily successful project which, as I said earlier, was initiated in the first instance by the current Leader of the Opposition. But I am hopeful that we will be able to satisfy the needs of supthe Ngaanyatjarra Lands in the not too distant future. Climate Change",74
106,Mr HUSIC,QUESTIONS WITHOUT NOTICE,My question is to the Minister for Foreign Affairs. Will the minister advise the House what the government is doing to assist developing countries to tackle climate change and what key emerging economies are doing to reduce their emissions?,75
107,Mr RUDD,QUESTIONS WITHOUT NOTICE,"I thank the honourable member for his question. For many of the most vulnerable countries around the world, climate change represents an existential threat",75
108,Unknown,QUESTIONS WITHOUT NOTICE,Opposition members interjecting,75
109,Mr RUDD,QUESTIONS WITHOUT NOTICE,"countries like Kiribati, countries like Tuvalu and countries like the Maldives. I find it remarkable that members would find this a matter of humour in this place. If you were to speak with the presidents of Tuvalu, Kiribati and the Maldives, they would have a different reaction. Furthermore, for many of the poorest countries in the world, climate change represents a fundamental challenge to economic development in terms of coastal inundation, water scarcity and the forced migration of populations. Again, those opposite, including the honourable member who interjects most volubly with his laughter: the President of Bangladesh has said to us in recent meetings that 40 million of her country's population lie potentially vulnerable to the inundation the southern part of Bangladesh should climate change continue unabated. Those opposite may find this to be amusing. We on this side of the House find it not to be amusing but instead to be the basis of intelligent international public policy. When the countries of the world gathered at Copenhagen, they decided through a Copenhagen accord on four courses of action. One was an agreement for the first time that temperature increases across the world should be kept within two degrees Centigrade. Secondly, they agreed that, when it comes to the burden to be shouldered to keep temperature increases within that range, it should be undertaken by both developed and developing countries, for the first time. Thirdly, there should be a global system of measurement, reporting and verification so that states which commit to courses of action are held accountable for their commitments. And, fourthly, for the most vulnerable states, the countries of the world agreed on a $30 billion allocation by the year 2012 to assist them with the immediate tasks of adaptation. Since then, for the information of the House, 140 states around the world have now acceded to the Copenhagen accord. Australia is playing its part in this respect. We have allocated some $599 million out to the year 2012 to assist in a number of specific areas. Twenty-five per cent of that funding is to go to those countries which are small island states and most vulnerable states, and I have listed some of them already, and 25 per cent will go to those who are dealing with the problems of avoided rainforest degradation. These are practical courses of action which assist with adaptation and mitigation for climate change purposes. For example, in the island republic of Tuvalu we have used this allocation of funds to assist with the provision of some 576 additional water tanks to provide for water of storage on that highly exposed island in the Pacific. We are allocating $70 million to work with Indonesia on avoided degradation of rainforest across an area of some 120,000 hectares of the Indonesian republic. We see actions undertaken by developed and developing countries around the world. In China we see actions to reduce energy intensity. In India we see actions to reduce energy intensity. In New Zealand a decision has agreed on a reduction in carbon by introducing a price on carbon through an emissions trading scheme. These are the actions of responsible governments around the world, developed and developing, and Australia is also rising to the global challenge. (Time expired)  Speaker, the opposition feels that the foreign minister has more to say and I therefore move: That Mr Rudd be granted an extension of time. Question agreed to.",76
110,Mr RUDD,QUESTIONS WITHOUT NOTICE," Mr Speaker, I am most grateful to the Manager of Opposition Business and I make one single point. Around the world this is taken seriously. By those opposite it is regarded as a joke. Asylum Seekers",76
111,Mr CHRISTENSEN,QUESTIONS WITHOUT NOTICE,"My question is to the Prime Minister. I refer to a Pakistani immigration official's assessment of Australian migration policy, and I quote: It [people-smuggling] is increasing and the is very simple: you're not doing anything positive to stop it. You're sending all the wrong signals. …If you're going to be so friendly then of course you're going to get more people. Isn'the right, Prime Minister? Mr Albanese-I rise on a point of order, Mr Speaker. Under standing order 100, that clearly does not contain any detail of who the quote is from, what the context is, where it is from or any evidence.  order, standing order 100 specifically says that names should not be used unless strictly necessary. The point of the question is the actual quote and that the government is not doing anything other than attracting people, and the Prime Minister is being asked to comment on the government's policy.",77
112,The SPEAKER,QUESTIONS WITHOUT NOTICE,"This is a dilemma for the chair because I am in the position that I am being asked to decide whether the naming of the official is required to make the question intelligible to the extent that it can be properly answered. I really do think that in cases like this when somebody overseas is being quoted there should be identification. I will leave it in the hands of the Prime Minister whether she chooses to reflect upon the quote that has been given, but I would say to the member for Dawson that there should be much more precision in identifying a person who is making the quote that he is asking for a response to.",77
113,Ms GILLARD,QUESTIONS WITHOUT NOTICE,"If I could give a new member of the House a tip: don't take castoffs from the shadow ministers of questions they are too embarrassed to ask. It normally gets you into trouble. I am not surprised that they would be too embarrassed to ask this one, because obviously it is a completely unnamed, unidentified source, and whoever it is and wherever the words are from they are completely wrong. As a government we have more assets patrolling our borders than reason ever before. We have a stringent mandatory detention policy. We have made some moves in relation to the circumstances of children. If the member is opposed to them, if the Leader of the Opposition is opposed to those changes in the interests of children, then stand up and say so. We are still waiting for a policy response from the opposition because of their internal divisions on this question. Whilst the opposition continues to play cheap politics-three-word slogans, stop this, end that, wreck, demolish-we will get on with the job of delivering in the national interest while the opposition stews in its own juices of bitterness, looking to impose that bitterness on the Australian people, putting their political interest in front of the national interest each and every time. The Australian people deserve better than this.  der. I seek leave to table the article in the Australian of 1 November which refers to the quotation, so that it can be put beyond any doubt. Leave not granted.",77
114,The SPEAKER,QUESTIONS WITHOUT NOTICE,"I simply say that some of the devices that have been used today make me think that some of the people should reflect upon them. The Manager of Opposition Business was involved in the point of order about identifying who the officer was. The Leader of the Opposition and the Manager of Opposition Business are incredulous but, if we are to see stunts like this, where the information was available and could have been given to the member for Dawson, the generosity that I displayed to the member for Dawson as a new member will not be as forthcoming. The alternative was that I could have ruled the question out of order. Climate Change Mrs D'ATH (3.31 pm)-My question is to the Minister for Sustainability, Environment, Water, Population and Communities. Will the minister outline the threat to the Great Barrier Reef from climate change and provide an update on government action to manage this threat?",77
115,Mr BURKE,QUESTIONS WITHOUT NOTICE,"I thank the member for Petrie for the question. As a Queenslander, the member for Petrie has a strong understanding of the economic benefits of the Great Barrier Reef, but today I want to talk about both the environmental importance of the Great Barrier Reef and also the environmental threats from climate change. When we can easily lose the context of just how unusual the system that we have in the Great Barrier Reef is by international standards, we could look at a place like the Caribbean, where the reefs have 60 different species of coral compared to our own Great Barrier Reef, with 560 different species of coral. The reef is under threat very directly through climate change in a few ways: first of all, through significant increases in ocean temperatures; secondly, through increased acidification of the ocean; and, thirdly, through the impact of more major weather events. The impact of those major weather events is clear: as cyclones go through, the health of the reef is compromised immediately, both through the destruction of coral and also through the increased run-off of floodwaters, as they often bring nutrients and agricultural chemicals down to the Great Barrier Reef. Added to that you have the impact of bleaching, which occurs through the increased ocean temperatures which are being seen in the area. There is also increased acidification of the ocean. We often talk about the role that trees and forests have as carbon sinks. We forget the extent to which the ocean also plays that role. As it does, though, carbonic acid is formed and the pH of the ocean has fallen by 0.1-towards a higher level of acidification. That has an impact. It does not kill the coral, but it means the coral grows more slowly. When you add the impacts together-the impact of major weather events and bleaching events-there is a need for the reef to recover, and with increased acidification that recovery happens more slowly. It means there are some really significant challenges to the reef by virtue of climate change. In dealing with that, as well as the government dealing with the causes of climate change, it is also important that we do what we can to improve the health of the reef so that recovery, even as these events occur, can at least happen in a more resilient ecosystem. That is why the government, ever since 2007, has been involved in the Reef Rescue program, working with $200 million under Caring for our Country and working directly with the graziers and the cane growers up and down the Queensland coast to change their systems. We have situations now where cane growers have managed to plot each square metre of their cane fields and connect that to a GPS, and they are able to locate very precisely where chemical and fertiliser is added so that no more than is required is used. When the rains then come, the run-off is reduced. Similar work is being done with beef producers to try to improve the ground cover so that run-off is diminished. This provides a greater opportunity for the reef to be a healthier system. Mr Christensen interjecting",78
116,Mr BURKE,QUESTIONS WITHOUT NOTICE,"The member for Dawson, of all people, should understand this, because so much of the economy of his seat is reliant on there being a healthy reef system, a healthy Great Barrier Reef, to preserve the ecology of what is-at least members on this side of the House understand, Member for Dawson-one of the most precious systems in the world. Ms Gillard- Mr Speaker, I ask that further questions be placed on the Notice Paper. NA",79
117,Mr ALBANESE,DOCUMENTS,Documents are presented as listed in the schedule circulated to honourable members. Full details of the documents will be recorded in the Votes and Proceedings and Hansard. I move: That the House take note of the following documents: Australian Fisheries Management AuthorityReport for 2009-10. Executive Director of Township Leasing-Report for 2009-10. General Practice Education and Training-Report for 2009-10. Migration Act 1958Section 91Y-Protection visa processing taking more than 90 days-Report for the period 1 March to 30 June 2010. Section 440A-Conduct of Refugee Review Tribunal (RRT) reviews not completed within 90 days-Report for the period 1 March to 30 June 2010. Migration Review Tribunal and Refugee Review Tribunal-Report for 2009-10. National Capital Authority-Report for 2009-10. Debate (on motion by Mr Hartsuyker) adjourned. NA Cyber-Safety Committee Membership,79
118,Mr ALBANESE,COMMITTEES,"by leave-I move: That: (1) paragraph (2) of the resolution of appointment of the Joint Select Committee on Cyber-Safety be amended to read: That the committee consist of 11 members, 4 Members of the House of Representatives to be nominated by the Government Whip or Whips, 2 Members of the House of Representatives to be nominated by the Opposition Whip or Whips, 2 Senators to be nominated by the Leader of the Government in the Senate, 2 Senators to be nominated by the Leader of the Opposition in the Senate and 1 Senator to be nominated by any minority group or groups or independent Senator or independent Senators; and (2) a message be sent to the Senate acquainting it of this resolution and requesting its concurrence. Question agreed to. Parliamentary Library Committee Membership",79
119,Mr ALBANESE,COMMITTEES,"by leave-I move: That: (1) paragraph (6) of the resolution of appointment of the Joint Standing Committee on the Parliamentary Library be amended to read: That the committee shall elect 2 of its members to be joint chairs, 1 being a Senator or Member who is a member of the government party or parties, and 1 being a Senator or Member who is a member of the nongovernment parties, provided that the joint chairs may not be members of the same House. The joint chair nominated by the government party or parties shall chair meetings of the committee, and the joint chair nominated by the non-government parties shall take the chair whenever the other joint chair is not present; and (2) a message be sent to the Senate acquainting it of this resolution and requesting its concurrence. Question agreed to. NA",79
120,Mr BOWEN,PERSONAL EXPLANATIONS,"MCMahon-Minister for Immigration and Citizenship) (3.37 pm)Mr Speaker, I wish to make a personal explanation.",80
121,The SPEAKER,PERSONAL EXPLANATIONS,Does the minister claim to have been misrepresented?,80
122,Mr BOWEN,PERSONAL EXPLANATIONS,I do.,80
123,The SPEAKER,PERSONAL EXPLANATIONS,Please proceed.,80
124,Mr BOWEN,PERSONAL EXPLANATIONS,"Yesterday, the member for Cook claimed that I had misrepresented him by pointing out that his claim that offshore refugee and skilled migration visas are not subject to judicial review is wrong. In fact, the member for Cook has misrepresented me and misrepresented the law. The Migration Act requires that any valid visa application must be considered against the visa criteria and if the application meets the criteria it must be granted and if it does not it must be refused, regardless of whether the application is made offshore or in Australia. Furthermore, any decision to refuse a visa application is subject to review by the High Court. The member for Cook appears patently unaware of this. NA",80
125,The SPEAKER,MATTERS OF PUBLIC IMPORTANCE,"I have received a letter from the honourable member for Warringah proposing that a definite matter of public importance be submitted to the House for discussion, namely: The failure of the Government to deliver a plan for managing the Australian economy. I call upon those members who approve of the proposed discussion to rise in their places. More than the number of members required by the standing orders having risen in their places",80
