speakerGroups,Speaker,Title,text,pageNumbers
186,Ms SMYTH,DONATIONS AND OTHER,"It was unions who were much maligned in the member for Mackellar's remarks previously about those who had campaigned somewhat steadfastly against the opposition leader and the member for Mackellar's Work Choices regime. She anticipates, I believe, that others in this debate will seek to malign corporate donors. Here is a revelation: I do not propose to do so because I think that we are more than capable of articulating a positive position on the bill which is put before us-the bill which so effectively provides for significant reforms to electoral campaign requirements. The changes proposed to be made by this bill are considerable and they are detailed. In the main, however, the bill deals with three central objectives. It increases the transparency of disclosure obligations relating to political donations and provides for more frequent and prompt reporting of political expenditure and donations. The reforms do not set out to create additional or unnecessary administrative obligations for parties or individuals but seek to increase the transparency and the integrity of the election system. It is quite extraordinary then that the members opposite would be seeking to oppose such a straightforward and fairly innocuous piece of legislation. Public perceptions of the sources of funding available to political parties and individuals are naturally linked to the regard in which our political system is held. Thorough disclosure of sources of election campaign funding ensures that the electorate can satisfy itself of the independence of policy decisions from undue influence or interference. The history of this legislation has been quite protracted-so much for the legislative rush described in the remarks of the member for Mackellar. The reforms are, as might be expected, detailed and comprehensive. They have involved deliberations over a considerable period of time and it is now timely indeed that they proceed. The government has sought to reform election funding and political donations for some time. The first bill to address these issues was introduced in of order: the standing orders require the vote that was delayed in the dinner break to be called on at eight o'clock. I am just wondering why that would not have been done.",139
187,The DEPUTY SPEAKER,DONATIONS AND OTHER,"I have taken the view that the deferred division should not proceed until the member speaking at 8 pm has completed his or her speech, so I did not interrupt the member.",139
188,Ms SMYTH,DONATIONS AND OTHER,"I was remarking on the legislative history of this bill. Members who were present during the last term might recall that the Joint Standing Committee on Electoral Matters had initially delivered its advisory report on that bill in October 2008. In December 2008, the government tabled amendments to the bill in response to that report. Disappointingly, that bill was rejected by the Senate. The government tried to introduce another bill in early 2009, but again, unfortunately, the second bill lapsed with the end of the last parliament. Given the protracted nature of deliberations around the reforms proposed in this bill and the recalcitrance of members of the opposition to date on the topic, it is important that the bill be enacted as law as soon as possible and that the commencement date of 1 July 2011, contemplated in the bill, should have effect. This government has demonstrated its ongoing commitment to electoral reform in this area by pursuing reform at the earliest opportunity available to it. I hope that other members ultimately in this place will be as committed to genuine reform of campaign finance in Australia. The member for Mackellar remarked earlier this evening that the opposition would like to advocate for further reform. Unfortunately, we have heard little of it and their obstruction on this matter paints a fairly unpalatable picture of their commitment to election reform generally. The practical reforms which are proposed in this bill will have a significant impact upon the functioning of our electoral processes and, ultimately, the representative nature of our democracy. It is critical that they be dled sincerely and implemented as swiftly as possible. Although the bill includes a substantial number of provisions, I propose to refer only to those key changes which go to the heart of the electoral reform package. Central to the reforms proposed in the bill is a new lower threshold for the disclosure of donations. The current threshold of $11,500 will be substantially reduced to a threshold of $1,000. This disclosure level would apply equally to donors, registered parties and candidates. It will provide transparency and accountability in the donations received or given by key participants in the political process and it reduces the scope for undisclosed gifts. It is curious then that such a relatively innocuous proposal should be so vehemently opposed by members opposite. Central to the reforms also proposed by the bill is the capacity to make anonymous donations of order: I do not like to disagree with your ruling but I do point out that the standing orders indicate that all business will be suspended at eight o'clock to deal with any votes or quorums that might have been called during the dinner break. The precedent that you have established means that if a speaker starts speaking at 7.59 pm, for example, they could speak for 20 minutes, and if they were the first speaker from the opposition or government side on a bill they could speak for 30 minutes. That would mean that a division or quorum would not be dealt with until either 20 past eight or half past eight. That is a very important precedent to have established, and the opposition believes that, as members are being called back to be here at eight o'clock and as the standing orders indicate that the votes and proceedings should be concluded at eight, you should interrupt the member for La Trobe and call on the vote.",139
189,The DEPUTY SPEAKER,DONATIONS AND OTHER,I thank the han- Manager of Opposition Business. I am happy to take advice from House of Representatives Practice and from the Speaker. I have already given my ruling and I call on the member for La Trobe to continue.,140
190,Ms SMYTH,DONATIONS AND OTHER,"Mr Deputy Speaker, in the interests of assisting the House, I am willing to defer the rest of my remarks on this matter until later.",140
191,The DEPUTY SPEAKER,DONATIONS AND OTHER,I thank the member for La Trobe for her goodwill. The debate is interrupted. The debate may be resumed at a later hour and the member will have leave to continue speaking when the debate is resumed. NA NA (COMPETITION AND CONSUMER SAFEGUARDS) BILL 2010 Consideration in Detail Consideration resumed.,140
192,The DEPUTY SPEAKER,LEGISLATION AMENDMENT,"In accordance with standing order 133(b), I shall now proceed to put the question on the motion moved earlier today by the honourable member for Wentworth on which a division was called but deferred. Question put: That the amendments (Mr Turnbull's) be agreed to. The House divided. [8.12 pm] (The Speaker- Mr Harry Jenkins) Ayes………… Noes………… Majority……… NA Abbott, A.J. Alexander, J. Andrews, K. Andrews, K.J. Baldwin, R.C. Billson, B.F. Bishop, B.K. Bishop, J.I. Briggs, J.E. Broadbent, R. Buchholz, S. Chester, D. Christensen, G. Ciobo, S.M. Cobb, J.K. Coulton, M. * Crook, T. Dutton, P.C. Entsch, W. Fletcher, P. Forrest, J.A. Frydenberg, J. Gambaro, T. Gash, J. Griggs, N. Haase, B.W. Hartsuyker, L. Hawke, A. Hunt, G.A. Irons, S.J. Jensen, D. Jones, E. Keenan, M. Kelly, C. Laming, A. Ley, S.P. Macfarlane, I.E. Marino, N.B. Markus, L.E. Matheson, R. MCCormack, M. Mirabella, S. Morrison, S.J. Moylan, J.E. Neville, P.C. O'Dowd, K. O'Dwyer, K Oakeshott, R.J.M. Prentice, J. Pyne, C. Ramsey, R. Randall, D.J. Robb, A. Robert, S.R. Roy, Wyatt Ruddock, P.M. Schultz, A. Secker, P.D. * Simpkins, L. Slipper, P.N. Smith, A.D.H. Somlyay, A.M. Southcott, A.J. Stone, S.N. Tehan, D. Truss, W.E. Tudge, A. Turnbull, M. Van Manen, B. Vasta, R. Washer, M.J. Wyatt, K. Adams, D.G.H. Albanese, A.N. Bandt, A. Bird, S. Bowen, C. Bradbury, D.J. Brodtmann, G. Burke, A.E. Burke, A.S. Butler, M.C. Byrne, A.M. Champion, N. Cheeseman, D.L. Clare, J.D. Collins, J.M. Combet, G. 72 Crean, S.F. D'Ath, Y.M. 73 Danby, M. Dreyfus, M.A. Elliot, J. Ellis, K. 1 Emerson, C.A. Ferguson, L.D.T. Ferguson, M.J. Fitzgibbon, J.A. Garrett, P. Georganas, S. Gibbons, S.W. Gray, G. Grierson, S.J. Griffin, A.P. Hall, J.G. * Hayes, C.P. * Husic, E. Jones, S. Katter, R.C. Kelly, M.J. King, C.F. Leigh, A. Livermore, K.F. Lyons, G. Macklin, J.L. Marles, R.D. MCClelland, R.B. Melham, D. Mitchell, R. Murphy, J. Neumann, S.K. O'Connor, B.P. ONEILL, D. Owens, J. Parke, M. Perrett, G.D. Ripoll, B.F. Rishworth, A.L. Rowland, M. Roxon, N.L. Rudd, K.M. Saffin, J.A. Shorten, W.R. Sidebottom, S. Smith, S.F. Smyth, L. Snowdon, W.E. Swan, W.M. Symon, M. Thomson, C. Thomson, K.J. Vamvakinou, M. Wilkie, A. Windsor, A.H.C. Zappia, A. NA Hockey, J.B. Gillard, J.E. Scott, B.C. Plibersek, T. * denotes teller Question negatived. In division",140
193,The SPEAKER,PAIRS,"I understand a point of order was raised about the timing of the division. It is clear that the practice of the House has been, where a member has been on his or NOES her feet making a speech, that the member has completed their speech and then the division has been called. I would hope that that is the practice that we will continue",141
194,The SPEAKER,PAIRS,Yet again the member for Sturt-I am not sure whether he is talking to his neighbours,142
195,Unknown,PAIRS,Honourable members interjecting,142
196,The SPEAKER,PAIRS,"But he does it in a way that I can hear-and, because of the special relationship that he was seeking from me, I listen to him. When he said that nobody knew, I assumed that he meant that nobody had read Practice. But that is okay; I accept that he was talking about something else.",142
197,Unknown,PAIRS,Honourable members interjecting,142
198,The SPEAKER,PAIRS,"I am supporting the member of the Speaker's panel, who appears to be lacking in confidence and requiring that support.",142
199,Unknown,PAIRS,Honourable members interjecting,142
200,The SPEAKER,PAIRS,The member of the Speaker's panel was only doing what he thought was correct. I understand that the House resolved it in a way that was accommodating to all. That should be acknowledged. Bill agreed to. Third Reading,142
201,Mr ALBANESE,PAIRS,Grayndler-Minister for Infrastructure and Transport) (8.19 pm)by leave-I move: That this bill be now read a third time. Question agreed to. Bill read a third time. NA AMENDMENT (POLITICAL NA MEASURES) BILL 2010 Second Reading Debate resumed.,142
202,Ms SMYTH,DONATIONS AND OTHER,"At my last opportunity to make remarks on the Commonwealth Electoral Amendment (Political Donations and Other Measures) Bill 2010, I was referring to the various reforms which are being considered in the bill. I had remarked on the new lower threshold for disclosure of donations, which I had observed was a fairly innocuous reform but a significant reform from the point of view of the electoral system and the transparency of the system in the public's eyes. I found it remarkable that those opposite were taking issue with such a relatively innocuous reform. Simultaneously, a key reform to the capacity to make anonymous donations will be made under the bill. The current Commonwealth Electoral Act provides that registered political parties and their branches, candidates, Senate groups and those who act on behalf of persons within each of these categories may receive anonymous donations below a specified indexed threshold. The indexed threshold is currently set at $11,500, and anonymous donations which exceed that threshold are not permitted. But at present a donor who wishes to make anonymous donations could do so by making multiple donations slightly below the threshold to various divisions of the same political party. The bill before us would remove that donationsplitting loophole by using an existing definition of ‘related political parties' found elsewhere in the Commonwealth Electoral Act to ensure that donations to different divisions of a political party are treated as aggregated, as they should be. This again is what one might regard as a fairly innocuous reform, and yet again we are seeing considerable resistance to it from those opposite. The reforms proposed under this bill will have the effect of banning all anonymous donations except those which are less than or equal to $50 and which are received at a general public activity or at a private event. These activities and events are defined in the bill and specified records must be kept in order for the anonymous donations to be retained. All of these reforms will apply equally to all political parties and all candidates. Once again, it is most surprising that those opposite seek to resist these changes so strenuously. Unfortunately, while I have articulated the merits and factual circumstances of this bill, those opposite have maligned union officials and union generally. I have not, as member for Mackellar flagged in her remarks, sought to malign any individual donor or categories of donor and I do not propose to do so in the remaining time available to me. Anonymous donations by third parties for political expenditure will now also be prohibited. This will apply to third parties that are required to lodge annual returns of their political expenditure above the current threshold, which will hopefully-assuming that this bill is passed-be lowered to a threshold of $1,000. The bill also provides for the recovery by the Commonwealth of any unlawful anonymous donations. Both of these reforms will improve substantially the transparency of political donations and the confidence that the public can have in our political processes. It is pleasing to note in particular that these reforms are supported by the Greens and the Independents. Both of these reforms, along with the balance of reforms in the proposed bill, will have a very significant role to play in terms of the public scrutiny of political donations and expenditure by making information more swiftly available to the public. The bill before us will require more regular disclosure of political donations and expenditure. It also reduce the current time periods for the lodgement of returns from the existing periods of between 15 and 20 weeks down to eight weeks. The requirement to lodge returns will now apply once every six months rather than once every 12 months as is currently the case. My time has been somewhat interrupted this evening, unfortunately. I will leave it to my colleagues remaining to speak in this debate to remark on the other merits of the bill. In closing, the changes that I have discussed and a substantial number of additional measures proposed in the bill that I the have not had an opportunity to discuss this evening will have a very significant and positive impact on public perceptions of campaign finances and electoral transparency. One of the remarks of the member for Mackellar this evening was, ‘What motivation other than rank self interest makes any sense?' I put it back to the opposition, because I simply cannot understand what motivation other than rank self interest makes any sense. (Time expired)",142
203,Mr TURNBULL,DONATIONS AND OTHER,"The issue of political donations is a vexed one in politics and it is fundamental to the integrity of our political system. An important aspect of political speech and political freedom is the ability for people to make a financial contribution to a political party, candidate or cause. But we all know that very real concerns arise about the independence and the integrity of political parties and candidates where the sums involved are so large that something must be given in return-or something must be assumed to be given in return. The Labor Party has a very different history to the Liberal Party. The Labor Party is the political wing of the labour movement. will The trade unions are the industrial wing of the labour movement. The Labor Party was established as a means of getting the representatives of the trade unions into parliament. The operations, the preselections and the policies of the Labor Party are to a very large extent controlled by the trade union movement. We have reached a point in Australia in the campaign finance area where the Labor Party enjoys an enormous advantage in terms of fundraising and campaign finance. They receive 100 per cent of the tens of millions dollars that the trade unions give to political campaigns-the unions do not give any to the Liberal Party. Those in the business sector-particularly the large public companies-increasingly do not make political donations at all or, where they do, they split them between both parties. But increasingly they do not make political donations at all. you go back 20 years, you could say that the big end of town gave to the conservatives and the unions gave to Labor, and there was a rough equivalence. That is not the case any longer. Increasingly, you have Labor dominated financially by the trade union movement. They have an organisational leverage over the Labor Party because of the history and structure of the Labor Party. But they also have a financial stranglehold over the Labor Party-it cannot function without the massive support from the trade union movement. At the same time as the large public companies that used to make political donations have increasingly not made them, more and more we have seen political donations from business that used to come to either party go overwhelmingly to the Labor Party because of their domination at the state level for some time. Further, political donations that come from business tend to come from businesses that have a particular interest in government policy-for example, the liquor industry, the gaming industry and property developers. There have been many efforts-false starts-at trying to do something about this. The issue of disclosure is being sought to be addressed in this bill, but this bill is not calculated to restore integrity to campaign finance. It is designed to tilt a campaign finance playing field that is already tilted in favour of Labor even more in favour of Labor. Because of the large sums that the trade of union movement gives to the Labor Party, it is immaterial whether the disclosure level is $11½ thousand or $1,000. The donations are going to exceed the higher disclosure level. There are many small and medium sized businesses that know that if they make a donation to our side of politics and that is disclosed they will come under pressure to If make an equivalent donation to the Labor Party. There is no point being naive about this. Those honourable members who have been involved in campaign finance-in particular, those on the Labor side-know that that is exactly how it works. The pressure, the standover, is brought to bear and a business is pressured to make an equivalent donation to Labor or, alternatively, decides that it is all too hard and stops making donations at all. The Commonwealth Electoral Amendment (Political Donations and Other Measures) Bill 2010 is designed not to effect campaign finance reform. We have sought over the years to engage the Labor Party in constructive discussions about real campaign finance reform. What that would look like is campaign finance reform that puts a cap on donations and eliminates donations. This is my own view. It is based on submissions I have made over the years and my own experience as honorary Federal Treasurer of the Liberal Party in a previous life. I was the principal fundraiser for the Liberal Party in that capacity. My view is that we should have a system whereby there is a cap on donations and donations can be made only by natural persons-that is to say, human beings-who are on the electoral roll. Donations could not be made by trade unions or by companies or associations. That would restore a degree of equivalence, an equity, and would address many of the issues of perceived influence that we see at the moment. I make the point that these issues of ence are very, very substantial. All of us on our side have complained over the years about the influence the trade union movement has over the Labor Party. The Labor Party would say in response to that, ‘Well, the trade union movement created our party; it is only reasonable that they should have influence.' However, consider this: the Labor government in New South Wales-which I hope is entering into its last months in office-in its time under Premier Bob Carr, permitted an extraordinary expansion of gaming facilities in hotels throughout New South Wales. Every hotel in New South Wales, with very few exceptions, was turned into a small casino. That was done to protect the economics of the hotel industry. You would have to be one of the most naive people-and I hope I do not fall into that category-to imagine that that extraordinary change in policy, which I believe has done great social harm in New South Wales, was not connected with the massive donations from the hotel industry and from the gaming industry to the Australian Labor Party's New South Wales branch. These issues of influence, perceived or real-people have different views about them-have to be dealt with. This bill does not deal with them. This bill is designed to do one thing and one thing only. It is designed to make it harder for small businesses to support the coalition, because they are the ones that will be sensitive to disclosure due to the pressure that they come under. The unions do not mind, because their donations are very big-they are well over the $11½ thousand threshold. Large companies are not fussed, because their donations are also going to be well over $11,500. If you think about the sorts of people and the sorts of people and businesses that are making $5,000, $6,000 and $7,000 donations to political parties, they are small and medium influbusiness and their owners. They are overwhelmingly supporters of the coalition, and they will be vulnerable, once their donations are disclosed, to being hit up by the Labor Party. That is what this so-called reform is all about. If Labor were fair dinkum about campaign finance reform, it would look at caps being placed right across the board and donations being limited to natural persons. So take unions out of it, take companies out of it, limit it to people on the electoral roll and then focus on what measures can be taken to ensure that those rules are not subverted by third-party activity. We have come close in discussions with different people in the Labor Party over the years to achieving we thought some kind of consensus in this area. But Labor, with this legislation, is quite clearly not interested in real reform; it is interested in changes that benefit it as opposed to the coalition. So I cannot support this legislation. I have a long standing commitment, publicly documented over nearly a decade, to campaign finance reform, but it has to be fair dinkum. That means it has to be root-and-branch reform, not just fiddling at the edges-not just twirling the knobs to make the system that much more favourable to the Labor Party. The playing field is already tilted in favour of the ALP. This legislation is designed to tilt it even further in that direction. It does not address the real problems of perceived influence, real influence, integrity and equity that we face in campaign finance. We need to face those issues, and we can do so. There is a common will to do it. At least I thought there was a common will when Senator Faulkner was in a leading role in the government ranks, but that seems to have dissipated, and Labor is again trying to game the system to make it work better for it at the expense both of its political opponents and of democracy.",143
