speakerGroups,Speaker,Title,text,pageNumbers
0,NA,Unknown,"Tuesday, 16 November 2010 ----",19
1,The SPEAKER,Unknown,"Mr Harry Jenkins) took the chair at 11 am, made an acknowledgement of country and read prayers. TAX LAWS AMENDMENT (2010 MEASURES No. 4) LEGISLATION",19
2,Mr HOCKEY,Unknown," Mr Speaker, on indulgence. Yesterday in the House I said the following: Even today I was given information that suggests that, on average, if you took all bank fees paid Australia and averaged them out across households, each household pays more than $5,000 in bank fees. I repeated that again today on MTR. As I said, I was advised of that, and that information has proven to be incorrect. The number of households in 2009 was 8,236,000, the bank fee income from the households was five billion and 31 million dollars and the average per household was $611. NA Address-in-Reply Afghanistan",19
3,Mrs ELLIOT,MAIN COMMITTEE,"by leave-I move: That: (1) the resumption of debate on the Address in Reply be referred to the Main Committee for further consideration. (2) unless otherwise ordered, at the interruption of the debate at 2 pm, the resumption of debate on the motion to take note of the Prime Minister's statement on Australia's commitment to Afghanistan, be referred to the Main Committee for further consideration. Question agreed to. NA Report from Main Committee Order of the day returned from Main Committee for further consideration; certified copy presented. Ordered that the order of the day be considered immediately.",19
4,The SPEAKER,AFGHANISTAN,The question is that the motion be agreed to.,19
5,Mr BILSON,AFGHANISTAN,"Dunkley) (11.03 am)Mr Speaker, thank you for the call and thank in you for the opportunity to make a contribution to this debate. I start by acknowledging the great, heartfelt sadness that 10 families must have felt on Remembrance Day. There were 10 new names added to the Roll of Honour at the Australian War Memorial. All those 10 outstanding Australians gave their lives in the service of our country doing what our nation asked of them in Operation Slipper in Afghanistan. Sapper Jacob Moerland, Sapper Darren Smith, Private Scott Palmer, Private Timothy Aplin, Private Benjamin Chuck, Private Nathan Bewes, Trooper Jason Brown, Private Grant Kirby, Private Thomas Dale and Lance Corporal Jared MACKinney Reference all made the ultimate sacrifice in Afghanistan over the preceding 12 months. Their contribution, their courage and their selfless service of our nation is captured on the honour roll at the War Memorial. That brings the number of Australian lives lost in Operation Slipper to 21, and there are more than 150 people who have been wounded, some very significantly, under Operation Slipper. I raise that because it is something I spoke with some children about on Remembrance Day at a service in Mount Eliza. It is a very real example that the good fortune we enjoy in Australia needs to be protected, and our duty is to preserve and carry forward those great gifts of freedom and liberty of opportunity that we enjoy. Where we see an opportunity to make a contribution as part of the international community we should consider our good fortune and recognise our responsibility to help others. I raise that in the text of our history as a nation. We have done that in the past, it has served our nation well and it has served humanity well. We also need to do that now. It is just one of a number of reasons why Australia's engagement in Afghanistan is, in my mind, entirely justified. It is just and it is one that we should persevere with. In addition to that there is the unavoidable truth that tragedy has been inflicted on Australian citizens through the most heinous acts of terrorism and violence by people whose talents were developed in Afghanistan. It is also worth recognising that a failed state in that region of the world where nuclear capability is present presents enormous problems for all of us. A functioning, regional architecghanistan? ture and opportunities for citizens of that region are our best antidote to not see potentially enormous and unthinkable things happen from the crumbling of civilisation, civilised discourse and governance in that part of the world. The other thing we should also bear in mind is that, when we reflect on our own good fortune, we pay the respects that are very hard earned and well deserved on commemorative occasions like Remembrance Day. It is important to wonder to ourselves what might occur if we did not participate and recognise the enormous cost borne disproportionately by the family members of those whose loved ones have already suffered so much and by those who continue to suffer from injury, illness or impairment as a result of their service. If that sacrifice was not made what might happen? I am happy to account for my contribution as a minister in the defence portfolio and as Minister for Veterans' Affairs, where my duty from sun-up to sundown and through most of the night was to care for those doing extraordinary work on behalf of our nation. con- But had they not been doing that work, had other likeminded countries not recognised not only the threat that was present in Afghanistan but also the consequences of that threat-consequences that had already played out most horrendously-what would have happened? Would we have left that role to someone else? Were we suggesting that because we were not a combatant in Afghanistan, al-Qaeda would spare Australian citizens the heinous acts of terrorism that they perpetuate around the globe? Would we be content for others to step up and see that the cost of their actions was somehow appropriate yet our willingness not to contribute was reasonable given the international concern that inspired the engagement in AfI think for all of those questions the answer is that if we did not turn up we would be regretting that inaction and we would be paying the cost of it-and that cost would be paid for a long time. Al-Qaeda is nothing like the outfit that was in Afghanistan previously. Al-Qaeda is a global terrorist organisation; it seeks to end Western influence and attack Western values and it seeks to ensure that that influence and those values do not take hold in the Middle East. Al-Qaeda pursues its mission with extraordinary acts of inhumanity and heinous crimes against people to drive home its objectives. They are now not able at will to come into and leave Afghanistan to develop that lethal terrorist capacity. They have been pushed out of Afghanistan. It is already an extraordinary achievement that that training ground, that incubator of terror, is now no longer present in Afghanistan, where entry and exit was so porous. It was frightening to see the number of people who went and learned their evil craft in Afghanistan. The Taliban, though, is a coalition of political, military and tribal organisations that basically wants to run Afghanistan. It has more of a domestic focus. Those in the Taliban are keen to impose their will on the people of Afghanistan. They are trying to exercise the weight of oppression to control the population, not the weight of their argument. They use the calibre of firearms to persuade people to follow their direction, not the bre of the leadership or the quality of the ideas they put to the people there. They continue to represent a threat, and they continue to symbolise the reason for our engagement-they are a threat to the physical security of people in Afghanistan and beyond. Afghanistan is referred to as a military engagement. That is but one phase of where we are at in Afghanistan. I think the Prime Minister, when talking about a decade-long engagement, could have articulated more precisely that this engagement will change over time-it will adapt to new circumstances and threats of the kind that al-Qaeda represented and that the Taliban, to a lesser extent but still at great cost of life, now represents. As that threat is removed, pushed back like a tide of evil and danger whose goal is to maim and kill others to gain a foothold of influence and power, we need to maintain our efforts. We need to make sure that our perseverance in a security and military sense does not wane and allow that tide to come in again. If that tide comes back into Afghanistan, anything else we seek to achieve in Afghanistan will not be achievable. Children do not go to school when they are terrified about walking down the street or terrified that they will be the subject of a random bombing attack designed to cause fear and intimidation and to terrorise a population into following an alternative strategy on the direction of the government not because it is in the citizens' best interests because the fear is so great. People do not go to health clinics when the resources in that clinic are not safe and secure and when medical practitioners risk their own lives simply by venturing out into those community spaces. Literacy does not improve when there is not the opportunity to engage in education. Livelihoods do not improve when the place is so dysfunctional that there are no caliprospects of any kind of economy taking hold. Women in Afghanistan need the opportunity to make a full contribution to lift the country's opportunities and prosperity and to shape a better future. Women need to be involved and they need that opportunity to participate. I have often said that if women are not being fully engaged in developing fragile countries and economies they are tackling the challenge with one arm tied behind their back. Yet in the Taliban's view of the world women do not have that contribution to make. At the Telstra Business Women's Awards presentation the other night I heard story after story about the remarkable contributions of women, and that reinforced my view of how much poorer countries like Afghanistan will be if organisations like the Taliban have their way. We need to pursue a position of strength to try and secure a negotiated peace settlement. You cannot negotiate from a position of weakness where it has already been proven that threats and intimidation, force and violence may be used as part of the artillery. We need to be in a position of strength to negotiate a political settlement. It is encouraging news that more conflicts now end in negotiated settlements than in military victories. It also turns out that wars that end in negotiated settlements last three times longer than those that end in military victories but are nearly twice as likely to restart within five years. So if we are to negotiate a but peace settlement and put Afghanistan on a positive footing with their future being shaped by Afghanis, we need to recognise the risks of the threat re-emerging-that is why I use the analogy of keeping the tide out. As a state emerges-it is past being a fragile or a failed state; it is now in a state building mode-safety and security are basic preconditions, otherwise nothing else will be achieved. That is why a military presence is justified but it needs to adapt and recalibrate as the domestic forces begin to provide that basic security, and that makes everything else possible. As that state is secured, we then get on with state building. The elections in Afghanistan might not pass the test of being free and fair by our standards but they were an expression of the people's will and that Afghanis can shape their own future. Their systems of democracy will improve. There is no question that corruption is a cancer on the work going on in Afghanistan but, sadly, it is not alone. We have seen it in other countries, and we have to work persistently to overcome that. It is also worth recognising what the international literature says about fragile states, failed states and state creation: it is a longhaul business. As the military's presence declines and a security-policing presence emerges and as objectives of livelihoods develop, services are put in place, schools are built, education and health services become available and there is the full participation of citizens, the tool kit needs to change and adapt. But that is going to take a long time. Even the recreation of fragile states-we are not talking about building from the ground up-is extraordinarily expensive to support. Under the previous coalition government, I was involved in the development of a white paper which provided some information about the cost of fragile states and how, on average, they remain fragile for half a century. You do not need to look too far to see this. The work with countries in our own neighbourhood has seen Australia continue to be involved with fragile states. Opportunities need to be supported through aid and development, and good governance is needed to support the continuation of that work-and we have been at it for decades. I also invite people to look closer to home. Australia have a recognised competency in dealing with the fragile and failed state recovery mode. We have some experience. We did it in East Timor, we did it in Bougainville and we are still at it in the Solomon Islands. We have developed some competencies around that space. The need to get local governance working and to see people want what that offers is a key precondition. The Afghanis will welcome our support but, as a friend of mine who has done a number of deployments said, they need to know you are for real. You need to do what you say you are going to do to be valued by the Afghanis, and you need to stay the course. We have that reputation. But to get the Afghan people working collaboratively and in a synchronised way with our international efforts, we need to keep face with the Afghan community. That is a cultural precondition. We need to do what we say we are going to do. We need to see this through. We need to make sure that the support is there and that the Afghan people can turn their efforts towards a partnership with the international community and know that those partners will hang around. This builds respect and credibility; it builds preconditions for a recovering state in Afghanistan. But this is going to take decades, and we need to be prepared to make that commitment. Mrs D'ATH (Petrie) (11.18 am)-I join with many members on both sides of the House and on the crossbenches to speak about Australia's involvement in Afghanistan and, in particular, the deployment of the Australian Defence Force throughout Afghanistan. I welcome the school students who are in the galleries today and also the members of our community. It says a lot about our democratic parliamentary system when we can have such a significant debate in this House, with our community watching on. I thank all those who have spoken before me and who are still to speak both in the House and in the Senate for their contributions on this important motion. Their contributions have been thoughtful and delivered in a way that is within the spirit of the bate. Many speakers before me, including the Prime Minister, have spoken of the heavy burden that the federal government must carry in making a decision to send our young men and women to war. The war of today is in many ways very different from the wars that our forefathers had to fight in the past. However, as we know, the war of today carries the same risks to the lives of those who choose to defend our country. If we, as a mocratic society, accept that we must defend our nation, its people and their way of life then we must accept that we cannot defend our nation only from our shores. The risks to our nation can come from far away. Terrorist acts have taken the lives of so many Australians, and we have seen those lives lost in acts of terror on foreign soil. New York is 15,989 kilometres from Sydney, Australia. Despite this distance, I am sure many Australians who were watching their televisions or listening to their radios when the devastating attacks on the World Trade Centre in New York occurred on 11 September 2001 will still recall exactly how they felt. I remember dropping my daughter off to day care, just thinking about the tragic loss of life. Later that day, I heard from my South Australian colleagues in the AWU that one of our past AWU officers had been in the World Trade Centre at the time. Andrew Knox, aged 29, was on the 103rd floor of the north tower when the plane hit. The last we heard of him on that day was that he and other work colleagues were heading to the roof, waiting to be rescued. Andrew was one of 10 Australians lost that day. Since that time we have witnessed other terrorist attacks that have taken Australian lives. The lives of 88 Australians were taken in Bali in 2002 and four Australians were killed in the second Bali bombing in 2005. Our embassy has been bombed in Jakarta. We saw the loss of one Australian and others de- injured in the London bombings on 7 July 2005. In each of these cases, the terrorist groups involved had links to Afghanistan. Australia's involvement in Afghanistan is not about any one individual; it is about all individuals. It is about defending our right to live without fear and defending that freedom. The Prime Minister outlined the two vital national interests in Australia's involvement in Afghanistan: firstly, to make sure that Afde- ghanistan never again becomes a safe haven for terrorists, a place where attacks on us and our allies begin; and secondly, to stand firmly by our alliance commitment to the United States, formally invoked following the attacks on New York and Washington in 2001. This House has heard from many that alQaeda, prior to 2001, was able to establish itself as an extensive global financial network that enabled it to exercise effective control over the Taliban. Al-Qaeda were able not only to train under the safety of the Taliban government but to finance and plan the attacks on foreign soils on innocent people. There are people in my communities and in communities around Australia who question our involvement in Afghanistan, who question what has been achieved. Since 2001 we have seen the removal of the Taliban government and the fracturing of al-Qaeda. Al-Qaeda cannot hide under the safety of a Taliban government and they cannot openly conduct their operations nor establish training facilities. We have heard from others, in reply to the Prime Minister's statement, talking about the actions of the Taliban regime-the brutality that it forced onto its people and the power that it wielded with such ferocity and terror. Women were subjected to acts that we in Australia could not even fathom, let alone our minds wander to the thoughts of our daughters being subjected to such treatment-abduction, forced marriage, rape or being sold into sexual slavery. Women were prohibited from working or gaining an education. Importantly, we do not go into this war alone. This action was taken as part of a broader strategy across nations. The International Security Assistance Force was created in December 2001 after the terrorist attacks of September 11. The International Security Assistance Force works under a United Nations Security Council mandate. ISAF's mandate has continued to transform to match the shifting needs of Afghanistan and its people. In London in January 2010, the international community-including over 70 nations and international organisationsreaffirmed its resolve to work with the Afghan government to defeat international terrorism. Importantly, the conference emphasised the need to transfer ‘ownership' for security, development and governance to the Afghan government, and the need for sustained international commitment in these areas. In June 2010, US General David Petraeus assumed command of the International Security Assistance Force. As recently as 13 October this year, the United Nations Security Council unanimously renewed ISAF's mandate for a further year. In July 2010, around 70 nations and international organisations met in Kabul, where participants welcomed the Afghan government's determination to work with the other nations to achieve governance, strengthen their own military operations and to renounce violence and links with international terrorist organisations. I welcome this debate because a government, having made a decision to send our let defence personnel into combat, must regularly assess the situation to ensure that the objectives are achievable and the decision is justifiable. I believe that the member for Eden-Monaro said it best, in speaking in his reply to this statement. Dr Mike Kelly said: This parliament is situated on an axis that ensures we are always in sight of the Australian War Memorial. There is no mistake in this, as it was intended that it be a reminder of the consequences of political decisions and that they should not be taken lightly. It is also a reminder that this nation has made great sacrifices throughout its history in the cause of peace and freedom. The executives of governments who have made these most challenging decisions do not do so lightly, and we have heard that from many in the executive of the current government in their addresses to this parliament and also from those who held executive positions in the previous Howard government. Nor do we, as elected representatives, take decisions about the service of our men and women lightly, whether it be in Afghanistan or anywhere else in the world. In the midst of a war, it can be difficult to recognise the real and tangible positives that are occurring in Afghanistan through the work of ISAF together with the Afghani people. There are, however, tangible positives that have already been achieved. These include positive steps in the areas of health and education-areas which, as Australians, we take for granted as being a basic birth right. Primary school enrolments are at six million today, up from one million only nine years ago. Importantly, two million of those enrolments are girls-something not just unthinkable but illegal under the Taliban rule. The transformative power of education is today sowing the seeds in these young Afghani boys and girls who will blossom in the years to come. The power and dignity an education can give to an individual should never be underestimated and the value to Afghanistan as a nation is incalculable. In the area of health, we have seen a 22 per cent decrease in infant mortality in six years and an immunisation rate that is between 70 and 90 per cent. These are achievements that our nation should be proud of. We must continue to support those who serve this country-those who do so voluntarily, with great risk and great sacrifice. Remembrance Day was marked across our nation last Thursday. There were a number of services across my electorate of Petrie. At one service, two serving soldiers spoke incredibly movingly of their recent service in Afghanistan. They spoke of the toll of the loss of their fellow soldiers, and the pride they feel at the job they are doing in Afghanistan and the positive changes they can see their work doing. I would like to finish by acknowledging the tremendous efforts of our serving defence force. To the Australian Defence Force personnel, the Australian Federal Police personnel and the civilian personnel who serve in the combined team in Oruzgan we say, ‘Thank you.' To the 21 Australian soldiers who have lost their lives in Afghanistan since 2001 and to the families left behind, we say: ‘Thank you. Your husbands, sons, and fathers will not be forgotten.' To the 129 soldiers wounded: we acknowledge your service and your sacrifice. And even to the explosives detection dogs that have died protecting our troops we say, ‘Thank you.' One of those dogs was Herbie. Herbie died with Sapper Darren Smith and Sapper Jacob Moerland, both from the Brisbane based 2nd Combat Regiment. These men and Herbie died from a roadside bomb in Afghanistan in June 2010. On 29 October this year, the Peninsula Animal Aid shelter in my electorate was presented with a plaque by Bonnie's Dog Obedience and Care Centre. Herbie had been adopted by the Defence Force from the shelter two years earlier. I end as I started: the decision to send our men and women to fight on foreign soil is taken with a heavy heart. It is, however, a decision that a democratic government, elected by the people, must make in the best interests of our nation. Having made that decision, the government must ensure that our nation, its people, are always grateful for the service that is given and never forget those who have served.",19
