speakerGroups,Speaker,Title,text,pageNumbers
0,NA,Unknown,"Tuesday, 28 February 2012 The SPEAKER (Hon. Peter Slipper) took the chair at 14:00, made an acknowledgement of country and read prayers. NA Carbon Pricing",21
1,Mr ABBOTT,QUESTIONS WITHOUT NOTICE," My question is to the Prime Minister. I remind the Prime Minister of her admission yesterday that she had made mistakes over the past 18 months. Was one of those mistakes telling the Australian people, five days before the election, 'There will be no carbon tax under the government I lead'? Will she now apologise for this deception and rescind the operation of the carbon tax until after the next election?",21
2,The SPEAKER,QUESTIONS WITHOUT NOTICE,Order! The Leader of the Opposition will retract the word 'deceive' because that is unparliamentary.,21
3,Mr ABBOTT,QUESTIONS WITHOUT NOTICE,The word was 'deception'.,21
4,The SPEAKER,QUESTIONS WITHOUT NOTICE,That is a derivative of the same word. It suggests a mental element of intentionally saying the wrong thing. It is disorderly. The leader will withdraw.,21
5,Mr ABBOTT,QUESTIONS WITHOUT NOTICE,I will withdraw and I will ask her to explain. An opposition member: You should repeat the question!,21
6,The SPEAKER,QUESTIONS WITHOUT NOTICE,"If I identified the member who did that interjection, he would be No. 1 for today. The honourable Prime Minister has the call.",21
7,Ms GILLARD,QUESTIONS WITHOUT NOTICE," To the Leader of the Opposition's question: last year this parliament put a price on carbon. It did that because we want our nation to seize a clean energy future. The Leader of the Opposition himself has been in favour of putting a price on carbon. He went to the 2007 election on a platform of introducing an emissions trading scheme. On this side of the parliament, we have always said that the best way of tackling climate change-the cheapest, the most effective way-was to put a price on carbonMrs Bronwyn Bishop interjecting",21
8,The SPEAKER,QUESTIONS WITHOUT NOTICE,The honourable member for Mackellar will restrain herself.,21
9,Ms GILLARD,QUESTIONS WITHOUT NOTICE,and we have achieved that.,21
10,Mr Abbott,QUESTIONS WITHOUT NOTICE,"Mr Speaker, I rise on a point of order on direct relevance. It was a simple question: was this statement one of the mistakes that the Prime Minister now regrets? She should directly answer that question.",21
11,The SPEAKER,QUESTIONS WITHOUT NOTICE,The Prime Minister will be directly relevant to the question.,21
12,Ms GILLARD,QUESTIONS WITHOUT NOTICE,"Putting a price on carbon was the right thing to do, and I stand by it. It was the right thing to do to seize a clean energy future. The Leader of the Opposition is on the public record saying that. Ms Julie Bishop interjecting",21
13,Ms GILLARD,QUESTIONS WITHOUT NOTICE,"The deputy leader, who interjects, is on the public record saying that. The member for Sturt is on the public record saying that. They all went to the 2007 election pledging to vote for that in this parliament. When it comes to talking about deception on this question, they might like to explain to the Australian people why they were in favourMrs Bronwyn Bishop: Mr Speaker, I rise on a point of order.",21
14,The SPEAKER,QUESTIONS WITHOUT NOTICE,"There is no point of order at this point because all the Prime Minister has said is that, when it comes to the point of deception, they might like to explain to the Australian people. If the Prime Minister were to accuse the opposition of deception, she would be compelled to withdraw. That could well be coming. It has not yet come. The Prime Minister has the call.",21
15,Ms GILLARD,QUESTIONS WITHOUT NOTICE,"Mr Speaker, I am more than happy to rephrase. It falls to the opposition to explain how the most senior figures of this opposition went to the 2007 election campaign saying that they believed in putting a price on carbon, that they would all vote for putting a price on carbonMrs Bronwyn Bishop: Mr Speaker, I rise on a point of order. Clearly, putting together the allegation of what happened in 2007 and the word 'deception' goes to intent, and she should withdraw.",22
16,The SPEAKER,QUESTIONS WITHOUT NOTICE,Has the honourable member finished? Mrs Bronwyn Bishop: Yes. There has to be one rule about this word.,22
17,The SPEAKER,QUESTIONS WITHOUT NOTICE,The Prime Minister has been asked about a statement made prior to the election and has been asked if she would apologise for that statement. The Prime Minister has the call to answer the question.,22
18,Ms GILLARD,QUESTIONS WITHOUT NOTICE,"The senior figures of the opposition should explain why they went to the 2007 election, hands on their hearts, saying, 'I will walk into the parliament and I will vote for a price on carbon.'",22
19,The SPEAKER,QUESTIONS WITHOUT NOTICE,The Prime Minister will become directly relevant and will answer the question.,22
20,Ms GILLARD,QUESTIONS WITHOUT NOTICE,"I am asked whether or not carbon pricing is a mistake for this country, and I am pointing out that carbon pricing in this nation has had strong bipartisan support, and that is why it is mistake for the nation. It has been supported fulsomely by the Leader of the Opposition. He sought election in 2007 on the basis that he would vote for carbon pricing",22
21,The SPEAKER,QUESTIONS WITHOUT NOTICE,The Prime Minister will return to being directly relevant.,22
22,Ms GILLARD,QUESTIONS WITHOUT NOTICE,"and he probably said that in 2007 because he believed then, as did Prime Minister Howard",22
23,The SPEAKER,QUESTIONS WITHOUT NOTICE,The Prime Minister will resume her seat. Next question?,22
24,Ms GILLARD,QUESTIONS WITHOUT NOTICE,that it was the right thing for the nation.,22
25,The SPEAKER,QUESTIONS WITHOUT NOTICE,The Prime Minister no longer has the call. Next question? The honourable member for North Sydney on a supp,22
26,Mr Hockey,QUESTIONS WITHOUT NOTICE,"On a question. You asked for questions: 'Next question?' I am standing, asking for the call, sir. No-one else was standing",22
27,The SPEAKER,QUESTIONS WITHOUT NOTICE,"No, I was of the view that the honourable member for North Sydney was approaching the dispatch box seeking to ask a supplementary, and naturally I would have accorded him precedence had that been the case. The honourable member for Greenway. Ms Smyth: For La Trobe.",22
28,The SPEAKER,QUESTIONS WITHOUT NOTICE,"La Trobe, sorry. Congratulations are in order for the honourable member for Greenway and her husband, Michael, on producing a young Australian. The honourable member for La Trobe has the call. Telecommunications",22
29,Ms SMYTH,QUESTIONS WITHOUT NOTICE," Thank you very much, Mr Speaker. My question is to the Prime Minister. Will the Prime Minister update the House on the latest not a developments in delivering the structural separation of Telstra? How is the government getting the job done on delivering this and the other major reforms we need to build Australia's future?",22
30,Ms GILLARD,QUESTIONS WITHOUT NOTICE," I thank the member for La Trobe for her question. As the representative of an outer urban electorate in this place, I am sure that she, like many other members, takes plenty of calls in her electorate office and has plenty of people seeking to speak to her on the streets of her community about their inability to get broadband-their inability to get a service. Today is a landmark day in the development of telecommunications for this country. Today the Australian Competition and Consumer Commission has approved the structural separation of Telstra. Our 100year-old copper network has served us well but it will not meet the needs of the future. To meet those needs we need superfast broadband. We need the National Broadband Network. And, to ensure that the National Broadband Network can be got to Australians in the most equitable way with services at the cheapest price, we need the structural separation of Telstra so that there are wholesale services and there is retail competition on those services. That is what structural separation means and that is what has been achieved by this government. This is the delivery of a major reform, much delayed in this country, spoken about for 20 years but delivered by this government, delivered through legislation at the end of last year and now getting the regulatory approvals it needs today. That means that we now have in place the funding, the legislation and the regulatory approvals to get superfast broadband around the nation. This is another example of the government getting the big things done, the big things that will make a difference to our future prosperity as a nation. It is inconceivable that we can hold our place in a competitive world if we are working on yesterday's technology and other nations are working on the technology of the 21st century. What today confirms is that in the 2013 election the nation will face a choice. Right around the nation for so many communities that choice will be an incredibly simple one: broadband or no broadband? That will be the choice. Productivity and prosperity in the future, or yesterday's technology? Twentyfirst century delivery of healthcare and education services, or leaving our hospitals, GP clinics and schoolchildren behind? On this side of the parliament, we stand for embracing that future and shaping it in Australia's interest, and today is a very important day in ensuring that we get the National Broadband Network done. NA The SPEAKER (14:11): The honourable member for Hinkler advises me that in the gallery today we have the Hon. Lin Powell, former Speaker of the Legislative Assembly of Queensland and a former Queensland education minister, and his wife, Mrs Jan Powell. I welcome both Mr and Mrs Powell to the gallery of the House of Representatives on behalf of all members. Honourable members: Hear, hear! NA Mining",23
31,Mr HOCKEY,QUESTIONS WITHOUT NOTICE," My question is to the Minister for Resources and Energy. I remind the minister of his statement yesterday that the Treasurer 'should take a good, hard look at himself'. Was he referring to the Treasurer's handling of the mining tax, which has had three different versions and five different costings, or is he referring-to use the minister's own words-to the 'character assassination' of the member for Griffith?",23
32,Mr Albanese,QUESTIONS WITHOUT NOTICE,"Mr Speaker, I raise a point of order.",24
33,Unknown,QUESTIONS WITHOUT NOTICE,Opposition members interjecting,24
34,The SPEAKER,QUESTIONS WITHOUT NOTICE,The House will remain-or become-silent so that I can listen to the Leader of the House on his point of order.,24
35,Mr Albanese,QUESTIONS WITHOUT NOTICE,"I submit to you, Mr Speaker, that the second half of that question is clearly out of order as it does not go to minister's responsibilities.  order: it is a long standing precedent in this place that ministers can have their words put to them and simply be asked whether they stand by them. The Minister for Resources and Energy has made those statements and he has a responsibility to either stand by them or repudiate them in this place.",24
36,The SPEAKER,QUESTIONS WITHOUT NOTICE,"My principal dilemma is whether I rule the whole question out of order on the basis that half of it pollutes the whole or whether in fact I direct the minister to answer the first part of the question. I invite the minister to answer the first part of the question, and he will disregard the second part. Mr MARTIN FERGUSON (BatmanMinister for Resources and Energy and Minister for Tourism) (14:13): I thank the honourable member for the question, which really raised the importance of the mining tax. Our endeavour to put in place a profits based system in Australia is exceptionally important to the future of Australia. It is about time the coalition understood that we are very fortunate as a nation. There is a huge pipeline of investment in Australia to the tune of $455 billion in either planned or committed capital investment. It is also time they understood that our economy is going through a major transition at the moment. Whilst a significant part of our economy is getting major benefits in the process of this investment, there are other parts of our economy that are challenged by the impact of the dollar and, I might say, disappointing commodity prices, such as the aluminium industry. That is the case internationally at this point in time. I also say to the opposition that only Labor have the capacity to manage this transition, just as we, during the period of 1983 to 1996, were the the only party capable of opening up Australia to the process of globalisation.",24
37,Mr Hockey,QUESTIONS WITHOUT NOTICE,"Mr Speaker, on a point of order, the question was about whether, when he said that the Treasurer should take a good, hard look at himself, he was referring to the bungling of the mining tax or the other issue.",24
38,The SPEAKER,QUESTIONS WITHOUT NOTICE,"The second part of the honourable member's question was ruled out of order. The minister will assist the House if he is as precise in his answer as he can manage. I call the honourable minister. Mr MARTIN FERGUSON: When it goes to a question of having a good, hard look at yourself, it is time the coalition had a good, hard look at its scare campaign in terms of the transition that is going on in the Australian economy at the moment. I am talking about its endeavours to use workers and their families",24
39,The SPEAKER,QUESTIONS WITHOUT NOTICE,"The minister will be directly relevant. Mr MARTIN FERGUSON: with respect to the transition that is occurring with Qantas, Alcoa and BHP. Mr Speaker, I thank you for the opportunity to address this matter. The government is hard at work in trying to assist the Australian economy to manage a major investment pipeline whilst looking after those sections of the economy that are challenged by the transition. I say to those opposite: front up to policy and real policy debates rather than having your heads in the sand. Economy Employment",24
40,Ms OWENS,QUESTIONS WITHOUT NOTICE, My question is to the Treasurer. Will the Treasurer update the House on recent global economic developments? Why do these developments make it critical for Australia to have the right policies to support jobs today and into the future?,25
41,Mr SWAN,QUESTIONS WITHOUT NOTICE," I thank the member for Parramatta for that very important question about the economy, something that those opposite are not interested in at all. Over the weekend my G20 colleagues met in Mexico, in what continues to be a difficult time.",25
42,Unknown,QUESTIONS WITHOUT NOTICE,Honourable members interjecting,25
43,The SPEAKER,QUESTIONS WITHOUT NOTICE,The Treasurer will pause while the House returns to silence so that we can listen to the Treasurer's answer. The Treasurer has the call.,25
44,Mr SWAN,QUESTIONS WITHOUT NOTICE,"It does continue to be a difficult time in the global economy but there have been recent policy decisions put in place in Europe, particularly by the ECB, that have eased pressures in markets. Nevertheless, my G20 colleagues have warned again that there are still challenges in the global economy. We do know that Europe does face a very painful period of adjustment and we also know that unemployment is far too high around the developed world and across the developing world. But, in the face of this, there was a very strong commitment from G20 finance ministers to make jobs, employment and economic growth the No. 1 priority in terms of structural reforms in both developed and developing countries. From our perspective on this side of the House, whether internationally or here, domestically, jobs are our No. 1 priority, and they have been from day one. Two-hundred thousand jobs would have been lost in this country during the global financial crisis if those on that side of the House had had their way. We on this side of the House understand that the dignity of labour is the lifeblood of every one of the communities that we represent, and we understand that prolonged high unemployment and small business closures are the most devastating things that can happen to any community, whether here or in other developed economies around the world. The values that drive us are to make sure that we support employment to the extent we can, to make our economy grow so that we can supply the jobs of the future. The one thing that everyone on this side of the House is proudest of is that today there are more Australians employed than at any other time in our history, with an unemployment rate of 5.1 per cent. We are proud of that. Despite the global challenges, our economy walks tall in the world, and the rock on which our economic policy is built is strong fiscal policy. Bringing our budget back to surplus in 2012-13 is absolutely critical. Compare and contrast that with the farce we have seen from those on the other side of the House: a $70 billion crater in their budget bottom line. On Q&A last night we discovered there is a fourth stooge: Senator Joyce, who could not explain to the people of Australia how they were going to bring the budget back to surplus. Ms Julie Bishop: Mr Speaker, on a point of order, I believe this is the eighth time that the Treasurer has used that word in reference to members of the coalition, in defiance of your ruling. On that basis, I ask that he withdraw.",25
45,The SPEAKER,QUESTIONS WITHOUT NOTICE,The Treasurer will withdraw that reference to Senator Joyce.,26
46,Mr SWAN,QUESTIONS WITHOUT NOTICE,"Yes, I withdraw that reference to Senator Joyce, Mr Speaker.",26
47,The SPEAKER,QUESTIONS WITHOUT NOTICE,"And then he will resume his seat. Next question. Housing, Homelessness and Emergency Management",26
48,Mr KEENAN,QUESTIONS WITHOUT NOTICE," My question is to the Minister for Housing, Minister for Homelessness and Minister for Emergency Management. Will the minister outline his future plans for his portfolio over the next 18 months?",26
49,Mr MCCLELLAND,QUESTIONS WITHOUT NOTICE,"Barton-Minister for Housing, Minister for Homelessness and Minister for Emergency Management) (14:20): Thank you very much for this opportunity to outline my portfolio responsibilities over the next 18 months. In the important area of emergency management, my focus will be on ensuring a greater focus on mitigation measures, preventative measures, to prevent people from being the subject of natural disasters in the first place. I am publicly on the record as saying, quite frankly, I think there is a lot of attention paid-and appropriately so-to providing assistance to people and communities once they have been the victim of natural disasters. But I think we as a parliament and indeed as dedicated local members-and I have seen many dedicated local members-need to really put a focus on preventative measures. In terms of my housing and homelessness responsibilities, we will be progressing the National Partnership Agreement on Social Housing. We will be pursuing the Social Housing Initiative, which involves $5.8 billion. By the middle of this year we will have all but constructed some 20,000 properties and will have repaired about 80,000 properties. In addition, under the National Affordable Housing Agreement we will be putting $6.2 billion into assistance for those who are homeless, including Indigenous Australians. Under the National Rental Affordability Scheme we have allocated $4.3 billion to reduce the rental payable not only by those who are vulnerable to homelessness but also by essential workers such as firemen, police officers, teachers and nurses. That assistance of $4.3 billion has been provided on the basis that proprietors of properties will reduce their rental accommodation to 80 per cent of market value. Work is being rolled out under the Housing Affordability Fund to assist state and local governments to implement infrastructure improvements in areas and get resources into those areas to reduce the cost of development so that those properties can be sold on the market at a cheaper value. Indeed, one example in Melbourne recently saw a $10,000 reduction in market property values. I will shortly be announcing that some 73 areas will benefit under the Building Better Regional Cities Program. (Time expired) NA The SPEAKER (14:23): I inform the House that we have present in the gallery this afternoon members of the Australian Political Exchange Council Sixth Delegation from the Philippines. On behalf of all honourable members. I extend a very warm welcome to the members of that delegation. Honourable members: Hear, hear! NA Murray-Darling Basin",26
50,Mr WINDSOR,QUESTIONS WITHOUT NOTICE," My question is to the Minister for Sustainability, Environment, Water, Population and Communities and relates to water buyback policy. Given recent questions raised about the government's initiative to seek expressions of interest water in the southern connected system of the Murray-Darling Basin, as it applies to irrigation districts and strategic water purchases, can the minister comment on those concerns and, given those concerns, will the minister also consider attending a meeting of the Standing Committee on Regional Australia in company with the Murray-Darling Basin Authority Chair, Craig Knowles, to discuss progress on the Murray-Darling Basin Plan?",26
51,Mr BURKE,QUESTIONS WITHOUT NOTICE,"Watson-Minister for Sustainability, Environment, Population and Communities) (14:25): I thank the member for New England both for the question and for the work he led when the Windsor inquiry looked into Murray-Darling Basin reform. A recommendation, supported at the media conferences that followed, held by members of parliament on each side of this House, was for the government to put a pause on all strategic buybacks. At that time we gave a guarantee that in the north of the system we would only be buying from river pumpers and in the south of the system the general tenders which had been taking place would not recommence until 2013. Those commitments stand. There have been claims, in this parliament and outside the parliament, from three members of the inquiry that the recent expressions of interest that have been launched are in some way a breach of that commitment. I make it clear to everyone, including members of the Windsor inquiry, that the expressions of interest have been launched so that strategic buyback can take place. Rather than doing a basin-wide tender, rather than going through the other system, which members opposite had always opposed, where value for money was the only indicator, we now actually have a situation where we look to expressions of for interest to see whether or not for the local community the purchase is strategic-and that is exactly what the inquiry unanimously called for. I am very happy to meet with members of the committee to talk about this; I am very happy to ask the Chair of the Murray-Darling Basin Authority to meet with members of the committee as well. This comes down to one really simple dividing line. When we got that unanimous report I actually thought that we had from the coalition members of the committee a willingness to engage in reform and that they Water, would hold themselves to the words of that inquiry-their issue was whether or not the buybacks were strategic. What we have discovered today is that, regardless of the unanimity of the report, there are members key opposite whose argument is not just whether it is strategic; they are just opposed to reform of the Murray-Darling Basin. The arguments that they have thrown up in the last few days non- are a slap in the face to every South Australian member opposite who thought they had a consensus position from the coalition; who thought they were actually on a constructive path forward.",27
52,The SPEAKER,QUESTIONS WITHOUT NOTICE,The minister will return to the substance of the question.,27
53,Mr BURKE,QUESTIONS WITHOUT NOTICE,"That is why, Mr Speaker, what has been announced is exactly what the Windsor inquiry called for, is exactly in line with the commitment we made and is exactly what until this week had been a unanimous position from the coalition. NA The SPEAKER (14:27): I inform honourable members that we have seated on the floor of the chamber the Hon. Barry Cohen, former Minister for the Arts, Heritage and the Environment. He seems to be seated on the floor of the chamber as often as some honourable members! We welcome Barry to the chamber. Honourable members: Hear, hear! NA Education",27
54,Mr MURPHY,QUESTIONS WITHOUT NOTICE," question is to the Minister for School Education, Early Childhood and Youth. Minister, will you update the House on the government's education reform agenda, and how will the government keep delivering better and more educational opportunities for our children and young people?",28
