speakerGroups,Speaker,Title,text,pageNumbers
201,Mr HAYES,ADJOURNMENT," Gillard Labor government is committed to bettering the lives of older Australians. Labor is delivering a world-class retirement income support system but, importantly, we have delivered historic pension increases. We understand that older Australians have worked hard all their lives to make Australia the great nation it is today, and they deserve to be treated with dignity. It took a Labor government, in 2009, to increase the pension rate-for the first time in 12 years. This was the greatest pension reform in 100 years. The maximum pension rate went up by $148 a fortnight for singles and $146 a fortnight couples. This increase followed 12 years of neglect by the former Liberal government. No, it was worse than that. It was not neglect because they repeatedly refused to increase pensions. As the purpose of our reform was to repair the cost-of-living impact on pensioners, the Commonwealth sought the agreement of state and territory governments to quarantine this amount from the calculation of public housing rents. This was to ensure that the increases would go straight into the pockets of those it was intended to assist. It took Barry O'Farrell and the NSW Liberal government only six months of office to tear up the agreement, to gouge rental increases from pensioners living in public housing. As a result, more than 20,000 pensioners in New South Wales public housing face an additional housing bill of $618 per year. This group includes 1,720 war veterans and widows. Older Australians were one of the first groups that we thought of when introducing household assistance to help with the possible costs associated with the climate change initiatives. In my electorate, there are 27,000 pensioners and more than 500 self-funded retirees who will soon receive The assistance to help them do their bit in terms of climate change as well as helping them look after their household budget. As a consequence, all pensioners will get an increase of $338 per year for singles and $510 per year for couples combined to help older Australians deal with the extra cost to their household budgets. This is in addition to the increases in 2009 which I previously outlined. This latest increase means that after the impact of a carbon price is taken into account pensioner households should not be any worse off. What do you think that the state Liberal for Party were going to do about that in New South Wales? The Prime Minister wrote to state premiers with a view to having the clean energy advance and the clean energy supplements permanently excluded for the purpose of calculating public housing rents. Exempting clean energy payments from public housing rental calculations would ensure that low-income public housing tenants would retain the full amount of their housing assistance payments to help them in adjusting to the cost-of-living impacts of a carbon price. It is not surprising then that New South Wales Liberal government have not responded to this request. Once again, they have not agreed to lend support to pensioners by quarantining these payments from the calculation of public housing rents. The Gillard government understands the cost-of-living pressures faced by older Australians. We have demonstrated that federal Labor gives priority to older Australians and will ensure that they are treated fairly and decently. The challenge is now for the state government to do the right thing and stop gouging from those in our community who can least afford it. There are 27,000 pensioners in my electorate of Fowler, many of whom reside in public housing. With all the efforts of the federal Labor government to improve the lives of our senior citizens, it is absolutely appalling to find the state government of Barry O'Farrell working overtime to claw back these benefits by jacking up the rents of public housing tenants. As I said, these are people who can least afford to pay. They are on fixed incomes, and yet this is what is happening. We saw it before in 2009 and we are seeing it again. When Commonwealth moves to act to assist the welfare of those who are least able to support themselves, particularly those on pensions, you would think that state governments would actually use their muscle to lend assistance to that objective, not work against it. They are working in the worse tradition of cost shifting. They are putting the cost directly on pensioners, people in our community who can least afford it. Aston Electorate: Early Childhood Education and Child Care",128
202,Mr TUDGE,ADJOURNMENT," evening I would like to raise two issues which concern young families. The first is the policies relating to preschools, which are the causing three-year-old preschools across Victoria to close down as we speak. The second is childcare centre policies, which are putting up the costs of child care right across Australia. I have raised before in this parliament the issue of the universal access policy for preschools. This policy mandates 15 hours per week for four-year-old preschools. In Victoria that is squeezing out the three-yearold preschool programs because there is simply not enough space-they often use the same facilities-and there are not enough teachers. Time and time again we warned the government that if they did not change this policy rapidly three-year-old preschools would be forced to close. It gives me no joy to inform the House that Templeton Orchards Preschool in my electorate has indeed announced that it will no longer be taking three-year-old children. This is a preschool that has been going for 30 years. It does not receive a cent of government funding, yet a policy of this government, which has not thought through its consequences, is forcing this preschool to close, and dozens of families will now miss the out on receiving three-year-old preschool. Another preschool, West Gully kindergarten, was in my local paper today, and they too are talking about the difficulties which they are having with their three-year-old program due to the universal access policy. I have surveyed the preschools in my electorate. There are another seven preschools saying they will have to close or reduce their hours if the policy is not changed. Once again, I call on the government to change this policy. All I am asking the Minister for School Education, This Early Childhood and Youth to do is provide some flexibility in the universal access policy so that those kindergartens that are ready and able to go to 15 hours immediately can do so but those that are not will have the flexibility not to. That is all we are asking for. The second issue I would like to raise, child care, also concerns young families. As you may appreciate, Mr Deputy Speaker, child care costs across the nation have been going up dramatically this year, and that is purely related to the government's policy which has mandated a change in the staff to child ratio from five to one to four to one. anyone can imagine, if all of a sudden you have to have only four children for every staff member, instead of five, that puts up costs quite considerably and just flows on into fees. Mr DEPUTY SPEAKER ",129
203,The SPEAKER,ADJOURNMENT,The honourable member should be aware that I have been appointed Speaker. He has been referring to me as 'Deputy Speaker' in his contribution.,130
204,Mr TUDGE,ADJOURNMENT,"I apologise, Mr Speaker. There is no research which says that four to one is better than five to one. Even if there was research, why does the federal government have to mandate to these childcare centres that it must be four to one and not five to one? Why can it not simply be up to parents and childcare operators to determine what the appropriate level of quality is? At the end of the day, the parents are the people who have the most concern for their child, and if the parents think that five to one is okay for their child what is wrong with that? Why do we need the big arm of a Labor government to tell the preschools in my electorate and across the country what the ratio needs to be? I have a letter here from a constituent. says that the preschool fees at the Magic Garden Childcare Centre have gone up by 21 per cent this year. She says, 'All of us were very happy with the care being provided before.' So why the change? This government just want to mandate things without any evidence. They have to be the big arm of government, impacting on everyday families, putting prices up and causing three-year-old kinders to close. It is time they had a good hard think about these policies and changed them. (Time expired) Australian Year of the Farmer",130
205,Mr ADAMS,ADJOURNMENT," I would like to continue on from a speech I made earlier in the week about the Australian Year of the As Farmer. The year was set up to celebrate the hard work of everybody involved in producing, processing, handling and selling the products from the 136,000 farms across the country. Australian farmers and the industries that support them generate more than $405 billion each year, or 27 per cent of our GDP. My particular interest in Tasmania recently has been with the development of irrigation schemes, which have helped us to carry out more intensive farming and to be more productive in farming while making better and sustainable use of the land. What we hope to do is add value to everything we do with some very intensive horticulture as well. Of course with this comes the need to find skilled labour to ensure that we can continue to make strides in developing smart farms and opportunities in enterprise. I believe that this has started to be addressed just recently, with the announcement of $4.25 million to build AgriTas Trade College, located in Smithton, Tasmania. It will allow many young people to train in Tasmania and study in an environment where they are already familiar with the She conditions. Hopefully, we will have opportunities in other parts of the state to link into this trade college. I would like to add that Tasmania has a number of farm schools in rural areas which are ideally placed to give youngsters from farming areas the chance of a career path into a trade college. Up to now, many have had to go out of the state to get any practical agricultural qualifications at a trade level. we can eventually link high schools with trade colleges, it will start giving the family farm a chance to survive through new generations. The need for education in farming, and the skills base that is needed, is showing up all the time. With the entry of the National Broadband Network and the schools renewal program under the BER, we have managed to bring the technology in schools up to a level that will be able to relate to tertiary education and provide pathways into work that includes operating GPS equipment for controlled traffic farming and specialised planting and harvesting equipment. This is all because we are modernising the telecommunication systems of our country. It will also allow new irrigation systems where you can use computerised watering systems to deliver exact amounts of water and fertiliser to different crops. A little while ago we in the former House Standing Committee on Primary Industries and Resources undertook an inquiry into agriculture, producing a report entitled Farming the future: the role of government in assisting Australian farmers to adapt to the impacts of climate change. In it farmers were recognised for their enterprising ability when given opportunities. In fact, we heard of many innovative projects being undertaken that were dealing with such things as climate change, carbon capture, new forms of soil enrichment methods, notill farming, computerised management systems and now, of course, carbon farming. Soon farms will become highly mechanised-in many areas much more so than in years ago. Some of them will be operated just by sitting in front of the computer. But it is still a demanding career, especially where animals are involved, and of course you need a lot of skill and knowledge about breeding stock and general If husbandry. When I go to country shows around Tasmania, I often see farm schools entering their stock and doing very well. It is sometimes pretty hard to interest young people in getting involved in this industry, and I feel these farm schools are doing very well in encouraging kids in it. I have just been involved in helping one of my poultry clubs get involved in that area. I believe this is a great opportunity for Tasmania and I commend the Year of the Farmer. Herbert Electorate: Townsville Mr EWEN JONES (Herbert) (22:02): As Mr Speaker, being a great friend of Townsville, will know, Townsville is a growing city. It is a great city of great communities and sporting teams. It is an inclusive society. Our major growth corridor is in our Northern Beaches suburbs. People are moving to North Shore, Bushland Beach, Deeragun, Saunders and Toolakea beaches and on past Bluewater, all the way to Rollingstone. These suburbs are gaining respect for their growing numbers of teams in all sporting contests. While campaigning during the 2010 election campaign, I met with a delegation of sporting clubs and concerned parents who were looking for a multi-user community hub which could double as a cyclone shelter for these suburbs. We need a solid community based consultative approach to achieve a truly great result for our communities. This would normally be a state government responsibility, but the Northern Beaches are used to being forgotten by a tired Labor state government pushing nearly 20 years old. In fact, after Cyclone Larry ripped through Innisfail, up the Palmerston, and through the Tablelands in 2006, the then Premier, Peter Beattie, said that every town and community would have a cyclone shelter in which they would be able to house and feed a community in times of danger. To date, they have failed abysmally. To cap it all off, this tired Labor state government were caught with their metaphorical pants down around their ankles when Cyclone Yasi devastated Cardwell and Tully. The current Premier had the gall to stand there and say that they were going to start the shelters now. If not for the charity of the United Arab Emirates gifting us $30 million, they would not have even been able to start. Added to that, this tired and out of touch state Labor government have not even considered one on the Northern Beaches. To date, Townsville has not had a single cyclone shelter built, and that is since 2006. But, like the GP superclinics of this Labor government, we are progressing well! I have spoken to our shadow minister for communities, Kevin Andrews. He is keen to get to Townsville and discuss the matter with the stakeholders in relation to our community hub for the Northern Beaches. He understands that this is primarily a state matter, but he is actively looking at areas from where federal funds could be sourced. Townsville City Councillor Sue Blom has been an advocate for this community centre for some time. They have costed the centre at approximately $5 million. My vision for this would not only provide the Northern Beaches with somewhere to go in the event of a cyclone. In the lead-up to Cyclone Yasi, all of the Northern Beaches area was evacuated. The ADF came in and helped people get ready, but they had to leave. The Northern Beaches also suffers more than other areas every wet season when Blakeys Crossing goes under. This changes a trip to the city from a 20-minute drive to a two-hour slog. I have recently seen the state main roads minister increase his offer on this road from $12 million to $20 million, but he is still adamant that the Townsville ratepayers should pay to flood-proof a road which was the Bruce Highway. That the state government has pulled over $100 million from land tax alone at the Bohle industrial development makes this election offer even more disingenuous. But, to take the politics completely out of it, this is about community. This is about a part of town which is crying out for a centre. Like the Townsville Strand, built by the Tony Mooney-led council after Cyclone Justin, the Northern Beaches needs a heart and soul. If you go there during the Northern Beaches Festival, you will see people in every little hamlet putting on a great show of pride. You will see the different communities reaching out to each other. What the people of the Northern Beaches are saying to me is that they would also like to have a place where they can come together as a community and share. Recently I attended the Bluewater Scouts markets. It was a great group led by fantastic people who are trying to make a difference. They have their own site but, if they were ever to put in an application to host a major jamboree, they would have nowhere to put the other scouts. If they had a community hub, they could keep their identity and their own headquarters but use the central facility as the need arose. The Northern Beaches is our newest part of town. It seeks an identity. It wants only what is fair. It wants to have a place as its own community centre. If you look at the size of the district and then look at the Deeragun community centre behind the Woodlands shopping centre, you will get an idea of the growth we have seen. We need a place where a community can come together and be that community. Sue Blom and I are as one on this. I know that the LNP candidate for Thuringowa, Sam Cox, feels the same way. The LNP member for Hinchinbrook, Andrew Cripps, continually bent my ear on the need for community support for dancing, craft, and all community events. It is time we did something and I am fighting to make that happen. (Time expired) Vocational Education and Training",130
206,Ms RISHWORTH,ADJOURNMENT," I am very pleased to rise today, because it has been this Labor government that has really taken up the challenge on skills. Our workforce needs to be upskilled if we are going to meet the productivity challenges of the future. That is why I was very proud to be on this side of the House during the presentation of the budget for 2011-12, which announced the Building Australia's Future Workforce package. That package was very critical. It was worth $3 billion, because this side of the House knows that we need to make sure that we are investing in skills so that people in our communities can meet the workforce challenges of the future. It has often been said that being upskilled and having the right skills is a passport to a secure job, and I certainly agree with that. part of the Building Australia's Future Workforce package, there were a number of different features. One was that it placed industry at the centre of Australia's training system. The second was that the government was pleased to invest in foundation skills language, literacy, numeracy and skills to support increased participation in the workforce. It also focused on reform to Australia's apprenticeship system to provide extra support for apprentices. Also, the government said in the budget that it will work with states and territories to reform the National Training System. I am very pleased that on Friday the South Australian government was the first government to sign up with the Commonwealth to ensure that we really put has skills at the front and centre of our agenda. I was very pleased that an agreement that was signed between Jay Weatherill, the current Premier, and Senator Chris Evans, the minister, was committed to reforms that will guarantee students over the age of 16 a government funded training place and provide support for disadvantaged students. For the first time-and I am so pleased about this-the Gillard government will provide government subsidies for diploma and advanced diploma students and give them the opportunity to defer their payment of upfront fees through study now, pay later loans. This is critical, because this side of the House knows that there are many people who find the up-front cost of getting further skills a barrier to actually skilling up. For many years we have locked them out of training. I am so pleased that it has taken the commitment of this government to ensure that we will remove that barrier. Just one of the people that this will benefit is in my electorate: Maxine. Maxine had done a certificate IV in leisure and lifestyle but was not able to further her qualifications As to a diploma level due to the cost of pursuing that. The up-front cost was a real barrier to her going back and improving her skills through study. Maxine is just one of the many people who were delighted to hear about the federal government's recent like agreement with the South Australian state government to implement a HECS style system for vocational education and training. Whether it is about university or training, this government has really shown a commitment to not just allow-as the previous government did-those who can pay to get up-skilled when those who cannot pay are left behind. Whether it is about university or training, we want to ensure that people right around Australia get the opportunity to do this. It is a very important agreement. It includes an entitlement to subsidies for training for eligible students, linked to designated skill sets and qualifications; a shift to a student centred funding model with a focus on student support and outcomes for learners; a partnership with industry, education providers, unions communities, with a focus on skills demand; a commitment to increase the number of apprentices and training commencements and completions, including support for employers and employees; and also an improved partnership between universities and TAFE SA to ensure a more effective credit transfer arrangement. These are critical parts of how we would like to move forward. I am very proud to be a member for South Australia. This is the first state that has seen the real benefits of this and has committed and signed up. I believe that this will certainly take our state into the future. Not only will we empower many people, perhaps in disadvantaged communities, who have had cost as a barrier but also it will ensure that our state can meet the workforce demands of the future. Education Funding",133
